A2: 2008 SBDGL Standings Through Week 18
A3: Rank | B3: Player | C3: Total Strokes | D3: Weeks | E3: Average | F3: H-Cap | G3: Last | H3: Week Pt. | I3: Total Pts.
A4: 1 | B4: Tim Peyton | C4: 908 | D4: 18 | E4: 50.444 | F4: 0 | G4: 50 | H4: 1/2 | I4: 9
A5: =A4+1 -> 2 | B5: Doug Peyton | C5: 916 | D5: 18 | E5: 50.889 | F5: 0 | G5: 51 | H5: 0 | I5: 9 1/2
A6: =A5+1 -> 3 | B6: Aaron Lindsley | C6: 729 | D6: 14 | E6: 52.071 | F6: 1 | G6: 44 | H6: 1 | I6: 8
A7: =A6+1 -> 4 | B7: Bryan Bream | C7: 938 | D7: 18 | E7: 52.111 | F7: 1 | G7: 48 | H7: 1 | I7: 10
A8: =A7+1 -> 5 | B8: Woody | C8: 938 | D8: 18 | E8: =(C8/D8) -> 52.111111111111114 | F8: =ROUNDDOWN(((E8-50)*0.8),0) -> 1 | G8: 48 | H8: 1 | I8: 12
A9: 6 | B9: Jeremy Farnsworth | C9: 630 | D9: 12 | E9: 52.500 | F9: 2 | G9: 48 | H9: 1 | I9: 5
A10: =A9+1 -> 7 | B10: Joel Knutson | C10: 948 | D10: 18 | E10: =(C10/D10) -> 52.666666666666664 | F10: =ROUNDDOWN(((E10-50)*0.8),0) -> 2 | G10: 48 | H10: 1 | I10: 13
A11: =A10+1 -> 8 | B11: Matt Wieben | C11: 952 | D11: 18 | E11: =(C11/D11) -> 52.888888888888886 | F11: =ROUNDDOWN(((E11-50)*0.8),0) -> 2 | G11: 50 | H11: 1 | I11: 8.5
A12: =A11+1 -> 9 | B12: Frog | C12: 906 | D12: 17 | E12: =(C12/D12) -> 53.294117647058826 | F12: =ROUNDDOWN(((E12-50)*0.8),0) -> 2 | G12: 49 | H12: 1 | I12: 9.5
A13: =A12+1 -> 10 | B13: Jason Rimrodt | C13: 801 | D13: 15 | E13: =(C13/D13) -> 53.400 | F13: =ROUNDDOWN(((E13-50)*0.8),0) -> 2 | G13: 45 | H13: 1 | I13: 13
A14: =A13+1 -> 11 | B14: Keith Gudenkauf | C14: 963 | D14: 18 | E14: =(C14/D14) -> 53.500 | F14: =ROUNDDOWN(((E14-50)*0.8),0) -> 2 | G14: 52 | H14: 0.5 | I14: 10.5
A15: =A14+1 -> 12 | B15: Andrew Greco | C15: 963 | D15: 18 | E15: =(C15/D15) -> 53.500 | F15: =ROUNDDOWN(((E15-50)*0.8),0) -> 2 | G15: 52 | H15: 0.5 | I15: 9
A16: =A15+1 -> 13 | B16: Adam Stiers | C16: 803 | D16: 15 | E16: =(C16/D16) -> 53.533333333333331 | F16: =ROUNDDOWN(((E16-50)*0.8),0) -> 2 | G16: 52 | H16: 0.5 | I16: 12
A17: =A16+1 -> 14 | B17: Travis Pike | C17: 974 | D17: 18 | E17: =(C17/D17) -> 54.111111111111114 | F17: =ROUNDDOWN(((E17-50)*0.8),0) -> 3 | G17: 50 | H17: 1 | I17: 12
A18: =A17+1 -> 15 | B18: Beachy | C18: 975 | D18: 18 | E18: =(C18/D18) -> 54.166666666666664 | F18: =ROUNDDOWN(((E18-50)*0.8),0) -> 3 | G18: 52 | H18: 0 | I18: 13
A19: =A18+1 -> 16 | B19: Jesse Saurbrai | C19: 976 | D19: 18 | E19: =(C19/D19) -> 54.222222222222221 | F19: =ROUNDDOWN(((E19-50)*0.8),0) -> 3 | G19: 51 | H19: 0 | I19: 7.5
A20: =A19+1 -> 17 | B20: Rory Lasansky | C20: 977 | D20: 18 | E20: =(C20/D20) -> 54.277777777777779 | F20: =ROUNDDOWN(((E20-50)*0.8),0) -> 3 | G20: 53 | H20: 1 | I20: 11
A21: =A20+1 -> 18 | B21: Kollin Grimm | C21: 982 | D21: 18 | E21: =(C21/D21) -> 54.555555555555557 | F21: =ROUNDDOWN(((E21-50)*0.8),0) -> 3 | G21: 51 | H21: 0 | I21: 10.5
A22: =A21+1 -> 19 | B22: Maker | C22: 984 | D22: 18 | E22: =(C22/D22) -> 54.666666666666664 | F22: =ROUNDDOWN(((E22-50)*0.8),0) -> 3 | G22: 50 | H22: 0 | I22: 10.5
A23: =A22+1 -> 20 | B23: Jesse Strienz | C23: 930 | D23: 17 | E23: =(C23/D23) -> 54.705882352941174 | F23: =ROUNDDOWN(((E23-50)*0.8),0) -> 3 | G23: 51 | H23: 1 | I23: 7
A24: =A23+1 -> 21 | B24: Nick Shultz | C24: 880 | D24: 16 | E24: =(C24/D24) -> 55.000 | F24: =ROUNDDOWN(((E24-50)*0.8),0) -> 4 | G24: 50 | H24: 0 | I24: 9
A25: =A24+1 -> 22 | B25: Super Dave | C25: 997 | D25: 18 | E25: =(C25/D25) -> 55.388888888888886 | F25: =ROUNDDOWN(((E25-50)*0.8),0) -> 4 | G25: 60 | H25: 0 | I25: 9
A26: =A25+1 -> 23 | B26: Shirtless Bill | C26: 999 | D26: 18 | E26: =(C26/D26) -> 55.500 | F26: =ROUNDDOWN(((E26-50)*0.8),0) -> 4 | G26: 51 | H26: 1 | I26: 8
A27: =A26+1 -> 24 | B27: Scott Lindsley | C27: 724 | D27: 13 | E27: =(C27/D27) -> 55.692307692307693 | F27: =ROUNDDOWN(((E27-50)*0.8),0) -> 4 | G27: 0 | H27: 0 | I27: 7
A28: =A27+1 -> 25 | B28: Joe Grady | C28: 503 | D28: 9 | E28: =(C28/D28) -> 55.888888888888886 | F28: =ROUNDDOWN(((E28-50)*0.8),0) -> 4 | G28: 52 | H28: 0 | I28: 4
A29: =A28+1 -> 26 | B29: Jon Russel | C29: 952 | D29: 17 | E29: =(C29/D29) -> 56.000 | F29: =ROUNDDOWN(((E29-50)*0.8),0) -> 4 | G29: 52 | H29: 0 | I29: 8.5
A30: =A29+1 -> 27 | B30: Dustin Utley | C30: 1012 | D30: 18 | E30: =(C30/D30) -> 56.222222222222221 | F30: =ROUNDDOWN(((E30-50)*0.8),0) -> 4 | G30: 53 | H30: 0 | I30: 9
A31: =A30+1 -> 28 | B31: Nathan Veeder | C31: 450 | D31: 8 | E31: =(C31/D31) -> 56.250 | F31: =ROUNDDOWN(((E31-50)*0.8),0) -> 5 | G31: 58 | H31: 0 | I31: 3
A32: =A31+1 -> 29 | B32: Ryan Hamilton | C32: 1024 | D32: 18 | E32: =(C32/D32) -> 56.888888888888886 | F32: =ROUNDDOWN(((E32-50)*0.8),0) -> 5 | G32: 55 | H32: 0 | I32: 9
A33: =A32+1 -> 30 | B33: Joe Cool | C33: 684 | D33: 12 | E33: =(C33/D33) -> 57.000 | F33: =ROUNDDOWN(((E33-50)*0.8),0) -> 5 | G33: 0 | H33: 0 | I33: 6.5
A34: =A33+1 -> 31 | B34: Brad Rew | C34: 914 | D34: 16 | E34: =(C34/D34) -> 57.125 | F34: =ROUNDDOWN(((E34-50)*0.8),0) -> 5 | G34: 52 | H34: 1 | I34: 6.5
A35: =A34+1 -> 32 | B35: Mike Flynn | C35: 973 | D35: 17 | E35: =(C35/D35) -> 57.235294117647058 | F35: =ROUNDDOWN(((E35-50)*0.8),0) -> 5 | G35: 50 | H35: 1 | I35: 8.5
A36: =A35+1 -> 33 | B36: Average Joe | C36: 922 | D36: 16 | E36: =(C36/D36) -> 57.625 | F36: =ROUNDDOWN(((E36-50)*0.8),0) -> 6 | G36: 50 | H36: 1 | I36: 8.5
A37: =A36+1 -> 34 | B37: Dan Klein | C37: 520 | D37: 9 | E37: =(C37/D37) -> 57.777777777777779 | F37: =ROUNDDOWN(((E37-50)*0.8),0) -> 6 | G37: 0 | H37: 0 | I37: 4
A38: =A37+1 -> 35 | B38: D. Burns | C38: 1041 | D38: 18 | E38: =(C38/D38) -> 57.833333333333336 | F38: =ROUNDDOWN(((E38-50)*0.8),0) -> 6 | G38: 54 | H38: 0 | I38: 12
A39: =A38+1 -> 36 | B39: Mark Dvorsky | C39: 930 | D39: 16 | E39: =(C39/D39) -> 58.125 | F39: =ROUNDDOWN(((E39-50)*0.8),0) -> 6 | G39: 51 | H39: 1 | I39: 9.5
A40: =A39+1 -> 37 | B40: Jamie Gray | C40: 989 | D40: 17 | E40: =(C40/D40) -> 58.176470588235297 | F40: =ROUNDDOWN(((E40-50)*0.8),0) -> 6 | G40: 53 | H40: 1 | I40: 13
A41: =A40+1 -> 38 | B41: Super Kate | C41: 1057 | D41: 18 | E41: =(C41/D41) -> 58.722222222222221 | F41: =ROUNDDOWN(((E41-50)*0.8),0) -> 6 | G41: 51 | H41: 1 | I41: 8
A42: =A41+1 -> 39 | B42: Matt Shannon | C42: 1065 | D42: 18 | E42: =(C42/D42) -> 59.166666666666664 | F42: =ROUNDDOWN(((E42-50)*0.8),0) -> 7 | G42: 59 | H42: 1 | I42: 11.5
A43: =A42+1 -> 40 | B43: Tom Pepper | C43: 1067 | D43: 18 | E43: =(C43/D43) -> 59.277777777777779 | F43: =ROUNDDOWN(((E43-50)*0.8),0) -> 7 | G43: 55 | H43: 0 | I43: 12
A44: =A43+1 -> 41 | B44: Justin Zehr | C44: 537 | D44: 9 | E44: =(C44/D44) -> 59.666666666666664 | F44: =ROUNDDOWN(((E44-50)*0.8),0) -> 7 | G44: 56 | H44: 1 | I44: 4.5
A45: =A44+1 -> 42 | B45: Matt Lacina | C45: 1075 | D45: 18 | E45: =(C45/D45) -> 59.722222222222221 | F45: =ROUNDDOWN(((E45-50)*0.8),0) -> 7 | G45: 59 | H45: 0 | I45: 4
A46: =A45+1 -> 43 | B46: Farley | C46: 1020 | D46: 17 | E46: =(C46/D46) -> 60.000 | F46: =ROUNDDOWN(((E46-50)*0.8),0) -> 8 | G46: 0 | H46: 0 | I46: 8
A47: =A46+1 -> 44 | B47: David Brown | C47: 960 | D47: 16 | E47: =(C47/D47) -> 60.000 | F47: =ROUNDDOWN(((E47-50)*0.8),0) -> 8 | G47: 0 | H47: 0 | I47: 8.5
A48: =A47+1 -> 45 | B48: Tim Troyna | C48: 904 | D48: 15 | E48: =(C48/D48) -> 60.266666666666666 | F48: =ROUNDDOWN(((E48-50)*0.8),0) -> 8 | G48: 0 | H48: 0 | I48: 5.5
A49: =A48+1 -> 46 | B49: Dustin Gaskill | C49: 845 | D49: 14 | E49: =(C49/D49) -> 60.357142857142854 | F49: =ROUNDDOWN(((E49-50)*0.8),0) -> 8 | G49: 56 | H49: 0 | I49: 9
A50: =A49+1 -> 47 | B50: Seth Marling | C50: 849 | D50: 14 | E50: =(C50/D50) -> 60.642857142857146 | F50: =ROUNDDOWN(((E50-50)*0.8),0) -> 8 | G50: 0 | H50: 0 | I50: 8
A51: =A50+1 -> 48 | B51: Marty Reis | C51: 1110 | D51: 18 | E51: =(C51/D51) -> 61.666666666666664 | F51: =ROUNDDOWN(((E51-50)*0.8),0) -> 9 | G51: 51 | H51: 1 | I51: 10.5
A52: =A51+1 -> 49 | B52: Troy Knapp | C52: 1121 | D52: 18 | E52: =(C52/D52) -> 62.277777777777779 | F52: =ROUNDDOWN(((E52-50)*0.8),0) -> 9 | G52: 56 | H52: 1 | I52: 11.5
A53: =A52+1 -> 50 | B53: Max Ostby | C53: 872 | D53: 14 | E53: =(C53/D53) -> 62.285714285714285 | F53: =ROUNDDOWN(((E53-50)*0.8),0) -> 9 | G53: 64 | H53: 0 | I53: 7
A54: =A53+1 -> 51 | B54: Valera Petrulevich | C54: 1001 | D54: 16 | E54: =(C54/D54) -> 62.5625 | F54: =ROUNDDOWN(((E54-50)*0.8),0) -> 10 | G54: 60 | H54: 0 | I54: 7
A55: =A54+1 -> 52 | B55: Andrew Staudt | C55: 814 | D55: 13 | E55: =(C55/D55) -> 62.615384615384613 | F55: =ROUNDDOWN(((E55-50)*0.8),0) -> 10 | G55: 0 | H55: 0 | I55: 7.5
A56: =A55+1 -> 53 | B56: Jeremy Prouty | C56: 970 | D56: 15 | E56: =(C56/D56) -> 64.666666666666671 | F56: =ROUNDDOWN(((E56-50)*0.8),0) -> 11 | G56: 0 | H56: 0 | I56: 7
A57: =A56+1 -> 54 | B57: Ben Young | C57: 1166 | D57: 18 | E57: =(C57/D57) -> 64.777777777777771 | F57: =ROUNDDOWN(((E57-50)*0.8),0) -> 11 | G57: 54 | H57: 1 | I57: 10
A58: =A57+1 -> 55 | B58: Brad Pike | C58: 852 | D58: 13 | E58: =(C58/D58) -> 65.538461538461533 | F58: =ROUNDDOWN(((E58-50)*0.8),0) -> 12 | G58: 0 | H58: 0 | I58: 6
A59: =A58+1 -> 56 | B59: Brandon Yoder | C59: 1014 | D59: 15 | E59: =(C59/D59) -> 67.600 | F59: =ROUNDDOWN(((E59-50)*0.8),0) -> 14 | G59: 64 | H59: 0 | I59: 6.5
A60: =A59+1 -> 57 | B60: Joe Evans | C60: 1120 | D60: 16 | E60: =(C60/D60) -> 70.000 | F60: =ROUNDDOWN(((E60-50)*0.8),0) -> 16 | G60: 62 | H60: 1 | I60: 4
A61: =A60+1 -> 58 | B61: Lyle Theisen | C61: 718 | D61: 10 | E61: =(C61/D61) -> 71.800 | F61: =ROUNDDOWN(((E61-50)*0.8),0) -> 17 | G61: 0 | H61: 0 | I61: 5
A62: =A61+1 -> 59 | B62: Steve Lepeltak | C62: 539 | D62: 7 | E62: =(C62/D62) -> 77.000 | F62: =ROUNDDOWN(((E62-50)*0.8),0) -> 21 | G62: 0 | H62: 0 | I62: 3.5

A2: Sub Player | B2: Total Strokes | C2: Weeks | D2: Average | E2: H-Cap | F2: Last | G2: Week Pt. | H2: Total Pts.
A5: Steve Calloway | B5: 167 | C5: 3 | D5: 55.667 | E5: 4 | F5: 54 | G5: 1 | H5: 1 1/2
A6: Matt Rinker | B6: 472 | C6: 9 | D6: =SUM(C66/D66) -> 52.444444444444443 | E6: =ROUNDDOWN(((E66-50)*0.8),0) -> 1 | F6: 0 | G6: 0 | H6: 4
A7: Matt Fritz | B7: 405 | C7: 7 | D7: =SUM(C67/D67) -> 57.857142857142854 | E7: =ROUNDDOWN(((E67-50)*0.8),0) -> 6 | F7: 0 | G7: 0 | H7: 5
A8: Brandon Sheer | B8: 122 | C8: 2 | D8: =SUM(C68/D68) -> 61.000 | E8: =ROUNDDOWN(((E68-50)*0.8),0) -> 8 | F8: 0 | G8: 0 | H8: 1
A9: Doug Knepp | B9: 131 | C9: 2 | D9: =SUM(C69/D69) -> 65.500 | E9: =ROUNDDOWN(((E69-50)*0.8),0) -> 12 | F9: 0 | G9: 0 | H9: 0
A10: Mike Baines | B10: 71 | C10: 1 | D10: =SUM(C70/D70) -> 71.000 | E10: =ROUNDDOWN(((E70-50)*0.8),0) -> 16 | F10: 0 | G10: 0 | H10: 0
A11: Shawn Hullinger | B11: 302 | C11: 5 | D11: =SUM(C71/D71) -> 60.400 | E11: =ROUNDDOWN(((E71-50)*0.8),0) -> 8 | F11: 60 | G11: 0 | H11: 3
A12: Skyler Landess | B12: 216 | C12: 3 | D12: =SUM(C72/D72) -> 72.000 | E12: =ROUNDDOWN(((E72-50)*0.8),0) -> 17 | F12: 0 | G12: 0 | H12: 0
A13: Kevin Stibal | B13: 112 | C13: 2 | D13: =SUM(C73/D73) -> 56.000 | E13: =ROUNDDOWN(((E73-50)*0.8),0) -> 4 | F13: 0 | G13: 0 | H13: 0.5
A14: Charlie Dobberstein | B14: 158 | C14: 3 | D14: =SUM(C74/D74) -> 52.666666666666664 | E14: =ROUNDDOWN(((E74-50)*0.8),0) -> 2 | F14: 0 | G14: 0 | H14: 1.5
A15: Josh Spang | B15: 55 | C15: 1 | D15: =SUM(C75/D75) -> 55.000 | E15: =ROUNDDOWN(((E75-50)*0.8),0) -> 4 | F15: 0 | G15: 0 | H15: 0
A16: Jason Baxter | B16: 560 | C16: 7 | D16: =SUM(C76/D76) -> 80.000 | E16: =ROUNDDOWN(((E76-50)*0.8),0) -> 24 | F16: 0 | G16: 0 | H16: 1.5
A17: Jenny Robertson | B17: 219 | C17: 3 | D17: =SUM(C77/D77) -> 73.000 | E17: =ROUNDDOWN(((E77-50)*0.8),0) -> 18 | F17: 69 | G17: 0 | H17: 0
A18: Cassie Shear | B18: 241 | C18: 4 | D18: =SUM(C78/D78) -> 60.250 | E18: =ROUNDDOWN(((E78-50)*0.8),0) -> 8 | F18: 0 | G18: 0 | H18: 0
A19: Adam Smith | B19: 59 | C19: 1 | D19: =SUM(C79/D79) -> 59.000 | E19: =ROUNDDOWN(((E79-50)*0.8),0) -> 7 | F19: 0 | G19: 0 | H19: 0
A20: John McClellan | B20: 129 | C20: 2 | D20: =SUM(C80/D80) -> 64.500 | E20: =ROUNDDOWN(((E80-50)*0.8),0) -> 11 | F20: 0 | G20: 0 | H20: 0
A21: John Petri | B21: 61 | C21: 1 | D21: =SUM(C81/D81) -> 61.000 | E21: =ROUNDDOWN(((E81-50)*0.8),0) -> 8 | F21: 61 | G21: 0 | H21: 0
A22: Jon Shear | B22: 216 | C22: 4 | D22: =SUM(C82/D82) -> 54.000 | E22: =ROUNDDOWN(((E82-50)*0.8),0) -> 3 | F22: 0 | G22: 0 | H22: 0.5
A23: Jeni Zeiser | B23: 395 | C23: 4 | D23: =(C83/D83) -> 98.750 | E23: =ROUNDDOWN(((E83-50)*0.8),0) -> 39 | F23: 0 | G23: 0 | H23: 0
A24: Jon Foley | B24: 70 | C24: 1 | D24: =(C84/D84) -> 70.000 | E24: =ROUNDDOWN(((E84-50)*0.8),0) -> 16 | F24: 70 | G24: 0 | H24: 0
A25: Adam Olson | B25: 53 | C25: 1 | D25: =(C85/D85) -> 53.000 | E25: =ROUNDDOWN(((E85-50)*0.8),0) -> 2 | F25: 0 | G25: 0 | H25: 0
A26: Joe Ostby | B26: 683 | C26: 12 | D26: =(C86/D86) -> 56.916666666666664 | E26: =ROUNDDOWN(((E86-50)*0.8),0) -> 5 | F26: 0 | G26: 0 | H26: 6
A27: Jason Stroud | B27: 219 | C27: 4 | D27: =SUM(C87/D87) -> 54.750 | E27: =ROUNDDOWN(((E87-50)*0.8),0) -> 3 | F27: 57 | G27: 0 | H27: 1

A1: 2008 SBDGL Team Standings
B2: Bush Division | D2: Total Points | F2: Team Average | H2: Team Points
A3: 10 | B3: Troy Knapp & Travis Pike | D3: 37 | F3: =SUM(C17+C52)/36 -> 58.194444444444443 | H3: 13.5
A4: 14 | B4: Adam Stiers & Andrew Staudt | D4: 34 | F4: =SUM(C16+C55)/28 -> 57.750 | H4: 11.5
A5: 26 | B5: Tom Pepper & Doug Peyton | D5: 33.5 | F5: =SUM(C5+C43)/36 -> 55.083333333333336 | H5: 12
A6: 12 | B6: Dustin Utley & Joel Knutson | D6: 32 | F6: =SUM(C10+C30)/36 -> 54.444444444444443 | H6: 10
A7: 24 | B7: Woody & Mike Flynn | D7: 30 | F7: =SUM(C8+C35)/35 -> 54.600 | H7: 9.5
A8: 6 | B8: Marty Reis & Ryan Hamilton | D8: 28 | F8: =SUM(C32+C51)/36 -> 59.277777777777779 | H8: 9.5
A9: 8 | B9: Jon Russel & Bryan Bream | D9: 27 | F9: =SUM(C7+C29)/35 -> 54.000 | H9: 8
A10: 18 | B10: Matt Wieben & Tim Peyton | D10: 26.5 | F10: =SUM(C4+C11)/36 -> 51.666666666666664 | H10: 9
A11: 20 | B11: David Brown & Tim Troyna | D11: 24.5 | F11: =SUM(C48+C47)/31 -> 60.12903225806452 | H11: 8.5
A12: 16 | B12: Super Dave & Super Kate | D12: 24.5 | F12: =SUM(C25+C41)/36 -> 57.055555555555557 | H12: 7.5
A13: 2 | B13: Seth Marling & Jesse Saurbrai | D13: 24 | F13: =SUM(C19+C50)/32 -> 57.03125 | H13: 8.5
A14: 28 | B14: Aaron Lindsley & Scott Lindsley | D14: 22.5 | F14: =SUM(C6+C27)/27 -> 53.814814814814817 | H14: 7.5
A15: 4 | B15: Brad Rew & Brad Pike | D15: 19 | F15: =SUM(C34+C58)/29 -> 60.896551724137929 | H15: 6
A16: 22 | B16: Lyle Theisen & Steve Lepeltak | D16: 13.5 | F16: =SUM(C61+C62)/17 -> 73.941176470588232 | H16: 4
B18: Whacker Division
A19: 19 | B19: Beachy & Jason Rimrodt | D19: 41 | F19: =SUM(C13+C18)/33 -> 53.81818181818182 | H19: 14
A20: 13 | B20: Jamie Gray & Maker | D20: 36.5 | F20: =SUM(C22+C40)/35 -> 56.371428571428574 | H20: 12.5
A21: 27 | B21: Matt Shannon & Keith Gudenkauf | D21: 34.5 | F21: =SUM(C14+C42)/36 -> 56.333333333333336 | H21: 12.5
A22: 3 | B22: Valera Petrulevich & Ben Young | D22: 33.5 | F22: =SUM(C54+C57)/34 -> 63.735294117647058 | H22: 12.5
A23: 25 | B23: Frog & Rory Lasansky | D23: 31.5 | F23: =SUM(C12+C20)/35 -> 53.800 | H23: 10
A24: 15 | B24: D. Burns & Jeremy Prouty | D24: 29.5 | F24: =SUM(C38+C56)/33 -> 60.939393939393938 | H24: 8.5
A25: 1 | B25: Jeremy Farnsworth & Shirtless Bill | D25: 27.5 | F25: =SUM(C9+C26)/30 -> 54.300 | H25: 9.5
A26: 29 | B26: Kollin Grimm & Dustin Gaskill | D26: 27.5 | F26: =SUM(C21+C49)/32 -> 57.09375 | H26: 8
A27: 11 | B27: Nick Shultz & Jesse Streinz | D27: 24.5 | F27: =SUM(C23+C24)/33 -> 54.848484848484851 | H27: 8.5
A28: 5 | B28: Andrew Greco & Max Ostby | D28: 24.5 | F28: =SUM(C15+C53)/32 -> 57.34375 | H28: 7.5
A29: 17 | B29: Justin Zehr & Brandon Yoder | D29: 22.5 | F29: =SUM(C44+C59)/24 -> 64.625 | H29: 9
A30: 9 | B30: Average Joe & Joe Grady | D30: 22.5 | F30: =SUM(C28+C36)/25 -> 57.000 | H30: 7.5
A31: 7 | B31: Matt Lacina & Mark Dvorsky | D31: 21.5 | F31: =SUM(C39+C45)/34 -> 58.970588235294116 | H31: 8
A32: 21 | B32: Nathan Veeder & Joe Evans | D32: 21 | F32: =SUM(C31+C60)/24 -> 65.416666666666671 | H32: 6
A33: 23 | B33: Dan Klein & Farley | D33: 17 | F33: =SUM(C37+C46)/26 -> 59.230769230769234 | H33: 5