A1: 2009 SBDGL Standings Through Week 18
A2: Rank | B2: Player | C2: Total Strokes | D2: Weeks | E2: Average | F2: H-Cap | G2: Last | H2: Week Pt. | I2: Total Pts. | J2: Sub Points
A4: =A3+1 -> 1 | B4: Doug Peyton | C4: 894 | D4: 18 | E4: =(C4/D4) -> 49.666666666666664 | F4: =ROUNDDOWN(((E4-50)*0.8),0) -> 0 | G4: 49 | H4: 1 | I4: 11 | J4: 0
A5: =A4+1 -> 2 | B5: Tim Peyton | C5: 906 | D5: 18 | E5: =(C5/D5) -> 50.333333333333336 | F5: =ROUNDDOWN(((E5-50)*0.8),0) -> 0 | G5: 52 | H5: 0.5 | I5: 11.5 | J5: 0
A6: =A5+1 -> 3 | B6: Matt Wieben | C6: 931 | D6: 18 | E6: =(C6/D6) -> 51.722222222222221 | F6: =ROUNDDOWN(((E6-50)*0.8),0) -> 1 | G6: 53 | H6: 1 | I6: 13.5 | J6: 0
A7: =A6+1 -> 4 | B7: Greco | C7: 935 | D7: 18 | E7: =(C7/D7) -> 51.944444444444443 | F7: =ROUNDDOWN(((E7-50)*0.8),0) -> 1 | G7: 49 | H7: 1 | I7: 11.5 | J7: 0
A8: =A7+1 -> 5 | B8: Jeremy Farnsworth | C8: 888 | D8: 17 | E8: =(C8/D8) -> 52.235294117647058 | F8: =ROUNDDOWN(((E8-50)*0.8),0) -> 1 | G8: 58 | H8: 0 | I8: 10 | J8: 1
A9: =A8+1 -> 6 | B9: KVN | C9: 837 | D9: 16 | E9: =(C9/D9) -> 52.3125 | F9: =ROUNDDOWN(((E9-50)*0.8),0) -> 1 | G9: 50 | H9: 1 | I9: 6.5 | J9: 4
A10: =A9+1 -> 7 | B10: Dan Kern | C10: 893 | D10: 17 | E10: =(C10/D10) -> 52.529411764705884 | F10: =ROUNDDOWN(((E10-50)*0.8),0) -> 2 | G10: 58 | H10: 0 | I10: 7.5 | J10: 1
A11: =A10+1 -> 8 | B11: Adam Miller | C11: 900 | D11: 17 | E11: =(C11/D11) -> 52.941176470588232 | F11: =ROUNDDOWN(((E11-50)*0.8),0) -> 2 | G11: 56 | H11: 0 | I11: 7 | J11: 0
A12: =A11+1 -> 9 | B12: Rimmy | C12: 853 | D12: 16 | E12: =(C12/D12) -> 53.3125 | F12: =ROUNDDOWN(((E12-50)*0.8),0) -> 2 | G12: 49 | H12: 1 | I12: 11 | J12: 0.5
A13: =A12+1 -> 10 | B13: Woody | C13: 961 | D13: 18 | E13: =(C13/D13) -> 53.388888888888886 | F13: =ROUNDDOWN(((E13-50)*0.8),0) -> 2 | G13: 59 | H13: 0 | I13: 7.5 | J13: 0
A14: =A13+1 -> 11 | B14: Kollin Grimm | C14: 968 | D14: 18 | E14: =(C14/D14) -> 53.777777777777779 | F14: =ROUNDDOWN(((E14-50)*0.8),0) -> 3 | G14: 52 | H14: 0 | I14: 6.5 | J14: 0
A15: =A14+1 -> 12 | B15: Dev Nelson | C15: 810 | D15: 15 | E15: =(C15/D15) -> 54.000 | F15: =ROUNDDOWN(((E15-50)*0.8),0) -> 3 | G15: 58 | H15: 1 | I15: 6.5 | J15: 1
A16: =A15+1 -> 13 | B16: Stiers | C16: 974 | D16: 18 | E16: =(C16/D16) -> 54.111111111111114 | F16: =ROUNDDOWN(((E16-50)*0.8),0) -> 3 | G16: 54 | H16: 1 | I16: 8 | J16: 0
A17: =A16+1 -> 14 | B17: Maker | C17: 975 | D17: 18 | E17: =(C17/D17) -> 54.166666666666664 | F17: =ROUNDDOWN(((E17-50)*0.8),0) -> 3 | G17: 55 | H17: 0.5 | I17: 12 | J17: 0
A18: =A17+1 -> 15 | B18: Jesse Sauerbrei | C18: 814 | D18: 15 | E18: =(C18/D18) -> 54.266666666666666 | F18: =ROUNDDOWN(((E18-50)*0.8),0) -> 3 | G18: 53 | H18: 0 | I18: 6 | J18: 1
A19: =A18+1 -> 16 | B19: Joel Knutson | C19: 978 | D19: 18 | E19: =(C19/D19) -> 54.333333333333336 | F19: =ROUNDDOWN(((E19-50)*0.8),0) -> 3 | G19: 56 | H19: 0 | I19: 10.5 | J19: 0
A20: =A19+1 -> 17 | B20: Nick Shultz | C20: 979 | D20: 18 | E20: =(C20/D20) -> 54.388888888888886 | F20: =ROUNDDOWN(((E20-50)*0.8),0) -> 3 | G20: 60 | H20: 0 | I20: 8 | J20: 0
A21: =A20+1 -> 18 | B21: Jason Stroud | C21: 980 | D21: 18 | E21: =(C21/D21) -> 54.444444444444443 | F21: =ROUNDDOWN(((E21-50)*0.8),0) -> 3 | G21: 52 | H21: 1 | I21: 10.5 | J21: 0
A22: =A21+1 -> 19 | B22: Keith Gudenkauf | C22: 928 | D22: 17 | E22: =(C22/D22) -> 54.588235294117645 | F22: =ROUNDDOWN(((E22-50)*0.8),0) -> 3 | G22: 54 | H22: 0 | I22: 9 | J22: 1
A23: =A22+1 -> 20 | B23: Beachy | C23: 983 | D23: 18 | E23: =(C23/D23) -> 54.611111111111114 | F23: =ROUNDDOWN(((E23-50)*0.8),0) -> 3 | G23: 59 | H23: 0 | I23: 10 | J23: 0
A24: =A23+1 -> 21 | B24: Jesse Streinz | C24: 992 | D24: 18 | E24: =(C24/D24) -> 55.111111111111114 | F24: =ROUNDDOWN(((E24-50)*0.8),0) -> 4 | G24: 54 | H24: 1 | I24: 9.5 | J24: 0
A25: =A24+1 -> 22 | B25: Frog | C25: 721 | D25: 13 | E25: =(C25/D25) -> 55.46153846153846 | F25: =ROUNDDOWN(((E25-50)*0.8),0) -> 4 | G25: 0 | H25: 0 | I25: 8 | J25: 1
A26: =A25+1 -> 23 | B26: Dan Ferch | C26: 1006 | D26: 18 | E26: =(C26/D26) -> 55.888888888888886 | F26: =ROUNDDOWN(((E26-50)*0.8),0) -> 4 | G26: 56 | H26: 0 | I26: 7.5 | J26: 0
A27: =A26+1 -> 24 | B27: Shirtless Bill | C27: 897 | D27: 16 | E27: =(C27/D27) -> 56.0625 | F27: =ROUNDDOWN(((E27-50)*0.8),0) -> 4 | G27: 52 | H27: 1 | I27: 8.5 | J27: 1
A28: =A27+1 -> 25 | B28: Utley | C28: 1015 | D28: 18 | E28: =(C28/D28) -> 56.388888888888886 | F28: =ROUNDDOWN(((E28-50)*0.8),0) -> 5 | G28: 52 | H28: 1 | I28: 10.5 | J28: 0
A29: =A28+1 -> 26 | B29: Nathan Veeder | C29: 1021 | D29: 18 | E29: =(C29/D29) -> 56.722222222222221 | F29: =ROUNDDOWN(((E29-50)*0.8),0) -> 5 | G29: 56 | H29: 1 | I29: 11.5 | J29: 0
A30: =A29+1 -> 27 | B30: Ryan Hamilton | C30: 1025 | D30: 18 | E30: =(C30/D30) -> 56.944444444444443 | F30: =ROUNDDOWN(((E30-50)*0.8),0) -> 5 | G30: 57 | H30: 0 | I30: 9.5 | J30: 0
A31: =A30+1 -> 28 | B31: Andrew Hamer | C31: 1028 | D31: 18 | E31: =(C31/D31) -> 57.111111111111114 | F31: =ROUNDDOWN(((E31-50)*0.8),0) -> 5 | G31: 55 | H31: 1 | I31: 10.5 | J31: 0
A32: =A31+1 -> 29 | B32: Martin Reis | C32: 1034 | D32: 18 | E32: =(C32/D32) -> 57.444444444444443 | F32: =ROUNDDOWN(((E32-50)*0.8),0) -> 5 | G32: 56 | H32: 1 | I32: 12 | J32: 0
A33: =A32+1 -> 30 | B33: Super Dave | C33: 805 | D33: 14 | E33: =(C33/D33) -> 57.500 | F33: =ROUNDDOWN(((E33-50)*0.8),0) -> 6 | G33: 0 | H33: 0 | I33: 10 | J33: 2.5
A34: =A33+1 -> 31 | B34: Matt Fritz | C34: 1038 | D34: 18 | E34: =(C34/D34) -> 57.666666666666664 | F34: =ROUNDDOWN(((E34-50)*0.8),0) -> 6 | G34: 56 | H34: 1 | I34: 9 | J34: 0
A35: =A34+1 -> 32 | B35: Brad Rew | C35: 752 | D35: 13 | E35: =(C35/D35) -> 57.846153846153847 | F35: =ROUNDDOWN(((E35-50)*0.8),0) -> 6 | G35: 0 | H35: 0 | I35: 7 | J35: 0
A36: =A35+1 -> 33 | B36: Rob Mumma | C36: 1044 | D36: 18 | E36: =(C36/D36) -> 58.000 | F36: =ROUNDDOWN(((E36-50)*0.8),0) -> 6 | G36: 55 | H36: 1 | I36: 8.5 | J36: 0
A37: =A36+1 -> 34 | B37: Super Kate | C37: 995 | D37: 17 | E37: =(C37/D37) -> 58.529411764705884 | F37: =ROUNDDOWN(((E37-50)*0.8),0) -> 6 | G37: 56 | H37: 1 | I37: 5 | J37: 1
A38: =A37+1 -> 35 | B38: Mike Flynn | C38: 1054 | D38: 18 | E38: =(C38/D38) -> 58.555555555555557 | F38: =ROUNDDOWN(((E38-50)*0.8),0) -> 6 | G38: 62 | H38: 0 | I38: 8 | J38: 0
A39: =A38+1 -> 36 | B39: Tom Pepper | C39: 1057 | D39: 18 | E39: =(C39/D39) -> 58.722222222222221 | F39: =ROUNDDOWN(((E39-50)*0.8),0) -> 6 | G39: 62 | H39: 0 | I39: 5.5 | J39: 0
A40: =A39+1 -> 37 | B40: Farley | C40: 1000 | D40: 17 | E40: =(C40/D40) -> 58.823529411764703 | F40: =ROUNDDOWN(((E40-50)*0.8),0) -> 7 | G40: 60 | H40: 0 | I40: 6 | J40: 1
A41: =A40+1 -> 38 | B41: Matt Shannon | C41: 1072 | D41: 18 | E41: =(C41/D41) -> 59.555555555555557 | F41: =ROUNDDOWN(((E41-50)*0.8),0) -> 7 | G41: 59 | H41: 0 | I41: 8 | J41: 0
A42: =A41+1 -> 39 | B42: Jamie Gray | C42: 956 | D42: 16 | E42: =(C42/D42) -> 59.750 | F42: =ROUNDDOWN(((E42-50)*0.8),0) -> 7 | G42: 61 | H42: 0 | I42: 5 | J42: 1
A43: =A42+1 -> 40 | B43: Prouty | C43: 1016 | D43: 17 | E43: =(C43/D43) -> 59.764705882352942 | F43: =ROUNDDOWN(((E43-50)*0.8),0) -> 7 | G43: 60 | H43: 0 | I43: 7 | J43: 1
A44: =A43+1 -> 41 | B44: Lacina | C44: 1077 | D44: 18 | E44: =(C44/D44) -> 59.833333333333336 | F44: =ROUNDDOWN(((E44-50)*0.8),0) -> 7 | G44: 59 | H44: 1 | I44: 10 | J44: 0
A45: =A44+1 -> 42 | B45: Justin Zehr | C45: 1080 | D45: 18 | E45: =(C45/D45) -> 60.000 | F45: =ROUNDDOWN(((E45-50)*0.8),0) -> 8 | G45: 63 | H45: 1 | I45: 13.5 | J45: 0
A46: =A45+1 -> 43 | B46: Matt Pease | C46: 1089 | D46: 18 | E46: =(C46/D46) -> 60.500 | F46: =ROUNDDOWN(((E46-50)*0.8),0) -> 8 | G46: 61 | H46: 1 | I46: 11 | J46: 0
A47: =A46+1 -> 44 | B47: Valera Petrulevich | C47: 1034 | D47: 17 | E47: =(C47/D47) -> 60.823529411764703 | F47: =ROUNDDOWN(((E47-50)*0.8),0) -> 8 | G47: 56 | H47: 1 | I47: 8 | J47: 0
A48: =A47+1 -> 45 | B48: Tim Troyna | C48: 924 | D48: 15 | E48: =(C48/D48) -> 61.600 | F48: =ROUNDDOWN(((E48-50)*0.8),0) -> 9 | G48: 65 | H48: 1 | I48: 7 | J48: 0
A49: =A48+1 -> 46 | B49: Dustin Nohr | C49: 935 | D49: 15 | E49: =(C49/D49) -> 62.333333333333336 | F49: =ROUNDDOWN(((E49-50)*0.8),0) -> 9 | G49: 62 | H49: 0.5 | I49: 7 | J49: 3
A50: =A49+1 -> 47 | B50: Max Ostby | C50: 1063 | D50: 17 | E50: =(C50/D50) -> 62.529411764705884 | F50: =ROUNDDOWN(((E50-50)*0.8),0) -> 10 | G50: 63 | H50: 0.5 | I50: 8.5 | J50: 0.5
A51: =A50+1 -> 48 | B51: Shawn Hullinger | C51: 1077 | D51: 17 | E51: =(C51/D51) -> 63.352941176470587 | F51: =ROUNDDOWN(((E51-50)*0.8),0) -> 10 | G51: 61 | H51: 0.5 | I51: 3.5 | J51: 1
A52: =A51+1 -> 49 | B52: Spencer Eubanks | C52: 1014 | D52: 16 | E52: =(C52/D52) -> 63.375 | F52: =ROUNDDOWN(((E52-50)*0.8),0) -> 10 | G52: 68 | H52: 0 | I52: 5.5 | J52: 1
A53: =A52+1 -> 50 | B53: Strad Docterman | C53: 1148 | D53: 18 | E53: =(C53/D53) -> 63.777777777777779 | F53: =ROUNDDOWN(((E53-50)*0.8),0) -> 11 | G53: 67 | H53: 0 | I53: 6 | J53: 0
A54: =A53+1 -> 51 | B54: Brandon Yoder | C54: 855 | D54: 13 | E54: =(C54/D54) -> 65.769230769230774 | F54: =ROUNDDOWN(((E54-50)*0.8),0) -> 12 | G54: 63 | H54: 0.5 | I54: 4.5 | J54: 1
A55: =A54+1 -> 52 | B55: Bridgette Rew | C55: 1170 | D55: 17 | E55: =(C55/D55) -> 68.82352941176471 | F55: =ROUNDDOWN(((E55-50)*0.8),0) -> 15 | G55: 71 | H55: 0 | I55: 6.5 | J55: 1
B57: Sub Player | C57: Total Strokes | D57: Weeks | E57: Average | F57: H-Cap | G57: Last | H57: Week Pt. | I57: Total Pts. | J57: Subed For
B58: Doug Johnson | C58: 49 | D58: 1 | E58: =SUM(C58/D58) -> 49.000 | F58: =ROUNDDOWN(((E58-50)*0.8),0) -> 0 | G58: 0 | H58: 0 | I58: 0
B59: T.J. Thurn | C59: 50 | D59: 1 | E59: =SUM(C59/D59) -> 50.000 | F59: =ROUNDDOWN(((E59-50)*0.8),0) -> 0 | G59: 0 | H59: 0 | I59: 0
B60: Kevin Stibal | C60: 555 | D60: 11 | E60: =SUM(C60/D60) -> 50.454545454545453 | F60: =ROUNDDOWN(((E60-50)*0.8),0) -> 0 | G60: 53 | H60: 0 | I60: 5 | J60: Frog
B61: Roland Hesford | C61: 51 | D61: 1 | E61: =SUM(C61/D61) -> 51.000 | F61: =ROUNDDOWN(((E61-50)*0.8),0) -> 0 | G61: 0 | H61: 0 | I61: 0
B62: Jack Gilmore | C62: 52 | D62: 1 | E62: =SUM(C62/D62) -> 52.000 | F62: =ROUNDDOWN(((E62-50)*0.8),0) -> 1 | G62: 0 | H62: 0 | I62: 0
B63: Bryan Bream | C63: 52 | D63: 1 | E63: =SUM(C63/D63) -> 52.000 | F63: =ROUNDDOWN(((E63-50)*0.8),0) -> 1 | G63: 0 | H63: 0 | I63: 0
B64: Rory Lasansky | C64: 685 | D64: 13 | E64: =SUM(C64/D64) -> 52.692307692307693 | F64: =ROUNDDOWN(((E64-50)*0.8),0) -> 2 | G64: 52 | H64: 1 | I64: 4.5 | J64: Super Dave
B65: Charlie Dobberstein | C65: 53 | D65: 1 | E65: =SUM(C65/D65) -> 53.000 | F65: =ROUNDDOWN(((E65-50)*0.8),0) -> 2 | G65: 0 | H65: 0 | I65: 0
B66: Adam Karstens | C66: 54 | D66: 1 | E66: =SUM(C66/D66) -> 54.000 | F66: =ROUNDDOWN(((E66-50)*0.8),0) -> 3 | G66: 0 | H66: 0 | I66: 0
B67: Robb Neubrand | C67: 108 | D67: 2 | E67: =SUM(C67/D67) -> 54.000 | F67: =ROUNDDOWN(((E67-50)*0.8),0) -> 3 | G67: 0 | H67: 0 | I67: 0
B68: Scott Lindsley | C68: 165 | D68: 3 | E68: =SUM(C68/D68) -> 55.000 | F68: =ROUNDDOWN(((E68-50)*0.8),0) -> 4 | G68: 0 | H68: 0 | I68: 0
B69: Greg Friestad | C69: 607 | D69: 11 | E69: =SUM(C69/D69) -> 55.18181818181818 | F69: =ROUNDDOWN(((E69-50)*0.8),0) -> 4 | G69: 54 | H69: 0 | I69: 3
B70: Average Joe | C70: 388 | D70: 7 | E70: =SUM(C70/D70) -> 55.428571428571431 | F70: =ROUNDDOWN(((E70-50)*0.8),0) -> 4 | G70: 0 | H70: 0 | I70: 3.5
B71: Will Viner | C71: 56 | D71: 1 | E71: =SUM(C71/D71) -> 56.000 | F71: =ROUNDDOWN(((E71-50)*0.8),0) -> 4 | G71: 0 | H71: 0 | I71: 0
B72: Dan Mosley | C72: 56 | D72: 1 | E72: =SUM(C72/D72) -> 56.000 | F72: =ROUNDDOWN(((E72-50)*0.8),0) -> 4 | G72: 0 | H72: 0 | I72: 0
B73: Travis Pike | C73: 227 | D73: 4 | E73: =SUM(C73/D73) -> 56.750 | F73: =ROUNDDOWN(((E73-50)*0.8),0) -> 5 | G73: 0 | H73: 0 | I73: 1
B74: Cody Green | C74: 171 | D74: 3 | E74: =SUM(C74/D74) -> 57.000 | F74: =ROUNDDOWN(((E74-50)*0.8),0) -> 5 | G74: 0 | H74: 0 | I74: 1.5
B75: Kruck | C75: 402 | D75: 7 | E75: =SUM(C75/D75) -> 57.428571428571431 | F75: =ROUNDDOWN(((E75-50)*0.8),0) -> 5 | G75: 0 | H75: 0 | I75: 1.5
B76: Archie Coulter | C76: 58 | D76: 1 | E76: =SUM(C76/D76) -> 58.000 | F76: =ROUNDDOWN(((E76-50)*0.8),0) -> 6 | G76: 0 | H76: 0 | I76: 0
B77: Eli Ostby | C77: 58 | D77: 1 | E77: =SUM(C77/D77) -> 58.000 | F77: =ROUNDDOWN(((E77-50)*0.8),0) -> 6 | G77: 0 | H77: 0 | I77: 0
B78: Matt Ross | C78: 116 | D78: 2 | E78: =SUM(C78/D78) -> 58.000 | F78: =ROUNDDOWN(((E78-50)*0.8),0) -> 6 | G78: 0 | H78: 0 | I78: 1
B79: D. Burns | C79: 353 | D79: 6 | E79: =SUM(C79/D79) -> 58.833333333333336 | F79: =ROUNDDOWN(((E79-50)*0.8),0) -> 7 | G79: 0 | H79: 0 | I79: 1
B80: Tony Ebson | C80: 60 | D80: 1 | E80: =SUM(C80/D80) -> 60.000 | F80: =ROUNDDOWN(((E80-50)*0.8),0) -> 8 | G80: 0 | H80: 0 | I80: 0
B81: Steve Callaway | C81: 424 | D81: 7 | E81: =SUM(C81/D81) -> 60.571428571428569 | F81: =ROUNDDOWN(((E81-50)*0.8),0) -> 8 | G81: 67 | H81: 0 | I81: 1 | J81: Brad Rew
B82: Andrew Staudt | C82: 246 | D82: 4 | E82: =SUM(C82/D82) -> 61.500 | F82: =ROUNDDOWN(((E82-50)*0.8),0) -> 9 | G82: 0 | H82: 0 | I82: 0
B83: Joe Cool | C83: 64 | D83: 1 | E83: =SUM(C83/D83) -> 64.000 | F83: =ROUNDDOWN(((E83-50)*0.8),0) -> 11 | G83: 0 | H83: 0 | I83: 0
B84: Tom Hashman | C84: 192 | D84: 3 | E84: =SUM(C84/D84) -> 64.000 | F84: =ROUNDDOWN(((E84-50)*0.8),0) -> 11 | G84: 0 | H84: 0 | I84: 1
B85: Eric VanDeusen | C85: 257 | D85: 4 | E85: =SUM(C85/D85) -> 64.250 | F85: =ROUNDDOWN(((E85-50)*0.8),0) -> 11 | G85: 0 | H85: 0 | I85: 0
B86: Jake Alheid | C86: 129 | D86: 2 | E86: =SUM(C86/D86) -> 64.500 | F86: =ROUNDDOWN(((E86-50)*0.8),0) -> 11 | G86: 0 | H86: 0 | I86: 0
B87: Doug Knepp | C87: 390 | D87: 6 | E87: =SUM(C87/D87) -> 65.000 | F87: =ROUNDDOWN(((E87-50)*0.8),0) -> 12 | G87: 0 | H87: 0 | I87: 3
B88: Troy Knapp | C88: 65 | D88: 1 | E88: =SUM(C88/D88) -> 65.000 | F88: =ROUNDDOWN(((E88-50)*0.8),0) -> 12 | G88: 0 | H88: 0 | I88: 0
B89: Dustin Gaskill | C89: 66 | D89: 1 | E89: =SUM(C89/D89) -> 66.000 | F89: =ROUNDDOWN(((E89-50)*0.8),0) -> 12 | G89: 0 | H89: 0 | I89: 0
B90: Kurtis Kron | C90: 332 | D90: 5 | E90: =SUM(C90/D90) -> 66.400 | F90: =ROUNDDOWN(((E90-50)*0.8),0) -> 13 | G90: 68 | H90: 0 | I90: 0
A92: 2009 SBDGL Team Standings
D93: Total Points | F93: Team Average | H93: Team Points
A94: 5 | B94: Tim Peyton / Matt Wieben | D94: 39.5 | F94: =SUM(C5+C6)/36 -> 51.027777777777779 | H94: 14.5
A95: 21 | B95: Maker / Joel Knutson | D95: 35 | F95: =SUM(C17+C19)/36 -> 54.250 | H95: 12.5
A96: 22 | B96: Keith Gudenkauf / Super Dave | D96: 34 | F96: =SUM(C22+C33)/31 -> 55.903225806451616 | H96: 11.5
A97: 23 | B97: Doug Peyton / Prouty | D97: 31.5 | F97: =SUM(C4+C43)/35 -> 54.571428571428569 | H97: 12.5
A98: 20 | B98: Dev Nelson / Justin Zehr | D98: 31 | F98: =SUM(C15+C45)/33 -> 57.272727272727273 | H98: 10
A99: 11 | B99: Greco / Dan Ferch | D99: 30 | F99: =SUM(C7+C26)/36 -> 53.916666666666664 | H99: 11
A100: 3 | B100: Beachy / Matt Fritz | D100: 29.5 | F100: =SUM(C23+C34)/36 -> 56.138888888888886 | H100: 10.5
A101: 14 | B101: Rimmy / Farley | D101: 29 | F101: =SUM(C12+C40)/33 -> 56.151515151515149 | H101: 10.5
A102: 15 | B102: Jesse Sauerbrei / Martin Reis | D102: 28.5 | F102: =SUM(C18+C32)/33 -> 56.000 | H102: 9.5
A103: 4 | B103: Frog / KVN | D103: 28.5 | F103: =SUM(C9+C25)/29 -> 53.724137931034484 | H103: 9
A104: 16 | B104: Jeremy Farnsworth / Bridgette Rew | D104: 28 | F104: =SUM(C8+C55)/34 -> 60.529411764705884 | H104: 9.5
A105: 24 | B105: Rob Mumma / Valera Petrulevich | D105: 27.5 | F105: =SUM(C36+C47)/35 -> 59.371428571428574 | H105: 11
A106: 12 | B106: Utley / Spencer Eubanks | D106: 27 | F106: =SUM(C28+C52)/34 -> 59.676470588235297 | H106: 10
A107: 9 | B107: Woody / Nathan Veeder | D107: 27 | F107: =SUM(C13+C29)/36 -> 55.055555555555557 | H107: 8
A108: 19 | B108: Mike Flynn / Matt Pease | D108: 26.5 | F108: =SUM(C38+C46)/36 -> 59.527777777777779 | H108: 7.5
A109: 17 | B109: Stiers / Max Ostby | D109: 26 | F109: =SUM(C16+C50)/35 -> 58.200 | H109: 9
A110: 6 | B110: Shirtless Bill / Super Kate | D110: 25 | F110: =SUM(C27+C37)/33 -> 57.333333333333336 | H110: 9.5
A111: 1 | B111: Jesse Strienz / Jamie Gray | D111: 24.5 | F111: =SUM(C24+C42)/34 -> 57.294117647058826 | H111: 9
A112: 13 | B112: Nick Shultz / Jason Stroud | D112: 24.5 | F112: =SUM(C20+C21)/36 -> 54.416666666666664 | H112: 6
A113: 8 | B113: Adam Miller / Ryan Hamilton | D113: 24 | F113: =SUM(C11+C30)/35 -> 55.000 | H113: 7.5
A114: 18 | B114: Brad Rew / Dustin Nohr | D114: 24 | F114: =SUM(C35+C49)/28 -> 60.250 | H114: 7
A115: 25 | B115: Andrew Hamer / Tim Troyna | D115: 23.5 | F115: =SUM(C31+C48)/33 -> 59.151515151515149 | H115: 6
A116: 7 | B116: Kollin Grimm / Matt Shannon | D116: 21 | F116: =SUM(C14+C41)/36 -> 56.666666666666664 | H116: 6.5
A117: 2 | B117: Lacina / Shawn Hullinger | D117: 21 | F117: =SUM(C44+C51)/35 -> 61.542857142857144 | H117: 6.5
A118: 26 | B118: Dan Kern / Strad Docterman | D118: 20 | F118: =SUM(C10+C53)/35 -> 58.314285714285717 | H118: 5.5
A119: 10 | B119: Tom Pepper / Brandon Yoder | D119: 15 | F119: =SUM(C39+C54)/31 -> 61.677419354838712 | H119: 4
B120: Bush Division Champions | D120: Tim Peyton / Matt Wieben
B121: Whacker Division Champions | D121: Keith Gudenkauf / Super Dave