A1: 2010 SBDGL Standings Through Week 18
A2: Rank | B2: Player | C2: Total Strokes | D2: Weeks | E2: Average | F2: H-Cap | G2: Last | H2: Week Pt. | I2: Total Pts. | J2: Sub Points
A4: =A3+1 -> 1 | B4: Doug Peyton | C4: 881 | D4: 18 | E4: =(C4/D4) -> 48.944444444444443 | F4: =ROUNDDOWN(((E4-50)*0.8),0) -> 0 | G4: 44 | H4: 0 | I4: 11
A5: =A4+1 -> 2 | B5: Matt Wieben | C5: 896 | D5: 18 | E5: =(C5/D5) -> 49.777777777777779 | F5: =ROUNDDOWN(((E5-50)*0.8),0) -> 0 | G5: 45 | H5: 1 | I5: 11
A6: =A5+1 -> 3 | B6: Dan Kern | C6: 900 | D6: 18 | E6: =(C6/D6) -> 50.000 | F6: =ROUNDDOWN(((E6-50)*0.8),0) -> 0 | G6: 49 | H6: 0 | I6: 11
A7: =A6+1 -> 4 | B7: Greco | C7: 906 | D7: 18 | E7: =(C7/D7) -> 50.333333333333336 | F7: =ROUNDDOWN(((E7-50)*0.8),0) -> 0 | G7: 41 | H7: 1 | I7: 11
A8: =A7+1 -> 5 | B8: Tim Peyton | C8: 913 | D8: 18 | E8: =(C8/D8) -> 50.722222222222221 | F8: =ROUNDDOWN(((E8-50)*0.8),0) -> 0 | G8: 49 | H8: 0 | I8: 9.5
A9: =A8+1 -> 6 | B9: Jeremy Farnsworth | C9: 915 | D9: 18 | E9: =(C9/D9) -> 50.833333333333336 | F9: =ROUNDDOWN(((E9-50)*0.8),0) -> 0 | G9: 42 | H9: 1 | I9: 13.5
A10: =A9+1 -> 7 | B10: Kollin Grimm | C10: 924 | D10: 18 | E10: =(C10/D10) -> 51.333333333333336 | F10: =ROUNDDOWN(((E10-50)*0.8),0) -> 1 | G10: 47 | H10: 1 | I10: 10.5
A11: =A10+1 -> 8 | B11: Dev Nelson | C11: 928 | D11: 18 | E11: =(C11/D11) -> 51.555555555555557 | F11: =ROUNDDOWN(((E11-50)*0.8),0) -> 1 | G11: 51 | H11: 0 | I11: 10
A12: =A11+1 -> 9 | B12: Tim Potter | C12: 930 | D12: 18 | E12: =(C12/D12) -> 51.666666666666664 | F12: =ROUNDDOWN(((E12-50)*0.8),0) -> 1 | G12: 46 | H12: 1 | I12: 13
A13: =A12+1 -> 10 | B13: Rory Lasansky | C13: 897 | D13: 17 | E13: =(C13/D13) -> 52.764705882352942 | F13: =ROUNDDOWN(((E13-50)*0.8),0) -> 2 | G13: 50 | H13: 1 | I13: 9.5
A14: =A13+1 -> 11 | B14: Adam Miller | C14: 900 | D14: 17 | E14: =(C14/D14) -> 52.941176470588232 | F14: =ROUNDDOWN(((E14-50)*0.8),0) -> 2 | G14: 49 | H14: 1 | I14: 7.5
A15: =A14+1 -> 12 | B15: Utley | C15: 957 | D15: 18 | E15: =(C15/D15) -> 53.166666666666664 | F15: =ROUNDDOWN(((E15-50)*0.8),0) -> 2 | G15: 50 | H15: 1 | I15: 8.5
A16: =A15+1 -> 13 | B16: Woody | C16: 957 | D16: 18 | E16: =(C16/D16) -> 53.166666666666664 | F16: =ROUNDDOWN(((E16-50)*0.8),0) -> 2 | G16: 48 | H16: 0 | I16: 12.5
A17: =A16+1 -> 14 | B17: Greg Friestad | C17: 856 | D17: 16 | E17: =(C17/D17) -> 53.500 | F17: =ROUNDDOWN(((E17-50)*0.8),0) -> 2 | G17: 53 | H17: 0 | I17: 7.5 | J17: 0.5
A18: =A17+1 -> 15 | B18: Nathan Veeder | C18: 922 | D18: 17 | E18: =(C18/D18) -> 54.235294117647058 | F18: =ROUNDDOWN(((E18-50)*0.8),0) -> 3 | G18: 54 | H18: 1 | I18: 7
A19: =A18+1 -> 16 | B19: Joel Knutson | C19: 979 | D19: 18 | E19: =(C19/D19) -> 54.388888888888886 | F19: =ROUNDDOWN(((E19-50)*0.8),0) -> 3 | G19: 52 | H19: 1 | I19: 9.5
A20: =A19+1 -> 17 | B20: Rimmy | C20: 762 | D20: 14 | E20: =(C20/D20) -> 54.428571428571431 | F20: =ROUNDDOWN(((E20-50)*0.8),0) -> 3 | G20: 47 | H20: 1 | I20: 5 | J20: 1.5
A21: =A20+1 -> 18 | B21: Ryan Hamilton | C21: 980 | D21: 18 | E21: =(C21/D21) -> 54.444444444444443 | F21: =ROUNDDOWN(((E21-50)*0.8),0) -> 3 | G21: 47 | H21: 1 | I21: 11.5
A22: =A21+1 -> 19 | B22: Beachy | C22: 981 | D22: 18 | E22: =(C22/D22) -> 54.500 | F22: =ROUNDDOWN(((E22-50)*0.8),0) -> 3 | G22: 50 | H22: 0 | I22: 10.5
A23: =A22+1 -> 20 | B23: Stiers | C23: 873 | D23: 16 | E23: =(C23/D23) -> 54.5625 | F23: =ROUNDDOWN(((E23-50)*0.8),0) -> 3 | G23: 52 | H23: 1 | I23: 5.5 | J23: 1
A24: =A23+1 -> 21 | B24: Matt Ross | C24: 930 | D24: 17 | E24: =(C24/D24) -> 54.705882352941174 | F24: =ROUNDDOWN(((E24-50)*0.8),0) -> 3 | G24: 51 | H24: 1 | I24: 11 | J24: 0.5
A25: =A24+1 -> 22 | B25: Travis Pike | C25: 825 | D25: 15 | E25: =(C25/D25) -> 55.000 | F25: =ROUNDDOWN(((E25-50)*0.8),0) -> 4 | G25: 50 | H25: 1 | I25: 5.5 | J25: 0.5
A26: =A25+1 -> 23 | B26: Matt Shannon | C26: 996 | D26: 18 | E26: =(C26/D26) -> 55.333333333333336 | F26: =ROUNDDOWN(((E26-50)*0.8),0) -> 4 | G26: 48 | H26: 0 | I26: 11
A27: =A26+1 -> 24 | B27: Maker | C27: 1003 | D27: 18 | E27: =(C27/D27) -> 55.722222222222221 | F27: =ROUNDDOWN(((E27-50)*0.8),0) -> 4 | G27: 57 | H27: 0 | I27: 7.5
A28: =A27+1 -> 25 | B28: Jesse Streinz | C28: 1003 | D28: 18 | E28: =(C28/D28) -> 55.722222222222221 | F28: =ROUNDDOWN(((E28-50)*0.8),0) -> 4 | G28: 56 | H28: 0 | I28: 11
A29: =A28+1 -> 26 | B29: Nathan Ciha | C29: 1003 | D29: 18 | E29: =(C29/D29) -> 55.722222222222221 | F29: =ROUNDDOWN(((E29-50)*0.8),0) -> 4 | G29: 54 | H29: 0 | I29: 9
A30: =A29+1 -> 27 | B30: Martin Reis | C30: 1013 | D30: 18 | E30: =(C30/D30) -> 56.277777777777779 | F30: =ROUNDDOWN(((E30-50)*0.8),0) -> 5 | G30: 56 | H30: 0 | I30: 8.5
A31: =A30+1 -> 28 | B31: Frog | C31: 734 | D31: 13 | E31: =(C31/D31) -> 56.46153846153846 | F31: =ROUNDDOWN(((E31-50)*0.8),0) -> 5 | G31: 57 | H31: 0 | I31: 5 | J31: 1
A32: =A31+1 -> 29 | B32: Super Dave | C32: 510 | D32: 9 | E32: =(C32/D32) -> 56.666666666666664 | F32: =ROUNDDOWN(((E32-50)*0.8),0) -> 5 | G32: 54 | H32: 0 | I32: 4 | J32: 7
A33: =A32+1 -> 30 | B33: Justin Zehr | C33: 907 | D33: 16 | E33: =(C33/D33) -> 56.6875 | F33: =ROUNDDOWN(((E33-50)*0.8),0) -> 5 | G33: 52 | H33: 1 | I33: 8.5 | J33: 2
A34: =A33+1 -> 31 | B34: Matt Fritz | C34: 965 | D34: 17 | E34: =(C34/D34) -> 56.764705882352942 | F34: =ROUNDDOWN(((E34-50)*0.8),0) -> 5 | G34: 49 | H34: 1 | I34: 12.5 | J34: 1
A35: =A34+1 -> 32 | B35: Dan Lewis | C35: 740 | D35: 13 | E35: =(C35/D35) -> 56.92307692307692 | F35: =ROUNDDOWN(((E35-50)*0.8),0) -> 5 | G35: 48 | H35: 1 | I35: 5 | J35: 2.5
A36: =A35+1 -> 33 | B36: Shirtless Bill | C36: 1025 | D36: 18 | E36: =(C36/D36) -> 56.944444444444443 | F36: =ROUNDDOWN(((E36-50)*0.8),0) -> 5 | G36: 54 | H36: 1 | I36: 8
A37: =A36+1 -> 34 | B37: Valera Petrulevich | C37: 1028 | D37: 18 | E37: =(C37/D37) -> 57.111111111111114 | F37: =ROUNDDOWN(((E37-50)*0.8),0) -> 5 | G37: 53 | H37: 0 | I37: 6.5
A38: =A37+1 -> 35 | B38: Dustin Nohr | C38: 1031 | D38: 18 | E38: =(C38/D38) -> 57.277777777777779 | F38: =ROUNDDOWN(((E38-50)*0.8),0) -> 5 | G38: 52 | H38: 1 | I38: 6
A39: =A38+1 -> 36 | B39: Farley | C39: 1039 | D39: 18 | E39: =(C39/D39) -> 57.722222222222221 | F39: =ROUNDDOWN(((E39-50)*0.8),0) -> 6 | G39: 46 | H39: 1 | I39: 9
A40: =A39+1 -> 37 | B40: Tim Troyna | C40: 982 | D40: 17 | E40: =(C40/D40) -> 57.764705882352942 | F40: =ROUNDDOWN(((E40-50)*0.8),0) -> 6 | G40: 56 | H40: 0 | I40: 12.5
A41: =A40+1 -> 38 | B41: Tom Pepper | C41: 1040 | D41: 18 | E41: =(C41/D41) -> 57.777777777777779 | F41: =ROUNDDOWN(((E41-50)*0.8),0) -> 6 | G41: 50 | H41: 1 | I41: 11.5
A42: =A41+1 -> 39 | B42: Average Joe | C42: 929 | D42: 16 | E42: =(C42/D42) -> 58.0625 | F42: =ROUNDDOWN(((E42-50)*0.8),0) -> 6 | G42: 0 | H42: 0 | I42: 5 | J42: 1
A43: =A42+1 -> 40 | B43: D. Burns | C43: 989 | D43: 17 | E43: =(C43/D43) -> 58.176470588235297 | F43: =ROUNDDOWN(((E43-50)*0.8),0) -> 6 | G43: 57 | H43: 0 | I43: 8.5 | J43: 1
A44: =A43+1 -> 41 | B44: Shane Thirtyacre | C44: 821 | D44: 14 | E44: =(C44/D44) -> 58.642857142857146 | F44: =ROUNDDOWN(((E44-50)*0.8),0) -> 6 | G44: 58 | H44: 0 | I44: 6
A45: =A44+1 -> 42 | B45: Max Ostby | C45: 771 | D45: 13 | E45: =(C45/D45) -> 59.307692307692307 | F45: =ROUNDDOWN(((E45-50)*0.8),0) -> 7 | G45: 50 | H45: 1 | I45: 5.5 | J45: 4
A46: =A45+1 -> 43 | B46: John Williams | C46: 954 | D46: 16 | E46: =(C46/D46) -> 59.625 | F46: =ROUNDDOWN(((E46-50)*0.8),0) -> 7 | G46: 59 | H46: 0 | I46: 6 | J46: 1
A47: =A46+1 -> 44 | B47: Trevor Dickerson | C47: 961 | D47: 16 | E47: =(C47/D47) -> 60.0625 | F47: =ROUNDDOWN(((E47-50)*0.8),0) -> 8 | G47: 53 | H47: 0 | I47: 4.5 | J47: 1.5
A48: =A47+1 -> 45 | B48: Chuck Hansen | C48: 1030 | D48: 17 | E48: =(C48/D48) -> 60.588235294117645 | F48: =ROUNDDOWN(((E48-50)*0.8),0) -> 8 | G48: 58 | H48: 0 | I48: 4.5 | J48: 0.5
A49: =A48+1 -> 46 | B49: Shawn Hullinger | C49: 1106 | D49: 18 | E49: =(C49/D49) -> 61.444444444444443 | F49: =ROUNDDOWN(((E49-50)*0.8),0) -> 9 | G49: 57 | H49: 1 | I49: 9
A50: =A49+1 -> 47 | B50: Spencer Eubanks | C50: 1169 | D50: 18 | E50: =(C50/D50) -> 64.944444444444443 | F50: =ROUNDDOWN(((E50-50)*0.8),0) -> 11 | G50: 62 | H50: 0 | I50: 5
A51: =A50+1 -> 48 | B51: Brandon Yoder | C51: 676 | D51: 10 | E51: =(C51/D51) -> 67.600 | F51: =ROUNDDOWN(((E51-50)*0.8),0) -> 14 | G51: 0 | H51: 0 | I51: 2.5 | J51: 2
B53: Sub Player | C53: Total Strokes | D53: Weeks | E53: Average | F53: H-Cap | G53: Last | H53: Week Pt. | I53: Total Pts. | J53: Subed For
B54: Prouty | C54: 656 | D54: 11 | E54: =SUM(C54/D54) -> 59.636363636363633 | F54: =ROUNDDOWN(((E54-50)*0.8),0) -> 7 | G54: 0 | H54: 0 | I54: 4.5
B55: Brad Rew | C55: 165 | D55: 3 | E55: =SUM(C55/D55) -> 55.000 | F55: =ROUNDDOWN(((E55-50)*0.8),0) -> 4 | G55: 0 | H55: 0 | I55: 2
B56: Ryan Eggleston | C56: 887 | D56: 15 | E56: =SUM(C56/D56) -> 59.133333333333333 | F56: =ROUNDDOWN(((E56-50)*0.8),0) -> 7 | G56: 0 | H56: 0 | I56: 1.5
B57: Spang | C57: 49 | D57: 1 | E57: =SUM(C57/D57) -> 49.000 | F57: =ROUNDDOWN(((E57-50)*0.8),0) -> 0 | G57: 0 | H57: 0 | I57: 1
B58: Wade Geary | C58: 53 | D58: 1 | E58: =SUM(C58/D58) -> 53.000 | F58: =ROUNDDOWN(((E58-50)*0.8),0) -> 2 | G58: 0 | H58: 0 | I58: 0
B59: Kevin Stibal | C59: 265 | D59: 5 | E59: =SUM(C59/D59) -> 53.000 | F59: =ROUNDDOWN(((E59-50)*0.8),0) -> 2 | G59: 0 | H59: 0 | I59: 2
B60: KVN | C60: 749 | D60: 15 | E60: =SUM(C60/D60) -> 49.93333333333333 | F60: =ROUNDDOWN(((E60-50)*0.8),0) -> 0 | G60: 49 | H60: 0 | I60: 9 | J60: Average Joe
B61: Greg Dye | C61: 53 | D61: 1 | E61: =SUM(C61/D61) -> 53.000 | F61: =ROUNDDOWN(((E61-50)*0.8),0) -> 2 | G61: 0 | H61: 0 | I61: 0
B62: Justin Harris | C62: 119 | D62: 2 | E62: =SUM(C62/D62) -> 59.500 | F62: =ROUNDDOWN(((E62-50)*0.8),0) -> 7 | G62: 0 | H62: 0 | I62: 0
B63: Adam Hartig | C63: 60 | D63: 1 | E63: =SUM(C63/D63) -> 60.000 | F63: =ROUNDDOWN(((E63-50)*0.8),0) -> 8 | G63: 0 | H63: 0 | I63: 0
B64: Chase Norton | C64: 118 | D64: 2 | E64: =SUM(C64/D64) -> 59.000 | F64: =ROUNDDOWN(((E64-50)*0.8),0) -> 7 | G64: 0 | H64: 0 | I64: 0
B65: Joe Cool | C65: 56 | D65: 1 | E65: =SUM(C65/D65) -> 56.000 | F65: =ROUNDDOWN(((E65-50)*0.8),0) -> 4 | G65: 0 | H65: 0 | I65: 0
B66: Kruck | C66: 239 | D66: 4 | E66: =SUM(C66/D66) -> 59.750 | F66: =ROUNDDOWN(((E66-50)*0.8),0) -> 7 | G66: 0 | H66: 0 | I66: 1.5
B67: TJ Nanke | C67: 113 | D67: 2 | E67: =SUM(C67/D67) -> 56.500 | F67: =ROUNDDOWN(((E67-50)*0.8),0) -> 5 | G67: 0 | H67: 0 | I67: 1
B68: Aaron Portor | C68: 133 | D68: 2 | E68: =SUM(C68/D68) -> 66.500 | F68: =ROUNDDOWN(((E68-50)*0.8),0) -> 13 | G68: 0 | H68: 0 | I68: 0
B69: Rob Mumma | C69: 218 | D69: 4 | E69: =SUM(C69/D69) -> 54.500 | F69: =ROUNDDOWN(((E69-50)*0.8),0) -> 3 | G69: 0 | H69: 0 | I69: 0
B70: Chris Farnsworth | C70: 507 | D70: 8 | E70: =SUM(C70/D70) -> 63.375 | F70: =ROUNDDOWN(((E70-50)*0.8),0) -> 10 | G70: 0 | H70: 0 | I70: 0
B71: Kurt Conrad | C71: 157 | D71: 3 | E71: =SUM(C71/D71) -> 52.333333333333336 | F71: =ROUNDDOWN(((E71-50)*0.8),0) -> 1 | G71: 0 | H71: 0 | I71: 1
B72: David "Meepo" | C72: 64 | D72: 1 | E72: =SUM(C72/D72) -> 64.000 | F72: =ROUNDDOWN(((E72-50)*0.8),0) -> 11 | G72: 0 | H72: 0 | I72: 0
B73: Zach Votroubeck | C73: 431 | D73: 7 | E73: =SUM(C73/D73) -> 61.571428571428569 | F73: =ROUNDDOWN(((E73-50)*0.8),0) -> 9 | G73: 0 | H73: 0 | I73: 2
B74: Charlie Dobb | C74: 112 | D74: 2 | E74: =SUM(C74/D74) -> 56.000 | F74: =ROUNDDOWN(((E74-50)*0.8),0) -> 4 | G74: 0 | H74: 0 | I74: 0.5
B75: Drew Detert | C75: 55 | D75: 1 | E75: =SUM(C75/D75) -> 55.000 | F75: =ROUNDDOWN(((E75-50)*0.8),0) -> 4 | G75: 0 | H75: 0 | I75: 0
B76: Adam Karstens | C76: 55 | D76: 1 | E76: =SUM(C76/D76) -> 55.000 | F76: =ROUNDDOWN(((E76-50)*0.8),0) -> 4 | G76: 0 | H76: 0 | I76: 0
B77: Doug Johnson | C77: 246 | D77: 5 | E77: =SUM(C77/D77) -> 49.200 | F77: =ROUNDDOWN(((E77-50)*0.8),0) -> 0 | G77: 47 | H77: 0 | I77: 2.5
B78: Adam Olson | C78: 47 | D78: 1 | E78: =SUM(C78/D78) -> 47.000 | F78: =ROUNDDOWN(((E78-50)*0.8),0) -> -2 | G78: 0 | H78: 0 | I78: 0
B79: Chris Klime | C79: 50 | D79: 1 | E79: =SUM(C79/D79) -> 50.000 | F79: =ROUNDDOWN(((E79-50)*0.8),0) -> 0 | G79: 0 | H79: 0 | I79: 0
A81: 2010 SBDGL Team Standings
D82: Total Points | F82: Team Average | H82: Team Points
A83: 1 | B83: Matt Ross / Tim Potter | D83: 37 | F83: =SUM(C12+C24)/35 -> 53.142857142857146 | H83: 12.5
A84: 2 | B84: Dan Kern / Super Dave | D84: 36 | F84: =SUM(C6+C32)/26 -> 54.230769230769234 | H84: 14
A85: 3 | B85: Matt Fritz / Utley | D85: 33 | F85: =SUM(C15+C34)/35 -> 54.914285714285711 | H85: 11
A86: 4 | B86: Matt Wieben / Nathan Ciha | D86: 32.5 | F86: =SUM(C5+C29)/36 -> 52.750 | H86: 12.5
A87: 5 | B87: Woody / Joel Knutson | D87: 32.5 | F87: =SUM(C16+C19)/36 -> 53.777777777777779 | H87: 10.5
A88: 6 | B88: Matt Shannon / Ryan Hamilton | D88: 32.5 | F88: =SUM(C21+C26)/36 -> 54.888888888888886 | H88: 10
A89: 7 | B89: Tim Troyna / Farley | D89: 31.5 | F89: =SUM(C39+C40)/35 -> 57.74285714285714 | H89: 10
A90: 8 | B90: Dev Nelson / Rory Lasansky | D90: 30.5 | F90: =SUM(C11+C13)/35 -> 52.142857142857146 | H90: 11
A91: 9 | B91: Jeremy Farnsworth / Stiers | D91: 29 | F91: =SUM(C9+C23)/34 -> 52.588235294117645 | H91: 9
A92: 10 | B92: Beachy / Tim Peyton | D92: 29 | F92: =SUM(C8+C22)/36 -> 52.611111111111114 | H92: 9
A93: 11 | B93: Maker / Kollin Grimm | D93: 27.5 | F93: =SUM(C10+C27)/36 -> 53.527777777777779 | H93: 9.5
A94: 12 | B94: Tom Pepper / Shane Thirtyacre | D94: 26.5 | F94: =SUM(C41+C44)/32 -> 58.15625 | H94: 9
A95: 13 | B95: Justin Zehr / Travis Pike | D95: 26 | F95: =SUM(C25+C33)/31 -> 55.87096774193548 | H95: 9.5
A96: 14 | B96: Frog / Greco | D96: 26 | F96: =SUM(C7+C31)/31 -> 52.903225806451616 | H96: 9
A97: 15 | B97: Spencer Eubanks / Jesse Streinz | D97: 25 | F97: =SUM(C28+C50)/36 -> 60.333333333333336 | H97: 9
A98: 16 | B98: Shirtless Bill / Martin Reis | D98: 25 | F98: =SUM(C30+C36)/36 -> 56.611111111111114 | H98: 8.5
A99: 17 | B99: Doug Peyton / Nathan Veeder | D99: 25 | F99: =SUM(C4+C18)/35 -> 51.514285714285712 | H99: 7
A100: 18 | B100: Rimmy / Max Ostby | D100: 24 | F100: =SUM(C20+C45)/27 -> 56.777777777777779 | H100: 8
A101: 19 | B101: Dustin Nohr / Dan Lewis | D101: 22.5 | F101: =SUM(C35+C38)/31 -> 57.12903225806452 | H101: 9
A102: 20 | B102: Average Joe / D. Burns | D102: 21.5 | F102: =SUM(C42+C43)/33 -> 58.121212121212125 | H102: 6
A103: 21 | B103: Chuck Hansen / Shawn Hullinger | D103: 21 | F103: =SUM(C48+C49)/35 -> 61.028571428571432 | H103: 7
A104: 22 | B104: Valera Petrulevich / Greg Friestad | D104: 21 | F104: =SUM(C17+C37)/34 -> 55.411764705882355 | H104: 6.5
A105: 23 | B105: John Williams / Trevor Dickerson | D105: 19 | F105: =SUM(C46+C47)/32 -> 59.84375 | H105: 6
A106: 24 | B106: Adam Miller / Brandon Yoder | D106: 14.5 | F106: =SUM(C14+C51)/27 -> 58.370370370370374 | H106: 2.5