A1: 2011 S.B.D.G.L. STANDINGS Through Week 8
A2: Rank | B2: Player | C2: Total Strokes | D2: Weeks | E2: Average | F2: H-Cap | G2: Last | H2: Week Pt. | I2: Total Pts. | J2: Sub Points
A4: =A3+1 -> 1 | B4: Doug Peyton | C4: 203 | D4: 4 | E4: =(C4/D4) -> 50.750 | F4: =ROUNDDOWN(((E4-50)*0.8),0) -> 0 | G4: - | H4: - | I4: 3
A5: =A4+1 -> 2 | B5: Greco | C5: 408 | D5: 8 | E5: =(C5/D5) -> 51.000 | F5: =ROUNDDOWN(((E5-50)*0.8),0) -> 0 | G5: 49 | H5: 1 | I5: 5
A6: =A5+1 -> 3 | B6: Tim Peyton | C6: 412 | D6: 8 | E6: =(C6/D6) -> 51.500 | F6: =ROUNDDOWN(((E6-50)*0.8),0) -> 1 | G6: 54 | H6: 1 | I6: 6.5
A7: =A6+1 -> 4 | B7: Matt Wieben | C7: 412 | D7: 8 | E7: =(C7/D7) -> 51.500 | F7: =ROUNDDOWN(((E7-50)*0.8),0) -> 1 | G7: 51 | H7: 1 | I7: 8
A8: =A7+1 -> 5 | B8: Doug Johnson | C8: 365 | D8: 7 | E8: =(C8/D8) -> 52.142857142857146 | F8: =ROUNDDOWN(((E8-50)*0.8),0) -> 1 | G8: 51 | H8: 0 | I8: 4.5
A9: =A8+1 -> 6 | B9: Adam Miller | C9: 367 | D9: 7 | E9: =(C9/D9) -> 52.428571428571431 | F9: =ROUNDDOWN(((E9-50)*0.8),0) -> 1 | G9: 53 | H9: 1 | I9: 6
A10: =A9+1 -> 7 | B10: KVN Lavley | C10: 420 | D10: 8 | E10: =(C10/D10) -> 52.500 | F10: =ROUNDDOWN(((E10-50)*0.8),0) -> 2 | G10: 44 | H10: 1 | I10: 5
A11: =A10+1 -> 8 | B11: Jeremy Farnsworth | C11: 368 | D11: 7 | E11: =(C11/D11) -> 52.571428571428569 | F11: =ROUNDDOWN(((E11-50)*0.8),0) -> 2 | G11: 54 | H11: 0 | I11: 3
A12: =A11+1 -> 9 | B12: Rimmy | C12: 371 | D12: 7 | E12: =(C12/D12) -> 53.000 | F12: =ROUNDDOWN(((E12-50)*0.8),0) -> 2 | G12: - | H12: - | I12: 5
A13: =A12+1 -> 10 | B13: Tim Potter | C13: 374 | D13: 7 | E13: =(C13/D13) -> 53.428571428571431 | F13: =ROUNDDOWN(((E13-50)*0.8),0) -> 2 | G13: 59 | H13: 0 | I13: 3
A14: =A13+1 -> 11 | B14: Jim Necessary | C14: 428 | D14: 8 | E14: =(C14/D14) -> 53.500 | F14: =ROUNDDOWN(((E14-50)*0.8),0) -> 2 | G14: 56 | H14: 0 | I14: 5
A15: =A14+1 -> 12 | B15: Stiers | C15: 375 | D15: 7 | E15: =(C15/D15) -> 53.571428571428569 | F15: =ROUNDDOWN(((E15-50)*0.8),0) -> 2 | G15: 54 | H15: 1 | I15: 4
A16: =A15+1 -> 13 | B16: Dan Kern | C16: 430 | D16: 8 | E16: =(C16/D16) -> 53.750 | F16: =ROUNDDOWN(((E16-50)*0.8),0) -> 3 | G16: 56 | H16: 0 | I16: 3
A17: =A16+1 -> 14 | B17: Kollin Grimm | C17: 430 | D17: 8 | E17: =(C17/D17) -> 53.750 | F17: =ROUNDDOWN(((E17-50)*0.8),0) -> 3 | G17: 54 | H17: 0 | I17: 2.5
A18: =A17+1 -> 15 | B18: Andrew Detert | C18: 433 | D18: 8 | E18: =(C18/D18) -> 54.125 | F18: =ROUNDDOWN(((E18-50)*0.8),0) -> 3 | G18: 51 | H18: 1 | I18: 4
A19: =A18+1 -> 16 | B19: Frog | C19: 438 | D19: 8 | E19: =(C19/D19) -> 54.750 | F19: =ROUNDDOWN(((E19-50)*0.8),0) -> 3 | G19: 56 | H19: 0 | I19: 3.5
A20: =A19+1 -> 17 | B20: Nate Veeder | C20: 384 | D20: 7 | E20: =(C20/D20) -> 54.857142857142854 | F20: =ROUNDDOWN(((E20-50)*0.8),0) -> 3 | G20: 53 | H20: 1 | I20: 3.5
A21: =A20+1 -> 18 | B21: Woody | C21: 440 | D21: 8 | E21: =(C21/D21) -> 55.000 | F21: =ROUNDDOWN(((E21-50)*0.8),0) -> 4 | G21: 56 | H21: 0 | I21: 5
A22: =A21+1 -> 19 | B22: Nathan Ciha | C22: 386 | D22: 7 | E22: =(C22/D22) -> 55.142857142857146 | F22: =ROUNDDOWN(((E22-50)*0.8),0) -> 4 | G22: 57 | H22: 0 | I22: 4
A23: =A22+1 -> 20 | B23: Ryan Hamilton | C23: 443 | D23: 8 | E23: =(C23/D23) -> 55.375 | F23: =ROUNDDOWN(((E23-50)*0.8),0) -> 4 | G23: 51 | H23: 1 | I23: 3
A24: =A23+1 -> 21 | B24: Rob Mumma | C24: 222 | D24: 4 | E24: =(C24/D24) -> 55.500 | F24: =ROUNDDOWN(((E24-50)*0.8),0) -> 4 | G24: - | H24: - | I24: 3
A25: =A24+1 -> 22 | B25: Beachy | C25: 446 | D25: 8 | E25: =(C25/D25) -> 55.750 | F25: =ROUNDDOWN(((E25-50)*0.8),0) -> 4 | G25: 53 | H25: 1 | I25: 7
A26: =A25+1 -> 23 | B26: Kurt Conrad | C26: 446 | D26: 8 | E26: =(C26/D26) -> 55.750 | F26: =ROUNDDOWN(((E26-50)*0.8),0) -> 4 | G26: 51 | H26: 1 | I26: 4
A27: 24 | B27: Jesse Sauerbrei | C27: 391 | D27: 7 | E27: =(C27/D27) -> 55.857142857142854 | F27: =ROUNDDOWN(((E27-50)*0.8),0) -> 4 | G27: 55 | H27: 1 | I27: 4
A28: 25 | B28: Utley | C28: 447 | D28: 8 | E28: =(C28/D28) -> 55.875 | F28: =ROUNDDOWN(((E28-50)*0.8),0) -> 4 | G28: 49 | H28: 1 | I28: 4.5
A29: 26 | B29: Adam Karstens | C29: 336 | D29: 6 | E29: =(C29/D29) -> 56.000 | F29: =ROUNDDOWN(((E29-50)*0.8),0) -> 4 | G29: 56 | H29: 1 | I29: 2.5
A30: =A29+1 -> 27 | B30: Travis Pike | C30: 453 | D30: 8 | E30: =(C30/D30) -> 56.625 | F30: =ROUNDDOWN(((E30-50)*0.8),0) -> 5 | G30: 57 | H30: 0 | I30: 2
A31: =A30+1 -> 28 | B31: Shirtless Bill | C31: 453 | D31: 8 | E31: =(C31/D31) -> 56.625 | F31: =ROUNDDOWN(((E31-50)*0.8),0) -> 5 | G31: 54 | H31: 0 | I31: 6
A32: =A31+1 -> 29 | B32: Martin Reis | C32: 454 | D32: 8 | E32: =(C32/D32) -> 56.750 | F32: =ROUNDDOWN(((E32-50)*0.8),0) -> 5 | G32: 53 | H32: 1 | I32: 6
A33: =A32+1 -> 30 | B33: Ryan Eggleston | C33: 399 | D33: 7 | E33: =(C33/D33) -> 57.000 | F33: =ROUNDDOWN(((E33-50)*0.8),0) -> 5 | G33: 60 | H33: 1 | I33: 3
A34: =A33+1 -> 31 | B34: Jesse Streinz | C34: 456 | D34: 8 | E34: =(C34/D34) -> 57.000 | F34: =ROUNDDOWN(((E34-50)*0.8),0) -> 5 | G34: 57 | H34: 1 | I34: 5
A35: =A34+1 -> 32 | B35: Dustin Nohr | C35: 459 | D35: 8 | E35: =(C35/D35) -> 57.375 | F35: =ROUNDDOWN(((E35-50)*0.8),0) -> 5 | G35: 55 | H35: 0 | I35: 2
A36: =A35+1 -> 33 | B36: John Williams | C36: 405 | D36: 7 | E36: =(C36/D36) -> 57.857142857142854 | F36: =ROUNDDOWN(((E36-50)*0.8),0) -> 6 | G36: 57 | H36: 1 | I36: 4.5
A37: =A36+1 -> 34 | B37: Matt Shannon | C37: 464 | D37: 8 | E37: =(C37/D37) -> 58.000 | F37: =ROUNDDOWN(((E37-50)*0.8),0) -> 6 | G37: 60 | H37: 0 | I37: 3
A38: =A37+1 -> 35 | B38: Joel Knutson | C38: 406 | D38: 7 | E38: =(C38/D38) -> 58.000 | F38: =ROUNDDOWN(((E38-50)*0.8),0) -> 6 | G38: 60 | H38: 0 | I38: 4
A39: =A38+1 -> 36 | B39: Dan Lewis | C39: 232 | D39: 4 | E39: =(C39/D39) -> 58.000 | F39: =ROUNDDOWN(((E39-50)*0.8),0) -> 6 | G39: - | H39: - | I39: 2
A40: =A39+1 -> 37 | B40: Matt Fritz | C40: 466 | D40: 8 | E40: =(C40/D40) -> 58.250 | F40: =ROUNDDOWN(((E40-50)*0.8),0) -> 6 | G40: 55 | H40: 1 | I40: 5.5
A41: =A40+1 -> 38 | B41: Phil Campos | C41: 467 | D41: 8 | E41: =(C41/D41) -> 58.375 | F41: =ROUNDDOWN(((E41-50)*0.8),0) -> 6 | G41: 60 | H41: 1 | I41: 2.5
A42: =A41+1 -> 39 | B42: Avg. Joe | C42: 471 | D42: 8 | E42: =(C42/D42) -> 58.875 | F42: =ROUNDDOWN(((E42-50)*0.8),0) -> 7 | G42: 59 | H42: 0 | I42: 3
A43: =A42+1 -> 40 | B43: David McCuskey | C43: 471 | D43: 8 | E43: =(C43/D43) -> 58.875 | F43: =ROUNDDOWN(((E43-50)*0.8),0) -> 7 | G43: 57 | H43: 1 | I43: 3
A44: =A43+1 -> 41 | B44: Darwin Schultz | C44: 118 | D44: 2 | E44: =(C44/D44) -> 59.000 | F44: =ROUNDDOWN(((E44-50)*0.8),0) -> 7 | G44: - | H44: - | I44: 1 | J44: 1
A45: =A44+1 -> 42 | B45: Tim Troyna | C45: 477 | D45: 8 | E45: =(C45/D45) -> 59.625 | F45: =ROUNDDOWN(((E45-50)*0.8),0) -> 7 | G45: 60 | H45: 1 | I45: 4
A46: =A45+1 -> 43 | B46: Justin Zehr | C46: 477 | D46: 8 | E46: =(C46/D46) -> 59.625 | F46: =ROUNDDOWN(((E46-50)*0.8),0) -> 7 | G46: 59 | H46: 1 | I46: 3.5
A47: =A46+1 -> 44 | B47: D. Burns | C47: 477 | D47: 8 | E47: =(C47/D47) -> 59.625 | F47: =ROUNDDOWN(((E47-50)*0.8),0) -> 7 | G47: 58 | H47: 0 | I47: 4
A48: =A47+1 -> 45 | B48: Matt Ross | C48: 299 | D48: 5 | E48: =(C48/D48) -> 59.800 | F48: =ROUNDDOWN(((E48-50)*0.8),0) -> 7 | G48: - | H48: - | I48: 2 | J48: 1
A49: =A48+1 -> 46 | B49: Tom Pepper | C49: 479 | D49: 8 | E49: =(C49/D49) -> 59.875 | F49: =ROUNDDOWN(((E49-50)*0.8),0) -> 7 | G49: 60 | H49: 0 | I49: 3
A50: =A49+1 -> 47 | B50: Shane Thirtyacre | C50: 183 | D50: 3 | E50: =(C50/D50) -> 61.000 | F50: =ROUNDDOWN(((E50-50)*0.8),0) -> 8 | G50: - | H50: - | I50: 2 | J50: 1
A51: =A50+1 -> 48 | B51: Eric Smith | C51: 491 | D51: 8 | E51: =(C51/D51) -> 61.375 | F51: =ROUNDDOWN(((E51-50)*0.8),0) -> 9 | G51: 59 | H51: 1 | I51: 2.5
A52: 49 | B52: Farley | C52: 500 | D52: 8 | E52: =(C52/D52) -> 62.500 | F52: =ROUNDDOWN(((E52-50)*0.8),0) -> 10 | G52: 64 | H52: 0 | I52: 1
A53: 50 | B53: Shawn Hullinger | C53: 438 | D53: 7 | E53: =(C53/D53) -> 62.571428571428569 | F53: =ROUNDDOWN(((E53-50)*0.8),0) -> 10 | G53: 59 | H53: 1 | I53: 3
A54: 51 | B54: Mike O'Neill | C54: 442 | D54: 7 | E54: =(C54/D54) -> 63.142857142857146 | F54: =ROUNDDOWN(((E54-50)*0.8),0) -> 10 | G54: 59 | H54: 1 | I54: 4.5 | J54: 1
A55: 52 | B55: Maker | C55: 506 | D55: 8 | E55: =(C55/D55) -> 63.250 | F55: =ROUNDDOWN(((E55-50)*0.8),0) -> 10 | G55: 63 | H55: 1 | I55: 5
A56: 53 | B56: Spencer Eubanks | C56: 521 | D56: 8 | E56: =(C56/D56) -> 65.125 | F56: =ROUNDDOWN(((E56-50)*0.8),0) -> 12 | G56: 64 | H56: 0 | I56: 1.5
A57: 54 | B57: Brandon Yoder | C57: 470 | D57: 7 | E57: =(C57/D57) -> 67.142857142857139 | F57: =ROUNDDOWN(((E57-50)*0.8),0) -> 13 | G57: 66 | H57: 0 | I57: 5
A58: 55 | B58: John Lambert | C58: 544 | D58: 8 | E58: =(C58/D58) -> 68.000 | F58: =ROUNDDOWN(((E58-50)*0.8),0) -> 14 | G58: 68 | H58: 0 | I58: 3
A59: 56 | B59: Zach Votroubek | C59: 282 | D59: 4 | E59: =(C59/D59) -> 70.500 | F59: =ROUNDDOWN(((E59-50)*0.8),0) -> 16 | G59: - | H59: - | I59: 3
A60: 2011 S.B.D.G.L STANDINGS Through Week 8
A61: Subs | B61: Player | C61: Total Strokes | D61: Weeks | E61: Average | F61: H-Cap | G61: Last | H61: Week Pt. | I61: Total Pts. | J61: Subed For
A62: 1 | B62: Anthony Moody | C62: 365 | D62: 6 | E62: =SUM(C62/D62) -> 60.833333333333336 | F62: =ROUNDDOWN(((E62-50)*0.8),0) -> 8 | G62: 63 | H62: 0 | I62: 1 | J62: lewis
A63: 2 | B63: Chad Goodwin | C63: 345 | D63: 5 | E63: =SUM(C63/D63) -> 69.000 | F63: =ROUNDDOWN(((E63-50)*0.8),0) -> 15 | G63: 73 | H63: 0 | I63: 1 | J63: thirty
A64: 3 | B64: Aaron Porter | C64: 263 | D64: 4 | E64: =SUM(C64/D64) -> 65.750 | F64: =ROUNDDOWN(((E64-50)*0.8),0) -> 12 | G64: 71
A65: =SUM(A64+1) -> 4 | B65: Wade Geary | C65: 179 | D65: 3 | E65: =SUM(C65/D65) -> 59.666666666666664 | F65: =ROUNDDOWN(((E65-50)*0.8),0) -> 7 | G65: 63
A66: =SUM(A65+1) -> 5 | B66: Jason Stroud | C66: 109 | D66: 2 | E66: =SUM(C66/D66) -> 54.500 | F66: 3 | G66: 56 | H66: 0 | I66: 1 | J66: Schultz
A67: 7 | B67: Aaron Killion | C67: 109 | D67: 2 | E67: =SUM(C67/D67) -> 54.500 | F67: =ROUNDDOWN(((E67-50)*0.8),0) -> 3 | G67: 56
A68: 8 | B68: Keith Gudenkauf | C68: 115 | D68: 2 | E68: =SUM(C68/D68) -> 57.500 | F68: =ROUNDDOWN(((E68-50)*0.8),0) -> 6 | G68: 56 | H68: 0 | I68: 1 | J68: Votroubek
A69: 9 | B69: Rob Obrien | C69: 52 | D69: 1 | E69: =SUM(C69/D69) -> 52.000 | F69: 0 | G69: 52
A70: 10 | B70: Bob Hernandez | C70: 53 | D70: 1 | E70: =SUM(C70/D70) -> 53.000 | F70: 0 | G70: 53
A71: 11 | B71: Kurt Conrad | C71: 55 | D71: 1 | E71: =SUM(C71/D71) -> 55.000 | F71: 0 | G71: 55
A72: 11 | B72: Cody Fuller | C72: 58 | D72: 1 | E72: =SUM(C72/D72) -> 58.000 | F72: 0 | G72: 58 | H72: 0
A73: 12 | B73: Eric Vandeusen | C73: 58 | D73: 1 | E73: =SUM(C73/D73) -> 58.000 | F73: 0 | G73: 58
A74: 13 | B74: Max Osby | C74: 64 | D74: 1 | E74: =SUM(C74/D74) -> 64.000 | F74: 0 | G74: 64
A75: 14 | B75: Nate Spencer | C75: 67 | D75: 1 | E75: =SUM(C75/D75) -> 67.000 | F75: 0 | G75: 67
A76: 15 | B76: Matt DaPaepe | C76: 77 | D76: 1 | E76: =SUM(C76/D76) -> 77.000 | F76: 0 | G76: 77
A77: 16 | B77: Andy Johnson | C77: 58 | D77: 1 | E77: =SUM(C77/D77) -> 58.000 | F77: 0 | G77: 58
A78: 17 | B78: Nate Hamilton | C78: 57 | D78: 1 | E78: =SUM(C78/D78) -> 57.000 | F78: 0 | G78: 57
A79: 18 | B79: Joe R | C79: 61 | D79: 1 | E79: =SUM(C79/D79) -> 61.000 | F79: 0 | G79: 61 | H79: 0
A80: 19 | B80: Jesse | C80: 66 | D80: 1 | E80: =SUM(C80/D80) -> 66.000 | F80: 0 | G80: 66 | I80: 0
A81: 20 | B81: Greg Dye | C81: 55 | D81: 1 | E81: =SUM(C81/D81) -> 55.000 | F81: 0 | G81: 55 | H81: 0 | I81: 0 | J81: Mumma
A82: 20 | B82: Kevin Stibal | C82: 63 | D82: 1 | E82: =SUM(C82/D82) -> 63.000 | F82: 0 | G82: 63
A83: 21 | B83: Perry Thirtyacre | C83: 62 | D83: 1 | E83: =SUM(C83/D83) -> 62.000 | F83: 0 | G83: 62
A84: 2011 SBDGL Team Standing
A85: Place | B85: TEAM # | C85: BUSH | E85: Total Points | F85: Team Points | G85: Team Avg
A86: 1 | B86: 23 | C86: AVG JOE/ WIEBEN | E86: 16.5 | F86: 5.5 | G86: =SUM(E42+E7)/2 -> 55.1875
A87: 2 | B87: 7 | C87: FRITZ / KOLLIN GRIMM | E87: 14.5 | F87: 6 | G87: =SUM(E40+E17)/2 -> 56.000
A88: 3 | B88: 5 | C88: ANDREW DETERT / MAKER | E88: 13 | F88: 4 | G88: =SUM(E55+E18)/2 -> 58.6875
A89: 4 | B89: 17 | C89: KVN LAVLEY / ROB MUMMA | E89: 12 | F89: 4 | G89: =SUM(E24+E10)/2 -> 54.000
A90: 5 | B90: 19 | C90: B. HULLINGER / PIKE | E90: 12 | F90: 4 | G90: =SUM(E31+E30)/2 -> 56.625
A91: 6 | B91: 21 | C91: JOEL KNUTSON / YODER | E91: 12 | F91: 4 | G91: =SUM(E38+E57)/2 -> 62.571428571428569
A92: 7 | B92: 13 | C92: D. JOHNSON / S. HULLINGER | E92: 11.5 | F92: 3 | G92: =SUM(E8+E53)/2 -> 57.357142857142861
A93: 8 | B93: 11 | C93: KURT CONRAD / J. SAUERBREI | E93: 11.5 | F93: 3.5 | G93: =SUM(E27+E26 )/2 -> 55.803571428571431
A94: 9 | B94: 15 | C94: TIM TROYNA / J. FARNSWORTH | E94: 11 | F94: 4 | G94: =SUM(E11+E45)/2 -> 56.098214285714285
A95: 10 | B95: 1 | C95: ADAM MILLER / DAN LEWIS | E95: 11 | F95: 3 | G95: =SUM(E9+E39)/2 -> 55.214285714285715
A96: 11 | B96: 3 | C96: DAN KERN / DUSTIN UTLEY | E96: 10.5 | F96: 4 | G96: =SUM(E16+E28)/2 -> 54.8125
A97: 12 | B97: 25 | C97: JOHN LAMBERT / FROG | E97: 10.5 | F97: 3 | G97: =SUM(E19+E58)/2 -> 61.375
A98: 13 | B98: 9 | C98: ERIC SMITH / ADAM STIERS | E98: 8.5 | F98: 2 | G98: =SUM(E51+E15)/2 -> 57.473214285714285
A99: 14 | B99: 27 | C99: S. EUBANKS / JESSE STRIENZ | E99: 7.5 | F99: 2 | G99: =SUM(E34+E56)/2 -> 61.0625
C100: WHACKER
A101: 1 | B101: 10 | C101: WOODY / BEACHY | E101: 19 | F101: 7 | G101: =SUM(E21+E25)/2 -> 55.375
A102: 2 | B102: 18 | C102: NATE VEEDER / RIMMY | E102: 15.5 | F102: 6 | G102: =SUM(E12+E20)/2 -> 53.928571428571431
A103: 3 | B103: 14 | C103: NATHAN CHIA / D BURNS | E103: 14 | F103: 5 | G103: =SUM(E22+E47)/2 -> 57.383928571428569
A104: 4 | B104: 20 | C104: TIM PEYTON / MATT SHANNON | E104: 14 | F104: 4.5 | G104: =SUM(E6+E37)/2 -> 54.750
A105: 5 | B105: 12 | C105: TIM POTTER / JOHN WILLIAMS | E105: 13 | F105: 5.5 | G105: =SUM(E13+E36)/2 -> 55.642857142857139
A106: 6 | B106: 6 | C106: DAVID MCCUSKY / J. NECESSARY | E106: 12 | F106: 4 | G106: =SUM(E14+E43)/2 -> 56.1875
A107: 7 | B107: 8 | C107: MARTIN REIS / PHIL CAMPOS | E107: 12 | F107: 3.5 | G107: =SUM(E41+E32)/2 -> 57.5625
A108: 8 | B108: 26 | C108: JUSTIN ZIER / TOM PEPPER | E108: 10.5 | F108: 4 | G108: =SUM(E49+E46)/2 -> 59.750
A109: 9 | B109: 28 | C109: MIKE O'NIELL / DUSITN NOHR | E109: 10.5 | F109: 4 | G109: =SUM(E54+E35)/2 -> 60.258928571428569
A110: 10 | B110: 4 | C110: ANDREW GRECO / A. CHITTENDEN | E110: 10 | F110: 3 | G110: =SUM(E5+E52)/2 -> 56.750
A111: 11 | B111: 22 | C111: S. THIRTYACRE / R. HAMILTON | E111: 9.5 | F111: 3.5 | G111: =SUM(E50+E23)/2 -> 58.1875
A112: 12 | B112: 2 | C112: A. KARSTENS / R. EGGLESTON | E112: 9.5 | F112: 3 | G112: =SUM(E33+E29)/2 -> 56.500
A113: 13 | B113: 16 | C113: MATT ROSS / DOUG PEYTON | E113: 9 | F113: 3 | G113: =SUM(E4+E48)/2 -> 55.274999999999999
A114: 14 | B114: 24 | C114: D. SCHULTZ / Z. VOTROUBEK | E114: 7 | F114: 2 | G114: =SUM(E59+E44)/2 -> 64.750