A1: 2011 S.B.D.G.L. STANDINGS Through Week 10
A2: Rank | B2: Player | C2: Total Strokes | D2: Weeks | E2: Average | F2: H-Cap | G2: Last | H2: Week Pt. | I2: Total Pts. | J2: Sub Points
A4: =A3+1 -> 1 | B4: Doug Peyton | C4: 203 | D4: 4 | E4: =(C4/D4) -> 50.750 | F4: =ROUNDDOWN(((E4-50)*0.8),0) -> 0 | G4: - | H4: - | I4: 3
A5: =A4+1 -> 2 | B5: Greco | C5: 510 | D5: 10 | E5: =(C5/D5) -> 51.000 | F5: =ROUNDDOWN(((E5-50)*0.8),0) -> 0 | G5: 48 | H5: 1 | I5: 6
A6: =A5+1 -> 3 | B6: Matt Wieben | C6: 514 | D6: 10 | E6: =(C6/D6) -> 51.400 | F6: =ROUNDDOWN(((E6-50)*0.8),0) -> 1 | G6: 49 | H6: 0.5 | I6: 9.5
A7: =A6+1 -> 4 | B7: Tim Peyton | C7: 517 | D7: 10 | E7: =(C7/D7) -> 51.700 | F7: =ROUNDDOWN(((E7-50)*0.8),0) -> 1 | G7: 51 | H7: 0 | I7: 6.5
A8: =A7+1 -> 5 | B8: KVN Lavley | C8: 521 | D8: 10 | E8: =(C8/D8) -> 52.100 | F8: =ROUNDDOWN(((E8-50)*0.8),0) -> 1 | G8: 48 | H8: 1 | I8: 7
A9: =A8+1 -> 6 | B9: Doug Johnson | C9: 475 | D9: 9 | E9: =(C9/D9) -> 52.777777777777779 | F9: =ROUNDDOWN(((E9-50)*0.8),0) -> 2 | G9: 57 | H9: 0.5 | I9: 6
A10: =A9+1 -> 7 | B10: Jeremy Farnsworth | C10: 475 | D10: 9 | E10: =(C10/D10) -> 52.777777777777779 | F10: =ROUNDDOWN(((E10-50)*0.8),0) -> 2 | G10: 49 | H10: 0 | I10: 3
A11: =A10+1 -> 8 | B11: Rimmy | C11: 476 | D11: 9 | E11: =(C11/D11) -> 52.888888888888886 | F11: =ROUNDDOWN(((E11-50)*0.8),0) -> 2 | G11: 49 | H11: 0 | I11: 6
A12: =A11+1 -> 9 | B12: Adam Miller | C12: 478 | D12: 9 | E12: =(C12/D12) -> 53.111111111111114 | F12: =ROUNDDOWN(((E12-50)*0.8),0) -> 2 | G12: 58 | H12: 0.5 | I12: 7.5
A13: =A12+1 -> 10 | B13: Dan Kern | C13: 532 | D13: 10 | E13: =(C13/D13) -> 53.200 | F13: =ROUNDDOWN(((E13-50)*0.8),0) -> 2 | G13: 50 | H13: 0.5 | I13: 4.5
A14: =A13+1 -> 11 | B14: Jim Necessary | C14: 481 | D14: 9 | E14: =(C14/D14) -> 53.444444444444443 | F14: =ROUNDDOWN(((E14-50)*0.8),0) -> 2 | G14: - | H14: - | I14: 5
A15: =A14+1 -> 12 | B15: Kollin Grimm | C15: 538 | D15: 10 | E15: =(C15/D15) -> 53.800 | F15: =ROUNDDOWN(((E15-50)*0.8),0) -> 3 | G15: 50 | H15: 1 | I15: 4.5
A16: =A15+1 -> 13 | B16: Frog | C16: 544 | D16: 10 | E16: =(C16/D16) -> 54.400 | F16: =ROUNDDOWN(((E16-50)*0.8),0) -> 3 | G16: 52 | H16: 1 | I16: 5.5
A17: =A16+1 -> 14 | B17: Tim Potter | C17: 490 | D17: 9 | E17: =(C17/D17) -> 54.444444444444443 | F17: =ROUNDDOWN(((E17-50)*0.8),0) -> 3 | G17: 58 | H17: 1 | I17: 5
A18: =A17+1 -> 15 | B18: Stiers | C18: 490 | D18: 9 | E18: =(C18/D18) -> 54.444444444444443 | F18: =ROUNDDOWN(((E18-50)*0.8),0) -> 3 | G18: 56 | H18: 0 | I18: 4
A19: =A18+1 -> 16 | B19: Andrew Detert | C19: 545 | D19: 10 | E19: =(C19/D19) -> 54.500 | F19: =ROUNDDOWN(((E19-50)*0.8),0) -> 3 | G19: 59 | H19: 1 | I19: 6
A20: =A19+1 -> 17 | B20: Nate Veeder | C20: 493 | D20: 9 | E20: =(C20/D20) -> 54.777777777777779 | F20: =ROUNDDOWN(((E20-50)*0.8),0) -> 3 | G20: 56 | H20: 0 | I20: 4.5
A21: =A20+1 -> 18 | B21: Woody | C21: 550 | D21: 10 | E21: =(C21/D21) -> 55.000 | F21: =ROUNDDOWN(((E21-50)*0.8),0) -> 4 | G21: 50 | H21: 1 | I21: 6
A22: =A21+1 -> 19 | B22: Kurt Conrad | C22: 495 | D22: 9 | E22: =(C22/D22) -> 55.000 | F22: =ROUNDDOWN(((E22-50)*0.8),0) -> 4 | G22: 49 | H22: 1 | I22: 5
A23: =A22+1 -> 20 | B23: Ryan Hamilton | C23: 551 | D23: 10 | E23: =(C23/D23) -> 55.100 | F23: =ROUNDDOWN(((E23-50)*0.8),0) -> 4 | G23: 55 | H23: 1 | I23: 5
A24: =A23+1 -> 21 | B24: Adam Karstens | C24: 443 | D24: 8 | E24: =(C24/D24) -> 55.375 | F24: =ROUNDDOWN(((E24-50)*0.8),0) -> 4 | G24: 53 | H24: 1 | I24: 4.5
A25: =A24+1 -> 22 | B25: Rob Mumma | C25: 222 | D25: 4 | E25: =(C25/D25) -> 55.500 | F25: =ROUNDDOWN(((E25-50)*0.8),0) -> 4 | G25: - | H25: - | I25: 3
A26: =A25+1 -> 23 | B26: Beachy | C26: 555 | D26: 10 | E26: =(C26/D26) -> 55.500 | F26: =ROUNDDOWN(((E26-50)*0.8),0) -> 4 | G26: 54 | H26: 1 | I26: 9
A27: 24 | B27: Nathan Ciha | C27: 446 | D27: 8 | E27: =(C27/D27) -> 55.750 | F27: =ROUNDDOWN(((E27-50)*0.8),0) -> 4 | G27: 60 | H27: 0 | I27: 4
A28: 25 | B28: Utley | C28: 559 | D28: 10 | E28: =(C28/D28) -> 55.900 | F28: =ROUNDDOWN(((E28-50)*0.8),0) -> 4 | G28: 53 | H28: 1 | I28: 6.5
A29: 26 | B29: Jesse Sauerbrei | C29: 448 | D29: 8 | E29: =(C29/D29) -> 56.000 | F29: =ROUNDDOWN(((E29-50)*0.8),0) -> 4 | G29: - | H29: - | I29: 4.5
A30: =A29+1 -> 27 | B30: Martin Reis | C30: 564 | D30: 10 | E30: =(C30/D30) -> 56.400 | F30: =ROUNDDOWN(((E30-50)*0.8),0) -> 5 | G30: 53 | H30: 1 | I30: 7
A31: =A30+1 -> 28 | B31: Shirtless Bill | C31: 571 | D31: 10 | E31: =(C31/D31) -> 57.100 | F31: =ROUNDDOWN(((E31-50)*0.8),0) -> 5 | G31: 55 | H31: 0 | I31: 7
A32: =A31+1 -> 29 | B32: Jesse Streinz | C32: 573 | D32: 10 | E32: =(C32/D32) -> 57.300 | F32: =ROUNDDOWN(((E32-50)*0.8),0) -> 5 | G32: 57 | H32: 0 | I32: 5
A33: =A32+1 -> 30 | B33: Dustin Nohr | C33: 574 | D33: 10 | E33: =(C33/D33) -> 57.400 | F33: =ROUNDDOWN(((E33-50)*0.8),0) -> 5 | G33: 54 | H33: 0 | I33: 2
A34: =A33+1 -> 31 | B34: Travis Pike | C34: 577 | D34: 10 | E34: =(C34/D34) -> 57.700 | F34: =ROUNDDOWN(((E34-50)*0.8),0) -> 6 | G34: 62 | H34: 0 | I34: 2
A35: =A34+1 -> 32 | B35: Matt Fritz | C35: 579 | D35: 10 | E35: =(C35/D35) -> 57.900 | F35: =ROUNDDOWN(((E35-50)*0.8),0) -> 6 | G35: 55 | H35: 1 | I35: 6.5
A36: =A35+1 -> 33 | B36: Dan Lewis | C36: 232 | D36: 4 | E36: =(C36/D36) -> 58.000 | F36: =ROUNDDOWN(((E36-50)*0.8),0) -> 6 | G36: - | H36: - | I36: 2
A37: =A36+1 -> 34 | B37: Matt Shannon | C37: 584 | D37: 10 | E37: =(C37/D37) -> 58.400 | F37: =ROUNDDOWN(((E37-50)*0.8),0) -> 6 | G37: 56 | H37: 0 | I37: 4
A38: =A37+1 -> 35 | B38: Joel Knutson | C38: 469 | D38: 8 | E38: =(C38/D38) -> 58.625 | F38: =ROUNDDOWN(((E38-50)*0.8),0) -> 6 | G38: - | H38: - | I38: 5
A39: =A38+1 -> 36 | B39: Avg. Joe | C39: 587 | D39: 10 | E39: =(C39/D39) -> 58.700 | F39: =ROUNDDOWN(((E39-50)*0.8),0) -> 6 | G39: 58 | H39: 0 | I39: 4
A40: =A39+1 -> 37 | B40: Phil Campos | C40: 587 | D40: 10 | E40: =(C40/D40) -> 58.700 | F40: =ROUNDDOWN(((E40-50)*0.8),0) -> 6 | G40: 55 | H40: 1 | I40: 3.5
A41: =A40+1 -> 38 | B41: Ryan Eggleston | C41: 529 | D41: 9 | E41: =(C41/D41) -> 58.777777777777779 | F41: =ROUNDDOWN(((E41-50)*0.8),0) -> 7 | G41: 63 | H41: 0 | I41: 3
A42: =A41+1 -> 39 | B42: Darwin Schultz | C42: 118 | D42: 2 | E42: =(C42/D42) -> 59.000 | F42: =ROUNDDOWN(((E42-50)*0.8),0) -> 7 | G42: - | H42: - | I42: 1 | J42: 1
A43: =A42+1 -> 40 | B43: David McCuskey | C43: 532 | D43: 9 | E43: =(C43/D43) -> 59.111111111111114 | F43: =ROUNDDOWN(((E43-50)*0.8),0) -> 7 | G43: 61 | H43: 0 | I43: 3
A44: =A43+1 -> 41 | B44: John Williams | C44: 532 | D44: 9 | E44: =(C44/D44) -> 59.111111111111114 | F44: =ROUNDDOWN(((E44-50)*0.8),0) -> 7 | G44: 60 | H44: 1 | I44: 5.5
A45: =A44+1 -> 42 | B45: Tim Troyna | C45: 534 | D45: 9 | E45: =(C45/D45) -> 59.333333333333336 | F45: =ROUNDDOWN(((E45-50)*0.8),0) -> 7 | G45: 57 | H45: 1 | I45: 5
A46: =A45+1 -> 43 | B46: D. Burns | C46: 594 | D46: 10 | E46: =(C46/D46) -> 59.400 | F46: =ROUNDDOWN(((E46-50)*0.8),0) -> 7 | G46: 57 | H46: 1 | I46: 5.5
A47: =A46+1 -> 44 | B47: Justin Zehr | C47: 538 | D47: 9 | E47: =(C47/D47) -> 59.777777777777779 | F47: =ROUNDDOWN(((E47-50)*0.8),0) -> 7 | G47: - | H47: - | I47: 3.5
A48: =A47+1 -> 45 | B48: Matt Ross | C48: 299 | D48: 5 | E48: =(C48/D48) -> 59.800 | F48: =ROUNDDOWN(((E48-50)*0.8),0) -> 7 | G48: - | H48: - | I48: 2 | J48: 1
A49: =A48+1 -> 46 | B49: Tom Pepper | C49: 601 | D49: 10 | E49: =(C49/D49) -> 60.100 | F49: =ROUNDDOWN(((E49-50)*0.8),0) -> 8 | G49: 61 | H49: 0 | I49: 3
A50: =A49+1 -> 47 | B50: Shane Thirtyacre | C50: 242 | D50: 4 | E50: =(C50/D50) -> 60.500 | F50: =ROUNDDOWN(((E50-50)*0.8),0) -> 8 | G50: 59 | H50: 1 | I50: 3 | J50: 1
A51: =A50+1 -> 48 | B51: Eric Smith | C51: 616 | D51: 10 | E51: =(C51/D51) -> 61.600 | F51: =ROUNDDOWN(((E51-50)*0.8),0) -> 9 | G51: 60 | H51: 1 | I51: 4.5
A52: 49 | B52: Farley | C52: 627 | D52: 10 | E52: =(C52/D52) -> 62.700 | F52: =ROUNDDOWN(((E52-50)*0.8),0) -> 10 | G52: 63 | H52: 1 | I52: 3
A53: 50 | B53: Shawn Hullinger | C53: 565 | D53: 9 | E53: =(C53/D53) -> 62.777777777777779 | F53: =ROUNDDOWN(((E53-50)*0.8),0) -> 10 | G53: 60 | H53: 0 | I53: 4
A54: 51 | B54: Mike O'Neill | C54: 567 | D54: 9 | E54: =(C54/D54) -> 63.000 | F54: =ROUNDDOWN(((E54-50)*0.8),0) -> 10 | G54: 61 | H54: 1 | I54: 6 | J54: 1
A55: 52 | B55: Maker | C55: 635 | D55: 10 | E55: =(C55/D55) -> 63.500 | F55: =ROUNDDOWN(((E55-50)*0.8),0) -> 10 | G55: 57 | H55: 1 | I55: 7
A56: 53 | B56: Spencer Eubanks | C56: 644 | D56: 10 | E56: =(C56/D56) -> 64.400 | F56: =ROUNDDOWN(((E56-50)*0.8),0) -> 11 | G56: 62 | H56: 0.5 | I56: 3
A57: 54 | B57: Brandon Yoder | C57: 540 | D57: 8 | E57: =(C57/D57) -> 67.500 | F57: =ROUNDDOWN(((E57-50)*0.8),0) -> 14 | G57: 70 | H57: 0 | I57: 5
A58: 55 | B58: John Lambert | C58: 677 | D58: 10 | E58: =(C58/D58) -> 67.700 | F58: =ROUNDDOWN(((E58-50)*0.8),0) -> 14 | G58: 65 | H58: 0.5 | I58: 4
A59: 56 | B59: Zach Votroubek | C59: 282 | D59: 4 | E59: =(C59/D59) -> 70.500 | F59: =ROUNDDOWN(((E59-50)*0.8),0) -> 16 | G59: - | H59: - | I59: 3
A60: 2011 S.B.D.G.L STANDINGS Through Week 10
A61: Subs | B61: Player | C61: Total Strokes | D61: Weeks | E61: Average | F61: H-Cap | G61: Last | H61: Week Pt. | I61: Total Pts. | J61: Subed For
A62: 1 | B62: Anthony Moody | C62: 487 | D62: 8 | E62: =SUM(C62/D62) -> 60.875 | F62: =ROUNDDOWN(((E62-50)*0.8),0) -> 8 | G62: 58 | H62: 1 | I62: 2 | J62: lewis
A63: 2 | B63: Chad Goodwin | C63: 345 | D63: 5 | E63: =SUM(C63/D63) -> 69.000 | F63: =ROUNDDOWN(((E63-50)*0.8),0) -> 15 | G63: 73 | I63: 1
A64: 3 | B64: Aaron Porter | C64: 263 | D64: 4 | E64: =SUM(C64/D64) -> 65.750 | F64: =ROUNDDOWN(((E64-50)*0.8),0) -> 12 | G64: 71
A65: =SUM(A64+1) -> 4 | B65: Wade Geary | C65: 179 | D65: 3 | E65: =SUM(C65/D65) -> 59.666666666666664 | F65: =ROUNDDOWN(((E65-50)*0.8),0) -> 7 | G65: 63
A66: =SUM(A65+1) -> 5 | B66: Jason Stroud | C66: 170 | D66: 3 | E66: =SUM(C66/D66) -> 56.666666666666664 | F66: 3 | G66: 61 | I66: 2
A67: 7 | B67: Aaron Killion | C67: 235 | D67: 4 | E67: =SUM(C67/D67) -> 58.750 | F67: =ROUNDDOWN(((E67-50)*0.8),0) -> 7 | G67: 55 | H67: 0 | I67: 0 | J67: necessary
A68: 8 | B68: Keith Gudenkauf | C68: 165 | D68: 3 | E68: =SUM(C68/D68) -> 55.000 | F68: =ROUNDDOWN(((E68-50)*0.8),0) -> 4 | G68: 50 | H68: 1 | I68: 2 | J68: zehr
A69: 9 | B69: Rob Obrien | C69: 52 | D69: 1 | E69: =SUM(C69/D69) -> 52.000 | F69: 0 | G69: 52
A70: 10 | B70: Bob Hernandez | C70: 53 | D70: 1 | E70: =SUM(C70/D70) -> 53.000 | F70: 0 | G70: 53
A71: 11 | B71: Kurt Conrad | C71: 55 | D71: 1 | E71: =SUM(C71/D71) -> 55.000 | F71: 0 | G71: 55
A72: 11 | B72: Cody Fuller | C72: 58 | D72: 1 | E72: =SUM(C72/D72) -> 58.000 | F72: 0 | G72: 58
A73: 12 | B73: Eric Vandeusen | C73: 58 | D73: 1 | E73: =SUM(C73/D73) -> 58.000 | F73: 0 | G73: 58
A74: 13 | B74: Max Osby | C74: 64 | D74: 1 | E74: =SUM(C74/D74) -> 64.000 | F74: 0 | G74: 64
A75: 14 | B75: Nate Spencer | C75: 67 | D75: 1 | E75: =SUM(C75/D75) -> 67.000 | F75: 0 | G75: 67
A76: 15 | B76: Matt DaPaepe | C76: 77 | D76: 1 | E76: =SUM(C76/D76) -> 77.000 | F76: 0 | G76: 77
A77: 16 | B77: Andy Johnson | C77: 58 | D77: 1 | E77: =SUM(C77/D77) -> 58.000 | F77: 0 | G77: 58
A78: 17 | B78: Nate Hamilton | C78: 57 | D78: 1 | E78: =SUM(C78/D78) -> 57.000 | F78: 0 | G78: 57
A79: 18 | B79: Joe R | C79: 61 | D79: 1 | E79: =SUM(C79/D79) -> 61.000 | F79: 0 | G79: 61
A80: 19 | B80: Jesse | C80: 66 | D80: 1 | E80: =SUM(C80/D80) -> 66.000 | F80: 0 | G80: 66 | I80: 0
A81: 20 | B81: Greg Dye | C81: 110 | D81: 2 | E81: =SUM(C81/D81) -> 55.000 | F81: =ROUNDDOWN(((E81-50)*0.8),0) -> 4 | G81: 55 | H81: 0 | I81: 0 | J81: mumma
A82: 20 | B82: Kevin Stibal | C82: 63 | D82: 1 | E82: =SUM(C82/D82) -> 63.000 | F82: 0 | G82: 63
A83: 21 | B83: Perry Thirtyacre | C83: 62 | D83: 1 | E83: =SUM(C83/D83) -> 62.000 | F83: 0 | G83: 62
A84: 2011 SBDGL Team Standing
A85: Place | B85: TEAM # | C85: BUSH | E85: Total Points | F85: Team Points | G85: Team Avg
A86: 1 | B86: 23 | C86: AVG JOE/ WIEBEN | E86: 20 | F86: 6.5 | G86: =SUM(E39+E6)/2 -> 55.050
A87: 2 | B87: 7 | C87: FRITZ / KOLLIN GRIMM | E87: 19 | F87: 7.5 | G87: =SUM(E35+E15)/2 -> 55.850
A88: 3 | B88: 5 | C88: ANDREW DETERT / MAKER | E88: 19 | F88: 6 | G88: =SUM(E55+E19)/2 -> 59.000
A89: 4 | B89: 3 | C89: DAN KERN / DUSTIN UTLEY | E89: 18 | F89: 7 | G89: =SUM(E13+E28)/2 -> 54.550
A90: 5 | B90: 25 | C90: JOHN LAMBERT / FROG | E90: 15.5 | F90: 5 | G90: =SUM(E58+E16)/2 -> 61.050
A91: 6 | B91: 17 | C91: KVN LAVLEY / ROB MUMMA | E91: 15 | F91: 5 | G91: =SUM(E25+E8)/2 -> 53.800
A92: 7 | B92: 11 | C92: KURT CONRAD / J. SAUERBREI | E92: 15 | F92: 4.5 | G92: =SUM(E22+E29)/2 -> 55.500
A93: 8 | B93: 1 | C93: ADAM MILLER / DAN LEWIS | E93: 15 | F93: 4.5 | G93: =SUM(E12+E62 )/2 -> 56.993055555555557
A94: 9 | B94: 13 | C94: D. JOHNSON / S. HULLINGER | E94: 15 | F94: 4 | G94: =SUM(E9+E53)/2 -> 57.777777777777779
A95: 10 | B95: 19 | C95: B. HULLINGER / PIKE | E95: 14 | F95: 5 | G95: =SUM(E31+E34)/2 -> 57.400
A96: 11 | B96: 21 | C96: JOEL KNUTSON / YODER | E96: 14 | F96: 5 | G96: =SUM(E57+E38)/2 -> 63.0625
A97: 12 | B97: 15 | C97: TIM TROYNA / J. FARNSWORTH | E97: 13 | F97: 5 | G97: =SUM(E45+E10)/2 -> 56.055555555555557
A98: 13 | B98: 9 | C98: ERIC SMITH / ADAM STIERS | E98: 11.5 | F98: 3 | G98: =SUM(E18+E51)/2 -> 58.022222222222226
A99: 14 | B99: 27 | C99: S. EUBANKS / JESSE STRIENZ | E99: 11 | F99: 3 | G99: =SUM(E32+E56)/2 -> 60.850
C100: WHACKER
A101: 1 | B101: 10 | C101: WOODY / BEACHY | E101: 23.5 | F101: 8.5 | G101: =SUM(E21+E26)/2 -> 55.250
A102: 2 | B102: 18 | C102: NATE VEEDER / RIMMY | E102: 18.5 | F102: 7 | G102: =SUM(E20+E11)/2 -> 53.833333333333329
A103: 3 | B103: 12 | C103: TIM POTTER / JOHN WILLIAMS | E103: 17 | F103: 6.5 | G103: =SUM(E17+E44)/2 -> 56.777777777777779
A104: 4 | B104: 20 | C104: TIM PEYTON / MATT SHANNON | E104: 16 | F104: 5.5 | G104: =SUM(E7+E37)/2 -> 55.050
A105: 5 | B105: 14 | C105: NATHAN CHIA / D BURNS | E105: 16 | F105: 5.5 | G105: =SUM(E27+E46)/2 -> 57.575000000000003
A106: 6 | B106: 8 | C106: MARTIN REIS / PHIL CAMPOS | E106: 15 | F106: 4.5 | G106: =SUM(E30+E40)/2 -> 57.550
A107: 7 | B107: 4 | C107: ANDREW GRECO / A. CHITTENDEN | E107: 14.5 | F107: 4.5 | G107: =SUM(E5+E52)/2 -> 56.850
A108: 8 | B108: 22 | C108: S. THIRTYACRE / R. HAMILTON | E108: 13.5 | F108: 4.5 | G108: =SUM(E23+E50)/2 -> 57.800
A109: 9 | B109: 26 | C109: JUSTIN ZEHR / TOM PEPPER | E109: 12.5 | F109: 5 | G109: =SUM(E49+E47)/2 -> 59.93888888888889
A110: 10 | B110: 6 | C110: DAVID MCCUSKY / J. NECESSARY | E110: 12 | F110: 4 | G110: =SUM(E14+E43)/2 -> 56.277777777777779
A111: 11 | B111: 28 | C111: MIKE O'NIELL / DUSITN NOHR | E111: 12 | F111: 4 | G111: =SUM(E54+E33)/2 -> 60.200
A112: 12 | B112: 2 | C112: A. KARSTENS / R. EGGLESTON | E112: 12 | F112: 3.5 | G112: =SUM(E24+E41)/2 -> 57.076388888888886
A113: 13 | B113: 16 | C113: MATT ROSS / DOUG PEYTON | E113: 9 | F113: 3 | G113: =SUM(E48+E4)/2 -> 55.274999999999999
A114: 14 | B114: 24 | C114: D. SCHULTZ / Z. VOTROUBEK | E114: 7 | F114: 2 | G114: =SUM(E59+E42)/2 -> 64.750