A1: 2011 S.B.D.G.L. STANDINGS Through Week 13
A2: Rank | B2: Player | C2: Total Strokes | D2: Weeks | E2: Average | F2: H-Cap | G2: Last | H2: Week Pt. | I2: Total Pts. | J2: Sub Points
A4: =A3+1 -> 1 | B4: Doug Peyton | C4: 203 | D4: 4 | E4: =(C4/D4) -> 50.750 | F4: =ROUNDDOWN(((E4-50)*0.8),0) -> 0 | I4: 3
A5: =A4+1 -> 2 | B5: Tim Peyton | C5: 661 | D5: 13 | E5: =(C5/D5) -> 50.846153846153847 | F5: =ROUNDDOWN(((E5-50)*0.8),0) -> 0 | G5: 50 | H5: 1 | I5: 9.5
A6: =A5+1 -> 3 | B6: Greco | C6: 668 | D6: 13 | E6: =(C6/D6) -> 51.384615384615387 | F6: =ROUNDDOWN(((E6-50)*0.8),0) -> 1 | G6: 55 | H6: 0 | I6: 6.5
A7: =A6+1 -> 4 | B7: Matt Wieben | C7: 669 | D7: 13 | E7: =(C7/D7) -> 51.46153846153846 | F7: =ROUNDDOWN(((E7-50)*0.8),0) -> 1 | G7: 52 | H7: 1 | I7: 11.5
A8: =A7+1 -> 5 | B8: KVN Lavley | C8: 677 | D8: 13 | E8: =(C8/D8) -> 52.07692307692308 | F8: =ROUNDDOWN(((E8-50)*0.8),0) -> 1 | G8: 53 | H8: 0 | I8: 8
A9: =A8+1 -> 6 | B9: Adam Miller | C9: 637 | D9: 12 | E9: =(C9/D9) -> 53.083333333333336 | F9: =ROUNDDOWN(((E9-50)*0.8),0) -> 2 | G9: 57 | H9: 0 | I9: 8.5
A10: =A9+1 -> 7 | B10: Jim Necessary | C10: 532 | D10: 10 | E10: =(C10/D10) -> 53.200 | F10: =ROUNDDOWN(((E10-50)*0.8),0) -> 2 | G10: 51 | H10: 1 | I10: 6
A11: =A10+1 -> 8 | B11: Jeremy Farnsworth | C11: 639 | D11: 12 | E11: =(C11/D11) -> 53.250 | F11: =ROUNDDOWN(((E11-50)*0.8),0) -> 2 | G11: 55 | H11: 1 | I11: 5
A12: =A11+1 -> 9 | B12: Rimmy | C12: 647 | D12: 12 | E12: =(C12/D12) -> 53.916666666666664 | F12: =ROUNDDOWN(((E12-50)*0.8),0) -> 3 | G12: 58 | H12: 0 | I12: 7
A13: =A12+1 -> 10 | B13: Doug Johnson | C13: 647 | D13: 12 | E13: =(C13/D13) -> 53.916666666666664 | F13: =ROUNDDOWN(((E13-50)*0.8),0) -> 3 | G13: 57 | H13: 1 | I13: 7
A14: =A13+1 -> 11 | B14: Andrew Detert | C14: 648 | D14: 12 | E14: =(C14/D14) -> 54.000 | F14: =ROUNDDOWN(((E14-50)*0.8),0) -> 3 | I14: 8
A15: =A14+1 -> 12 | B15: Kollin Grimm | C15: 702 | D15: 13 | E15: =(C15/D15) -> 54.000 | F15: =ROUNDDOWN(((E15-50)*0.8),0) -> 3 | G15: 53 | H15: 1 | I15: 6.5
A16: =A15+1 -> 13 | B16: Kurt Conrad | C16: 650 | D16: 12 | E16: =(C16/D16) -> 54.166666666666664 | F16: =ROUNDDOWN(((E16-50)*0.8),0) -> 3 | G16: 53 | H16: 1 | I16: 8
A17: =A16+1 -> 14 | B17: Dan Kern | C17: 706 | D17: 13 | E17: =(C17/D17) -> 54.307692307692307 | F17: =ROUNDDOWN(((E17-50)*0.8),0) -> 3 | G17: 54 | H17: 0 | I17: 4.5
A18: =A17+1 -> 15 | B18: Stiers | C18: 601 | D18: 11 | E18: =(C18/D18) -> 54.636363636363633 | F18: =ROUNDDOWN(((E18-50)*0.8),0) -> 3 | I18: 5
A19: =A18+1 -> 16 | B19: Beachy | C19: 711 | D19: 13 | E19: =(C19/D19) -> 54.692307692307693 | F19: =ROUNDDOWN(((E19-50)*0.8),0) -> 3 | G19: 56 | H19: 0 | I19: 11
A20: =A19+1 -> 17 | B20: Ryan Hamilton | C20: 713 | D20: 13 | E20: =(C20/D20) -> 54.846153846153847 | F20: =ROUNDDOWN(((E20-50)*0.8),0) -> 3 | G20: 54 | H20: 0 | I20: 6.5
A21: =A20+1 -> 18 | B21: Nate Veeder | C21: 661 | D21: 12 | E21: =(C21/D21) -> 55.083333333333336 | F21: =ROUNDDOWN(((E21-50)*0.8),0) -> 4 | G21: 56 | H21: 1 | I21: 6.5
A22: =A21+1 -> 19 | B22: Woody | C22: 717 | D22: 13 | E22: =(C22/D22) -> 55.153846153846153 | F22: =ROUNDDOWN(((E22-50)*0.8),0) -> 4 | G22: 52 | H22: 1 | I22: 9
A23: =A22+1 -> 20 | B23: Frog | C23: 607 | D23: 11 | E23: =(C23/D23) -> 55.18181818181818 | F23: =ROUNDDOWN(((E23-50)*0.8),0) -> 4 | I23: 6.5
A24: =A23+1 -> 21 | B24: Tim Potter | C24: 664 | D24: 12 | E24: =(C24/D24) -> 55.333333333333336 | F24: =ROUNDDOWN(((E24-50)*0.8),0) -> 4 | G24: 57 | H24: 1 | I24: 6
A25: =A24+1 -> 22 | B25: Rob Mumma | C25: 222 | D25: 4 | E25: =(C25/D25) -> 55.500 | F25: =ROUNDDOWN(((E25-50)*0.8),0) -> 4 | I25: 3
A26: =A25+1 -> 23 | B26: Adam Karstens | C26: 611 | D26: 11 | E26: =(C26/D26) -> 55.545454545454547 | F26: =ROUNDDOWN(((E26-50)*0.8),0) -> 4 | G26: 56 | H26: 0 | I26: 5.5
A27: 24 | B27: Utley | C27: 726 | D27: 13 | E27: =(C27/D27) -> 55.846153846153847 | F27: =ROUNDDOWN(((E27-50)*0.8),0) -> 4 | G27: 58 | H27: 0 | I27: 8.5
A28: 25 | B28: Jesse Sauerbrei | C28: 615 | D28: 11 | E28: =(C28/D28) -> 55.909090909090907 | F28: =ROUNDDOWN(((E28-50)*0.8),0) -> 4 | G28: 55 | H28: 1 | I28: 6.5
A29: 26 | B29: Martin Reis | C29: 729 | D29: 13 | E29: =(C29/D29) -> 56.07692307692308 | F29: =ROUNDDOWN(((E29-50)*0.8),0) -> 4 | G29: 55 | H29: 1 | I29: 9
A30: =A29+1 -> 27 | B30: Shirtless Bill | C30: 739 | D30: 13 | E30: =(C30/D30) -> 56.846153846153847 | F30: =ROUNDDOWN(((E30-50)*0.8),0) -> 5 | G30: 56 | H30: 1 | I30: 10
A31: =A30+1 -> 28 | B31: Joel Knutson | C31: 630 | D31: 11 | E31: =(C31/D31) -> 57.272727272727273 | F31: =ROUNDDOWN(((E31-50)*0.8),0) -> 5 | G31: 61 | H31: 0 | I31: 7
A32: =A31+1 -> 29 | B32: Matt Fritz | C32: 745 | D32: 13 | E32: =(C32/D32) -> 57.307692307692307 | F32: =ROUNDDOWN(((E32-50)*0.8),0) -> 5 | G32: 59 | H32: 0 | I32: 7.5
A33: =A32+1 -> 30 | B33: Nathan Ciha | C33: 633 | D33: 11 | E33: =(C33/D33) -> 57.545454545454547 | F33: =ROUNDDOWN(((E33-50)*0.8),0) -> 6 | G33: 68 | H33: 0 | I33: 4.5
A34: =A33+1 -> 31 | B34: Jesse Streinz | C34: 633 | D34: 11 | E34: =(C34/D34) -> 57.545454545454547 | F34: =ROUNDDOWN(((E34-50)*0.8),0) -> 6 | I34: 5
A35: =A34+1 -> 32 | B35: Dustin Nohr | C35: 753 | D35: 13 | E35: =(C35/D35) -> 57.92307692307692 | F35: =ROUNDDOWN(((E35-50)*0.8),0) -> 6 | G35: 56 | H35: 1 | I35: 3
A36: =A35+1 -> 33 | B36: Dan Lewis | C36: 232 | D36: 4 | E36: =(C36/D36) -> 58.000 | F36: =ROUNDDOWN(((E36-50)*0.8),0) -> 6 | I36: 2
A37: =A36+1 -> 34 | B37: Travis Pike | C37: 755 | D37: 13 | E37: =(C37/D37) -> 58.07692307692308 | F37: =ROUNDDOWN(((E37-50)*0.8),0) -> 6 | G37: 56 | H37: 1 | I37: 3.5
A38: =A37+1 -> 35 | B38: Phil Campos | C38: 758 | D38: 13 | E38: =(C38/D38) -> 58.307692307692307 | F38: =ROUNDDOWN(((E38-50)*0.8),0) -> 6 | G38: 64 | H38: 0 | I38: 4.5
A39: =A38+1 -> 36 | B39: Matt Shannon | C39: 759 | D39: 13 | E39: =(C39/D39) -> 58.384615384615387 | F39: =ROUNDDOWN(((E39-50)*0.8),0) -> 6 | G39: 61 | H39: 0 | I39: 5
A40: =A39+1 -> 37 | B40: John Williams | C40: 707 | D40: 12 | E40: =(C40/D40) -> 58.916666666666664 | F40: =ROUNDDOWN(((E40-50)*0.8),0) -> 7 | G40: 58 | H40: 1 | I40: 8.5
A41: =A40+1 -> 38 | B41: Darwin Schultz | C41: 118 | D41: 2 | E41: =(C41/D41) -> 59.000 | F41: =ROUNDDOWN(((E41-50)*0.8),0) -> 7 | I41: 1 | J41: 1
A42: =A41+1 -> 39 | B42: Tim Troyna | C42: 710 | D42: 12 | E42: =(C42/D42) -> 59.166666666666664 | F42: =ROUNDDOWN(((E42-50)*0.8),0) -> 7 | G42: 62 | H42: 0 | I42: 5
A43: =A42+1 -> 40 | B43: David McCuskey | C43: 710 | D43: 12 | E43: =(C43/D43) -> 59.166666666666664 | F43: =ROUNDDOWN(((E43-50)*0.8),0) -> 7 | G43: 57 | H43: 0 | I43: 5
A44: =A43+1 -> 41 | B44: Avg. Joe | C44: 771 | D44: 13 | E44: =(C44/D44) -> 59.307692307692307 | F44: =ROUNDDOWN(((E44-50)*0.8),0) -> 7 | G44: 56 | H44: 1 | I44: 5
A45: =A44+1 -> 42 | B45: Ryan Eggleston | C45: 713 | D45: 12 | E45: =(C45/D45) -> 59.416666666666664 | F45: =ROUNDDOWN(((E45-50)*0.8),0) -> 7 | G45: 57 | H45: 1 | I45: 5
A46: =A45+1 -> 43 | B46: Justin Zehr | C46: 654 | D46: 11 | E46: =(C46/D46) -> 59.454545454545453 | F46: =ROUNDDOWN(((E46-50)*0.8),0) -> 7 | I46: 4.5
A47: =A46+1 -> 44 | B47: Matt Ross | C47: 299 | D47: 5 | E47: =(C47/D47) -> 59.800 | F47: =ROUNDDOWN(((E47-50)*0.8),0) -> 7 | I47: 2 | J47: 1
A48: =A47+1 -> 45 | B48: Tom Pepper | C48: 780 | D48: 13 | E48: =(C48/D48) -> 60.000 | F48: =ROUNDDOWN(((E48-50)*0.8),0) -> 8 | G48: 61 | H48: 0 | I48: 3
A49: =A48+1 -> 46 | B49: D. Burns | C49: 788 | D49: 13 | E49: =(C49/D49) -> 60.615384615384613 | F49: =ROUNDDOWN(((E49-50)*0.8),0) -> 8 | G49: 67 | H49: 0 | I49: 7.5
A50: =A49+1 -> 47 | B50: Eric Smith | C50: 734 | D50: 12 | E50: =(C50/D50) -> 61.166666666666664 | F50: =ROUNDDOWN(((E50-50)*0.8),0) -> 8 | I50: 5.5
A51: =A50+1 -> 48 | B51: Maker | C51: 739 | D51: 12 | E51: =(C51/D51) -> 61.583333333333336 | F51: =ROUNDDOWN(((E51-50)*0.8),0) -> 9 | I51: 9
A52: 49 | B52: Shane Thirtyacre | C52: 371 | D52: 6 | E52: =(C52/D52) -> 61.833333333333336 | F52: =ROUNDDOWN(((E52-50)*0.8),0) -> 9 | G52: 58 | H52: 1 | I52: 4 | J52: 1
A53: 50 | B53: Shawn Hullinger | C53: 746 | D53: 12 | E53: =(C53/D53) -> 62.166666666666664 | F53: =ROUNDDOWN(((E53-50)*0.8),0) -> 9 | G53: 57 | H53: 1 | I53: 5
A54: 51 | B54: Mike O'Neill | C54: 685 | D54: 11 | E54: =(C54/D54) -> 62.272727272727273 | F54: =ROUNDDOWN(((E54-50)*0.8),0) -> 9 | G54: 62 | H54: 1 | I54: 7 | J54: 1
A55: 52 | B55: Farley | C55: 811 | D55: 13 | E55: =(C55/D55) -> 62.384615384615387 | F55: =ROUNDDOWN(((E55-50)*0.8),0) -> 9 | G55: 65 | H55: 0 | I55: 6
A56: 53 | B56: Spencer Eubanks | C56: 833 | D56: 13 | E56: =(C56/D56) -> 64.07692307692308 | F56: =ROUNDDOWN(((E56-50)*0.8),0) -> 11 | G56: 64 | H56: 0 | I56: 4
A57: 54 | B57: Brandon Yoder | C57: 673 | D57: 10 | E57: =(C57/D57) -> 67.300 | F57: =ROUNDDOWN(((E57-50)*0.8),0) -> 13 | I57: 6
A58: 55 | B58: John Lambert | C58: 878 | D58: 13 | E58: =(C58/D58) -> 67.538461538461533 | F58: =ROUNDDOWN(((E58-50)*0.8),0) -> 14 | G58: 68 | H58: 1 | I58: 5.5
A59: 56 | B59: Zach Votroubek | C59: 282 | D59: 4 | E59: =(C59/D59) -> 70.500 | F59: =ROUNDDOWN(((E59-50)*0.8),0) -> 16 | I59: 3
A60: 2011 S.B.D.G.L STANDINGS Through Week 13
A61: Subs | B61: Player | C61: Total Strokes | D61: Weeks | E61: Average | F61: H-Cap | G61: Last | H61: Week Pt. | I61: Total Pts. | J61: Subed For
A62: 1 | B62: Anthony Moody | C62: 662 | D62: 11 | E62: =SUM(C62/D62) -> 60.18181818181818 | F62: =ROUNDDOWN(((E62-50)*0.8),0) -> 8 | G62: 57 | H62: 1 | I62: 5 | J62: lewis
A63: 2 | B63: Aaron Killion | C63: 352 | D63: 6 | E63: =SUM(C63/D63) -> 58.666666666666664 | F63: =ROUNDDOWN(((E63-50)*0.8),0) -> 6 | G63: 56 | I63: 1.5
A64: 3 | B64: Chad Goodwin | C64: 410 | D64: 6 | E64: =SUM(C64/D64) -> 68.333333333333329 | F64: =ROUNDDOWN(((E64-50)*0.8),0) -> 14 | G64: 65 | I64: 1
A65: =SUM(A64+1) -> 4 | B65: Keith Gudenkauf | C65: 271 | D65: 5 | E65: =SUM(C65/D65) -> 54.200 | F65: =ROUNDDOWN(((E65-50)*0.8),0) -> 3 | G65: 53 | H65: 1 | I65: 4 | J65: zehr
A66: =SUM(A65+1) -> 5 | B66: Aaron Porter | C66: 263 | D66: 4 | E66: =SUM(C66/D66) -> 65.750 | F66: =ROUNDDOWN(((E66-50)*0.8),0) -> 12 | G66: 71
A67: 7 | B67: Jason Stroud | C67: 170 | D67: 3 | E67: =SUM(C67/D67) -> 56.666666666666664 | F67: 3 | G67: 61 | I67: 2
A68: 8 | B68: Greg Dye | C68: 279 | D68: 5 | E68: =SUM(C68/D68) -> 55.800 | F68: =ROUNDDOWN(((E68-50)*0.8),0) -> 4 | G68: 57 | H68: 0 | I68: 1 | J68: mumma
A69: 9 | B69: Wade Geary | C69: 179 | D69: 3 | E69: =SUM(C69/D69) -> 59.666666666666664 | F69: =ROUNDDOWN(((E69-50)*0.8),0) -> 7 | G69: 63
A70: 10 | B70: Kevin Stibal | C70: 126 | D70: 2 | E70: =SUM(C70/D70) -> 63.000 | F70: =ROUNDDOWN(((E70-50)*0.8),0) -> 10 | G70: 63 | I70: 1
A71: 11 | B71: Rob Obrien | C71: 52 | D71: 1 | E71: =SUM(C71/D71) -> 52.000 | F71: 0 | G71: 52
A72: 11 | B72: Bob Hernandez | C72: 53 | D72: 1 | E72: =SUM(C72/D72) -> 53.000 | F72: 0 | G72: 53
A73: 12 | B73: Kurt Conrad | C73: 55 | D73: 1 | E73: =SUM(C73/D73) -> 55.000 | F73: 0 | G73: 55
A74: 13 | B74: Nate Hamilton | C74: 57 | D74: 1 | E74: =SUM(C74/D74) -> 57.000 | F74: 0 | G74: 57
A75: 14 | B75: Cody Fuller | C75: 58 | D75: 1 | E75: =SUM(C75/D75) -> 58.000 | F75: 0 | G75: 58
A76: 15 | B76: Eric Vandeusen | C76: 58 | D76: 1 | E76: =SUM(C76/D76) -> 58.000 | F76: 0 | G76: 58
A77: 16 | B77: Andy Johnson | C77: 58 | D77: 1 | E77: =SUM(C77/D77) -> 58.000 | F77: 0 | G77: 58
A78: 17 | B78: Joe R | C78: 61 | D78: 1 | E78: =SUM(C78/D78) -> 61.000 | F78: 0 | G78: 61
A79: 18 | B79: Perry Thirtyacre | C79: 62 | D79: 1 | E79: =SUM(C79/D79) -> 62.000 | F79: 0 | G79: 62
A80: 19 | B80: Max Osby | C80: 64 | D80: 1 | E80: =SUM(C80/D80) -> 64.000 | F80: 0 | G80: 64
A81: 20 | B81: Nate Spencer | C81: 67 | D81: 1 | E81: =SUM(C81/D81) -> 67.000 | F81: 0 | G81: 67
A82: 21 | B82: John Calahan | C82: 137 | D82: 2 | E82: =SUM(C82/D82) -> 68.500 | F82: =ROUNDDOWN(((E82-50)*0.8),0) -> 14 | G82: 68
A83: 22 | B83: Chase Norton | C83: 54 | D83: 1 | E83: =SUM(C83/D83) -> 54.000 | F83: 0 | G83: 54
A84: 23 | B84: Brad Milder | C84: 60 | D84: 1 | E84: =SUM(C84/D84) -> 60.000 | F84: 0 | G84: 60 | H84: 0
A85: 23 | B85: Nick Cole | C85: 70 | D85: 1 | E85: =SUM(C85/D85) -> 70.000 | F85: 0 | G85: 70
A86: 24 | B86: Matt DaPaepe | C86: 77 | D86: 1 | E86: =SUM(C86/D86) -> 77.000 | F86: 0 | G86: 77
A87: 2011 SBDGL Team Standing
A88: Place | B88: TEAM # | C88: BUSH | E88: Total Points | F88: Team Points | G88: Team Avg
A89: 1 | B89: 5 | C89: ANDREW DETERT / MAKER | E89: 28 | F89: 9 | G89: =SUM(E51+E14)/2 -> 57.791666666666671
A90: 2 | B90: 23 | C90: AVG JOE/ WIEBEN | E90: 25 | F90: 8.5 | G90: =SUM(E44+E7)/2 -> 55.384615384615387
A91: 3 | B91: 7 | C91: FRITZ / KOLLIN GRIMM | E91: 22.5 | F91: 8.5 | G91: =SUM(E32+E15)/2 -> 55.653846153846153
A92: 4 | B92: 3 | C92: DAN KERN / DUSTIN UTLEY | E92: 20 | F92: 7 | G92: =SUM(E17+E27)/2 -> 55.07692307692308
A93: 5 | B93: 21 | C93: JOEL KNUTSON / YODER | E93: 20 | F93: 7 | G93: =SUM(E31+E57)/2 -> 62.286363636363632
A94: 6 | B94: 11 | C94: KURT CONRAD / J. SAUERBREI | E94: 23 | F94: 7.5 | G94: =SUM(E28+E16)/2 -> 55.037878787878782
A95: 7 | B95: 1 | C95: ADAM MILLER / DAN LEWIS | E95: 21 | F95: 6.5 | G95: =SUM(E9+E62)/2 -> 56.632575757575758
A96: 8 | B96: 19 | C96: B. HULLINGER / PIKE | E96: 21.5 | F96: 8 | G96: =SUM(E30+E37 )/2 -> 57.461538461538467
A97: 9 | B97: 17 | C97: KVN LAVLEY / ROB MUMMA | E97: 18 | F97: 6 | G97: =SUM(E25+E8)/2 -> 53.78846153846154
A98: 10 | B98: 25 | C98: JOHN LAMBERT / FROG | E98: 18 | F98: 5 | G98: =SUM(E58+E23)/2 -> 61.360139860139853
A99: 11 | B99: 15 | C99: TIM TROYNA / J. FARNSWORTH | E99: 17 | F99: 7 | G99: =SUM(E42+E11)/2 -> 56.208333333333329
A100: 12 | B100: 9 | C100: ERIC SMITH / ADAM STIERS | E100: 14.5 | F100: 4 | G100: =SUM(E50+E18)/2 -> 57.901515151515149
A101: 13 | B101: 13 | C101: D. JOHNSON / S. HULLINGER | E101: 17 | F101: 5 | G101: =SUM(E53+E13)/2 -> 58.041666666666664
A102: 14 | B102: 27 | C102: S. EUBANKS / JESSE STRIENZ | E102: 12 | F102: 3 | G102: =SUM(E34+E56)/2 -> 60.811188811188813
C103: WHACKER
A104: 1 | B104: 10 | C104: WOODY / BEACHY | E104: 30.5 | F104: 10.5 | G104: =SUM(E22+E19)/2 -> 54.92307692307692
A105: 2 | B105: 18 | C105: NATE VEEDER / RIMMY | E105: 22.5 | F105: 9 | G105: =SUM(E12+E21)/2 -> 54.500
A106: 3 | B106: 20 | C106: TIM PEYTON / MATT SHANNON | E106: 22 | F106: 7.5 | G106: =SUM(E5+E39)/2 -> 54.615384615384613
A107: 4 | B107: 12 | C107: TIM POTTER / JOHN WILLIAMS | E107: 23 | F107: 8.5 | G107: =SUM(E24+E40)/2 -> 57.125
A108: 5 | B108: 8 | C108: MARTIN REIS / PHIL CAMPOS | E108: 20 | F108: 6.5 | G108: =SUM(E38+E29)/2 -> 57.192307692307693
A109: 6 | B109: 14 | C109: NATHAN CHIA / D BURNS | E109: 18.5 | F109: 6.5 | G109: =SUM(E33+E49)/2 -> 59.08041958041958
A110: 7 | B110: 4 | C110: ANDREW GRECO / A. CHITTENDEN | E110: 18 | F110: 5.5 | G110: =SUM(E6+E55)/2 -> 56.884615384615387
A111: 8 | B111: 6 | C111: DAVID MCCUSKY / J. NECESSARY | E111: 17.5 | F111: 6 | G111: =SUM(E10+E43)/2 -> 56.183333333333337
A112: 9 | B112: 22 | C112: S. THIRTYACRE / R. HAMILTON | E112: 17 | F112: 5.5 | G112: =SUM(E52+E20)/2 -> 58.339743589743591
A113: 10 | B113: 28 | C113: MIKE O'NIELL / DUSITN NOHR | E113: 17 | F113: 6 | G113: =SUM(E35+E54)/2 -> 60.097902097902093
A114: 11 | B114: 26 | C114: JUSTIN ZEHR / TOM PEPPER | E114: 15.5 | F114: 6 | G114: =SUM(E46+E48)/2 -> 59.727272727272727
A115: 12 | B115: 2 | C115: A. KARSTENS / R. EGGLESTON | E115: 15 | F115: 4.5 | G115: =SUM(E45+E26)/2 -> 57.481060606060609
A116: 13 | B116: 16 | C116: MATT ROSS / DOUG PEYTON | E116: 9 | F116: 3 | G116: =SUM(E47+E4)/2 -> 55.274999999999999
A117: 14 | B117: 24 | C117: D. SCHULTZ / Z. VOTROUBEK | E117: 7 | F117: 2 | G117: =SUM(E59+E41)/2 -> 64.750