A1: 2011 SBDGL Standings Through Week 18
A2: Rank | B2: Player | C2: Total Strokes | D2: Weeks | E2: Average | F2: H-Cap | G2: Last | H2: Week Pt. | I2: Total Pts.
A4: =A3+1 -> 1 | B4: Tim Peyton | C4: 900 | D4: 18 | E4: =(C4/D4) -> 50.000 | F4: =ROUNDDOWN(((E4-50)*0.8),0) -> 0 | G4: 48 | H4: 1 | I4: 13
A5: =A4+1 -> 2 | B5: Doug Peyton | C5: 251 | D5: 5 | E5: =(C5/D5) -> 50.200 | F5: =ROUNDDOWN(((E5-50)*0.8),0) -> 0 | G5: 48 | H5: 0 | I5: 3
A6: =A5+1 -> 3 | B6: Greco | C6: 905 | D6: 18 | E6: =(C6/D6) -> 50.277777777777779 | F6: =ROUNDDOWN(((E6-50)*0.8),0) -> 0 | G6: 48 | H6: 0 | I6: 9.5
A7: =A6+1 -> 4 | B7: Matt Wieben | C7: 915 | D7: 18 | E7: =(C7/D7) -> 50.833333333333336 | F7: =ROUNDDOWN(((E7-50)*0.8),0) -> 0 | G7: 51 | H7: 0 | I7: 13.5
A8: =A7+1 -> 5 | B8: Adam Miller | C8: 874 | D8: 17 | E8: =(C8/D8) -> 51.411764705882355 | F8: =ROUNDDOWN(((E8-50)*0.8),0) -> 1 | G8: 53 | H8: 0 | I8: 12.5
A9: =A8+1 -> 6 | B9: KVN Lavley | C9: 930 | D9: 18 | E9: =(C9/D9) -> 51.666666666666664 | F9: =ROUNDDOWN(((E9-50)*0.8),0) -> 1 | G9: 57 | H9: 0 | I9: 11
A10: =A9+1 -> 7 | B10: Jeremy Farnsworth | C10: 886 | D10: 17 | E10: =(C10/D10) -> 52.117647058823529 | F10: =ROUNDDOWN(((E10-50)*0.8),0) -> 1 | G10: 51 | H10: 1 | I10: 7
A11: =A10+1 -> 8 | B11: Andrew Detert | C11: 947 | D11: 18 | E11: =(C11/D11) -> 52.611111111111114 | F11: =ROUNDDOWN(((E11-50)*0.8),0) -> 2 | G11: 49 | H11: 1 | I11: 12.5
A12: =A11+1 -> 9 | B12: Dan Kern | C12: 948 | D12: 18 | E12: =(C12/D12) -> 52.666666666666664 | F12: =ROUNDDOWN(((E12-50)*0.8),0) -> 2 | G12: 46 | H12: 1 | I12: 5.5
A13: =A12+1 -> 10 | B13: Rimmy | C13: 844 | D13: 16 | E13: =(C13/D13) -> 52.750 | F13: =ROUNDDOWN(((E13-50)*0.8),0) -> 2 | G13: 52 | H13: 1 | I13: 10.5
A14: =A13+1 -> 11 | B14: Kollin Grimm | C14: 953 | D14: 18 | E14: =(C14/D14) -> 52.944444444444443 | F14: =ROUNDDOWN(((E14-50)*0.8),0) -> 2 | G14: 48 | H14: 1 | I14: 10.5
A15: =A14+1 -> 12 | B15: Doug Johnson | C15: 905 | D15: 17 | E15: =(C15/D15) -> 53.235294117647058 | F15: =ROUNDDOWN(((E15-50)*0.8),0) -> 2 | G15: 57 | H15: 0 | I15: 8.5
A16: =A15+1 -> 13 | B16: Kurt Conrad | C16: 909 | D16: 17 | E16: =(C16/D16) -> 53.470588235294116 | F16: =ROUNDDOWN(((E16-50)*0.8),0) -> 2 | G16: 49 | H16: 1 | I16: 10.5
A17: =A16+1 -> 14 | B17: Jim Necessary | C17: 805 | D17: 15 | E17: =(C17/D17) -> 53.666666666666664 | F17: =ROUNDDOWN(((E17-50)*0.8),0) -> 2 | G17: 59 | H17: 0 | I17: 8
A18: =A17+1 -> 15 | B18: Woody | C18: 973 | D18: 18 | E18: =(C18/D18) -> 54.055555555555557 | F18: =ROUNDDOWN(((E18-50)*0.8),0) -> 3 | G18: 53 | H18: 0 | I18: 11
A19: =A18+1 -> 16 | B19: Beachy | C19: 974 | D19: 18 | E19: =(C19/D19) -> 54.111111111111114 | F19: =ROUNDDOWN(((E19-50)*0.8),0) -> 3 | G19: 54 | H19: 0 | I19: 13.5
A20: =A19+1 -> 17 | B20: Tim Potter | C20: 923 | D20: 17 | E20: =(C20/D20) -> 54.294117647058826 | F20: =ROUNDDOWN(((E20-50)*0.8),0) -> 3 | G20: 52 | H20: 0 | I20: 10
A21: =A20+1 -> 18 | B21: Jesse Sauerbrei | C21: 870 | D21: 16 | E21: =(C21/D21) -> 54.375 | F21: =ROUNDDOWN(((E21-50)*0.8),0) -> 3 | G21: 52 | H21: 1 | I21: 11.5
A22: =A21+1 -> 19 | B22: Adam Karstens | C22: 816 | D22: 15 | E22: =(C22/D22) -> 54.400 | F22: =ROUNDDOWN(((E22-50)*0.8),0) -> 3 | G22: 52 | H22: 1 | I22: 9
A23: =A22+1 -> 20 | B23: Ryan Hamilton | C23: 980 | D23: 18 | E23: =(C23/D23) -> 54.444444444444443 | F23: =ROUNDDOWN(((E23-50)*0.8),0) -> 3 | G23: 55 | H23: 1 | I23: 9.5
A24: =A23+1 -> 21 | B24: Martin Reis | C24: 929 | D24: 17 | E24: =(C24/D24) -> 54.647058823529413 | F24: =ROUNDDOWN(((E24-50)*0.8),0) -> 3 | G24: 49 | H24: 1 | I24: 12
A25: =A24+1 -> 22 | B25: Utley | C25: 986 | D25: 18 | E25: =(C25/D25) -> 54.777777777777779 | F25: =ROUNDDOWN(((E25-50)*0.8),0) -> 3 | G25: 50 | H25: 1 | I25: 12.5
A26: =A25+1 -> 23 | B26: Stiers | C26: 932 | D26: 17 | E26: =(C26/D26) -> 54.823529411764703 | F26: =ROUNDDOWN(((E26-50)*0.8),0) -> 3 | G26: 57 | H26: 0 | I26: 8
A27: 24 | B27: Nate Veeder | C27: 935 | D27: 17 | E27: =(C27/D27) -> 55.000 | F27: =ROUNDDOWN(((E27-50)*0.8),0) -> 4 | G27: 57 | H27: 1 | I27: 7.5
A28: 25 | B28: Frog | C28: 776 | D28: 14 | E28: =(C28/D28) -> 55.428571428571431 | F28: =ROUNDDOWN(((E28-50)*0.8),0) -> 4 | I28: 7.5
A29: 26 | B29: Rob Mumma | C29: 222 | D29: 4 | E29: =(C29/D29) -> 55.500 | F29: =ROUNDDOWN(((E29-50)*0.8),0) -> 4 | I29: 3
A30: =A29+1 -> 27 | B30: Joel Knutson | C30: 896 | D30: 16 | E30: =(C30/D30) -> 56.000 | F30: =ROUNDDOWN(((E30-50)*0.8),0) -> 4 | G30: 56 | H30: 0 | I30: 10.5
A31: =A30+1 -> 28 | B31: Shirtless Bill | C31: 1012 | D31: 18 | E31: =(C31/D31) -> 56.222222222222221 | F31: =ROUNDDOWN(((E31-50)*0.8),0) -> 4 | G31: 56 | H31: 1 | I31: 12.5
A32: =A31+1 -> 29 | B32: Jesse Streinz | C32: 905 | D32: 16 | E32: =(C32/D32) -> 56.5625 | F32: =ROUNDDOWN(((E32-50)*0.8),0) -> 5 | G32: 58 | H32: 0 | I32: 5
A33: =A32+1 -> 30 | B33: Matt Fritz | C33: 1022 | D33: 18 | E33: =(C33/D33) -> 56.777777777777779 | F33: =ROUNDDOWN(((E33-50)*0.8),0) -> 5 | G33: 54 | H33: 1 | I33: 10
A34: =A33+1 -> 31 | B34: Nathan Ciha | C34: 801 | D34: 14 | E34: =(C34/D34) -> 57.214285714285715 | F34: =ROUNDDOWN(((E34-50)*0.8),0) -> 5 | G34: 53 | H34: 1 | I34: 5.5
A35: =A34+1 -> 32 | B35: Matt Shannon | C35: 1030 | D35: 18 | E35: =(C35/D35) -> 57.222222222222221 | F35: =ROUNDDOWN(((E35-50)*0.8),0) -> 5 | G35: 55 | H35: 0 | I35: 9
A36: =A35+1 -> 33 | B36: Phil Campos | C36: 1034 | D36: 18 | E36: =(C36/D36) -> 57.444444444444443 | F36: =ROUNDDOWN(((E36-50)*0.8),0) -> 5 | G36: 58 | H36: 0 | I36: 6
A37: =A36+1 -> 34 | B37: Travis Pike | C37: 1035 | D37: 18 | E37: =(C37/D37) -> 57.500 | F37: =ROUNDDOWN(((E37-50)*0.8),0) -> 6 | G37: 54 | H37: 0 | I37: 3.5
A38: =A37+1 -> 35 | B38: David McCuskey | C38: 979 | D38: 17 | E38: =(C38/D38) -> 57.588235294117645 | F38: =ROUNDDOWN(((E38-50)*0.8),0) -> 6 | G38: 53 | H38: 1 | I38: 9
A39: =A38+1 -> 36 | B39: Avg. Joe | C39: 1038 | D39: 18 | E39: =(C39/D39) -> 57.666666666666664 | F39: =ROUNDDOWN(((E39-50)*0.8),0) -> 6 | G39: 49 | H39: 1 | I39: 8
A40: =A39+1 -> 37 | B40: Tim Troyna | C40: 925 | D40: 16 | E40: =(C40/D40) -> 57.8125 | F40: =ROUNDDOWN(((E40-50)*0.8),0) -> 6 | G40: 54 | H40: 1 | I40: 9
A41: =A40+1 -> 38 | B41: John Williams | C41: 983 | D41: 17 | E41: =(C41/D41) -> 57.823529411764703 | F41: =ROUNDDOWN(((E41-50)*0.8),0) -> 6 | G41: 57 | H41: 0 | I41: 11
A42: =A41+1 -> 39 | B42: Dan Lewis | C42: 232 | D42: 4 | E42: =(C42/D42) -> 58.000 | F42: =ROUNDDOWN(((E42-50)*0.8),0) -> 6 | I42: 2
A43: =A42+1 -> 40 | B43: Dustin Nohr | C43: 873 | D43: 15 | E43: =(C43/D43) -> 58.200 | F43: =ROUNDDOWN(((E43-50)*0.8),0) -> 6 | I43: 3
A44: =A43+1 -> 41 | B44: Ryan Eggleston | C44: 940 | D44: 16 | E44: =(C44/D44) -> 58.750 | F44: =ROUNDDOWN(((E44-50)*0.8),0) -> 7 | I44: 5
A45: =A44+1 -> 42 | B45: Darwin Schultz | C45: 118 | D45: 2 | E45: =(C45/D45) -> 59.000 | F45: =ROUNDDOWN(((E45-50)*0.8),0) -> 7 | I45: 1
A46: =A45+1 -> 43 | B46: Justin Zehr | C46: 945 | D46: 16 | E46: =(C46/D46) -> 59.0625 | F46: =ROUNDDOWN(((E46-50)*0.8),0) -> 7 | G46: 55 | H46: 1 | I46: 6.5
A47: =A46+1 -> 44 | B47: Tom Pepper | C47: 953 | D47: 16 | E47: =(C47/D47) -> 59.5625 | F47: =ROUNDDOWN(((E47-50)*0.8),0) -> 7 | G47: 57 | H47: 1 | I47: 5.5
A48: =A47+1 -> 45 | B48: Matt Ross | C48: 299 | D48: 5 | E48: =(C48/D48) -> 59.800 | F48: =ROUNDDOWN(((E48-50)*0.8),0) -> 7 | I48: 2
A49: =A48+1 -> 46 | B49: D. Burns | C49: 1078 | D49: 18 | E49: =(C49/D49) -> 59.888888888888886 | F49: =ROUNDDOWN(((E49-50)*0.8),0) -> 7 | G49: 57 | H49: 0 | I49: 10.5
A50: =A49+1 -> 47 | B50: Maker | C50: 1078 | D50: 18 | E50: =(C50/D50) -> 59.888888888888886 | F50: =ROUNDDOWN(((E50-50)*0.8),0) -> 7 | G50: 54 | H50: 1 | I50: 15
A51: =A50+1 -> 48 | B51: Eric Smith | C51: 1080 | D51: 18 | E51: =(C51/D51) -> 60.000 | F51: =ROUNDDOWN(((E51-50)*0.8),0) -> 8 | G51: 54 | H51: 1 | I51: 9.5
A52: 49 | B52: Shane Thirtyacre | C52: 667 | D52: 11 | E52: =(C52/D52) -> 60.636363636363633 | F52: =ROUNDDOWN(((E52-50)*0.8),0) -> 8 | G52: 60 | H52: 0 | I52: 5
A53: 50 | B53: Shawn Hullinger | C53: 1031 | D53: 17 | E53: =(C53/D53) -> 60.647058823529413 | F53: =ROUNDDOWN(((E53-50)*0.8),0) -> 8 | G53: 55 | H53: 1 | I53: 8
A54: 51 | B54: Farley | C54: 1039 | D54: 17 | E54: =(C54/D54) -> 61.117647058823529 | F54: =ROUNDDOWN(((E54-50)*0.8),0) -> 8 | G54: 59 | H54: 0 | I54: 7.5
A55: 52 | B55: Mike O'Neill | C55: 921 | D55: 15 | E55: =(C55/D55) -> 61.400 | F55: =ROUNDDOWN(((E55-50)*0.8),0) -> 9 | I55: 9
A56: 53 | B56: Spencer Eubanks | C56: 1139 | D56: 18 | E56: =(C56/D56) -> 63.277777777777779 | F56: =ROUNDDOWN(((E56-50)*0.8),0) -> 10 | G56: 58 | H56: 1 | I56: 6
A57: 54 | B57: John Lambert | C57: 1181 | D57: 18 | E57: =(C57/D57) -> 65.611111111111114 | F57: =ROUNDDOWN(((E57-50)*0.8),0) -> 12 | G57: 57 | H57: 1 | I57: 9
A58: 55 | B58: Brandon Yoder | C58: 673 | D58: 10 | E58: =(C58/D58) -> 67.300 | F58: =ROUNDDOWN(((E58-50)*0.8),0) -> 13 | I58: 6
A59: 56 | B59: Zach Votroubek | C59: 282 | D59: 4 | E59: =(C59/D59) -> 70.500 | F59: =ROUNDDOWN(((E59-50)*0.8),0) -> 16 | I59: 3
B61: Sub Player | C61: Total Strokes | D61: Weeks | E61: Average | F61: H-Cap | G61: Last | H61: Week Pt. | I61: Total Pts.
B62: Anthony Moody | C62: 945 | D62: 16 | E62: =SUM(C62/D62) -> 59.0625 | F62: =ROUNDDOWN(((E62-50)*0.8),0) -> 7 | G62: 57 | H62: 0 | I62: 6
B63: Aaron Killion | C63: 520 | D63: 9 | E63: =SUM(C63/D63) -> 57.777777777777779 | F63: =ROUNDDOWN(((E63-50)*0.8),0) -> 6 | G63: 57 | I63: 2
B64: Keith Gudenkauf | C64: 320 | D64: 6 | E64: =SUM(C64/D64) -> 53.333333333333336 | F64: =ROUNDDOWN(((E64-50)*0.8),0) -> 2 | G64: 49 | I64: 5
B65: Greg Dye | C65: 438 | D65: 8 | E65: =SUM(C65/D65) -> 54.750 | F65: =ROUNDDOWN(((E65-50)*0.8),0) -> 3 | G65: 51 | I65: 1
B66: Chad Goodwin | C66: 410 | D66: 6 | E66: =SUM(C66/D66) -> 68.333333333333329 | F66: =ROUNDDOWN(((E66-50)*0.8),0) -> 14 | G66: 65 | I66: 1
B67: Aaron Porter | C67: 263 | D67: 4 | E67: =SUM(C67/D67) -> 65.750 | F67: =ROUNDDOWN(((E67-50)*0.8),0) -> 12 | G67: 71
B68: Jason Stroud | C68: 170 | D68: 3 | E68: =SUM(C68/D68) -> 56.666666666666664 | F68: 3 | G68: 61 | I68: 2
B69: Brad Milder | C69: 227 | D69: 4 | E69: =SUM(C69/D69) -> 56.750 | F69: =ROUNDDOWN(((E69-50)*0.8),0) -> 5 | G69: 53
B70: Wade Geary | C70: 179 | D70: 3 | E70: =SUM(C70/D70) -> 59.666666666666664 | F70: =ROUNDDOWN(((E70-50)*0.8),0) -> 7 | G70: 63
B71: Dev | C71: 105 | D71: 2 | E71: =SUM(C71/D71) -> 52.500 | F71: 0 | G71: 50
B72: Kevin Stibal | C72: 223 | D72: 4 | E72: =SUM(C72/D72) -> 55.750 | F72: =ROUNDDOWN(((E72-50)*0.8),0) -> 4 | G72: 51 | I72: 2
B73: Nick Cole | C73: 197 | D73: 3 | E73: =SUM(C73/D73) -> 65.666666666666671 | F73: =ROUNDDOWN(((E73-50)*0.8),0) -> 12 | G73: 61
B74: John Calahan | C74: 137 | D74: 2 | E74: =SUM(C74/D74) -> 68.500 | F74: =ROUNDDOWN(((E74-50)*0.8),0) -> 14 | G74: 68
B75: Rob Neubrand | C75: 51 | D75: 1 | E75: =SUM(C75/D75) -> 51.000 | F75: 0 | G75: 51
B76: Rory | C76: 52 | D76: 1 | E76: =SUM(C76/D76) -> 52.000 | F76: 0 | G76: 52 | I76: 1
B77: Rob Obrien | C77: 52 | D77: 1 | E77: =SUM(C77/D77) -> 52.000 | F77: 0 | G77: 52
B78: Bob Hernandez | C78: 53 | D78: 1 | E78: =SUM(C78/D78) -> 53.000 | F78: 0 | G78: 53
B79: Chase Norton | C79: 54 | D79: 1 | E79: =SUM(C79/D79) -> 54.000 | F79: 0 | G79: 54
B80: Kurt Conrad | C80: 55 | D80: 1 | E80: =SUM(C80/D80) -> 55.000 | F80: 0 | G80: 55
B81: Nate Hamilton | C81: 57 | D81: 1 | E81: =SUM(C81/D81) -> 57.000 | F81: 0 | G81: 57
B82: Cody Fuller | C82: 58 | D82: 1 | E82: =SUM(C82/D82) -> 58.000 | F82: 0 | G82: 58
B83: Eric Vandeusen | C83: 58 | D83: 1 | E83: =SUM(C83/D83) -> 58.000 | F83: 0 | G83: 58
B84: Andy Johnson | C84: 58 | D84: 1 | E84: =SUM(C84/D84) -> 58.000 | F84: 0 | G84: 58
B85: Joe R | C85: 61 | D85: 1 | E85: =SUM(C85/D85) -> 61.000 | F85: 0 | G85: 61
B86: Perry Thirtyacre | C86: 62 | D86: 1 | E86: =SUM(C86/D86) -> 62.000 | F86: 0 | G86: 62
B87: Max Osby | C87: 121 | D87: 2 | E87: =SUM(C87/D87) -> 60.500 | F87: 0 | G87: 57
B88: Nate Spencer | C88: 67 | D88: 1 | E88: =SUM(C88/D88) -> 67.000 | F88: 0 | G88: 67
B89: Matt DaPaepe | C89: 77 | D89: 1 | E89: =SUM(C89/D89) -> 77.000 | F89: 0 | G89: 77
A91: 2011 SBDGL Team Standings
B92: TEAM # | E92: Total Points | F92: Team Points | G92: Team Avg
A93: 1 | B93: 5 | C93: ANDREW DETERT / MAKER | E93: 40.5 | F93: 13 | G93: =SUM(E50+E11)/2 -> 56.250
A94: 2 | B94: 10 | C94: WOODY / BEACHY | E94: 37 | F94: 12.5 | G94: =SUM(E19+E18)/2 -> 54.083333333333336
A95: 3 | B95: 11 | C95: KURT CONRAD / J. SAUERBREI | E95: 35.5 | F95: 12.5 | G95: =SUM(E16+E21)/2 -> 53.922794117647058
A96: 4 | B96: 23 | C96: AVG JOE/ WIEBEN | E96: 34 | F96: 12.5 | G96: =SUM(E39+E7)/2 -> 54.250
A97: 5 | B97: 12 | C97: TIM POTTER / JOHN WILLIAMS | E97: 33.5 | F97: 12.5 | G97: =SUM(E20+E41)/2 -> 56.058823529411768
A98: 6 | B98: 20 | C98: TIM PEYTON / MATT SHANNON | E98: 32.5 | F98: 10.5 | G98: =SUM(E4+E35)/2 -> 53.611111111111114
A99: 7 | B99: 7 | C99: FRITZ / KOLLIN GRIMM | E99: 31 | F99: 10.5 | G99: =SUM(E14+E33)/2 -> 54.861111111111114
A100: 8 | B100: 18 | C100: NATE VEEDER / RIMMY | E100: 30 | F100: 12 | G100: =SUM(E27+E13)/2 -> 53.875
A101: 9 | B101: 1 | C101: ADAM MILLER / DAN LEWIS | E101: 29.5 | F101: 10 | G101: =SUM(E8+E62)/2 -> 55.237132352941174
A102: 10 | B102: 3 | C102: DAN KERN / DUSTIN UTLEY | E102: 28 | F102: 10 | G102: =SUM(E12+E25)/2 -> 53.722222222222221
A103: 11 | B103: 15 | C103: TIM TROYNA / J. FARNSWORTH | E103: 27 | F103: 11 | G103: =SUM(E10+E40)/2 -> 54.965073529411768
A104: 12 | B104: 8 | C104: MARTIN REIS / PHIL CAMPOS | E104: 27 | F104: 9 | G104: =SUM(E25+E20)/2 -> 54.535947712418306
A105: 13 | B105: 4 | C105: ANDREW GRECO / A. CHITTENDEN | E105: 25.5 | F105: 8.5 | G105: =SUM(E6+E54)/2 -> 55.697712418300654
A106: 14 | B106: 6 | C106: DAVID MCCUSKY / J. NECESSARY | E106: 25.5 | F106: 8 | G106: =SUM(E17+E38)/2 -> 55.627450980392155
A107: 15 | B107: 21 | C107: JOEL KNUTSON / YODER | E107: 25.5 | F107: 8 | G107: =SUM(E30+E58)/2 -> 61.650
A108: 16 | B108: 19 | C108: B. HULLINGER / PIKE | E108: 25 | F108: 9 | G108: =SUM(E31+E37)/2 -> 56.861111111111114
A109: 17 | B109: 9 | C109: ERIC SMITH / ADAM STIERS | E109: 24.5 | F109: 7 | G109: =SUM(E51+E26)/2 -> 57.411764705882348
A110: 18 | B110: 22 | C110: S. THIRTYACRE / R. HAMILTON | E110: 24 | F110: 8.5 | G110: =SUM(E52+E23)/2 -> 57.540404040404042
A111: 19 | B111: 17 | C111: KVN LAVLEY / ROB MUMMA | E111: 24 | F111: 8 | G111: =SUM(E29+E9 )/2 -> 53.583333333333329
A112: 20 | B112: 14 | C112: NATHAN CHIA / D BURNS | E112: 24 | F112: 8 | G112: =SUM(E34+E49)/2 -> 58.551587301587304
A113: 21 | B113: 26 | C113: JUSTIN ZEHR / TOM PEPPER | E113: 23.5 | F113: 8.5 | G113: =SUM(E46+E47)/2 -> 59.3125
A114: 22 | B114: 25 | C114: JOHN LAMBERT / FROG | E114: 23.5 | F114: 6 | G114: =SUM(E57+E28)/2 -> 60.519841269841272
A115: 23 | B115: 13 | C115: D. JOHNSON / S. HULLINGER | E115: 22.5 | F115: 6 | G115: =SUM(E15+E53)/2 -> 56.941176470588232
A116: 24 | B116: 28 | C116: MIKE O'NIELL / DUSITN NOHR | E116: 20.5 | F116: 7 | G116: =SUM(E55+E43)/2 -> 59.800
A117: 25 | B117: 2 | C117: A. KARSTENS / R. EGGLESTON | E117: 19.5 | F117: 5.5 | G117: =SUM(E44+E22)/2 -> 56.575000000000003
A118: 26 | B118: 27 | C118: S. EUBANKS / JESSE STRIENZ | E118: 16 | F118: 5 | G118: =SUM(E32+E56)/2 -> 59.920138888888886
A119: 27 | B119: 16 | C119: MATT ROSS / DOUG PEYTON | E119: 9 | F119: 3 | G119: =SUM(E48+E5)/2 -> 55.000
A120: 28 | B120: 24 | C120: D. SCHULTZ / Z. VOTROUBEK | E120: 7 | F120: 2 | G120: =SUM(E45+E59)/2 -> 64.750