A1: 2012 S.B.D.G.L. STANDINGS Through Week 6 Peninsula
A2: Rank | B2: Player | C2: Total Strokes | D2: Weeks | E2: Average | F2: H-Cap | G2: Last | H2: Week Pt. | I2: Total Pts. | J2: Sub Pts.
A4: =A3+1 -> 1 | B4: Doug Peyton | C4: 296 | D4: 6 | E4: =(C4/D4) -> 49.333333333333336 | F4: =ROUNDDOWN(((E4-50)*0.8),0) -> 0 | G4: 54 | H4: 1 | I4: 3.5
A5: =A4+1 -> 2 | B5: Tim Peyton | C5: 296 | D5: 6 | E5: =(C5/D5) -> 49.333333333333336 | F5: =ROUNDDOWN(((E5-50)*0.8),0) -> 0 | G5: 51 | H5: 1 | I5: 4.5
A6: =A5+1 -> 3 | B6: Jeremy Farnsworth | C6: 299 | D6: 6 | E6: =(C6/D6) -> 49.833333333333336 | F6: =ROUNDDOWN(((E6-50)*0.8),0) -> 0 | G6: 55 | H6: 1 | I6: 5
A7: =A6+1 -> 4 | B7: Greco | C7: 303 | D7: 6 | E7: =(C7/D7) -> 50.500 | F7: =ROUNDDOWN(((E7-50)*0.8),0) -> 0 | G7: 54 | H7: 1 | I7: 4
A8: =A7+1 -> 5 | B8: Dan Kern | C8: 308 | D8: 6 | E8: =(C8/D8) -> 51.333333333333336 | F8: =ROUNDDOWN(((E8-50)*0.8),0) -> 1 | G8: 51 | H8: 1 | I8: 4
A9: =A8+1 -> 6 | B9: Kurt Conrad | C9: 309 | D9: 6 | E9: =(C9/D9) -> 51.500 | F9: =ROUNDDOWN(((E9-50)*0.8),0) -> 1 | G9: 57 | H9: 1 | I9: 4
A10: =A9+1 -> 7 | B10: KVN Lavley | C10: 315 | D10: 6 | E10: =(C10/D10) -> 52.500 | F10: =ROUNDDOWN(((E10-50)*0.8),0) -> 2 | G10: 61 | I10: 4.5
A11: =A10+1 -> 8 | B11: Doug Johnson | C11: 315 | D11: 6 | E11: =(C11/D11) -> 52.500 | F11: =ROUNDDOWN(((E11-50)*0.8),0) -> 2 | G11: 59 | I11: 2.5
A12: =A11+1 -> 9 | B12: Kollin Grimm | C12: 319 | D12: 6 | E12: =(C12/D12) -> 53.166666666666664 | F12: =ROUNDDOWN(((E12-50)*0.8),0) -> 2 | G12: 61 | H12: 1 | I12: 3.5
A13: =A12+1 -> 10 | B13: Woody | C13: 320 | D13: 6 | E13: =(C13/D13) -> 53.333333333333336 | F13: =ROUNDDOWN(((E13-50)*0.8),0) -> 2 | G13: 57 | I13: 2
A14: =A13+1 -> 11 | B14: Chris Clime | C14: 320 | D14: 6 | E14: =(C14/D14) -> 53.333333333333336 | F14: =ROUNDDOWN(((E14-50)*0.8),0) -> 2 | G14: 54 | H14: 1 | I14: 6
A15: =A14+1 -> 12 | B15: Tim Potter | C15: 321 | D15: 6 | E15: =(C15/D15) -> 53.500 | F15: =ROUNDDOWN(((E15-50)*0.8),0) -> 2 | G15: 58 | H15: 1 | I15: 5.5
A16: =A15+1 -> 13 | B16: Beachy | C16: 322 | D16: 6 | E16: =(C16/D16) -> 53.666666666666664 | F16: =ROUNDDOWN(((E16-50)*0.8),0) -> 2 | G16: 60 | I16: 2
A17: =A16+1 -> 14 | B17: Nate Veeder | C17: 323 | D17: 6 | E17: =(C17/D17) -> 53.833333333333336 | F17: =ROUNDDOWN(((E17-50)*0.8),0) -> 3 | G17: 56 | H17: 0.5 | I17: 3
A18: =A17+1 -> 15 | B18: Rob Neubrand | C18: 325 | D18: 6 | E18: =(C18/D18) -> 54.166666666666664 | F18: =ROUNDDOWN(((E18-50)*0.8),0) -> 3 | G18: 57 | H18: 1 | I18: 3
A19: =A18+1 -> 16 | B19: Utley | C19: 327 | D19: 6 | E19: =(C19/D19) -> 54.500 | F19: =ROUNDDOWN(((E19-50)*0.8),0) -> 3 | G19: 60 | H19: 1 | I19: 3
A20: =A19+1 -> 17 | B20: Matt Wieben | C20: 327 | D20: 6 | E20: =(C20/D20) -> 54.500 | F20: =ROUNDDOWN(((E20-50)*0.8),0) -> 3 | G20: 57 | H20: 0.5 | I20: 1.5
A21: =A20+1 -> 18 | B21: Rimmy | C21: 329 | D21: 6 | E21: =(C21/D21) -> 54.833333333333336 | F21: =ROUNDDOWN(((E21-50)*0.8),0) -> 3 | G21: 61 | I21: 2
A22: =A21+1 -> 19 | B22: Ryan Hamilton | C22: 329 | D22: 6 | E22: =(C22/D22) -> 54.833333333333336 | F22: =ROUNDDOWN(((E22-50)*0.8),0) -> 3 | G22: 56 | H22: 1 | I22: 4.5
A23: =A22+1 -> 20 | B23: Stiers | C23: 275 | D23: 5 | E23: =(C23/D23) -> 55.000 | F23: =ROUNDDOWN(((E23-50)*0.8),0) -> 4 | G23: NA | I23: 4 | J23: 1
A24: =A23+1 -> 21 | B24: Adam Miller | C24: 330 | D24: 6 | E24: =(C24/D24) -> 55.000 | F24: =ROUNDDOWN(((E24-50)*0.8),0) -> 4 | G24: 62 | I24: 3
A25: =A24+1 -> 22 | B25: Jesse Streinz | C25: 333 | D25: 6 | E25: =(C25/D25) -> 55.500 | F25: =ROUNDDOWN(((E25-50)*0.8),0) -> 4 | G25: 57 | H25: 1 | I25: 4.5
A26: =A25+1 -> 23 | B26: Travis Pike | C26: 335 | D26: 6 | E26: =(C26/D26) -> 55.833333333333336 | F26: =ROUNDDOWN(((E26-50)*0.8),0) -> 4 | G26: 57 | H26: 1 | I26: 3
A27: =A26+1 -> 24 | B27: Shirtless Bill | C27: 337 | D27: 6 | E27: =(C27/D27) -> 56.166666666666664 | F27: =ROUNDDOWN(((E27-50)*0.8),0) -> 4 | G27: 61 | I27: 2
A28: =A27+1 -> 25 | B28: Dustin Nohr | C28: 282 | D28: 5 | E28: =(C28/D28) -> 56.400 | F28: =ROUNDDOWN(((E28-50)*0.8),0) -> 5 | G28: NA | I28: 3 | J28: 1
A29: =A28+1 -> 26 | B29: Joel Knutson | C29: 339 | D29: 6 | E29: =(C29/D29) -> 56.500 | F29: =ROUNDDOWN(((E29-50)*0.8),0) -> 5 | G29: 60 | I29: 2.5
A30: =A29+1 -> 27 | B30: Martin Reis | C30: 339 | D30: 6 | E30: =(C30/D30) -> 56.500 | F30: =ROUNDDOWN(((E30-50)*0.8),0) -> 5 | G30: 59 | I30: 2.5
A31: =A30+1 -> 28 | B31: Travis Fruendt | C31: 284 | D31: 5 | E31: =(C31/D31) -> 56.800 | F31: =ROUNDDOWN(((E31-50)*0.8),0) -> 5 | G31: NA | I31: 2.5 | J31: 0
A32: =A31+1 -> 29 | B32: Frog | C32: 171 | D32: 3 | E32: =(C32/D32) -> 57.000 | F32: =ROUNDDOWN(((E32-50)*0.8),0) -> 5 | G32: 62 | I32: 3
A33: =A32+1 -> 30 | B33: Ryan Eggleston | C33: 346 | D33: 6 | E33: =(C33/D33) -> 57.666666666666664 | F33: =ROUNDDOWN(((E33-50)*0.8),0) -> 6 | G33: 62 | I33: 3
A34: =A33+1 -> 31 | B34: Wyckoff | C34: 290 | D34: 5 | E34: =(C34/D34) -> 58.000 | F34: =ROUNDDOWN(((E34-50)*0.8),0) -> 6 | G34: 64 | I34: 1
A35: =A34+1 -> 32 | B35: Perry Thirtyacre | C35: 290 | D35: 5 | E35: =(C35/D35) -> 58.000 | F35: =ROUNDDOWN(((E35-50)*0.8),0) -> 6 | G35: 61 | I35: 0.5
A36: =A35+1 -> 33 | B36: Matt Fritz | C36: 348 | D36: 6 | E36: =(C36/D36) -> 58.000 | F36: =ROUNDDOWN(((E36-50)*0.8),0) -> 6 | G36: 58 | I36: 4.5
A37: =A36+1 -> 34 | B37: Justin Zehr | C37: 349 | D37: 6 | E37: =(C37/D37) -> 58.166666666666664 | F37: =ROUNDDOWN(((E37-50)*0.8),0) -> 6 | G37: 59 | H37: 1 | I37: 2
A38: =A37+1 -> 35 | B38: John Williams | C38: 350 | D38: 6 | E38: =(C38/D38) -> 58.333333333333336 | F38: =ROUNDDOWN(((E38-50)*0.8),0) -> 6 | G38: 62 | I38: 1.5
A39: =A38+1 -> 36 | B39: Matt Shannon | C39: 350 | D39: 6 | E39: =(C39/D39) -> 58.333333333333336 | F39: =ROUNDDOWN(((E39-50)*0.8),0) -> 6 | G39: 58 | H39: 1 | I39: 2
A40: =A39+1 -> 37 | B40: Phil Campos | C40: 351 | D40: 6 | E40: =(C40/D40) -> 58.500 | F40: =ROUNDDOWN(((E40-50)*0.8),0) -> 6 | G40: 62 | I40: 3
A41: =A40+1 -> 38 | B41: Avg. Joe | C41: 353 | D41: 6 | E41: =(C41/D41) -> 58.833333333333336 | F41: =ROUNDDOWN(((E41-50)*0.8),0) -> 7 | G41: 58 | H41: 1 | I41: 3
A42: =A41+1 -> 39 | B42: Kirby Callahan | C42: 355 | D42: 6 | E42: =(C42/D42) -> 59.166666666666664 | F42: =ROUNDDOWN(((E42-50)*0.8),0) -> 7 | G42: 65 | I42: 2
A43: =A42+1 -> 40 | B43: Erik Smith | C43: 358 | D43: 6 | E43: =(C43/D43) -> 59.666666666666664 | F43: =ROUNDDOWN(((E43-50)*0.8),0) -> 7 | G43: 65 | I43: 1
A44: =A43+1 -> 41 | B44: D. Burns | C44: 360 | D44: 6 | E44: =(C44/D44) -> 60.000 | F44: =ROUNDDOWN(((E44-50)*0.8),0) -> 8 | G44: 65 | I44: 3
A45: =A44+1 -> 42 | B45: Adam Henderson | C45: 361 | D45: 6 | E45: =(C45/D45) -> 60.166666666666664 | F45: =ROUNDDOWN(((E45-50)*0.8),0) -> 8 | G45: 63 | H45: 1 | I45: 4
A46: =A45+1 -> 43 | B46: David McCuskey | C46: 303 | D46: 5 | E46: =(C46/D46) -> 60.600 | F46: =ROUNDDOWN(((E46-50)*0.8),0) -> 8 | G46: 61 | H46: 1 | I46: 3.5
A47: =A46+1 -> 44 | B47: Shane Thirtyacre | C47: 366 | D47: 6 | E47: =(C47/D47) -> 61.000 | F47: =ROUNDDOWN(((E47-50)*0.8),0) -> 8 | G47: 63 | H47: 1 | I47: 4.5
A48: =A47+1 -> 45 | B48: Spencer Eubanks | C48: 308 | D48: 5 | E48: =(C48/D48) -> 61.600 | F48: =ROUNDDOWN(((E48-50)*0.8),0) -> 9 | G48: 68 | I48: 3
A49: =A48+1 -> 46 | B49: Archie Coulter | C49: 373 | D49: 6 | E49: =(C49/D49) -> 62.166666666666664 | F49: =ROUNDDOWN(((E49-50)*0.8),0) -> 9 | G49: 68 | I49: 3.5
A50: =A49+1 -> 47 | B50: Tom Pepper | C50: 374 | D50: 6 | E50: =(C50/D50) -> 62.333333333333336 | F50: =ROUNDDOWN(((E50-50)*0.8),0) -> 9 | G50: 70 | I50: 2
A51: =A50+1 -> 48 | B51: Maker | C51: 379 | D51: 6 | E51: =(C51/D51) -> 63.166666666666664 | F51: =ROUNDDOWN(((E51-50)*0.8),0) -> 10 | G51: 68 | I51: 1
A52: =A51+1 -> 49 | B52: Shawn Hullinger | C52: 398 | D52: 6 | E52: =(C52/D52) -> 66.333333333333329 | F52: =ROUNDDOWN(((E52-50)*0.8),0) -> 13 | G52: 70 | H52: 1 | I52: 2.5
A53: =A52+1 -> 50 | B53: Sarah Potter | C53: 407 | D53: 6 | E53: =(C53/D53) -> 67.833333333333329 | F53: =ROUNDDOWN(((E53-50)*0.8),0) -> 14 | G53: 70 | H53: 1 | I53: 4
A54: =A53+1 -> 51 | B54: Chad Goodwin | C54: 272 | D54: 4 | E54: =(C54/D54) -> 68.000 | F54: =ROUNDDOWN(((E54-50)*0.8),0) -> 14 | G54: NA | I54: 2.5 | J54: 1
A55: =A54+1 -> 52 | B55: M. Lerch | C55: 441 | D55: 6 | E55: =(C55/D55) -> 73.500 | F55: =ROUNDDOWN(((E55-50)*0.8),0) -> 18 | G55: 80 | I55: 1
A57: Subs | B57: Player | C57: Total Strokes | D57: Weeks | E57: Average | F57: H-Cap | G57: Last | H57: Week Pt. | I57: Total Pts. | J57: Subed For
A58: 1 | B58: Ian Jacobs | C58: 351 | D58: 6 | E58: =(C58/D58) -> 58.500 | F58: =ROUNDDOWN(((E58-50)*0.8),0) -> 6 | G58: 63 | H58: 1 | I58: 1 | J58: Nohr
A59: 2 | B59: Rob Mumma | C59: 57 | D59: 1 | E59: =SUM(C59/D59) -> 57.000 | F59: =ROUNDDOWN(((E59-50)*0.8),0) -> 5 | G59: 0 | I59: 0
A60: 3 | B60: Ben Sandell | C60: 206 | D60: 3 | E60: =SUM(C60/D60) -> 68.666666666666671 | F60: =ROUNDDOWN(((E60-50)*0.8),0) -> 14 | G60: 0 | I60: 0
A61: 4 | B61: AO | C61: 95 | D61: 2 | E61: =SUM(C61/D61) -> 47.500 | F61: 0 | G61: 0 | I61: 1
A62: 5 | B62: Stibal | C62: 175 | D62: 3 | E62: =SUM(C62/D62) -> 58.333333333333336 | F62: =ROUNDDOWN(((E62-50)*0.8),0) -> 6 | G62: 65 | I62: 1 | J62: NA
A63: 6 | B63: Chuck | C63: =54+58 -> 112 | D63: 2 | E63: =SUM(C63/D63) -> 56.000 | F63: =ROUNDDOWN(((E63-50)*0.8),0) -> 4 | G63: 0 | I63: 1.5
A64: 8 | B64: Prouty | C64: 71 | D64: 1 | E64: =SUM(C64/D64) -> 71.000 | F64: NA | G64: 0 | I64: 0
A65: 9 | B65: Steve Adkinson | C65: 65 | D65: 1 | E65: =SUM(C65/D65) -> 65.000 | F65: 0 | G65: 65 | H65: 0 | I65: 0 | J65: Travis
A66: 10 | B66: Dev Nelson | C66: 58 | D66: 1 | E66: =SUM(C66/D66) -> 58.000 | F66: 0 | G66: 58 | H66: 1 | I66: 1 | J66: Stiers
A67: 11 | B67: Greg Friestad | C67: 59 | D67: 1 | E67: =SUM(C67/D67) -> 59.000 | F67: 0 | G67: 59 | H67: 1 | I67: 1 | J67: Goodwin
A68: 12 | C68: 0 | D68: 1 | E68: =SUM(C68/D68) -> 0.000 | F68: =ROUNDDOWN(((E68-50)*0.8),0) -> -40
A69: 13 | C69: 0 | D69: 1 | E69: =SUM(C69/D69) -> 0.000 | F69: =ROUNDDOWN(((E69-50)*0.8),0) -> -40
A70: 14 | C70: 0 | D70: 1 | E70: =SUM(C70/D70) -> 0.000 | F70: =ROUNDDOWN(((E70-50)*0.8),0) -> -40
A71: 15 | C71: 0 | D71: 1 | E71: =SUM(C71/D71) -> 0.000 | F71: =ROUNDDOWN(((E71-50)*0.8),0) -> -40
A72: 16 | C72: 0 | D72: 1 | E72: =SUM(C72/D72) -> 0.000 | F72: =ROUNDDOWN(((E72-50)*0.8),0) -> -40
A73: 17 | C73: 0 | D73: 1 | E73: =SUM(C73/D73) -> 0.000 | F73: =ROUNDDOWN(((E73-50)*0.8),0) -> -40
A74: 18 | C74: 0 | D74: 1 | E74: =SUM(C74/D74) -> 0.000 | F74: =ROUNDDOWN(((E74-50)*0.8),0) -> -40
A75: 19 | C75: 0 | D75: 1 | E75: =SUM(C75/D75) -> 0.000 | F75: =ROUNDDOWN(((E75-50)*0.8),0) -> -40
A76: 20 | C76: 0 | D76: 1 | E76: =SUM(C76/D76) -> 0.000 | F76: =ROUNDDOWN(((E76-50)*0.8),0) -> -40
A77: 21 | C77: 0 | D77: 1 | E77: =SUM(C77/D77) -> 0.000 | F77: =ROUNDDOWN(((E77-50)*0.8),0) -> -40
A78: 22 | C78: 0 | D78: 1 | E78: =SUM(C78/D78) -> 0.000 | F78: =ROUNDDOWN(((E78-50)*0.8),0) -> -40
A79: 23 | C79: 0 | D79: 1 | E79: =SUM(C79/D79) -> 0.000 | F79: =ROUNDDOWN(((E79-50)*0.8),0) -> -40
A80: 24 | C80: 0 | D80: 1 | E80: =SUM(C80/D80) -> 0.000 | F80: =ROUNDDOWN(((E80-50)*0.8),0) -> -40
A81: 25 | C81: 0 | D81: 1 | E81: =SUM(C81/D81) -> 0.000 | F81: =ROUNDDOWN(((E81-50)*0.8),0) -> -40
A82: 26 | C82: 0 | D82: 1 | E82: =SUM(C82/D82) -> 0.000 | F82: =ROUNDDOWN(((E82-50)*0.8),0) -> -40
A83: 27 | C83: 0 | D83: 1 | E83: =SUM(C83/D83) -> 0.000 | F83: =ROUNDDOWN(((E83-50)*0.8),0) -> -40
A84: 28 | C84: 0 | D84: 1 | E84: =SUM(C84/D84) -> 0.000 | F84: =ROUNDDOWN(((E84-50)*0.8),0) -> -40
A86: 2012 SBDGL Team Standing
B87: TEAM # | C87: BUSH | E87: Total Points | F87: Team Points | G87: Team Avg | H87: Week Total | I87: Week Team
A88: 1 | B88: 11 | C88: Tim Potter + Andrew Greco | E88: 14.5 | F88: 5 | G88: =AVERAGE(E7,E15) -> 52.000 | H88: 3 | I88: 1
A89: 2 | B89: 7 | C89: Doug Johnson + Shane Thirtyacre | E89: 12 | F89: 5 | G89: =AVERAGE(E11,E35) -> 55.250 | H89: 2 | I89: 1
A90: 3 | B90: 4 | C90: KVN + Archie C. | E90: 12 | F90: 4 | G90: =AVERAGE(E10,E49) -> 57.333333333333329 | H90: 0 | I90: 0
A91: 4 | B91: 6 | C91: Hullinger + Jesse Streinz | E91: 11 | F91: 3 | G91: =AVERAGE(E52,E25) -> 60.916666666666664 | H91: 3 | I91: 1
A92: 5 | B92: 8 | C92: Sarah Potter + Adam Henderson | E92: 10 | F92: 2 | G92: =AVERAGE(E53,E45) -> 64.000 | H92: 3 | I92: 1
A93: 6 | B93: 2 | C93: Travis Pike + Kollin Grimm | E93: 9.5 | F93: 3 | G93: =AVERAGE(E12,E26) -> 54.500 | H93: 3 | I93: 1
A94: 7 | B94: 12 | C94: Joshua Beachy + Dustin Nohr | E94: 8 | F94: 3 | G94: =AVERAGE(E16,E28) -> 55.033333333333331 | H94: 2 | I94: 1
A95: 8 | B95: 1 | C95: Woody + Adam Miller | E95: 7 | F95: 2 | G95: =AVERAGE(E13,E24) -> 54.166666666666671 | H95: 0 | I95: 0
A96: 9 | B96: 5 | C96: Shirtless + Dustin Utley | E96: 7 | F96: 2 | G96: =AVERAGE(E27,E19) -> 55.333333333333329 | H96: 1 | I96: 0
A97: 10 | B97: 3 | C97: Adam Stiers + Wyckoff | E97: 7 | F97: 2 | G97: =AVERAGE(E23,E34) -> 56.500 | H97: 1 | I97: 0
A98: 11 | B98: 9 | C98: John Williams + Kirby Callahan | E98: 6.5 | F98: 3 | G98: =AVERAGE(E38,E42) -> 58.750 | H98: 0 | I98: 0
A99: 12 | B99: 10 | C99: Tom Pepper + Travis Fruendt | E99: 6.5 | F99: 2 | G99: =AVERAGE(E50,E31) -> 59.566666666666663 | H99: 0 | I99: 0
A100: 13 | B100: 13 | C100: Perry Thirtyacre + Justin Zehr | E100: 4.5 | F100: 2 | G100: =AVERAGE(E37,E35) -> 58.083333333333329 | H100: 2 | I100: 1
C102: WHACKER
A103: 1 | B103: 25 | C103: Doug Peyton + Chris Clime | E103: 14.5 | F103: 5 | G103: =AVERAGE(E4,E14) -> 51.333333333333336 | H103: 3 | I103: 1
A104: 2 | B104: 18 | C104: Dan Kern + Jeremy Farnsworth | E104: 14 | F104: 5 | G104: =AVERAGE(E6,E14) -> 51.583333333333336 | H104: 3 | I104: 1
A105: 3 | B105: 20 | C105: Matt Fritz + Egglesten | E105: 11 | F105: 3.5 | G105: =AVERAGE(E36,E33) -> 57.833333333333329 | H105: 0 | I105: 0
A106: 4 | B106: 22 | C106: Kurt Conrad + Chad Goodwin | E106: 10.5 | F106: 4 | G106: =AVERAGE(E9,E54) -> 59.750 | H106: 3 | I106: 1
A107: 5 | B107: 21 | C107: Super Dave + Tim Peyton | E107: 10.5 | F107: 3 | G107: =AVERAGE(E46,E5) -> 54.966666666666669 | H107: 3 | I107: 1
A108: 6 | B108: 24 | C108: Ryan Hamilton + D. Burns | E108: 10.5 | F108: 3 | G108: =AVERAGE(E22,E44) -> 57.416666666666671 | H108: 1 | I108: 0
A109: 7 | B109: 17 | C109: Marty Reis + Spencer Eubanks | E109: 9.5 | F109: 4 | G109: =AVERAGE(E48,E30) -> 59.050 | H109: 0 | I109: 0
A110: 8 | B110: 15 | C110: Campos + Nathan Veeder | E110: 8.5 | F110: 2.5 | G110: =AVERAGE(E40,E17) -> 56.166666666666671 | H110: 0.5 | I110: 0
A111: 9 | B111: 14 | C111: Average Joe + Jason Rimrodt | E111: 8 | F111: 3 | G111: =AVERAGE(E21,E41) -> 56.833333333333336 | H111: 2 | I111: 1
A112: 10 | B112: 26 | C112: Joel Knutson + Rob Neubrand | E112: 7.5 | F112: 2 | G112: =AVERAGE(E29,E18) -> 55.333333333333329 | H112: 1 | I112: 0
A113: 11 | B113: 23 | C113: Matt Wieben + Matt Shannon | E113: 5.5 | F113: 2 | G113: =AVERAGE(E39,E20) -> 56.416666666666671 | H113: 2.5 | I113: 1
A114: 12 | B114: 19 | C114: Matt Geers + M. Lerch | E114: 5.5 | F114: 2 | G114: =AVERAGE(E55,E32) -> 65.250 | H114: 0 | I114: 0
A115: 13 | B115: 16 | C115: Jerimie Maker + Smith | E115: 3 | F115: 1 | G115: =AVERAGE(E51,E43) -> 61.416666666666664 | H115: 0 | I115: 0