A1: 2012 S.B.D.G.L. STANDINGS Through Week 14 Legion
A2: Rank | B2: Player | C2: Total Strokes | D2: Weeks | E2: Average | F2: H-Cap | G2: Last | H2: Week Pt. | I2: Total Pts. | J2: Sub Pts.
A4: =A3+1 -> 1 | B4: Doug Peyton | C4: 708 | D4: 14 | E4: =(C4/D4) -> 50.571428571428569 | F4: =ROUNDDOWN(((E4-50)*0.8),0) -> 0 | G4: 53 | I4: 8
A5: =A4+1 -> 2 | B5: Jeremy Farnsworth | C5: 607 | D5: 12 | E5: =(C5/D5) -> 50.583333333333336 | F5: =ROUNDDOWN(((E5-50)*0.8),0) -> 0 | G5: 49 | H5: 1 | I5: 8
A6: =A5+1 -> 3 | B6: Tim Peyton | C6: 712 | D6: 14 | E6: =(C6/D6) -> 50.857142857142854 | F6: =ROUNDDOWN(((E6-50)*0.8),0) -> 0 | G6: 46 | H6: 1 | I6: 8.5
A7: =A6+1 -> 4 | B7: Dan Kern | C7: 718 | D7: 14 | E7: =(C7/D7) -> 51.285714285714285 | F7: =ROUNDDOWN(((E7-50)*0.8),0) -> 1 | G7: 46 | H7: 1 | I7: 9
A8: =A7+1 -> 5 | B8: Greco | C8: 731 | D8: 14 | E8: =(C8/D8) -> 52.214285714285715 | F8: =ROUNDDOWN(((E8-50)*0.8),0) -> 1 | G8: 53 | I8: 7.5
A9: =A8+1 -> 6 | B9: KVN Lavley | C9: 737 | D9: 14 | E9: =(C9/D9) -> 52.642857142857146 | F9: =ROUNDDOWN(((E9-50)*0.8),0) -> 2 | G9: 51 | H9: 1 | I9: 10
A10: =A9+1 -> 7 | B10: Kurt Conrad | C10: 753 | D10: 14 | E10: =(C10/D10) -> 53.785714285714285 | F10: =ROUNDDOWN(((E10-50)*0.8),0) -> 3 | G10: 48 | H10: 1 | I10: 9.5
A11: =A10+1 -> 8 | B11: Matt Wieben | C11: 753 | D11: 14 | E11: =(C11/D11) -> 53.785714285714285 | F11: =ROUNDDOWN(((E11-50)*0.8),0) -> 3 | G11: 50 | I11: 8
A12: =A11+1 -> 9 | B12: Kollin Grimm | C12: 760 | D12: 14 | E12: =(C12/D12) -> 54.285714285714285 | F12: =ROUNDDOWN(((E12-50)*0.8),0) -> 3 | G12: 52 | I12: 8
A13: =A12+1 -> 10 | B13: Doug Johnson | C13: 766 | D13: 14 | E13: =(C13/D13) -> 54.714285714285715 | F13: =ROUNDDOWN(((E13-50)*0.8),0) -> 3 | G13: 54 | H13: 1 | I13: 8
A14: =A13+1 -> 11 | B14: Chris Clime | C14: 770 | D14: 14 | E14: =(C14/D14) -> 55.000 | F14: =ROUNDDOWN(((E14-50)*0.8),0) -> 4 | G14: 53 | H14: 1 | I14: 13
A15: =A14+1 -> 12 | B15: Woody | C15: 771 | D15: 14 | E15: =(C15/D15) -> 55.071428571428569 | F15: =ROUNDDOWN(((E15-50)*0.8),0) -> 4 | G15: 54 | I15: 3
A16: =A15+1 -> 13 | B16: Tim Potter | C16: 771 | D16: 14 | E16: =(C16/D16) -> 55.071428571428569 | F16: =ROUNDDOWN(((E16-50)*0.8),0) -> 4 | G16: 56 | I16: 9
A17: =A16+1 -> 14 | B17: Rimmy | C17: 771 | D17: 14 | E17: =(C17/D17) -> 55.071428571428569 | F17: =ROUNDDOWN(((E17-50)*0.8),0) -> 4 | G17: 60 | I17: 5
A18: =A17+1 -> 15 | B18: Rob Neubrand | C18: 775 | D18: 14 | E18: =(C18/D18) -> 55.357142857142854 | F18: =ROUNDDOWN(((E18-50)*0.8),0) -> 4 | G18: 59 | H18: 1 | I18: 6.5
A19: =A18+1 -> 16 | B19: Stiers | C19: 720 | D19: 13 | E19: =(C19/D19) -> 55.384615384615387 | F19: =ROUNDDOWN(((E19-50)*0.8),0) -> 4 | G19: 48 | H19: 1 | I19: 8.5
A20: =A19+1 -> 17 | B20: Adam Miller | C20: 779 | D20: 14 | E20: =(C20/D20) -> 55.642857142857146 | F20: =ROUNDDOWN(((E20-50)*0.8),0) -> 4 | G20: 54 | I20: 6.5
A21: =A20+1 -> 18 | B21: Beachy | C21: 781 | D21: 14 | E21: =(C21/D21) -> 55.785714285714285 | F21: =ROUNDDOWN(((E21-50)*0.8),0) -> 4 | G21: 57 | I21: 4
A22: =A21+1 -> 19 | B22: Utley | C22: 726 | D22: 13 | E22: =(C22/D22) -> 55.846153846153847 | F22: =ROUNDDOWN(((E22-50)*0.8),0) -> 4 | G22: 54 | H22: 1 | I22: 7.5
A23: =A22+1 -> 20 | B23: Nate Veeder | C23: 730 | D23: 13 | E23: =(C23/D23) -> 56.153846153846153 | F23: =ROUNDDOWN(((E23-50)*0.8),0) -> 4 | G23: 51 | H23: 1 | I23: 6
A24: =A23+1 -> 21 | B24: Jesse Streinz | C24: 787 | D24: 14 | E24: =(C24/D24) -> 56.214285714285715 | F24: =ROUNDDOWN(((E24-50)*0.8),0) -> 4 | G24: 57 | H24: 1 | I24: 10.5
A25: =A24+1 -> 22 | B25: Travis Fruendt | C25: 733 | D25: 13 | E25: =(C25/D25) -> 56.384615384615387 | F25: =ROUNDDOWN(((E25-50)*0.8),0) -> 5 | G25: 50 | H25: 1 | I25: 8
A26: =A25+1 -> 23 | B26: Ryan Hamilton | C26: 791 | D26: 14 | E26: =(C26/D26) -> 56.500 | F26: =ROUNDDOWN(((E26-50)*0.8),0) -> 5 | G26: 58 | I26: 8
A27: =A26+1 -> 24 | B27: Joel Knutson | C27: 798 | D27: 14 | E27: =(C27/D27) -> 57.000 | F27: =ROUNDDOWN(((E27-50)*0.8),0) -> 5 | G27: 57 | I27: 6
A28: =A27+1 -> 25 | B28: Martin Reis | C28: 800 | D28: 14 | E28: =(C28/D28) -> 57.142857142857146 | F28: =ROUNDDOWN(((E28-50)*0.8),0) -> 5 | G28: 50 | H28: 1 | I28: 7.5
A29: =A28+1 -> 26 | B29: Shirtless Bill | C29: 744 | D29: 13 | E29: =(C29/D29) -> 57.230769230769234 | F29: =ROUNDDOWN(((E29-50)*0.8),0) -> 5 | G29: 54 | H29: 1 | I29: 6.5
A30: =A29+1 -> 27 | B30: Travis Pike | C30: 811 | D30: 14 | E30: =(C30/D30) -> 57.928571428571431 | F30: =ROUNDDOWN(((E30-50)*0.8),0) -> 6 | G30: 59 | I30: 7
A31: =A30+1 -> 28 | B31: Matt Fritz | C31: 816 | D31: 14 | E31: =(C31/D31) -> 58.285714285714285 | F31: =ROUNDDOWN(((E31-50)*0.8),0) -> 6 | G31: 58 | H31: 1 | I31: 9.5
A32: =A31+1 -> 29 | B32: Perry Thirtyacre | C32: 758 | D32: 13 | E32: =(C32/D32) -> 58.307692307692307 | F32: =ROUNDDOWN(((E32-50)*0.8),0) -> 6 | G32: 61 | I32: 4.5
A33: =A32+1 -> 30 | B33: Dustin Nohr | C33: 760 | D33: 13 | E33: =(C33/D33) -> 58.46153846153846 | F33: =ROUNDDOWN(((E33-50)*0.8),0) -> 6 | G33: 57 | H33: 1 | I33: 6.5
A34: =A33+1 -> 31 | B34: Ryan Eggleston | C34: 819 | D34: 14 | E34: =(C34/D34) -> 58.500 | F34: =ROUNDDOWN(((E34-50)*0.8),0) -> 6 | G34: 56 | I34: 9.5
A35: =A34+1 -> 32 | B35: David McCuskey | C35: 761 | D35: 13 | E35: =(C35/D35) -> 58.53846153846154 | F35: =ROUNDDOWN(((E35-50)*0.8),0) -> 6 | G35: 55 | H35: 1 | I35: 9.5
A36: =A35+1 -> 33 | B36: Kirby Callahan | C36: 820 | D36: 14 | E36: =(C36/D36) -> 58.571428571428569 | F36: =ROUNDDOWN(((E36-50)*0.8),0) -> 6 | G36: 58 | I36: 6
A37: =A36+1 -> 34 | B37: Matt Shannon | C37: 821 | D37: 14 | E37: =(C37/D37) -> 58.642857142857146 | F37: =ROUNDDOWN(((E37-50)*0.8),0) -> 6 | G37: 59 | I37: 5
A38: =A37+1 -> 35 | B38: John Williams | C38: 823 | D38: 14 | E38: =(C38/D38) -> 58.785714285714285 | F38: =ROUNDDOWN(((E38-50)*0.8),0) -> 7 | G38: 49 | H38: 1 | I38: 6.5
A39: =A38+1 -> 36 | B39: Avg. Joe | C39: 825 | D39: 14 | E39: =(C39/D39) -> 58.928571428571431 | F39: =ROUNDDOWN(((E39-50)*0.8),0) -> 7 | G39: 60 | I39: 7
A40: =A39+1 -> 37 | B40: Phil Campos | C40: 826 | D40: 14 | E40: =(C40/D40) -> 59.000 | F40: =ROUNDDOWN(((E40-50)*0.8),0) -> 7 | G40: 57 | H40: 1 | I40: 6.5
A41: =A40+1 -> 38 | B41: Wyckoff | C41: 776 | D41: 13 | E41: =(C41/D41) -> 59.692307692307693 | F41: =ROUNDDOWN(((E41-50)*0.8),0) -> 7 | G41: 58 | H41: 1 | I41: 7
A42: =A41+1 -> 39 | B42: Adam Henderson | C42: 840 | D42: 14 | E42: =(C42/D42) -> 60.000 | F42: =ROUNDDOWN(((E42-50)*0.8),0) -> 8 | G42: 55 | I42: 6.5
A43: =A42+1 -> 40 | B43: Frog | C43: 300 | D43: 5 | E43: =(C43/D43) -> 60.000 | F43: =ROUNDDOWN(((E43-50)*0.8),0) -> 8 | I43: 5 | J43: 0
A44: =A43+1 -> 41 | B44: Archie Coulter | C44: 852 | D44: 14 | E44: =(C44/D44) -> 60.857142857142854 | F44: =ROUNDDOWN(((E44-50)*0.8),0) -> 8 | G44: 57 | H44: 1 | I44: 8
A45: =A44+1 -> 42 | B45: Justin Zehr | C45: 670 | D45: 11 | E45: =(C45/D45) -> 60.909090909090907 | F45: =ROUNDDOWN(((E45-50)*0.8),0) -> 8 | I45: 4 | J45: 0
A46: =A45+1 -> 43 | B46: Erik Smith | C46: 801 | D46: 13 | E46: =(C46/D46) -> 61.615384615384613 | F46: =ROUNDDOWN(((E46-50)*0.8),0) -> 9 | G46: 59 | I46: 2
A47: =A46+1 -> 44 | B47: D. Burns | C47: 867 | D47: 14 | E47: =(C47/D47) -> 61.928571428571431 | F47: =ROUNDDOWN(((E47-50)*0.8),0) -> 9 | G47: 60 | I47: 6.5
A48: =A47+1 -> 45 | B48: Shane Thirtyacre | C48: 868 | D48: 14 | E48: =(C48/D48) -> 62.000 | F48: =ROUNDDOWN(((E48-50)*0.8),0) -> 9 | G48: 63 | I48: 6.5
A49: =A48+1 -> 46 | B49: Maker | C49: 807 | D49: 13 | E49: =(C49/D49) -> 62.07692307692308 | F49: =ROUNDDOWN(((E49-50)*0.8),0) -> 9 | I49: 6
A50: =A49+1 -> 47 | B50: Tom Pepper | C50: 886 | D50: 14 | E50: =(C50/D50) -> 63.285714285714285 | F50: =ROUNDDOWN(((E50-50)*0.8),0) -> 10 | G50: 62 | I50: 5.5
A51: =A50+1 -> 48 | B51: Spencer Eubanks | C51: 833 | D51: 13 | E51: =(C51/D51) -> 64.07692307692308 | F51: =ROUNDDOWN(((E51-50)*0.8),0) -> 11 | G51: 62 | H51: 1 | I51: 6
A52: =A51+1 -> 49 | B52: Shawn Hullinger | C52: 902 | D52: 14 | E52: =(C52/D52) -> 64.428571428571431 | F52: =ROUNDDOWN(((E52-50)*0.8),0) -> 11 | G52: 61 | H52: 1 | I52: 7.5
A53: =A52+1 -> 50 | B53: Sarah Potter | C53: 946 | D53: 14 | E53: =(C53/D53) -> 67.571428571428569 | F53: =ROUNDDOWN(((E53-50)*0.8),0) -> 14 | G53: 66 | I53: 7
A54: =A53+1 -> 51 | B54: Chad Goodwin | C54: 695 | D54: 10 | E54: =(C54/D54) -> 69.500 | F54: =ROUNDDOWN(((E54-50)*0.8),0) -> 15 | G54: 67 | H54: 1 | I54: 5
A55: =A54+1 -> 52 | B55: M. Lerch | C55: 1014 | D55: 14 | E55: =(C55/D55) -> 72.428571428571431 | F55: =ROUNDDOWN(((E55-50)*0.8),0) -> 17 | G55: 65 | H55: 1 | I55: 4
A57: Subs | B57: Player | C57: Total Strokes | D57: Weeks | E57: Average | F57: H-Cap | G57: Last | H57: Week Pt. | I57: Total Pts. | J57: Subed For
A58: 1 | B58: Ian Jacobs | C58: 826 | D58: 14 | E58: =(C58/D58) -> 59.000 | F58: =ROUNDDOWN(((E58-50)*0.8),0) -> 7 | G58: 63 | I58: 0 | J58: Frog
A59: 2 | B59: Ben Sandell | C59: 464 | D59: 7 | E59: =SUM(C59/D59) -> 66.285714285714292 | F59: =ROUNDDOWN(((E59-50)*0.8),0) -> 13 | G59: 69 | H59: 0 | I59: 1 | J59: Zehr
A60: 3 | B60: AO | C60: 196 | D60: 4 | E60: =SUM(C60/D60) -> 49.000 | F60: =ROUNDDOWN(((E60-50)*0.8),0) -> 0 | I60: 2
A61: 4 | B61: Chuck | C61: 165 | D61: 3 | E61: =SUM(C61/D61) -> 55.000 | F61: =ROUNDDOWN(((E61-50)*0.8),0) -> 4 | I61: 1.5
A62: 5 | B62: Rory | C62: 168 | D62: 3 | E62: =SUM(C62/D62) -> 56.000 | F62: =ROUNDDOWN(((E62-50)*0.8),0) -> 4 | I62: 0
A63: 6 | B63: Stibal | C63: 175 | D63: 3 | E63: =SUM(C63/D63) -> 58.333333333333336 | F63: =ROUNDDOWN(((E63-50)*0.8),0) -> 6 | I63: 1
A64: 8 | B64: Dan Lewis | C64: 180 | D64: 3 | E64: =SUM(C64/D64) -> 60.000 | F64: =ROUNDDOWN(((E64-50)*0.8),0) -> 8 | I64: 0
A65: 9 | B65: Dev Nelson | C65: 115 | D65: 2 | E65: =SUM(C65/D65) -> 57.500 | F65: =ROUNDDOWN(((E65-50)*0.8),0) -> 6 | I65: 1
A66: 10 | B66: Crager | C66: 176 | D66: 3 | E66: =SUM(C66/D66) -> 58.666666666666664 | F66: =ROUNDDOWN(((E66-50)*0.8),0) -> 6 | G66: 58 | I66: 0
A67: 11 | B67: Rob Mumma | C67: 240 | D67: 4 | E67: =SUM(C67/D67) -> 60.000 | F67: =ROUNDDOWN(((E67-50)*0.8),0) -> 8 | G67: 56 | I67: 0
A68: 12 | B68: Tony Rios | C68: 182 | D68: 3 | E68: =SUM(C68/D68) -> 60.666666666666664 | F68: =ROUNDDOWN(((E68-50)*0.8),0) -> 8 | I68: 0
A69: 13 | B69: Nate ? | C69: 62 | D69: 1 | E69: =SUM(C69/D69) -> 62.000 | F69: =ROUNDDOWN(((E69-50)*0.8),0) -> 9 | I69: 0
A70: 14 | B70: Nate ? | C70: 57 | D70: 1 | E70: =SUM(C70/D70) -> 57.000 | F70: =ROUNDDOWN(((E70-50)*0.8),0) -> 5 | I70: 0
A71: 15 | B71: Timmy | C71: 59 | D71: 1 | E71: =SUM(C71/D71) -> 59.000 | F71: =ROUNDDOWN(((E71-50)*0.8),0) -> 7 | I71: 0
A72: 16 | B72: Bob Hernandez | C72: 56 | D72: 1 | E72: =SUM(C72/D72) -> 56.000 | F72: =ROUNDDOWN(((E72-50)*0.8),0) -> 4 | I72: 0
A73: 17 | B73: Greg Friestad | C73: 59 | D73: 1 | E73: =SUM(C73/D73) -> 59.000 | F73: =ROUNDDOWN(((E73-50)*0.8),0) -> 7 | I73: 1
A74: 18 | B74: Steve Adkinson | C74: 65 | D74: 1 | E74: =SUM(C74/D74) -> 65.000 | F74: =ROUNDDOWN(((E74-50)*0.8),0) -> 12 | I74: 0
A75: 19 | B75: Prouty | C75: 71 | D75: 1 | E75: =SUM(C75/D75) -> 71.000 | F75: =ROUNDDOWN(((E75-50)*0.8),0) -> 16 | I75: 0
A76: 20 | B76: McCarley | C76: 65 | D76: 1 | E76: =SUM(C76/D76) -> 65.000 | F76: =ROUNDDOWN(((E76-50)*0.8),0) -> 12 | I76: 0
A77: 21 | B77: Brent | C77: 62 | D77: 1 | E77: =SUM(C77/D77) -> 62.000 | F77: =ROUNDDOWN(((E77-50)*0.8),0) -> 9 | I77: 0
A78: 22 | B78: Adam Karstens | C78: 57 | D78: 1 | E78: =SUM(C78/D78) -> 57.000 | F78: =ROUNDDOWN(((E78-50)*0.8),0) -> 5
A79: 23 | B79: Doc | C79: 103 | D79: 1 | E79: =SUM(C79/D79) -> 103.000 | F79: =ROUNDDOWN(((E79-50)*0.8),0) -> 42 | G79: 103
A80: 24 | C80: 0 | D80: 1 | E80: =SUM(C80/D80) -> 0.000 | F80: =ROUNDDOWN(((E80-50)*0.8),0) -> -40
A81: 25 | C81: 0 | D81: 1 | E81: =SUM(C81/D81) -> 0.000 | F81: =ROUNDDOWN(((E81-50)*0.8),0) -> -40
A82: 26 | C82: 0 | D82: 1 | E82: =SUM(C82/D82) -> 0.000 | F82: =ROUNDDOWN(((E82-50)*0.8),0) -> -40
A83: 27 | C83: 0 | D83: 1 | E83: =SUM(C83/D83) -> 0.000 | F83: =ROUNDDOWN(((E83-50)*0.8),0) -> -40
A84: 28 | C84: 0 | D84: 1 | E84: =SUM(C84/D84) -> 0.000 | F84: =ROUNDDOWN(((E84-50)*0.8),0) -> -40
A86: 2012 SBDGL Team Standing
B87: TEAM # | C87: BUSH | E87: Total Points | F87: Team Points | G87: Team Avg | H87: Week Total | I87: Week Team
A88: 1 | B88: 6 | C88: Hullinger + Jesse Streinz | E88: 29.5 | F88: 9.5 | G88: =AVERAGE(E52,E24) -> 60.321428571428569 | H88: 3 | I88: 1
A89: 2 | B89: 4 | C89: KVN + Archie C. | E89: 27 | F89: 9 | G89: =AVERAGE(E9,E44) -> 56.750 | H89: 3 | I89: 1
A90: 3 | B90: 11 | C90: Tim Potter + Andrew Greco | E90: 25 | F90: 8.5 | G90: =AVERAGE(E8,E16) -> 53.642857142857139
A91: 4 | B91: 2 | C91: Travis Pike + Kollin Grimm | E91: 24 | F91: 9 | G91: =AVERAGE(E12,E30) -> 56.107142857142861
A92: 5 | B92: 7 | C92: Doug Johnson + Shane Thirtyacre | E92: 21.5 | F92: 8 | G92: =AVERAGE(E48,E13) -> 58.357142857142861 | H92: 1
A93: 6 | B93: 9 | C93: John Williams + Kirby Callahan | E93: 21 | F93: 8.5 | G93: =AVERAGE(E38,E36) -> 58.678571428571431 | H93: 2 | I93: 1
A94: 7 | B94: 5 | C94: Shirtless + Dustin Utley | E94: 19.5 | F94: 5.5 | G94: =AVERAGE(E29,E22) -> 56.53846153846154 | H94: 3 | I94: 1
A95: 8 | B95: 3 | C95: Adam Stiers + Wyckoff | E95: 19.5 | F95: 5 | G95: =AVERAGE(E19,E41) -> 57.53846153846154 | H95: 3 | I95: 1
A96: 9 | B96: 10 | C96: Tom Pepper + Travis Fruendt | E96: 19 | F96: 5.5 | G96: =AVERAGE(E50,E25) -> 59.835164835164832 | H96: 1
A97: 10 | B97: 12 | C97: Joshua Beachy + Dustin Nohr | E97: 17 | F97: 6 | G97: =AVERAGE(E21,E33) -> 57.123626373626372 | H97: 2 | I97: 1
A98: 11 | B98: 8 | C98: Sarah Potter + Adam Henderson | E98: 16.5 | F98: 3 | G98: =AVERAGE(E53,E42) -> 63.785714285714285
A99: 12 | B99: 1 | C99: Woody + Adam Miller | E99: 14.5 | F99: 5 | G99: =AVERAGE(E15,E20) -> 55.357142857142861
A100: 13 | B100: 13 | C100: Perry Thirtyacre + Justin Zehr | E100: 13 | F100: 4.5 | G100: =AVERAGE(E45,E32) -> 59.608391608391607
C102: WHACKER
A103: 1 | B103: 25 | C103: Doug Peyton + Chris Clime | E103: 34.5 | F103: 12.5 | G103: =AVERAGE(E4,E14) -> 52.785714285714285 | H103: 1.5 | I103: 0.5
A104: 2 | B104: 18 | C104: Dan Kern + Jeremy Farnsworth | E104: 29.5 | F104: 11.5 | G104: =AVERAGE(E5,E7) -> 50.93452380952381 | H104: 3 | I104: 1
A105: 3 | B105: 20 | C105: Matt Fritz + Egglesten | E105: 28.5 | F105: 9.5 | G105: =AVERAGE(E31,E34) -> 58.392857142857139 | H105: 1.5 | I105: 0.5
A106: 4 | B106: 21 | C106: Super Dave + Tim Peyton | E106: 26 | F106: 8.5 | G106: =AVERAGE(E35,E6) -> 54.697802197802197 | H106: 3 | I106: 1
A107: 5 | B107: 22 | C107: Kurt Conrad + Chad Goodwin | E107: 22.5 | F107: 8 | G107: =AVERAGE(E10,E54) -> 61.642857142857139 | H107: 3 | I107: 1
A108: 6 | B108: 24 | C108: Ryan Hamilton + D. Burns | E108: 20 | F108: 5.5 | G108: =AVERAGE(E26,E47) -> 59.214285714285715
A109: 7 | B109: 26 | C109: Joel Knutson + Rob Neubrand | E109: 19.5 | F109: 6.5 | G109: =AVERAGE(E27,E18) -> 56.178571428571431 | H109: 1
A110: 8 | B110: 17 | C110: Marty Reis + Spencer Eubanks | E110: 19.5 | F110: 6 | G110: =AVERAGE(E51,E28) -> 60.609890109890117 | H110: 3 | I110: 1
A111: 9 | B111: 23 | C111: Matt Wieben + Matt Shannon | E111: 18.5 | F111: 5.5 | G111: =AVERAGE(E11,E37) -> 56.214285714285715
A112: 10 | B112: 14 | C112: Average Joe + Jason Rimrodt | E112: 18 | F112: 6 | G112: =AVERAGE(E17,E39) -> 57.000
A113: 11 | B113: 15 | C113: Campos + Nathan Veeder | E113: 18 | F113: 5.5 | G113: =AVERAGE(E40,E23) -> 57.57692307692308 | H113: 3 | I113: 1
A114: 12 | B114: 19 | C114: Matt Geers + M. Lerch | E114: 14.5 | F114: 6 | G114: =AVERAGE(E55,E43) -> 66.214285714285722 | H114: 2 | I114: 1
A115: 13 | B115: 16 | C115: Jerimie Maker + Smith | E115: 10 | F115: 4 | G115: =AVERAGE(E46,E49) -> 61.846153846153847