A1: 2012 S.B.D.G.L. STANDINGS Through Week 8 Sugar Bottom
A2: Rank | B2: Player | C2: Total Strokes | D2: Weeks | E2: Average | F2: H-Cap | G2: Last | H2: Week Pt. | I2: Total Pts. | J2: Sub Pts.
A4: =A3+1 -> 1 | B4: Doug Peyton | C4: 396 | D4: 8 | E4: =(C4/D4) -> 49.500 | F4: =ROUNDDOWN(((E4-50)*0.8),0) -> 0 | G4: 53 | H4: 0.5 | I4: 5
A5: =A4+1 -> 2 | B5: Jeremy Farnsworth | C5: 400 | D5: 8 | E5: =(C5/D5) -> 50.000 | F5: =ROUNDDOWN(((E5-50)*0.8),0) -> 0 | G5: 50 | H5: 1 | I5: 6
A6: =A5+1 -> 3 | B6: Tim Peyton | C6: 404 | D6: 8 | E6: =(C6/D6) -> 50.500 | F6: =ROUNDDOWN(((E6-50)*0.8),0) -> 0 | G6: 52 | I6: 4.5
A7: =A6+1 -> 4 | B7: Dan Kern | C7: 407 | D7: 8 | E7: =(C7/D7) -> 50.875 | F7: =ROUNDDOWN(((E7-50)*0.8),0) -> 0 | G7: 52 | H7: 0.5 | I7: 4.5
A8: =A7+1 -> 5 | B8: Greco | C8: 414 | D8: 8 | E8: =(C8/D8) -> 51.750 | F8: =ROUNDDOWN(((E8-50)*0.8),0) -> 1 | G8: 58 | I8: 4
A9: =A8+1 -> 6 | B9: Doug Johnson | C9: 418 | D9: 8 | E9: =(C9/D9) -> 52.250 | F9: =ROUNDDOWN(((E9-50)*0.8),0) -> 1 | G9: 54 | H9: 1 | I9: 5.5
A10: =A9+1 -> 7 | B10: Kurt Conrad | C10: 419 | D10: 8 | E10: =(C10/D10) -> 52.375 | F10: =ROUNDDOWN(((E10-50)*0.8),0) -> 1 | G10: 54 | H10: 0.5 | I10: 4.5
A11: =A10+1 -> 8 | B11: KVN Lavley | C11: 422 | D11: 8 | E11: =(C11/D11) -> 52.750 | F11: =ROUNDDOWN(((E11-50)*0.8),0) -> 2 | G11: 54 | H11: 0.5 | I11: 6
A12: =A11+1 -> 9 | B12: Woody | C12: 426 | D12: 8 | E12: =(C12/D12) -> 53.250 | F12: =ROUNDDOWN(((E12-50)*0.8),0) -> 2 | G12: 55 | I12: 2
A13: =A12+1 -> 10 | B13: Matt Wieben | C13: 429 | D13: 8 | E13: =(C13/D13) -> 53.625 | F13: =ROUNDDOWN(((E13-50)*0.8),0) -> 2 | G13: 50 | H13: 1 | I13: 3.5
A14: =A13+1 -> 11 | B14: Chris Clime | C14: 430 | D14: 8 | E14: =(C14/D14) -> 53.750 | F14: =ROUNDDOWN(((E14-50)*0.8),0) -> 3 | G14: 54 | H14: 1 | I14: 8
A15: =A14+1 -> 12 | B15: Rimmy | C15: 432 | D15: 8 | E15: =(C15/D15) -> 54.000 | F15: =ROUNDDOWN(((E15-50)*0.8),0) -> 3 | G15: 52 | I15: 3
A16: =A15+1 -> 13 | B16: Tim Potter | C16: 432 | D16: 8 | E16: =(C16/D16) -> 54.000 | F16: =ROUNDDOWN(((E16-50)*0.8),0) -> 3 | G16: 54 | H16: 1 | I16: 6.5
A17: =A16+1 -> 14 | B17: Kollin Grimm | C17: 432 | D17: 8 | E17: =(C17/D17) -> 54.000 | F17: =ROUNDDOWN(((E17-50)*0.8),0) -> 3 | G17: 58 | H17: 1 | I17: 4.5
A18: =A17+1 -> 15 | B18: Rob Neubrand | C18: 433 | D18: 8 | E18: =(C18/D18) -> 54.125 | F18: =ROUNDDOWN(((E18-50)*0.8),0) -> 3 | G18: 54 | I18: 3.5
A19: =A18+1 -> 16 | B19: Stiers | C19: 381 | D19: 7 | E19: =(C19/D19) -> 54.428571428571431 | F19: =ROUNDDOWN(((E19-50)*0.8),0) -> 3 | G19: 55 | H19: 0.5 | I19: 5.5
A20: =A19+1 -> 17 | B20: Utley | C20: 437 | D20: 8 | E20: =(C20/D20) -> 54.625 | F20: =ROUNDDOWN(((E20-50)*0.8),0) -> 3 | G20: 56 | I20: 4
A21: =A20+1 -> 18 | B21: Beachy | C21: 437 | D21: 8 | E21: =(C21/D21) -> 54.625 | F21: =ROUNDDOWN(((E21-50)*0.8),0) -> 3 | G21: 56 | I21: 2
A22: =A21+1 -> 19 | B22: Jesse Streinz | C22: 439 | D22: 8 | E22: =(C22/D22) -> 54.875 | F22: =ROUNDDOWN(((E22-50)*0.8),0) -> 3 | G22: 54 | H22: 1 | I22: 6.5
A23: =A22+1 -> 20 | B23: Adam Miller | C23: 441 | D23: 8 | E23: =(C23/D23) -> 55.125 | F23: =ROUNDDOWN(((E23-50)*0.8),0) -> 4 | G23: 56 | I23: 4
A24: =A23+1 -> 21 | B24: Nate Veeder | C24: 441 | D24: 8 | E24: =(C24/D24) -> 55.125 | F24: =ROUNDDOWN(((E24-50)*0.8),0) -> 4 | G24: 64 | I24: 3.5
A25: =A24+1 -> 22 | B25: Ryan Hamilton | C25: 442 | D25: 8 | E25: =(C25/D25) -> 55.250 | F25: =ROUNDDOWN(((E25-50)*0.8),0) -> 4 | G25: 58 | I25: 5.5
A26: =A25+1 -> 23 | B26: Shirtless Bill | C26: 448 | D26: 8 | E26: =(C26/D26) -> 56.000 | F26: =ROUNDDOWN(((E26-50)*0.8),0) -> 4 | G26: 55 | H26: 1 | I26: 4
A27: =A26+1 -> 24 | B27: Travis Pike | C27: 448 | D27: 8 | E27: =(C27/D27) -> 56.000 | F27: =ROUNDDOWN(((E27-50)*0.8),0) -> 4 | G27: 56 | H27: 0.5 | I27: 4.5
A28: =A27+1 -> 25 | B28: Travis Fruendt | C28: 393 | D28: 7 | E28: =(C28/D28) -> 56.142857142857146 | F28: =ROUNDDOWN(((E28-50)*0.8),0) -> 4 | G28: 52 | H28: 1 | I28: 3.5
A29: =A28+1 -> 26 | B29: Joel Knutson | C29: 451 | D29: 8 | E29: =(C29/D29) -> 56.375 | F29: =ROUNDDOWN(((E29-50)*0.8),0) -> 5 | G29: 57 | H29: 0.5 | I29: 4
A30: =A29+1 -> 27 | B30: Dustin Nohr | C30: 397 | D30: 7 | E30: =(C30/D30) -> 56.714285714285715 | F30: =ROUNDDOWN(((E30-50)*0.8),0) -> 5 | G30: 59 | I30: 3
A31: =A30+1 -> 28 | B31: Frog | C31: 171 | D31: 3 | E31: =(C31/D31) -> 57.000 | F31: =ROUNDDOWN(((E31-50)*0.8),0) -> 5 | G31: NA | I31: 4 | J31: 1
A32: =A31+1 -> 29 | B32: Matt Shannon | C32: 459 | D32: 8 | E32: =(C32/D32) -> 57.375 | F32: =ROUNDDOWN(((E32-50)*0.8),0) -> 5 | G32: 53 | H32: 1 | I32: 3
A33: =A32+1 -> 30 | B33: Martin Reis | C33: 461 | D33: 8 | E33: =(C33/D33) -> 57.625 | F33: =ROUNDDOWN(((E33-50)*0.8),0) -> 6 | G33: 61 | I33: 2.5
A34: =A33+1 -> 31 | B34: Perry Thirtyacre | C34: 404 | D34: 7 | E34: =(C34/D34) -> 57.714285714285715 | F34: =ROUNDDOWN(((E34-50)*0.8),0) -> 6 | G34: 57 | H34: 1 | I34: 2.5
A35: =A34+1 -> 32 | B35: Matt Fritz | C35: 463 | D35: 8 | E35: =(C35/D35) -> 57.875 | F35: =ROUNDDOWN(((E35-50)*0.8),0) -> 6 | G35: 60 | H35: 1 | I35: 5.5
A36: =A35+1 -> 33 | B36: Ryan Eggleston | C36: 465 | D36: 8 | E36: =(C36/D36) -> 58.125 | F36: =ROUNDDOWN(((E36-50)*0.8),0) -> 6 | G36: 58 | H36: 0.5 | I36: 4.5
A37: =A36+1 -> 34 | B37: Kirby Callahan | C37: 466 | D37: 8 | E37: =(C37/D37) -> 58.250 | F37: =ROUNDDOWN(((E37-50)*0.8),0) -> 6 | G37: 53 | H37: 1 | I37: 3.5
A38: =A37+1 -> 35 | B38: John Williams | C38: 466 | D38: 8 | E38: =(C38/D38) -> 58.250 | F38: =ROUNDDOWN(((E38-50)*0.8),0) -> 6 | G38: 57 | H38: 1 | I38: 3.5
A39: =A38+1 -> 36 | B39: Phil Campos | C39: 466 | D39: 8 | E39: =(C39/D39) -> 58.250 | F39: =ROUNDDOWN(((E39-50)*0.8),0) -> 6 | G39: 58 | H39: 0.5 | I39: 3.5
A40: =A39+1 -> 37 | B40: Wyckoff | C40: 412 | D40: 7 | E40: =(C40/D40) -> 58.857142857142854 | F40: =ROUNDDOWN(((E40-50)*0.8),0) -> 7 | G40: 61 | I40: 1
A41: =A40+1 -> 38 | B41: Avg. Joe | C41: 472 | D41: 8 | E41: =(C41/D41) -> 59.000 | F41: =ROUNDDOWN(((E41-50)*0.8),0) -> 7 | G41: 60 | H41: 1 | I41: 4
A42: =A41+1 -> 39 | B42: David McCuskey | C42: 414 | D42: 7 | E42: =(C42/D42) -> 59.142857142857146 | F42: =ROUNDDOWN(((E42-50)*0.8),0) -> 7 | G42: 55 | I42: 4.5
A43: =A42+1 -> 40 | B43: Justin Zehr | C43: 415 | D43: 7 | E43: =(C43/D43) -> 59.285714285714285 | F43: =ROUNDDOWN(((E43-50)*0.8),0) -> 7 | G43: NA | I43: 2 | J43: 0
A44: =A43+1 -> 41 | B44: Erik Smith | C44: 475 | D44: 8 | E44: =(C44/D44) -> 59.375 | F44: =ROUNDDOWN(((E44-50)*0.8),0) -> 7 | G44: 58 | H44: 1 | I44: 2
A45: =A44+1 -> 42 | B45: D. Burns | C45: 478 | D45: 8 | E45: =(C45/D45) -> 59.750 | F45: =ROUNDDOWN(((E45-50)*0.8),0) -> 7 | G45: 59 | H45: 0.5 | I45: 4.5
A46: =A45+1 -> 43 | B46: Adam Henderson | C46: 479 | D46: 8 | E46: =(C46/D46) -> 59.875 | F46: =ROUNDDOWN(((E46-50)*0.8),0) -> 7 | G46: 57 | I46: 4
A47: =A46+1 -> 44 | B47: Shane Thirtyacre | C47: 487 | D47: 8 | E47: =(C47/D47) -> 60.875 | F47: =ROUNDDOWN(((E47-50)*0.8),0) -> 8 | G47: 60 | I47: 4.5
A48: =A47+1 -> 45 | B48: Archie Coulter | C48: 490 | D48: 8 | E48: =(C48/D48) -> 61.250 | F48: =ROUNDDOWN(((E48-50)*0.8),0) -> 9 | G48: 56 | H48: 1 | I48: 5.5
A49: =A48+1 -> 46 | B49: Spencer Eubanks | C49: 435 | D49: 7 | E49: =(C49/D49) -> 62.142857142857146 | F49: =ROUNDDOWN(((E49-50)*0.8),0) -> 9 | G49: 65 | H49: 1 | I49: 4
A50: =A49+1 -> 47 | B50: Tom Pepper | C50: 499 | D50: 8 | E50: =(C50/D50) -> 62.375 | F50: =ROUNDDOWN(((E50-50)*0.8),0) -> 9 | G50: 63 | H50: 1 | I50: 3
A51: =A50+1 -> 48 | B51: Maker | C51: 503 | D51: 8 | E51: =(C51/D51) -> 62.875 | F51: =ROUNDDOWN(((E51-50)*0.8),0) -> 10 | G51: 66 | I51: 2
A52: =A51+1 -> 49 | B52: Shawn Hullinger | C52: 522 | D52: 8 | E52: =(C52/D52) -> 65.250 | F52: =ROUNDDOWN(((E52-50)*0.8),0) -> 12 | G52: 61 | H52: 1 | I52: 4.5
A53: =A52+1 -> 50 | B53: Sarah Potter | C53: 541 | D53: 8 | E53: =(C53/D53) -> 67.625 | F53: =ROUNDDOWN(((E53-50)*0.8),0) -> 14 | G53: 71 | I53: 5
A54: =A53+1 -> 51 | B54: Chad Goodwin | C54: 411 | D54: 6 | E54: =(C54/D54) -> 68.500 | F54: =ROUNDDOWN(((E54-50)*0.8),0) -> 14 | G54: 74 | I54: 3
A55: =A54+1 -> 52 | B55: M. Lerch | C55: 586 | D55: 8 | E55: =(C55/D55) -> 73.250 | F55: =ROUNDDOWN(((E55-50)*0.8),0) -> 18 | G55: 72 | I55: 1
A57: Subs | B57: Player | C57: Total Strokes | D57: Weeks | E57: Average | F57: H-Cap | G57: Last | H57: Week Pt. | I57: Total Pts. | J57: Subed For
A58: 1 | B58: Ian Jacobs | C58: 469 | D58: 8 | E58: =(C58/D58) -> 58.625 | F58: =ROUNDDOWN(((E58-50)*0.8),0) -> 6 | G58: 59 | I58: 1
A59: 2 | B59: Rob Mumma | C59: 57 | D59: 1 | E59: =SUM(C59/D59) -> 57.000 | F59: NA | G59: 0 | I59: 0
A60: 3 | B60: Ben Sandell | C60: 333 | D60: 5 | E60: =SUM(C60/D60) -> 66.600 | F60: =ROUNDDOWN(((E60-50)*0.8),0) -> 13 | G60: 66 | H60: 0 | I60: 0 | J60: Zehr
A61: 4 | B61: AO | C61: 142 | D61: 3 | E61: =SUM(C61/D61) -> 47.333333333333336 | F61: 0 | G61: 47 | H61: 1 | I61: 2 | J61: Frog
A62: 5 | B62: Stibal | C62: 175 | D62: 3 | E62: =SUM(C62/D62) -> 58.333333333333336 | F62: =ROUNDDOWN(((E62-50)*0.8),0) -> 6 | G62: 0 | I62: 1
A63: 6 | B63: Chuck | C63: =54+58 -> 112 | D63: 2 | E63: =SUM(C63/D63) -> 56.000 | F63: =ROUNDDOWN(((E63-50)*0.8),0) -> 4 | G63: 0 | I63: 1.5
A64: 8 | B64: Prouty | C64: 71 | D64: 1 | E64: =SUM(C64/D64) -> 71.000 | F64: NA | G64: 0 | I64: 0
A65: 9 | B65: Steve Adkinson | C65: 65 | D65: 1 | E65: =SUM(C65/D65) -> 65.000 | F65: NA | G65: 0 | I65: 0
A66: 10 | B66: Dev Nelson | C66: 58 | D66: 1 | E66: =SUM(C66/D66) -> 58.000 | F66: NA | G66: 0 | I66: 1
A67: 11 | B67: Greg Friestad | C67: 59 | D67: 1 | E67: =SUM(C67/D67) -> 59.000 | F67: NA | G67: 0 | I67: 1
A68: 12 | B68: Bob Hernandez | C68: 56 | D68: 1 | E68: =SUM(C68/D68) -> 56.000 | F68: NA | G68: 0 | I68: 0
A69: 13 | B69: Dan Lewis | C69: 54 | D69: 1 | E69: =SUM(C69/D69) -> 54.000 | F69: NA | G69: 0 | I69: 0
A70: 14 | B70: Tony Rios | C70: DNF | D70: 1 | E70: NA | F70: NA | G70: NA
A71: 15 | C71: 0 | D71: 1 | E71: =SUM(C71/D71) -> 0.000 | F71: =ROUNDDOWN(((E71-50)*0.8),0) -> -40
A72: 16 | C72: 0 | D72: 1 | E72: =SUM(C72/D72) -> 0.000 | F72: =ROUNDDOWN(((E72-50)*0.8),0) -> -40
A73: 17 | C73: 0 | D73: 1 | E73: =SUM(C73/D73) -> 0.000 | F73: =ROUNDDOWN(((E73-50)*0.8),0) -> -40
A74: 18 | C74: 0 | D74: 1 | E74: =SUM(C74/D74) -> 0.000 | F74: =ROUNDDOWN(((E74-50)*0.8),0) -> -40
A75: 19 | C75: 0 | D75: 1 | E75: =SUM(C75/D75) -> 0.000 | F75: =ROUNDDOWN(((E75-50)*0.8),0) -> -40
A76: 20 | C76: 0 | D76: 1 | E76: =SUM(C76/D76) -> 0.000 | F76: =ROUNDDOWN(((E76-50)*0.8),0) -> -40
A77: 21 | C77: 0 | D77: 1 | E77: =SUM(C77/D77) -> 0.000 | F77: =ROUNDDOWN(((E77-50)*0.8),0) -> -40
A78: 22 | C78: 0 | D78: 1 | E78: =SUM(C78/D78) -> 0.000 | F78: =ROUNDDOWN(((E78-50)*0.8),0) -> -40
A79: 23 | C79: 0 | D79: 1 | E79: =SUM(C79/D79) -> 0.000 | F79: =ROUNDDOWN(((E79-50)*0.8),0) -> -40
A80: 24 | C80: 0 | D80: 1 | E80: =SUM(C80/D80) -> 0.000 | F80: =ROUNDDOWN(((E80-50)*0.8),0) -> -40
A81: 25 | C81: 0 | D81: 1 | E81: =SUM(C81/D81) -> 0.000 | F81: =ROUNDDOWN(((E81-50)*0.8),0) -> -40
A82: 26 | C82: 0 | D82: 1 | E82: =SUM(C82/D82) -> 0.000 | F82: =ROUNDDOWN(((E82-50)*0.8),0) -> -40
A83: 27 | C83: 0 | D83: 1 | E83: =SUM(C83/D83) -> 0.000 | F83: =ROUNDDOWN(((E83-50)*0.8),0) -> -40
A84: 28 | C84: 0 | D84: 1 | E84: =SUM(C84/D84) -> 0.000 | F84: =ROUNDDOWN(((E84-50)*0.8),0) -> -40
A86: 2012 SBDGL Team Standings
B87: TEAM # | C87: BUSH | E87: Total Points | F87: Team Points | G87: Team Avg | H87: Week Total | I87: Week Team
A88: 1 | B88: 4 | C88: KVN + Archie C. | E88: 17.5 | F88: 6 | G88: =AVERAGE(E10,E48) -> 56.8125 | H88: 2.5 | I88: 1
A89: 2 | B89: 6 | C89: Hullinger + Jesse Streinz | E89: 17 | F89: 5 | G89: =AVERAGE(E52,E22) -> 60.0625 | H89: 3 | I89: 1
A90: 3 | B90: 7 | C90: Doug Johnson + Shane Thirtyacre | E90: 16 | F90: 7 | G90: =AVERAGE(E9,E47) -> 56.5625 | H90: 2 | I90: 1
A91: 4 | B91: 11 | C91: Tim Potter + Andrew Greco | E91: 15.5 | F91: 5 | G91: =AVERAGE(E8,E16) -> 52.875 | H91: 1 | I91: 0
A92: 5 | B92: 2 | C92: Travis Pike + Kollin Grimm | E92: 14 | F92: 5 | G92: =AVERAGE(E17,E27) -> 55.000 | H92: 2.5 | I92: 1
A93: 6 | B93: 9 | C93: John Williams + Kirby Callahan | E93: 12 | F93: 5 | G93: =AVERAGE(E38,E37) -> 58.250 | H93: 3 | I93: 1
A94: 7 | B94: 5 | C94: Shirtless + Dustin Utley | E94: 11.5 | F94: 3.5 | G94: =AVERAGE(E20,E26) -> 55.3125 | H94: 1.5 | I94: 0.5
A95: 8 | B95: 8 | C95: Sarah Potter + Adam Henderson | E95: 11 | F95: 2 | G95: =AVERAGE(E53,E46) -> 63.750 | H95: 0 | I95: 0
A96: 9 | B96: 10 | C96: Tom Pepper + Travis Fruendt | E96: 9.5 | F96: 3 | G96: =AVERAGE(E50,E28) -> 59.258928571428569 | H96: 3 | I96: 1
A97: 10 | B97: 1 | C97: Woody + Adam Miller | E97: 9 | F97: 3 | G97: =AVERAGE(E12,E23) -> 54.1875 | H97: 0 | I97: 0
A98: 11 | B98: 3 | C98: Adam Stiers + Wyckoff | E98: 8.5 | F98: 2 | G98: =AVERAGE(E40,E19) -> 56.642857142857139 | H98: 0.5 | I98: 0
A99: 12 | B99: 12 | C99: Joshua Beachy + Dustin Nohr | E99: 8 | F99: 3 | G99: =AVERAGE(E21,E30) -> 55.669642857142861 | H99: 0 | I99: 0
A100: 13 | B100: 13 | C100: Perry Thirtyacre + Justin Zehr | E100: 7 | F100: 2.5 | G100: =AVERAGE(E43,E34) -> 58.500 | H100: 1.5 | I100: 0.5
C102: WHACKER
A103: 1 | B103: 25 | C103: Doug Peyton + Chris Clime | E103: 20 | F103: 7 | G103: =AVERAGE(E4,E14) -> 51.625 | H103: 2.5 | I103: 1
A104: 2 | B104: 18 | C104: Dan Kern + Jeremy Farnsworth | E104: 18.5 | F104: 7 | G104: =AVERAGE(E5,E7) -> 50.4375 | H104: 2.5 | I104: 1
A105: 3 | B105: 20 | C105: Matt Fritz + Egglesten | E105: 15 | F105: 5 | G105: =AVERAGE(E35,E36) -> 58.000 | H105: 2.5 | I105: 1
A106: 4 | B106: 24 | C106: Ryan Hamilton + D. Burns | E106: 14 | F106: 4 | G106: =AVERAGE(E45,E25) -> 57.500 | H106: 0.5 | I106: 0
A107: 5 | B107: 21 | C107: Super Dave + Tim Peyton | E107: 12 | F107: 3.5 | G107: =AVERAGE(E6) -> 50.500 | H107: 0 | I107: 0
A108: 6 | B108: 22 | C108: Kurt Conrad + Chad Goodwin | E108: 11.5 | F108: 4 | G108: =AVERAGE(E10,E54) -> 60.4375 | H108: 0.5 | I108: 0
A109: 7 | B109: 17 | C109: Marty Reis + Spencer Eubanks | E109: 10.5 | F109: 4 | G109: =AVERAGE(E49,E33) -> 59.883928571428569 | H109: 1 | I109: 0
A110: 8 | B110: 14 | C110: Average Joe + Jason Rimrodt | E110: 10.5 | F110: 3.5 | G110: =AVERAGE(E15,E41) -> 56.500 | H110: 1 | I110: 0
A111: 9 | B111: 26 | C111: Joel Knutson + Rob Neubrand | E111: 10.5 | F111: 3 | G111: =AVERAGE(E29,E18) -> 55.250 | H111: 0.5 | I111: 0
A112: 10 | B112: 23 | C112: Matt Wieben + Matt Shannon | E112: 9.5 | F112: 3 | G112: =AVERAGE(E13,E32) -> 55.500 | H112: 3 | I112: 1
A113: 11 | B113: 15 | C113: Campos + Nathan Veeder | E113: 9.5 | F113: 2.5 | G113: =AVERAGE(E39,E24) -> 56.6875 | H113: 0.5 | I113: 0
A114: 12 | B114: 19 | C114: Matt Geers + M. Lerch | E114: 7.5 | F114: 3 | G114: =AVERAGE(E55,E31) -> 65.125 | H114: 2 | I114: 1
A115: 13 | B115: 16 | C115: Jerimie Maker + Smith | E115: 6.5 | F115: 2.5 | G115: =AVERAGE(E51,E44) -> 61.125 | H115: 2 | I115: 1