A1: 2012 S.B.D.G.L. STANDINGS Through Week 9 Shaver
A2: Rank | B2: Player | C2: Total Strokes | D2: Weeks | E2: Average | F2: H-Cap | G2: Last | H2: Week Pt. | I2: Total Pts. | J2: Sub Pts.
A4: =A3+1 -> 1 | B4: Doug Peyton | C4: 448 | D4: 9 | E4: =(C4/D4) -> 49.777777777777779 | F4: =ROUNDDOWN(((E4-50)*0.8),0) -> 0 | G4: 52 | H4: 1 | I4: 5
A5: =A4+1 -> 2 | B5: Jeremy Farnsworth | C5: 400 | D5: 8 | E5: =(C5/D5) -> 50.000 | F5: =ROUNDDOWN(((E5-50)*0.8),0) -> 0 | I5: 6 | J5: 0
A6: =A5+1 -> 3 | B6: Tim Peyton | C6: 461 | D6: 9 | E6: =(C6/D6) -> 51.222222222222221 | F6: =ROUNDDOWN(((E6-50)*0.8),0) -> 0 | G6: 57 | I6: 4.5
A7: =A6+1 -> 4 | B7: Dan Kern | C7: 463 | D7: 9 | E7: =(C7/D7) -> 51.444444444444443 | F7: =ROUNDDOWN(((E7-50)*0.8),0) -> 1 | G7: 56 | H7: 0.5 | I7: 5
A8: =A7+1 -> 5 | B8: Kurt Conrad | C8: 476 | D8: 9 | E8: =(C8/D8) -> 52.888888888888886 | F8: =ROUNDDOWN(((E8-50)*0.8),0) -> 2 | G8: 57 | H8: 1 | I8: 5.5
A9: =A8+1 -> 6 | B9: Greco | C9: 477 | D9: 9 | E9: =(C9/D9) -> 53.000 | F9: =ROUNDDOWN(((E9-50)*0.8),0) -> 2 | G9: 63 | H9: 1 | I9: 5
A10: =A9+1 -> 7 | B10: KVN Lavley | C10: 478 | D10: 9 | E10: =(C10/D10) -> 53.111111111111114 | F10: =ROUNDDOWN(((E10-50)*0.8),0) -> 2 | G10: 56 | H10: 1 | I10: 7
A11: =A10+1 -> 8 | B11: Matt Wieben | C11: 484 | D11: 9 | E11: =(C11/D11) -> 53.777777777777779 | F11: =ROUNDDOWN(((E11-50)*0.8),0) -> 3 | G11: 55 | H11: 1 | I11: 4.5
A12: =A11+1 -> 9 | B12: Doug Johnson | C12: 484 | D12: 9 | E12: =(C12/D12) -> 53.777777777777779 | F12: =ROUNDDOWN(((E12-50)*0.8),0) -> 3 | G12: 66 | I12: 5.5
A13: =A12+1 -> 10 | B13: Rimmy | C13: 485 | D13: 9 | E13: =(C13/D13) -> 53.888888888888886 | F13: =ROUNDDOWN(((E13-50)*0.8),0) -> 3 | G13: 53 | I13: 3
A14: =A13+1 -> 11 | B14: Woody | C14: 487 | D14: 9 | E14: =(C14/D14) -> 54.111111111111114 | F14: =ROUNDDOWN(((E14-50)*0.8),0) -> 3 | G14: 61 | I14: 2
A15: =A14+1 -> 12 | B15: Tim Potter | C15: 488 | D15: 9 | E15: =(C15/D15) -> 54.222222222222221 | F15: =ROUNDDOWN(((E15-50)*0.8),0) -> 3 | G15: 56 | H15: 1 | I15: 7.5
A16: =A15+1 -> 13 | B16: Kollin Grimm | C16: 488 | D16: 9 | E16: =(C16/D16) -> 54.222222222222221 | F16: =ROUNDDOWN(((E16-50)*0.8),0) -> 3 | G16: 56 | H16: 1 | I16: 5.5
A17: =A16+1 -> 14 | B17: Chris Clime | C17: 489 | D17: 9 | E17: =(C17/D17) -> 54.333333333333336 | F17: =ROUNDDOWN(((E17-50)*0.8),0) -> 3 | G17: 59 | H17: 0.5 | I17: 8.5
A18: =A17+1 -> 15 | B18: Rob Neubrand | C18: 494 | D18: 9 | E18: =(C18/D18) -> 54.888888888888886 | F18: =ROUNDDOWN(((E18-50)*0.8),0) -> 3 | G18: 61 | I18: 3.5
A19: =A18+1 -> 16 | B19: Stiers | C19: 440 | D19: 8 | E19: =(C19/D19) -> 55.000 | F19: =ROUNDDOWN(((E19-50)*0.8),0) -> 4 | G19: 59 | H19: 1 | I19: 6.5
A20: =A19+1 -> 17 | B20: Beachy | C20: 499 | D20: 9 | E20: =(C20/D20) -> 55.444444444444443 | F20: =ROUNDDOWN(((E20-50)*0.8),0) -> 4 | G20: 62 | I20: 2
A21: =A20+1 -> 18 | B21: Jesse Streinz | C21: 500 | D21: 9 | E21: =(C21/D21) -> 55.555555555555557 | F21: =ROUNDDOWN(((E21-50)*0.8),0) -> 4 | G21: 61 | I21: 6.5
A22: =A21+1 -> 19 | B22: Adam Miller | C22: 501 | D22: 9 | E22: =(C22/D22) -> 55.666666666666664 | F22: =ROUNDDOWN(((E22-50)*0.8),0) -> 4 | G22: 60 | H22: 1 | I22: 5
A23: =A22+1 -> 20 | B23: Utley | C23: 501 | D23: 9 | E23: =(C23/D23) -> 55.666666666666664 | F23: =ROUNDDOWN(((E23-50)*0.8),0) -> 4 | G23: 64 | I23: 4
A24: =A23+1 -> 21 | B24: Ryan Hamilton | C24: 504 | D24: 9 | E24: =(C24/D24) -> 56.000 | F24: =ROUNDDOWN(((E24-50)*0.8),0) -> 4 | G24: 62 | I24: 5.5
A25: =A24+1 -> 22 | B25: Shirtless Bill | C25: 448 | D25: 8 | E25: =(C25/D25) -> 56.000 | F25: =ROUNDDOWN(((E25-50)*0.8),0) -> 4 | I25: 4 | J25: 0
A26: =A25+1 -> 23 | B26: Nate Veeder | C26: 506 | D26: 9 | E26: =(C26/D26) -> 56.222222222222221 | F26: =ROUNDDOWN(((E26-50)*0.8),0) -> 4 | G26: 65 | I26: 3.5
A27: =A26+1 -> 24 | B27: Joel Knutson | C27: 508 | D27: 9 | E27: =(C27/D27) -> 56.444444444444443 | F27: =ROUNDDOWN(((E27-50)*0.8),0) -> 5 | G27: 57 | H27: 1 | I27: 5
A28: =A27+1 -> 25 | B28: Travis Pike | C28: 508 | D28: 9 | E28: =(C28/D28) -> 56.444444444444443 | F28: =ROUNDDOWN(((E28-50)*0.8),0) -> 5 | G28: 60 | H28: 1 | I28: 5.5
A29: =A28+1 -> 26 | B29: Travis Fruendt | C29: 453 | D29: 8 | E29: =(C29/D29) -> 56.625 | F29: =ROUNDDOWN(((E29-50)*0.8),0) -> 5 | G29: 60 | H29: 1 | I29: 4.5
A30: =A29+1 -> 27 | B30: Martin Reis | C30: 516 | D30: 9 | E30: =(C30/D30) -> 57.333333333333336 | F30: =ROUNDDOWN(((E30-50)*0.8),0) -> 5 | G30: 55 | H30: 1 | I30: 3.5
A31: =A30+1 -> 28 | B31: Phil Campos | C31: 520 | D31: 9 | E31: =(C31/D31) -> 57.777777777777779 | F31: =ROUNDDOWN(((E31-50)*0.8),0) -> 6 | G31: 54 | H31: 1 | I31: 4.5
A32: =A31+1 -> 29 | B32: Matt Fritz | C32: 522 | D32: 9 | E32: =(C32/D32) -> 58.000 | F32: =ROUNDDOWN(((E32-50)*0.8),0) -> 6 | G32: 59 | H32: 1 | I32: 6.5
A33: =A32+1 -> 30 | B33: Matt Shannon | C33: 523 | D33: 9 | E33: =(C33/D33) -> 58.111111111111114 | F33: =ROUNDDOWN(((E33-50)*0.8),0) -> 6 | G33: 64 | I33: 3
A34: =A33+1 -> 31 | B34: Perry Thirtyacre | C34: 466 | D34: 8 | E34: =(C34/D34) -> 58.250 | F34: =ROUNDDOWN(((E34-50)*0.8),0) -> 6 | G34: 62 | H34: 1 | I34: 3.5
A35: =A34+1 -> 32 | B35: Dustin Nohr | C35: 466 | D35: 8 | E35: =(C35/D35) -> 58.250 | F35: =ROUNDDOWN(((E35-50)*0.8),0) -> 6 | G35: 69 | I35: 3
A36: =A35+1 -> 33 | B36: Avg. Joe | C36: 528 | D36: 9 | E36: =(C36/D36) -> 58.666666666666664 | F36: =ROUNDDOWN(((E36-50)*0.8),0) -> 6 | G36: 56 | H36: 1 | I36: 5
A37: =A36+1 -> 34 | B37: Frog | C37: 235 | D37: 4 | E37: =(C37/D37) -> 58.750 | F37: =ROUNDDOWN(((E37-50)*0.8),0) -> 7 | G37: 64 | H37: 1 | I37: 5
A38: =A37+1 -> 35 | B38: Ryan Eggleston | C38: 529 | D38: 9 | E38: =(C38/D38) -> 58.777777777777779 | F38: =ROUNDDOWN(((E38-50)*0.8),0) -> 7 | G38: 64 | H38: 1 | I38: 5.5
A39: =A38+1 -> 36 | B39: Kirby Callahan | C39: 533 | D39: 9 | E39: =(C39/D39) -> 59.222222222222221 | F39: =ROUNDDOWN(((E39-50)*0.8),0) -> 7 | G39: 67 | I39: 3.5
A40: =A39+1 -> 37 | B40: John Williams | C40: 533 | D40: 9 | E40: =(C40/D40) -> 59.222222222222221 | F40: =ROUNDDOWN(((E40-50)*0.8),0) -> 7 | G40: 67 | I40: 3.5
A41: =A40+1 -> 38 | B41: David McCuskey | C41: 476 | D41: 8 | E41: =(C41/D41) -> 59.500 | F41: =ROUNDDOWN(((E41-50)*0.8),0) -> 7 | G41: 62 | H41: 1 | I41: 5.5
A42: =A41+1 -> 39 | B42: Wyckoff | C42: 477 | D42: 8 | E42: =(C42/D42) -> 59.625 | F42: =ROUNDDOWN(((E42-50)*0.8),0) -> 7 | G42: 65 | H42: 1 | I42: 3
A43: =A42+1 -> 40 | B43: Adam Henderson | C43: 546 | D43: 9 | E43: =(C43/D43) -> 60.666666666666664 | F43: =ROUNDDOWN(((E43-50)*0.8),0) -> 8 | G43: 67 | H43: 1 | I43: 5
A44: =A43+1 -> 41 | B44: Justin Zehr | C44: 487 | D44: 8 | E44: =(C44/D44) -> 60.875 | F44: =ROUNDDOWN(((E44-50)*0.8),0) -> 8 | G44: 72 | I44: 2
A45: =A44+1 -> 42 | B45: Erik Smith | C45: 551 | D45: 9 | E45: =(C45/D45) -> 61.222222222222221 | F45: =ROUNDDOWN(((E45-50)*0.8),0) -> 8 | G45: 76 | I45: 2
A46: =A45+1 -> 43 | B46: Shane Thirtyacre | C46: 552 | D46: 9 | E46: =(C46/D46) -> 61.333333333333336 | F46: =ROUNDDOWN(((E46-50)*0.8),0) -> 9 | G46: 65 | I46: 4.5
A47: =A46+1 -> 44 | B47: Archie Coulter | C47: 556 | D47: 9 | E47: =(C47/D47) -> 61.777777777777779 | F47: =ROUNDDOWN(((E47-50)*0.8),0) -> 9 | G47: 66 | I47: 5.5
A48: =A47+1 -> 45 | B48: D. Burns | C48: 556 | D48: 9 | E48: =(C48/D48) -> 61.777777777777779 | F48: =ROUNDDOWN(((E48-50)*0.8),0) -> 9 | G48: 78 | I48: 4.5
A49: =A48+1 -> 46 | B49: Maker | C49: 563 | D49: 9 | E49: =(C49/D49) -> 62.555555555555557 | F49: =ROUNDDOWN(((E49-50)*0.8),0) -> 10 | G49: 60 | H49: 1 | I49: 3
A50: =A49+1 -> 47 | B50: Tom Pepper | C50: 566 | D50: 9 | E50: =(C50/D50) -> 62.888888888888886 | F50: =ROUNDDOWN(((E50-50)*0.8),0) -> 10 | G50: 67 | I50: 3
A51: =A50+1 -> 48 | B51: Spencer Eubanks | C51: 505 | D51: 8 | E51: =(C51/D51) -> 63.125 | F51: =ROUNDDOWN(((E51-50)*0.8),0) -> 10 | G51: 70 | I51: 4
A52: =A51+1 -> 49 | B52: Shawn Hullinger | C52: 589 | D52: 9 | E52: =(C52/D52) -> 65.444444444444443 | F52: =ROUNDDOWN(((E52-50)*0.8),0) -> 12 | G52: 67 | H52: 1 | I52: 5.5
A53: =A52+1 -> 50 | B53: Sarah Potter | C53: 611 | D53: 9 | E53: =(C53/D53) -> 67.888888888888886 | F53: =ROUNDDOWN(((E53-50)*0.8),0) -> 14 | G53: 70 | H53: 1 | I53: 6
A54: =A53+1 -> 51 | B54: Chad Goodwin | C54: 411 | D54: 6 | E54: =(C54/D54) -> 68.500 | F54: =ROUNDDOWN(((E54-50)*0.8),0) -> 14 | I54: 3 | J54: 0
A55: =A54+1 -> 52 | B55: M. Lerch | C55: 662 | D55: 9 | E55: =(C55/D55) -> 73.555555555555557 | F55: =ROUNDDOWN(((E55-50)*0.8),0) -> 18 | G55: 76 | I55: 1
A58: Subs | B58: Player | C58: Total Strokes | D58: Weeks | E58: Average | F58: H-Cap | G58: Last | H58: Week Pt. | I58: Total Pts. | J58: Subed For
A59: 1 | B59: Ian Jacobs | C59: 526 | D59: 9 | E59: =(C59/D59) -> 58.444444444444443 | F59: =ROUNDDOWN(((E59-50)*0.8),0) -> 6 | G59: 57 | H59: NA | I59: 0 | J59: NA
A60: 2 | B60: Ben Sandell | C60: 333 | D60: 5 | E60: =SUM(C60/D60) -> 66.600 | F60: =ROUNDDOWN(((E60-50)*0.8),0) -> 13 | I60: 0
A61: 3 | B61: AO | C61: 196 | D61: 4 | E61: =SUM(C61/D61) -> 49.000 | F61: =ROUNDDOWN(((E61-50)*0.8),0) -> 0 | G61: 54 | H61: 0 | I61: 2 | J61: Farns
A62: 4 | B62: Stibal | C62: 175 | D62: 3 | E62: =SUM(C62/D62) -> 58.333333333333336 | F62: =ROUNDDOWN(((E62-50)*0.8),0) -> 6 | I62: 1
A63: 5 | B63: Chuck | C63: =54+58 -> 112 | D63: 2 | E63: =SUM(C63/D63) -> 56.000 | F63: =ROUNDDOWN(((E63-50)*0.8),0) -> 4 | I63: 1.5
A64: 6 | B64: Dan Lewis | C64: 117 | D64: 2 | E64: =SUM(C64/D64) -> 58.500 | F64: =ROUNDDOWN(((E64-50)*0.8),0) -> 6 | G64: 63 | H64: 0 | I64: 0 | J64: Goodwin
A65: 8 | B65: Nate ? | C65: 62 | D65: 1 | E65: =SUM(C65/D65) -> 62.000 | F65: =ROUNDDOWN(((E65-50)*0.8),0) -> 9 | G65: 62 | J65: NA
A66: 9 | B66: Nate ? | C66: 57 | D66: 1 | E66: =SUM(C66/D66) -> 57.000 | F66: NA | G66: 57 | J66: NA
A67: 10 | B67: Timmy | C67: 59 | D67: 1 | E67: =SUM(C67/D67) -> 59.000 | F67: NA | G67: 59 | H67: 0 | J67: Shirtless
A68: 11 | B68: Rory | C68: 62 | D68: 1 | E68: =SUM(C68/D68) -> 62.000 | F68: NA | G68: 62 | H68: NA | I68: 0 | J68: NA
A69: 12 | B69: Bob Hernandez | C69: 56 | D69: 1 | E69: =SUM(C69/D69) -> 56.000 | F69: NA | I69: 0
A70: 13 | B70: Rob Mumma | C70: 57 | D70: 1 | E70: =SUM(C70/D70) -> 57.000 | F70: NA | I70: 0
A71: 14 | B71: Dev Nelson | C71: 58 | D71: 1 | E71: =SUM(C71/D71) -> 58.000 | F71: NA | I71: 1
A72: 15 | B72: Greg Friestad | C72: 59 | D72: 1 | E72: =SUM(C72/D72) -> 59.000 | F72: NA | I72: 1
A73: 16 | B73: Steve Adkinson | C73: 65 | D73: 1 | E73: =SUM(C73/D73) -> 65.000 | F73: NA | I73: 0
A74: 17 | B74: Prouty | C74: 71 | D74: 1 | E74: =SUM(C74/D74) -> 71.000 | F74: NA | I74: 0
A75: 18 | B75: Tony Rios | C75: DNF | D75: 1 | E75: NA | F75: NA | I75: 0
A77: 2012 SBDGL Team Standing
B78: TEAM # | C78: BUSH | E78: Total Points | F78: Team Points | G78: Team Avg | H78: Week Total | I78: Week Team
A79: 1 | B79: 4 | C79: KVN + Archie C. | E79: 19.5 | F79: 7 | G79: =AVERAGE(E10,E47) -> 57.444444444444443 | H79: 2 | I79: 1
A80: 2 | B80: 11 | C80: Tim Potter + Andrew Greco | E80: 18.5 | F80: 6 | G80: =AVERAGE(E15,E9) -> 53.611111111111114 | H80: 3 | I80: 1
A81: 3 | B81: 6 | C81: Hullinger + Jesse Streinz | E81: 18 | F81: 5 | G81: =AVERAGE(E52,E21) -> 60.500 | H81: 1 | I81: 0
A82: 4 | B82: 2 | C82: Travis Pike + Kollin Grimm | E82: 17 | F82: 6 | G82: =AVERAGE(E28,E16) -> 55.333333333333329 | H82: 3 | I82: 1
A83: 5 | B83: 7 | C83: Doug Johnson + Shane Thirtyacre | E83: 16 | F83: 7 | G83: =AVERAGE(E46,E12) -> 57.555555555555557 | H83: 0 | I83: 0
A84: 6 | B84: 8 | C84: Sarah Potter + Adam Henderson | E84: 14 | F84: 3 | G84: =AVERAGE(E53,E43) -> 64.277777777777771 | H84: 3 | I84: 1
A85: 7 | B85: 9 | C85: John Williams + Kirby Callahan | E85: 12 | F85: 5 | G85: =AVERAGE(E39,E40) -> 59.222222222222221 | H85: 0 | I85: 0
A86: 8 | B86: 5 | C86: Shirtless + Dustin Utley | E86: 11.5 | F86: 3.5 | G86: =AVERAGE(E25,E23) -> 55.833333333333329 | H86: 0 | I86: 0
A87: 9 | B87: 3 | C87: Adam Stiers + Wyckoff | E87: 11.5 | F87: 3 | G87: =AVERAGE(E19,E42) -> 57.3125 | H87: 3 | I87: 1
A88: 10 | B88: 10 | C88: Tom Pepper + Travis Fruendt | E88: 11 | F88: 3.5 | G88: =AVERAGE(E50,E29) -> 59.756944444444443 | H88: 1.5 | I88: 0.5
A89: 11 | B89: 1 | C89: Woody + Adam Miller | E89: 10.5 | F89: 3.5 | G89: =AVERAGE(E14,E22) -> 54.888888888888886 | H89: 1.5 | I89: 0.5
A90: 12 | B90: 12 | C90: Joshua Beachy + Dustin Nohr | E90: 8 | F90: 3 | G90: =AVERAGE(E20,E35) -> 56.847222222222221 | H90: 0 | I90: 0
A91: 13 | B91: 13 | C91: Perry Thirtyacre + Justin Zehr | E91: 8 | F91: 2.5 | G91: =AVERAGE(E44,E34) -> 59.5625 | H91: 1 | I91: 0
C93: WHACKER
A94: 1 | B94: 25 | C94: Doug Peyton + Chris Clime | E94: 22.5 | F94: 8 | G94: =AVERAGE(E4,E17) -> 52.055555555555557 | H94: 2.5 | I94: 1
A95: 2 | B95: 18 | C95: Dan Kern + Jeremy Farnsworth | E95: 19 | F95: 7 | G95: =AVERAGE(E5,E7) -> 50.722222222222221 | H95: 0.5 | I95: 0
A96: 3 | B96: 20 | C96: Matt Fritz + Egglesten | E96: 18 | F96: 6 | G96: =AVERAGE(E32,E38) -> 58.388888888888886 | H96: 3 | I96: 1
A97: 4 | B97: 21 | C97: Super Dave + Tim Peyton | E97: 14 | F97: 4.5 | G97: =AVERAGE(E41,E6) -> 55.361111111111114 | H97: 2 | I97: 1
A98: 5 | B98: 24 | C98: Ryan Hamilton + D. Burns | E98: 14 | F98: 4 | G98: =AVERAGE(E24,E48) -> 58.888888888888886 | H98: 0 | I98: 0
A99: 6 | B99: 14 | C99: Average Joe + Jason Rimrodt | E99: 12.5 | F99: 4.5 | G99: =AVERAGE(E13,E36) -> 56.277777777777771 | H99: 2 | I99: 1
A100: 7 | B100: 26 | C100: Joel Knutson + Rob Neubrand | E100: 12.5 | F100: 4 | G100: =AVERAGE(E27,E18) -> 55.666666666666664 | H100: 2 | I100: 1
A101: 8 | B101: 22 | C101: Kurt Conrad + Chad Goodwin | E101: 12.5 | F101: 4 | G101: =AVERAGE(E8,E54) -> 60.694444444444443 | H101: 1 | I101: 0
A102: 9 | B102: 17 | C102: Marty Reis + Spencer Eubanks | E102: 11.5 | F102: 4 | G102: =AVERAGE(E51,E30) -> 60.229166666666671 | H102: 1 | I102: 0
A103: 10 | B103: 15 | C103: Campos + Nathan Veeder | E103: 11.5 | F103: 3.5 | G103: =AVERAGE(E31,E26) -> 57.000 | H103: 2 | I103: 1
A104: 11 | B104: 23 | C104: Matt Wieben + Matt Shannon | E104: 10.5 | F104: 3 | G104: =AVERAGE(E11,E33) -> 55.944444444444443 | H104: 1 | I104: 0
A105: 12 | B105: 16 | C105: Jerimie Maker + Smith | E105: 8.5 | F105: 3.5 | G105: =AVERAGE(E49,E45) -> 61.888888888888886 | H105: 2 | I105: 1
A106: 13 | B106: 19 | C106: Matt Geers + M. Lerch | E106: 8.5 | F106: 3 | G106: =AVERAGE(E37,E55) -> 66.152777777777771 | H106: 1 | I106: 0