A1: 2012 S.B.D.G.L. STANDINGS Through Week 4 Turkey
A2: Rank | B2: Player | C2: Total Strokes | D2: Weeks | E2: Average | F2: H-Cap | G2: Last | H2: Week Pt. | I2: Total Pts. | J2: Sub Pts.
A4: =A3+1 -> 1 | B4: Jeremy Farnsworth | C4: 190 | D4: 4 | E4: =(C4/D4) -> 47.500 | F4: 0 | G4: 50 | H4: 1 | I4: 3
A5: =A4+1 -> 2 | B5: Doug Peyton | C5: 191 | D5: 4 | E5: =(C5/D5) -> 47.750 | F5: 0 | G5: 48 | H5: 1 | I5: 2
A6: =A5+1 -> 3 | B6: Tim Peyton | C6: 192 | D6: 4 | E6: =(C6/D6) -> 48.000 | F6: 0 | G6: 47 | H6: 1 | I6: 2.5
A7: =A6+1 -> 4 | B7: Greco | C7: 195 | D7: 4 | E7: =(C7/D7) -> 48.750 | F7: 0 | G7: 48 | H7: 1 | I7: 2
A8: =A7+1 -> 5 | B8: KVN Lavley | C8: 201 | D8: 4 | E8: =(C8/D8) -> 50.250 | F8: =ROUNDDOWN(((E8-50)*0.8),0) -> 0 | G8: 51 | H8: 1 | I8: 3.5
A9: =A8+1 -> 6 | B9: Doug Johnson | C9: 202 | D9: 4 | E9: =(C9/D9) -> 50.500 | F9: =ROUNDDOWN(((E9-50)*0.8),0) -> 0 | G9: 50 | H9: 0.5 | I9: 2.5
A10: =A9+1 -> 7 | B10: Dan Kern | C10: 202 | D10: 4 | E10: =(C10/D10) -> 50.500 | F10: =ROUNDDOWN(((E10-50)*0.8),0) -> 0 | G10: 56 | H10: 0 | I10: 2
A11: =A10+1 -> 8 | B11: Beachy | C11: 203 | D11: 4 | E11: =(C11/D11) -> 50.750 | F11: =ROUNDDOWN(((E11-50)*0.8),0) -> 0 | G11: 52 | H11: 0 | I11: 1
A12: =A11+1 -> 9 | B12: Kurt Conrad | C12: 203 | D12: 4 | E12: =(C12/D12) -> 50.750 | F12: =ROUNDDOWN(((E12-50)*0.8),0) -> 0 | G12: 54 | H12: 0 | I12: 2
A13: =A12+1 -> 10 | B13: Woody | C13: 204 | D13: 4 | E13: =(C13/D13) -> 51.000 | F13: =ROUNDDOWN(((E13-50)*0.8),0) -> 0 | G13: 52 | H13: 0 | I13: 2
A14: =A13+1 -> 11 | B14: Tim Potter | C14: 205 | D14: 4 | E14: =(C14/D14) -> 51.250 | F14: =ROUNDDOWN(((E14-50)*0.8),0) -> 1 | G14: 51 | H14: 1 | I14: 3.5
A15: =A14+1 -> 12 | B15: Chris Clime | C15: 206 | D15: 4 | E15: =(C15/D15) -> 51.500 | F15: =ROUNDDOWN(((E15-50)*0.8),0) -> 1 | G15: 51 | H15: 1 | I15: 4
A16: =A15+1 -> 13 | B16: Kollin Grimm | C16: 206 | D16: 4 | E16: =(C16/D16) -> 51.500 | F16: =ROUNDDOWN(((E16-50)*0.8),0) -> 1 | G16: 51 | H16: 0.5 | I16: 2
A17: =A16+1 -> 14 | B17: Nate Veeder | C17: 206 | D17: 4 | E17: =(C17/D17) -> 51.500 | F17: =ROUNDDOWN(((E17-50)*0.8),0) -> 1 | G17: 55 | H17: 0 | I17: 2.5
A18: =A17+1 -> 15 | B18: Utley | C18: 207 | D18: 4 | E18: =(C18/D18) -> 51.750 | F18: =ROUNDDOWN(((E18-50)*0.8),0) -> 1 | G18: 55 | H18: 0 | I18: 2
A19: =A18+1 -> 16 | B19: Adam Miller | C19: 208 | D19: 4 | E19: =(C19/D19) -> 52.000 | F19: =ROUNDDOWN(((E19-50)*0.8),0) -> 1 | G19: 51 | H19: 1 | I19: 2.5
A20: =A19+1 -> 17 | B20: Matt Wieben | C20: 210 | D20: 4 | E20: =(C20/D20) -> 52.500 | F20: =ROUNDDOWN(((E20-50)*0.8),0) -> 2 | G20: 51 | H20: 1 | I20: 1
A21: =A20+1 -> 18 | B21: Rimmy | C21: 210 | D21: 4 | E21: =(C21/D21) -> 52.500 | F21: =ROUNDDOWN(((E21-50)*0.8),0) -> 2 | G21: 51 | H21: 0 | I21: 1
A22: =A21+1 -> 19 | B22: Jesse Streinz | C22: 211 | D22: 4 | E22: =(C22/D22) -> 52.750 | F22: =ROUNDDOWN(((E22-50)*0.8),0) -> 2 | G22: 55 | H22: 0.5 | I22: 3.5
A23: =A22+1 -> 20 | B23: Wyckoff | C23: 159 | D23: 3 | E23: =(C23/D23) -> 53.000 | F23: =ROUNDDOWN(((E23-50)*0.8),0) -> 2 | G23: 0 | H23: 0 | I23: 1
A24: =A23+1 -> 21 | B24: Ryan Hamilton | C24: 212 | D24: 4 | E24: =(C24/D24) -> 53.000 | F24: =ROUNDDOWN(((E24-50)*0.8),0) -> 2 | G24: 52 | H24: 0 | I24: 2.5
A25: =A24+1 -> 22 | B25: Rob Neubrand | C25: 212 | D25: 4 | E25: =(C25/D25) -> 53.000 | F25: =ROUNDDOWN(((E25-50)*0.8),0) -> 2 | G25: 55 | H25: 0 | I25: 1
A26: =A25+1 -> 23 | B26: Travis Pike | C26: 212 | D26: 4 | E26: =(C26/D26) -> 53.000 | F26: =ROUNDDOWN(((E26-50)*0.8),0) -> 2 | G26: 56 | H26: 0 | I26: 2
A27: =A26+1 -> 24 | B27: Stiers | C27: 216 | D27: 4 | E27: =(C27/D27) -> 54.000 | F27: =ROUNDDOWN(((E27-50)*0.8),0) -> 3 | G27: 57 | H27: 1 | I27: 2
A28: =A27+1 -> 25 | B28: Joel Knutson | C28: 217 | D28: 4 | E28: =(C28/D28) -> 54.250 | F28: =ROUNDDOWN(((E28-50)*0.8),0) -> 3 | G28: 52 | H28: 1 | I28: 2
A29: =A28+1 -> 26 | B29: Martin Reis | C29: 217 | D29: 4 | E29: =(C29/D29) -> 54.250 | F29: =ROUNDDOWN(((E29-50)*0.8),0) -> 3 | G29: 56 | H29: 0 | I29: 2
A30: =A29+1 -> 27 | B30: Frog | C30: 109 | D30: 2 | E30: =(C30/D30) -> 54.500 | F30: =ROUNDDOWN(((E30-50)*0.8),0) -> 3 | G30: 0 | I30: 2 | J30: 0.5
A31: =A30+1 -> 28 | B31: Kirby Callahan | C31: 219 | D31: 4 | E31: =(C31/D31) -> 54.750 | F31: =ROUNDDOWN(((E31-50)*0.8),0) -> 3 | G31: 58 | H31: 0 | I31: 2
A32: =A31+1 -> 29 | B32: Travis Fruendt | C32: 220 | D32: 4 | E32: =(C32/D32) -> 55.000 | F32: =ROUNDDOWN(((E32-50)*0.8),0) -> 4 | G32: 58 | H32: 1 | I32: 2
A33: =A32+1 -> 30 | B33: Shirtless Bill | C33: 220 | D33: 4 | E33: =(C33/D33) -> 55.000 | F33: =ROUNDDOWN(((E33-50)*0.8),0) -> 4 | G33: 58 | H33: 0 | I33: 1
A34: =A33+1 -> 31 | B34: Ryan Eggleston | C34: 221 | D34: 4 | E34: =(C34/D34) -> 55.250 | F34: =ROUNDDOWN(((E34-50)*0.8),0) -> 4 | G34: 54 | H34: 0 | I34: 2
A35: =A34+1 -> 32 | B35: Perry Thirtyacre | C35: 166 | D35: 3 | E35: =(C35/D35) -> 55.333333333333336 | F35: =ROUNDDOWN(((E35-50)*0.8),0) -> 4 | G35: 0 | I35: 0.5 | J35: 0
A36: =A35+1 -> 33 | B36: Justin Zehr | C36: 222 | D36: 4 | E36: =(C36/D36) -> 55.500 | F36: =ROUNDDOWN(((E36-50)*0.8),0) -> 4 | G36: 55 | H36: 0 | I36: 1
A37: =A36+1 -> 34 | B37: Dustin Nohr | C37: 223 | D37: 4 | E37: =(C37/D37) -> 55.750 | F37: =ROUNDDOWN(((E37-50)*0.8),0) -> 4 | G37: 61 | H37: 0 | I37: 1
A38: =A37+1 -> 35 | B38: Matt Fritz | C38: 224 | D38: 4 | E38: =(C38/D38) -> 56.000 | F38: =ROUNDDOWN(((E38-50)*0.8),0) -> 4 | G38: 57 | H38: 1 | I38: 4
A39: =A38+1 -> 36 | B39: Phil Campos | C39: 225 | D39: 4 | E39: =(C39/D39) -> 56.250 | F39: =ROUNDDOWN(((E39-50)*0.8),0) -> 5 | G39: 53 | H39: 1 | I39: 3
A40: =A39+1 -> 37 | B40: Matt Shannon | C40: 226 | D40: 4 | E40: =(C40/D40) -> 56.500 | F40: =ROUNDDOWN(((E40-50)*0.8),0) -> 5 | G40: 56 | H40: 0 | I40: 1
A41: =A40+1 -> 38 | B41: John Williams | C41: 227 | D41: 4 | E41: =(C41/D41) -> 56.750 | F41: =ROUNDDOWN(((E41-50)*0.8),0) -> 5 | G41: 54 | H41: 1 | I41: 1.5
A42: =A41+1 -> 39 | B42: D. Burns | C42: 227 | D42: 4 | E42: =(C42/D42) -> 56.750 | F42: =ROUNDDOWN(((E42-50)*0.8),0) -> 5 | G42: 58 | H42: 0 | I42: 3
A43: =A42+1 -> 40 | B43: Avg. Joe | C43: 227 | D43: 4 | E43: =(C43/D43) -> 56.750 | F43: =ROUNDDOWN(((E43-50)*0.8),0) -> 5 | G43: 59 | H43: 0 | I43: 1
A44: =A43+1 -> 41 | B44: David McCuskey | C44: 171 | D44: 3 | E44: =(C44/D44) -> 57.000 | F44: =ROUNDDOWN(((E44-50)*0.8),0) -> 5 | G44: 58 | H44: 1 | I44: 2.5
A45: =A44+1 -> 42 | B45: Adam Henderson | C45: 229 | D45: 4 | E45: =(C45/D45) -> 57.250 | F45: =ROUNDDOWN(((E45-50)*0.8),0) -> 5 | G45: 55 | H45: 1 | I45: 3
A46: =A45+1 -> 43 | B46: Erik Smith | C46: 229 | D46: 4 | E46: =(C46/D46) -> 57.250 | F46: =ROUNDDOWN(((E46-50)*0.8),0) -> 5 | G46: 58 | H46: 1 | I46: 1
A47: =A46+1 -> 44 | B47: Spencer Eubanks | C47: 176 | D47: 3 | E47: =(C47/D47) -> 58.666666666666664 | F47: =ROUNDDOWN(((E47-50)*0.8),0) -> 6 | G47: 0 | I47: 2 | J47: 1
A48: =A47+1 -> 45 | B48: Shane Thirtyacre | C48: 237 | D48: 4 | E48: =(C48/D48) -> 59.250 | F48: =ROUNDDOWN(((E48-50)*0.8),0) -> 7 | G48: 56 | H48: 1 | I48: 2.5
A49: =A48+1 -> 46 | B49: Maker | C49: 237 | D49: 4 | E49: =(C49/D49) -> 59.250 | F49: =ROUNDDOWN(((E49-50)*0.8),0) -> 7 | G49: 60 | H49: 0 | I49: 1
A50: =A49+1 -> 47 | B50: Archie Coulter | C50: 238 | D50: 4 | E50: =(C50/D50) -> 59.500 | F50: =ROUNDDOWN(((E50-50)*0.8),0) -> 7 | G50: 55 | H50: 1 | I50: 2.5
A51: =A50+1 -> 48 | B51: Tom Pepper | C51: 238 | D51: 4 | E51: =(C51/D51) -> 59.500 | F51: =ROUNDDOWN(((E51-50)*0.8),0) -> 7 | G51: 55 | H51: 1 | I51: 2
A52: =A51+1 -> 49 | B52: Shawn Hullinger | C52: 255 | D52: 4 | E52: =(C52/D52) -> 63.750 | F52: =ROUNDDOWN(((E52-50)*0.8),0) -> 11 | G52: 69 | H52: 0 | I52: 1
A53: =A52+1 -> 50 | B53: Sarah Potter | C53: 264 | D53: 4 | E53: =(C53/D53) -> 66.000 | F53: =ROUNDDOWN(((E53-50)*0.8),0) -> 12 | G53: 73 | H53: 0 | I53: 2
A54: =A53+1 -> 51 | B54: Chad Goodwin | C54: 272 | D54: 4 | E54: =(C54/D54) -> 68.000 | F54: =ROUNDDOWN(((E54-50)*0.8),0) -> 14 | G54: 63 | H54: 1 | I54: 1.5
A55: =A54+1 -> 52 | B55: M. Lerch | C55: 280 | D55: 4 | E55: =(C55/D55) -> 70.000 | F55: =ROUNDDOWN(((E55-50)*0.8),0) -> 16 | G55: 71 | H55: 1 | I55: 1
A57: Subs | B57: Player | C57: Total Strokes | D57: Weeks | E57: Average | F57: H-Cap | G57: Last | H57: Week Pt. | I57: Total Pts. | J57: Subed For
A58: 1 | B58: Ian Jacobs | C58: 224 | D58: 4 | E58: =(C58/D58) -> 56.000 | F58: =ROUNDDOWN(((E58-50)*0.8),0) -> 4 | G58: 55 | H58: 0 | I58: 0 | J58: NA
A59: 2 | B59: Rob Mumma | C59: 57 | D59: 1 | E59: =SUM(C59/D59) -> 57.000 | F59: =ROUNDDOWN(((E59-50)*0.8),0) -> 5 | G59: 0 | I59: 0 | J59: NA
A60: 3 | B60: Ben Sandell | C60: 127 | D60: 2 | E60: =SUM(C60/D60) -> 63.500 | F60: =ROUNDDOWN(((E60-50)*0.8),0) -> 10 | G60: 65 | H60: 0 | I60: 0 | J60: P. Thirtyacre
A61: 4 | B61: AO | C61: 95 | D61: 2 | E61: =SUM(C61/D61) -> 47.500 | F61: 0 | G61: 49 | H61: 1 | I61: 1 | J61: Spencer
A62: 5 | B62: Stibal | C62: 52 | D62: 1 | E62: =SUM(C62/D62) -> 52.000 | F62: =ROUNDDOWN(((E62-50)*0.8),0) -> 1 | G62: 0 | I62: 1 | J62: NA
A63: 6 | B63: Chuck | C63: 54 | D63: 1 | E63: =SUM(C63/D63) -> 54.000 | F63: =ROUNDDOWN(((E63-50)*0.8),0) -> 3 | G63: 54 | H63: 0.5 | I63: 0.5 | J63: FROG
A64: 7 | C64: 0 | D64: 1 | E64: =SUM(C64/D64) -> 0.000 | F64: =ROUNDDOWN(((E64-50)*0.8),0) -> -40
A65: 8 | C65: 0 | D65: 1 | E65: =SUM(C65/D65) -> 0.000 | F65: =ROUNDDOWN(((E65-50)*0.8),0) -> -40
A66: 9 | C66: 0 | D66: 1 | E66: =SUM(C66/D66) -> 0.000 | F66: =ROUNDDOWN(((E66-50)*0.8),0) -> -40
A67: 10 | C67: 0 | D67: 1 | E67: =SUM(C67/D67) -> 0.000 | F67: =ROUNDDOWN(((E67-50)*0.8),0) -> -40
A68: 11 | C68: 0 | D68: 1 | E68: =SUM(C68/D68) -> 0.000 | F68: =ROUNDDOWN(((E68-50)*0.8),0) -> -40
A69: 12 | C69: 0 | D69: 1 | E69: =SUM(C69/D69) -> 0.000 | F69: =ROUNDDOWN(((E69-50)*0.8),0) -> -40
A70: 13 | C70: 0 | D70: 1 | E70: =SUM(C70/D70) -> 0.000 | F70: =ROUNDDOWN(((E70-50)*0.8),0) -> -40
A71: 14 | C71: 0 | D71: 1 | E71: =SUM(C71/D71) -> 0.000 | F71: =ROUNDDOWN(((E71-50)*0.8),0) -> -40
A72: 15 | C72: 0 | D72: 1 | E72: =SUM(C72/D72) -> 0.000 | F72: =ROUNDDOWN(((E72-50)*0.8),0) -> -40
A73: 16 | C73: 0 | D73: 1 | E73: =SUM(C73/D73) -> 0.000 | F73: =ROUNDDOWN(((E73-50)*0.8),0) -> -40
A74: 17 | C74: 0 | D74: 1 | E74: =SUM(C74/D74) -> 0.000 | F74: =ROUNDDOWN(((E74-50)*0.8),0) -> -40
A75: 18 | C75: 0 | D75: 1 | E75: =SUM(C75/D75) -> 0.000 | F75: =ROUNDDOWN(((E75-50)*0.8),0) -> -40
A76: 19 | C76: 0 | D76: 1 | E76: =SUM(C76/D76) -> 0.000 | F76: =ROUNDDOWN(((E76-50)*0.8),0) -> -40
A77: 20 | C77: 0 | D77: 1 | E77: =SUM(C77/D77) -> 0.000 | F77: =ROUNDDOWN(((E77-50)*0.8),0) -> -40
A78: 21 | C78: 0 | D78: 1 | E78: =SUM(C78/D78) -> 0.000 | F78: =ROUNDDOWN(((E78-50)*0.8),0) -> -40
A79: 22 | C79: 0 | D79: 1 | E79: =SUM(C79/D79) -> 0.000 | F79: =ROUNDDOWN(((E79-50)*0.8),0) -> -40
A80: 23 | C80: 0 | D80: 1 | E80: =SUM(C80/D80) -> 0.000 | F80: =ROUNDDOWN(((E80-50)*0.8),0) -> -40
A81: 24 | C81: 0 | D81: 1 | E81: =SUM(C81/D81) -> 0.000 | F81: =ROUNDDOWN(((E81-50)*0.8),0) -> -40
A82: 25 | C82: 0 | D82: 1 | E82: =SUM(C82/D82) -> 0.000 | F82: =ROUNDDOWN(((E82-50)*0.8),0) -> -40
A83: 26 | C83: 0 | D83: 1 | E83: =SUM(C83/D83) -> 0.000 | F83: =ROUNDDOWN(((E83-50)*0.8),0) -> -40
A84: 27 | C84: 0 | D84: 1 | E84: =SUM(C84/D84) -> 0.000 | F84: =ROUNDDOWN(((E84-50)*0.8),0) -> -40
A85: 28 | C85: 0 | D85: 1 | E85: =SUM(C85/D85) -> 0.000 | F85: =ROUNDDOWN(((E85-50)*0.8),0) -> -40
A87: 2012 SBDGL Team Standings
B88: TEAM # | C88: BUSH | E88: Total Points | F88: Team Points | G88: Team Avg
A89: 1 | B89: 4 | C89: KVN + Archie C. | E89: 9 | F89: 3 | G89: =AVERAGE(E8,E50) -> 54.875
A90: 2 | B90: 11 | C90: Tim Potter + Andrew Greco | E90: 8.5 | F90: 3 | G90: =AVERAGE(E7,E14) -> 50.000
A91: 3 | B91: 7 | C91: Doug Johnson + Shane Thirtyacre | E91: 8 | F91: 3 | G91: =AVERAGE(E48,E9) -> 54.875
A92: 4 | B92: 6 | C92: Hullinger + Jesse Streinz | E92: 7.5 | F92: 2 | G92: =AVERAGE(E52,E22) -> 58.250
A93: 5 | B93: 9 | C93: John Williams + Kirby Callahan | E93: 6.5 | F93: 3 | G93: =AVERAGE(E31,E41) -> 55.750
A94: 6 | B94: 1 | C94: Woody + Adam Miller | E94: 6.5 | F94: 2 | G94: =AVERAGE(E13,E19) -> 51.500
A95: 7 | B95: 8 | C95: Sarah Potter + Adam Henderson | E95: 6 | F95: 1 | G95: =AVERAGE(E53,E45) -> 61.625
A96: 8 | B96: 2 | C96: Travis Pike + Kollin Grimm | E96: 6 | F96: 2 | G96: =AVERAGE(E16,E26) -> 52.250
A97: 9 | B97: 10 | C97: Tom Pepper + Travis Fruendt | E97: 5 | F97: 2 | G97: =AVERAGE(E51,E32) -> 57.250
A98: 10 | B98: 5 | C98: Shirtless + Dustin Utley | E98: 5 | F98: 2 | G98: =AVERAGE(E18,E33) -> 53.375
A99: 11 | B99: 3 | C99: Adam Stiers + Wyckoff | E99: 4 | F99: 1 | G99: =AVERAGE(E23,E27) -> 53.500
A100: 12 | B100: 13 | C100: Perry Thirtyacre + Justin Zehr | E100: 3.5 | F100: 1 | G100: =AVERAGE(E35,E36) -> 55.416666666666671
A101: 13 | B101: 12 | C101: Joshua Beachy + Dustin Nohr | E101: 3 | F101: 1 | G101: =AVERAGE(E11,E37) -> 53.250
C103: WHACKER
A104: 1 | B104: 25 | C104: Doug Peyton + Chris Clime | E104: 9 | F104: 3 | G104: =AVERAGE(E15,E5) -> 49.625
A105: 2 | B105: 20 | C105: Matt Fritz + Egglesten | E105: 8.5 | F105: 2.5 | G105: =AVERAGE(E34,E38) -> 55.625
A106: 3 | B106: 24 | C106: Ryan Hamilton + D. Burns | E106: 8.5 | F106: 3 | G106: =AVERAGE(E41,E24) -> 54.875
A107: 4 | B107: 15 | C107: Campos + Nathan Veeder | E107: 8 | F107: 2.5 | G107: =AVERAGE(E39,E17) -> 53.875
A108: 5 | B108: 18 | C108: Dan Kern + Jeremy Farnsworth | E108: 8 | F108: 3 | G108: =AVERAGE(E4,E10) -> 49.000
A109: 6 | B109: 17 | C109: Marty Reis + Spencer Eubanks | E109: 7 | F109: 3 | G109: =AVERAGE(E47,E29) -> 56.458333333333329
A110: 7 | B110: 21 | C110: Super Dave + Tim Peyton | E110: 6.5 | F110: 2 | G110: =AVERAGE(E44,E6) -> 52.500
A111: 8 | B111: 22 | C111: Kurt Conrad + Chad Goodwin | E111: 5.5 | F111: 2 | G111: =AVERAGE(E54,E12) -> 59.375
A112: 9 | B112: 26 | C112: Joel Knutson + Rob Neubrand | E112: 4 | F112: 1 | G112: =AVERAGE(E25,E28) -> 53.625
A113: 10 | B113: 19 | C113: Matt Geers + M. Lerch | E113: 3.5 | F113: 1 | G113: =AVERAGE(E55,E30) -> 62.250
A114: 11 | B114: 16 | C114: Jerimie Maker + Smith | E114: 3 | F114: 1 | G114: =AVERAGE(E49,E46) -> 58.250
A115: 12 | B115: 23 | C115: Matt Wieben + Matt Shannon | E115: 3 | F115: 1 | G115: =AVERAGE(E20,E40) -> 54.500
A116: 13 | B116: 14 | C116: Average Joe + Jason Rimrodt | E116: 3 | F116: 1 | G116: =AVERAGE(E43,E21) -> 54.625