A1: 2012 S.B.D.G.L. STANDINGS Through Week 17 Sugar Bottom
A2: Rank | B2: Player | C2: Total Strokes | D2: Weeks | E2: Average | F2: H-Cap | G2: Last | H2: Week Pt. | I2: Total Pts. | J2: Sub Pts.
A4: =A3+1 -> 1 | B4: Jeremy Farnsworth | C4: 759 | D4: 15 | E4: =(C4/D4) -> 50.600 | F4: =ROUNDDOWN(((E4-50)*0.8),0) -> 0 | G4: 48 | H4: 1 | I4: 10.5
A5: =A4+1 -> 2 | B5: Dan Kern | C5: 863 | D5: 17 | E5: =(C5/D5) -> 50.764705882352942 | F5: =ROUNDDOWN(((E5-50)*0.8),0) -> 0 | G5: 50 | H5: 1 | I5: 12.5
A6: =A5+1 -> 3 | B6: Tim Peyton | C6: 864 | D6: 17 | E6: =(C6/D6) -> 50.823529411764703 | F6: =ROUNDDOWN(((E6-50)*0.8),0) -> 0 | G6: 51 | H6: 0.5 | I6: 10.5
A7: =A6+1 -> 4 | B7: Doug Peyton | C7: 867 | D7: 17 | E7: =(C7/D7) -> 51.000 | F7: =ROUNDDOWN(((E7-50)*0.8),0) -> 0 | G7: 54 | I7: 9.5
A8: =A7+1 -> 5 | B8: Greco | C8: 883 | D8: 17 | E8: =(C8/D8) -> 51.941176470588232 | F8: =ROUNDDOWN(((E8-50)*0.8),0) -> 1 | G8: 49 | H8: 1 | I8: 10
A9: =A8+1 -> 6 | B9: KVN Lavley | C9: 898 | D9: 17 | E9: =(C9/D9) -> 52.823529411764703 | F9: =ROUNDDOWN(((E9-50)*0.8),0) -> 2 | G9: 57 | I9: 10
A10: =A9+1 -> 7 | B10: Kurt Conrad | C10: 913 | D10: 17 | E10: =(C10/D10) -> 53.705882352941174 | F10: =ROUNDDOWN(((E10-50)*0.8),0) -> 2 | G10: 50 | H10: 1 | I10: 12
A11: =A10+1 -> 8 | B11: Matt Wieben | C11: 917 | D11: 17 | E11: =(C11/D11) -> 53.941176470588232 | F11: =ROUNDDOWN(((E11-50)*0.8),0) -> 3 | G11: 55 | H11: 1 | I11: 9.5
A12: =A11+1 -> 9 | B12: Kollin Grimm | C12: 920 | D12: 17 | E12: =(C12/D12) -> 54.117647058823529 | F12: =ROUNDDOWN(((E12-50)*0.8),0) -> 3 | G12: 48 | H12: 1 | I12: 9
A13: =A12+1 -> 10 | B13: Doug Johnson | C13: 925 | D13: 17 | E13: =(C13/D13) -> 54.411764705882355 | F13: =ROUNDDOWN(((E13-50)*0.8),0) -> 3 | G13: 53 | I13: 8.5
A14: =A13+1 -> 11 | B14: Chris Clime | C14: 934 | D14: 17 | E14: =(C14/D14) -> 54.941176470588232 | F14: =ROUNDDOWN(((E14-50)*0.8),0) -> 3 | G14: 56 | I14: 13
A15: =A14+1 -> 12 | B15: Adam Miller | C15: 936 | D15: 17 | E15: =(C15/D15) -> 55.058823529411768 | F15: =ROUNDDOWN(((E15-50)*0.8),0) -> 4 | G15: 53 | I15: 7.5
A16: =A15+1 -> 13 | B16: Woody | C16: 936 | D16: 17 | E16: =(C16/D16) -> 55.058823529411768 | F16: =ROUNDDOWN(((E16-50)*0.8),0) -> 4 | G16: 58 | H16: 0.5 | I16: 5
A17: =A16+1 -> 14 | B17: Stiers | C17: 881 | D17: 16 | E17: =(C17/D17) -> 55.0625 | F17: =ROUNDDOWN(((E17-50)*0.8),0) -> 4 | G17: 55 | I17: 9.5
A18: =A17+1 -> 15 | B18: Rimmy | C18: 938 | D18: 17 | E18: =(C18/D18) -> 55.176470588235297 | F18: =ROUNDDOWN(((E18-50)*0.8),0) -> 4 | G18: 55 | I18: 6
A19: =A18+1 -> 16 | B19: Utley | C19: 887 | D19: 16 | E19: =(C19/D19) -> 55.4375 | F19: =ROUNDDOWN(((E19-50)*0.8),0) -> 4 | G19: 53 | H19: 1 | I19: 10.5
A20: =A19+1 -> 17 | B20: Beachy | C20: 944 | D20: 17 | E20: =(C20/D20) -> 55.529411764705884 | F20: =ROUNDDOWN(((E20-50)*0.8),0) -> 4 | G20: 56 | I20: 5
A21: =A20+1 -> 18 | B21: Rob Neubrand | C21: 947 | D21: 17 | E21: =(C21/D21) -> 55.705882352941174 | F21: =ROUNDDOWN(((E21-50)*0.8),0) -> 4 | G21: 58 | I21: 8
A22: =A21+1 -> 19 | B22: Tim Potter | C22: 950 | D22: 17 | E22: =(C22/D22) -> 55.882352941176471 | F22: =ROUNDDOWN(((E22-50)*0.8),0) -> 4 | G22: 60 | I22: 11
A23: =A22+1 -> 20 | B23: Nate Veeder | C23: 896 | D23: 16 | E23: =(C23/D23) -> 56.000 | F23: =ROUNDDOWN(((E23-50)*0.8),0) -> 4 | G23: 53 | H23: 1 | I23: 7
A24: =A23+1 -> 21 | B24: Jesse Streinz | C24: 953 | D24: 17 | E24: =(C24/D24) -> 56.058823529411768 | F24: =ROUNDDOWN(((E24-50)*0.8),0) -> 4 | G24: 52 | H24: 1 | I24: 12.5
A25: =A24+1 -> 22 | B25: Ryan Hamilton | C25: 961 | D25: 17 | E25: =(C25/D25) -> 56.529411764705884 | F25: =ROUNDDOWN(((E25-50)*0.8),0) -> 5 | G25: 50 | H25: 1 | I25: 9
A26: =A25+1 -> 23 | B26: Travis Fruendt | C26: 907 | D26: 16 | E26: =(C26/D26) -> 56.6875 | F26: =ROUNDDOWN(((E26-50)*0.8),0) -> 5 | G26: 57 | H26: 0.5 | I26: 8.5
A27: =A26+1 -> 24 | B27: Joel Knutson | C27: 966 | D27: 17 | E27: =(C27/D27) -> 56.823529411764703 | F27: =ROUNDDOWN(((E27-50)*0.8),0) -> 5 | G27: 56 | H27: 1 | I27: 9
A28: =A27+1 -> 25 | B28: Martin Reis | C28: 966 | D28: 17 | E28: =(C28/D28) -> 56.823529411764703 | F28: =ROUNDDOWN(((E28-50)*0.8),0) -> 5 | G28: 58 | I28: 9.5
A29: =A28+1 -> 26 | B29: Shirtless Bill | C29: 920 | D29: 16 | E29: =(C29/D29) -> 57.500 | F29: =ROUNDDOWN(((E29-50)*0.8),0) -> 6 | G29: 62 | I29: 6.5
A30: =A29+1 -> 27 | B30: Perry Thirtyacre | C30: 922 | D30: 16 | E30: =(C30/D30) -> 57.625 | F30: =ROUNDDOWN(((E30-50)*0.8),0) -> 6 | G30: 58 | H30: 0.5 | I30: 7
A31: =A30+1 -> 28 | B31: Kirby Callahan | C31: 984 | D31: 17 | E31: =(C31/D31) -> 57.882352941176471 | F31: =ROUNDDOWN(((E31-50)*0.8),0) -> 6 | G31: 56 | I31: 7
A32: =A31+1 -> 29 | B32: David McCuskey | C32: 927 | D32: 16 | E32: =(C32/D32) -> 57.9375 | F32: =ROUNDDOWN(((E32-50)*0.8),0) -> 6 | G32: 55 | H32: 0.5 | I32: 12
A33: =A32+1 -> 30 | B33: Travis Pike | C33: 985 | D33: 17 | E33: =(C33/D33) -> 57.941176470588232 | F33: =ROUNDDOWN(((E33-50)*0.8),0) -> 6 | G33: 57 | H33: 1 | I33: 8.5
A34: =A33+1 -> 31 | B34: Ryan Eggleston | C34: 987 | D34: 17 | E34: =(C34/D34) -> 58.058823529411768 | F34: =ROUNDDOWN(((E34-50)*0.8),0) -> 6 | G34: 55 | H34: 0.5 | I34: 11
A35: =A34+1 -> 32 | B35: Matt Fritz | C35: 989 | D35: 17 | E35: =(C35/D35) -> 58.176470588235297 | F35: =ROUNDDOWN(((E35-50)*0.8),0) -> 6 | G35: 57 | H35: 0.5 | I35: 11.5
A36: =A35+1 -> 33 | B36: Matt Shannon | C36: 989 | D36: 17 | E36: =(C36/D36) -> 58.176470588235297 | F36: =ROUNDDOWN(((E36-50)*0.8),0) -> 6 | G36: 59 | I36: 6.5
A37: =A36+1 -> 34 | B37: Avg. Joe | C37: 991 | D37: 17 | E37: =(C37/D37) -> 58.294117647058826 | F37: =ROUNDDOWN(((E37-50)*0.8),0) -> 6 | G37: 52 | H37: 1 | I37: 8.5
A38: =A37+1 -> 35 | B38: Dustin Nohr | C38: 875 | D38: 15 | E38: =(C38/D38) -> 58.333333333333336 | F38: =ROUNDDOWN(((E38-50)*0.8),0) -> 6 | G38: 59 | H38: 1 | I38: 7.5
A39: =A38+1 -> 36 | B39: Phil Campos | C39: 995 | D39: 17 | E39: =(C39/D39) -> 58.529411764705884 | F39: =ROUNDDOWN(((E39-50)*0.8),0) -> 6 | G39: 56 | I39: 7.5
A40: =A39+1 -> 37 | B40: John Williams | C40: 938 | D40: 16 | E40: =(C40/D40) -> 58.625 | F40: =ROUNDDOWN(((E40-50)*0.8),0) -> 6 | G40: 63 | I40: 7.5
A41: =A40+1 -> 38 | B41: Wyckoff | C41: 952 | D41: 16 | E41: =(C41/D41) -> 59.500 | F41: =ROUNDDOWN(((E41-50)*0.8),0) -> 7 | G41: 57 | H41: 1 | I41: 8
A42: =A41+1 -> 39 | B42: Adam Henderson | C42: 955 | D42: 16 | E42: =(C42/D42) -> 59.6875 | F42: =ROUNDDOWN(((E42-50)*0.8),0) -> 7 | G42: Karstens | I42: 7.5 | J42: 0.5
A43: =A42+1 -> 40 | B43: Archie Coulter | C43: 1018 | D43: 17 | E43: =(C43/D43) -> 59.882352941176471 | F43: =ROUNDDOWN(((E43-50)*0.8),0) -> 7 | G43: 58 | I43: 10
A44: =A43+1 -> 41 | B44: Frog | C44: 300 | D44: 5 | E44: =(C44/D44) -> 60.000 | F44: =ROUNDDOWN(((E44-50)*0.8),0) -> 8 | G44: Ian | I44: 6.5
A45: =A44+1 -> 42 | B45: Justin Zehr | C45: 670 | D45: 11 | E45: =(C45/D45) -> 60.909090909090907 | F45: =ROUNDDOWN(((E45-50)*0.8),0) -> 8 | G45: Ben S. | I45: 6
A46: =A45+1 -> 43 | B46: Erik Smith | C46: 984 | D46: 16 | E46: =(C46/D46) -> 61.500 | F46: =ROUNDDOWN(((E46-50)*0.8),0) -> 9 | G46: 60 | H46: 1 | I46: 3.5
A47: =A46+1 -> 44 | B47: D. Burns | C47: 989 | D47: 16 | E47: =(C47/D47) -> 61.8125 | F47: =ROUNDDOWN(((E47-50)*0.8),0) -> 9 | G47: 57 | I47: 6.5
A48: =A47+1 -> 45 | B48: Shane Thirtyacre | C48: 1052 | D48: 17 | E48: =(C48/D48) -> 61.882352941176471 | F48: =ROUNDDOWN(((E48-50)*0.8),0) -> 9 | G48: 61 | H48: 1 | I48: 8.5
A49: =A48+1 -> 46 | B49: Maker | C49: 807 | D49: 13 | E49: =(C49/D49) -> 62.07692307692308 | F49: =ROUNDDOWN(((E49-50)*0.8),0) -> 9 | G49: Mumma | I49: 5
A50: =A49+1 -> 47 | B50: Tom Pepper | C50: 1063 | D50: 17 | E50: =(C50/D50) -> 62.529411764705884 | F50: =ROUNDDOWN(((E50-50)*0.8),0) -> 10 | G50: 59 | H50: 1 | I50: 7.5
A51: =A50+1 -> 48 | B51: Spencer Eubanks | C51: 949 | D51: 15 | E51: =(C51/D51) -> 63.266666666666666 | F51: =ROUNDDOWN(((E51-50)*0.8),0) -> 10 | G51: 57 | H51: 1 | I51: 7.5
A52: =A51+1 -> 49 | B52: Shawn Hullinger | C52: 1083 | D52: 17 | E52: =(C52/D52) -> 63.705882352941174 | F52: =ROUNDDOWN(((E52-50)*0.8),0) -> 10 | G52: 57 | H52: 1 | I52: 11
A53: =A52+1 -> 50 | B53: Sarah Potter | C53: 1137 | D53: 17 | E53: =(C53/D53) -> 66.882352941176464 | F53: =ROUNDDOWN(((E53-50)*0.8),0) -> 13 | G53: 61 | H53: 1 | I53: 9
A54: =A53+1 -> 51 | B54: Chad Goodwin | C54: 829 | D54: 12 | E54: =(C54/D54) -> 69.083333333333329 | F54: =ROUNDDOWN(((E54-50)*0.8),0) -> 15 | I54: 5
A55: =A54+1 -> 52 | B55: M. Lerch | C55: 1205 | D55: 17 | E55: =(C55/D55) -> 70.882352941176464 | F55: =ROUNDDOWN(((E55-50)*0.8),0) -> 16 | G55: 61 | H55: 1 | I55: 6.5
A57: Subs | B57: Player | C57: Total Strokes | D57: Weeks | E57: Average | F57: H-Cap | G57: Last | H57: Week Pt. | I57: Total Pts. | J57: Subed For
A58: 1 | B58: Ian Jacobs | C58: 997 | D58: 17 | E58: =(C58/D58) -> 58.647058823529413 | F58: =ROUNDDOWN(((E58-50)*0.8),0) -> 6 | G58: 59 | I58: 1.5 | J58: Frog
A59: 2 | B59: Ben Sandell | C59: 586 | D59: 9 | E59: =SUM(C59/D59) -> 65.111111111111114 | F59: =ROUNDDOWN(((E59-50)*0.8),0) -> 12 | G59: 66 | I59: 3
A60: 3 | B60: AO | C60: 196 | D60: 4 | E60: =SUM(C60/D60) -> 49.000 | F60: =ROUNDDOWN(((E60-50)*0.8),0) -> 0 | I60: 2
A61: 4 | B61: Chuck | C61: 165 | D61: 3 | E61: =SUM(C61/D61) -> 55.000 | F61: =ROUNDDOWN(((E61-50)*0.8),0) -> 4 | I61: 1.5
A62: 5 | B62: Rory | C62: 168 | D62: 3 | E62: =SUM(C62/D62) -> 56.000 | F62: =ROUNDDOWN(((E62-50)*0.8),0) -> 4 | I62: 0
A63: 6 | B63: Stibal | C63: 175 | D63: 3 | E63: =SUM(C63/D63) -> 58.333333333333336 | F63: =ROUNDDOWN(((E63-50)*0.8),0) -> 6 | I63: 1
A64: 8 | B64: Dan Lewis | C64: 180 | D64: 3 | E64: =SUM(C64/D64) -> 60.000 | F64: =ROUNDDOWN(((E64-50)*0.8),0) -> 8 | I64: 0
A65: 9 | B65: Dev Nelson | C65: 115 | D65: 2 | E65: =SUM(C65/D65) -> 57.500 | F65: =ROUNDDOWN(((E65-50)*0.8),0) -> 6 | I65: 1
A66: 10 | B66: Crager | C66: 176 | D66: 3 | E66: =SUM(C66/D66) -> 58.666666666666664 | F66: =ROUNDDOWN(((E66-50)*0.8),0) -> 6 | I66: 0
A67: 11 | B67: Rob Mumma | C67: 356 | D67: 6 | E67: =SUM(C67/D67) -> 59.333333333333336 | F67: =ROUNDDOWN(((E67-50)*0.8),0) -> 7 | G67: 62 | I67: 0
A68: 12 | B68: Tony Rios | C68: 182 | D68: 3 | E68: =SUM(C68/D68) -> 60.666666666666664 | F68: =ROUNDDOWN(((E68-50)*0.8),0) -> 8 | I68: 0
A69: 13 | B69: Nate ? | C69: 62 | D69: 1 | E69: =SUM(C69/D69) -> 62.000 | F69: NA | I69: 0
A70: 14 | B70: Nate ? | C70: 57 | D70: 1 | E70: =SUM(C70/D70) -> 57.000 | F70: NA | I70: 0
A71: 15 | B71: Timmy | C71: 59 | D71: 1 | E71: =SUM(C71/D71) -> 59.000 | F71: NA | I71: 0
A72: 16 | B72: Bob Hernandez | C72: 56 | D72: 1 | E72: =SUM(C72/D72) -> 56.000 | F72: NA | I72: 0
A73: 17 | B73: Greg Friestad | C73: 59 | D73: 1 | E73: =SUM(C73/D73) -> 59.000 | F73: NA | I73: 1
A74: 18 | B74: Steve Adkinson | C74: 65 | D74: 1 | E74: =SUM(C74/D74) -> 65.000 | F74: NA | I74: 0
A75: 19 | B75: Prouty | C75: 71 | D75: 1 | E75: =SUM(C75/D75) -> 71.000 | F75: NA | I75: 0
A76: 20 | B76: McCarley | C76: 65 | D76: 1 | E76: =SUM(C76/D76) -> 65.000 | F76: NA | I76: 0
A77: 21 | B77: Brent | C77: 62 | D77: 1 | E77: =SUM(C77/D77) -> 62.000 | F77: NA | I77: 0
A78: 22 | B78: Adam Karstens | C78: 119 | D78: 2 | E78: =SUM(C78/D78) -> 59.500 | F78: =ROUNDDOWN(((E78-50)*0.8),0) -> 7 | G78: 62 | I78: 0 | J78: Henderson
A79: 23 | B79: Doc | C79: 103 | D79: 1 | E79: =SUM(C79/D79) -> 103.000 | F79: NA | I79: 0
A80: 24 | B80: Skyler | C80: 59 | D80: 1 | E80: =SUM(C80/D80) -> 59.000 | F80: NA | I80: 0
A81: 25 | B81: Steve Thirtyacre | C81: 56 | D81: 1 | E81: =SUM(C81/D81) -> 56.000 | F81: NA | I81: 0
A82: 26 | B82: Joe Cool | C82: 57 | D82: 1 | E82: =SUM(C82/D82) -> 57.000 | F82: NA | G82: 57
A83: 27 | C83: 0 | D83: 1 | E83: =SUM(C83/D83) -> 0.000 | F83: =ROUNDDOWN(((E83-50)*0.8),0) -> -40
A84: 28 | C84: 0 | D84: 1 | E84: =SUM(C84/D84) -> 0.000 | F84: =ROUNDDOWN(((E84-50)*0.8),0) -> -40
A86: 2012 SBDGL Team Standing
B87: TEAM # | E87: Total Points | F87: Team Points | G87: Team Avg | H87: Week Total | I87: Week Team
A88: 1 | B88: 18 | C88: Dan Kern + Jeremy Farnsworth | E88: 37 | F88: 14 | G88: =AVERAGE(E4,E5) -> 50.682352941176475 | H88: 3 | I88: 1
A89: 2 | B89: 25 | C89: Doug Peyton + Chris Clime | E89: 35 | F89: 12.5 | G89: =AVERAGE(E14,E7) -> 52.970588235294116
A90: 3 | B90: 6 | C90: Hullinger + Jesse Streinz | E90: 35 | F90: 11.5 | G90: =AVERAGE(E52,E24) -> 59.882352941176471 | H90: 3 | I90: 1
A91: 4 | B91: 20 | C91: Matt Fritz + Egglesten | E91: 33.5 | F91: 11 | G91: =AVERAGE(E34,E35) -> 58.117647058823536 | H91: 1.5 | I91: 0.5
A92: 5 | B92: 21 | C92: Super Dave + Tim Peyton | E92: 33.5 | F92: 11 | G92: =AVERAGE(E6,E32) -> 54.380514705882348 | H92: 1.5 | I92: 0.5
A93: 6 | B93: 11 | C93: Tim Potter + Andrew Greco | E93: 31.5 | F93: 10.5 | G93: =AVERAGE(E22,E8) -> 53.911764705882348 | H93: 1
A94: 7 | B94: 4 | C94: KVN + Archie C. | E94: 31 | F94: 11 | G94: =AVERAGE(E9,E43) -> 56.352941176470587
A95: 8 | B95: 2 | C95: Travis Pike + Kollin Grimm | E95: 27.5 | F95: 10 | G95: =AVERAGE(E12,E33) -> 56.029411764705884 | H95: 3 | I95: 1
A96: 9 | B96: 7 | C96: Doug Johnson + Shane Thirtyacre | E96: 27 | F96: 10 | G96: =AVERAGE(E48,E13) -> 58.147058823529413 | H96: 2 | I96: 1
A97: 10 | B97: 26 | C97: Joel Knutson + Rob Neubrand | E97: 26.5 | F97: 9.5 | G97: =AVERAGE(E27,E21) -> 56.264705882352942 | H97: 2 | I97: 1
A98: 11 | B98: 17 | C98: Marty Reis + Spencer Eubanks | E98: 25 | F98: 8 | G98: =AVERAGE(E51,E28) -> 60.045098039215688 | H98: 2 | I98: 1
A99: 12 | B99: 22 | C99: Kurt Conrad + Chad Goodwin | E99: 25 | F99: 8 | G99: =AVERAGE(E10,E54) -> 61.394607843137251 | H99: 1
A100: 13 | B100: 3 | C100: Adam Stiers + Wyckoff | E100: 24.5 | F100: 7 | G100: =AVERAGE(E17,E41) -> 57.28125 | H100: 2 | I100: 1
A101: 14 | B101: 9 | C101: John Williams + Kirby Callahan | E101: 24 | F101: 9.5 | G101: =AVERAGE(E31,E40) -> 58.253676470588232
A102: 15 | B102: 10 | C102: Tom Pepper + Travis Fruendt | E102: 23.5 | F102: 7.5 | G102: =AVERAGE(E50,E26) -> 59.608455882352942 | H102: 2.5 | I102: 1
A103: 16 | B103: 5 | C103: Shirtless + Dustin Utley | E103: 23.5 | F103: 6.5 | G103: =AVERAGE(E29,E19) -> 56.46875 | H103: 1
A104: 17 | B104: 14 | C104: Average Joe + Jason Rimrodt | E104: 22.5 | F104: 8 | G104: =AVERAGE(E18,E37) -> 56.735294117647058 | H104: 2 | I104: 1
A105: 18 | B105: 23 | C105: Matt Wieben + Matt Shannon | E105: 22.5 | F105: 6.5 | G105: =AVERAGE(E11,E36) -> 56.058823529411768 | H105: 1
A106: 19 | B106: 24 | C106: Ryan Hamilton + D. Burns | E106: 22 | F106: 6.5 | G106: =AVERAGE(E25,E47) -> 59.170955882352942 | H106: 2 | I106: 1
A107: 20 | B107: 8 | C107: Sarah Potter + Adam Henderson | E107: 21.5 | F107: 5 | G107: =AVERAGE(E53,E42) -> 63.284926470588232 | H107: 2.5 | I107: 1
A108: 21 | B108: 15 | C108: Campos + Nathan Veeder | E108: 21 | F108: 6.5 | G108: =AVERAGE(E39,E23) -> 57.264705882352942 | H108: 1
A109: 22 | B109: 19 | C109: Matt Geers + M. Lerch | E109: 20.5 | F109: 7.5 | G109: =AVERAGE(E55,E44) -> 65.441176470588232 | H109: 1
A110: 23 | B110: 12 | C110: Joshua Beachy + Dustin Nohr | E110: 19.5 | F110: 7 | G110: =AVERAGE(E20,E38) -> 56.931372549019613 | H110: 2 | I110: 1
A111: 24 | B111: 13 | C111: Perry Thirtyacre + Justin Zehr | E111: 19.5 | F111: 6.5 | G111: =AVERAGE(E45,E30) -> 59.267045454545453 | H111: 0.5
A112: 25 | B112: 1 | C112: Woody + Adam Miller | E112: 18.5 | F112: 6 | G112: =AVERAGE(E16,E15) -> 55.058823529411768 | H112: 0.5
A113: 26 | B113: 16 | C113: Jerimie Maker + Smith | E113: 12.5 | F113: 4 | G113: =AVERAGE(E46,E49) -> 61.78846153846154 | H113: 1