A1: 2012 S.B.D.G.L. STANDINGS Through Week 16 Hiawatha
A2: Rank | B2: Player | C2: Total Strokes | D2: Weeks | E2: Average | F2: H-Cap | G2: Last | H2: Week Pt. | I2: Total Pts. | J2: Sub Pts.
A4: =A3+1 -> 1 | B4: Jeremy Farnsworth | C4: 711 | D4: 14 | E4: =(C4/D4) -> 50.785714285714285 | F4: =ROUNDDOWN(((E4-50)*0.8),0) -> 0 | G4: 50 | H4: 0.5 | I4: 9.5
A5: =A4+1 -> 2 | B5: Dan Kern | C5: 813 | D5: 16 | E5: =(C5/D5) -> 50.8125 | F5: =ROUNDDOWN(((E5-50)*0.8),0) -> 0 | G5: 45 | H5: 0.5 | I5: 11.5
A6: =A5+1 -> 3 | B6: Tim Peyton | C6: 813 | D6: 16 | E6: =(C6/D6) -> 50.8125 | F6: =ROUNDDOWN(((E6-50)*0.8),0) -> 0 | G6: 50 | H6: 0.5 | I6: 10
A7: =A6+1 -> 4 | B7: Doug Peyton | C7: 813 | D7: 16 | E7: =(C7/D7) -> 50.8125 | F7: =ROUNDDOWN(((E7-50)*0.8),0) -> 0 | G7: 51 | I7: 9.5
A8: =A7+1 -> 5 | B8: Greco | C8: 834 | D8: 16 | E8: =(C8/D8) -> 52.125 | F8: =ROUNDDOWN(((E8-50)*0.8),0) -> 1 | G8: 48 | H8: 1 | I8: 9
A9: =A8+1 -> 6 | B9: KVN Lavley | C9: 841 | D9: 16 | E9: =(C9/D9) -> 52.5625 | F9: =ROUNDDOWN(((E9-50)*0.8),0) -> 2 | G9: 50 | I9: 10
A10: =A9+1 -> 7 | B10: Matt Wieben | C10: 862 | D10: 16 | E10: =(C10/D10) -> 53.875 | F10: =ROUNDDOWN(((E10-50)*0.8),0) -> 3 | G10: 52 | I10: 8.5
A11: =A10+1 -> 8 | B11: Kurt Conrad | C11: 863 | D11: 16 | E11: =(C11/D11) -> 53.9375 | F11: =ROUNDDOWN(((E11-50)*0.8),0) -> 3 | G11: 51 | H11: 1 | I11: 11
A12: =A11+1 -> 9 | B12: Doug Johnson | C12: 872 | D12: 16 | E12: =(C12/D12) -> 54.500 | F12: =ROUNDDOWN(((E12-50)*0.8),0) -> 3 | G12: 50 | H12: 1 | I12: 8.5
A13: =A12+1 -> 10 | B13: Kollin Grimm | C13: 872 | D13: 16 | E13: =(C13/D13) -> 54.500 | F13: =ROUNDDOWN(((E13-50)*0.8),0) -> 3 | G13: 53 | I13: 8
A14: =A13+1 -> 11 | B14: Woody | C14: 878 | D14: 16 | E14: =(C14/D14) -> 54.875 | F14: =ROUNDDOWN(((E14-50)*0.8),0) -> 3 | G14: 50 | H14: 1 | I14: 4.5
A15: =A14+1 -> 12 | B15: Chris Clime | C15: 878 | D15: 16 | E15: =(C15/D15) -> 54.875 | F15: =ROUNDDOWN(((E15-50)*0.8),0) -> 3 | G15: 53 | I15: 13
A16: =A15+1 -> 13 | B16: Stiers | C16: 826 | D16: 15 | E16: =(C16/D16) -> 55.06666666666667 | F16: =ROUNDDOWN(((E16-50)*0.8),0) -> 4 | G16: 47 | H16: 1 | I16: 9.5
A17: =A16+1 -> 14 | B17: Adam Miller | C17: 883 | D17: 16 | E17: =(C17/D17) -> 55.1875 | F17: =ROUNDDOWN(((E17-50)*0.8),0) -> 4 | G17: 48 | H17: 1 | I17: 7.5
A18: =A17+1 -> 15 | B18: Rimmy | C18: 883 | D18: 16 | E18: =(C18/D18) -> 55.1875 | F18: =ROUNDDOWN(((E18-50)*0.8),0) -> 4 | G18: 51 | H18: 1 | I18: 6
A19: =A18+1 -> 16 | B19: Beachy | C19: 888 | D19: 16 | E19: =(C19/D19) -> 55.500 | F19: =ROUNDDOWN(((E19-50)*0.8),0) -> 4 | G19: 55 | I19: 5
A20: =A19+1 -> 17 | B20: Rob Neubrand | C20: 889 | D20: 16 | E20: =(C20/D20) -> 55.5625 | F20: =ROUNDDOWN(((E20-50)*0.8),0) -> 4 | G20: 54 | H20: 1 | I20: 8
A21: =A20+1 -> 18 | B21: Utley | C21: 834 | D21: 15 | E21: =(C21/D21) -> 55.600 | F21: =ROUNDDOWN(((E21-50)*0.8),0) -> 4 | G21: 51 | H21: 1 | I21: 9.5
A22: =A21+1 -> 19 | B22: Tim Potter | C22: 890 | D22: 16 | E22: =(C22/D22) -> 55.625 | F22: =ROUNDDOWN(((E22-50)*0.8),0) -> 4 | G22: 58 | H22: 1 | I22: 11
A23: =A22+1 -> 20 | B23: Nate Veeder | C23: 843 | D23: 15 | E23: =(C23/D23) -> 56.200 | F23: =ROUNDDOWN(((E23-50)*0.8),0) -> 4 | G23: 54 | I23: 6
A24: =A23+1 -> 21 | B24: Jesse Streinz | C24: 901 | D24: 16 | E24: =(C24/D24) -> 56.3125 | F24: =ROUNDDOWN(((E24-50)*0.8),0) -> 5 | G24: 55 | I24: 11.5
A25: =A24+1 -> 22 | B25: Travis Fruendt | C25: 850 | D25: 15 | E25: =(C25/D25) -> 56.666666666666664 | F25: =ROUNDDOWN(((E25-50)*0.8),0) -> 5 | G25: 52 | I25: 8
A26: =A25+1 -> 23 | B26: Martin Reis | C26: 908 | D26: 16 | E26: =(C26/D26) -> 56.750 | F26: =ROUNDDOWN(((E26-50)*0.8),0) -> 5 | G26: 54 | H26: 1 | I26: 9.5
A27: =A26+1 -> 24 | B27: Joel Knutson | C27: 910 | D27: 16 | E27: =(C27/D27) -> 56.875 | F27: =ROUNDDOWN(((E27-50)*0.8),0) -> 5 | G27: 52 | H27: 1 | I27: 8
A28: =A27+1 -> 25 | B28: Ryan Hamilton | C28: 911 | D28: 16 | E28: =(C28/D28) -> 56.9375 | F28: =ROUNDDOWN(((E28-50)*0.8),0) -> 5 | G28: 58 | I28: 8
A29: =A28+1 -> 26 | B29: Shirtless Bill | C29: 858 | D29: 15 | E29: =(C29/D29) -> 57.200 | F29: =ROUNDDOWN(((E29-50)*0.8),0) -> 5 | G29: 55 | I29: 6.5
A30: =A29+1 -> 27 | B30: Perry Thirtyacre | C30: 864 | D30: 15 | E30: =(C30/D30) -> 57.600 | F30: =ROUNDDOWN(((E30-50)*0.8),0) -> 6 | G30: 50 | H30: 1 | I30: 6.5
A31: =A30+1 -> 28 | B31: Kirby Callahan | C31: 928 | D31: 16 | E31: =(C31/D31) -> 58.000 | F31: =ROUNDDOWN(((E31-50)*0.8),0) -> 6 | G31: 50 | H31: 1 | I31: 7
A32: =A31+1 -> 29 | B32: Travis Pike | C32: 928 | D32: 16 | E32: =(C32/D32) -> 58.000 | F32: =ROUNDDOWN(((E32-50)*0.8),0) -> 6 | G32: 57 | I32: 7.5
A33: =A32+1 -> 30 | B33: Matt Shannon | C33: 930 | D33: 16 | E33: =(C33/D33) -> 58.125 | F33: =ROUNDDOWN(((E33-50)*0.8),0) -> 6 | G33: 54 | H33: 0.5 | I33: 6.5
A34: =A33+1 -> 31 | B34: David McCuskey | C34: 872 | D34: 15 | E34: =(C34/D34) -> 58.133333333333333 | F34: =ROUNDDOWN(((E34-50)*0.8),0) -> 6 | G34: 50 | H34: 1 | I34: 11.5
A35: =A34+1 -> 32 | B35: Matt Fritz | C35: 932 | D35: 16 | E35: =(C35/D35) -> 58.250 | F35: =ROUNDDOWN(((E35-50)*0.8),0) -> 6 | G35: 54 | H35: 0.5 | I35: 11
A36: =A35+1 -> 33 | B36: Ryan Eggleston | C36: 932 | D36: 16 | E36: =(C36/D36) -> 58.250 | F36: =ROUNDDOWN(((E36-50)*0.8),0) -> 6 | G36: 56 | I36: 10.5
A37: =A36+1 -> 34 | B37: Dustin Nohr | C37: 816 | D37: 14 | E37: =(C37/D37) -> 58.285714285714285 | F37: =ROUNDDOWN(((E37-50)*0.8),0) -> 6 | G37: 56 | I37: 6.5
A38: =A37+1 -> 35 | B38: John Williams | C38: 875 | D38: 15 | E38: =(C38/D38) -> 58.333333333333336 | F38: =ROUNDDOWN(((E38-50)*0.8),0) -> 6 | G38: 52 | H38: 1 | I38: 7.5
A39: =A38+1 -> 36 | B39: Phil Campos | C39: 939 | D39: 16 | E39: =(C39/D39) -> 58.6875 | F39: =ROUNDDOWN(((E39-50)*0.8),0) -> 6 | G39: 52 | H39: 1 | I39: 7.5
A40: =A39+1 -> 37 | B40: Avg. Joe | C40: 939 | D40: 16 | E40: =(C40/D40) -> 58.6875 | F40: =ROUNDDOWN(((E40-50)*0.8),0) -> 6 | G40: 55 | H40: 0.5 | I40: 7.5
A41: =A40+1 -> 38 | B41: Wyckoff | C41: 895 | D41: 15 | E41: =(C41/D41) -> 59.666666666666664 | F41: =ROUNDDOWN(((E41-50)*0.8),0) -> 7 | G41: 64 | I41: 7
A42: =A41+1 -> 39 | B42: Adam Henderson | C42: 955 | D42: 16 | E42: =(C42/D42) -> 59.6875 | F42: =ROUNDDOWN(((E42-50)*0.8),0) -> 7 | G42: 53 | I42: 7
A43: =A42+1 -> 40 | B43: Archie Coulter | C43: 960 | D43: 16 | E43: =(C43/D43) -> 60.000 | F43: =ROUNDDOWN(((E43-50)*0.8),0) -> 8 | G43: 49 | H43: 1 | I43: 10
A44: =A43+1 -> 41 | B44: Frog | C44: 300 | D44: 5 | E44: =(C44/D44) -> 60.000 | F44: =ROUNDDOWN(((E44-50)*0.8),0) -> 8 | G44: IAN | I44: 6.5 | J44: 0.5
A45: =A44+1 -> 42 | B45: Justin Zehr | C45: 670 | D45: 11 | E45: =(C45/D45) -> 60.909090909090907 | F45: =ROUNDDOWN(((E45-50)*0.8),0) -> 8 | G45: Ben S | I45: 6 | J45: 1
A46: =A45+1 -> 43 | B46: Erik Smith | C46: 924 | D46: 15 | E46: =(C46/D46) -> 61.600 | F46: =ROUNDDOWN(((E46-50)*0.8),0) -> 9 | G46: 59 | H46: 0.5 | I46: 2.5
A47: =A46+1 -> 44 | B47: Shane Thirtyacre | C47: 991 | D47: 16 | E47: =(C47/D47) -> 61.9375 | F47: =ROUNDDOWN(((E47-50)*0.8),0) -> 9 | G47: 63 | I47: 7.5
A48: =A47+1 -> 45 | B48: Maker | C48: 807 | D48: 13 | E48: =(C48/D48) -> 62.07692307692308 | F48: =ROUNDDOWN(((E48-50)*0.8),0) -> 9 | I48: 5
A49: =A48+1 -> 46 | B49: D. Burns | C49: 932 | D49: 15 | E49: =(C49/D49) -> 62.133333333333333 | F49: =ROUNDDOWN(((E49-50)*0.8),0) -> 9 | G49: S. Thirty | I49: 6.5
A50: =A49+1 -> 47 | B50: Tom Pepper | C50: 1004 | D50: 16 | E50: =(C50/D50) -> 62.750 | F50: =ROUNDDOWN(((E50-50)*0.8),0) -> 10 | G50: 57 | I50: 6.5
A51: =A50+1 -> 48 | B51: Shawn Hullinger | C51: 1026 | D51: 16 | E51: =(C51/D51) -> 64.125 | F51: =ROUNDDOWN(((E51-50)*0.8),0) -> 11 | G51: 59 | H51: 1 | I51: 10
A52: =A51+1 -> 49 | B52: Sarah Potter | C52: 1076 | D52: 16 | E52: =(C52/D52) -> 67.250 | F52: =ROUNDDOWN(((E52-50)*0.8),0) -> 13 | G52: 58 | H52: 1 | I52: 8
A53: =A52+1 -> 50 | B53: Spencer Eubanks | C53: 942 | D53: 14 | E53: =(C53/D53) -> 67.285714285714292 | F53: =ROUNDDOWN(((E53-50)*0.8),0) -> 13 | G53: 59 | H53: 0.5 | I53: 6.5
A54: =A53+1 -> 51 | B54: Chad Goodwin | C54: 829 | D54: 12 | E54: =(C54/D54) -> 69.083333333333329 | F54: =ROUNDDOWN(((E54-50)*0.8),0) -> 15 | G54: 62 | I54: 5
A55: =A54+1 -> 52 | B55: M. Lerch | C55: 1144 | D55: 16 | E55: =(C55/D55) -> 71.500 | F55: =ROUNDDOWN(((E55-50)*0.8),0) -> 17 | G55: 62 | H55: 0.5 | I55: 5.5
A57: Subs | B57: Player | C57: Total Strokes | D57: Weeks | E57: Average | F57: H-Cap | G57: Last | H57: Week Pt. | I57: Total Pts. | J57: Subed For
A58: 1 | B58: Ian Jacobs | C58: 938 | D58: 16 | E58: =(C58/D58) -> 58.625 | F58: =ROUNDDOWN(((E58-50)*0.8),0) -> 6 | G58: 57 | H58: 0.5 | I58: 1 | J58: Frog
A59: 2 | B59: Ben Sandell | C59: 520 | D59: 8 | E59: =SUM(C59/D59) -> 65.000 | F59: =ROUNDDOWN(((E59-50)*0.8),0) -> 12 | G59: 56 | H59: 1 | I59: 3 | J59: Zehr
A60: 3 | B60: AO | C60: 196 | D60: 4 | E60: =SUM(C60/D60) -> 49.000 | F60: =ROUNDDOWN(((E60-50)*0.8),0) -> 0 | I60: 2
A61: 4 | B61: Chuck | C61: 165 | D61: 3 | E61: =SUM(C61/D61) -> 55.000 | F61: =ROUNDDOWN(((E61-50)*0.8),0) -> 4 | I61: 1.5
A62: 5 | B62: Rory | C62: 168 | D62: 3 | E62: =SUM(C62/D62) -> 56.000 | F62: =ROUNDDOWN(((E62-50)*0.8),0) -> 4 | I62: 0
A63: 6 | B63: Stibal | C63: 175 | D63: 3 | E63: =SUM(C63/D63) -> 58.333333333333336 | F63: =ROUNDDOWN(((E63-50)*0.8),0) -> 6 | I63: 1
A64: 8 | B64: Dan Lewis | C64: 180 | D64: 3 | E64: =SUM(C64/D64) -> 60.000 | F64: =ROUNDDOWN(((E64-50)*0.8),0) -> 8 | I64: 0
A65: 9 | B65: Dev Nelson | C65: 115 | D65: 2 | E65: =SUM(C65/D65) -> 57.500 | F65: =ROUNDDOWN(((E65-50)*0.8),0) -> 6 | I65: 1
A66: 10 | B66: Crager | C66: 176 | D66: 3 | E66: =SUM(C66/D66) -> 58.666666666666664 | F66: =ROUNDDOWN(((E66-50)*0.8),0) -> 6 | I66: 0
A67: 11 | B67: Rob Mumma | C67: 294 | D67: 5 | E67: =SUM(C67/D67) -> 58.800 | F67: =ROUNDDOWN(((E67-50)*0.8),0) -> 7 | G67: 54 | I67: 0 | J67: NA
A68: 12 | B68: Tony Rios | C68: 182 | D68: 3 | E68: =SUM(C68/D68) -> 60.666666666666664 | F68: =ROUNDDOWN(((E68-50)*0.8),0) -> 8 | I68: 0
A69: 13 | B69: Nate ? | C69: 62 | D69: 1 | E69: =SUM(C69/D69) -> 62.000 | F69: =ROUNDDOWN(((E69-50)*0.8),0) -> 9 | I69: 0
A70: 14 | B70: Nate ? | C70: 57 | D70: 1 | E70: =SUM(C70/D70) -> 57.000 | F70: =ROUNDDOWN(((E70-50)*0.8),0) -> 5 | I70: 0
A71: 15 | B71: Timmy | C71: 59 | D71: 1 | E71: =SUM(C71/D71) -> 59.000 | F71: =ROUNDDOWN(((E71-50)*0.8),0) -> 7 | I71: 0
A72: 16 | B72: Bob Hernandez | C72: 56 | D72: 1 | E72: =SUM(C72/D72) -> 56.000 | F72: =ROUNDDOWN(((E72-50)*0.8),0) -> 4 | I72: 0
A73: 17 | B73: Greg Friestad | C73: 59 | D73: 1 | E73: =SUM(C73/D73) -> 59.000 | F73: =ROUNDDOWN(((E73-50)*0.8),0) -> 7 | I73: 1
A74: 18 | B74: Steve Adkinson | C74: 65 | D74: 1 | E74: =SUM(C74/D74) -> 65.000 | F74: =ROUNDDOWN(((E74-50)*0.8),0) -> 12 | I74: 0
A75: 19 | B75: Prouty | C75: 71 | D75: 1 | E75: =SUM(C75/D75) -> 71.000 | F75: =ROUNDDOWN(((E75-50)*0.8),0) -> 16 | I75: 0
A76: 20 | B76: McCarley | C76: 65 | D76: 1 | E76: =SUM(C76/D76) -> 65.000 | F76: =ROUNDDOWN(((E76-50)*0.8),0) -> 12 | I76: 0
A77: 21 | B77: Brent | C77: 62 | D77: 1 | E77: =SUM(C77/D77) -> 62.000 | F77: =ROUNDDOWN(((E77-50)*0.8),0) -> 9 | I77: 0
A78: 22 | B78: Adam Karstens | C78: 57 | D78: 1 | E78: =SUM(C78/D78) -> 57.000 | F78: =ROUNDDOWN(((E78-50)*0.8),0) -> 5 | I78: 0
A79: 23 | B79: Doc | C79: 103 | D79: 1 | E79: =SUM(C79/D79) -> 103.000 | F79: =ROUNDDOWN(((E79-50)*0.8),0) -> 42 | I79: 0
A80: 24 | B80: Skyler | C80: 59 | D80: 1 | E80: =SUM(C80/D80) -> 59.000 | F80: 0 | G80: 59 | I80: 0 | J80: NA
A81: 25 | B81: Steve Thirtyacre | C81: 56 | D81: 1 | E81: =SUM(C81/D81) -> 56.000 | F81: 0 | G81: 56 | H81: 0 | I81: 0 | J81: D. Burns
A82: 26 | C82: 0 | D82: 1 | E82: =SUM(C82/D82) -> 0.000 | F82: =ROUNDDOWN(((E82-50)*0.8),0) -> -40
A83: 27 | C83: 0 | D83: 1 | E83: =SUM(C83/D83) -> 0.000 | F83: =ROUNDDOWN(((E83-50)*0.8),0) -> -40
A84: 28 | C84: 0 | D84: 1 | E84: =SUM(C84/D84) -> 0.000 | F84: =ROUNDDOWN(((E84-50)*0.8),0) -> -40
A86: 2012 SBDGL Team Standing
B87: TEAM # | C87: BUSH | E87: Total Points | F87: Team Points | G87: Team Avg | H87: Week Total | I87: Week Team
A88: 1 | B88: 6 | C88: Hullinger + Jesse Streinz | E88: 32 | F88: 10.5 | G88: =AVERAGE(E51,E24) -> 60.21875 | H88: 1
A89: 2 | B89: 4 | C89: KVN + Archie C. | E89: 31 | F89: 11 | G89: =AVERAGE(E9,E43) -> 56.28125 | H89: 2 | I89: 1
A90: 3 | B90: 11 | C90: Tim Potter + Andrew Greco | E90: 30.5 | F90: 10.5 | G90: =AVERAGE(E8,E22) -> 53.875 | H90: 3 | I90: 1
A91: 4 | B91: 7 | C91: Doug Johnson + Shane Thirtyacre | E91: 25 | F91: 9 | G91: =AVERAGE(E47,E12) -> 58.21875 | H91: 1
A92: 5 | B92: 2 | C92: Travis Pike + Kollin Grimm | E92: 24.5 | F92: 9 | G92: =AVERAGE(E13,E32) -> 56.250
A93: 6 | B93: 9 | C93: John Williams + Kirby Callahan | E93: 24 | F93: 9.5 | G93: =AVERAGE(E38,E31) -> 58.166666666666671 | H93: 3 | I93: 1
A94: 7 | B94: 5 | C94: Shirtless + Dustin Utley | E94: 22.5 | F94: 6.5 | G94: =AVERAGE(E29,E21) -> 56.400 | H94: 2 | I94: 1
A95: 8 | B95: 3 | C95: Adam Stiers + Wyckoff | E95: 22.5 | F95: 6 | G95: =AVERAGE(E16,E41) -> 57.366666666666667 | H95: 1
A96: 9 | B96: 10 | C96: Tom Pepper + Travis Fruendt | E96: 21 | F96: 6.5 | G96: =AVERAGE(E50,E25) -> 59.708333333333329
A97: 10 | B97: 13 | C97: Perry Thirtyacre + Justin Zehr | E97: 19 | F97: 6.5 | G97: =AVERAGE(E45,E29) -> 59.054545454545455 | H97: 3 | I97: 1
A98: 11 | B98: 8 | C98: Sarah Potter + Adam Henderson | E98: 19 | F98: 4 | G98: =AVERAGE(E54,E42) -> 64.385416666666657 | H98: 2 | I98: 1
A99: 12 | B99: 1 | C99: Woody + Adam Miller | E99: 18 | F99: 6 | G99: =AVERAGE(E14,E17) -> 55.03125 | H99: 3 | I99: 1
A100: 13 | B100: 12 | C100: Joshua Beachy + Dustin Nohr | E100: 17.5 | F100: 6 | G100: =AVERAGE(E19,E37) -> 56.892857142857139
C102: WHACKER
A103: 1 | B103: 25 | C103: Doug Peyton + Chris Clime | E103: 35 | F103: 12.5 | G103: =AVERAGE(E7,E15) -> 52.84375
A104: 2 | B104: 18 | C104: Dan Kern + Jeremy Farnsworth | E104: 34 | F104: 13 | G104: =AVERAGE(E5,E4) -> 50.799107142857139 | H104: 1.5 | I104: 0.5
A105: 3 | B105: 21 | C105: Super Dave + Tim Peyton | E105: 32 | F105: 10.5 | G105: =AVERAGE(E34,E6) -> 54.472916666666663 | H105: 2.5 | I105: 1
A106: 4 | B106: 20 | C106: Matt Fritz + Egglesten | E106: 32 | F106: 10.5 | G106: =AVERAGE(E35,E36) -> 58.250 | H106: 0.5
A107: 5 | B107: 26 | C107: Joel Knutson + Rob Neubrand | E107: 24.5 | F107: 8.5 | G107: =AVERAGE(E27,E20) -> 56.21875 | H107: 3 | I107: 1
A108: 6 | B108: 22 | C108: Kurt Conrad + Chad Goodwin | E108: 24 | F108: 8 | G108: =AVERAGE(E11,E54) -> 61.510416666666664 | H108: 1
A109: 7 | B109: 17 | C109: Marty Reis + Spencer Eubanks | E109: 23 | F109: 7 | G109: =AVERAGE(E53,E24) -> 61.799107142857146 | H109: 2.5 | I109: 1
A110: 8 | B110: 23 | C110: Matt Wieben + Matt Shannon | E110: 21.5 | F110: 6.5 | G110: =AVERAGE(E10,E33) -> 56.000 | H110: 0.5
A111: 9 | B111: 14 | C111: Average Joe + Jason Rimrodt | E111: 20.5 | F111: 7 | G111: =AVERAGE(E18,E40) -> 56.9375 | H111: 2.5 | I111: 1
A112: 10 | B112: 15 | C112: Campos + Nathan Veeder | E112: 20 | F112: 6.5 | G112: =AVERAGE(E39,E23) -> 57.443750000000001 | H112: 2 | I112: 1
A113: 11 | B113: 24 | C113: Ryan Hamilton + D. Burns | E113: 20 | F113: 5.5 | G113: =AVERAGE(E28,E49) -> 59.535416666666663
A114: 12 | B114: 19 | C114: Matt Geers + M. Lerch | E114: 19.5 | F114: 7.5 | G114: =AVERAGE(E55,E44) -> 65.750 | H114: 1.5 | I114: 0.5
A115: 13 | B115: 16 | C115: Jerimie Maker + Smith | E115: 11.5 | F115: 4 | G115: =AVERAGE(E46,E48) -> 61.838461538461544 | H115: 0.5