A1: 2012 S.B.D.G.L. STANDINGS Through Week 5 Shaver
A2: Rank | B2: Player | C2: Total Strokes | D2: Weeks | E2: Average | F2: H-Cap | G2: Last | H2: Week Pt. | I2: Total Pts. | J2: Sub Pts.
A4: =A3+1 -> 1 | B4: Doug Peyton | C4: 242 | D4: 5 | E4: =(C4/D4) -> 48.400 | F4: 0 | G4: 51 | H4: 0.5 | I4: 2.5
A5: =A4+1 -> 2 | B5: Jeremy Farnsworth | C5: 244 | D5: 5 | E5: =(C5/D5) -> 48.800 | F5: =ROUNDDOWN(((E5-50)*0.8),0) -> 0 | G5: 54 | H5: 1 | I5: 4
A6: =A5+1 -> 3 | B6: Tim Peyton | C6: 245 | D6: 5 | E6: =(C6/D6) -> 49.000 | F6: =ROUNDDOWN(((E6-50)*0.8),0) -> 0 | G6: 53 | H6: 1 | I6: 3.5
A7: =A6+1 -> 4 | B7: Greco | C7: 249 | D7: 5 | E7: =(C7/D7) -> 49.800 | F7: =ROUNDDOWN(((E7-50)*0.8),0) -> 0 | G7: 54 | H7: 1 | I7: 3
A8: =A7+1 -> 5 | B8: Kurt Conrad | C8: 252 | D8: 5 | E8: =(C8/D8) -> 50.400 | F8: =ROUNDDOWN(((E8-50)*0.8),0) -> 0 | G8: 49 | H8: 1 | I8: 3
A9: =A8+1 -> 6 | B9: KVN Lavley | C9: 254 | D9: 5 | E9: =(C9/D9) -> 50.800 | F9: =ROUNDDOWN(((E9-50)*0.8),0) -> 0 | G9: 53 | H9: 1 | I9: 4.5
A10: =A9+1 -> 7 | B10: Doug Johnson | C10: 256 | D10: 5 | E10: =(C10/D10) -> 51.200 | F10: =ROUNDDOWN(((E10-50)*0.8),0) -> 0 | G10: 54 | I10: 2.5
A11: =A10+1 -> 8 | B11: Dan Kern | C11: 257 | D11: 5 | E11: =(C11/D11) -> 51.400 | F11: =ROUNDDOWN(((E11-50)*0.8),0) -> 1 | G11: 55 | H11: 1 | I11: 3
A12: =A11+1 -> 9 | B12: Kollin Grimm | C12: 258 | D12: 5 | E12: =(C12/D12) -> 51.600 | F12: =ROUNDDOWN(((E12-50)*0.8),0) -> 1 | G12: 52 | H12: 0.5 | I12: 2.5
A13: =A12+1 -> 10 | B13: Beachy | C13: 262 | D13: 5 | E13: =(C13/D13) -> 52.400 | F13: =ROUNDDOWN(((E13-50)*0.8),0) -> 1 | G13: 59 | H13: 1 | I13: 2
A14: =A13+1 -> 11 | B14: Tim Potter | C14: 263 | D14: 5 | E14: =(C14/D14) -> 52.600 | F14: =ROUNDDOWN(((E14-50)*0.8),0) -> 2 | G14: 58 | H14: 1 | I14: 4.5
A15: =A14+1 -> 12 | B15: Woody | C15: 263 | D15: 5 | E15: =(C15/D15) -> 52.600 | F15: =ROUNDDOWN(((E15-50)*0.8),0) -> 2 | G15: 59 | I15: 2
A16: =A15+1 -> 13 | B16: Chris Clime | C16: 266 | D16: 5 | E16: =(C16/D16) -> 53.200 | F16: =ROUNDDOWN(((E16-50)*0.8),0) -> 2 | G16: 60 | H16: 1 | I16: 5
A17: =A16+1 -> 14 | B17: Utley | C17: 267 | D17: 5 | E17: =(C17/D17) -> 53.400 | F17: =ROUNDDOWN(((E17-50)*0.8),0) -> 2 | G17: 60 | I17: 2
A18: =A17+1 -> 15 | B18: Nate Veeder | C18: 267 | D18: 5 | E18: =(C18/D18) -> 53.400 | F18: =ROUNDDOWN(((E18-50)*0.8),0) -> 2 | G18: 61 | I18: 2.5
A19: =A18+1 -> 16 | B19: Rob Neubrand | C19: 268 | D19: 5 | E19: =(C19/D19) -> 53.600 | F19: =ROUNDDOWN(((E19-50)*0.8),0) -> 2 | G19: 56 | H19: 1 | I19: 2
A20: =A19+1 -> 17 | B20: Rimmy | C20: 268 | D20: 5 | E20: =(C20/D20) -> 53.600 | F20: =ROUNDDOWN(((E20-50)*0.8),0) -> 2 | G20: 58 | H20: 1 | I20: 2
A21: =A20+1 -> 18 | B21: Adam Miller | C21: 268 | D21: 5 | E21: =(C21/D21) -> 53.600 | F21: =ROUNDDOWN(((E21-50)*0.8),0) -> 2 | G21: 60 | H21: 0.5 | I21: 3
A22: =A21+1 -> 19 | B22: Matt Wieben | C22: 270 | D22: 5 | E22: =(C22/D22) -> 54.000 | F22: =ROUNDDOWN(((E22-50)*0.8),0) -> 3 | G22: 60 | I22: 1
A23: =A22+1 -> 20 | B23: Frog | C23: 109 | D23: 2 | E23: =(C23/D23) -> 54.500 | F23: =ROUNDDOWN(((E23-50)*0.8),0) -> 3 | G23: 0 | I23: 3 | J23: 1
A24: =A23+1 -> 21 | B24: Ryan Hamilton | C24: 273 | D24: 5 | E24: =(C24/D24) -> 54.600 | F24: =ROUNDDOWN(((E24-50)*0.8),0) -> 3 | G24: 61 | H24: 1 | I24: 3.5
A25: =A24+1 -> 22 | B25: Stiers | C25: 275 | D25: 5 | E25: =(C25/D25) -> 55.000 | F25: =ROUNDDOWN(((E25-50)*0.8),0) -> 4 | G25: 59 | H25: 1 | I25: 3
A26: =A25+1 -> 23 | B26: Shirtless Bill | C26: 276 | D26: 5 | E26: =(C26/D26) -> 55.200 | F26: =ROUNDDOWN(((E26-50)*0.8),0) -> 4 | G26: 56 | H26: 1 | I26: 2
A27: =A26+1 -> 24 | B27: Jesse Streinz | C27: 276 | D27: 5 | E27: =(C27/D27) -> 55.200 | F27: =ROUNDDOWN(((E27-50)*0.8),0) -> 4 | G27: 65 | I27: 3.5
A28: =A27+1 -> 25 | B28: Travis Pike | C28: 278 | D28: 5 | E28: =(C28/D28) -> 55.600 | F28: =ROUNDDOWN(((E28-50)*0.8),0) -> 4 | G28: 66 | I28: 2
A29: =A28+1 -> 26 | B29: Joel Knutson | C29: 279 | D29: 5 | E29: =(C29/D29) -> 55.800 | F29: =ROUNDDOWN(((E29-50)*0.8),0) -> 4 | G29: 62 | H29: 0.5 | I29: 2.5
A30: =A29+1 -> 27 | B30: Martin Reis | C30: 280 | D30: 5 | E30: =(C30/D30) -> 56.000 | F30: =ROUNDDOWN(((E30-50)*0.8),0) -> 4 | G30: 63 | H30: 0.5 | I30: 2.5
A31: =A30+1 -> 28 | B31: Dustin Nohr | C31: 282 | D31: 5 | E31: =(C31/D31) -> 56.400 | F31: =ROUNDDOWN(((E31-50)*0.8),0) -> 5 | G31: 59 | H31: 1 | I31: 2
A32: =A31+1 -> 29 | B32: Wyckoff | C32: 226 | D32: 4 | E32: =(C32/D32) -> 56.500 | F32: =ROUNDDOWN(((E32-50)*0.8),0) -> 5 | G32: 67 | I32: 1
A33: =A32+1 -> 30 | B33: Ryan Eggleston | C33: 284 | D33: 5 | E33: =(C33/D33) -> 56.800 | F33: =ROUNDDOWN(((E33-50)*0.8),0) -> 5 | G33: 63 | H33: 1 | I33: 3
A34: =A33+1 -> 31 | B34: Travis Fruendt | C34: 284 | D34: 5 | E34: =(C34/D34) -> 56.800 | F34: =ROUNDDOWN(((E34-50)*0.8),0) -> 5 | G34: 64 | H34: 0.5 | I34: 2.5
A35: =A34+1 -> 32 | B35: Perry Thirtyacre | C35: 229 | D35: 4 | E35: =(C35/D35) -> 57.250 | F35: =ROUNDDOWN(((E35-50)*0.8),0) -> 5 | G35: 63 | I35: 0.5
A36: =A35+1 -> 33 | B36: John Williams | C36: 288 | D36: 5 | E36: =(C36/D36) -> 57.600 | F36: =ROUNDDOWN(((E36-50)*0.8),0) -> 6 | G36: 61 | I36: 1.5
A37: =A36+1 -> 34 | B37: Phil Campos | C37: 289 | D37: 5 | E37: =(C37/D37) -> 57.800 | F37: =ROUNDDOWN(((E37-50)*0.8),0) -> 6 | G37: 64 | I37: 3
A38: =A37+1 -> 35 | B38: Matt Fritz | C38: 290 | D38: 5 | E38: =(C38/D38) -> 58.000 | F38: =ROUNDDOWN(((E38-50)*0.8),0) -> 6 | G38: 66 | H38: 0.5 | I38: 4.5
A39: =A38+1 -> 36 | B39: Justin Zehr | C39: 290 | D39: 5 | E39: =(C39/D39) -> 58.000 | F39: =ROUNDDOWN(((E39-50)*0.8),0) -> 6 | G39: 68 | I39: 1
A40: =A39+1 -> 37 | B40: Kirby Callahan | C40: 290 | D40: 5 | E40: =(C40/D40) -> 58.000 | F40: =ROUNDDOWN(((E40-50)*0.8),0) -> 6 | G40: 71 | I40: 2
A41: =A40+1 -> 38 | B41: Matt Shannon | C41: 292 | D41: 5 | E41: =(C41/D41) -> 58.400 | F41: =ROUNDDOWN(((E41-50)*0.8),0) -> 6 | G41: 66 | I41: 1
A42: =A41+1 -> 39 | B42: Erik Smith | C42: 293 | D42: 5 | E42: =(C42/D42) -> 58.600 | F42: =ROUNDDOWN(((E42-50)*0.8),0) -> 6 | G42: 64 | I42: 1
A43: =A42+1 -> 40 | B43: Avg. Joe | C43: 295 | D43: 5 | E43: =(C43/D43) -> 59.000 | F43: =ROUNDDOWN(((E43-50)*0.8),0) -> 7 | G43: 67 | H43: 1 | I43: 2
A44: =A43+1 -> 41 | B44: D. Burns | C44: 295 | D44: 5 | E44: =(C44/D44) -> 59.000 | F44: =ROUNDDOWN(((E44-50)*0.8),0) -> 7 | G44: 68 | I44: 3
A45: =A44+1 -> 42 | B45: Adam Henderson | C45: 298 | D45: 5 | E45: =(C45/D45) -> 59.600 | F45: =ROUNDDOWN(((E45-50)*0.8),0) -> 7 | G45: 69 | I45: 3
A46: =A45+1 -> 43 | B46: Spencer Eubanks | C46: 240 | D46: 4 | E46: =(C46/D46) -> 60.000 | F46: =ROUNDDOWN(((E46-50)*0.8),0) -> 8 | G46: 64 | H46: 1 | I46: 3
A47: =A46+1 -> 44 | B47: David McCuskey | C47: 242 | D47: 4 | E47: =(C47/D47) -> 60.500 | F47: =ROUNDDOWN(((E47-50)*0.8),0) -> 8 | G47: 71 | I47: 2.5
A48: =A47+1 -> 45 | B48: Shane Thirtyacre | C48: 303 | D48: 5 | E48: =(C48/D48) -> 60.600 | F48: =ROUNDDOWN(((E48-50)*0.8),0) -> 8 | G48: 66 | H48: 1 | I48: 3.5
A49: =A48+1 -> 46 | B49: Tom Pepper | C49: 304 | D49: 5 | E49: =(C49/D49) -> 60.800 | F49: =ROUNDDOWN(((E49-50)*0.8),0) -> 8 | G49: 66 | I49: 2
A50: =A49+1 -> 47 | B50: Archie Coulter | C50: 305 | D50: 5 | E50: =(C50/D50) -> 61.000 | F50: =ROUNDDOWN(((E50-50)*0.8),0) -> 8 | G50: 67 | H50: 1 | I50: 3.5
A51: =A50+1 -> 48 | B51: Maker | C51: 311 | D51: 5 | E51: =(C51/D51) -> 62.200 | F51: =ROUNDDOWN(((E51-50)*0.8),0) -> 9 | G51: 74 | H51: 0 | I51: 1
A52: =A51+1 -> 49 | B52: Shawn Hullinger | C52: 328 | D52: 5 | E52: =(C52/D52) -> 65.600 | F52: =ROUNDDOWN(((E52-50)*0.8),0) -> 12 | G52: 73 | H52: 0.5 | I52: 1.5
A53: =A52+1 -> 50 | B53: Sarah Potter | C53: 337 | D53: 5 | E53: =(C53/D53) -> 67.400 | F53: =ROUNDDOWN(((E53-50)*0.8),0) -> 13 | G53: 73 | H53: 1 | I53: 3
A54: =A53+1 -> 51 | B54: Chad Goodwin | C54: 272 | D54: 4 | E54: =(C54/D54) -> 68.000 | F54: =ROUNDDOWN(((E54-50)*0.8),0) -> 14 | G54: 0 | I54: 1.5 | J54: 0
A55: =A54+1 -> 52 | B55: M. Lerch | C55: 361 | D55: 5 | E55: =(C55/D55) -> 72.200 | F55: =ROUNDDOWN(((E55-50)*0.8),0) -> 17 | G55: 81 | I55: 1
A57: Subs | B57: Player | C57: Total Strokes | D57: Weeks | E57: Average | F57: H-Cap | G57: Last | H57: Week Pt. | I57: Total Pts. | J57: Subed For
A58: 1 | B58: Ian Jacobs | C58: 288 | D58: 5 | E58: =(C58/D58) -> 57.600 | F58: =ROUNDDOWN(((E58-50)*0.8),0) -> 6 | G58: 64 | I58: 0 | J58: NA
A59: 2 | B59: Rob Mumma | C59: 57 | D59: 1 | E59: =SUM(C59/D59) -> 57.000 | F59: =ROUNDDOWN(((E59-50)*0.8),0) -> 5 | G59: 0 | I59: 0 | J59: NA
A60: 3 | B60: Ben Sandell | C60: 206 | D60: 3 | E60: =SUM(C60/D60) -> 68.666666666666671 | F60: =ROUNDDOWN(((E60-50)*0.8),0) -> 14 | G60: 79 | I60: 0 | J60: NA
A61: 4 | B61: AO | C61: 95 | D61: 2 | E61: =SUM(C61/D61) -> 47.500 | F61: 0 | G61: 0 | I61: 1 | J61: NA
A62: 5 | B62: Stibal | C62: 110 | D62: 2 | E62: =SUM(C62/D62) -> 55.000 | F62: =ROUNDDOWN(((E62-50)*0.8),0) -> 4 | G62: 58 | H62: 0 | I62: 1 | J62: Goodwin
A63: 6 | B63: Chuck | C63: =54+58 -> 112 | D63: 2 | E63: =SUM(C63/D63) -> 56.000 | F63: =ROUNDDOWN(((E63-50)*0.8),0) -> 4 | G63: 58 | H63: 1 | I63: 1.5 | J63: FROG
A64: 8 | B64: Prouty | C64: 71 | D64: 1 | E64: =SUM(C64/D64) -> 71.000 | F64: NA | G64: 71 | J64: NA
A65: 9 | C65: 0 | D65: 1 | E65: =SUM(C65/D65) -> 0.000 | F65: =ROUNDDOWN(((E65-50)*0.8),0) -> -40
A66: 10 | C66: 0 | D66: 1 | E66: =SUM(C66/D66) -> 0.000 | F66: =ROUNDDOWN(((E66-50)*0.8),0) -> -40
A67: 11 | C67: 0 | D67: 1 | E67: =SUM(C67/D67) -> 0.000 | F67: =ROUNDDOWN(((E67-50)*0.8),0) -> -40
A68: 12 | C68: 0 | D68: 1 | E68: =SUM(C68/D68) -> 0.000 | F68: =ROUNDDOWN(((E68-50)*0.8),0) -> -40
A69: 13 | C69: 0 | D69: 1 | E69: =SUM(C69/D69) -> 0.000 | F69: =ROUNDDOWN(((E69-50)*0.8),0) -> -40
A70: 14 | C70: 0 | D70: 1 | E70: =SUM(C70/D70) -> 0.000 | F70: =ROUNDDOWN(((E70-50)*0.8),0) -> -40
A71: 15 | C71: 0 | D71: 1 | E71: =SUM(C71/D71) -> 0.000 | F71: =ROUNDDOWN(((E71-50)*0.8),0) -> -40
A72: 16 | C72: 0 | D72: 1 | E72: =SUM(C72/D72) -> 0.000 | F72: =ROUNDDOWN(((E72-50)*0.8),0) -> -40
A73: 17 | C73: 0 | D73: 1 | E73: =SUM(C73/D73) -> 0.000 | F73: =ROUNDDOWN(((E73-50)*0.8),0) -> -40
A74: 18 | C74: 0 | D74: 1 | E74: =SUM(C74/D74) -> 0.000 | F74: =ROUNDDOWN(((E74-50)*0.8),0) -> -40
A75: 19 | C75: 0 | D75: 1 | E75: =SUM(C75/D75) -> 0.000 | F75: =ROUNDDOWN(((E75-50)*0.8),0) -> -40
A76: 20 | C76: 0 | D76: 1 | E76: =SUM(C76/D76) -> 0.000 | F76: =ROUNDDOWN(((E76-50)*0.8),0) -> -40
A77: 21 | C77: 0 | D77: 1 | E77: =SUM(C77/D77) -> 0.000 | F77: =ROUNDDOWN(((E77-50)*0.8),0) -> -40
A78: 22 | C78: 0 | D78: 1 | E78: =SUM(C78/D78) -> 0.000 | F78: =ROUNDDOWN(((E78-50)*0.8),0) -> -40
A79: 23 | C79: 0 | D79: 1 | E79: =SUM(C79/D79) -> 0.000 | F79: =ROUNDDOWN(((E79-50)*0.8),0) -> -40
A80: 24 | C80: 0 | D80: 1 | E80: =SUM(C80/D80) -> 0.000 | F80: =ROUNDDOWN(((E80-50)*0.8),0) -> -40
A81: 25 | C81: 0 | D81: 1 | E81: =SUM(C81/D81) -> 0.000 | F81: =ROUNDDOWN(((E81-50)*0.8),0) -> -40
A82: 26 | C82: 0 | D82: 1 | E82: =SUM(C82/D82) -> 0.000 | F82: =ROUNDDOWN(((E82-50)*0.8),0) -> -40
A83: 27 | C83: 0 | D83: 1 | E83: =SUM(C83/D83) -> 0.000 | F83: =ROUNDDOWN(((E83-50)*0.8),0) -> -40
A84: 28 | C84: 0 | D84: 1 | E84: =SUM(C84/D84) -> 0.000 | F84: =ROUNDDOWN(((E84-50)*0.8),0) -> -40
A86: 2012 SBDGL Team Standing
B87: TEAM # | C87: BUSH | E87: Total Points | F87: Team Points | G87: Team Avg
A88: 1 | B88: 4 | C88: KVN + Archie C. | E88: 12 | F88: 4 | G88: =AVERAGE(E50,E9) -> 55.900
A89: 2 | B89: 11 | C89: Tim Potter + Andrew Greco | E89: 11.5 | F89: 4 | G89: =AVERAGE(E7,E14) -> 51.200
A90: 3 | B90: 7 | C90: Doug Johnson + Shane Thirtyacre | E90: 10 | F90: 4 | G90: =AVERAGE(E48,E10) -> 55.900
A91: 4 | B91: 6 | C91: Hullinger + Jesse Streinz | E91: 8 | F91: 2 | G91: =AVERAGE(E52,E27) -> 60.400
A92: 5 | B92: 1 | C92: Woody + Adam Miller | E92: 7 | F92: 2 | G92: =AVERAGE(E14,E20) -> 53.100
A93: 6 | B93: 8 | C93: Sarah Potter + Adam Henderson | E93: 7 | F93: 1 | G93: =AVERAGE(E52,E44) -> 62.300
A94: 7 | B94: 9 | C94: John Williams + Kirby Callahan | E94: 6.5 | F94: 3 | G94: =AVERAGE(E42,E38) -> 58.300
A95: 8 | B95: 2 | C95: Travis Pike + Kollin Grimm | E95: 6.5 | F95: 2 | G95: =AVERAGE(E12,E28) -> 53.600
A96: 9 | B96: 10 | C96: Tom Pepper + Travis Fruendt | E96: 6.5 | F96: 2 | G96: =AVERAGE(E49,E34) -> 58.800
A97: 10 | B97: 5 | C97: Shirtless + Dustin Utley | E97: 6 | F97: 2 | G97: =AVERAGE(E26,E17) -> 54.300
A98: 11 | B98: 12 | C98: Joshua Beachy + Dustin Nohr | E98: 6 | F98: 2 | G98: =AVERAGE(E11, E29) -> 53.600
A99: 12 | B99: 3 | C99: Adam Stiers + Wyckoff | E99: 6 | F99: 2 | G99: =AVERAGE(E26,E33) -> 56.000
A100: 13 | B100: 13 | C100: Perry Thirtyacre + Justin Zehr | E100: 2.5 | F100: 1 | G100: =AVERAGE(E36,E40) -> 57.800
C102: WHACKER
A103: 1 | B103: 25 | C103: Doug Peyton + Chris Clime | E103: 11.5 | F103: 4 | G103: =AVERAGE(E4,E16) -> 50.800
A104: 2 | B104: 18 | C104: Dan Kern + Jeremy Farnsworth | E104: 11 | F104: 4 | G104: =AVERAGE(E2,E8) -> 50.400
A105: 3 | B105: 20 | C105: Matt Fritz + Egglesten | E105: 11 | F105: 3.5 | G105: =AVERAGE(E34,E39) -> 57.400
A106: 4 | B106: 17 | C106: Marty Reis + Spencer Eubanks | E106: 9.5 | F106: 4 | G106: =AVERAGE(E44,E28) -> 57.300
A107: 5 | B107: 24 | C107: Ryan Hamilton + D. Burns | E107: 9.5 | F107: 3 | G107: =AVERAGE(E26,E46) -> 57.600
A108: 6 | B108: 15 | C108: Campos + Nathan Veeder | E108: 8 | F108: 2.5 | G108: =AVERAGE(E39,E20) -> 55.800
A109: 7 | B109: 22 | C109: Kurt Conrad + Chad Goodwin | E109: 7.5 | F109: 3 | G109: =AVERAGE(E53,E7) -> 58.600
A110: 8 | B110: 21 | C110: Super Dave + Tim Peyton | E110: 7.5 | F110: 2 | G110: =AVERAGE(E48,E7) -> 55.200
A111: 9 | B111: 26 | C111: Joel Knutson + Rob Neubrand | E111: 6.5 | F111: 2 | G111: =AVERAGE(E29,E19) -> 54.700
A112: 10 | B112: 14 | C112: Average Joe + Jason Rimrodt | E112: 6 | F112: 2 | G112: =AVERAGE(E40,E17) -> 55.700
A113: 11 | B113: 19 | C113: Matt Geers + M. Lerch | E113: 5.5 | F113: 2 | G113: =AVERAGE(E56,E24) -> 54.600
A114: 12 | B114: 23 | C114: Matt Wieben + Matt Shannon | E114: 3 | F114: 1 | G114: =AVERAGE(E22,E41) -> 56.200
A115: 13 | B115: 16 | C115: Jerimie Maker + Smith | E115: 3 | F115: 1 | G115: =AVERAGE(E53,E44) -> 63.200