A1: 2012 S.B.D.G.L. STANDINGS Through Week 7 Legion
A2: Rank | B2: Player | C2: Total Strokes | D2: Weeks | E2: Average | F2: H-Cap | G2: Last | H2: Week Pt. | I2: Total Pts. | J2: Sub Pts.
A4: =A3+1 -> 1 | B4: Doug Peyton | C4: 343 | D4: 7 | E4: =(C4/D4) -> 49.000 | F4: =ROUNDDOWN(((E4-50)*0.8),0) -> 0 | G4: 47 | H4: 1 | I4: 4.5
A5: =A4+1 -> 2 | B5: Jeremy Farnsworth | C5: 350 | D5: 7 | E5: =(C5/D5) -> 50.000 | F5: =ROUNDDOWN(((E5-50)*0.8),0) -> 0 | G5: 51 | I5: 5
A6: =A5+1 -> 3 | B6: Tim Peyton | C6: 352 | D6: 7 | E6: =(C6/D6) -> 50.285714285714285 | F6: =ROUNDDOWN(((E6-50)*0.8),0) -> 0 | G6: 56 | I6: 4.5
A7: =A6+1 -> 4 | B7: Dan Kern | C7: 355 | D7: 7 | E7: =(C7/D7) -> 50.714285714285715 | F7: =ROUNDDOWN(((E7-50)*0.8),0) -> 0 | G7: 47 | H7: 1 | I7: 5
A8: =A7+1 -> 5 | B8: Greco | C8: 356 | D8: 7 | E8: =(C8/D8) -> 50.857142857142854 | F8: =ROUNDDOWN(((E8-50)*0.8),0) -> 0 | G8: 53 | I8: 4
A9: =A8+1 -> 6 | B9: Doug Johnson | C9: 364 | D9: 7 | E9: =(C9/D9) -> 52.000 | F9: =ROUNDDOWN(((E9-50)*0.8),0) -> 1 | G9: 49 | H9: 1 | I9: 3.5
A10: =A9+1 -> 7 | B10: Kurt Conrad | C10: 365 | D10: 7 | E10: =(C10/D10) -> 52.142857142857146 | F10: =ROUNDDOWN(((E10-50)*0.8),0) -> 1 | G10: 56 | I10: 4
A11: =A10+1 -> 8 | B11: KVN Lavley | C11: 368 | D11: 7 | E11: =(C11/D11) -> 52.571428571428569 | F11: =ROUNDDOWN(((E11-50)*0.8),0) -> 2 | G11: 53 | H11: 1 | I11: 5.5
A12: =A11+1 -> 9 | B12: Woody | C12: 371 | D12: 7 | E12: =(C12/D12) -> 53.000 | F12: =ROUNDDOWN(((E12-50)*0.8),0) -> 2 | G12: 51 | I12: 2
A13: =A12+1 -> 10 | B13: Kollin Grimm | C13: 374 | D13: 7 | E13: =(C13/D13) -> 53.428571428571431 | F13: =ROUNDDOWN(((E13-50)*0.8),0) -> 2 | G13: 55 | I13: 3.5
A14: =A13+1 -> 11 | B14: Chris Clime | C14: 376 | D14: 7 | E14: =(C14/D14) -> 53.714285714285715 | F14: =ROUNDDOWN(((E14-50)*0.8),0) -> 2 | G14: 56 | H14: 1 | I14: 7
A15: =A14+1 -> 12 | B15: Nate Veeder | C15: 377 | D15: 7 | E15: =(C15/D15) -> 53.857142857142854 | F15: =ROUNDDOWN(((E15-50)*0.8),0) -> 3 | G15: 54 | H15: 0.5 | I15: 3.5
A16: =A15+1 -> 13 | B16: Tim Potter | C16: 378 | D16: 7 | E16: =(C16/D16) -> 54.000 | F16: =ROUNDDOWN(((E16-50)*0.8),0) -> 3 | G16: 57 | I16: 5.5
A17: =A16+1 -> 14 | B17: Matt Wieben | C17: 379 | D17: 7 | E17: =(C17/D17) -> 54.142857142857146 | F17: =ROUNDDOWN(((E17-50)*0.8),0) -> 3 | G17: 52 | H17: 1 | I17: 2.5
A18: =A17+1 -> 15 | B18: Rob Neubrand | C18: 379 | D18: 7 | E18: =(C18/D18) -> 54.142857142857146 | F18: =ROUNDDOWN(((E18-50)*0.8),0) -> 3 | G18: 54 | H18: 0.5 | I18: 3.5
A19: =A18+1 -> 16 | B19: Rimmy | C19: 380 | D19: 7 | E19: =(C19/D19) -> 54.285714285714285 | F19: =ROUNDDOWN(((E19-50)*0.8),0) -> 3 | G19: 51 | H19: 1 | I19: 3
A20: =A19+1 -> 17 | B20: Stiers | C20: 326 | D20: 6 | E20: =(C20/D20) -> 54.333333333333336 | F20: =ROUNDDOWN(((E20-50)*0.8),0) -> 3 | G20: 51 | H20: 1 | I20: 5
A21: =A20+1 -> 18 | B21: Utley | C21: 381 | D21: 7 | E21: =(C21/D21) -> 54.428571428571431 | F21: =ROUNDDOWN(((E21-50)*0.8),0) -> 3 | G21: 54 | H21: 1 | I21: 4
A22: =A21+1 -> 19 | B22: Beachy | C22: 381 | D22: 7 | E22: =(C22/D22) -> 54.428571428571431 | F22: =ROUNDDOWN(((E22-50)*0.8),0) -> 3 | G22: 59 | I22: 2
A23: =A22+1 -> 20 | B23: Ryan Hamilton | C23: 384 | D23: 7 | E23: =(C23/D23) -> 54.857142857142854 | F23: =ROUNDDOWN(((E23-50)*0.8),0) -> 3 | G23: 55 | H23: 1 | I23: 5.5
A24: =A23+1 -> 21 | B24: Jesse Streinz | C24: 385 | D24: 7 | E24: =(C24/D24) -> 55.000 | F24: =ROUNDDOWN(((E24-50)*0.8),0) -> 4 | G24: 52 | H24: 1 | I24: 5.5
A25: =A24+1 -> 22 | B25: Adam Miller | C25: 385 | D25: 7 | E25: =(C25/D25) -> 55.000 | F25: =ROUNDDOWN(((E25-50)*0.8),0) -> 4 | G25: 55 | H25: 1 | I25: 4
A26: =A25+1 -> 23 | B26: Travis Pike | C26: 392 | D26: 7 | E26: =(C26/D26) -> 56.000 | F26: =ROUNDDOWN(((E26-50)*0.8),0) -> 4 | G26: 57 | H26: 1 | I26: 4
A27: =A26+1 -> 24 | B27: Shirtless Bill | C27: 393 | D27: 7 | E27: =(C27/D27) -> 56.142857142857146 | F27: =ROUNDDOWN(((E27-50)*0.8),0) -> 4 | G27: 56 | H27: 1 | I27: 3
A28: =A27+1 -> 25 | B28: Joel Knutson | C28: 394 | D28: 7 | E28: =(C28/D28) -> 56.285714285714285 | F28: =ROUNDDOWN(((E28-50)*0.8),0) -> 5 | G28: 55 | H28: 1 | I28: 3.5
A29: =A28+1 -> 26 | B29: Dustin Nohr | C29: 338 | D29: 6 | E29: =(C29/D29) -> 56.333333333333336 | F29: =ROUNDDOWN(((E29-50)*0.8),0) -> 5 | G29: 56 | I29: 3
A30: =A29+1 -> 27 | B30: Travis Fruendt | C30: 341 | D30: 6 | E30: =(C30/D30) -> 56.833333333333336 | F30: =ROUNDDOWN(((E30-50)*0.8),0) -> 5 | G30: 57 | I30: 2.5
A31: =A30+1 -> 28 | B31: Frog | C31: 171 | D31: 3 | E31: =(C31/D31) -> 57.000 | F31: =ROUNDDOWN(((E31-50)*0.8),0) -> 5 | G31: NA | I31: 3 | J31: 0
A32: =A31+1 -> 29 | B32: Martin Reis | C32: 400 | D32: 7 | E32: =(C32/D32) -> 57.142857142857146 | F32: =ROUNDDOWN(((E32-50)*0.8),0) -> 5 | G32: 61 | I32: 2.5
A33: =A32+1 -> 30 | B33: Matt Fritz | C33: 403 | D33: 7 | E33: =(C33/D33) -> 57.571428571428569 | F33: =ROUNDDOWN(((E33-50)*0.8),0) -> 6 | G33: 55 | I33: 4.5
A34: =A33+1 -> 31 | B34: Perry Thirtyacre | C34: 347 | D34: 6 | E34: =(C34/D34) -> 57.833333333333336 | F34: =ROUNDDOWN(((E34-50)*0.8),0) -> 6 | G34: 57 | H34: 1 | I34: 1.5
A35: =A34+1 -> 32 | B35: Matt Shannon | C35: 406 | D35: 7 | E35: =(C35/D35) -> 58.000 | F35: =ROUNDDOWN(((E35-50)*0.8),0) -> 6 | G35: 56 | I35: 2
A36: =A35+1 -> 33 | B36: Ryan Eggleston | C36: 407 | D36: 7 | E36: =(C36/D36) -> 58.142857142857146 | F36: =ROUNDDOWN(((E36-50)*0.8),0) -> 6 | G36: 61 | H36: 1 | I36: 4
A37: =A36+1 -> 34 | B37: Phil Campos | C37: 408 | D37: 7 | E37: =(C37/D37) -> 58.285714285714285 | F37: =ROUNDDOWN(((E37-50)*0.8),0) -> 6 | G37: 57 | I37: 3
A38: =A37+1 -> 35 | B38: John Williams | C38: 409 | D38: 7 | E38: =(C38/D38) -> 58.428571428571431 | F38: =ROUNDDOWN(((E38-50)*0.8),0) -> 6 | G38: 59 | H38: 1 | I38: 2.5
A39: =A38+1 -> 36 | B39: Wyckoff | C39: 351 | D39: 6 | E39: =(C39/D39) -> 58.500 | F39: =ROUNDDOWN(((E39-50)*0.8),0) -> 6 | G39: 61 | I39: 1
A40: =A39+1 -> 37 | B40: Avg. Joe | C40: 412 | D40: 7 | E40: =(C40/D40) -> 58.857142857142854 | F40: =ROUNDDOWN(((E40-50)*0.8),0) -> 7 | G40: 59 | I40: 3
A41: =A40+1 -> 38 | B41: Kirby Callahan | C41: 413 | D41: 7 | E41: =(C41/D41) -> 59.000 | F41: =ROUNDDOWN(((E41-50)*0.8),0) -> 7 | G41: 58 | H41: 0.5 | I41: 2.5
A42: =A41+1 -> 39 | B42: Justin Zehr | C42: 415 | D42: 7 | E42: =(C42/D42) -> 59.285714285714285 | F42: =ROUNDDOWN(((E42-50)*0.8),0) -> 7 | G42: 66 | I42: 2
A43: =A42+1 -> 40 | B43: Erik Smith | C43: 417 | D43: 7 | E43: =(C43/D43) -> 59.571428571428569 | F43: =ROUNDDOWN(((E43-50)*0.8),0) -> 7 | G43: 59 | I43: 1
A44: =A43+1 -> 41 | B44: David McCuskey | C44: 359 | D44: 6 | E44: =(C44/D44) -> 59.833333333333336 | F44: =ROUNDDOWN(((E44-50)*0.8),0) -> 7 | G44: 56 | H44: 1 | I44: 4.5
A45: =A44+1 -> 42 | B45: D. Burns | C45: 419 | D45: 7 | E45: =(C45/D45) -> 59.857142857142854 | F45: =ROUNDDOWN(((E45-50)*0.8),0) -> 7 | G45: 59 | H45: 1 | I45: 4
A46: =A45+1 -> 43 | B46: Adam Henderson | C46: 422 | D46: 7 | E46: =(C46/D46) -> 60.285714285714285 | F46: =ROUNDDOWN(((E46-50)*0.8),0) -> 8 | G46: 61 | I46: 4
A47: =A46+1 -> 44 | B47: Shane Thirtyacre | C47: 427 | D47: 7 | E47: =(C47/D47) -> 61.000 | F47: =ROUNDDOWN(((E47-50)*0.8),0) -> 8 | G47: 61 | I47: 4.5
A48: =A47+1 -> 45 | B48: Spencer Eubanks | C48: 370 | D48: 6 | E48: =(C48/D48) -> 61.666666666666664 | F48: =ROUNDDOWN(((E48-50)*0.8),0) -> 9 | G48: 62 | I48: 3
A49: =A48+1 -> 46 | B49: Archie Coulter | C49: 434 | D49: 7 | E49: =(C49/D49) -> 62.000 | F49: =ROUNDDOWN(((E49-50)*0.8),0) -> 9 | G49: 61 | H49: 1 | I49: 4.5
A50: =A49+1 -> 47 | B50: Tom Pepper | C50: 436 | D50: 7 | E50: =(C50/D50) -> 62.285714285714285 | F50: =ROUNDDOWN(((E50-50)*0.8),0) -> 9 | G50: 62 | I50: 2
A51: =A50+1 -> 48 | B51: Maker | C51: 437 | D51: 7 | E51: =(C51/D51) -> 62.428571428571431 | F51: =ROUNDDOWN(((E51-50)*0.8),0) -> 9 | G51: 58 | H51: 1 | I51: 2
A52: =A51+1 -> 49 | B52: Shawn Hullinger | C52: 461 | D52: 7 | E52: =(C52/D52) -> 65.857142857142861 | F52: =ROUNDDOWN(((E52-50)*0.8),0) -> 12 | G52: 63 | H52: 1 | I52: 3.5
A53: =A52+1 -> 50 | B53: Sarah Potter | C53: 470 | D53: 7 | E53: =(C53/D53) -> 67.142857142857139 | F53: =ROUNDDOWN(((E53-50)*0.8),0) -> 13 | G53: 63 | H53: 1 | I53: 5
A54: =A53+1 -> 51 | B54: Chad Goodwin | C54: 337 | D54: 5 | E54: =(C54/D54) -> 67.400 | F54: =ROUNDDOWN(((E54-50)*0.8),0) -> 13 | G54: 65 | H54: 0.5 | I54: 3
A55: =A54+1 -> 52 | B55: M. Lerch | C55: 514 | D55: 7 | E55: =(C55/D55) -> 73.428571428571431 | F55: =ROUNDDOWN(((E55-50)*0.8),0) -> 18 | G55: 73 | I55: 1
A57: Subs | B57: Player | C57: Total Strokes | D57: Weeks | E57: Average | F57: H-Cap | G57: Last | H57: Week Pt. | I57: Total Pts. | J57: Subed For
A58: 1 | B58: Ian Jacobs | C58: 410 | D58: 7 | E58: =(C58/D58) -> 58.571428571428569 | F58: =ROUNDDOWN(((E58-50)*0.8),0) -> 6 | G58: 59 | H58: 0 | I58: 1
A59: 2 | B59: Rob Mumma | C59: 57 | D59: 1 | E59: =SUM(C59/D59) -> 57.000 | F59: NA | G59: 0 | I59: 0
A60: 3 | B60: Ben Sandell | C60: 267 | D60: 4 | E60: =SUM(C60/D60) -> 66.750 | F60: =ROUNDDOWN(((E60-50)*0.8),0) -> 13 | G60: 61 | H60: 0 | I60: 0
A61: 4 | B61: AO | C61: 95 | D61: 2 | E61: =SUM(C61/D61) -> 47.500 | F61: 0 | G61: 0 | I61: 1
A62: 5 | B62: Stibal | C62: 175 | D62: 3 | E62: =SUM(C62/D62) -> 58.333333333333336 | F62: =ROUNDDOWN(((E62-50)*0.8),0) -> 6 | G62: 0 | I62: 1
A63: 6 | B63: Chuck | C63: =54+58 -> 112 | D63: 2 | E63: =SUM(C63/D63) -> 56.000 | F63: =ROUNDDOWN(((E63-50)*0.8),0) -> 4 | G63: 0 | I63: 1.5
A64: 8 | B64: Prouty | C64: 71 | D64: 1 | E64: =SUM(C64/D64) -> 71.000 | F64: NA | G64: 0 | I64: 0
A65: 9 | B65: Steve Adkinson | C65: 65 | D65: 1 | E65: =SUM(C65/D65) -> 65.000 | F65: NA | G65: 0 | I65: 0
A66: 10 | B66: Dev Nelson | C66: 58 | D66: 1 | E66: =SUM(C66/D66) -> 58.000 | F66: NA | G66: 0 | I66: 1
A67: 11 | B67: Greg Friestad | C67: 59 | D67: 1 | E67: =SUM(C67/D67) -> 59.000 | F67: NA | G67: 0 | I67: 1
A68: 12 | B68: Bob Hernandez | C68: 56 | D68: 1 | E68: =SUM(C68/D68) -> 56.000 | F68: NA | G68: 56 | H68: 0 | I68: 0
A69: 13 | B69: Dan Lewis | C69: 54 | D69: 1 | E69: =SUM(C69/D69) -> 54.000 | F69: NA | G69: 54 | H69: 0 | I69: 0 | J69: Frog
A70: 14 | C70: 0 | D70: 1 | E70: =SUM(C70/D70) -> 0.000 | F70: =ROUNDDOWN(((E70-50)*0.8),0) -> -40
A71: 15 | C71: 0 | D71: 1 | E71: =SUM(C71/D71) -> 0.000 | F71: =ROUNDDOWN(((E71-50)*0.8),0) -> -40
A72: 16 | C72: 0 | D72: 1 | E72: =SUM(C72/D72) -> 0.000 | F72: =ROUNDDOWN(((E72-50)*0.8),0) -> -40
A73: 17 | C73: 0 | D73: 1 | E73: =SUM(C73/D73) -> 0.000 | F73: =ROUNDDOWN(((E73-50)*0.8),0) -> -40
A74: 18 | C74: 0 | D74: 1 | E74: =SUM(C74/D74) -> 0.000 | F74: =ROUNDDOWN(((E74-50)*0.8),0) -> -40
A75: 19 | C75: 0 | D75: 1 | E75: =SUM(C75/D75) -> 0.000 | F75: =ROUNDDOWN(((E75-50)*0.8),0) -> -40
A76: 20 | C76: 0 | D76: 1 | E76: =SUM(C76/D76) -> 0.000 | F76: =ROUNDDOWN(((E76-50)*0.8),0) -> -40
A77: 21 | C77: 0 | D77: 1 | E77: =SUM(C77/D77) -> 0.000 | F77: =ROUNDDOWN(((E77-50)*0.8),0) -> -40
A78: 22 | C78: 0 | D78: 1 | E78: =SUM(C78/D78) -> 0.000 | F78: =ROUNDDOWN(((E78-50)*0.8),0) -> -40
A79: 23 | C79: 0 | D79: 1 | E79: =SUM(C79/D79) -> 0.000 | F79: =ROUNDDOWN(((E79-50)*0.8),0) -> -40
A80: 24 | C80: 0 | D80: 1 | E80: =SUM(C80/D80) -> 0.000 | F80: =ROUNDDOWN(((E80-50)*0.8),0) -> -40
A81: 25 | C81: 0 | D81: 1 | E81: =SUM(C81/D81) -> 0.000 | F81: =ROUNDDOWN(((E81-50)*0.8),0) -> -40
A82: 26 | C82: 0 | D82: 1 | E82: =SUM(C82/D82) -> 0.000 | F82: =ROUNDDOWN(((E82-50)*0.8),0) -> -40
A83: 27 | C83: 0 | D83: 1 | E83: =SUM(C83/D83) -> 0.000 | F83: =ROUNDDOWN(((E83-50)*0.8),0) -> -40
A84: 28 | C84: 0 | D84: 1 | E84: =SUM(C84/D84) -> 0.000 | F84: =ROUNDDOWN(((E84-50)*0.8),0) -> -40
A86: 2012 SBDGL Team Standing
B87: TEAM # | C87: BUSH | E87: Total Points | F87: Team Points | G87: Team Avg | H87: Week Total | I87: Week Team
A88: 1 | B88: 4 | C88: KVN + Archie C. | E88: 15 | F88: 5 | G88: =AVERAGE(E49,E11) -> 57.285714285714285 | H88: 3 | I88: 1
A89: 2 | B89: 11 | C89: Tim Potter + Andrew Greco | E89: 14.5 | F89: 5 | G89: =AVERAGE(E8,E16) -> 52.428571428571431
A90: 3 | B90: 7 | C90: Doug Johnson + Shane Thirtyacre | E90: 14 | F90: 6 | G90: =AVERAGE(E47,E9) -> 56.500 | H90: 2 | I90: 1
A91: 4 | B91: 6 | C91: Hullinger + Jesse Streinz | E91: 14 | F91: 4 | G91: =AVERAGE(E52,E24) -> 60.428571428571431 | H91: 3 | I91: 1
A92: 5 | B92: 2 | C92: Travis Pike + Kollin Grimm | E92: 11.5 | F92: 4 | G92: =AVERAGE(E13,E26) -> 54.714285714285715 | H92: 2 | I92: 1
A93: 6 | B93: 8 | C93: Sarah Potter + Adam Henderson | E93: 11 | F93: 2 | G93: =AVERAGE(E53,E46) -> 63.714285714285708 | H93: 1
A94: 7 | B94: 5 | C94: Shirtless + Dustin Utley | E94: 10 | F94: 3 | G94: =AVERAGE(E21,E27) -> 55.285714285714292 | H94: 3 | I94: 1
A95: 8 | B95: 9 | C95: John Williams + Kirby Callahan | E95: 9 | F95: 4 | G95: =AVERAGE(E41,E38) -> 58.714285714285715 | H95: 2.5 | I95: 1
A96: 9 | B96: 1 | C96: Woody + Adam Miller | E96: 9 | F96: 3 | G96: =AVERAGE(E12,E25) -> 54.000 | H96: 2 | I96: 1
A97: 10 | B97: 12 | C97: Joshua Beachy + Dustin Nohr | E97: 8 | F97: 3 | G97: =AVERAGE(E22,E29) -> 55.38095238095238
A98: 11 | B98: 3 | C98: Adam Stiers + Wyckoff | E98: 8 | F98: 2 | G98: =AVERAGE(E39,E20) -> 56.416666666666671 | H98: 1
A99: 12 | B99: 10 | C99: Tom Pepper + Travis Fruendt | E99: 6.5 | F99: 2 | G99: =AVERAGE(E50,E30) -> 59.55952380952381
A100: 13 | B100: 13 | C100: Perry Thirtyacre + Justin Zehr | E100: 5.5 | F100: 2 | G100: =AVERAGE(E34,E42) -> 58.55952380952381 | H100: 1
C102: WHACKER
A103: 1 | B103: 25 | C103: Doug Peyton + Chris Clime | E103: 17.5 | F103: 6 | G103: =AVERAGE(E4,E14) -> 51.357142857142861 | H103: 3 | I103: 1
A104: 2 | B104: 18 | C104: Dan Kern + Jeremy Farnsworth | E104: 16 | F104: 6 | G104: =AVERAGE(E5,E7) -> 50.357142857142861 | H104: 2 | I104: 1
A105: 3 | B105: 24 | C105: Ryan Hamilton + D. Burns | E105: 13.5 | F105: 4 | G105: =AVERAGE(E45,E23) -> 57.357142857142854 | H105: 3 | I105: 1
A106: 4 | B106: 20 | C106: Matt Fritz + Egglesten | E106: 12.5 | F106: 4 | G106: =AVERAGE(E36,E33) -> 57.857142857142861 | H106: 1.5 | I106: 0.5
A107: 5 | B107: 21 | C107: Super Dave + Tim Peyton | E107: 12 | F107: 3.5 | G107: =AVERAGE(E44,E6) -> 55.05952380952381 | H107: 1.5 | I107: 0.5
A108: 6 | B108: 22 | C108: Kurt Conrad + Chad Goodwin | E108: 11 | F108: 4 | G108: =AVERAGE(E54,E10) -> 59.771428571428572 | H108: 0.5
A109: 7 | B109: 26 | C109: Joel Knutson + Rob Neubrand | E109: 10 | F109: 3 | G109: =AVERAGE(E28,E18) -> 55.214285714285715 | H109: 2.5 | I109: 1
A110: 8 | B110: 17 | C110: Marty Reis + Spencer Eubanks | E110: 9.5 | F110: 4 | G110: =AVERAGE(E48,E32) -> 59.404761904761905
A111: 9 | B111: 14 | C111: Average Joe + Jason Rimrodt | E111: 9.5 | F111: 3.5 | G111: =AVERAGE(E19,E40) -> 56.571428571428569 | H111: 1.5 | I111: 0.5
A112: 10 | B112: 15 | C112: Campos + Nathan Veeder | E112: 9 | F112: 2.5 | G112: =AVERAGE(E37,E15) -> 56.071428571428569 | H112: 0.5
A113: 11 | B113: 23 | C113: Matt Wieben + Matt Shannon | E113: 6.5 | F113: 2 | G113: =AVERAGE(E17,E35) -> 56.071428571428569 | H113: 1
A114: 12 | B114: 19 | C114: Matt Geers + M. Lerch | E114: 5.5 | F114: 2 | G114: =AVERAGE(E31,E55) -> 65.214285714285722
A115: 13 | B115: 16 | C115: Jerimie Maker + Smith | E115: 4.5 | F115: 1.5 | G115: =AVERAGE(E51,E43) -> 61.000 | H115: 1.5 | I115: 0.5