A1: 2012 S.B.D.G.L. STANDINGS Through Week 11 Turkey
A2: Rank | B2: Player | C2: Total Strokes | D2: Weeks | E2: Average | F2: H-Cap | G2: Last | H2: Week Pt. | I2: Total Pts. | J2: Sub Pts.
A4: =A3+1 -> 1 | B4: Jeremy Farnsworth | C4: 449 | D4: 9 | E4: =(C4/D4) -> 49.888888888888886 | F4: =ROUNDDOWN(((E4-50)*0.8),0) -> 0 | G4: 0 | I4: 7 | J4: 0
A5: =A4+1 -> 2 | B5: Doug Peyton | C5: 549 | D5: 11 | E5: =(C5/D5) -> 49.909090909090907 | F5: =ROUNDDOWN(((E5-50)*0.8),0) -> 0 | G5: 48 | H5: 1 | I5: 7
A6: =A5+1 -> 3 | B6: Tim Peyton | C6: 560 | D6: 11 | E6: =(C6/D6) -> 50.909090909090907 | F6: =ROUNDDOWN(((E6-50)*0.8),0) -> 0 | G6: 49 | I6: 5.5
A7: =A6+1 -> 4 | B7: Dan Kern | C7: 566 | D7: 11 | E7: =(C7/D7) -> 51.454545454545453 | F7: =ROUNDDOWN(((E7-50)*0.8),0) -> 1 | G7: 49 | H7: 1 | I7: 6
A8: =A7+1 -> 5 | B8: Greco | C8: 575 | D8: 11 | E8: =(C8/D8) -> 52.272727272727273 | F8: =ROUNDDOWN(((E8-50)*0.8),0) -> 1 | G8: 51 | I8: 6
A9: =A8+1 -> 6 | B9: KVN Lavley | C9: 579 | D9: 11 | E9: =(C9/D9) -> 52.636363636363633 | F9: =ROUNDDOWN(((E9-50)*0.8),0) -> 2 | G9: 48 | H9: 1 | I9: 8
A10: =A9+1 -> 7 | B10: Kurt Conrad | C10: 586 | D10: 11 | E10: =(C10/D10) -> 53.272727272727273 | F10: =ROUNDDOWN(((E10-50)*0.8),0) -> 2 | G10: 52 | H10: 1 | I10: 6.5
A11: =A10+1 -> 8 | B11: Doug Johnson | C11: 591 | D11: 11 | E11: =(C11/D11) -> 53.727272727272727 | F11: =ROUNDDOWN(((E11-50)*0.8),0) -> 2 | G11: 50 | H11: 1 | I11: 6.5
A12: =A11+1 -> 9 | B12: Rimmy | C12: 593 | D12: 11 | E12: =(C12/D12) -> 53.909090909090907 | F12: =ROUNDDOWN(((E12-50)*0.8),0) -> 3 | G12: 51 | H12: 1 | I12: 5
A13: =A12+1 -> 10 | B13: Matt Wieben | C13: 595 | D13: 11 | E13: =(C13/D13) -> 54.090909090909093 | F13: =ROUNDDOWN(((E13-50)*0.8),0) -> 3 | G13: 52 | H13: 1 | I13: 6
A14: =A13+1 -> 11 | B14: Tim Potter | C14: 596 | D14: 11 | E14: =(C14/D14) -> 54.18181818181818 | F14: =ROUNDDOWN(((E14-50)*0.8),0) -> 3 | G14: 53 | H14: 1 | I14: 9
A15: =A14+1 -> 12 | B15: Chris Clime | C15: 600 | D15: 11 | E15: =(C15/D15) -> 54.545454545454547 | F15: =ROUNDDOWN(((E15-50)*0.8),0) -> 3 | G15: 55 | H15: 1 | I15: 10
A16: =A15+1 -> 13 | B16: Kollin Grimm | C16: 601 | D16: 11 | E16: =(C16/D16) -> 54.636363636363633 | F16: =ROUNDDOWN(((E16-50)*0.8),0) -> 3 | G16: 56 | I16: 6.5
A17: =A16+1 -> 14 | B17: Woody | C17: 602 | D17: 11 | E17: =(C17/D17) -> 54.727272727272727 | F17: =ROUNDDOWN(((E17-50)*0.8),0) -> 3 | G17: 54 | I17: 2
A18: =A17+1 -> 15 | B18: Rob Neubrand | C18: 605 | D18: 11 | E18: =(C18/D18) -> 55.000 | F18: =ROUNDDOWN(((E18-50)*0.8),0) -> 4 | G18: 53 | H18: 1 | I18: 4.5
A19: =A18+1 -> 16 | B19: Jesse Streinz | C19: 607 | D19: 11 | E19: =(C19/D19) -> 55.18181818181818 | F19: =ROUNDDOWN(((E19-50)*0.8),0) -> 4 | G19: 54 | H19: 1 | I19: 8.5
A20: =A19+1 -> 17 | B20: Adam Miller | C20: 610 | D20: 11 | E20: =(C20/D20) -> 55.454545454545453 | F20: =ROUNDDOWN(((E20-50)*0.8),0) -> 4 | G20: 57 | I20: 6
A21: =A20+1 -> 18 | B21: Stiers | C21: 555 | D21: 10 | E21: =(C21/D21) -> 55.500 | F21: =ROUNDDOWN(((E21-50)*0.8),0) -> 4 | G21: 59 | I21: 7.5
A22: =A21+1 -> 19 | B22: Utley | C22: 615 | D22: 11 | E22: =(C22/D22) -> 55.909090909090907 | F22: =ROUNDDOWN(((E22-50)*0.8),0) -> 4 | G22: 51 | H22: 1 | I22: 5
A23: =A22+1 -> 20 | B23: Nate Veeder | C23: 560 | D23: 10 | E23: =(C23/D23) -> 56.000 | F23: =ROUNDDOWN(((E23-50)*0.8),0) -> 4 | G23: 54 | H23: 0.5 | I23: 4
A24: =A23+1 -> 21 | B24: Beachy | C24: 616 | D24: 11 | E24: =(C24/D24) -> 56.000 | F24: =ROUNDDOWN(((E24-50)*0.8),0) -> 4 | G24: 57 | I24: 2
A25: =A24+1 -> 22 | B25: Ryan Hamilton | C25: 617 | D25: 11 | E25: =(C25/D25) -> 56.090909090909093 | F25: =ROUNDDOWN(((E25-50)*0.8),0) -> 4 | G25: 53 | H25: 1 | I25: 7
A26: =A25+1 -> 23 | B26: Travis Fruendt | C26: 565 | D26: 10 | E26: =(C26/D26) -> 56.500 | F26: =ROUNDDOWN(((E26-50)*0.8),0) -> 5 | G26: 55 | H26: 0.5 | I26: 5
A27: =A26+1 -> 24 | B27: Martin Reis | C27: 626 | D27: 11 | E27: =(C27/D27) -> 56.909090909090907 | F27: =ROUNDDOWN(((E27-50)*0.8),0) -> 5 | G27: 54 | H27: 1 | I27: 5.5
A28: =A27+1 -> 25 | B28: Joel Knutson | C28: 626 | D28: 11 | E28: =(C28/D28) -> 56.909090909090907 | F28: =ROUNDDOWN(((E28-50)*0.8),0) -> 5 | G28: 55 | I28: 5
A29: =A28+1 -> 26 | B29: Shirtless Bill | C29: 571 | D29: 10 | E29: =(C29/D29) -> 57.100 | F29: =ROUNDDOWN(((E29-50)*0.8),0) -> 5 | G29: 58 | I29: 4.5
A30: =A29+1 -> 27 | B30: Travis Pike | C30: 633 | D30: 11 | E30: =(C30/D30) -> 57.545454545454547 | F30: =ROUNDDOWN(((E30-50)*0.8),0) -> 6 | G30: 59 | I30: 6
A31: =A30+1 -> 28 | B31: Perry Thirtyacre | C31: 578 | D31: 10 | E31: =(C31/D31) -> 57.800 | F31: =ROUNDDOWN(((E31-50)*0.8),0) -> 6 | G31: 56 | I31: 3.5
A32: =A31+1 -> 29 | B32: Matt Fritz | C32: 636 | D32: 11 | E32: =(C32/D32) -> 57.81818181818182 | F32: =ROUNDDOWN(((E32-50)*0.8),0) -> 6 | G32: 57 | I32: 7.5
A33: =A32+1 -> 30 | B33: Dustin Nohr | C33: 579 | D33: 10 | E33: =(C33/D33) -> 57.900 | F33: =ROUNDDOWN(((E33-50)*0.8),0) -> 6 | G33: 54 | H33: 1 | I33: 4.5
A34: =A33+1 -> 31 | B34: Phil Campos | C34: 637 | D34: 11 | E34: =(C34/D34) -> 57.909090909090907 | F34: =ROUNDDOWN(((E34-50)*0.8),0) -> 6 | G34: 60 | I34: 5.5
A35: =A34+1 -> 32 | B35: Matt Shannon | C35: 640 | D35: 11 | E35: =(C35/D35) -> 58.18181818181818 | F35: =ROUNDDOWN(((E35-50)*0.8),0) -> 6 | G35: 55 | H35: 1 | I35: 5
A36: =A35+1 -> 33 | B36: Avg. Joe | C36: 640 | D36: 11 | E36: =(C36/D36) -> 58.18181818181818 | F36: =ROUNDDOWN(((E36-50)*0.8),0) -> 6 | G36: 58 | I36: 6
A37: =A36+1 -> 34 | B37: Kirby Callahan | C37: 642 | D37: 11 | E37: =(C37/D37) -> 58.363636363636367 | F37: =ROUNDDOWN(((E37-50)*0.8),0) -> 6 | G37: 55 | H37: 1 | I37: 5.5
A38: =A37+1 -> 35 | B38: Ryan Eggleston | C38: 644 | D38: 11 | E38: =(C38/D38) -> 58.545454545454547 | F38: =ROUNDDOWN(((E38-50)*0.8),0) -> 6 | G38: 53 | H38: 1 | I38: 7.5
A39: =A38+1 -> 36 | B39: Frog | C39: 235 | D39: 4 | E39: =(C39/D39) -> 58.750 | F39: =ROUNDDOWN(((E39-50)*0.8),0) -> 7 | G39: 0 | I39: 5 | J39: 0
A40: =A39+1 -> 37 | B40: David McCuskey | C40: 588 | D40: 10 | E40: =(C40/D40) -> 58.800 | F40: =ROUNDDOWN(((E40-50)*0.8),0) -> 7 | G40: 50 | H40: 1 | I40: 7.5
A41: =A40+1 -> 38 | B41: Wyckoff | C41: 591 | D41: 10 | E41: =(C41/D41) -> 59.100 | F41: =ROUNDDOWN(((E41-50)*0.8),0) -> 7 | G41: 55 | H41: 1 | I41: 5
A42: =A41+1 -> 39 | B42: John Williams | C42: 657 | D42: 11 | E42: =(C42/D42) -> 59.727272727272727 | F42: =ROUNDDOWN(((E42-50)*0.8),0) -> 7 | G42: 58 | H42: 1 | I42: 4.5
A43: =A42+1 -> 40 | B43: Adam Henderson | C43: 659 | D43: 11 | E43: =(C43/D43) -> 59.909090909090907 | F43: =ROUNDDOWN(((E43-50)*0.8),0) -> 7 | G43: 58 | I43: 6
A44: =A43+1 -> 41 | B44: Justin Zehr | C44: 545 | D44: 9 | E44: =(C44/D44) -> 60.555555555555557 | F44: =ROUNDDOWN(((E44-50)*0.8),0) -> 8 | G44: 58 | I44: 3
A45: =A44+1 -> 42 | B45: Archie Coulter | C45: 671 | D45: 11 | E45: =(C45/D45) -> 61.000 | F45: =ROUNDDOWN(((E45-50)*0.8),0) -> 8 | G45: 59 | I45: 5.5
A46: =A45+1 -> 43 | B46: Shane Thirtyacre | C46: 674 | D46: 11 | E46: =(C46/D46) -> 61.272727272727273 | F46: =ROUNDDOWN(((E46-50)*0.8),0) -> 9 | G46: 58 | H46: 1 | I46: 5.5
A47: =A46+1 -> 44 | B47: Erik Smith | C47: 616 | D47: 10 | E47: =(C47/D47) -> 61.600 | F47: =ROUNDDOWN(((E47-50)*0.8),0) -> 9 | G47: 0 | I47: 2
A48: =A47+1 -> 45 | B48: D. Burns | C48: 680 | D48: 11 | E48: =(C48/D48) -> 61.81818181818182 | F48: =ROUNDDOWN(((E48-50)*0.8),0) -> 9 | G48: 57 | H48: 1 | I48: 5.5
A49: =A48+1 -> 46 | B49: Maker | C49: 686 | D49: 11 | E49: =(C49/D49) -> 62.363636363636367 | F49: =ROUNDDOWN(((E49-50)*0.8),0) -> 9 | G49: 62 | I49: 3
A50: =A49+1 -> 47 | B50: Tom Pepper | C50: 690 | D50: 11 | E50: =(C50/D50) -> 62.727272727272727 | F50: =ROUNDDOWN(((E50-50)*0.8),0) -> 10 | G50: 62 | H50: 1 | I50: 4.5
A51: =A50+1 -> 48 | B51: Spencer Eubanks | C51: 631 | D51: 10 | E51: =(C51/D51) -> 63.100 | F51: =ROUNDDOWN(((E51-50)*0.8),0) -> 10 | G51: 61 | H51: 1 | I51: 5
A52: =A51+1 -> 49 | B52: Shawn Hullinger | C52: 709 | D52: 11 | E52: =(C52/D52) -> 64.454545454545453 | F52: =ROUNDDOWN(((E52-50)*0.8),0) -> 11 | G52: 62 | I52: 6.5
A53: =A52+1 -> 50 | B53: Sarah Potter | C53: 748 | D53: 11 | E53: =(C53/D53) -> 68.000 | F53: =ROUNDDOWN(((E53-50)*0.8),0) -> 14 | G53: 68 | I53: 6
A54: =A53+1 -> 51 | B54: Chad Goodwin | C54: 556 | D54: 8 | E54: =(C54/D54) -> 69.500 | F54: =ROUNDDOWN(((E54-50)*0.8),0) -> 15 | G54: 67 | I54: 3
A55: =A54+1 -> 52 | B55: M. Lerch | C55: 799 | D55: 11 | E55: =(C55/D55) -> 72.63636363636364 | F55: =ROUNDDOWN(((E55-50)*0.8),0) -> 18 | G55: 71 | I55: 2
A57: Subs | B57: Player | C57: Total Strokes | D57: Weeks | E57: Average | F57: H-Cap | G57: Last | H57: Week Pt. | I57: Total Pts. | J57: Subed For
A58: 1 | B58: Ian Jacobs | C58: 646 | D58: 11 | E58: =(C58/D58) -> 58.727272727272727 | F58: =ROUNDDOWN(((E58-50)*0.8),0) -> 6 | G58: 59 | H58: 0 | I58: 0 | J58: Farns
A59: 2 | B59: Ben Sandell | C59: 395 | D59: 6 | E59: =SUM(C59/D59) -> 65.833333333333329 | F59: =ROUNDDOWN(((E59-50)*0.8),0) -> 12 | I59: 1
A60: 3 | B60: AO | C60: 196 | D60: 4 | E60: =SUM(C60/D60) -> 49.000 | F60: =ROUNDDOWN(((E60-50)*0.8),0) -> 0 | I60: 2
A61: 4 | B61: Stibal | C61: 175 | D61: 3 | E61: =SUM(C61/D61) -> 58.333333333333336 | F61: =ROUNDDOWN(((E61-50)*0.8),0) -> 6 | I61: 1
A62: 5 | B62: Chuck | C62: 165 | D62: 3 | E62: =SUM(C62/D62) -> 55.000 | F62: =ROUNDDOWN(((E62-50)*0.8),0) -> 4 | G62: 53 | H62: 0 | I62: 1.5 | J62: Frog
A63: 6 | B63: Dan Lewis | C63: 117 | D63: 2 | E63: =SUM(C63/D63) -> 58.500 | F63: =ROUNDDOWN(((E63-50)*0.8),0) -> 6 | I63: 0
A64: 8 | B64: Nate ? | C64: 62 | D64: 1 | E64: =SUM(C64/D64) -> 62.000 | F64: NA | I64: 0
A65: 9 | B65: Nate ? | C65: 57 | D65: 1 | E65: =SUM(C65/D65) -> 57.000 | F65: NA | I65: 0
A66: 10 | B66: Timmy | C66: 59 | D66: 1 | E66: =SUM(C66/D66) -> 59.000 | F66: NA | I66: 0
A67: 11 | B67: Rory | C67: 168 | D67: 3 | E67: =SUM(C67/D67) -> 56.000 | F67: =ROUNDDOWN(((E67-50)*0.8),0) -> 4 | I67: 0
A68: 12 | B68: Bob Hernandez | C68: 56 | D68: 1 | E68: =SUM(C68/D68) -> 56.000 | F68: NA | I68: 0
A69: 13 | B69: Rob Mumma | C69: 57 | D69: 1 | E69: =SUM(C69/D69) -> 57.000 | F69: NA | I69: 0
A70: 14 | B70: Dev Nelson | C70: 115 | D70: 2 | E70: =SUM(C70/D70) -> 57.500 | F70: =ROUNDDOWN(((E70-50)*0.8),0) -> 6 | I70: 1
A71: 15 | B71: Greg Friestad | C71: 59 | D71: 1 | E71: =SUM(C71/D71) -> 59.000 | F71: NA | I71: 1
A72: 16 | B72: Steve Adkinson | C72: 65 | D72: 1 | E72: =SUM(C72/D72) -> 65.000 | F72: NA | I72: 0
A73: 17 | B73: Prouty | C73: 71 | D73: 1 | E73: =SUM(C73/D73) -> 71.000 | F73: NA | I73: 0
A74: 18 | B74: Tony Rios | C74: 120 | D74: 2 | E74: =SUM(C74/D74) -> 60.000 | F74: NA | G74: 53 | H74: NA | I74: 0 | J74: NA
A75: 19 | B75: McCarley | C75: 65 | D75: 1 | E75: =SUM(C75/D75) -> 65.000 | F75: NA | I75: 0
A76: 20 | B76: Brent | C76: 62 | D76: 1 | E76: =SUM(C76/D76) -> 62.000 | F76: NA | I76: 0
A77: 21 | B77: Crager | C77: 60 | D77: 1 | E77: =SUM(C77/D77) -> 60.000 | F77: NA | G77: 60 | H77: NA | I77: 0 | J77: NA
A78: 22 | C78: 0 | D78: 1 | E78: =SUM(C78/D78) -> 0.000 | F78: =ROUNDDOWN(((E78-50)*0.8),0) -> -40
A79: 23 | C79: 0 | D79: 1 | E79: =SUM(C79/D79) -> 0.000 | F79: =ROUNDDOWN(((E79-50)*0.8),0) -> -40
A80: 24 | C80: 0 | D80: 1 | E80: =SUM(C80/D80) -> 0.000 | F80: =ROUNDDOWN(((E80-50)*0.8),0) -> -40
A81: 25 | C81: 0 | D81: 1 | E81: =SUM(C81/D81) -> 0.000 | F81: =ROUNDDOWN(((E81-50)*0.8),0) -> -40
A82: 26 | C82: 0 | D82: 1 | E82: =SUM(C82/D82) -> 0.000 | F82: =ROUNDDOWN(((E82-50)*0.8),0) -> -40
A83: 27 | C83: 0 | D83: 1 | E83: =SUM(C83/D83) -> 0.000 | F83: =ROUNDDOWN(((E83-50)*0.8),0) -> -40
A84: 28 | C84: 0 | D84: 1 | E84: =SUM(C84/D84) -> 0.000 | F84: =ROUNDDOWN(((E84-50)*0.8),0) -> -40
A86: 2012 SBDGL Team Standing
B87: TEAM # | C87: BUSH | E87: Total Points | F87: Team Points | G87: Team Avg | H87: Week Total | I87: Week Team
A88: 1 | B88: 11 | C88: Tim Potter + Andrew Greco | E88: 22.5 | F88: 7.5 | G88: =AVERAGE(E7,E13) -> 52.772727272727273 | H88: 1.5 | I88: 0.5
A89: 2 | B89: 6 | C89: Hullinger + Jesse Streinz | E89: 22.5 | F89: 6.5 | G89: =AVERAGE(E51,E18) -> 59.050 | H89: 1.5 | I89: 0.5
A90: 3 | B90: 4 | C90: KVN + Archie C. | E90: 20.5 | F90: 7 | G90: =AVERAGE(E11,E47) -> 57.663636363636364 | H90: 1 | I90: 0
A91: 4 | B91: 2 | C91: Travis Pike + Kollin Grimm | E91: 19.5 | F91: 7 | G91: =AVERAGE(E16,E30) -> 56.090909090909093 | H91: 0 | I91: 0
A92: 5 | B92: 7 | C92: Doug Johnson + Shane Thirtyacre | E92: 19 | F92: 8 | G92: =AVERAGE(E46,E11) -> 57.500 | H92: 3 | I92: 1
A93: 6 | B93: 9 | C93: John Williams + Kirby Callahan | E93: 16.5 | F93: 6.5 | G93: =AVERAGE(E36,E41) -> 58.640909090909091 | H93: 3 | I93: 1
A94: 7 | B94: 3 | C94: Adam Stiers + Wyckoff | E94: 15.5 | F94: 4 | G94: =AVERAGE(E19,E39) -> 56.965909090909093 | H94: 1 | I94: 0
A95: 8 | B95: 8 | C95: Sarah Potter + Adam Henderson | E95: 15 | F95: 3 | G95: =AVERAGE(E55,E45) -> 66.818181818181813 | H95: 0 | I95: 0
A96: 9 | B96: 10 | C96: Tom Pepper + Travis Fruendt | E96: 14 | F96: 4.5 | G96: =AVERAGE(E49,E25) -> 59.227272727272734 | H96: 2.5 | I96: 1
A97: 10 | B97: 5 | C97: Shirtless + Dustin Utley | E97: 13 | F97: 3.5 | G97: =AVERAGE(E31,E24) -> 56.900 | H97: 1 | I97: 0
A98: 11 | B98: 1 | C98: Woody + Adam Miller | E98: 12 | F98: 4 | G98: =AVERAGE(E17,E20) -> 55.090909090909093 | H98: 0 | I98: 0
A99: 12 | B99: 13 | C99: Perry Thirtyacre + Justin Zehr | E99: 10 | F99: 3.5 | G99: =AVERAGE(E43,E30) -> 58.727272727272727 | H99: 0 | I99: 0
A100: 13 | B100: 12 | C100: Joshua Beachy + Dustin Nohr | E100: 9.5 | F100: 3 | G100: =AVERAGE(E25,E34) -> 57.000 | H100: 1 | I100: 0
C102: WHACKER
A103: 1 | B103: 25 | C103: Doug Peyton + Chris Clime | E103: 28 | F103: 10 | G103: =AVERAGE(E5,E15) -> 52.227272727272727 | H103: 3 | I103: 1
A104: 2 | B104: 20 | C104: Matt Fritz + Egglesten | E104: 23 | F104: 8 | G104: =AVERAGE(E31,E37) -> 58.081818181818178 | H104: 2 | I104: 1
A105: 3 | B105: 18 | C105: Dan Kern + Jeremy Farnsworth | E105: 22.5 | F105: 8.5 | G105: =AVERAGE(E5,E8) -> 51.090909090909093 | H105: 1.5 | I105: 0.5
A106: 4 | B106: 21 | C106: Super Dave + Tim Peyton | E106: 19 | F106: 6.5 | G106: =AVERAGE(E40,E6) -> 54.854545454545452 | H106: 2 | I106: 1
A107: 5 | B107: 24 | C107: Ryan Hamilton + D. Burns | E107: 17.5 | F107: 5 | G107: =AVERAGE(E25,E48) -> 58.954545454545453 | H107: 3 | I107: 1
A108: 6 | B108: 14 | C108: Average Joe + Jason Rimrodt | E108: 17 | F108: 6 | G108: =AVERAGE(E12,E36) -> 56.045454545454547 | H108: 1.5 | I108: 0.5
A109: 7 | B109: 23 | C109: Matt Wieben + Matt Shannon | E109: 16 | F109: 5 | G109: =AVERAGE(E9,E31) -> 55.218181818181819 | H109: 3 | I109: 1
A110: 8 | B110: 17 | C110: Marty Reis + Spencer Eubanks | E110: 15.5 | F110: 5 | G110: =AVERAGE(E50,E26) -> 59.61363636363636 | H110: 3 | I110: 1
A111: 9 | B111: 22 | C111: Kurt Conrad + Chad Goodwin | E111: 14.5 | F111: 5 | G111: =AVERAGE(E11,E55) -> 63.181818181818187 | H111: 2 | I111: 1
A112: 10 | B112: 26 | C112: Joel Knutson + Rob Neubrand | E112: 14.5 | F112: 5 | G112: =AVERAGE(E31,E21) -> 56.650 | H112: 2 | I112: 1
A113: 11 | B113: 15 | C113: Campos + Nathan Veeder | E113: 13 | F113: 3.5 | G113: =AVERAGE(E35,E24) -> 57.090909090909093 | H113: 0.5 | I113: 0
A114: 12 | B114: 19 | C114: Matt Geers + M. Lerch | E114: 10.5 | F114: 4 | G114: =AVERAGE(E54,E38) -> 64.02272727272728 | H114: 0 | I114: 0
A115: 13 | B115: 16 | C115: Jerimie Maker + Smith | E115: 8.5 | F115: 3.5 | G115: =AVERAGE(E50,E48) -> 62.272727272727273 | H115: 0 | I115: 0