A1: 2011 S.B.D.G.L. STANDINGS Through Week 3 Legion
A2: Rank | B2: Player | C2: Total Strokes | D2: Weeks | E2: Average | F2: H-Cap | G2: Last | H2: Week Pt. | I2: Total Pts. | J2: Sub Pts.
A4: =A3+1 -> 1 | B4: Jeremy Farnsworth | C4: 140 | D4: 3 | E4: =(C4/D4) -> 46.666666666666664 | F4: 0 | G4: 44 | H4: 1 | I4: 2 | K4: =SUM(H4:H55) -> 26
A5: =A4+1 -> 2 | B5: Doug Peyton | C5: 143 | D5: 3 | E5: =(C5/D5) -> 47.666666666666664 | F5: 0 | G5: 48 | H5: 0.5 | I5: 1 | K5: =SUM(I4:I55) -> 78
A6: =A5+1 -> 3 | B6: Tim Peyton | C6: 145 | D6: 3 | E6: =(C6/D6) -> 48.333333333333336 | F6: 0 | G6: 48 | H6: 0.5 | I6: 1.5
A7: =A6+1 -> 4 | B7: Dan Kern | C7: 146 | D7: 3 | E7: =(C7/D7) -> 48.666666666666664 | F7: 0 | G7: 47 | H7: 1 | I7: 2
A8: =A7+1 -> 5 | B8: Greco | C8: 147 | D8: 3 | E8: =(C8/D8) -> 49.000 | F8: =ROUNDDOWN(((E8-50)*0.8),0) -> 0 | G8: 52 | H8: 0 | I8: 1
A9: =A8+1 -> 6 | B9: Kurt Conrad | C9: 149 | D9: 3 | E9: =(C9/D9) -> 49.666666666666664 | F9: =ROUNDDOWN(((E9-50)*0.8),0) -> 0 | G9: 54 | H9: 0 | I9: 2
A10: =A9+1 -> 7 | B10: KVN Lavley | C10: 150 | D10: 3 | E10: =(C10/D10) -> 50.000 | F10: =ROUNDDOWN(((E10-50)*0.8),0) -> 0 | G10: 49 | H10: 1 | I10: 2.5
A11: =A10+1 -> 8 | B11: Nate Veeder | C11: 151 | D11: 3 | E11: =(C11/D11) -> 50.333333333333336 | F11: =ROUNDDOWN(((E11-50)*0.8),0) -> 0 | G11: 50 | H11: 1 | I11: 2.5
A12: =A11+1 -> 9 | B12: Beachy | C12: 151 | D12: 3 | E12: =(C12/D12) -> 50.333333333333336 | F12: =ROUNDDOWN(((E12-50)*0.8),0) -> 0 | G12: 53 | H12: 0 | I12: 1
A13: =A12+1 -> 10 | B13: Utley | C13: 152 | D13: 3 | E13: =(C13/D13) -> 50.666666666666664 | F13: =ROUNDDOWN(((E13-50)*0.8),0) -> 0 | G13: 48 | H13: 1 | I13: 2
A14: =A13+1 -> 11 | B14: Woody | C14: 152 | D14: 3 | E14: =(C14/D14) -> 50.666666666666664 | F14: =ROUNDDOWN(((E14-50)*0.8),0) -> 0 | G14: 50 | H14: 1 | I14: 2
A15: =A14+1 -> 12 | B15: Doug Johnson | C15: 152 | D15: 3 | E15: =(C15/D15) -> 50.666666666666664 | F15: =ROUNDDOWN(((E15-50)*0.8),0) -> 0 | G15: 53 | H15: 1 | I15: 2
A16: =A15+1 -> 13 | B16: Tim Potter | C16: 154 | D16: 3 | E16: =(C16/D16) -> 51.333333333333336 | F16: =ROUNDDOWN(((E16-50)*0.8),0) -> 1 | G16: 52 | H16: 0.5 | I16: 2.5
A17: =A16+1 -> 14 | B17: Chris Clime | C17: 155 | D17: 3 | E17: =(C17/D17) -> 51.666666666666664 | F17: =ROUNDDOWN(((E17-50)*0.8),0) -> 1 | G17: 52 | H17: 1 | I17: 3
A18: =A17+1 -> 15 | B18: Kollin Grimm | C18: 155 | D18: 3 | E18: =(C18/D18) -> 51.666666666666664 | F18: =ROUNDDOWN(((E18-50)*0.8),0) -> 1 | G18: 56 | H18: 0 | I18: 1.5
A19: =A18+1 -> 16 | B19: Jesse Streinz | C19: 156 | D19: 3 | E19: =(C19/D19) -> 52.000 | F19: =ROUNDDOWN(((E19-50)*0.8),0) -> 1 | G19: 53 | H19: 1 | I19: 3
A20: =A19+1 -> 17 | B20: Travis Pike | C20: 156 | D20: 3 | E20: =(C20/D20) -> 52.000 | F20: =ROUNDDOWN(((E20-50)*0.8),0) -> 1 | G20: 56 | H20: 0 | I20: 2
A21: =A20+1 -> 18 | B21: Rob Neubrand | C21: 157 | D21: 3 | E21: =(C21/D21) -> 52.333333333333336 | F21: =ROUNDDOWN(((E21-50)*0.8),0) -> 1 | G21: 53 | H21: 1 | I21: 1
A22: =A21+1 -> 19 | B22: Adam Miller | C22: 157 | D22: 3 | E22: =(C22/D22) -> 52.333333333333336 | F22: =ROUNDDOWN(((E22-50)*0.8),0) -> 1 | G22: 56 | H22: 0 | I22: 1.5
A23: =A22+1 -> 20 | B23: Matt Wieben | C23: 159 | D23: 3 | E23: =(C23/D23) -> 53.000 | F23: =ROUNDDOWN(((E23-50)*0.8),0) -> 2 | G23: 55 | H23: 0 | I23: 0
A24: =A23+1 -> 21 | B24: Stiers | C24: 159 | D24: 3 | E24: =(C24/D24) -> 53.000 | F24: =ROUNDDOWN(((E24-50)*0.8),0) -> 2 | G24: 56 | H24: 0 | I24: 1
A25: =A24+1 -> 22 | B25: Rimmy | C25: 159 | D25: 3 | E25: =(C25/D25) -> 53.000 | F25: =ROUNDDOWN(((E25-50)*0.8),0) -> 2 | G25: 56 | H25: 0 | I25: 1
A26: =A25+1 -> 23 | B26: Wyckoff | C26: 159 | D26: 3 | E26: =(C26/D26) -> 53.000 | F26: =ROUNDDOWN(((E26-50)*0.8),0) -> 2 | G26: 57 | H26: 0 | I26: 1
A27: =A26+1 -> 24 | B27: Ryan Hamilton | C27: 160 | D27: 3 | E27: =(C27/D27) -> 53.333333333333336 | F27: =ROUNDDOWN(((E27-50)*0.8),0) -> 2 | G27: 53 | H27: 1 | I27: 2.5
A28: =A27+1 -> 25 | B28: Kirby Callahan | C28: 161 | D28: 3 | E28: =(C28/D28) -> 53.666666666666664 | F28: =ROUNDDOWN(((E28-50)*0.8),0) -> 2 | G28: 53 | H28: 1 | I28: 2
A29: =A28+1 -> 26 | B29: Martin Reis | C29: 161 | D29: 3 | E29: =(C29/D29) -> 53.666666666666664 | F29: =ROUNDDOWN(((E29-50)*0.8),0) -> 2 | G29: 58 | H29: 0 | I29: 2
A30: =A29+1 -> 27 | B30: Travis Fruendt | C30: 162 | D30: 3 | E30: =(C30/D30) -> 54.000 | F30: =ROUNDDOWN(((E30-50)*0.8),0) -> 3 | G30: 54 | H30: 1 | I30: 1
A31: =A30+1 -> 28 | B31: Shirtless Bill | C31: 162 | D31: 3 | E31: =(C31/D31) -> 54.000 | F31: =ROUNDDOWN(((E31-50)*0.8),0) -> 3 | G31: 56 | H31: 0 | I31: 1
A32: =A31+1 -> 29 | B32: Dustin Nohr | C32: 162 | D32: 3 | E32: =(C32/D32) -> 54.000 | F32: =ROUNDDOWN(((E32-50)*0.8),0) -> 3 | G32: 57 | H32: 0 | I32: 1
A33: =A32+1 -> 30 | B33: Frog | C33: 109 | D33: 2 | E33: =(C33/D33) -> 54.500 | F33: =ROUNDDOWN(((E33-50)*0.8),0) -> 3 | G33: 0 | H33: 0 | I33: 1.5 | J33: 1
A34: =A33+1 -> 31 | B34: Joel Knutson | C34: 165 | D34: 3 | E34: =(C34/D34) -> 55.000 | F34: =ROUNDDOWN(((E34-50)*0.8),0) -> 4 | G34: 57 | H34: 1 | I34: 1
A35: =A34+1 -> 32 | B35: Perry Thirtyacre | C35: 166 | D35: 3 | E35: =(C35/D35) -> 55.333333333333336 | F35: =ROUNDDOWN(((E35-50)*0.8),0) -> 4 | G35: 60 | H35: 0 | I35: 0.5
A36: =A35+1 -> 33 | B36: Matt Fritz | C36: 167 | D36: 3 | E36: =(C36/D36) -> 55.666666666666664 | F36: =ROUNDDOWN(((E36-50)*0.8),0) -> 4 | G36: 57 | H36: 1 | I36: 3
A37: =A36+1 -> 34 | B37: Ryan Eggleston | C37: 167 | D37: 3 | E37: =(C37/D37) -> 55.666666666666664 | F37: =ROUNDDOWN(((E37-50)*0.8),0) -> 4 | G37: 59 | H37: 0 | I37: 2
A38: =A37+1 -> 35 | B38: Justin Zehr | C38: 167 | D38: 3 | E38: =(C38/D38) -> 55.666666666666664 | F38: =ROUNDDOWN(((E38-50)*0.8),0) -> 4 | G38: 60 | H38: 0 | I38: 1
A39: =A38+1 -> 36 | B39: Avg. Joe | C39: 168 | D39: 3 | E39: =(C39/D39) -> 56.000 | F39: =ROUNDDOWN(((E39-50)*0.8),0) -> 4 | G39: 54 | H39: 0 | I39: 1
A40: =A39+1 -> 37 | B40: D. Burns | C40: 169 | D40: 3 | E40: =(C40/D40) -> 56.333333333333336 | F40: =ROUNDDOWN(((E40-50)*0.8),0) -> 5 | G40: 58 | H40: 1 | I40: 3
A41: =A40+1 -> 38 | B41: David McCuskey | C41: 113 | D41: 2 | E41: =(C41/D41) -> 56.500 | F41: =ROUNDDOWN(((E41-50)*0.8),0) -> 5 | G41: 0 | H41: 0 | I41: 1.5
A42: =A41+1 -> 39 | B42: Matt Shannon | C42: 170 | D42: 3 | E42: =(C42/D42) -> 56.666666666666664 | F42: =ROUNDDOWN(((E42-50)*0.8),0) -> 5 | G42: 59 | H42: 1 | I42: 1
A43: =A42+1 -> 40 | B43: Erik Smith | C43: 171 | D43: 3 | E43: =(C43/D43) -> 57.000 | F43: =ROUNDDOWN(((E43-50)*0.8),0) -> 5 | G43: 59 | H43: 0 | I43: 0
A44: =A43+1 -> 41 | B44: Phil Campos | C44: 172 | D44: 3 | E44: =(C44/D44) -> 57.333333333333336 | F44: =ROUNDDOWN(((E44-50)*0.8),0) -> 5 | G44: 56 | H44: 1 | I44: 2
A45: =A44+1 -> 42 | B45: John Williams | C45: 173 | D45: 3 | E45: =(C45/D45) -> 57.666666666666664 | F45: =ROUNDDOWN(((E45-50)*0.8),0) -> 6 | G45: 58 | H45: 0.5 | I45: 0.5
A46: =A45+1 -> 43 | B46: Adam Henderson | C46: 174 | D46: 3 | E46: =(C46/D46) -> 58.000 | F46: =ROUNDDOWN(((E46-50)*0.8),0) -> 6 | G46: 58 | H46: 1 | I46: 2
A47: =A46+1 -> 44 | B47: Spencer Eubanks | C47: 176 | D47: 3 | E47: =(C47/D47) -> 58.666666666666664 | F47: =ROUNDDOWN(((E47-50)*0.8),0) -> 6 | G47: 60 | H47: 0 | I47: 1
A48: =A47+1 -> 45 | B48: Maker | C48: 177 | D48: 3 | E48: =(C48/D48) -> 59.000 | F48: =ROUNDDOWN(((E48-50)*0.8),0) -> 7 | G48: 59 | H48: 1 | I48: 1
A49: =A48+1 -> 46 | B49: Shane Thirtyacre | C49: 181 | D49: 3 | E49: =(C49/D49) -> 60.333333333333336 | F49: =ROUNDDOWN(((E49-50)*0.8),0) -> 8 | G49: 61 | H49: 1 | I49: 1.5
A50: =A49+1 -> 47 | B50: Archie Coulter | C50: 183 | D50: 3 | E50: =(C50/D50) -> 61.000 | F50: =ROUNDDOWN(((E50-50)*0.8),0) -> 8 | G50: 60 | H50: 1 | I50: 1.5
A51: =A50+1 -> 48 | B51: Tom Pepper | C51: 183 | D51: 3 | E51: =(C51/D51) -> 61.000 | F51: =ROUNDDOWN(((E51-50)*0.8),0) -> 8 | G51: 64 | H51: 0 | I51: 1
A52: =A51+1 -> 49 | B52: Shawn Hullinger | C52: 186 | D52: 3 | E52: =(C52/D52) -> 62.000 | F52: =ROUNDDOWN(((E52-50)*0.8),0) -> 9 | G52: 62 | H52: 1 | I52: 1
A53: =A52+1 -> 50 | B53: Sarah Potter | C53: 191 | D53: 3 | E53: =(C53/D53) -> 63.666666666666664 | F53: =ROUNDDOWN(((E53-50)*0.8),0) -> 10 | G53: 64 | H53: 1 | I53: 2
A54: =A53+1 -> 51 | B54: M. Lerch | C54: 209 | D54: 3 | E54: =(C54/D54) -> 69.666666666666671 | F54: =ROUNDDOWN(((E54-50)*0.8),0) -> 15 | G54: 72 | H54: 0 | I54: 0
A55: =A54+1 -> 52 | B55: Chad Goodwin | C55: 209 | D55: 3 | E55: =(C55/D55) -> 69.666666666666671 | F55: =ROUNDDOWN(((E55-50)*0.8),0) -> 15 | G55: 79 | H55: 0 | I55: 0.5
A57: 2012 S.B.D.G.L STANDINGS Through Week 1
A58: Subs | B58: Player | C58: Total Strokes | D58: Weeks | E58: Average | F58: H-Cap | G58: Last | H58: Week Pt. | I58: Total Pts. | J58: Subed For
A59: 1 | B59: Ian Jacobs | C59: 169 | D59: 3 | E59: =(C59/D59) -> 56.333333333333336 | F59: =ROUNDDOWN(((E59-50)*0.8),0) -> 5 | G59: 59 | J59: NA
A60: 2 | B60: Rob Mumma | C60: 57 | D60: 1 | E60: =SUM(C60/D60) -> 57.000 | F60: =ROUNDDOWN(((E60-50)*0.8),0) -> 5 | G60: 0 | J60: NA
A61: 3 | B61: Ben Sandell | C61: 62 | D61: 1 | E61: =SUM(C61/D61) -> 62.000 | F61: =ROUNDDOWN(((E61-50)*0.8),0) -> 9 | G61: 0 | J61: NA
A62: 4 | B62: AO | C62: 46 | D62: 1 | E62: =SUM(C62/D62) -> 46.000 | F62: =ROUNDDOWN(((E62-50)*0.8),0) -> -3 | G62: 46 | J62: NA
A63: 5 | B63: Stibal | C63: 52 | D63: 1 | E63: =SUM(C63/D63) -> 52.000 | F63: =ROUNDDOWN(((E63-50)*0.8),0) -> 1 | G63: 52 | J63: FROG
A64: 6 | C64: 0 | D64: 1 | E64: =SUM(C64/D64) -> 0.000 | F64: =ROUNDDOWN(((E64-50)*0.8),0) -> -40
A65: 7 | C65: 0 | D65: 1 | E65: =SUM(C65/D65) -> 0.000 | F65: =ROUNDDOWN(((E65-50)*0.8),0) -> -40
A66: 8 | C66: 0 | D66: 1 | E66: =SUM(C66/D66) -> 0.000 | F66: =ROUNDDOWN(((E66-50)*0.8),0) -> -40
A67: 9 | C67: 0 | D67: 1 | E67: =SUM(C67/D67) -> 0.000 | F67: =ROUNDDOWN(((E67-50)*0.8),0) -> -40
A68: 10 | C68: 0 | D68: 1 | E68: =SUM(C68/D68) -> 0.000 | F68: =ROUNDDOWN(((E68-50)*0.8),0) -> -40
A69: 11 | C69: 0 | D69: 1 | E69: =SUM(C69/D69) -> 0.000 | F69: =ROUNDDOWN(((E69-50)*0.8),0) -> -40
A70: 12 | C70: 0 | D70: 1 | E70: =SUM(C70/D70) -> 0.000 | F70: =ROUNDDOWN(((E70-50)*0.8),0) -> -40
A71: 13 | C71: 0 | D71: 1 | E71: =SUM(C71/D71) -> 0.000 | F71: =ROUNDDOWN(((E71-50)*0.8),0) -> -40
A72: 14 | C72: 0 | D72: 1 | E72: =SUM(C72/D72) -> 0.000 | F72: =ROUNDDOWN(((E72-50)*0.8),0) -> -40
A73: 15 | C73: 0 | D73: 1 | E73: =SUM(C73/D73) -> 0.000 | F73: =ROUNDDOWN(((E73-50)*0.8),0) -> -40
A74: 16 | C74: 0 | D74: 1 | E74: =SUM(C74/D74) -> 0.000 | F74: =ROUNDDOWN(((E74-50)*0.8),0) -> -40
A75: 17 | C75: 0 | D75: 1 | E75: =SUM(C75/D75) -> 0.000 | F75: =ROUNDDOWN(((E75-50)*0.8),0) -> -40
A76: 18 | C76: 0 | D76: 1 | E76: =SUM(C76/D76) -> 0.000 | F76: =ROUNDDOWN(((E76-50)*0.8),0) -> -40
A77: 19 | C77: 0 | D77: 1 | E77: =SUM(C77/D77) -> 0.000 | F77: =ROUNDDOWN(((E77-50)*0.8),0) -> -40
A78: 20 | C78: 0 | D78: 1 | E78: =SUM(C78/D78) -> 0.000 | F78: =ROUNDDOWN(((E78-50)*0.8),0) -> -40
A79: 21 | C79: 0 | D79: 1 | E79: =SUM(C79/D79) -> 0.000 | F79: =ROUNDDOWN(((E79-50)*0.8),0) -> -40
A80: 22 | C80: 0 | D80: 1 | E80: =SUM(C80/D80) -> 0.000 | F80: =ROUNDDOWN(((E80-50)*0.8),0) -> -40
A81: 23 | C81: 0 | D81: 1 | E81: =SUM(C81/D81) -> 0.000 | F81: =ROUNDDOWN(((E81-50)*0.8),0) -> -40
A82: 24 | C82: 0 | D82: 1 | E82: =SUM(C82/D82) -> 0.000 | F82: =ROUNDDOWN(((E82-50)*0.8),0) -> -40
A83: 25 | C83: 0 | D83: 1 | E83: =SUM(C83/D83) -> 0.000 | F83: =ROUNDDOWN(((E83-50)*0.8),0) -> -40
A84: 26 | C84: 0 | D84: 1 | E84: =SUM(C84/D84) -> 0.000 | F84: =ROUNDDOWN(((E84-50)*0.8),0) -> -40
A85: 27 | C85: 0 | D85: 1 | E85: =SUM(C85/D85) -> 0.000 | F85: =ROUNDDOWN(((E85-50)*0.8),0) -> -40
A86: 28 | C86: 0 | D86: 1 | E86: =SUM(C86/D86) -> 0.000 | F86: =ROUNDDOWN(((E86-50)*0.8),0) -> -40
A87: 2012 SBDGL Team Standing
B88: TEAM # | C88: BUSH | E88: Total Points | F88: Team Points | G88: Team Avg
A89: 1 | B89: 6 | C89: Hullinger + Jesse Streinz | E89: 7 | F89: 2 | G89: =AVERAGE(E19:E52) -> 55.666666666666664
A90: 2 | B90: 4 | C90: KVN + Archie C. | E90: 6 | F90: 2 | G90: =AVERAGE(E50,E10) -> 55.500
A91: 3 | B91: 7 | C91: Doug Johnson + Shane Thirtyacre | E91: 5.5 | F91: 2 | G91: =AVERAGE(E49,E15) -> 55.500
A92: 4 | B92: 2 | C92: Travis Pike + Kollin Grimm | E92: 5.5 | F92: 2 | G92: =AVERAGE(E18,E20) -> 51.833333333333329
A93: 5 | B93: 11 | C93: Tim Potter + Andrew Greco | E93: 5.5 | F93: 2 | G93: =AVERAGE(E16,E8) -> 50.166666666666671
A94: 6 | B94: 8 | C94: Sarah Potter + Adam Henderson | E94: 5 | F94: 1 | G94: =AVERAGE(E53,E46) -> 60.833333333333329
A95: 7 | B95: 5 | C95: Shirtless + Dustin Utley | E95: 5 | F95: 2 | G95: =AVERAGE(E31,E13) -> 52.333333333333329
A96: 8 | B96: 9 | C96: John Williams + Kirby Callahan | E96: 4.5 | F96: 2 | G96: =AVERAGE(E45,E28) -> 55.666666666666664
A97: 9 | B97: 1 | C97: Woody + Adam Miller | E97: 4.5 | F97: 1 | G97: =AVERAGE(E14,E22) -> 51.500
A98: 10 | B98: 10 | C98: Tom Pepper + Travis Fruendt | E98: 3 | F98: 1 | G98: =AVERAGE(E51,E30) -> 57.500
A99: 11 | B99: 3 | C99: Adam Stiers + Wyckoff | E99: 3 | F99: 1 | G99: =AVERAGE(E24,E26) -> 53.000
A100: 12 | B100: 12 | C100: Joshua Beachy + Dustin Nohr | E100: 3 | F100: 1 | G100: =AVERAGE(E12,E32) -> 52.166666666666671
A101: 13 | B101: 13 | C101: Perry Thirtyacre + Justin Zehr | E101: 2.5 | F101: 1 | G101: =AVERAGE(E38,E35) -> 55.500
C103: WHACKER
A104: 1 | B104: 20 | C104: Ryan Hamilton + D. Burns | E104: 8.5 | F104: 3 | G104: =AVERAGE(E40,E27) -> 54.833333333333336
A105: 2 | B105: 24 | C105: Matt Fritz + Egglesten | E105: 7 | F105: 2 | G105: =AVERAGE(E37,E36) -> 55.666666666666664
A106: 3 | B106: 17 | C106: Dan Kern + Jeremy Farnsworth | E106: 7 | F106: 3 | G106: =AVERAGE(E7,E4) -> 47.666666666666664
A107: 4 | B107: 18 | C107: Campos + Nathan Veeder | E107: 6.5 | F107: 2 | G107: =AVERAGE(E44,E11) -> 53.833333333333336
A108: 5 | B108: 25 | C108: Doug Peyton + Chris Clime | E108: 6 | F108: 2 | G108: =AVERAGE(E5,E17) -> 49.666666666666664
A109: 6 | B109: 22 | C109: Marty Reis + Spencer Eubanks | E109: 5 | F109: 2 | G109: =AVERAGE(E47,E29) -> 56.166666666666664
A110: 7 | B110: 15 | C110: Kurt Conrad + Chad Goodwin | E110: 3.5 | F110: 1 | G110: =AVERAGE(E9,E55) -> 59.666666666666671
A111: 8 | B111: 14 | C111: Super Dave + Tim Peyton | E111: 3.5 | F111: 1 | G111: =AVERAGE(E41,E6) -> 52.416666666666671
A112: 9 | B112: 21 | C112: Average Joe + Jason Rimrodt | E112: 3 | F112: 1 | G112: =AVERAGE(E39,E25) -> 54.500
A113: 10 | B113: 26 | C113: Joel Knutson + Rob Neubrand | E113: 3 | F113: 1 | G113: =AVERAGE(E21,E34) -> 53.666666666666671
A114: 11 | B114: 16 | C114: Jerimie Maker + Smith | E114: 2 | F114: 1 | G114: =AVERAGE(E48,E43) -> 58.000
A115: 12 | B115: 19 | C115: Matt Geers + M. Lerch | E115: 1 | G115: =AVERAGE(E54,E33) -> 62.083333333333336
A116: 13 | B116: 23 | C116: Matt Wieben + Matt Shannon | E116: 1 | G116: =AVERAGE(E23,E42) -> 54.833333333333329
E117: =SUM(E89:E116) -> 117 | F117: =SUM(F89:F116) -> 39