A1: 2012 S.B.D.G.L. STANDINGS Through Week 12 Shaver
A2: Rank | B2: Player | C2: Total Strokes | D2: Weeks | E2: Average | F2: H-Cap | G2: Last | H2: Week Pt. | I2: Total Pts. | J2: Sub Pts.
A4: =A3+1 -> 1 | B4: Doug Peyton | C4: 600 | D4: 12 | E4: =(C4/D4) -> 50.000 | F4: =ROUNDDOWN(((E4-50)*0.8),0) -> 0 | G4: 51 | H4: 1 | I4: 8
A5: =A4+1 -> 2 | B5: Jeremy Farnsworth | C5: 505 | D5: 10 | E5: =(C5/D5) -> 50.500 | F5: =ROUNDDOWN(((E5-50)*0.8),0) -> 0 | G5: 56 | I5: 7
A6: =A5+1 -> 3 | B6: Tim Peyton | C6: 615 | D6: 12 | E6: =(C6/D6) -> 51.250 | F6: =ROUNDDOWN(((E6-50)*0.8),0) -> 1 | G6: 55 | H6: 1 | I6: 6.5
A7: =A6+1 -> 4 | B7: Dan Kern | C7: 619 | D7: 12 | E7: =(C7/D7) -> 51.583333333333336 | F7: =ROUNDDOWN(((E7-50)*0.8),0) -> 1 | G7: 53 | H7: 1 | I7: 7
A8: =A7+1 -> 5 | B8: Greco | C8: 629 | D8: 12 | E8: =(C8/D8) -> 52.416666666666664 | F8: =ROUNDDOWN(((E8-50)*0.8),0) -> 1 | G8: 54 | H8: 1 | I8: 7
A9: =A8+1 -> 6 | B9: KVN Lavley | C9: 633 | D9: 12 | E9: =(C9/D9) -> 52.750 | F9: =ROUNDDOWN(((E9-50)*0.8),0) -> 2 | G9: 54 | H9: 1 | I9: 9
A10: =A9+1 -> 7 | B10: Matt Wieben | C10: 647 | D10: 12 | E10: =(C10/D10) -> 53.916666666666664 | F10: =ROUNDDOWN(((E10-50)*0.8),0) -> 3 | G10: 52 | H10: 1 | I10: 7
A11: =A10+1 -> 8 | B11: Kurt Conrad | C11: 648 | D11: 12 | E11: =(C11/D11) -> 54.000 | F11: =ROUNDDOWN(((E11-50)*0.8),0) -> 3 | G11: 62 | H11: 1 | I11: 7.5
A12: =A11+1 -> 9 | B12: Rimmy | C12: 649 | D12: 12 | E12: =(C12/D12) -> 54.083333333333336 | F12: =ROUNDDOWN(((E12-50)*0.8),0) -> 3 | G12: 56 | I12: 5
A13: =A12+1 -> 10 | B13: Tim Potter | C13: 656 | D13: 12 | E13: =(C13/D13) -> 54.666666666666664 | F13: =ROUNDDOWN(((E13-50)*0.8),0) -> 3 | G13: 60 | I13: 9
A14: =A13+1 -> 11 | B14: Kollin Grimm | C14: 657 | D14: 12 | E14: =(C14/D14) -> 54.750 | F14: =ROUNDDOWN(((E14-50)*0.8),0) -> 3 | G14: 56 | H14: 1 | I14: 7.5
A15: =A14+1 -> 12 | B15: Doug Johnson | C15: 657 | D15: 12 | E15: =(C15/D15) -> 54.750 | F15: =ROUNDDOWN(((E15-50)*0.8),0) -> 3 | G15: 66 | I15: 6.5
A16: =A15+1 -> 13 | B16: Chris Clime | C16: 660 | D16: 12 | E16: =(C16/D16) -> 55.000 | F16: =ROUNDDOWN(((E16-50)*0.8),0) -> 4 | G16: 60 | H16: 1 | I16: 11
A17: =A16+1 -> 14 | B17: Rob Neubrand | C17: 662 | D17: 12 | E17: =(C17/D17) -> 55.166666666666664 | F17: =ROUNDDOWN(((E17-50)*0.8),0) -> 4 | G17: 57 | I17: 4.5
A18: =A17+1 -> 15 | B18: Woody | C18: 662 | D18: 12 | E18: =(C18/D18) -> 55.166666666666664 | F18: =ROUNDDOWN(((E18-50)*0.8),0) -> 4 | G18: 60 | I18: 2
A19: =A18+1 -> 16 | B19: Adam Miller | C19: 669 | D19: 12 | E19: =(C19/D19) -> 55.750 | F19: =ROUNDDOWN(((E19-50)*0.8),0) -> 4 | G19: 59 | H19: 0.5 | I19: 6.5
A20: =A19+1 -> 17 | B20: Jesse Streinz | C20: 669 | D20: 12 | E20: =(C20/D20) -> 55.750 | F20: =ROUNDDOWN(((E20-50)*0.8),0) -> 4 | G20: 62 | H20: 1 | I20: 9.5
A21: =A20+1 -> 18 | B21: Stiers | C21: 614 | D21: 11 | E21: =(C21/D21) -> 55.81818181818182 | F21: =ROUNDDOWN(((E21-50)*0.8),0) -> 4 | G21: 59 | I21: 7.5
A22: =A21+1 -> 19 | B22: Beachy | C22: 671 | D22: 12 | E22: =(C22/D22) -> 55.916666666666664 | F22: =ROUNDDOWN(((E22-50)*0.8),0) -> 4 | G22: 55 | H22: 1 | I22: 3
A23: =A22+1 -> 20 | B23: Utley | C23: 672 | D23: 12 | E23: =(C23/D23) -> 56.000 | F23: =ROUNDDOWN(((E23-50)*0.8),0) -> 4 | G23: 57 | H23: 1 | I23: 6
A24: =A23+1 -> 21 | B24: Ryan Hamilton | C24: 673 | D24: 12 | E24: =(C24/D24) -> 56.083333333333336 | F24: =ROUNDDOWN(((E24-50)*0.8),0) -> 4 | G24: 56 | H24: 1 | I24: 8
A25: =A24+1 -> 22 | B25: Travis Fruendt | C25: 623 | D25: 11 | E25: =(C25/D25) -> 56.636363636363633 | F25: =ROUNDDOWN(((E25-50)*0.8),0) -> 5 | G25: 58 | H25: 1 | I25: 6
A26: =A25+1 -> 23 | B26: Nate Veeder | C26: 623 | D26: 11 | E26: =(C26/D26) -> 56.636363636363633 | F26: =ROUNDDOWN(((E26-50)*0.8),0) -> 5 | G26: 63 | I26: 4
A27: =A26+1 -> 24 | B27: Joel Knutson | C27: 683 | D27: 12 | E27: =(C27/D27) -> 56.916666666666664 | F27: =ROUNDDOWN(((E27-50)*0.8),0) -> 5 | G27: 57 | H27: 1 | I27: 6
A28: =A27+1 -> 25 | B28: Shirtless Bill | C28: 634 | D28: 11 | E28: =(C28/D28) -> 57.636363636363633 | F28: =ROUNDDOWN(((E28-50)*0.8),0) -> 6 | G28: 63 | I28: 4.5
A29: =A28+1 -> 26 | B29: Travis Pike | C29: 692 | D29: 12 | E29: =(C29/D29) -> 57.666666666666664 | F29: =ROUNDDOWN(((E29-50)*0.8),0) -> 6 | G29: 59 | I29: 6
A30: =A29+1 -> 27 | B30: Martin Reis | C30: 694 | D30: 12 | E30: =(C30/D30) -> 57.833333333333336 | F30: =ROUNDDOWN(((E30-50)*0.8),0) -> 6 | G30: 68 | I30: 5.5
A31: =A30+1 -> 28 | B31: Matt Fritz | C31: 696 | D31: 12 | E31: =(C31/D31) -> 58.000 | F31: =ROUNDDOWN(((E31-50)*0.8),0) -> 6 | G31: 60 | H31: 1 | I31: 8.5
A32: =A31+1 -> 29 | B32: Dustin Nohr | C32: 640 | D32: 11 | E32: =(C32/D32) -> 58.18181818181818 | F32: =ROUNDDOWN(((E32-50)*0.8),0) -> 6 | G32: 61 | H32: 0.5 | I32: 5
A33: =A32+1 -> 30 | B33: Perry Thirtyacre | C33: 641 | D33: 11 | E33: =(C33/D33) -> 58.272727272727273 | F33: =ROUNDDOWN(((E33-50)*0.8),0) -> 6 | G33: 63 | I33: 3.5
A34: =A33+1 -> 31 | B34: Ryan Eggleston | C34: 701 | D34: 12 | E34: =(C34/D34) -> 58.416666666666664 | F34: =ROUNDDOWN(((E34-50)*0.8),0) -> 6 | G34: 57 | H34: 1 | I34: 8.5
A35: =A34+1 -> 32 | B35: Matt Shannon | C35: 703 | D35: 12 | E35: =(C35/D35) -> 58.583333333333336 | F35: =ROUNDDOWN(((E35-50)*0.8),0) -> 6 | G35: 63 | I35: 5
A36: =A35+1 -> 33 | B36: Kirby Callahan | C36: 704 | D36: 12 | E36: =(C36/D36) -> 58.666666666666664 | F36: =ROUNDDOWN(((E36-50)*0.8),0) -> 6 | G36: 62 | I36: 5.5
A37: =A36+1 -> 34 | B37: David McCuskey | C37: 646 | D37: 11 | E37: =(C37/D37) -> 58.727272727272727 | F37: =ROUNDDOWN(((E37-50)*0.8),0) -> 6 | G37: 58 | H37: 1 | I37: 8.5
A38: =A37+1 -> 35 | B38: Phil Campos | C38: 705 | D38: 12 | E38: =(C38/D38) -> 58.750 | F38: =ROUNDDOWN(((E38-50)*0.8),0) -> 7 | G38: 68 | I38: 5.5
A39: =A38+1 -> 36 | B39: Avg. Joe | C39: 708 | D39: 12 | E39: =(C39/D39) -> 59.000 | F39: =ROUNDDOWN(((E39-50)*0.8),0) -> 7 | G39: 68 | I39: 6
A40: =A39+1 -> 37 | B40: John Williams | C40: 716 | D40: 12 | E40: =(C40/D40) -> 59.666666666666664 | F40: =ROUNDDOWN(((E40-50)*0.8),0) -> 7 | G40: 59 | I40: 4.5
A41: =A40+1 -> 38 | B41: Wyckoff | C41: 658 | D41: 11 | E41: =(C41/D41) -> 59.81818181818182 | F41: =ROUNDDOWN(((E41-50)*0.8),0) -> 7 | G41: 67 | I41: 5
A42: =A41+1 -> 39 | B42: Frog | C42: 300 | D42: 5 | E42: =(C42/D42) -> 60.000 | F42: =ROUNDDOWN(((E42-50)*0.8),0) -> 8 | G42: 65 | I42: 5
A43: =A42+1 -> 40 | B43: Adam Henderson | C43: 721 | D43: 12 | E43: =(C43/D43) -> 60.083333333333336 | F43: =ROUNDDOWN(((E43-50)*0.8),0) -> 8 | G43: 62 | I43: 6
A44: =A43+1 -> 41 | B44: Justin Zehr | C44: 607 | D44: 10 | E44: =(C44/D44) -> 60.700 | F44: =ROUNDDOWN(((E44-50)*0.8),0) -> 8 | G44: 62 | H44: 1 | I44: 4
A45: =A44+1 -> 42 | B45: Archie Coulter | C45: 730 | D45: 12 | E45: =(C45/D45) -> 60.833333333333336 | F45: =ROUNDDOWN(((E45-50)*0.8),0) -> 8 | G45: 59 | H45: 1 | I45: 6.5
A46: =A45+1 -> 43 | B46: Shane Thirtyacre | C46: 737 | D46: 12 | E46: =(C46/D46) -> 61.416666666666664 | F46: =ROUNDDOWN(((E46-50)*0.8),0) -> 9 | G46: 63 | H46: 1 | I46: 6.5
A47: =A46+1 -> 44 | B47: Erik Smith | C47: 680 | D47: 11 | E47: =(C47/D47) -> 61.81818181818182 | F47: =ROUNDDOWN(((E47-50)*0.8),0) -> 9 | G47: 64 | I47: 2
A48: =A47+1 -> 45 | B48: D. Burns | C48: 742 | D48: 12 | E48: =(C48/D48) -> 61.833333333333336 | F48: =ROUNDDOWN(((E48-50)*0.8),0) -> 9 | G48: 62 | I48: 5.5
A49: =A48+1 -> 46 | B49: Maker | C49: 746 | D49: 12 | E49: =(C49/D49) -> 62.166666666666664 | F49: =ROUNDDOWN(((E49-50)*0.8),0) -> 9 | G49: 60 | H49: 1 | I49: 4
A50: =A49+1 -> 47 | B50: Tom Pepper | C50: 757 | D50: 12 | E50: =(C50/D50) -> 63.083333333333336 | F50: =ROUNDDOWN(((E50-50)*0.8),0) -> 10 | G50: 67 | H50: 1 | I50: 5.5
A51: =A50+1 -> 48 | B51: Spencer Eubanks | C51: 701 | D51: 11 | E51: =(C51/D51) -> 63.727272727272727 | F51: =ROUNDDOWN(((E51-50)*0.8),0) -> 10 | G51: 70 | I51: 5
A52: =A51+1 -> 49 | B52: Shawn Hullinger | C52: 776 | D52: 12 | E52: =(C52/D52) -> 64.666666666666671 | F52: =ROUNDDOWN(((E52-50)*0.8),0) -> 11 | G52: 67 | I52: 6.5
A53: =A52+1 -> 50 | B53: Sarah Potter | C53: 814 | D53: 12 | E53: =(C53/D53) -> 67.833333333333329 | F53: =ROUNDDOWN(((E53-50)*0.8),0) -> 14 | G53: 66 | H53: 1 | I53: 7
A54: =A53+1 -> 51 | B54: Chad Goodwin | C54: 556 | D54: 8 | E54: =(C54/D54) -> 69.500 | F54: =ROUNDDOWN(((E54-50)*0.8),0) -> 15 | I54: 4 | J54: 1
A55: =A54+1 -> 52 | B55: M. Lerch | C55: 881 | D55: 12 | E55: =(C55/D55) -> 73.416666666666671 | F55: =ROUNDDOWN(((E55-50)*0.8),0) -> 18 | G55: 82 | I55: 2
A57: Subs | B57: Player | C57: Total Strokes | D57: Weeks | E57: Average | F57: H-Cap | G57: Last | H57: Week Pt. | I57: Total Pts. | J57: Subed For
A58: 1 | B58: Ian Jacobs | C58: 706 | D58: 12 | E58: =(C58/D58) -> 58.833333333333336 | F58: =ROUNDDOWN(((E58-50)*0.8),0) -> 7 | G58: 60 | H58: NA | I58: 0 | J58: NA
A59: 2 | B59: Ben Sandell | C59: 395 | D59: 6 | E59: =SUM(C59/D59) -> 65.833333333333329 | F59: =ROUNDDOWN(((E59-50)*0.8),0) -> 12 | I59: 1
A60: 3 | B60: AO | C60: 196 | D60: 4 | E60: =SUM(C60/D60) -> 49.000 | F60: =ROUNDDOWN(((E60-50)*0.8),0) -> 0 | I60: 2
A61: 4 | B61: Stibal | C61: 175 | D61: 3 | E61: =SUM(C61/D61) -> 58.333333333333336 | F61: =ROUNDDOWN(((E61-50)*0.8),0) -> 6 | I61: 1
A62: 5 | B62: Chuck | C62: 165 | D62: 3 | E62: =SUM(C62/D62) -> 55.000 | F62: =ROUNDDOWN(((E62-50)*0.8),0) -> 4 | I62: 1.5
A63: 6 | B63: Dan Lewis | C63: 180 | D63: 3 | E63: =SUM(C63/D63) -> 60.000 | F63: =ROUNDDOWN(((E63-50)*0.8),0) -> 8 | G63: 63 | H63: NA | I63: 0 | J63: NA
A64: 8 | B64: Nate ? | C64: 62 | D64: 1 | E64: =SUM(C64/D64) -> 62.000 | F64: NA | I64: 0
A65: 9 | B65: Nate ? | C65: 57 | D65: 1 | E65: =SUM(C65/D65) -> 57.000 | F65: NA | I65: 0
A66: 10 | B66: Timmy | C66: 59 | D66: 1 | E66: =SUM(C66/D66) -> 59.000 | F66: NA | I66: 0
A67: 11 | B67: Rory | C67: 168 | D67: 3 | E67: =SUM(C67/D67) -> 56.000 | F67: =ROUNDDOWN(((E67-50)*0.8),0) -> 4 | I67: 0
A68: 12 | B68: Bob Hernandez | C68: 56 | D68: 1 | E68: =SUM(C68/D68) -> 56.000 | F68: NA | I68: 0
A69: 13 | B69: Rob Mumma | C69: 120 | D69: 2 | E69: =SUM(C69/D69) -> 60.000 | F69: =ROUNDDOWN(((E69-50)*0.8),0) -> 8 | G69: 63 | H69: NA | I69: 0 | J69: NA
A70: 14 | B70: Dev Nelson | C70: 115 | D70: 2 | E70: =SUM(C70/D70) -> 57.500 | F70: =ROUNDDOWN(((E70-50)*0.8),0) -> 6 | I70: 1
A71: 15 | B71: Greg Friestad | C71: 59 | D71: 1 | E71: =SUM(C71/D71) -> 59.000 | F71: NA | I71: 1
A72: 16 | B72: Steve Adkinson | C72: 65 | D72: 1 | E72: =SUM(C72/D72) -> 65.000 | F72: NA | I72: 0
A73: 17 | B73: Prouty | C73: 71 | D73: 1 | E73: =SUM(C73/D73) -> 71.000 | F73: NA | I73: 0
A74: 18 | B74: Tony Rios | C74: 120 | D74: 2 | E74: =SUM(C74/D74) -> 60.000 | F74: =ROUNDDOWN(((E74-50)*0.8),0) -> 8 | I74: 0
A75: 19 | B75: McCarley | C75: 65 | D75: 1 | E75: =SUM(C75/D75) -> 65.000 | F75: NA | I75: 0
A76: 20 | B76: Brent | C76: 62 | D76: 1 | E76: =SUM(C76/D76) -> 62.000 | F76: NA | I76: 0
A77: 21 | B77: Crager | C77: 118 | D77: 2 | E77: =SUM(C77/D77) -> 59.000 | F77: =ROUNDDOWN(((E77-50)*0.8),0) -> 7 | G77: 58 | H77: NA | I77: 0 | J77: NA
A79: 2012 SBDGL Team Standing
B80: TEAM # | C80: BUSH | E80: Total Points | F80: Team Points | G80: Team Avg | H80: Week Total | I80: Week Team
A81: 1 | B81: 11 | C81: Tim Potter + Andrew Greco | E81: 24.5 | F81: 8.5 | G81: =AVERAGE(E8,E13) -> 53.541666666666664 | H81: 2 | I81: 1
A82: 2 | B82: 6 | C82: Hullinger + Jesse Streinz | E82: 24.5 | F82: 7.5 | G82: =AVERAGE(E52,E20) -> 60.208333333333336 | H82: 2 | I82: 1
A83: 3 | B83: 4 | C83: KVN + Archie C. | E83: 23.5 | F83: 8 | G83: =AVERAGE(E9,E45) -> 56.791666666666671 | H83: 3 | I83: 1
A84: 4 | B84: 2 | C84: Travis Pike + Kollin Grimm | E84: 21.5 | F84: 8 | G84: =AVERAGE(E14,E29) -> 56.208333333333329 | H84: 2 | I84: 1
A85: 5 | B85: 7 | C85: Doug Johnson + Shane Thirtyacre | E85: 20 | F85: 8 | G85: =AVERAGE(E46,E15) -> 58.083333333333329 | H85: 1
A86: 6 | B86: 10 | C86: Tom Pepper + Travis Fruendt | E86: 17 | F86: 5.5 | G86: =AVERAGE(E50,E25) -> 59.859848484848484 | H86: 3 | I86: 1
A87: 7 | B87: 9 | C87: John Williams + Kirby Callahan | E87: 16.5 | F87: 6.5 | G87: =AVERAGE(E40,E36) -> 59.166666666666664
A88: 8 | B88: 8 | C88: Sarah Potter + Adam Henderson | E88: 16 | F88: 3 | G88: =AVERAGE(E53,E43) -> 63.958333333333329 | H88: 1
A89: 9 | B89: 3 | C89: Adam Stiers + Wyckoff | E89: 15.5 | F89: 4 | G89: =AVERAGE(E21,E41) -> 57.81818181818182
A90: 10 | B90: 5 | C90: Shirtless + Dustin Utley | E90: 14 | F90: 3.5 | G90: =AVERAGE(E28,E23) -> 56.818181818181813 | H90: 1
A91: 11 | B91: 1 | C91: Woody + Adam Miller | E91: 12.5 | F91: 4 | G91: =AVERAGE(E18,E19) -> 55.458333333333329 | H91: 0.5
A92: 12 | B92: 12 | C92: Joshua Beachy + Dustin Nohr | E92: 12 | F92: 1 | G92: =AVERAGE(E22,E32) -> 57.049242424242422 | H92: 2.5 | I92: 1
A93: 13 | B93: 13 | C93: Perry Thirtyacre + Justin Zehr | E93: 11 | F93: 3.5 | G93: =AVERAGE(E44,E33) -> 59.486363636363635 | H93: 1
C95: WHACKER
A96: 1 | B96: 25 | C96: Doug Peyton + Chris Clime | E96: 31 | F96: 11 | G96: =AVERAGE(E4,E16) -> 52.500 | H96: 3 | I96: 1
A97: 2 | B97: 20 | C97: Matt Fritz + Egglesten | E97: 26 | F97: 9 | G97: =AVERAGE(E31,E34) -> 58.208333333333329 | H97: 3 | I97: 1
A98: 3 | B98: 18 | C98: Dan Kern + Jeremy Farnsworth | E98: 24.5 | F98: 9.5 | G98: =AVERAGE(E5,E7) -> 51.041666666666671 | H98: 2 | I98: 1
A99: 4 | B99: 21 | C99: Super Dave + Tim Peyton | E99: 22 | F99: 7.5 | G99: =AVERAGE(E37,E6) -> 54.98863636363636 | H99: 3 | I99: 1
A100: 5 | B100: 24 | C100: Ryan Hamilton + D. Burns | E100: 19 | F100: 5.5 | G100: =AVERAGE(E24,E48) -> 58.958333333333336 | H100: 1.5 | I100: 0.5
A101: 6 | B101: 22 | C101: Kurt Conrad + Chad Goodwin | E101: 17.5 | F101: 6 | G101: =AVERAGE(E11,E54) -> 61.750 | H101: 3 | I101: 1
A102: 7 | B102: 23 | C102: Matt Wieben + Matt Shannon | E102: 17.5 | F102: 5.5 | G102: =AVERAGE(E10,E35) -> 56.250 | H102: 1.5 | I102: 0.5
A103: 8 | B103: 14 | C103: Average Joe + Jason Rimrodt | E103: 17 | F103: 6 | G103: =AVERAGE(E12,E39) -> 56.541666666666671
A104: 9 | B104: 26 | C104: Joel Knutson + Rob Neubrand | E104: 16 | F104: 5.5 | G104: =AVERAGE(E27,E17) -> 56.041666666666664 | H104: 1.5 | I104: 0.5
A105: 10 | B105: 17 | C105: Marty Reis + Spencer Eubanks | E105: 15.5 | F105: 5 | G105: =AVERAGE(E51,E30) -> 60.780303030303031
A106: 11 | B106: 15 | C106: Campos + Nathan Veeder | E106: 13 | F106: 3.5 | G106: =AVERAGE(E38,E26) -> 57.693181818181813
A107: 12 | B107: 19 | C107: Matt Geers + M. Lerch | E107: 10.5 | F107: 4 | G107: =AVERAGE(E55,E42) -> 66.708333333333343
A108: 13 | B108: 16 | C108: Jerimie Maker + Smith | E108: 10 | F108: 4 | G108: =AVERAGE(E47,E49) -> 61.992424242424242 | H108: 1.5 | I108: 0.5