A1: 2012 S.B.D.G.L. STANDINGS Through Week 18 Jones
A2: Rank | B2: Player | C2: Total Strokes | D2: Weeks | E2: Average | F2: H-Cap | G2: Last | H2: Week Pt. | I2: Total Pts. | J2: Sub Pts.
A4: =A3+1 -> 1 | B4: Jeremy Farnsworth | C4: 807 | D4: 16 | E4: =(C4/D4) -> 50.4375 | F4: =ROUNDDOWN(((E4-50)*0.8),0) -> 0 | G4: 48 | I4: 10.5
A5: =A4+1 -> 2 | B5: Dan Kern | C5: 910 | D5: 18 | E5: =(C5/D5) -> 50.555555555555557 | F5: =ROUNDDOWN(((E5-50)*0.8),0) -> 0 | G5: 47 | H5: 1 | I5: 13.5
A6: =A5+1 -> 3 | B6: Doug Peyton | C6: 913 | D6: 18 | E6: =(C6/D6) -> 50.722222222222221 | F6: =ROUNDDOWN(((E6-50)*0.8),0) -> 0 | G6: 46 | H6: 1 | I6: 10.5
A7: =A6+1 -> 4 | B7: Tim Peyton | C7: 914 | D7: 18 | E7: =(C7/D7) -> 50.777777777777779 | F7: =ROUNDDOWN(((E7-50)*0.8),0) -> 0 | G7: 50 | H7: 1 | I7: 11.5
A8: =A7+1 -> 5 | B8: Greco | C8: 932 | D8: 18 | E8: =(C8/D8) -> 51.777777777777779 | F8: =ROUNDDOWN(((E8-50)*0.8),0) -> 1 | G8: 49 | H8: 1 | I8: 11
A9: =A8+1 -> 6 | B9: KVN Lavley | C9: 947 | D9: 18 | E9: =(C9/D9) -> 52.611111111111114 | F9: =ROUNDDOWN(((E9-50)*0.8),0) -> 2 | G9: 49 | H9: 1 | I9: 11
A10: =A9+1 -> 7 | B10: Matt Wieben | C10: 965 | D10: 18 | E10: =(C10/D10) -> 53.611111111111114 | F10: =ROUNDDOWN(((E10-50)*0.8),0) -> 2 | G10: 48 | H10: 1 | I10: 10.5
A11: =A10+1 -> 8 | B11: Kurt Conrad | C11: 970 | D11: 18 | E11: =(C11/D11) -> 53.888888888888886 | F11: =ROUNDDOWN(((E11-50)*0.8),0) -> 3 | G11: 57 | I11: 12
A12: =A11+1 -> 9 | B12: Kollin Grimm | C12: 972 | D12: 18 | E12: =(C12/D12) -> 54.000 | F12: =ROUNDDOWN(((E12-50)*0.8),0) -> 3 | G12: 52 | I12: 9
A13: =A12+1 -> 10 | B13: Doug Johnson | C13: 973 | D13: 18 | E13: =(C13/D13) -> 54.055555555555557 | F13: =ROUNDDOWN(((E13-50)*0.8),0) -> 3 | G13: 48 | H13: 1 | I13: 9.5
A14: =A13+1 -> 11 | B14: Adam Miller | C14: 988 | D14: 18 | E14: =(C14/D14) -> 54.888888888888886 | F14: =ROUNDDOWN(((E14-50)*0.8),0) -> 3 | G14: 52 | H14: 1 | I14: 8.5
A15: =A14+1 -> 12 | B15: Chris Clime | C15: 988 | D15: 18 | E15: =(C15/D15) -> 54.888888888888886 | F15: =ROUNDDOWN(((E15-50)*0.8),0) -> 3 | G15: 54 | I15: 13
A16: =A15+1 -> 13 | B16: Woody | C16: 989 | D16: 18 | E16: =(C16/D16) -> 54.944444444444443 | F16: =ROUNDDOWN(((E16-50)*0.8),0) -> 3 | G16: 53 | I16: 5
A17: =A16+1 -> 14 | B17: Stiers | C17: 880 | D17: 16 | E17: =(C17/D17) -> 55.000 | F17: =ROUNDDOWN(((E17-50)*0.8),0) -> 4 | G17: 54 | I17: 9.5
A18: =A17+1 -> 15 | B18: Utley | C18: 937 | D18: 17 | E18: =(C18/D18) -> 55.117647058823529 | F18: =ROUNDDOWN(((E18-50)*0.8),0) -> 4 | G18: 50 | H18: 1 | I18: 11.5
A19: =A18+1 -> 16 | B19: Beachy | C19: 997 | D19: 18 | E19: =(C19/D19) -> 55.388888888888886 | F19: =ROUNDDOWN(((E19-50)*0.8),0) -> 4 | G19: 53 | I19: 5
A20: =A19+1 -> 17 | B20: Rimmy | C20: 997 | D20: 18 | E20: =(C20/D20) -> 55.388888888888886 | F20: =ROUNDDOWN(((E20-50)*0.8),0) -> 4 | G20: 59 | I20: 6
A21: =A20+1 -> 18 | B21: Rob Neubrand | C21: 999 | D21: 18 | E21: =(C21/D21) -> 55.500 | F21: =ROUNDDOWN(((E21-50)*0.8),0) -> 4 | G21: 52 | I21: 8
A22: =A21+1 -> 19 | B22: Nate Veeder | C22: 945 | D22: 17 | E22: =(C22/D22) -> 55.588235294117645 | F22: =ROUNDDOWN(((E22-50)*0.8),0) -> 4 | G22: 49 | H22: 1 | I22: 8
A23: =A22+1 -> 20 | B23: Tim Potter | C23: 1002 | D23: 18 | E23: =(C23/D23) -> 55.666666666666664 | F23: =ROUNDDOWN(((E23-50)*0.8),0) -> 4 | G23: 52 | I23: 11
A24: =A23+1 -> 21 | B24: Jesse Streinz | C24: 1008 | D24: 18 | E24: =(C24/D24) -> 56.000 | F24: =ROUNDDOWN(((E24-50)*0.8),0) -> 4 | G24: 55 | I24: 12.5
A25: =A24+1 -> 22 | B25: Ryan Hamilton | C25: 1016 | D25: 18 | E25: =(C25/D25) -> 56.444444444444443 | F25: =ROUNDDOWN(((E25-50)*0.8),0) -> 5 | G25: 55 | I25: 9
A26: =A25+1 -> 23 | B26: Joel Knutson | C26: 1019 | D26: 18 | E26: =(C26/D26) -> 56.611111111111114 | F26: =ROUNDDOWN(((E26-50)*0.8),0) -> 5 | G26: 53 | I26: 9
A27: =A26+1 -> 24 | B27: Travis Fruendt | C27: 963 | D27: 17 | E27: =(C27/D27) -> 56.647058823529413 | F27: =ROUNDDOWN(((E27-50)*0.8),0) -> 5 | G27: 56 | I27: 8.5
A28: =A27+1 -> 25 | B28: Martin Reis | C28: 1023 | D28: 18 | E28: =(C28/D28) -> 56.833333333333336 | F28: =ROUNDDOWN(((E28-50)*0.8),0) -> 5 | G28: 57 | H28: 1 | I28: 10.5
A29: =A28+1 -> 26 | B29: Perry Thirtyacre | C29: 975 | D29: 17 | E29: =(C29/D29) -> 57.352941176470587 | F29: =ROUNDDOWN(((E29-50)*0.8),0) -> 5 | G29: 53 | H29: 1 | I29: 8
A30: =A29+1 -> 27 | B30: Shirtless Bill | C30: 975 | D30: 17 | E30: =(C30/D30) -> 57.352941176470587 | F30: =ROUNDDOWN(((E30-50)*0.8),0) -> 5 | G30: 55 | I30: 6.5
A31: =A30+1 -> 28 | B31: David McCuskey | C31: 977 | D31: 17 | E31: =(C31/D31) -> 57.470588235294116 | F31: =ROUNDDOWN(((E31-50)*0.8),0) -> 5 | G31: 50 | H31: 1 | I31: 13
A32: =A31+1 -> 29 | B32: Kirby Callahan | C32: 1035 | D32: 18 | E32: =(C32/D32) -> 57.500 | F32: =ROUNDDOWN(((E32-50)*0.8),0) -> 6 | G32: 51 | H32: 1 | I32: 8
A33: =A32+1 -> 30 | B33: Travis Pike | C33: 1037 | D33: 18 | E33: =(C33/D33) -> 57.611111111111114 | F33: =ROUNDDOWN(((E33-50)*0.8),0) -> 6 | G33: 52 | H33: 1 | I33: 9.5
A34: =A33+1 -> 31 | B34: Avg. Joe | C34: 1040 | D34: 18 | E34: =(C34/D34) -> 57.777777777777779 | F34: =ROUNDDOWN(((E34-50)*0.8),0) -> 6 | G34: 49 | H34: 1 | I34: 9.5
A35: =A34+1 -> 32 | B35: Matt Fritz | C35: 1040 | D35: 18 | E35: =(C35/D35) -> 57.777777777777779 | F35: =ROUNDDOWN(((E35-50)*0.8),0) -> 6 | G35: 51 | H35: 1 | I35: 12.5
A36: =A35+1 -> 33 | B36: Matt Shannon | C36: 1042 | D36: 18 | E36: =(C36/D36) -> 57.888888888888886 | F36: =ROUNDDOWN(((E36-50)*0.8),0) -> 6 | G36: 53 | I36: 6.5
A37: =A36+1 -> 34 | B37: Ryan Eggleston | C37: 1043 | D37: 18 | E37: =(C37/D37) -> 57.944444444444443 | F37: =ROUNDDOWN(((E37-50)*0.8),0) -> 6 | G37: 56 | I37: 11
A38: =A37+1 -> 35 | B38: Dustin Nohr | C38: 928 | D38: 16 | E38: =(C38/D38) -> 58.000 | F38: =ROUNDDOWN(((E38-50)*0.8),0) -> 6 | G38: 53 | H38: 1 | I38: 8.5
A39: =A38+1 -> 36 | B39: John Williams | C39: 990 | D39: 17 | E39: =(C39/D39) -> 58.235294117647058 | F39: =ROUNDDOWN(((E39-50)*0.8),0) -> 6 | G39: 52 | H39: 1 | I39: 8.5
A40: =A39+1 -> 37 | B40: Phil Campos | C40: 995 | D40: 17 | E40: =(C40/D40) -> 58.529411764705884 | F40: =ROUNDDOWN(((E40-50)*0.8),0) -> 6 | I40: 7.5
A41: =A40+1 -> 38 | B41: Adam Henderson | C41: 1009 | D41: 17 | E41: =(C41/D41) -> 59.352941176470587 | F41: =ROUNDDOWN(((E41-50)*0.8),0) -> 7 | G41: 54 | H41: 1 | I41: 8.5
A42: =A41+1 -> 39 | B42: Wyckoff | C42: 1009 | D42: 17 | E42: =(C42/D42) -> 59.352941176470587 | F42: =ROUNDDOWN(((E42-50)*0.8),0) -> 7 | G42: 57 | I42: 8
A43: =A42+1 -> 40 | B43: Archie Coulter | C43: 1073 | D43: 18 | E43: =(C43/D43) -> 59.611111111111114 | F43: =ROUNDDOWN(((E43-50)*0.8),0) -> 7 | G43: 55 | I43: 10
A44: =A43+1 -> 41 | B44: Frog | C44: 300 | D44: 5 | E44: =(C44/D44) -> 60.000 | F44: =ROUNDDOWN(((E44-50)*0.8),0) -> 8 | G44: IAN | I44: 6.5
A45: =A44+1 -> 42 | B45: Justin Zehr | C45: 670 | D45: 11 | E45: =(C45/D45) -> 60.909090909090907 | F45: =ROUNDDOWN(((E45-50)*0.8),0) -> 8 | I45: 6
A46: =A45+1 -> 43 | B46: Erik Smith | C46: 1041 | D46: 17 | E46: =(C46/D46) -> 61.235294117647058 | F46: =ROUNDDOWN(((E46-50)*0.8),0) -> 8 | G46: 57 | H46: 1 | I46: 4.5
A47: =A46+1 -> 44 | B47: Shane Thirtyacre | C47: 1108 | D47: 18 | E47: =(C47/D47) -> 61.555555555555557 | F47: =ROUNDDOWN(((E47-50)*0.8),0) -> 9 | G47: 56 | H47: 1 | I47: 9.5
A48: =A47+1 -> 45 | B48: D. Burns | C48: 1054 | D48: 17 | E48: =(C48/D48) -> 62.000 | F48: =ROUNDDOWN(((E48-50)*0.8),0) -> 9 | G48: 65 | I48: 6.5
A49: =A48+1 -> 46 | B49: Maker | C49: 807 | D49: 13 | E49: =(C49/D49) -> 62.07692307692308 | F49: =ROUNDDOWN(((E49-50)*0.8),0) -> 9 | I49: 5
A50: =A49+1 -> 47 | B50: Tom Pepper | C50: 1121 | D50: 18 | E50: =(C50/D50) -> 62.277777777777779 | F50: =ROUNDDOWN(((E50-50)*0.8),0) -> 9 | G50: 58 | H50: 1 | I50: 8.5
A51: =A50+1 -> 48 | B51: Spencer Eubanks | C51: 1010 | D51: 16 | E51: =(C51/D51) -> 63.125 | F51: =ROUNDDOWN(((E51-50)*0.8),0) -> 10 | G51: 61 | I51: 7.5
A52: =A51+1 -> 49 | B52: Shawn Hullinger | C52: 1145 | D52: 18 | E52: =(C52/D52) -> 63.611111111111114 | F52: =ROUNDDOWN(((E52-50)*0.8),0) -> 10 | G52: 62 | I52: 11
A53: =A52+1 -> 50 | B53: Sarah Potter | C53: 1194 | D53: 18 | E53: =(C53/D53) -> 66.333333333333329 | F53: =ROUNDDOWN(((E53-50)*0.8),0) -> 13 | G53: 57 | H53: 1 | I53: 10
A54: =A53+1 -> 51 | B54: Chad Goodwin | C54: 894 | D54: 13 | E54: =(C54/D54) -> 68.769230769230774 | F54: =ROUNDDOWN(((E54-50)*0.8),0) -> 15 | G54: 65 | H54: 1 | I54: 6
A55: =A54+1 -> 52 | B55: M. Lerch | C55: 1269 | D55: 18 | E55: =(C55/D55) -> 70.500 | F55: =ROUNDDOWN(((E55-50)*0.8),0) -> 16 | G55: 64 | H55: 1 | I55: 7.5
B57: Sub Player | C57: Total Strokes | D57: Weeks | E57: Average | F57: H-Cap | G57: Last | H57: Week Pt. | I57: Total Pts.
B58: Ian Jacobs | C58: 1050 | D58: 18 | E58: =(C58/D58) -> 58.333333333333336 | F58: =ROUNDDOWN(((E58-50)*0.8),0) -> 6 | G58: 53 | I58: 1.5
B59: Ben Sandell | C59: 644 | D59: 10 | E59: =SUM(C59/D59) -> 64.400 | F59: =ROUNDDOWN(((E59-50)*0.8),0) -> 11 | G59: 58 | I59: 3
B60: AO | C60: 196 | D60: 4 | E60: =SUM(C60/D60) -> 49.000 | F60: =ROUNDDOWN(((E60-50)*0.8),0) -> 0 | I60: 2
B61: Chuck | C61: 165 | D61: 3 | E61: =SUM(C61/D61) -> 55.000 | F61: =ROUNDDOWN(((E61-50)*0.8),0) -> 4 | I61: 1.5
B62: Rory | C62: 168 | D62: 3 | E62: =SUM(C62/D62) -> 56.000 | F62: =ROUNDDOWN(((E62-50)*0.8),0) -> 4 | I62: 0
B63: Stibal | C63: 175 | D63: 3 | E63: =SUM(C63/D63) -> 58.333333333333336 | F63: =ROUNDDOWN(((E63-50)*0.8),0) -> 6 | I63: 1
B64: Dan Lewis | C64: 180 | D64: 3 | E64: =SUM(C64/D64) -> 60.000 | F64: =ROUNDDOWN(((E64-50)*0.8),0) -> 8 | I64: 0
B65: Dev Nelson | C65: 168 | D65: 3 | E65: =SUM(C65/D65) -> 56.000 | F65: =ROUNDDOWN(((E65-50)*0.8),0) -> 4 | G65: 53 | I65: 1
B66: Crager | C66: 176 | D66: 3 | E66: =SUM(C66/D66) -> 58.666666666666664 | F66: =ROUNDDOWN(((E66-50)*0.8),0) -> 6 | I66: 0
B67: Rob Mumma | C67: 411 | D67: 7 | E67: =SUM(C67/D67) -> 58.714285714285715 | F67: =ROUNDDOWN(((E67-50)*0.8),0) -> 6 | G67: 55 | I67: 0
B68: Tony Rios | C68: 182 | D68: 3 | E68: =SUM(C68/D68) -> 60.666666666666664 | F68: =ROUNDDOWN(((E68-50)*0.8),0) -> 8 | I68: 0
B69: Nate ? | C69: 62 | D69: 1 | E69: =SUM(C69/D69) -> 62.000 | F69: NA | I69: 0
B70: Nate ? | C70: 57 | D70: 1 | E70: =SUM(C70/D70) -> 57.000 | F70: NA | I70: 0
B71: Timmy | C71: 59 | D71: 1 | E71: =SUM(C71/D71) -> 59.000 | F71: NA | I71: 0
B72: Bob Hernandez | C72: 56 | D72: 1 | E72: =SUM(C72/D72) -> 56.000 | F72: NA | I72: 0
B73: Greg Friestad | C73: 59 | D73: 1 | E73: =SUM(C73/D73) -> 59.000 | F73: NA | I73: 1
B74: Steve Adkinson | C74: 65 | D74: 1 | E74: =SUM(C74/D74) -> 65.000 | F74: NA | I74: 0
B75: Prouty | C75: 71 | D75: 1 | E75: =SUM(C75/D75) -> 71.000 | F75: NA | I75: 0
B76: McCarley | C76: 65 | D76: 1 | E76: =SUM(C76/D76) -> 65.000 | F76: NA | I76: 0
B77: Brent | C77: 62 | D77: 1 | E77: =SUM(C77/D77) -> 62.000 | F77: NA | I77: 0
B78: Adam Karstens | C78: 119 | D78: 2 | E78: =SUM(C78/D78) -> 59.500 | F78: =ROUNDDOWN(((E78-50)*0.8),0) -> 7 | I78: 0
B79: Doc | C79: 103 | D79: 1 | E79: =SUM(C79/D79) -> 103.000 | F79: NA | I79: 0
B80: Skyler | C80: 59 | D80: 1 | E80: =SUM(C80/D80) -> 59.000 | F80: NA | I80: 0
B81: Steve Thirtyacre | C81: 56 | D81: 1 | E81: =SUM(C81/D81) -> 56.000 | F81: NA | I81: 0
B82: Joe Cool | C82: 57 | D82: 1 | E82: =SUM(C82/D82) -> 57.000 | F82: NA
B83: Pete | C83: 61 | D83: 1 | E83: =SUM(C83/D83) -> 61.000 | F83: NA | G83: 61
A85: 2012 SBDGL Team Standings
B86: TEAM # | E86: Total Points | F86: Team Points | G86: Team Avg | H86: Week Total | I86: Week Team
A87: 1 | B87: 18 | C87: Dan Kern + Jeremy Farnsworth | E87: 39 | F87: 14 | G87: =AVERAGE(E4,E5) -> 50.496527777777779 | H87: 2 | I87: 1
A88: 2 | B88: 21 | C88: Super Dave + Tim Peyton | E88: 36.5 | F88: 12 | G88: =AVERAGE(E6,E30) -> 54.037581699346404 | H88: 3 | I88: 1
A89: 3 | B89: 25 | C89: Doug Peyton + Chris Clime | E89: 36 | F89: 12.5 | G89: =AVERAGE(E16,E7) -> 52.861111111111114 | H89: 1
A90: 4 | B90: 20 | C90: Matt Fritz + Egglesten | E90: 35.5 | F90: 12 | G90: =AVERAGE(E37,E35) -> 57.861111111111114 | H90: 2 | I90: 1
A91: 5 | B91: 6 | C91: Hullinger + Jesse Streinz | E91: 35 | F91: 11.5 | G91: =AVERAGE(E52,E24) -> 59.805555555555557
A92: 6 | B92: 4 | C92: KVN + Archie C. | E92: 32.5 | F92: 11.5 | G92: =AVERAGE(E9,E43) -> 56.111111111111114 | H92: 1.5 | I92: 0.5
A93: 7 | B93: 11 | C93: Tim Potter + Andrew Greco | E93: 32.5 | F93: 10.5 | G93: =AVERAGE(E23,E8) -> 53.722222222222221 | H93: 1
A94: 8 | B94: 7 | C94: Doug Johnson + Shane Thirtyacre | E94: 30 | F94: 11 | G94: =AVERAGE(E47,E13) -> 57.805555555555557 | H94: 3 | I94: 1
A95: 9 | B95: 2 | C95: Travis Pike + Kollin Grimm | E95: 29 | F95: 10.5 | G95: =AVERAGE(E12,E33) -> 55.805555555555557 | H95: 1.5 | I95: 0.5
A96: 10 | B96: 9 | C96: John Williams + Kirby Callahan | E96: 27 | F96: 10.5 | G96: =AVERAGE(E32,E39) -> 57.867647058823529 | H96: 3 | I96: 1
A97: 11 | B97: 17 | C97: Marty Reis + Spencer Eubanks | E97: 27 | F97: 9 | G97: =AVERAGE(E51,E28) -> 59.979166666666671 | H97: 2 | I97: 1
A98: 12 | B98: 26 | C98: Joel Knutson + Rob Neubrand | E98: 26.5 | F98: 9.5 | G98: =AVERAGE(E26,E21) -> 56.055555555555557
A99: 13 | B99: 22 | C99: Kurt Conrad + Chad Goodwin | E99: 26 | F99: 8 | G99: =AVERAGE(E11,E54) -> 61.32905982905983 | H99: 1
A100: 14 | B100: 5 | C100: Shirtless + Dustin Utley | E100: 25.5 | F100: 7.5 | G100: =AVERAGE(E30,E18) -> 56.235294117647058 | H100: 2 | I100: 1
A101: 15 | B101: 10 | C101: Tom Pepper + Travis Fruendt | E101: 24.5 | F101: 7.5 | G101: =AVERAGE(E50,E27) -> 59.462418300653596 | H101: 1
A102: 16 | B102: 23 | C102: Matt Wieben + Matt Shannon | E102: 24.5 | F102: 7.5 | G102: =AVERAGE(E36,E10) -> 55.750 | H102: 2 | I102: 1
A103: 17 | B103: 3 | C103: Adam Stiers + Wyckoff | E103: 24.5 | F103: 7 | G103: =AVERAGE(E17,E42) -> 57.17647058823529
A104: 18 | B104: 8 | C104: Sarah Potter + Adam Henderson | E104: 24.5 | F104: 6 | G104: =AVERAGE(E53,E41) -> 62.843137254901961 | H104: 3 | I104: 1
A105: 19 | B105: 14 | C105: Average Joe + Jason Rimrodt | E105: 23.5 | F105: 8 | G105: =AVERAGE(E20,E34) -> 56.583333333333329 | H105: 1
A106: 20 | B106: 15 | C106: Campos + Nathan Veeder | E106: 23 | F106: 7.5 | G106: =AVERAGE(E40,E22) -> 57.058823529411768 | H106: 2 | I106: 1
A107: 21 | B107: 24 | C107: Ryan Hamilton + D. Burns | E107: 22 | F107: 6.5 | G107: =AVERAGE(E25,E48) -> 59.222222222222221
A108: 22 | B108: 12 | C108: Joshua Beachy + Dustin Nohr | E108: 21.5 | F108: 8 | G108: =AVERAGE(E19,E38) -> 56.694444444444443 | H108: 2 | I108: 1
A109: 23 | B109: 19 | C109: Matt Geers + M. Lerch | E109: 21.5 | F109: 7.5 | G109: =AVERAGE(E55,E45) -> 65.704545454545453 | H109: 1
A110: 24 | B110: 1 | C110: Woody + Adam Miller | E110: 20.5 | F110: 7 | G110: =AVERAGE(E16,E14) -> 54.916666666666664 | H110: 2 | I110: 1
A111: 25 | B111: 13 | C111: Perry Thirtyacre + Justin Zehr | E111: 20.5 | F111: 6.5 | G111: =AVERAGE(E45,E29) -> 59.131016042780743 | H111: 1
A112: 26 | B112: 16 | C112: Jerimie Maker + Smith | E112: 13.5 | F112: 4 | G112: =AVERAGE(E46,E49) -> 61.656108597285069 | H112: 1