A1: 2013 S.B.D.G.L. STANDINGS Through Week 5 Legion
A2: Rank | B2: Player | C2: Total Strokes | D2: Weeks | E2: Average | F2: H-Cap | G2: Last | H2: Week Pt. | I2: Total Pts. | J2: Sub Pts.
A4: =A3+1 -> 1 | B4: Adam Olsen | C4: 236 | D4: 5 | E4: =(C4/D4) -> 47.200 | F4: =ROUNDDOWN(((E4-48)*0.8),0) -> 0 | G4: 45 | H4: 1 | I4: 5
A5: =A4+1 -> 2 | B5: Jason Rimrodt | C5: 256 | D5: 5 | E5: =(C5/D5) -> 51.200 | F5: =ROUNDDOWN(((E5-48)*0.8),0) -> 2 | G5: 49 | H5: 1 | I5: 5
A6: =A5+1 -> 3 | B6: Tim Peyton | C6: 257 | D6: 5 | E6: =(C6/D6) -> 51.400 | F6: =ROUNDDOWN(((E6-48)*0.8),0) -> 2 | G6: 50 | H6: 1 | I6: 4
A7: =A6+1 -> 4 | B7: Doug Peyton | C7: 258 | D7: 5 | E7: =(C7/D7) -> 51.600 | F7: =ROUNDDOWN(((E7-48)*0.8),0) -> 2 | G7: 52 | H7: 1 | I7: 5
A8: =A7+1 -> 5 | B8: Andrew Greco | C8: 258 | D8: 5 | E8: =(C8/D8) -> 51.600 | F8: =ROUNDDOWN(((E8-48)*0.8),0) -> 2 | G8: 55 | H8: 0 | I8: 4
A9: =A8+1 -> 6 | B9: Doug Johnson | C9: 258 | D9: 5 | E9: =(C9/D9) -> 51.600 | F9: =ROUNDDOWN(((E9-48)*0.8),0) -> 2 | G9: 51 | H9: 0 | I9: 2.5
A10: =A9+1 -> 7 | B10: Jeremy Farnsworth | C10: 259 | D10: 5 | E10: =(C10/D10) -> 51.800 | F10: =ROUNDDOWN(((E10-48)*0.8),0) -> 3 | G10: 48 | H10: 0.5 | I10: 2
A11: =A10+1 -> 8 | B11: Dan Kern | C11: 261 | D11: 5 | E11: =(C11/D11) -> 52.200 | F11: =ROUNDDOWN(((E11-48)*0.8),0) -> 3 | G11: 51 | H11: 1 | I11: 3
A12: =A11+1 -> 9 | B12: Drew Detert | C12: 262 | D12: 5 | E12: =(C12/D12) -> 52.400 | F12: =ROUNDDOWN(((E12-48)*0.8),0) -> 3 | G12: 50 | H12: 1 | I12: 3.5
A13: =A12+1 -> 10 | B13: Matt Wieben | C13: 263 | D13: 5 | E13: =(C13/D13) -> 52.600 | F13: =ROUNDDOWN(((E13-48)*0.8),0) -> 3 | G13: 50 | H13: 1 | I13: 2
A14: =A13+1 -> 11 | B14: Dustin Utley | C14: 265 | D14: 5 | E14: =(C14/D14) -> 53.000 | F14: =ROUNDDOWN(((E14-48)*0.8),0) -> 4 | G14: 52 | H14: 0.5 | I14: 2
A15: =A14+1 -> 12 | B15: Kurt Conrad | C15: 266 | D15: 5 | E15: =(C15/D15) -> 53.200 | F15: =ROUNDDOWN(((E15-48)*0.8),0) -> 4 | G15: 56 | H15: 0 | I15: 3
A16: =A15+1 -> 13 | B16: Ryan Wodstrchill | C16: 267 | D16: 5 | E16: =(C16/D16) -> 53.400 | F16: =ROUNDDOWN(((E16-48)*0.8),0) -> 4 | G16: 56 | H16: 0 | I16: 2
A17: =A16+1 -> 14 | B17: Adam Miller | C17: 267 | D17: 5 | E17: =(C17/D17) -> 53.400 | F17: =ROUNDDOWN(((E17-48)*0.8),0) -> 4 | G17: 54 | H17: 0 | I17: 1.5
A18: =A17+1 -> 15 | B18: Josh Beachy | C18: 214 | D18: 4 | E18: =(C18/D18) -> 53.500 | F18: =ROUNDDOWN(((E18-48)*0.8),0) -> 4 | G18: 59 | H18: 0 | I18: 2
A19: =A18+1 -> 16 | B19: Tim Potter | C19: 268 | D19: 5 | E19: =(C19/D19) -> 53.600 | F19: =ROUNDDOWN(((E19-48)*0.8),0) -> 4 | G19: 57 | H19: 0 | I19: 1
A20: =A19+1 -> 17 | B20: Adam Stiers | C20: 270 | D20: 5 | E20: =(C20/D20) -> 54.000 | F20: =ROUNDDOWN(((E20-48)*0.8),0) -> 4 | G20: 52 | H20: 1 | I20: 3
A21: =A20+1 -> 18 | B21: Ryan Clark | C21: 273 | D21: 5 | E21: =(C21/D21) -> 54.600 | F21: =ROUNDDOWN(((E21-48)*0.8),0) -> 5 | G21: 51 | H21: 1 | I21: 4.5
A22: =A21+1 -> 19 | B22: KVN Lavley | C22: 273 | D22: 5 | E22: =(C22/D22) -> 54.600 | F22: =ROUNDDOWN(((E22-48)*0.8),0) -> 5 | G22: 49 | H22: 1 | I22: 3
A23: =A22+1 -> 20 | B23: Dan Kent | C23: 274 | D23: 5 | E23: =(C23/D23) -> 54.800 | F23: =ROUNDDOWN(((E23-48)*0.8),0) -> 5 | G23: 50 | H23: 1 | I23: 4.5
A24: =A23+1 -> 21 | B24: Kollin Grimm | C24: 274 | D24: 5 | E24: =(C24/D24) -> 54.800 | F24: =ROUNDDOWN(((E24-48)*0.8),0) -> 5 | G24: 52 | H24: 1 | I24: 3
A25: =A24+1 -> 22 | B25: Joe French | C25: 276 | D25: 5 | E25: =(C25/D25) -> 55.200 | F25: =ROUNDDOWN(((E25-48)*0.8),0) -> 5 | G25: 53 | H25: 0 | I25: 1.5
A26: =A25+1 -> 23 | B26: Shirtless Bill | C26: 279 | D26: 5 | E26: =(C26/D26) -> 55.800 | F26: =ROUNDDOWN(((E26-48)*0.8),0) -> 6 | G26: 56 | H26: 0 | I26: 2
A27: =A26+1 -> 24 | B27: Joel Knutson | C27: 280 | D27: 5 | E27: =(C27/D27) -> 56.000 | F27: =ROUNDDOWN(((E27-48)*0.8),0) -> 6 | G27: 56 | H27: 1 | I27: 3.5
A28: =A27+1 -> 25 | B28: Jesse Streinz | C28: 280 | D28: 5 | E28: =(C28/D28) -> 56.000 | F28: =ROUNDDOWN(((E28-48)*0.8),0) -> 6 | G28: 57 | H28: 0 | I28: 2
A29: =A28+1 -> 26 | B29: Matt Fritz | C29: 280 | D29: 5 | E29: =(C29/D29) -> 56.000 | F29: =ROUNDDOWN(((E29-48)*0.8),0) -> 6 | G29: 55 | H29: 0 | I29: 2
A30: =A29+1 -> 27 | B30: Travis Fruendt | C30: 281 | D30: 5 | E30: =(C30/D30) -> 56.200 | F30: =ROUNDDOWN(((E30-48)*0.8),0) -> 6 | G30: 53 | H30: 1 | I30: 5
A31: =A30+1 -> 28 | B31: Nate Veeder | C31: 281 | D31: 5 | E31: =(C31/D31) -> 56.200 | F31: =ROUNDDOWN(((E31-48)*0.8),0) -> 6 | G31: 52 | H31: 1 | I31: 2
A32: =A31+1 -> 29 | B32: Kirby Callahan | C32: 281 | D32: 5 | E32: =(C32/D32) -> 56.200 | F32: =ROUNDDOWN(((E32-48)*0.8),0) -> 6 | G32: 60 | H32: 0 | I32: 1.5
A33: =A32+1 -> 30 | B33: Travis Pike | C33: 281 | D33: 5 | E33: =(C33/D33) -> 56.200 | F33: =ROUNDDOWN(((E33-48)*0.8),0) -> 6 | G33: 58 | H33: 0 | I33: 1.5
A34: =A33+1 -> 31 | B34: Nate Robins | C34: 281 | D34: 5 | E34: =(C34/D34) -> 56.200 | F34: =ROUNDDOWN(((E34-48)*0.8),0) -> 6 | G34: 52 | H34: 0.5 | I34: 1.5
A35: =A34+1 -> 32 | B35: Bob Hernadez | C35: 282 | D35: 5 | E35: =(C35/D35) -> 56.400 | F35: =ROUNDDOWN(((E35-48)*0.8),0) -> 6 | G35: 55 | H35: 1 | I35: 4
A36: =A35+1 -> 33 | B36: Rob Mumma | C36: 282 | D36: 5 | E36: =(C36/D36) -> 56.400 | F36: =ROUNDDOWN(((E36-48)*0.8),0) -> 6 | G36: 56 | H36: 0 | I36: 3.5
A37: =A36+1 -> 34 | B37: Tony Rios | C37: 282 | D37: 5 | E37: =(C37/D37) -> 56.400 | F37: =ROUNDDOWN(((E37-48)*0.8),0) -> 6 | G37: 54 | H37: 1 | I37: 3
A38: =A37+1 -> 35 | B38: Chris Clime | C38: 283 | D38: 5 | E38: =(C38/D38) -> 56.600 | F38: =ROUNDDOWN(((E38-48)*0.8),0) -> 6 | G38: 56 | H38: 1 | I38: 2
A39: =A38+1 -> 36 | B39: Phil Campos | C39: 285 | D39: 5 | E39: =(C39/D39) -> 57.000 | F39: =ROUNDDOWN(((E39-48)*0.8),0) -> 7 | G39: 54 | H39: 0 | I39: 1
A40: =A39+1 -> 37 | B40: Chuck Yanda | C40: 286 | D40: 5 | E40: =(C40/D40) -> 57.200 | F40: =ROUNDDOWN(((E40-48)*0.8),0) -> 7 | G40: 53 | H40: 1 | I40: 4
A41: =A40+1 -> 38 | B41: Ryan Eggleston | C41: 286 | D41: 5 | E41: =(C41/D41) -> 57.200 | F41: =ROUNDDOWN(((E41-48)*0.8),0) -> 7 | G41: 55 | H41: 0.5 | I41: 3
A42: =A41+1 -> 39 | B42: Matt Wyckoff | C42: 229 | D42: 4 | E42: =(C42/D42) -> 57.250 | F42: =ROUNDDOWN(((E42-48)*0.8),0) -> 7 | G42: 54 | H42: 1 | I42: 1.5
A43: =A42+1 -> 40 | B43: Ryan Hamilton | C43: 287 | D43: 5 | E43: =(C43/D43) -> 57.400 | F43: =ROUNDDOWN(((E43-48)*0.8),0) -> 7 | G43: 60 | H43: 0 | I43: 2
A44: =A43+1 -> 41 | B44: Martin Reis | C44: 289 | D44: 5 | E44: =(C44/D44) -> 57.800 | F44: =ROUNDDOWN(((E44-48)*0.8),0) -> 7 | G44: 52 | H44: 1 | I44: 2
A45: =A44+1 -> 42 | B45: Josh McFarland | C45: 290 | D45: 5 | E45: =(C45/D45) -> 58.000 | F45: =ROUNDDOWN(((E45-48)*0.8),0) -> 8 | G45: 64 | H45: 0 | I45: 1
A46: =A45+1 -> 43 | B46: Greg Dye | C46: 292 | D46: 5 | E46: =(C46/D46) -> 58.400 | F46: =ROUNDDOWN(((E46-48)*0.8),0) -> 8 | G46: 56 | H46: 1 | I46: 3
A47: =A46+1 -> 44 | B47: Jason Shook | C47: 293 | D47: 5 | E47: =(C47/D47) -> 58.600 | F47: =ROUNDDOWN(((E47-48)*0.8),0) -> 8 | G47: 61 | H47: 0 | I47: 2
A48: =A47+1 -> 45 | B48: Ben Sandell | C48: 294 | D48: 5 | E48: =(C48/D48) -> 58.800 | F48: =ROUNDDOWN(((E48-48)*0.8),0) -> 8 | G48: 61 | H48: 0 | I48: 3
A49: =A48+1 -> 46 | B49: Tim Troyna | C49: 294 | D49: 5 | E49: =(C49/D49) -> 58.800 | F49: =ROUNDDOWN(((E49-48)*0.8),0) -> 8 | G49: 58 | H49: 0 | I49: 1.5
A50: =A49+1 -> 47 | B50: Ian Jacobs | C50: 294 | D50: 5 | E50: =(C50/D50) -> 58.800 | F50: =ROUNDDOWN(((E50-48)*0.8),0) -> 8 | G50: 56 | H50: 1 | I50: 1.5
A51: =A50+1 -> 48 | B51: Anthony Moody | C51: 295 | D51: 5 | E51: =(C51/D51) -> 59.000 | F51: =ROUNDDOWN(((E51-48)*0.8),0) -> 8 | G51: 54 | H51: 1 | I51: 2
A52: =A51+1 -> 49 | B52: Adam Henderson | C52: 296 | D52: 5 | E52: =(C52/D52) -> 59.200 | F52: =ROUNDDOWN(((E52-48)*0.8),0) -> 8 | G52: 57 | H52: 0 | I52: 2
A53: =A52+1 -> 50 | B53: Matt Shannon | C53: 297 | D53: 5 | E53: =(C53/D53) -> 59.400 | F53: =ROUNDDOWN(((E53-48)*0.8),0) -> 9 | G53: 58 | H53: 1 | I53: 3
A54: =A53+1 -> 51 | B54: David McCuskey | C54: 297 | D54: 5 | E54: =(C54/D54) -> 59.400 | F54: =ROUNDDOWN(((E54-48)*0.8),0) -> 9 | G54: 59 | H54: 0 | I54: 2
A55: =A54+1 -> 52 | B55: D Burns | C55: 302 | D55: 5 | E55: =(C55/D55) -> 60.400 | F55: =ROUNDDOWN(((E55-48)*0.8),0) -> 9 | G55: 55 | H55: 1 | I55: 3
A56: 53 | B56: Shane Thirtyacre | C56: 303 | D56: 5 | E56: =(C56/D56) -> 60.600 | F56: =ROUNDDOWN(((E56-48)*0.8),0) -> 10 | G56: 59 | H56: 0.5 | I56: 1
A57: 54 | B57: Tom Pepper | C57: 304 | D57: 5 | E57: =(C57/D57) -> 60.800 | F57: =ROUNDDOWN(((E57-48)*0.8),0) -> 10 | G57: 59 | H57: 0.5 | I57: 2.5
A58: 55 | B58: Erik Smith | C58: 304 | D58: 5 | E58: =(C58/D58) -> 60.800 | F58: =ROUNDDOWN(((E58-48)*0.8),0) -> 10 | G58: 62 | H58: 0 | I58: 2
A59: 56 | B59: Adam Chittenden | C59: 306 | D59: 5 | E59: =(C59/D59) -> 61.200 | F59: =ROUNDDOWN(((E59-48)*0.8),0) -> 10 | G59: 60 | H59: 1 | I59: 3.5
A60: 57 | B60: Spencer Eubanks | C60: 307 | D60: 5 | E60: =(C60/D60) -> 61.400 | F60: =ROUNDDOWN(((E60-48)*0.8),0) -> 10 | G60: 56 | H60: 1 | I60: 1
A61: 58 | B61: Mitch Lerch | C61: 315 | D61: 5 | E61: =(C61/D61) -> 63.000 | F61: =ROUNDDOWN(((E61-48)*0.8),0) -> 12 | G61: 65 | H61: 0 | I61: 2.5
A62: 59 | B62: Sarah Potter | C62: 317 | D62: 5 | E62: =(C62/D62) -> 63.400 | F62: =ROUNDDOWN(((E62-48)*0.8),0) -> 12 | G62: 63 | H62: 0 | I62: 2.5
A63: 60 | B63: Shawn Hullinger | C63: 319 | D63: 5 | E63: =(C63/D63) -> 63.800 | F63: =ROUNDDOWN(((E63-48)*0.8),0) -> 12 | G63: 65 | H63: 0 | I63: 1
A64: 61 | B64: Pat Cutsforth | C64: 321 | D64: 5 | E64: =(C64/D64) -> 64.200 | F64: =ROUNDDOWN(((E64-48)*0.8),0) -> 12 | G64: 60 | H64: 1 | I64: 3.5
A65: 62 | B65: Tony Ebson | C65: 321 | D65: 5 | E65: =(C65/D65) -> 64.200 | F65: =ROUNDDOWN(((E65-48)*0.8),0) -> 12 | G65: 66 | H65: 0 | I65: 1.5
A66: 63 | B66: Avg Joe | C66: 322 | D66: 5 | E66: =(C66/D66) -> 64.400 | F66: =ROUNDDOWN(((E66-48)*0.8),0) -> 13 | G66: 69 | H66: 0 | I66: 0
A67: 64 | B67: Matt Whitlock | C67: 333 | D67: 5 | E67: =(C67/D67) -> 66.600 | F67: =ROUNDDOWN(((E67-48)*0.8),0) -> 14 | G67: 68 | H67: 0 | I67: 1
A69: 2013 S.B.D.G.L STANDINGS Through Week 5 Legion
A70: Subs | B70: Player | C70: Total Strokes | D70: Weeks | E70: Average | F70: H-Cap | G70: Last | H70: Week Pt. | I70: Total Pts. | J70: Subed For
A71: 1 | B71: Dustin Snodgress | C71: 182 | D71: 3 | E71: =SUM(C71/D71) -> 60.666666666666664 | F71: =ROUNDDOWN(((E71-48)*0.8),0) -> 10 | G71: 64
A72: 2 | B72: Kerri Haught | C72: 124 | D72: 2 | E72: =SUM(C72/D72) -> 62.000 | F72: =ROUNDDOWN(((E72-48)*0.8),0) -> 11
A73: 3 | B73: Matt Snyder | C73: 162 | D73: 2 | E73: =SUM(C73/D73) -> 81.000 | F73: =ROUNDDOWN(((E73-48)*0.8),0) -> 26 | I73: 0
A74: 2 | C74: 0 | D74: 1 | E74: =SUM(C74/D74) -> 0.000 | F74: =ROUNDDOWN(((E74-50)*0.8),0) -> -40
A75: 3 | C75: 0 | D75: 1 | E75: =SUM(C75/D75) -> 0.000 | F75: =ROUNDDOWN(((E75-50)*0.8),0) -> -40
A76: =SUM(A75+1) -> 4 | C76: 0 | D76: 1 | E76: =SUM(C76/D76) -> 0.000 | F76: =ROUNDDOWN(((E76-50)*0.8),0) -> -40
A77: =SUM(A76+1) -> 5 | C77: 0 | D77: 1 | E77: =SUM(C77/D77) -> 0.000 | F77: =ROUNDDOWN(((E77-50)*0.8),0) -> -40
A78: 7 | C78: 0 | D78: 1 | E78: =SUM(C78/D78) -> 0.000 | F78: =ROUNDDOWN(((E78-50)*0.8),0) -> -40
A79: 8 | C79: 0 | D79: 1 | E79: =SUM(C79/D79) -> 0.000 | F79: =ROUNDDOWN(((E79-50)*0.8),0) -> -40
A80: 9 | C80: 0 | D80: 1 | E80: =SUM(C80/D80) -> 0.000 | F80: =ROUNDDOWN(((E80-50)*0.8),0) -> -40
A81: 10 | C81: 0 | D81: 1 | E81: =SUM(C81/D81) -> 0.000 | F81: =ROUNDDOWN(((E81-50)*0.8),0) -> -40
A82: 11 | C82: 0 | D82: 1 | E82: =SUM(C82/D82) -> 0.000 | F82: =ROUNDDOWN(((E82-50)*0.8),0) -> -40
A83: 12 | C83: 0 | D83: 1 | E83: =SUM(C83/D83) -> 0.000 | F83: =ROUNDDOWN(((E83-50)*0.8),0) -> -40
A84: 13 | C84: 0 | D84: 1 | E84: =SUM(C84/D84) -> 0.000 | F84: =ROUNDDOWN(((E84-50)*0.8),0) -> -40
A85: 14 | C85: 0 | D85: 1 | E85: =SUM(C85/D85) -> 0.000 | F85: =ROUNDDOWN(((E85-50)*0.8),0) -> -40
A86: 15 | C86: 0 | D86: 1 | E86: =SUM(C86/D86) -> 0.000 | F86: =ROUNDDOWN(((E86-50)*0.8),0) -> -40
A87: 16 | C87: 0 | D87: 1 | E87: =SUM(C87/D87) -> 0.000 | F87: =ROUNDDOWN(((E87-50)*0.8),0) -> -40
A88: 17 | C88: 0 | D88: 1 | E88: =SUM(C88/D88) -> 0.000 | F88: =ROUNDDOWN(((E88-50)*0.8),0) -> -40
A89: 18 | C89: 0 | D89: 1 | E89: =SUM(C89/D89) -> 0.000 | F89: =ROUNDDOWN(((E89-50)*0.8),0) -> -40
A90: 19 | C90: 0 | D90: 1 | E90: =SUM(C90/D90) -> 0.000 | F90: =ROUNDDOWN(((E90-50)*0.8),0) -> -40
A91: 20 | C91: 0 | D91: 1 | E91: =SUM(C91/D91) -> 0.000 | F91: =ROUNDDOWN(((E91-50)*0.8),0) -> -40
A92: 21 | C92: 0 | D92: 1 | E92: =SUM(C92/D92) -> 0.000 | F92: =ROUNDDOWN(((E92-50)*0.8),0) -> -40
A93: 22 | C93: 0 | D93: 1 | E93: =SUM(C93/D93) -> 0.000 | F93: =ROUNDDOWN(((E93-50)*0.8),0) -> -40
A94: 23 | C94: 0 | D94: 1 | E94: =SUM(C94/D94) -> 0.000 | F94: =ROUNDDOWN(((E94-50)*0.8),0) -> -40
A95: 24 | C95: 0 | D95: 1 | E95: =SUM(C95/D95) -> 0.000 | F95: =ROUNDDOWN(((E95-50)*0.8),0) -> -40
A96: 25 | C96: 0 | D96: 1 | E96: =SUM(C96/D96) -> 0.000 | F96: =ROUNDDOWN(((E96-50)*0.8),0) -> -40
A97: 26 | C97: 0 | D97: 1 | E97: =SUM(C97/D97) -> 0.000 | F97: =ROUNDDOWN(((E97-50)*0.8),0) -> -40
A98: 27 | C98: 0 | D98: 1 | E98: =SUM(C98/D98) -> 0.000 | F98: =ROUNDDOWN(((E98-50)*0.8),0) -> -40
A99: 28 | C99: 0 | D99: 1 | E99: =SUM(C99/D99) -> 0.000 | F99: =ROUNDDOWN(((E99-50)*0.8),0) -> -40
A100: 28 | C100: 0 | D100: 1 | E100: =SUM(C100/D100) -> 0.000 | F100: =ROUNDDOWN(((E100-50)*0.8),0) -> -40
A101: 7 | B101: Archie Coulter | C101: 59 | D101: 1 | E101: =SUM(C101/D101) -> 59.000 | F101: 0 | G101: 59
A102: 6 | B102: Dustin Nohr | C102: 64 | D102: 1 | E102: =SUM(C102/D102) -> 64.000 | F102: 0 | G102: 64
A103: 4 | B103: Adam Karstens | C103: 64 | D103: 1 | E103: =SUM(C103/D103) -> 64.000 | F103: 0
A104: 5 | B104: Johnny Walker | C104: 64 | D104: 1 | E104: =SUM(C104/D104) -> 64.000 | F104: 0
B106: TEAM # | C106: BUSH | E106: Total Points | F106: Team Points | G106: Team Avg
A107: 1 | B107: 6 | C107: Ryan Clark & Ben Sandel | E107: 11.5 | F107: 4 | G107: =AVERAGE(E48,E21) -> 56.700
A108: 2 | B108: 14 | C108: Matt Fritz & Jason Rimrodt | E108: 10.5 | F108: 3.5 | G108: =AVERAGE(E5,E29) -> 53.600
A109: 3 | B109: 16 | C109: Tim Peyton & Josh Beachy | E109: 9.5 | F109: 3.5 | G109: =AVERAGE(E6,E18) -> 52.450
A110: 4 | B110: 7 | C110: Doug Johnson & Adam Stiers | E110: 8.5 | F110: 3 | G110: =AVERAGE(E9,E20) -> 52.800
A111: 5 | B111: 2 | C111: Sarah Potter & Kollin Grimm | E111: 8.5 | F111: 3 | G111: =AVERAGE(E24,E62) -> 59.100
A112: 6 | B112: 3 | C112: Erik Smith & KVN | E112: 8 | F112: 3 | G112: =AVERAGE(E58,E22) -> 57.700
A113: 7 | B113: 1 | C113: D Burns & Adam Henderson | E113: 8 | F113: 3 | G113: =AVERAGE(E52,E55) -> 59.800
A114: 8 | B114: 8 | C114: Jesse Streinz & Bob Hernandez | E114: 8 | F114: 2 | G114: =AVERAGE(E28,E35) -> 56.200
A115: 9 | B115: 15 | C115: Nathan Veeder & Tony Rios | E115: 7.5 | F115: 2.5 | G115: =AVERAGE(E37,E31) -> 56.300
A116: 10 | B116: 12 | C116: Ian Jacobs & Andrew Greco | E116: 7.5 | F116: 2 | G116: =AVERAGE(E8,E50) -> 55.200
A117: 11 | B117: 9 | C117: Tim Troyna & Pat Cutsforth | E117: 7 | F117: 2 | G117: =AVERAGE(E49,E64) -> 61.500
A118: 12 | B118: 11 | C118: Matt Weiben & Kirby Callanhan | E118: 6.5 | F118: 3 | G118: =AVERAGE(E32,E13) -> 54.400
A119: 13 | B119: 10 | C119: Adam Miller & Mitch Lerch | E119: 6 | F119: 2 | G119: =AVERAGE(E17,E61) -> 58.200
A120: 14 | B120: 4 | C120: Marty Reis & Travis Pike | E120: 5.5 | F120: 2 | G120: =AVERAGE(E33,E44) -> 57.000
A121: 15 | B121: 13 | C121: Matt Whitlock & Greg Dye | E121: 5.5 | F121: 1.5 | G121: =AVERAGE(E46,E67) -> 62.500
A122: 16 | B122: 5 | C122: Average Joe & Chris Clime | E122: 2 | F122: 0 | G122: =AVERAGE(E66,E38) -> 60.500
B124: TEAM # | C124: WHACKER
A125: 1 | B125: 30 | C125: Joel Knutson & Travis Fruendt | E125: 13.5 | F125: 5 | G125: =AVERAGE(E27,E30) -> 56.100
A126: 2 | B126: 23 | C126: Doug Peyton & Adam Chittenden | E126: 13.5 | F126: 5 | G126: =AVERAGE(E7,E59) -> 56.400
A127: 3 | B127: 29 | C127: Adam Olsen & Matt Shannon | E127: 12 | F127: 4 | G127: =AVERAGE(E4,E53) -> 53.300
A128: 4 | B128: 27 | C128: Kurt Conrad & Dan Kent | E128: 11.5 | F128: 4 | G128: =AVERAGE(E15,E23) -> 54.000
A129: 5 | B129: 19 | C129: Drew Detert & Anthony Moody | E129: 8.5 | F129: 3 | G129: =AVERAGE(E12,E51) -> 55.700
A130: 6 | B130: 17 | C130: Chuck Yanda & Nate Robbins | E130: 8.5 | F130: 3 | G130: =AVERAGE(E34,E40) -> 56.700
A131: 7 | B131: 24 | C131: Ryan Hamilton & Rob Mumma | E131: 7.5 | F131: 2 | G131: =AVERAGE(E36,E43) -> 56.900
A132: 8 | B132: 20 | C132: Dustin Utley & Tom Pepper | E132: 7 | F132: 2.5 | G132: =AVERAGE(E14,E57) -> 56.900
A133: 9 | B133: 32 | C133: Dan Kern & Shirtless Bill | E133: 7 | F133: 2 | G133: =AVERAGE(E26,E11) -> 54.000
A134: 10 | B134: 22 | C134: Jeremy Farnsworth & Tony Ebson | E134: 5.5 | F134: 2 | G134: =AVERAGE(E10,E65) -> 58.000
A135: 11 | B135: 21 | C135: Ryan Eggleston & Shane Thirtyacre | E135: 5.5 | F135: 1.5 | G135: =AVERAGE(E41,E56) -> 58.900
A136: 12 | B136: 25 | C136: Ryan Wodstrchill & Phil Campos | E136: 5 | F136: 2 | G136: =AVERAGE(E16,E39) -> 55.200
A137: 13 | B137: 26 | C137: Joe French & Matt Wycoff | E137: 4.5 | F137: 1.5 | G137: =AVERAGE(E25,E42) -> 56.225000000000001
A138: 14 | B138: 28 | C138: Tim Potter & David McCuskey | E138: 4.5 | F138: 1.5 | G138: =AVERAGE(E19,E54) -> 56.500
A139: 15 | B139: 18 | C139: Jason Shook & Josh McFarland | E139: 4 | F139: 1 | G139: =AVERAGE(E45,E47) -> 58.300
A140: 16 | B140: 31 | C140: Spencer Eubanks & Shawn Hullinger | E140: 2 | F140: 0 | G140: =AVERAGE(E63,E60) -> 62.600