A1: 2013 S.B.D.G.L. STANDINGS Through Week 7 Shaver
A2: Rank | B2: Player | C2: Total Strokes | D2: Weeks | E2: Average | F2: H-Cap | G2: Last | H2: Week Pt. | I2: Total Pts. | J2: Sub Pts.
A4: =A3+1 -> 1 | B4: Adam Olsen | C4: 330 | D4: 7 | E4: =(C4/D4) -> 47.142857142857146 | F4: =ROUNDDOWN(((E4-48)*0.8),0) -> 0 | G4: 52 | H4: 0.5 | I4: 6.5
A5: =A4+1 -> 2 | B5: Jason Rimrodt | C5: 357 | D5: 7 | E5: =(C5/D5) -> 51.000 | F5: =ROUNDDOWN(((E5-48)*0.8),0) -> 2 | G5: 53 | H5: 1 | I5: 7
A6: =A5+1 -> 3 | B6: Andrew Greco | C6: 358 | D6: 7 | E6: =(C6/D6) -> 51.142857142857146 | F6: =ROUNDDOWN(((E6-48)*0.8),0) -> 2 | G6: 51 | H6: 1 | I6: 5
A7: =A6+1 -> 4 | B7: Doug Peyton | C7: 359 | D7: 7 | E7: =(C7/D7) -> 51.285714285714285 | F7: =ROUNDDOWN(((E7-48)*0.8),0) -> 2 | G7: 55 | H7: 1 | I7: 6
A8: =A7+1 -> 5 | B8: Tim Peyton | C8: 362 | D8: 7 | E8: =(C8/D8) -> 51.714285714285715 | F8: =ROUNDDOWN(((E8-48)*0.8),0) -> 2 | G8: 56 | H8: 1 | I8: 5
A9: =A8+1 -> 6 | B9: Dan Kern | C9: 369 | D9: 7 | E9: =(C9/D9) -> 52.714285714285715 | F9: =ROUNDDOWN(((E9-48)*0.8),0) -> 3 | G9: 54 | H9: 1 | I9: 4
A10: =A9+1 -> 7 | B10: Jeremy Farnsworth | C10: 370 | D10: 7 | E10: =(C10/D10) -> 52.857142857142854 | F10: =ROUNDDOWN(((E10-48)*0.8),0) -> 3 | G10: 58 | H10: 1 | I10: 4
A11: =A10+1 -> 8 | B11: Doug Johnson | C11: 370 | D11: 7 | E11: =(C11/D11) -> 52.857142857142854 | F11: =ROUNDDOWN(((E11-48)*0.8),0) -> 3 | G11: 60 | H11: 1 | I11: 4
A12: =A11+1 -> 9 | B12: Kurt Conrad | C12: 372 | D12: 7 | E12: =(C12/D12) -> 53.142857142857146 | F12: =ROUNDDOWN(((E12-48)*0.8),0) -> 4 | G12: 56 | H12: 1 | I12: 4
A13: =A12+1 -> 10 | B13: Ryan Wodstrchill | C13: 373 | D13: 7 | E13: =(C13/D13) -> 53.285714285714285 | F13: =ROUNDDOWN(((E13-48)*0.8),0) -> 4 | G13: 57 | H13: 0 | I13: 2.5
A14: =A13+1 -> 11 | B14: Matt Wieben | C14: 375 | D14: 7 | E14: =(C14/D14) -> 53.571428571428569 | F14: =ROUNDDOWN(((E14-48)*0.8),0) -> 4 | G14: 60 | H14: 0 | I14: 2
A15: =A14+1 -> 12 | B15: Tim Potter | C15: 380 | D15: 7 | E15: =(C15/D15) -> 54.285714285714285 | F15: =ROUNDDOWN(((E15-48)*0.8),0) -> 5 | G15: 60 | H15: 1 | I15: 2
A16: =A15+1 -> 13 | B16: Adam Miller | C16: 382 | D16: 7 | E16: =(C16/D16) -> 54.571428571428569 | F16: =ROUNDDOWN(((E16-48)*0.8),0) -> 5 | G16: 69 | H16: 0 | I16: 2.5
A17: =A16+1 -> 14 | B17: Dustin Utley | C17: 383 | D17: 7 | E17: =(C17/D17) -> 54.714285714285715 | F17: =ROUNDDOWN(((E17-48)*0.8),0) -> 5 | G17: 63 | H17: 0 | I17: 2
A18: =A17+1 -> 15 | B18: KVN Lavley | C18: 384 | D18: 7 | E18: =(C18/D18) -> 54.857142857142854 | F18: =ROUNDDOWN(((E18-48)*0.8),0) -> 5 | G18: 61 | H18: 0.5 | I18: 4.5
A19: =A18+1 -> 16 | B19: Adam Stiers | C19: 385 | D19: 7 | E19: =(C19/D19) -> 55.000 | F19: =ROUNDDOWN(((E19-48)*0.8),0) -> 5 | G19: 65 | H19: 0 | I19: 4
A20: =A19+1 -> 17 | B20: Joe French | C20: 386 | D20: 7 | E20: =(C20/D20) -> 55.142857142857146 | F20: =ROUNDDOWN(((E20-48)*0.8),0) -> 5 | G20: 57 | H20: 0.5 | I20: 3
A21: =A20+1 -> 18 | B21: Nate Robins | C21: 386 | D21: 7 | E21: =(C21/D21) -> 55.142857142857146 | F21: =ROUNDDOWN(((E21-48)*0.8),0) -> 5 | G21: 56 | H21: 1 | I21: 3.5
A22: =A21+1 -> 19 | B22: Josh Beachy | C22: 331 | D22: 6 | E22: =(C22/D22) -> 55.166666666666664 | F22: =ROUNDDOWN(((E22-48)*0.8),0) -> 5 | G22: 63 | H22: 0 | I22: 2.5
A23: =A22+1 -> 20 | B23: Dan Kent | C23: 389 | D23: 7 | E23: =(C23/D23) -> 55.571428571428569 | F23: =ROUNDDOWN(((E23-48)*0.8),0) -> 6 | G23: 62 | H23: 1 | I23: 5.5
A24: =A23+1 -> 21 | B24: Rob Mumma | C24: 390 | D24: 7 | E24: =(C24/D24) -> 55.714285714285715 | F24: =ROUNDDOWN(((E24-48)*0.8),0) -> 6 | G24: 58 | H24: 0 | I24: 4.5
A25: =A24+1 -> 22 | B25: Drew Detert | C25: 391 | D25: 7 | E25: =(C25/D25) -> 55.857142857142854 | F25: =ROUNDDOWN(((E25-48)*0.8),0) -> 6 | G25: 61 | H25: 0 | I25: 3.5
A26: =A25+1 -> 23 | B26: Kirby Callahan | C26: 392 | D26: 7 | E26: =(C26/D26) -> 56.000 | F26: =ROUNDDOWN(((E26-48)*0.8),0) -> 6 | G26: 57 | H26: 1 | I26: 2.5
A27: =A26+1 -> 24 | B27: Nate Veeder | C27: 393 | D27: 7 | E27: =(C27/D27) -> 56.142857142857146 | F27: =ROUNDDOWN(((E27-48)*0.8),0) -> 6 | G27: 56 | H27: 0 | I27: 2.5
A28: =A27+1 -> 25 | B28: Shirtless Bill | C28: 393 | D28: 7 | E28: =(C28/D28) -> 56.142857142857146 | F28: =ROUNDDOWN(((E28-48)*0.8),0) -> 6 | G28: 58 | H28: 1 | I28: 3.5
A29: =A28+1 -> 26 | B29: Jesse Streinz | C29: 394 | D29: 7 | E29: =(C29/D29) -> 56.285714285714285 | F29: =ROUNDDOWN(((E29-48)*0.8),0) -> 6 | G29: 64 | H29: 0 | I29: 3
A30: =A29+1 -> 27 | B30: Joel Knutson | C30: 394 | D30: 7 | E30: =(C30/D30) -> 56.285714285714285 | F30: =ROUNDDOWN(((E30-48)*0.8),0) -> 6 | G30: 61 | H30: 0 | I30: 4.5
A31: =A30+1 -> 28 | B31: Ryan Clark | C31: 394 | D31: 7 | E31: =(C31/D31) -> 56.285714285714285 | F31: =ROUNDDOWN(((E31-48)*0.8),0) -> 6 | G31: 62 | H31: 0.5 | I31: 5
A32: =A31+1 -> 29 | B32: Bob Hernadez | C32: 394 | D32: 7 | E32: =(C32/D32) -> 56.285714285714285 | F32: =ROUNDDOWN(((E32-48)*0.8),0) -> 6 | G32: 60 | H32: 1 | I32: 6
A33: =A32+1 -> 30 | B33: Kollin Grimm | C33: 395 | D33: 7 | E33: =(C33/D33) -> 56.428571428571431 | F33: =ROUNDDOWN(((E33-48)*0.8),0) -> 6 | G33: 66 | H33: 0 | I33: 3
A34: =A33+1 -> 31 | B34: Chris Clime | C34: 397 | D34: 7 | E34: =(C34/D34) -> 56.714285714285715 | F34: =ROUNDDOWN(((E34-48)*0.8),0) -> 6 | G34: 61 | H34: 1 | I34: 3
A35: =A34+1 -> 32 | B35: Phil Campos | C35: 400 | D35: 7 | E35: =(C35/D35) -> 57.142857142857146 | F35: =ROUNDDOWN(((E35-48)*0.8),0) -> 7 | G35: 63 | H35: 0 | I35: 1
A36: =A35+1 -> 33 | B36: Travis Pike | C36: 401 | D36: 7 | E36: =(C36/D36) -> 57.285714285714285 | F36: =ROUNDDOWN(((E36-48)*0.8),0) -> 7 | G36: 66 | H36: 0 | I36: 2.5
A37: =A36+1 -> 34 | B37: Greg Dye | C37: 401 | D37: 7 | E37: =(C37/D37) -> 57.285714285714285 | F37: =ROUNDDOWN(((E37-48)*0.8),0) -> 7 | G37: 58 | H37: 1 | I37: 5
A38: =A37+1 -> 35 | B38: Travis Fruendt | C38: 401 | D38: 7 | E38: =(C38/D38) -> 57.285714285714285 | F38: =ROUNDDOWN(((E38-48)*0.8),0) -> 7 | G38: 65 | H38: 0 | I38: 6
A39: =A38+1 -> 36 | B39: Tony Rios | C39: 344 | D39: 6 | E39: =(C39/D39) -> 57.333333333333336 | F39: =ROUNDDOWN(((E39-48)*0.8),0) -> 7 | I39: 3 | J39: 0
A40: =A39+1 -> 37 | B40: Ryan Hamilton | C40: 402 | D40: 7 | E40: =(C40/D40) -> 57.428571428571431 | F40: =ROUNDDOWN(((E40-48)*0.8),0) -> 7 | G40: 59 | H40: 0 | I40: 3
A41: =A40+1 -> 38 | B41: Matt Wyckoff | C41: 345 | D41: 6 | E41: =(C41/D41) -> 57.500 | F41: =ROUNDDOWN(((E41-48)*0.8),0) -> 7 | G41: 59 | H41: 1 | I41: 3
A42: =A41+1 -> 39 | B42: Matt Fritz | C42: 403 | D42: 7 | E42: =(C42/D42) -> 57.571428571428569 | F42: =ROUNDDOWN(((E42-48)*0.8),0) -> 7 | G42: 66 | H42: 0 | I42: 2
A43: =A42+1 -> 40 | B43: Matt Shannon | C43: 405 | D43: 7 | E43: =(C43/D43) -> 57.857142857142854 | F43: =ROUNDDOWN(((E43-48)*0.8),0) -> 7 | G43: 60 | H43: 0 | I43: 4
A44: =A43+1 -> 41 | B44: Ryan Eggleston | C44: 405 | D44: 7 | E44: =(C44/D44) -> 57.857142857142854 | F44: =ROUNDDOWN(((E44-48)*0.8),0) -> 7 | G44: 61 | H44: 1 | I44: 5
A45: =A44+1 -> 42 | B45: Chuck Yanda | C45: 406 | D45: 7 | E45: =(C45/D45) -> 58.000 | F45: =ROUNDDOWN(((E45-48)*0.8),0) -> 8 | G45: 56 | H45: 1 | I45: 5
A46: =A45+1 -> 43 | B46: Josh McFarland | C46: 407 | D46: 7 | E46: =(C46/D46) -> 58.142857142857146 | F46: =ROUNDDOWN(((E46-48)*0.8),0) -> 8 | G46: 62 | H46: 0 | I46: 1
A47: =A46+1 -> 44 | B47: Ian Jacobs | C47: 408 | D47: 7 | E47: =(C47/D47) -> 58.285714285714285 | F47: =ROUNDDOWN(((E47-48)*0.8),0) -> 8 | G47: 60 | H47: 1 | I47: 3.5
A48: =A47+1 -> 45 | B48: Martin Reis | C48: 409 | D48: 7 | E48: =(C48/D48) -> 58.428571428571431 | F48: =ROUNDDOWN(((E48-48)*0.8),0) -> 8 | G48: 64 | H48: 1 | I48: 3
A49: =A48+1 -> 46 | B49: Jason Shook | C49: 351 | D49: 6 | E49: =(C49/D49) -> 58.500 | F49: =ROUNDDOWN(((E49-48)*0.8),0) -> 8 | I49: 2
A50: =A49+1 -> 47 | B50: Tim Troyna | C50: 415 | D50: 7 | E50: =(C50/D50) -> 59.285714285714285 | F50: =ROUNDDOWN(((E50-48)*0.8),0) -> 9 | G50: 63 | H50: 0 | I50: 2
A51: =A50+1 -> 48 | B51: David McCuskey | C51: 418 | D51: 7 | E51: =(C51/D51) -> 59.714285714285715 | F51: =ROUNDDOWN(((E51-48)*0.8),0) -> 9 | G51: 62 | H51: 1 | I51: 3
A52: =A51+1 -> 49 | B52: Adam Henderson | C52: 418 | D52: 7 | E52: =(C52/D52) -> 59.714285714285715 | F52: =ROUNDDOWN(((E52-48)*0.8),0) -> 9 | G52: 64 | H52: 1 | I52: 3.5
A53: =A52+1 -> 50 | B53: Ben Sandell | C53: 418 | D53: 7 | E53: =(C53/D53) -> 59.714285714285715 | F53: =ROUNDDOWN(((E53-48)*0.8),0) -> 9 | G53: 68 | H53: 1 | I53: 5
A54: =A53+1 -> 51 | B54: Anthony Moody | C54: 419 | D54: 7 | E54: =(C54/D54) -> 59.857142857142854 | F54: =ROUNDDOWN(((E54-48)*0.8),0) -> 9 | G54: 66 | H54: 0.5 | I54: 2.5
A55: =A54+1 -> 52 | B55: Adam Chittenden | C55: 426 | D55: 7 | E55: =(C55/D55) -> 60.857142857142854 | F55: =ROUNDDOWN(((E55-48)*0.8),0) -> 10 | G55: 67 | H55: 0.5 | I55: 5
A56: 53 | B56: Shane Thirtyacre | C56: 427 | D56: 7 | E56: =(C56/D56) -> 61.000 | F56: =ROUNDDOWN(((E56-48)*0.8),0) -> 10 | G56: 67 | H56: 1 | I56: 3
A57: 56 | B57: D Burns | C57: 429 | D57: 7 | E57: =(C57/D57) -> 61.285714285714285 | F57: =ROUNDDOWN(((E57-48)*0.8),0) -> 10 | G57: 67 | H57: 0 | I57: 3
A58: 55 | B58: Erik Smith | C58: 432 | D58: 7 | E58: =(C58/D58) -> 61.714285714285715 | F58: =ROUNDDOWN(((E58-48)*0.8),0) -> 10 | G58: 70 | H58: 0 | I58: 2
A59: 54 | B59: Spencer Eubanks | C59: 434 | D59: 7 | E59: =(C59/D59) -> 62.000 | F59: =ROUNDDOWN(((E59-48)*0.8),0) -> 11 | G59: 72 | H59: 0 | I59: 1.5
A60: 57 | B60: Tom Pepper | C60: 372 | D60: 6 | E60: =(C60/D60) -> 62.000 | F60: =ROUNDDOWN(((E60-48)*0.8),0) -> 11 | G60: 68 | H60: 0.5 | I60: 3
A61: 59 | B61: Avg Joe | C61: 442 | D61: 7 | E61: =(C61/D61) -> 63.142857142857146 | F61: =ROUNDDOWN(((E61-48)*0.8),0) -> 12 | G61: 66 | H61: 1 | I61: 2
A62: 62 | B62: Pat Cutsforth | C62: 443 | D62: 7 | E62: =(C62/D62) -> 63.285714285714285 | F62: =ROUNDDOWN(((E62-48)*0.8),0) -> 12 | G62: 66 | H62: 1 | I62: 5.5
A63: 60 | B63: Sarah Potter | C63: 444 | D63: 7 | E63: =(C63/D63) -> 63.428571428571431 | F63: =ROUNDDOWN(((E63-48)*0.8),0) -> 12 | G63: 67 | H63: 0 | I63: 2.5
A64: 61 | B64: Mitch Lerch | C64: 445 | D64: 7 | E64: =(C64/D64) -> 63.571428571428569 | F64: =ROUNDDOWN(((E64-48)*0.8),0) -> 12 | G64: 68 | H64: 1 | I64: 4
A65: 58 | B65: Shawn Hullinger | C65: 450 | D65: 7 | E65: =(C65/D65) -> 64.285714285714292 | F65: =ROUNDDOWN(((E65-48)*0.8),0) -> 13 | G65: 76 | H65: 0 | I65: 2
A66: 63 | B66: Tony Ebson | C66: 451 | D66: 7 | E66: =(C66/D66) -> 64.428571428571431 | F66: =ROUNDDOWN(((E66-48)*0.8),0) -> 13 | G66: 70 | H66: 0.5 | I66: 3
A67: 64 | B67: Matt Whitlock | C67: 470 | D67: 7 | E67: =(C67/D67) -> 67.142857142857139 | F67: =ROUNDDOWN(((E67-48)*0.8),0) -> 15 | G67: 77 | H67: 0 | I67: 2
A69: Subs | B69: Player | C69: Total Strokes | D69: Weeks | E69: Average | F69: H-Cap | G69: Last | H69: Week Pt. | I69: Total Pts. | J69: Subed For
A70: 1 | B70: Dustin Snodgress | C70: 314 | D70: 5 | E70: =SUM(C70/D70) -> 62.800 | F70: =ROUNDDOWN(((E70-48)*0.8),0) -> 11 | G70: 71 | H70: 0 | J70: Rios
A71: 2 | B71: Adam Karstens | C71: 179 | D71: 3 | E71: =SUM(C71/D71) -> 59.666666666666664 | F71: =ROUNDDOWN(((E71-48)*0.8),0) -> 9
A72: 3 | B72: Archie Coulter | C72: 115 | D72: 2 | E72: =SUM(C72/D72) -> 57.500 | F72: =ROUNDDOWN(((E72-48)*0.8),0) -> 7
A73: 4 | B73: Kerri Haught | C73: 124 | D73: 2 | E73: =SUM(C73/D73) -> 62.000 | F73: =ROUNDDOWN(((E73-48)*0.8),0) -> 11
A74: 5 | B74: Matt Snyder | C74: 162 | D74: 2 | E74: =SUM(C74/D74) -> 81.000 | F74: =ROUNDDOWN(((E74-48)*0.8),0) -> 26
A75: 6 | C75: 0 | D75: 1 | E75: =SUM(C75/D75) -> 0.000 | F75: =ROUNDDOWN(((E75-48)*0.8),0) -> -38
A76: 7 | C76: 0 | D76: 1 | E76: =SUM(C76/D76) -> 0.000 | F76: =ROUNDDOWN(((E76-48)*0.8),0) -> -38
A77: 8 | C77: 0 | D77: 1 | E77: =SUM(C77/D77) -> 0.000 | F77: =ROUNDDOWN(((E77-48)*0.8),0) -> -38
A78: 9 | C78: 0 | D78: 1 | E78: =SUM(C78/D78) -> 0.000 | F78: =ROUNDDOWN(((E78-48)*0.8),0) -> -38
A79: 10 | C79: 0 | D79: 1 | E79: =SUM(C79/D79) -> 0.000 | F79: =ROUNDDOWN(((E79-48)*0.8),0) -> -38
A80: 11 | C80: 0 | D80: 1 | E80: =SUM(C80/D80) -> 0.000 | F80: =ROUNDDOWN(((E80-48)*0.8),0) -> -38
A81: 12 | C81: 0 | D81: 1 | E81: =SUM(C81/D81) -> 0.000 | F81: =ROUNDDOWN(((E81-48)*0.8),0) -> -38
A82: 13 | C82: 0 | D82: 1 | E82: =SUM(C82/D82) -> 0.000 | F82: =ROUNDDOWN(((E82-48)*0.8),0) -> -38
A83: 14 | C83: 0 | D83: 1 | E83: =SUM(C83/D83) -> 0.000 | F83: =ROUNDDOWN(((E83-48)*0.8),0) -> -38
A84: 15 | C84: 0 | D84: 1 | E84: =SUM(C84/D84) -> 0.000 | F84: =ROUNDDOWN(((E84-48)*0.8),0) -> -38
A85: 16 | C85: 0 | D85: 1 | E85: =SUM(C85/D85) -> 0.000 | F85: =ROUNDDOWN(((E85-48)*0.8),0) -> -38
A86: 17 | C86: 0 | D86: 1 | E86: =SUM(C86/D86) -> 0.000 | F86: =ROUNDDOWN(((E86-48)*0.8),0) -> -38
A87: 18 | C87: 0 | D87: 1 | E87: =SUM(C87/D87) -> 0.000 | F87: =ROUNDDOWN(((E87-48)*0.8),0) -> -38
A88: 19 | C88: 0 | D88: 1 | E88: =SUM(C88/D88) -> 0.000 | F88: =ROUNDDOWN(((E88-48)*0.8),0) -> -38
A89: 20 | C89: 0 | D89: 1 | E89: =SUM(C89/D89) -> 0.000 | F89: =ROUNDDOWN(((E89-48)*0.8),0) -> -38
A90: 21 | C90: 0 | D90: 1 | E90: =SUM(C90/D90) -> 0.000 | F90: =ROUNDDOWN(((E90-48)*0.8),0) -> -38
A91: 22 | C91: 0 | D91: 1 | E91: =SUM(C91/D91) -> 0.000 | F91: =ROUNDDOWN(((E91-48)*0.8),0) -> -38
A92: 23 | C92: 0 | D92: 1 | E92: =SUM(C92/D92) -> 0.000 | F92: =ROUNDDOWN(((E92-48)*0.8),0) -> -38
A93: 24 | C93: 0 | D93: 1 | E93: =SUM(C93/D93) -> 0.000 | F93: =ROUNDDOWN(((E93-48)*0.8),0) -> -38
A94: 25 | C94: 0 | D94: 1 | E94: =SUM(C94/D94) -> 0.000 | F94: =ROUNDDOWN(((E94-48)*0.8),0) -> -38
A95: 26 | C95: 0 | D95: 1 | E95: =SUM(C95/D95) -> 0.000 | F95: =ROUNDDOWN(((E95-48)*0.8),0) -> -38
A96: 27 | C96: 0 | D96: 1 | E96: =SUM(C96/D96) -> 0.000 | F96: =ROUNDDOWN(((E96-48)*0.8),0) -> -38
A97: 28 | C97: 0 | D97: 1 | E97: =SUM(C97/D97) -> 0.000 | F97: =ROUNDDOWN(((E97-48)*0.8),0) -> -38
A98: 29 | C98: 0 | D98: 1 | E98: =SUM(C98/D98) -> 0.000 | F98: =ROUNDDOWN(((E98-48)*0.8),0) -> -38
A99: 30 | C99: 0 | D99: 1 | E99: =SUM(C99/D99) -> 0.000 | F99: =ROUNDDOWN(((E99-48)*0.8),0) -> -38
A100: 6 | B100: Josh Spang | C100: 57 | D100: 1 | E100: =SUM(C100/D100) -> 57.000 | F100: 0 | G100: 57
A101: 7 | B101: Steve Callaway | C101: 60 | D101: 1 | E101: =SUM(C101/D101) -> 60.000 | F101: 0
A102: 8 | B102: Dan Lewis | C102: 63 | D102: 1 | E102: =SUM(C102/D102) -> 63.000 | F102: 0 | G102: 63
A103: 9 | B103: Dustin Nohr | C103: 64 | D103: 1 | E103: =SUM(C103/D103) -> 64.000 | F103: 0
A104: 10 | B104: Johnny Walker | C104: 64 | D104: 1 | E104: =SUM(C104/D104) -> 64.000 | F104: 0
A106: 2013 SBDGL Team Standings
B107: TEAM # | C107: BUSH | E107: Total Points | F107: Team Points | G107: Team Avg
A108: 1 | B108: 6 | C108: Ryan Clark & Ben Sandel | E108: 15 | F108: 5 | G108: =AVERAGE(E53,E31) -> 58.000
A109: 2 | B109: 8 | C109: Jesse Streinz & Bob Hernandez | E109: 13 | F109: 4 | G109: =AVERAGE(E29,E32) -> 56.285714285714285
A110: 3 | B110: 12 | C110: Ian Jacobs & Andrew Greco | E110: 12.5 | F110: 4 | G110: =AVERAGE(E6,E47) -> 54.714285714285715
A111: 4 | B111: 14 | C111: Matt Fritz & Jason Rimrodt | E111: 12.5 | F111: 3.5 | G111: =AVERAGE(E5,E42) -> 54.285714285714285
A112: 5 | B112: 7 | C112: Doug Johnson & Adam Stiers | E112: 12 | F112: 4 | G112: =AVERAGE(E11,E19) -> 53.928571428571431
A113: 6 | B113: 9 | C113: Tim Troyna & Pat Cutsforth | E113: 11.5 | F113: 4 | G113: =AVERAGE(E50,E62) -> 61.285714285714285
A114: 7 | B114: 16 | C114: Tim Peyton & Josh Beachy | E114: 11 | F114: 3.5 | G114: =AVERAGE(E8,E22) -> 53.44047619047619
A115: 8 | B115: 13 | C115: Matt Whitlock & Greg Dye | E115: 10.5 | F115: 3.5 | G115: =AVERAGE(E37,E67) -> 62.214285714285708
A116: 9 | B116: 4 | C116: Marty Reis & Travis Pike | E116: 9.5 | F116: 4 | G116: =AVERAGE(E36,E48) -> 57.857142857142861
A117: 10 | B117: 3 | C117: Erik Smith & KVN | E117: 9.5 | F117: 3 | G117: =AVERAGE(E58,E18) -> 58.285714285714285
A118: 11 | B118: 10 | C118: Adam Miller & Mitch Lerch | E118: 9.5 | F118: 3 | G118: =AVERAGE(E16,E64) -> 59.071428571428569
A119: 12 | B119: 1 | C119: D Burns & Adam Henderson | E119: 9.5 | F119: 3 | G119: =AVERAGE(E52,E57) -> 60.500
A120: 13 | B120: 11 | C120: Matt Weiben & Kirby Callanhan | E120: 8.5 | F120: 4 | G120: =AVERAGE(E26,E14) -> 54.785714285714285
A121: 14 | B121: 2 | C121: Sarah Potter & Kollin Grimm | E121: 8.5 | F121: 3 | G121: =AVERAGE(E33,E63) -> 59.928571428571431
A122: 15 | B122: 15 | C122: Nathan Veeder & Tony Rios | E122: 8 | F122: 2.5 | G122: =AVERAGE(E27,E39) -> 56.738095238095241
A123: 16 | B123: 5 | C123: Average Joe & Chris Clime | E123: 7 | F123: 2 | G123: =AVERAGE(E61,E34) -> 59.928571428571431
B125: TEAM # | C125: WHACKER
A126: 1 | B126: 23 | C126: Doug Peyton & Adam Chittenden | E126: 18 | F126: 7 | G126: =AVERAGE(E5,E55) -> 55.928571428571431
A127: 2 | B127: 30 | C127: Joel Knutson & Travis Fruendt | E127: 16.5 | F127: 6 | G127: =AVERAGE(E30,E38) -> 56.785714285714285
A128: 3 | B128: 29 | C128: Adam Olsen & Matt Shannon | E128: 15.5 | F128: 5 | G128: =AVERAGE(E4,E43) -> 52.500
A129: 4 | B129: 27 | C129: Kurt Conrad & Dan Kent | E129: 14.5 | F129: 5 | G129: =AVERAGE(E12,E23) -> 54.357142857142861
A130: 5 | B130: 17 | C130: Chuck Yanda & Nate Robbins | E130: 12.5 | F130: 4 | G130: =AVERAGE(E21,E45) -> 56.571428571428569
A131: 6 | B131: 21 | C131: Ryan Eggleston & Shane Thirtyacre | E131: 11.5 | F131: 3.5 | G131: =AVERAGE(E44,E56) -> 59.428571428571431
A132: 7 | B132: 22 | C132: Jeremy Farnsworth & Tony Ebson | E132: 11 | F132: 4 | G132: =AVERAGE(E10,E66) -> 58.642857142857139
A133: 8 | B133: 32 | C133: Dan Kern & Shirtless Bill | E133: 10.5 | F133: 3 | G133: =AVERAGE(E28,E9) -> 54.428571428571431
A134: 9 | B134: 24 | C134: Ryan Hamilton & Rob Mumma | E134: 10.5 | F134: 3 | G134: =AVERAGE(E40,E24) -> 56.571428571428569
A135: 10 | B135: 26 | C135: Joe French & Matt Wycoff | E135: 9.5 | F135: 3.5 | G135: =AVERAGE(E41,E20) -> 56.321428571428569
A136: 11 | B136: 19 | C136: Drew Detert & Anthony Moody | E136: 9 | F136: 3 | G136: =AVERAGE(E25,E54) -> 57.857142857142854
A137: 12 | B137: 28 | C137: Tim Potter & David McCuskey | E137: 7.5 | F137: 2.5 | G137: =AVERAGE(E15,E51) -> 57.000
A138: 13 | B138: 20 | C138: Dustin Utley & Tom Pepper | E138: 7.5 | F138: 2.5 | G138: =AVERAGE(E17,E60) -> 58.357142857142861
A139: 14 | B139: 25 | C139: Ryan Wodstrchill & Phil Campos | E139: 5.5 | F139: 2 | G139: =AVERAGE(E13,E35) -> 55.214285714285715
A140: 15 | B140: 31 | C140: Spencer Eubanks & Shawn Hullinger | E140: 4.5 | F140: 1 | G140: =AVERAGE(E59,E65) -> 63.142857142857146
A141: 16 | B141: 18 | C141: Jason Shook & Josh McFarland | E141: 4 | F141: 1 | G141: =AVERAGE(E46,E49) -> 58.321428571428569