A1: 2013 S.B.D.G.L. STANDINGS Through Week 11 Legion
A2: Rank | B2: Player | C2: Total Strokes | D2: Weeks | E2: Average | F2: H-Cap | G2: Last | H2: Week Pt. | I2: Total Pts. | J2: Sub Pts.
A4: =A3+1 -> 1 | B4: Adam Olsen | C4: 521 | D4: 11 | E4: =(C4/D4) -> 47.363636363636367 | F4: =ROUNDDOWN(((E4-48)*0.8),0) -> 0 | G4: 44 | H4: 0 | I4: 9
A5: =A4+1 -> 2 | B5: Jason Rimrodt | C5: 562 | D5: 11 | E5: =(C5/D5) -> 51.090909090909093 | F5: =ROUNDDOWN(((E5-48)*0.8),0) -> 2 | G5: 48 | H5: 0.5 | I5: 9
A6: 3 | B6: Doug Peyton | C6: 563 | D6: 11 | E6: =(C6/D6) -> 51.18181818181818 | F6: =ROUNDDOWN(((E6-48)*0.8),0) -> 2 | G6: 50 | H6: 0 | I6: 8
A7: =A6+1 -> 4 | B7: Andrew Greco | C7: 566 | D7: 11 | E7: =(C7/D7) -> 51.454545454545453 | F7: =ROUNDDOWN(((E7-48)*0.8),0) -> 2 | G7: 51 | H7: 0 | I7: 6.5
A8: =A7+1 -> 5 | B8: Tim Peyton | C8: 573 | D8: 11 | E8: =(C8/D8) -> 52.090909090909093 | F8: =ROUNDDOWN(((E8-48)*0.8),0) -> 3 | G8: 46 | H8: 1 | I8: 7
A9: =A8+1 -> 6 | B9: Dan Kern | C9: 576 | D9: 11 | E9: =(C9/D9) -> 52.363636363636367 | F9: =ROUNDDOWN(((E9-48)*0.8),0) -> 3 | G9: 54 | H9: 0 | I9: 5.5
A10: =A9+1 -> 7 | B10: Jeremy Farnsworth | C10: 527 | D10: 10 | E10: =(C10/D10) -> 52.700 | F10: =ROUNDDOWN(((E10-48)*0.8),0) -> 3 | G10: 47 | H10: 1 | I10: 6.5
A11: =A10+1 -> 8 | B11: Kurt Conrad | C11: 583 | D11: 11 | E11: =(C11/D11) -> 53.000 | F11: =ROUNDDOWN(((E11-48)*0.8),0) -> 4 | G11: 49 | H11: 0 | I11: 5
A12: =A11+1 -> 9 | B12: Doug Johnson | C12: 589 | D12: 11 | E12: =(C12/D12) -> 53.545454545454547 | F12: =ROUNDDOWN(((E12-48)*0.8),0) -> 4 | G12: 52 | H12: 0 | I12: 5.5
A13: =A12+1 -> 10 | B13: Josh Beachy | C13: 538 | D13: 10 | E13: =(C13/D13) -> 53.800 | F13: =ROUNDDOWN(((E13-48)*0.8),0) -> 4 | G13: 49 | H13: 1 | I13: 6.5
A14: =A13+1 -> 11 | B14: Ryan Wodstrchill | C14: 595 | D14: 11 | E14: =(C14/D14) -> 54.090909090909093 | F14: =ROUNDDOWN(((E14-48)*0.8),0) -> 4 | G14: 51 | H14: 1 | I14: 4.5
A15: =A14+1 -> 12 | B15: Nate Robbins | C15: 596 | D15: 11 | E15: =(C15/D15) -> 54.18181818181818 | F15: =ROUNDDOWN(((E15-48)*0.8),0) -> 4 | G15: 49 | H15: 1 | I15: 6.5
A16: =A15+1 -> 13 | B16: Matt Wieben | C16: 598 | D16: 11 | E16: =(C16/D16) -> 54.363636363636367 | F16: =ROUNDDOWN(((E16-48)*0.8),0) -> 5 | G16: 55 | H16: 0 | I16: 4
A17: =A16+1 -> 14 | B17: KVN Lavley | C17: 601 | D17: 11 | E17: =(C17/D17) -> 54.636363636363633 | F17: =ROUNDDOWN(((E17-48)*0.8),0) -> 5 | G17: 50 | H17: 1 | I17: 7.5
A18: =A17+1 -> 15 | B18: Dan Kent | C18: 602 | D18: 11 | E18: =(C18/D18) -> 54.727272727272727 | F18: =ROUNDDOWN(((E18-48)*0.8),0) -> 5 | G18: 53 | H18: 0 | I18: 7.5
A19: =A18+1 -> 16 | B19: Joe French | C19: 548 | D19: 10 | E19: =(C19/D19) -> 54.800 | F19: =ROUNDDOWN(((E19-48)*0.8),0) -> 5 | I19: 5
A20: =A19+1 -> 17 | B20: Dustin Utley | C20: 603 | D20: 11 | E20: =(C20/D20) -> 54.81818181818182 | F20: =ROUNDDOWN(((E20-48)*0.8),0) -> 5 | G20: 52 | H20: 1 | I20: 4
A21: =A20+1 -> 18 | B21: Drew Detert | C21: 604 | D21: 11 | E21: =(C21/D21) -> 54.909090909090907 | F21: =ROUNDDOWN(((E21-48)*0.8),0) -> 5 | G21: 48 | H21: 1 | I21: 5.5
A22: =A21+1 -> 19 | B22: Adam Miller | C22: 552 | D22: 10 | E22: =(C22/D22) -> 55.200 | F22: =ROUNDDOWN(((E22-48)*0.8),0) -> 5 | G22: 49 | H22: 1 | I22: 4
A23: =A22+1 -> 20 | B23: Tim Potter | C23: 608 | D23: 11 | E23: =(C23/D23) -> 55.272727272727273 | F23: =ROUNDDOWN(((E23-48)*0.8),0) -> 5 | G23: 54 | H23: 0 | I23: 4
A24: =A23+1 -> 21 | B24: Jesse Streinz | C24: 611 | D24: 11 | E24: =(C24/D24) -> 55.545454545454547 | F24: =ROUNDDOWN(((E24-48)*0.8),0) -> 6 | G24: 50 | H24: 0 | I24: 4
A25: =A24+1 -> 22 | B25: Kollin Grimm | C25: 612 | D25: 11 | E25: =(C25/D25) -> 55.636363636363633 | F25: =ROUNDDOWN(((E25-48)*0.8),0) -> 6 | G25: 51 | H25: 1 | I25: 5.5
A26: =A25+1 -> 23 | B26: Chris Clime | C26: 557 | D26: 10 | E26: =(C26/D26) -> 55.700 | F26: =ROUNDDOWN(((E26-48)*0.8),0) -> 6 | G26: 50 | H26: 1 | I26: 5
A27: =A26+1 -> 24 | B27: Rob Mumma | C27: 613 | D27: 11 | E27: =(C27/D27) -> 55.727272727272727 | F27: =ROUNDDOWN(((E27-48)*0.8),0) -> 6 | G27: 53 | H27: 1 | I27: 7.5
A28: =A27+1 -> 25 | B28: Greg Dye | C28: 558 | D28: 10 | E28: =(C28/D28) -> 55.800 | F28: =ROUNDDOWN(((E28-48)*0.8),0) -> 6 | G28: 53 | H28: 0 | I28: 7.5
A29: =A28+1 -> 26 | B29: Adam Stiers | C29: 615 | D29: 11 | E29: =(C29/D29) -> 55.909090909090907 | F29: =ROUNDDOWN(((E29-48)*0.8),0) -> 6 | G29: 52 | H29: 1 | I29: 6
A30: =A29+1 -> 27 | B30: Ryan Clark | C30: 616 | D30: 11 | E30: =(C30/D30) -> 56.000 | F30: =ROUNDDOWN(((E30-48)*0.8),0) -> 6 | G30: 55 | H30: 0 | I30: 7
A31: =A30+1 -> 28 | B31: Joel Knutson | C31: 616 | D31: 11 | E31: =(C31/D31) -> 56.000 | F31: =ROUNDDOWN(((E31-48)*0.8),0) -> 6 | G31: 58 | H31: 0 | I31: 6.5
A32: =A31+1 -> 29 | B32: Kirby Callahan | C32: 616 | D32: 11 | E32: =(C32/D32) -> 56.000 | F32: =ROUNDDOWN(((E32-48)*0.8),0) -> 6 | G32: 52 | H32: 1 | I32: 5.5
A33: =A32+1 -> 30 | B33: Bob Hernadez | C33: 618 | D33: 11 | E33: =(C33/D33) -> 56.18181818181818 | F33: =ROUNDDOWN(((E33-48)*0.8),0) -> 6 | G33: 56 | H33: 0 | I33: 7
A34: =A33+1 -> 31 | B34: Travis Fruendt | C34: 621 | D34: 11 | E34: =(C34/D34) -> 56.454545454545453 | F34: =ROUNDDOWN(((E34-48)*0.8),0) -> 6 | G34: 50 | H34: 1 | I34: 10
A35: =A34+1 -> 32 | B35: Shirtless Bill | C35: 621 | D35: 11 | E35: =(C35/D35) -> 56.454545454545453 | F35: =ROUNDDOWN(((E35-48)*0.8),0) -> 6 | G35: 54 | H35: 0 | I35: 6.5
A36: =A35+1 -> 33 | B36: Chuck Yanda | C36: 623 | D36: 11 | E36: =(C36/D36) -> 56.636363636363633 | F36: =ROUNDDOWN(((E36-48)*0.8),0) -> 6 | G36: 49 | H36: 1 | I36: 9
A37: =A36+1 -> 34 | B37: Phil Campos | C37: 510 | D37: 9 | E37: =(C37/D37) -> 56.666666666666664 | F37: =ROUNDDOWN(((E37-48)*0.8),0) -> 6 | G37: 53 | H37: 0 | I37: 2
A38: =A37+1 -> 35 | B38: Nate Veeder | C38: 624 | D38: 11 | E38: =(C38/D38) -> 56.727272727272727 | F38: =ROUNDDOWN(((E38-48)*0.8),0) -> 6 | G38: 54 | H38: 0 | I38: 3
A39: =A38+1 -> 36 | B39: Ryan Hamilton | C39: 625 | D39: 11 | E39: =(C39/D39) -> 56.81818181818182 | F39: =ROUNDDOWN(((E39-48)*0.8),0) -> 7 | G39: 56 | H39: 0 | I39: 6
A40: =A39+1 -> 37 | B40: Ian Jacobs | C40: 634 | D40: 11 | E40: =(C40/D40) -> 57.636363636363633 | F40: =ROUNDDOWN(((E40-48)*0.8),0) -> 7 | G40: 52 | H40: 1 | I40: 6
A41: =A40+1 -> 38 | B41: Travis Pike | C41: 634 | D41: 11 | E41: =(C41/D41) -> 57.636363636363633 | F41: =ROUNDDOWN(((E41-48)*0.8),0) -> 7 | G41: 54 | H41: 0.5 | I41: 4.5
A42: =A41+1 -> 39 | B42: Jason Shook | C42: 579 | D42: 10 | E42: =(C42/D42) -> 57.900 | F42: =ROUNDDOWN(((E42-48)*0.8),0) -> 7 | G42: 56 | H42: 1 | I42: 6
A43: =A42+1 -> 40 | B43: Ryan Eggleston | C43: 637 | D43: 11 | E43: =(C43/D43) -> 57.909090909090907 | F43: =ROUNDDOWN(((E43-48)*0.8),0) -> 7 | G43: 54 | H43: 1 | I43: 7
A44: =A43+1 -> 41 | B44: Matt Wyckoff | C44: 581 | D44: 10 | E44: =(C44/D44) -> 58.100 | F44: =ROUNDDOWN(((E44-48)*0.8),0) -> 8 | G44: 55 | H44: 1 | I44: 5
A45: =A44+1 -> 42 | B45: Martin Reis | C45: 641 | D45: 11 | E45: =(C45/D45) -> 58.272727272727273 | F45: =ROUNDDOWN(((E45-48)*0.8),0) -> 8 | G45: 56 | H45: 1 | I45: 5.5
A46: =A45+1 -> 43 | B46: Tony Rios | C46: 583 | D46: 10 | E46: =(C46/D46) -> 58.300 | F46: =ROUNDDOWN(((E46-48)*0.8),0) -> 8 | G46: 55 | H46: 0 | I46: 3.5
A47: =A46+1 -> 44 | B47: Matt Fritz | C47: 643 | D47: 11 | E47: =(C47/D47) -> 58.454545454545453 | F47: =ROUNDDOWN(((E47-48)*0.8),0) -> 8 | G47: 57 | H47: 0 | I47: 3
A48: =A47+1 -> 45 | B48: Josh McFarland | C48: 644 | D48: 11 | E48: =(C48/D48) -> 58.545454545454547 | F48: =ROUNDDOWN(((E48-48)*0.8),0) -> 8 | G48: 55 | H48: 1 | I48: 2
A49: =A48+1 -> 46 | B49: Matt Shannon | C49: 651 | D49: 11 | E49: =(C49/D49) -> 59.18181818181818 | F49: =ROUNDDOWN(((E49-48)*0.8),0) -> 8 | G49: 63 | H49: 0 | I49: 4.5
A50: =A49+1 -> 47 | B50: Ben Sandell | C50: 656 | D50: 11 | E50: =(C50/D50) -> 59.636363636363633 | F50: =ROUNDDOWN(((E50-48)*0.8),0) -> 9 | G50: 57 | H50: 0 | I50: 7.5
A51: =A50+1 -> 48 | B51: Anthony Moody | C51: 657 | D51: 11 | E51: =(C51/D51) -> 59.727272727272727 | F51: =ROUNDDOWN(((E51-48)*0.8),0) -> 9 | G51: 54 | H51: 1 | I51: 4.5
A52: =A51+1 -> 49 | B52: David McCuskey | C52: 658 | D52: 11 | E52: =(C52/D52) -> 59.81818181818182 | F52: =ROUNDDOWN(((E52-48)*0.8),0) -> 9 | G52: 57 | H52: 0 | I52: 3.5
A53: =A52+1 -> 50 | B53: Tim Troyna | C53: 602 | D53: 10 | E53: =(C53/D53) -> 60.200 | F53: =ROUNDDOWN(((E53-48)*0.8),0) -> 9 | G53: 57 | H53: 1 | I53: 5
A54: =A53+1 -> 51 | B54: Adam Henderson | C54: 672 | D54: 11 | E54: =(C54/D54) -> 61.090909090909093 | F54: =ROUNDDOWN(((E54-48)*0.8),0) -> 10 | G54: 57 | H54: 1 | I54: 5
A55: =A54+1 -> 52 | B55: Erik Smith | C55: 672 | D55: 11 | E55: =(C55/D55) -> 61.090909090909093 | F55: =ROUNDDOWN(((E55-48)*0.8),0) -> 10 | G55: 56 | H55: 1 | I55: 4
A56: 53 | B56: Adam Chittenden | C56: 674 | D56: 11 | E56: =(C56/D56) -> 61.272727272727273 | F56: =ROUNDDOWN(((E56-48)*0.8),0) -> 10 | G56: 56 | H56: 1 | I56: 6
A57: 54 | B57: Tom Pepper | C57: 556 | D57: 9 | E57: =(C57/D57) -> 61.777777777777779 | F57: =ROUNDDOWN(((E57-48)*0.8),0) -> 11 | G57: 57 | H57: 0 | I57: 4
A58: 55 | B58: Spencer Eubanks | C58: 682 | D58: 11 | E58: =(C58/D58) -> 62.000 | F58: =ROUNDDOWN(((E58-48)*0.8),0) -> 11 | G58: 61 | H58: 0 | I58: 2.5
A59: 56 | B59: Shane Thirtyacre | C59: 621 | D59: 10 | E59: =(C59/D59) -> 62.100 | F59: =ROUNDDOWN(((E59-48)*0.8),0) -> 11 | I59: 5 | J59: 1
A60: 57 | B60: Pat Cutsforth | C60: 687 | D60: 11 | E60: =(C60/D60) -> 62.454545454545453 | F60: =ROUNDDOWN(((E60-48)*0.8),0) -> 11 | G60: 61 | H60: 0 | I60: 7.5
A61: 58 | B61: Avg Joe | C61: 688 | D61: 11 | E61: =(C61/D61) -> 62.545454545454547 | F61: =ROUNDDOWN(((E61-48)*0.8),0) -> 11 | G61: 54 | H61: 1 | I61: 3
A62: 59 | B62: D Burns | C62: 689 | D62: 11 | E62: =(C62/D62) -> 62.636363636363633 | F62: =ROUNDDOWN(((E62-48)*0.8),0) -> 11 | G62: 59 | H62: 0 | I62: 3
A63: 60 | B63: Mitch Lerch | C63: 692 | D63: 11 | E63: =(C63/D63) -> 62.909090909090907 | F63: =ROUNDDOWN(((E63-48)*0.8),0) -> 11 | G63: 58 | H63: 1 | I63: 7
A64: 61 | B64: Sarah Potter | C64: 706 | D64: 11 | E64: =(C64/D64) -> 64.181818181818187 | F64: =ROUNDDOWN(((E64-48)*0.8),0) -> 12 | G64: 64 | H64: 0 | I64: 3.5
A65: 62 | B65: Shawn Hullinger | C65: 708 | D65: 11 | E65: =(C65/D65) -> 64.36363636363636 | F65: =ROUNDDOWN(((E65-48)*0.8),0) -> 13 | G65: 64 | H65: 0 | I65: 4.5
A66: 63 | B66: Tony Ebson | C66: 711 | D66: 11 | E66: =(C66/D66) -> 64.63636363636364 | F66: =ROUNDDOWN(((E66-48)*0.8),0) -> 13 | G66: 58 | H66: 1 | I66: 5.5
A67: 64 | B67: Matt Whitlock | C67: 730 | D67: 11 | E67: =(C67/D67) -> 66.36363636363636 | F67: =ROUNDDOWN(((E67-48)*0.8),0) -> 14 | G67: 64 | H67: 0 | I67: 5
A69: Subs | B69: Player | C69: Total Strokes | D69: Weeks | E69: Average | F69: H-Cap | G69: Last | H69: Week Pt. | I69: Total Pts. | J69: Subed For
A70: 1 | B70: Adam Karstens | C70: 286 | D70: 5 | E70: =SUM(C70/D70) -> 57.200 | F70: =ROUNDDOWN(((E70-48)*0.8),0) -> 7 | I70: 1.5
A71: 2 | B71: Dustin Snodgress | C71: 314 | D71: 5 | E71: =SUM(C71/D71) -> 62.800 | F71: =ROUNDDOWN(((E71-48)*0.8),0) -> 11
A72: 3 | B72: Archie Coulter | C72: 230 | D72: 4 | E72: =SUM(C72/D72) -> 57.500 | F72: =ROUNDDOWN(((E72-48)*0.8),0) -> 7 | G72: 56 | I72: 0.5
A73: 4 | B73: Josh Spang | C73: 166 | D73: 3 | E73: =SUM(C73/D73) -> 55.333333333333336 | F73: =ROUNDDOWN(((E73-48)*0.8),0) -> 5 | I73: 0.5
A74: 5 | B74: Dan Lewis | C74: 173 | D74: 3 | E74: =SUM(C74/D74) -> 57.666666666666664 | F74: =ROUNDDOWN(((E74-48)*0.8),0) -> 7 | G74: 54 | H74: 1 | I74: 1 | J74: THIRTY
A75: 6 | B75: Kerri Haught | C75: 124 | D75: 2 | E75: =SUM(C75/D75) -> 62.000 | F75: =ROUNDDOWN(((E75-48)*0.8),0) -> 11
A76: 7 | B76: Steve Callaway | C76: 125 | D76: 2 | E76: =SUM(C76/D76) -> 62.500 | F76: =ROUNDDOWN(((E76-48)*0.8),0) -> 11
A77: 8 | B77: Matt Snyder | C77: 162 | D77: 2 | E77: =SUM(C77/D77) -> 81.000 | F77: =ROUNDDOWN(((E77-48)*0.8),0) -> 26
A78: 9 | B78: Apollo | C78: 54 | D78: 1 | E78: =SUM(C78/D78) -> 54.000 | F78: 0 | G78: 54
A79: 10 | B79: Mike Noth | C79: 57 | D79: 1 | E79: =SUM(C79/D79) -> 57.000 | F79: 0 | G79: 57
A80: 11 | B80: Mike William | C80: 53 | D80: 1 | E80: =SUM(C80/D80) -> 53.000 | F80: 0
A81: 12 | B81: Kevin Stibal | C81: 56 | D81: 1 | E81: =SUM(C81/D81) -> 56.000 | F81: 0 | I81: 1
A82: 13 | B82: Jack Gilmore | C82: 59 | D82: 1 | E82: =SUM(C82/D82) -> 59.000 | F82: 0
A83: 14 | B83: Jesse Kirk | C83: 60 | D83: 1 | E83: =SUM(C83/D83) -> 60.000 | F83: 0
A84: 15 | B84: Dustin Nohr | C84: 64 | D84: 1 | E84: =SUM(C84/D84) -> 64.000 | F84: 0
A85: 16 | B85: Johnny Walker | C85: 64 | D85: 1 | E85: =SUM(C85/D85) -> 64.000 | F85: 0
A86: 17 | B86: Craig Eastin | C86: 65 | D86: 1 | E86: =SUM(C86/D86) -> 65.000 | F86: 0
A87: 18 | B87: Sills | C87: 65 | D87: 1 | E87: =SUM(C87/D87) -> 65.000 | F87: 0
A88: 19 | C88: 0 | D88: 1 | E88: =SUM(C88/D88) -> 0.000 | F88: =ROUNDDOWN(((E88-50)*0.8),0) -> -40
A89: 20 | C89: 0 | D89: 1 | E89: =SUM(C89/D89) -> 0.000 | F89: =ROUNDDOWN(((E89-50)*0.8),0) -> -40
A90: 21 | C90: 0 | D90: 1 | E90: =SUM(C90/D90) -> 0.000 | F90: =ROUNDDOWN(((E90-50)*0.8),0) -> -40
A91: 22 | C91: 0 | D91: 1 | E91: =SUM(C91/D91) -> 0.000 | F91: =ROUNDDOWN(((E91-50)*0.8),0) -> -40
A92: 23 | C92: 0 | D92: 1 | E92: =SUM(C92/D92) -> 0.000 | F92: =ROUNDDOWN(((E92-50)*0.8),0) -> -40
A93: 24 | C93: 0 | D93: 1 | E93: =SUM(C93/D93) -> 0.000 | F93: =ROUNDDOWN(((E93-50)*0.8),0) -> -40
A94: 25 | C94: 0 | D94: 1 | E94: =SUM(C94/D94) -> 0.000 | F94: =ROUNDDOWN(((E94-50)*0.8),0) -> -40
A95: 26 | C95: 0 | D95: 1 | E95: =SUM(C95/D95) -> 0.000 | F95: =ROUNDDOWN(((E95-50)*0.8),0) -> -40
A96: 27 | C96: 0 | D96: 1 | E96: =SUM(C96/D96) -> 0.000 | F96: =ROUNDDOWN(((E96-50)*0.8),0) -> -40
A97: 28 | C97: 0 | D97: 1 | E97: =SUM(C97/D97) -> 0.000 | F97: =ROUNDDOWN(((E97-50)*0.8),0) -> -40
A98: 29 | C98: 0 | D98: 1 | E98: =SUM(C98/D98) -> 0.000 | F98: =ROUNDDOWN(((E98-50)*0.8),0) -> -40
A99: 30 | C99: 0 | D99: 1 | E99: =SUM(C99/D99) -> 0.000 | F99: =ROUNDDOWN(((E99-50)*0.8),0) -> -40
A103: 2013 SBDGL Team Standings
B104: TEAM # | C104: BUSH | E104: Total Points | F104: Team Points | G104: Team Avg
A105: 1 | B105: 6 | C105: Ryan Clark & Ben Sandel | E105: 21.5 | F105: 7 | G105: =AVERAGE(E50,E30) -> 57.818181818181813
A106: 2 | B106: 16 | C106: Tim Peyton & Josh Beachy | E106: 21 | F106: 7.5 | G106: =AVERAGE(E13,E8) -> 52.945454545454545
A107: 3 | B107: 12 | C107: Ian Jacobs & Andrew Greco | E107: 20 | F107: 7.5 | G107: =AVERAGE(E40,E7) -> 54.545454545454547
A108: 4 | B108: 13 | C108: Matt Whitlock & Greg Dye | E108: 19 | F108: 6.5 | G108: =AVERAGE(E28,E67) -> 61.081818181818178
A109: 5 | B109: 9 | C109: Tim Troyna & Pat Cutsforth | E109: 18.5 | F109: 6 | G109: =AVERAGE(E53,E60) -> 61.327272727272728
A110: 6 | B110: 7 | C110: Doug Johnson & Adam Stiers | E110: 17.5 | F110: 6 | G110: =AVERAGE(E12,E29) -> 54.727272727272727
A111: 7 | B111: 4 | C111: Marty Reis & Travis Pike | E111: 16.5 | F111: 6.5 | G111: =AVERAGE(E45,E41) -> 57.954545454545453
A112: 8 | B112: 3 | C112: Erik Smith & KVN | E112: 16.5 | F112: 5 | G112: =AVERAGE(E55,E17) -> 57.86363636363636
A113: 9 | B113: 14 | C113: Matt Fritz & Jason Rimrodt | E113: 16.5 | F113: 4.5 | G113: =AVERAGE(E5,E47) -> 54.772727272727273
A114: 10 | B114: 10 | C114: Adam Miller & Mitch Lerch | E114: 16 | F114: 5 | G114: =AVERAGE(E22,E63) -> 59.054545454545455
A115: 11 | B115: 11 | C115: Matt Weiben & Kirby Callanhan | E115: 15.5 | F115: 6 | G115: =AVERAGE(E32,E16) -> 55.181818181818187
A116: 12 | B116: 8 | C116: Jesse Streinz & Bob Hernandez | E116: 15 | F116: 4 | G116: =AVERAGE(E24,E33) -> 55.86363636363636
A117: 13 | B117: 2 | C117: Sarah Potter & Kollin Grimm | E117: 13 | F117: 4 | G117: =AVERAGE(E25,E64) -> 59.909090909090907
A118: 14 | B118: 5 | C118: Average Joe & Chris Clime | E118: 12 | F118: 4 | G118: =AVERAGE(E61,E26) -> 59.122727272727275
A119: 15 | B119: 1 | C119: D Burns & Adam Henderson | E119: 12 | F119: 4 | G119: =AVERAGE(E62,E54) -> 61.86363636363636
A120: 16 | B120: 15 | C120: Nathan Veeder & Tony Rios | E120: 9 | F120: 2.5 | G120: =AVERAGE(E38,E46) -> 57.513636363636365
B122: TEAM # | C122: WHACKER
A123: 1 | B123: 30 | C123: Joel Knutson & Travis Fruendt | E123: 25 | F123: 8.5 | G123: =AVERAGE(E34,E31) -> 56.227272727272727
A124: 2 | B124: 23 | C124: Doug Peyton & Adam Chittenden | E124: 22.5 | F124: 8.5 | G124: =AVERAGE(E6,E56) -> 56.227272727272727
A125: 3 | B125: 17 | C125: Chuck Yanda & Nate Robbins | E125: 21.5 | F125: 7 | G125: =AVERAGE(E15,E36) -> 55.409090909090907
A126: 4 | B126: 27 | C126: Kurt Conrad & Dan Kent | E126: 20.5 | F126: 8 | G126: =AVERAGE(E11,E18) -> 53.86363636363636
A127: 5 | B127: 29 | C127: Adam Olsen & Matt Shannon | E127: 19.5 | F127: 6 | G127: =AVERAGE(E4,E49) -> 53.272727272727273
A128: 6 | B128: 24 | C128: Ryan Hamilton & Rob Mumma | E128: 20 | F128: 6.5 | G128: =AVERAGE(E39,E27) -> 56.272727272727273
A129: 7 | B129: 22 | C129: Jeremy Farnsworth & Tony Ebson | E129: 19 | F129: 7 | G129: =AVERAGE(E10,E66) -> 58.668181818181822
A130: 8 | B130: 21 | C130: Ryan Eggleston & Shane Thirtyacre | E130: 19 | F130: 6 | G130: =AVERAGE(E43,E59) -> 60.00454545454545
A131: 9 | B131: 32 | C131: Dan Kern & Shirtless Bill | E131: 17.5 | F131: 5.5 | G131: =AVERAGE(E35,E9) -> 54.409090909090907
A132: 10 | B132: 26 | C132: Joe French & Matt Wycoff | E132: 15.5 | F132: 5.5 | G132: =AVERAGE(E44,E19) -> 56.450
A133: 11 | B133: 19 | C133: Drew Detert & Anthony Moody | E133: 15 | F133: 5 | G133: =AVERAGE(E21,E51) -> 57.318181818181813
A134: 12 | B134: 20 | C134: Dustin Utley & Tom Pepper | E134: 12.5 | F134: 4.5 | G134: =AVERAGE(E20,E57) -> 58.297979797979799
A135: 13 | B135: 28 | C135: Tim Potter & David McCuskey | E135: 11 | F135: 3.5 | G135: =AVERAGE(E23,E52) -> 57.545454545454547
A136: 14 | B136: 25 | C136: Ryan Wodstrchill & Phil Campos | E136: 10.5 | F136: 4 | G136: =AVERAGE(E14,E37) -> 55.378787878787875
A137: 15 | B137: 18 | C137: Jason Shook & Josh McFarland | E137: 10 | F137: 2 | G137: =AVERAGE(E48,E42) -> 58.222727272727269
A138: 16 | B138: 31 | C138: Spencer Eubanks & Shawn Hullinger | E138: 9.5 | F138: 2.5 | G138: =AVERAGE(E58,E65) -> 63.18181818181818