A1: 2013 S.B.D.G.L. STANDINGS Through Week 16 Turkey Creek
A2: Rank | B2: Player | C2: Total Strokes | D2: Weeks | E2: Average | F2: H-Cap | G2: Last | H2: Week Pt. | I2: Total Pts. | J2: Sub Pts.
A4: =A3+1 -> 1 | B4: Adam Olsen | C4: 750 | D4: 16 | E4: =(C4/D4) -> 46.875 | F4: =ROUNDDOWN(((E4-48)*0.8),0) -> 0 | G4: 44 | H4: 0.5 | I4: 13.5
A5: =A4+1 -> 2 | B5: Doug Peyton | C5: 807 | D5: 16 | E5: =(C5/D5) -> 50.4375 | F5: =ROUNDDOWN(((E5-48)*0.8),0) -> 1 | G5: 41 | H5: 1 | I5: 10
A6: =A5+1 -> 3 | B6: Jason Rimrodt | C6: 812 | D6: 16 | E6: =(C6/D6) -> 50.750 | F6: =ROUNDDOWN(((E6-48)*0.8),0) -> 2 | G6: 47 | H6: 1 | I6: 10.5
A7: =A6+1 -> 4 | B7: Andrew Greco | C7: 816 | D7: 16 | E7: =(C7/D7) -> 51.000 | F7: =ROUNDDOWN(((E7-48)*0.8),0) -> 2 | G7: 53 | H7: 0 | I7: 10.5
A8: =A7+1 -> 5 | B8: Dan Kern | C8: 821 | D8: 16 | E8: =(C8/D8) -> 51.3125 | F8: =ROUNDDOWN(((E8-48)*0.8),0) -> 2 | G8: 49 | H8: 1 | I8: 10
A9: =A8+1 -> 6 | B9: Jeremy Farnsworth | C9: 770 | D9: 15 | E9: =(C9/D9) -> 51.333333333333336 | F9: =ROUNDDOWN(((E9-48)*0.8),0) -> 2 | G9: 46 | H9: 0.5 | I9: 10
A10: =A9+1 -> 7 | B10: Tim Peyton | C10: 826 | D10: 16 | E10: =(C10/D10) -> 51.625 | F10: =ROUNDDOWN(((E10-48)*0.8),0) -> 2 | G10: 49 | H10: 1 | I10: 10
A11: =A10+1 -> 8 | B11: Kurt Conrad | C11: 835 | D11: 16 | E11: =(C11/D11) -> 52.1875 | F11: =ROUNDDOWN(((E11-48)*0.8),0) -> 3 | G11: 49 | H11: 1 | I11: 8.5
A12: =A11+1 -> 9 | B12: Josh Beachy | C12: 789 | D12: 15 | E12: =(C12/D12) -> 52.600 | F12: =ROUNDDOWN(((E12-48)*0.8),0) -> 3 | G12: 48 | H12: 1 | I12: 9
A13: =A12+1 -> 10 | B13: Ryan Wodstrchill | C13: 850 | D13: 16 | E13: =(C13/D13) -> 53.125 | F13: =ROUNDDOWN(((E13-48)*0.8),0) -> 4 | G13: 50 | H13: 0 | I13: 7.5
A14: =A13+1 -> 11 | B14: Doug Johnson | C14: 852 | D14: 16 | E14: =(C14/D14) -> 53.250 | F14: =ROUNDDOWN(((E14-48)*0.8),0) -> 4 | G14: 54 | H14: 0 | I14: 6.5
A15: =A14+1 -> 12 | B15: KVN Lavley | C15: 852 | D15: 16 | E15: =(C15/D15) -> 53.250 | F15: =ROUNDDOWN(((E15-48)*0.8),0) -> 4 | G15: 47 | H15: 1 | I15: 12
A16: =A15+1 -> 13 | B16: Matt Wieben | C16: 853 | D16: 16 | E16: =(C16/D16) -> 53.3125 | F16: =ROUNDDOWN(((E16-48)*0.8),0) -> 4 | G16: 50 | H16: 1 | I16: 8
A17: =A16+1 -> 14 | B17: Nate Robbins | C17: 857 | D17: 16 | E17: =(C17/D17) -> 53.5625 | F17: =ROUNDDOWN(((E17-48)*0.8),0) -> 4 | G17: 53 | H17: 0 | I17: 9.5
A18: =A17+1 -> 15 | B18: Dan Kent | C18: 857 | D18: 16 | E18: =(C18/D18) -> 53.5625 | F18: =ROUNDDOWN(((E18-48)*0.8),0) -> 4 | G18: 49 | H18: 1 | I18: 11.5
A19: =A18+1 -> 16 | B19: Adam Miller | C19: 808 | D19: 15 | E19: =(C19/D19) -> 53.866666666666667 | F19: =ROUNDDOWN(((E19-48)*0.8),0) -> 4 | G19: 49 | H19: 0 | I19: 7
A20: =A19+1 -> 17 | B20: Joe French | C20: 756 | D20: 14 | E20: =(C20/D20) -> 54.000 | F20: =ROUNDDOWN(((E20-48)*0.8),0) -> 4 | G20: 52 | H20: 1 | I20: 8
A21: =A20+1 -> 18 | B21: Greg Dye | C21: 819 | D21: 15 | E21: =(C21/D21) -> 54.600 | F21: =ROUNDDOWN(((E21-48)*0.8),0) -> 5 | G21: 48 | H21: 1 | I21: 11.5
A22: =A21+1 -> 19 | B22: Kirby Callahan | C22: 875 | D22: 16 | E22: =(C22/D22) -> 54.6875 | F22: =ROUNDDOWN(((E22-48)*0.8),0) -> 5 | G22: 54 | H22: 1 | I22: 8.5
A23: =A22+1 -> 20 | B23: Tim Potter | C23: 875 | D23: 16 | E23: =(C23/D23) -> 54.6875 | F23: =ROUNDDOWN(((E23-48)*0.8),0) -> 5 | G23: 48 | H23: 1 | I23: 7
A24: =A23+1 -> 21 | B24: Dustin Utley | C24: 876 | D24: 16 | E24: =(C24/D24) -> 54.750 | F24: =ROUNDDOWN(((E24-48)*0.8),0) -> 5 | G24: 52 | H24: 0 | I24: 5
A25: =A24+1 -> 22 | B25: Bob Hernadez | C25: 879 | D25: 16 | E25: =(C25/D25) -> 54.9375 | F25: =ROUNDDOWN(((E25-48)*0.8),0) -> 5 | G25: 54 | H25: 1 | I25: 11.5
A26: =A25+1 -> 23 | B26: Ryan Clark | C26: 880 | D26: 16 | E26: =(C26/D26) -> 55.000 | F26: =ROUNDDOWN(((E26-48)*0.8),0) -> 5 | G26: 52 | H26: 0 | I26: 8
A27: =A26+1 -> 24 | B27: Drew Detert | C27: 881 | D27: 16 | E27: =(C27/D27) -> 55.0625 | F27: =ROUNDDOWN(((E27-48)*0.8),0) -> 5 | G27: 54 | H27: 0 | I27: 6
A28: =A27+1 -> 25 | B28: Adam Stiers | C28: 827 | D28: 15 | E28: =(C28/D28) -> 55.133333333333333 | F28: =ROUNDDOWN(((E28-48)*0.8),0) -> 5 | G28: 56 | H28: 0 | I28: 7
A29: =A28+1 -> 26 | B29: Chris Clime | C29: 827 | D29: 15 | E29: =(C29/D29) -> 55.133333333333333 | F29: =ROUNDDOWN(((E29-48)*0.8),0) -> 5 | G29: 54 | H29: 1 | I29: 8.5
A30: =A29+1 -> 27 | B30: Chuck Yanda | C30: 884 | D30: 16 | E30: =(C30/D30) -> 55.250 | F30: =ROUNDDOWN(((E30-48)*0.8),0) -> 5 | G30: 55 | H30: 0 | I30: 13
A31: =A30+1 -> 28 | B31: Travis Fruendt | C31: 884 | D31: 16 | E31: =(C31/D31) -> 55.250 | F31: =ROUNDDOWN(((E31-48)*0.8),0) -> 5 | G31: 52 | H31: 0 | I31: 12
A32: =A31+1 -> 29 | B32: Kollin Grimm | C32: 886 | D32: 16 | E32: =(C32/D32) -> 55.375 | F32: =ROUNDDOWN(((E32-48)*0.8),0) -> 5 | G32: 59 | H32: 0 | I32: 6.5
A33: =A32+1 -> 30 | B33: Jesse Streinz | C33: 886 | D33: 16 | E33: =(C33/D33) -> 55.375 | F33: =ROUNDDOWN(((E33-48)*0.8),0) -> 5 | G33: 57 | H33: 1 | I33: 7
A34: =A33+1 -> 31 | B34: Joel Knutson | C34: 892 | D34: 16 | E34: =(C34/D34) -> 55.750 | F34: =ROUNDDOWN(((E34-48)*0.8),0) -> 6 | G34: 54 | H34: 0.5 | I34: 8
A35: =A34+1 -> 32 | B35: Rob Mumma | C35: 893 | D35: 16 | E35: =(C35/D35) -> 55.8125 | F35: =ROUNDDOWN(((E35-48)*0.8),0) -> 6 | G35: 57 | H35: 0 | I35: 8.5
A36: =A35+1 -> 33 | B36: Ryan Hamilton | C36: 893 | D36: 16 | E36: =(C36/D36) -> 55.8125 | F36: =ROUNDDOWN(((E36-48)*0.8),0) -> 6 | G36: 53 | H36: 0 | I36: 8
A37: =A36+1 -> 34 | B37: Nate Veeder | C37: 901 | D37: 16 | E37: =(C37/D37) -> 56.3125 | F37: =ROUNDDOWN(((E37-48)*0.8),0) -> 6 | G37: 58 | H37: 0 | I37: 4
A38: =A37+1 -> 35 | B38: Shirtless Bill | C38: 902 | D38: 16 | E38: =(C38/D38) -> 56.375 | F38: =ROUNDDOWN(((E38-48)*0.8),0) -> 6 | G38: 55 | H38: 1 | I38: 9.5
A39: =A38+1 -> 36 | B39: Phil Campos | C39: 737 | D39: 13 | E39: =(C39/D39) -> 56.692307692307693 | F39: =ROUNDDOWN(((E39-48)*0.8),0) -> 6 | G39: 0 | H39: 0 | I39: 3 | J39: 0
A40: =A39+1 -> 37 | B40: Jason Shook | C40: 851 | D40: 15 | E40: =(C40/D40) -> 56.733333333333334 | F40: =ROUNDDOWN(((E40-48)*0.8),0) -> 6 | G40: 52 | H40: 1 | I40: 8
A41: =A40+1 -> 38 | B41: Ian Jacobs | C41: 909 | D41: 16 | E41: =(C41/D41) -> 56.8125 | F41: =ROUNDDOWN(((E41-48)*0.8),0) -> 7 | G41: 59 | H41: 0 | I41: 8
A42: =A41+1 -> 39 | B42: Ryan Eggleston | C42: 913 | D42: 16 | E42: =(C42/D42) -> 57.0625 | F42: =ROUNDDOWN(((E42-48)*0.8),0) -> 7 | G42: 53 | H42: 0 | I42: 8
A43: =A42+1 -> 40 | B43: Matt Wyckoff | C43: 858 | D43: 15 | E43: =(C43/D43) -> 57.200 | F43: =ROUNDDOWN(((E43-48)*0.8),0) -> 7 | G43: 51 | H43: 1 | I43: 8
A44: =A43+1 -> 41 | B44: Martin Reis | C44: 916 | D44: 16 | E44: =(C44/D44) -> 57.250 | F44: =ROUNDDOWN(((E44-48)*0.8),0) -> 7 | G44: 56 | H44: 0 | I44: 6.5
A45: =A44+1 -> 42 | B45: Josh McFarland | C45: 918 | D45: 16 | E45: =(C45/D45) -> 57.375 | F45: =ROUNDDOWN(((E45-48)*0.8),0) -> 7 | G45: 55 | H45: 1 | I45: 5
A46: =A45+1 -> 43 | B46: Travis Pike | C46: 811 | D46: 14 | E46: =(C46/D46) -> 57.928571428571431 | F46: =ROUNDDOWN(((E46-48)*0.8),0) -> 7 | G46: 61 | H46: 0 | I46: 7.5
A47: =A46+1 -> 44 | B47: Tony Rios | C47: 697 | D47: 12 | E47: =(C47/D47) -> 58.083333333333336 | F47: =ROUNDDOWN(((E47-48)*0.8),0) -> 8 | G47: 0 | H47: 0 | I47: 4.5 | J47: 0
A48: =A47+1 -> 45 | B48: Matt Fritz | C48: 930 | D48: 16 | E48: =(C48/D48) -> 58.125 | F48: =ROUNDDOWN(((E48-48)*0.8),0) -> 8 | G48: 58 | H48: 1 | I48: 5
A49: =A48+1 -> 46 | B49: Anthony Moody | C49: 938 | D49: 16 | E49: =(C49/D49) -> 58.625 | F49: =ROUNDDOWN(((E49-48)*0.8),0) -> 8 | G49: 54 | H49: 0 | I49: 6.5
A50: =A49+1 -> 47 | B50: Ben Sandell | C50: 939 | D50: 16 | E50: =(C50/D50) -> 58.6875 | F50: =ROUNDDOWN(((E50-48)*0.8),0) -> 8 | G50: 57 | H50: 1 | I50: 10.5
A51: =A50+1 -> 48 | B51: Matt Shannon | C51: 943 | D51: 16 | E51: =(C51/D51) -> 58.9375 | F51: =ROUNDDOWN(((E51-48)*0.8),0) -> 8 | G51: 58 | H51: 0 | I51: 5
A52: =A51+1 -> 49 | B52: Tim Troyna | C52: 887 | D52: 15 | E52: =(C52/D52) -> 59.133333333333333 | F52: =ROUNDDOWN(((E52-48)*0.8),0) -> 8 | G52: 60 | H52: 1 | I52: 7
A53: =A52+1 -> 50 | B53: David McCuskey | C53: 950 | D53: 16 | E53: =(C53/D53) -> 59.375 | F53: =ROUNDDOWN(((E53-48)*0.8),0) -> 9 | G53: 50 | H53: 1 | I53: 5.5
A54: =A53+1 -> 51 | B54: Erik Smith | C54: 965 | D54: 16 | E54: =(C54/D54) -> 60.3125 | F54: =ROUNDDOWN(((E54-48)*0.8),0) -> 9 | G54: 59 | H54: 0 | I54: 6.5
A55: =A54+1 -> 52 | B55: Adam Chittenden | C55: 968 | D55: 16 | E55: =(C55/D55) -> 60.500 | F55: =ROUNDDOWN(((E55-48)*0.8),0) -> 10 | G55: 58 | H55: 0.5 | I55: 8
A56: 53 | B56: Adam Henderson | C56: 970 | D56: 16 | E56: =(C56/D56) -> 60.625 | F56: =ROUNDDOWN(((E56-48)*0.8),0) -> 10 | G56: 67 | H56: 0 | I56: 7
A57: 54 | B57: Spencer Eubanks | C57: 975 | D57: 16 | E57: =(C57/D57) -> 60.9375 | F57: =ROUNDDOWN(((E57-48)*0.8),0) -> 10 | G57: 59 | H57: 1 | I57: 6
A58: 55 | B58: Tom Pepper | C58: 857 | D58: 14 | E58: =(C58/D58) -> 61.214285714285715 | F58: =ROUNDDOWN(((E58-48)*0.8),0) -> 10 | G58: 57 | H58: 0 | I58: 7
A59: 56 | B59: Shane Thirtyacre | C59: 860 | D59: 14 | E59: =(C59/D59) -> 61.428571428571431 | F59: =ROUNDDOWN(((E59-48)*0.8),0) -> 10 | G59: 57 | H59: 0 | I59: 7.5
A60: 57 | B60: D Burns | C60: 984 | D60: 16 | E60: =(C60/D60) -> 61.500 | F60: =ROUNDDOWN(((E60-48)*0.8),0) -> 10 | G60: 60 | H60: 0 | I60: 4
A61: 58 | B61: Mitch Lerch | C61: 990 | D61: 16 | E61: =(C61/D61) -> 61.875 | F61: =ROUNDDOWN(((E61-48)*0.8),0) -> 11 | G61: 60 | H61: 1 | I61: 11.5
A62: 59 | B62: Pat Cutsforth | C62: 992 | D62: 16 | E62: =(C62/D62) -> 62.000 | F62: =ROUNDDOWN(((E62-48)*0.8),0) -> 11 | G62: 62 | H62: 1 | I62: 11
A63: 60 | B63: Avg Joe | C63: 996 | D63: 16 | E63: =(C63/D63) -> 62.250 | F63: =ROUNDDOWN(((E63-48)*0.8),0) -> 11 | G63: 62 | H63: 1 | I63: 6
A64: 61 | B64: Tony Ebson | C64: 1014 | D64: 16 | E64: =(C64/D64) -> 63.375 | F64: =ROUNDDOWN(((E64-48)*0.8),0) -> 12 | G64: 59 | H64: 1 | I64: 9
A65: 62 | B65: Sarah Potter | C65: 1016 | D65: 16 | E65: =(C65/D65) -> 63.500 | F65: =ROUNDDOWN(((E65-48)*0.8),0) -> 12 | G65: 64 | H65: 0 | I65: 6.5
A66: 63 | B66: Shawn Hullinger | C66: 1016 | D66: 16 | E66: =(C66/D66) -> 63.500 | F66: =ROUNDDOWN(((E66-48)*0.8),0) -> 12 | G66: 58 | H66: 1 | I66: 6.5
A67: 64 | B67: Matt Whitlock | C67: 992 | D67: 15 | E67: =(C67/D67) -> 66.13333333333334 | F67: =ROUNDDOWN(((E67-48)*0.8),0) -> 14 | G67: 66 | H67: 0 | I67: 6
A69: Subs | B69: Player | C69: Total Strokes | D69: Weeks | E69: Average | F69: H-Cap | G69: Last | H69: Week Pt. | I69: Total Pts. | J69: Subed For
A70: 1 | B70: Adam Karstens | C70: 499 | D70: 9 | E70: =SUM(C70/D70) -> 55.444444444444443 | F70: =ROUNDDOWN(((E70-48)*0.8),0) -> 5 | G70: 55 | I70: 3.5
A71: 2 | B71: Archie Coulter | C71: 338 | D71: 6 | E71: =SUM(C71/D71) -> 56.333333333333336 | F71: =ROUNDDOWN(((E71-48)*0.8),0) -> 6 | I71: 1.5
A72: 3 | B72: Dan Lewis | C72: 340 | D72: 6 | E72: =SUM(C72/D72) -> 56.666666666666664 | F72: =ROUNDDOWN(((E72-48)*0.8),0) -> 6 | G72: 51 | I72: 1
A73: 2 | B73: Josh Spang | C73: 264 | D73: 5 | E73: =SUM(C73/D73) -> 52.800 | F73: =ROUNDDOWN(((E73-48)*0.8),0) -> 3 | I73: 1.5
A74: 3 | B74: Dustin Snodgress | C74: 314 | D74: 5 | E74: =SUM(C74/D74) -> 62.800 | F74: =ROUNDDOWN(((E74-48)*0.8),0) -> 11
A75: =SUM(A74+1) -> 4 | B75: Jason Sills | C75: 179 | D75: 3 | E75: =SUM(C75/D75) -> 59.666666666666664 | F75: =ROUNDDOWN(((E75-48)*0.8),0) -> 9 | G75: 60 | H75: 0 | I75: 0 | J75: Campos
A76: =SUM(A75+1) -> 5 | B76: Steve Callaway | C76: 185 | D76: 3 | E76: =SUM(C76/D76) -> 61.666666666666664 | F76: =ROUNDDOWN(((E76-48)*0.8),0) -> 10 | G76: 60
A77: 7 | B77: Kevin Stibal | C77: 104 | D77: 2 | E77: =SUM(C77/D77) -> 52.000 | F77: =ROUNDDOWN(((E77-48)*0.8),0) -> 3 | I77: 1
A78: 8 | B78: Caleb Richer | C78: 114 | D78: 2 | E78: =SUM(C78/D78) -> 57.000 | F78: =ROUNDDOWN(((E78-48)*0.8),0) -> 7 | G78: 60 | H78: 0 | I78: 0 | J78: Rios
A79: 9 | B79: Jack Gilmore | C79: 115 | D79: 2 | E79: =SUM(C79/D79) -> 57.500 | F79: =ROUNDDOWN(((E79-48)*0.8),0) -> 7 | G79: 56
A80: 10 | B80: Nic Gordon | C80: 116 | D80: 2 | E80: =SUM(C80/D80) -> 58.000 | F80: =ROUNDDOWN(((E80-48)*0.8),0) -> 8
A81: 11 | B81: Johnny Walker | C81: 122 | D81: 2 | E81: =SUM(C81/D81) -> 61.000 | F81: =ROUNDDOWN(((E81-48)*0.8),0) -> 10 | I81: 1
A82: 12 | B82: Kerri Haught | C82: 124 | D82: 2 | E82: =SUM(C82/D82) -> 62.000 | F82: =ROUNDDOWN(((E82-48)*0.8),0) -> 11
A83: 13 | B83: Matt Snyder | C83: 162 | D83: 2 | E83: =SUM(C83/D83) -> 81.000 | F83: =ROUNDDOWN(((E83-48)*0.8),0) -> 26
A84: 14 | B84: Miguel - Bowling Green | C84: 52 | D84: 1 | E84: =SUM(C84/D84) -> 52.000 | F84: 0 | I84: 1
A85: 15 | B85: Brandon Yancey | C85: 52 | D85: 1 | E85: =SUM(C85/D85) -> 52.000 | F85: 0
A86: 16 | B86: Mike William | C86: 53 | D86: 1 | E86: =SUM(C86/D86) -> 53.000 | F86: 0
A87: 17 | B87: Aaron | C87: 53 | D87: 1 | E87: =SUM(C87/D87) -> 53.000 | F87: 0
A88: 18 | B88: Apollo | C88: 54 | D88: 1 | E88: =SUM(C88/D88) -> 54.000 | F88: 0
A89: 19 | B89: Dave Peyton | C89: 56 | D89: 1 | E89: =SUM(C89/D89) -> 56.000 | F89: 0
A90: 20 | B90: Mike Noth | C90: 57 | D90: 1 | E90: =SUM(C90/D90) -> 57.000 | F90: 0
A91: 21 | B91: Brian Snider | C91: 59 | D91: 1 | E91: =SUM(C91/D91) -> 59.000 | F91: 0
A92: 22 | B92: Jesse Kirk | C92: 60 | D92: 1 | E92: =SUM(C92/D92) -> 60.000 | F92: 0
A93: 23 | B93: Tony Hobel | C93: 60 | D93: 1 | E93: 60.000 | F93: 0
A94: 24 | B94: Dustin Nohr | C94: 64 | D94: 1 | E94: =SUM(C94/D94) -> 64.000 | F94: 0
A95: 25 | C95: 0 | D95: 1 | E95: =SUM(C95/D95) -> 0.000 | F95: =ROUNDDOWN(((E95-50)*0.8),0) -> -40
A96: 26 | C96: 0 | D96: 1 | E96: =SUM(C96/D96) -> 0.000 | F96: =ROUNDDOWN(((E96-50)*0.8),0) -> -40
A97: 27 | C97: 0 | D97: 1 | E97: =SUM(C97/D97) -> 0.000 | F97: =ROUNDDOWN(((E97-50)*0.8),0) -> -40
A98: 28 | C98: 0 | D98: 1 | E98: =SUM(C98/D98) -> 0.000 | F98: =ROUNDDOWN(((E98-50)*0.8),0) -> -40
A99: 29 | C99: 0 | D99: 1 | E99: =SUM(C99/D99) -> 0.000 | F99: =ROUNDDOWN(((E99-50)*0.8),0) -> -40
A100: 30
A101: 31
A102: 25 | B102: Craig Eastin | C102: 65 | D102: 1 | E102: =SUM(C102/D102) -> 65.000 | F102: 0
A103: 26 | B103: Max Ostby | C103: 66 | D103: 1 | E103: 66.000 | F103: 0
A105: 2013 SBDGL Team Standings
B106: TEAM # | C106: BUSH | E106: Total Points | F106: Team Points | G106: Team Avg
A107: 1 | B107: 16 | C107: Tim Peyton & Josh Beachy | E107: 29 | F107: 10 | G107: =AVERAGE(E10,E12) -> 52.112499999999997
A108: 2 | B108: 12 | C108: Ian Jacobs & Andrew Greco | E108: 28 | F108: 9.5 | G108: =AVERAGE(E7,E41) -> 53.90625
A109: 3 | B109: 11 | C109: Matt Weiben & Kirby Callanhan | E109: 27.5 | F109: 11 | G109: =AVERAGE(E16,E22) -> 54.000
A110: 4 | B110: 6 | C110: Ryan Clark & Ben Sandel | E110: 27.5 | F110: 9 | G110: =AVERAGE(E26,E50) -> 56.84375
A111: 5 | B111: 13 | C111: Matt Whitlock & Greg Dye | E111: 27 | F111: 9.5 | G111: =AVERAGE(E21,E67) -> 60.366666666666674
A112: 6 | B112: 9 | C112: Tim Troyna & Pat Cutsforth | E112: 27 | F112: 9 | G112: =AVERAGE(E52,E62) -> 60.566666666666663
A113: 7 | B113: 3 | C113: Erik Smith & KVN | E113: 27 | F113: 8.5 | G113: =AVERAGE(E54,E15) -> 56.78125
A114: 8 | B114: 10 | C114: Adam Miller & Mitch Lerch | E114: 27 | F114: 8.5 | G114: =AVERAGE(E19,E61) -> 57.870833333333337
A115: 9 | B115: 8 | C115: Jesse Streinz & Bob Hernandez | E115: 26.5 | F115: 8 | G115: =AVERAGE(E25,E33) -> 55.15625
A116: 10 | B116: 4 | C116: Marty Reis & Travis Pike | E116: 22.5 | F116: 8.5 | G116: =AVERAGE(E44,E46) -> 57.589285714285715
A117: 11 | B117: 14 | C117: Matt Fritz & Jason Rimrodt | E117: 22 | F117: 6.5 | G117: =AVERAGE(E6,E48) -> 54.4375
A118: 12 | B118: 5 | C118: Average Joe & Chris Clime | E118: 21.5 | F118: 7 | G118: =AVERAGE(E29,E63) -> 58.691666666666663
A119: 13 | B119: 7 | C119: Doug Johnson & Adam Stiers | E119: 21 | F119: 7.5 | G119: =AVERAGE(E14,E28) -> 54.191666666666663
A120: 14 | B120: 2 | C120: Sarah Potter & Kollin Grimm | E120: 18 | F120: 5 | G120: =AVERAGE(E32,E65) -> 59.4375
A121: 15 | B121: 1 | C121: D Burns & Adam Henderson | E121: 16 | F121: 5 | G121: =AVERAGE(E56,E60) -> 61.0625
A122: 16 | B122: 15 | C122: Nathan Veeder & Tony Rios | E122: 12 | F122: 3.5 | G122: =AVERAGE(E37,E47) -> 57.197916666666671
B124: TEAM # | C124: WHACKER
A125: 1 | B125: 17 | C125: Chuck Yanda & Nate Robbins | E125: 32.5 | F125: 11 | G125: =AVERAGE(E17,E30) -> 54.40625
A126: 2 | B126: 27 | C126: Kurt Conrad & Dan Kent | E126: 32 | F126: 12 | G126: =AVERAGE(E11,E18) -> 52.875
A127: 3 | B127: 22 | C127: Jeremy Farnsworth & Tony Ebson | E127: 30 | F127: 11 | G127: =AVERAGE(E9,E64) -> 57.354166666666671
A128: 4 | B128: 30 | C128: Joel Knutson & Travis Fruendt | E128: 30 | F128: 10 | G128: =AVERAGE(E31,E34) -> 55.500
A129: 5 | B129: 23 | C129: Doug Peyton & Adam Chittenden | E129: 28.5 | F129: 10.5 | G129: =AVERAGE(E5,E55) -> 55.46875
A130: 6 | B130: 32 | C130: Dan Kern & Shirtless Bill | E130: 28 | F130: 8.5 | G130: =AVERAGE(E8,E38) -> 53.84375
A131: 7 | B131: 29 | C131: Adam Olsen & Matt Shannon | E131: 26.5 | F131: 8 | G131: =AVERAGE(E51,E4) -> 52.90625
A132: 8 | B132: 24 | C132: Ryan Hamilton & Rob Mumma | E132: 25 | F132: 8.5 | G132: =AVERAGE(E35,E36) -> 55.8125
A133: 9 | B133: 26 | C133: Joe French & Matt Wycoff | E133: 24.5 | F133: 8.5 | G133: =AVERAGE(E20,E43) -> 55.600
A134: 10 | B134: 21 | C134: Ryan Eggleston & Shane Thirtyacre | E134: 24.5 | F134: 8 | G134: =AVERAGE(E42,E59) -> 59.245535714285715
A135: 11 | B135: 20 | C135: Dustin Utley & Tom Pepper | E135: 18.5 | F135: 6.5 | G135: =AVERAGE(E24,E58) -> 57.982142857142861
A136: 12 | B136: 19 | C136: Drew Detert & Anthony Moody | E136: 18.5 | F136: 6 | G136: =AVERAGE(E27,E49) -> 56.84375
A137: 13 | B137: 28 | C137: Tim Potter & David McCuskey | E137: 18 | F137: 5.5 | G137: =AVERAGE(E23,E53) -> 57.03125
A138: 14 | B138: 25 | C138: Ryan Wodstrchill & Phil Campos | E138: 17.5 | F138: 7 | G138: =AVERAGE(E13,E39) -> 54.908653846153847
A139: 15 | B139: 18 | C139: Jason Shook & Josh McFarland | E139: 17.5 | F139: 4.5 | G139: =AVERAGE(E40,E45) -> 57.054166666666667
A140: 16 | B140: 31 | C140: Spencer Eubanks & Shawn Hullinger | E140: 17 | F140: 4.5 | G140: =AVERAGE(E57,E66) -> 62.21875