A1: 2013 S.B.D.G.L. STANDINGS Through Week 9 Shaver
A2: Rank | B2: Player | C2: Total Strokes | D2: Weeks | E2: Average | F2: H-Cap | G2: Last | H2: Week Pt. | I2: Total Pts. | J2: Sub Pts.
A4: =A3+1 -> 1 | B4: Adam Olsen | C4: 432 | D4: 9 | E4: =(C4/D4) -> 48.000 | F4: =ROUNDDOWN(((E4-48)*0.8),0) -> 0 | G4: 51 | H4: 1 | I4: 8
A5: =A4+1 -> 2 | B5: Doug Peyton | C5: 461 | D5: 9 | E5: =(C5/D5) -> 51.222222222222221 | F5: =ROUNDDOWN(((E5-48)*0.8),0) -> 2 | G5: 51 | H5: 1 | I5: 8
A6: =A5+1 -> 3 | B6: Jason Rimrodt | C6: 461 | D6: 9 | E6: =(C6/D6) -> 51.222222222222221 | F6: =ROUNDDOWN(((E6-48)*0.8),0) -> 2 | G6: 52 | H6: 0.5 | I6: 7.5
A7: =A6+1 -> 4 | B7: Andrew Greco | C7: 463 | D7: 9 | E7: =(C7/D7) -> 51.444444444444443 | F7: =ROUNDDOWN(((E7-48)*0.8),0) -> 2 | G7: 52 | H7: 1 | I7: 6.5
A8: =A7+1 -> 5 | B8: Tim Peyton | C8: 471 | D8: 9 | E8: =(C8/D8) -> 52.333333333333336 | F8: =ROUNDDOWN(((E8-48)*0.8),0) -> 3 | G8: 59 | H8: 0 | I8: 6
A9: =A8+1 -> 6 | B9: Dan Kern | C9: 472 | D9: 9 | E9: =(C9/D9) -> 52.444444444444443 | F9: =ROUNDDOWN(((E9-48)*0.8),0) -> 3 | G9: 53 | H9: 0.5 | I9: 4.5
A10: =A9+1 -> 7 | B10: Kurt Conrad | C10: 480 | D10: 9 | E10: =(C10/D10) -> 53.333333333333336 | F10: =ROUNDDOWN(((E10-48)*0.8),0) -> 4 | G10: 55 | H10: 1 | I10: 5
A11: =A10+1 -> 8 | B11: Doug Johnson | C11: 484 | D11: 9 | E11: =(C11/D11) -> 53.777777777777779 | F11: =ROUNDDOWN(((E11-48)*0.8),0) -> 4 | G11: 60 | H11: 0 | I11: 4.5
A12: =A11+1 -> 9 | B12: Jeremy Farnsworth | C12: 431 | D12: 8 | E12: =(C12/D12) -> 53.875 | F12: =ROUNDDOWN(((E12-48)*0.8),0) -> 4 | I12: 4.5 | J12: 0.5
A13: =A12+1 -> 10 | B13: Ryan Wodstrchill | C13: 488 | D13: 9 | E13: =(C13/D13) -> 54.222222222222221 | F13: =ROUNDDOWN(((E13-48)*0.8),0) -> 4 | G13: 56 | H13: 1 | I13: 3.5
A14: =A13+1 -> 11 | B14: Matt Wieben | C14: 489 | D14: 9 | E14: =(C14/D14) -> 54.333333333333336 | F14: =ROUNDDOWN(((E14-48)*0.8),0) -> 5 | G14: 63 | H14: 0 | I14: 3
A15: =A14+1 -> 12 | B15: Josh Beachy | C15: 439 | D15: 8 | E15: =(C15/D15) -> 54.875 | F15: =ROUNDDOWN(((E15-48)*0.8),0) -> 5 | G15: 57 | H15: 1 | I15: 4.5
A16: =A15+1 -> 13 | B16: Joe French | C16: 494 | D16: 9 | E16: =(C16/D16) -> 54.888888888888886 | F16: =ROUNDDOWN(((E16-48)*0.8),0) -> 5 | G16: 58 | H16: 1 | I16: 5
A17: =A16+1 -> 14 | B17: Nate Robins | C17: 494 | D17: 9 | E17: =(C17/D17) -> 54.888888888888886 | F17: =ROUNDDOWN(((E17-48)*0.8),0) -> 5 | G17: 56 | H17: 0 | I17: 4.5
A18: =A17+1 -> 15 | B18: KVN Lavley | C18: 498 | D18: 9 | E18: =(C18/D18) -> 55.333333333333336 | F18: =ROUNDDOWN(((E18-48)*0.8),0) -> 5 | G18: 56 | H18: 1 | I18: 5.5
A19: =A18+1 -> 16 | B19: Dustin Utley | C19: 499 | D19: 9 | E19: =(C19/D19) -> 55.444444444444443 | F19: =ROUNDDOWN(((E19-48)*0.8),0) -> 5 | G19: 63 | H19: 0 | I19: 3
A20: =A19+1 -> 17 | B20: Dan Kent | C20: 500 | D20: 9 | E20: =(C20/D20) -> 55.555555555555557 | F20: =ROUNDDOWN(((E20-48)*0.8),0) -> 6 | G20: 60 | H20: 0 | I20: 6.5
A21: =A20+1 -> 18 | B21: Drew Detert | C21: 500 | D21: 9 | E21: =(C21/D21) -> 55.555555555555557 | F21: =ROUNDDOWN(((E21-48)*0.8),0) -> 6 | G21: 58 | H21: 0 | I21: 4.5
A22: =A21+1 -> 19 | B22: Joel Knutson | C22: 501 | D22: 9 | E22: =(C22/D22) -> 55.666666666666664 | F22: =ROUNDDOWN(((E22-48)*0.8),0) -> 6 | G22: 57 | H22: 1 | I22: 6.5
A23: =A22+1 -> 20 | B23: Adam Stiers | C23: 501 | D23: 9 | E23: =(C23/D23) -> 55.666666666666664 | F23: =ROUNDDOWN(((E23-48)*0.8),0) -> 6 | G23: 66 | H23: 0 | I23: 5
A24: =A23+1 -> 21 | B24: Adam Miller | C24: 446 | D24: 8 | E24: =(C24/D24) -> 55.750 | F24: =ROUNDDOWN(((E24-48)*0.8),0) -> 6 | I24: 2.5 | J24: 0
A25: =A24+1 -> 22 | B25: Rob Mumma | C25: 503 | D25: 9 | E25: =(C25/D25) -> 55.888888888888886 | F25: =ROUNDDOWN(((E25-48)*0.8),0) -> 6 | G25: 61 | H25: 0 | I25: 5.5
A26: =A25+1 -> 23 | B26: Tim Potter | C26: 503 | D26: 9 | E26: =(C26/D26) -> 55.888888888888886 | F26: =ROUNDDOWN(((E26-48)*0.8),0) -> 6 | G26: 66 | H26: 1 | I26: 3
A27: =A26+1 -> 24 | B27: Bob Hernadez | C27: 504 | D27: 9 | E27: =(C27/D27) -> 56.000 | F27: =ROUNDDOWN(((E27-48)*0.8),0) -> 6 | G27: 56 | H27: 1 | I27: 7
A28: =A27+1 -> 25 | B28: Kollin Grimm | C28: 504 | D28: 9 | E28: =(C28/D28) -> 56.000 | F28: =ROUNDDOWN(((E28-48)*0.8),0) -> 6 | G28: 57 | H28: 0.5 | I28: 4.5
A29: =A28+1 -> 26 | B29: Kirby Callahan | C29: 506 | D29: 9 | E29: =(C29/D29) -> 56.222222222222221 | F29: =ROUNDDOWN(((E29-48)*0.8),0) -> 6 | G29: 61 | H29: 0 | I29: 3.5
A30: =A29+1 -> 27 | B30: Chris Clime | C30: 507 | D30: 9 | E30: =(C30/D30) -> 56.333333333333336 | F30: =ROUNDDOWN(((E30-48)*0.8),0) -> 6 | G30: 57 | H30: 1 | I30: 4
A31: =A30+1 -> 28 | B31: Greg Dye | C31: 451 | D31: 8 | E31: =(C31/D31) -> 56.375 | F31: =ROUNDDOWN(((E31-48)*0.8),0) -> 6 | I31: 6.5 | J31: 0.5
A32: =A31+1 -> 29 | B32: Ryan Clark | C32: 508 | D32: 9 | E32: =(C32/D32) -> 56.444444444444443 | F32: =ROUNDDOWN(((E32-48)*0.8),0) -> 6 | G32: 61 | H32: 0 | I32: 6
A33: =A32+1 -> 30 | B33: Jesse Streinz | C33: 509 | D33: 9 | E33: =(C33/D33) -> 56.555555555555557 | F33: =ROUNDDOWN(((E33-48)*0.8),0) -> 6 | G33: 58 | H33: 0 | I33: 3
A34: =A33+1 -> 31 | B34: Nate Veeder | C34: 510 | D34: 9 | E34: =(C34/D34) -> 56.666666666666664 | F34: =ROUNDDOWN(((E34-48)*0.8),0) -> 6 | G34: 60 | H34: 0 | I34: 3
A35: =A34+1 -> 32 | B35: Shirtless Bill | C35: 512 | D35: 9 | E35: =(C35/D35) -> 56.888888888888886 | F35: =ROUNDDOWN(((E35-48)*0.8),0) -> 7 | G35: 63 | H35: 1 | I35: 5.5
A36: =A35+1 -> 33 | B36: Travis Fruendt | C36: 514 | D36: 9 | E36: =(C36/D36) -> 57.111111111111114 | F36: =ROUNDDOWN(((E36-48)*0.8),0) -> 7 | G36: 56 | H36: 1 | I36: 8
A37: =A36+1 -> 34 | B37: Ryan Hamilton | C37: 514 | D37: 9 | E37: =(C37/D37) -> 57.111111111111114 | F37: =ROUNDDOWN(((E37-48)*0.8),0) -> 7 | G37: 54 | H37: 1 | I37: 5
A38: =A37+1 -> 35 | B38: Phil Campos | C38: 400 | D38: 7 | E38: =(C38/D38) -> 57.142857142857146 | F38: =ROUNDDOWN(((E38-48)*0.8),0) -> 7 | I38: 2 | J38: 1
A39: =A38+1 -> 36 | B39: Chuck Yanda | C39: 520 | D39: 9 | E39: =(C39/D39) -> 57.777777777777779 | F39: =ROUNDDOWN(((E39-48)*0.8),0) -> 7 | G39: 57 | H39: 1 | I39: 7
A40: =A39+1 -> 37 | B40: Travis Pike | C40: 523 | D40: 9 | E40: =(C40/D40) -> 58.111111111111114 | F40: =ROUNDDOWN(((E40-48)*0.8),0) -> 8 | G40: 64 | H40: 1 | I40: 4
A41: =A40+1 -> 38 | B41: Matt Wyckoff | C41: 465 | D41: 8 | E41: =(C41/D41) -> 58.125 | F41: =ROUNDDOWN(((E41-48)*0.8),0) -> 8 | G41: 59 | H41: 1 | I41: 4
A42: =A41+1 -> 39 | B42: Martin Reis | C42: 524 | D42: 9 | E42: =(C42/D42) -> 58.222222222222221 | F42: =ROUNDDOWN(((E42-48)*0.8),0) -> 8 | G42: 58 | H42: 1 | I42: 4.5
A43: =A42+1 -> 40 | B43: Jason Shook | C43: 467 | D43: 8 | E43: =(C43/D43) -> 58.375 | F43: =ROUNDDOWN(((E43-48)*0.8),0) -> 8 | G43: 58 | H43: 1 | I43: 4
A44: =A43+1 -> 41 | B44: Ian Jacobs | C44: 526 | D44: 9 | E44: =(C44/D44) -> 58.444444444444443 | F44: =ROUNDDOWN(((E44-48)*0.8),0) -> 8 | G44: 61 | H44: 0 | I44: 4
A45: =A44+1 -> 42 | B45: Ryan Eggleston | C45: 528 | D45: 9 | E45: =(C45/D45) -> 58.666666666666664 | F45: =ROUNDDOWN(((E45-48)*0.8),0) -> 8 | G45: 65 | H45: 0.5 | I45: 5
A46: =A45+1 -> 43 | B46: Matt Shannon | C46: 528 | D46: 9 | E46: =(C46/D46) -> 58.666666666666664 | F46: =ROUNDDOWN(((E46-48)*0.8),0) -> 8 | G46: 67 | H46: 0 | I46: 4
A47: =A46+1 -> 44 | B47: Matt Fritz | C47: 529 | D47: 9 | E47: =(C47/D47) -> 58.777777777777779 | F47: =ROUNDDOWN(((E47-48)*0.8),0) -> 8 | G47: 66 | H47: 0 | I47: 2
A48: =A47+1 -> 45 | B48: Tony Rios | C48: 471 | D48: 8 | E48: =(C48/D48) -> 58.875 | F48: =ROUNDDOWN(((E48-48)*0.8),0) -> 8 | G48: 65 | H48: 0 | I48: 3
A49: =A48+1 -> 46 | B49: Josh McFarland | C49: 530 | D49: 9 | E49: =(C49/D49) -> 58.888888888888886 | F49: =ROUNDDOWN(((E49-48)*0.8),0) -> 8 | G49: 65 | H49: 0 | I49: 1
A50: =A49+1 -> 47 | B50: David McCuskey | C50: 539 | D50: 9 | E50: =(C50/D50) -> 59.888888888888886 | F50: =ROUNDDOWN(((E50-48)*0.8),0) -> 9 | G50: 62 | H50: 0 | I50: 3.5
A51: =A50+1 -> 48 | B51: Ben Sandell | C51: 541 | D51: 9 | E51: =(C51/D51) -> 60.111111111111114 | F51: =ROUNDDOWN(((E51-48)*0.8),0) -> 9 | G51: 64 | H51: 1 | I51: 7
A52: =A51+1 -> 49 | B52: Tim Troyna | C52: 545 | D52: 9 | E52: =(C52/D52) -> 60.555555555555557 | F52: =ROUNDDOWN(((E52-48)*0.8),0) -> 10 | G52: 69 | H52: 0 | I52: 3
A53: =A52+1 -> 50 | B53: Anthony Moody | C53: 546 | D53: 9 | E53: =(C53/D53) -> 60.666666666666664 | F53: =ROUNDDOWN(((E53-48)*0.8),0) -> 10 | G53: 65 | H53: 0 | I53: 2.5
A54: =A53+1 -> 51 | B54: Erik Smith | C54: 551 | D54: 9 | E54: =(C54/D54) -> 61.222222222222221 | F54: =ROUNDDOWN(((E54-48)*0.8),0) -> 10 | G54: 60 | H54: 1 | I54: 3
A55: =A54+1 -> 52 | B55: Adam Henderson | C55: 554 | D55: 9 | E55: =(C55/D55) -> 61.555555555555557 | F55: =ROUNDDOWN(((E55-48)*0.8),0) -> 10 | G55: 73 | H55: 0 | I55: 3.5
A56: 53 | B56: Adam Chittenden | C56: 555 | D56: 9 | E56: =(C56/D56) -> 61.666666666666664 | F56: =ROUNDDOWN(((E56-48)*0.8),0) -> 10 | G56: 66 | H56: 0 | I56: 5
A57: 54 | B57: Shane Thirtyacre | C57: 556 | D57: 9 | E57: =(C57/D57) -> 61.777777777777779 | F57: =ROUNDDOWN(((E57-48)*0.8),0) -> 11 | G57: 71 | H57: 0 | I57: 4
A58: 55 | B58: Tom Pepper | C58: 436 | D58: 7 | E58: =(C58/D58) -> 62.285714285714285 | F58: =ROUNDDOWN(((E58-48)*0.8),0) -> 11 | G58: 64 | H58: 0 | I58: 3.5
A59: 56 | B59: D Burns | C59: 562 | D59: 9 | E59: =(C59/D59) -> 62.444444444444443 | F59: =ROUNDDOWN(((E59-48)*0.8),0) -> 11 | G59: 68 | H59: 0 | I59: 3
A60: 57 | B60: Pat Cutsforth | C60: 563 | D60: 9 | E60: =(C60/D60) -> 62.555555555555557 | F60: =ROUNDDOWN(((E60-48)*0.8),0) -> 11 | G60: 65 | H60: 1 | I60: 7.5
A61: 58 | B61: Spencer Eubanks | C61: 563 | D61: 9 | E61: =(C61/D61) -> 62.555555555555557 | F61: =ROUNDDOWN(((E61-48)*0.8),0) -> 11 | G61: 67 | H61: 1 | I61: 2.5
A62: 59 | B62: Mitch Lerch | C62: 570 | D62: 9 | E62: =(C62/D62) -> 63.333333333333336 | F62: =ROUNDDOWN(((E62-48)*0.8),0) -> 12 | G62: 64 | H62: 1 | I62: 5
A63: 60 | B63: Avg Joe | C63: 572 | D63: 9 | E63: =(C63/D63) -> 63.555555555555557 | F63: =ROUNDDOWN(((E63-48)*0.8),0) -> 12 | G63: 67 | H63: 0 | I63: 2
A64: 61 | B64: Sarah Potter | C64: 573 | D64: 9 | E64: =(C64/D64) -> 63.666666666666664 | F64: =ROUNDDOWN(((E64-48)*0.8),0) -> 12 | G64: 69 | H64: 0 | I64: 3.5
A65: 62 | B65: Shawn Hullinger | C65: 579 | D65: 9 | E65: =(C65/D65) -> 64.333333333333329 | F65: =ROUNDDOWN(((E65-48)*0.8),0) -> 13 | G65: 65 | H65: 1 | I65: 4
A66: 63 | B66: Tony Ebson | C66: 588 | D66: 9 | E66: =(C66/D66) -> 65.333333333333329 | F66: =ROUNDDOWN(((E66-48)*0.8),0) -> 13 | G66: 69 | H66: 1 | I66: 4
A67: 64 | B67: Matt Whitlock | C67: 601 | D67: 9 | E67: =(C67/D67) -> 66.777777777777771 | F67: =ROUNDDOWN(((E67-48)*0.8),0) -> 15 | G67: 67 | H67: 1 | I67: 4
A69: Subs | B69: Player | C69: Total Strokes | D69: Weeks | E69: Average | F69: H-Cap | G69: Last | H69: Week Pt. | I69: Total Pts. | J69: Subed For
A70: 1 | B70: Dustin Snodgress | C70: 314 | D70: 5 | E70: =SUM(C70/D70) -> 62.800 | F70: =ROUNDDOWN(((E70-48)*0.8),0) -> 11
A71: 2 | B71: Adam Karstens | C71: 179 | D71: 3 | E71: =SUM(C71/D71) -> 59.666666666666664 | F71: =ROUNDDOWN(((E71-48)*0.8),0) -> 9 | G71: 67 | H71: 0.5 | I71: 0.5 | J71: DYE
A72: 3 | B72: Archie Coulter | C72: 115 | D72: 2 | E72: =SUM(C72/D72) -> 57.500 | F72: =ROUNDDOWN(((E72-48)*0.8),0) -> 7
A73: 4 | B73: Josh Spang | C73: 116 | D73: 2 | E73: =SUM(C73/D73) -> 58.000 | F73: =ROUNDDOWN(((E73-48)*0.8),0) -> 8 | G73: 59 | H73: 0.5 | I73: 0.5 | J73: FARNSWORTH
A74: 5 | B74: Kerri Haught | C74: 124 | D74: 2 | E74: =SUM(C74/D74) -> 62.000 | F74: =ROUNDDOWN(((E74-48)*0.8),0) -> 11
A75: 6 | B75: Steve Callaway | C75: 125 | D75: 2 | E75: =SUM(C75/D75) -> 62.500 | F75: =ROUNDDOWN(((E75-48)*0.8),0) -> 11
A76: 7 | B76: Matt Snyder | C76: 162 | D76: 2 | E76: =SUM(C76/D76) -> 81.000 | F76: =ROUNDDOWN(((E76-48)*0.8),0) -> 26
A77: 8 | B77: Mike William | C77: 53 | D77: 1 | E77: =SUM(C77/D77) -> 53.000 | F77: 0 | G77: 53
A78: 9 | B78: Kevin Stibal | C78: 56 | D78: 1 | E78: =SUM(C78/D78) -> 56.000 | F78: 0 | G78: 56 | H78: 1 | I78: 1 | J78: CAMPOS
A79: 10 | B79: Jack Gilmore | C79: 59 | D79: 1 | E79: =SUM(C79/D79) -> 59.000 | F79: 0
A80: 11 | B80: Jesse Kirk | C80: 60 | D80: 1 | E80: =SUM(C80/D80) -> 60.000 | F80: 0 | G80: 60
A81: 12 | B81: Dan Lewis | C81: 63 | D81: 1 | E81: =SUM(C81/D81) -> 63.000 | F81: 0
A82: 13 | B82: Dustin Nohr | C82: 64 | D82: 1 | E82: =SUM(C82/D82) -> 64.000 | F82: 0
A83: 14 | B83: Johnny Walker | C83: 64 | D83: 1 | E83: =SUM(C83/D83) -> 64.000 | F83: 0
A84: 15 | B84: Craig Eastin | C84: 65 | D84: 1 | E84: =SUM(C84/D84) -> 65.000 | F84: 0 | G84: 65 | H84: 0 | I84: 0 | J84: ADAM MILLER
A85: 16 | B85: Sills | C85: 65 | D85: 1 | E85: =SUM(C85/D85) -> 65.000 | F85: 0 | G85: 65
A86: 17 | C86: 0 | D86: 1 | E86: =SUM(C86/D86) -> 0.000 | F86: =ROUNDDOWN(((E86-48)*0.8),0) -> -38
A87: 18 | C87: 0 | D87: 1 | E87: =SUM(C87/D87) -> 0.000 | F87: =ROUNDDOWN(((E87-48)*0.8),0) -> -38
A88: 19 | C88: 0 | D88: 1 | E88: =SUM(C88/D88) -> 0.000 | F88: =ROUNDDOWN(((E88-48)*0.8),0) -> -38
A89: 20 | C89: 0 | D89: 1 | E89: =SUM(C89/D89) -> 0.000 | F89: =ROUNDDOWN(((E89-48)*0.8),0) -> -38
A90: 21 | C90: 0 | D90: 1 | E90: =SUM(C90/D90) -> 0.000 | F90: =ROUNDDOWN(((E90-48)*0.8),0) -> -38
A91: 22 | C91: 0 | D91: 1 | E91: =SUM(C91/D91) -> 0.000 | F91: =ROUNDDOWN(((E91-48)*0.8),0) -> -38
A92: 23 | C92: 0 | D92: 1 | E92: =SUM(C92/D92) -> 0.000 | F92: =ROUNDDOWN(((E92-48)*0.8),0) -> -38
A93: 24 | C93: 0 | D93: 1 | E93: =SUM(C93/D93) -> 0.000 | F93: =ROUNDDOWN(((E93-48)*0.8),0) -> -38
A94: 25 | C94: 0 | D94: 1 | E94: =SUM(C94/D94) -> 0.000 | F94: =ROUNDDOWN(((E94-48)*0.8),0) -> -38
A95: 26 | C95: 0 | D95: 1 | E95: =SUM(C95/D95) -> 0.000 | F95: =ROUNDDOWN(((E95-48)*0.8),0) -> -38
A96: 27 | C96: 0 | D96: 1 | E96: =SUM(C96/D96) -> 0.000 | F96: =ROUNDDOWN(((E96-48)*0.8),0) -> -38
A97: 28 | C97: 0 | D97: 1 | E97: =SUM(C97/D97) -> 0.000 | F97: =ROUNDDOWN(((E97-48)*0.8),0) -> -38
A98: 29 | C98: 0 | D98: 1 | E98: =SUM(C98/D98) -> 0.000 | F98: =ROUNDDOWN(((E98-48)*0.8),0) -> -38
A99: 30 | C99: 0 | D99: 1 | E99: =SUM(C99/D99) -> 0.000 | F99: =ROUNDDOWN(((E99-48)*0.8),0) -> -38
A100: 31 | F100: =ROUNDDOWN(((E100-48)*0.8),0) -> -38
A101: 32 | F101: =ROUNDDOWN(((E101-48)*0.8),0) -> -38
A103: 2013 SBDGL Team Standings
B104: TEAM # | C104: BUSH | E104: Total Points | F104: Team Points | G104: Team Avg
A105: 1 | B105: 6 | C105: Ryan Clark & Ben Sandel | E105: 19 | F105: 6 | G105: =AVERAGE(E51,E32) -> 58.277777777777779
A106: 2 | B106: 16 | C106: Tim Peyton & Josh Beachy | E106: 16 | F106: 5.5 | G106: =AVERAGE(E15,E8) -> 53.604166666666671
A107: 3 | B107: 12 | C107: Ian Jacobs & Andrew Greco | E107: 16 | F107: 5.5 | G107: =AVERAGE(E44,E7) -> 54.944444444444443
A108: 4 | B108: 13 | C108: Matt Whitlock & Greg Dye | E108: 16 | F108: 5.5 | G108: =AVERAGE(E31,E67) -> 61.576388888888886
A109: 5 | B109: 9 | C109: Tim Troyna & Pat Cutsforth | E109: 15.5 | F109: 5 | G109: =AVERAGE(E52,E60) -> 61.555555555555557
A110: 6 | B110: 7 | C110: Doug Johnson & Adam Stiers | E110: 14.5 | F110: 5 | G110: =AVERAGE(E11,E23) -> 54.722222222222221
A111: 7 | B111: 8 | C111: Jesse Streinz & Bob Hernandez | E111: 14 | F111: 4 | G111: =AVERAGE(E27,E33) -> 56.277777777777779
A112: 8 | B112: 4 | C112: Marty Reis & Travis Pike | E112: 14 | F112: 5.5 | G112: =AVERAGE(E40,E42) -> 58.166666666666671
A113: 9 | B113: 14 | C113: Matt Fritz & Jason Rimrodt | E113: 13 | F113: 3.5 | G113: =AVERAGE(E6,E47) -> 55.000
A114: 10 | B114: 3 | C114: Erik Smith & KVN | E114: 12.5 | F114: 4 | G114: =AVERAGE(E54,E18) -> 58.277777777777779
A115: 11 | B115: 2 | C115: Sarah Potter & Kollin Grimm | E115: 12 | F115: 4 | G115: =AVERAGE(E28,E64) -> 59.833333333333329
A116: 12 | B116: 11 | C116: Matt Weiben & Kirby Callanhan | E116: 11.5 | F116: 5 | G116: =AVERAGE(E29,E14) -> 55.277777777777779
A117: 13 | B117: 10 | C117: Adam Miller & Mitch Lerch | E117: 10.5 | F117: 3 | G117: =AVERAGE(E24,E62) -> 59.541666666666671
A118: 14 | B118: 1 | C118: D Burns & Adam Henderson | E118: 9.5 | F118: 3 | G118: =AVERAGE(E55,E59) -> 62.000
A119: 15 | B119: 5 | C119: Average Joe & Chris Clime | E119: 9 | F119: 3 | G119: =AVERAGE(E63,E30) -> 59.944444444444443
A120: 16 | B120: 15 | C120: Nathan Veeder & Tony Rios | E120: 8.5 | F120: 2.5 | G120: =AVERAGE(E34,E48) -> 57.770833333333329
B122: TEAM # | C122: WHACKER
A123: 1 | B123: 30 | C123: Joel Knutson & Travis Fruendt | E123: 22.5 | F123: 8 | G123: =AVERAGE(E36,E22) -> 56.388888888888886
A124: 2 | B124: 23 | C124: Doug Peyton & Adam Chittenden | E124: 21.5 | F124: 8.5 | G124: =AVERAGE(E5,E56) -> 56.444444444444443
A125: 3 | B125: 27 | C125: Kurt Conrad & Dan Kent | E125: 18.5 | F125: 7 | G125: =AVERAGE(E10,E20) -> 54.444444444444443
A126: 4 | B126: 29 | C126: Adam Olsen & Matt Shannon | E126: 17 | F126: 5 | G126: =AVERAGE(E4,E46) -> 53.333333333333329
A127: 5 | B127: 17 | C127: Chuck Yanda & Nate Robbins | E127: 15.5 | F127: 5 | G127: =AVERAGE(E17,E39) -> 56.333333333333329
A128: 6 | B128: 24 | C128: Ryan Hamilton & Rob Mumma | E128: 15 | F128: 4.5 | G128: =AVERAGE(E37,E25) -> 56.500
A129: 7 | B129: 32 | C129: Dan Kern & Shirtless Bill | E129: 14.5 | F129: 4.5 | G129: =AVERAGE(E35,E9) -> 54.666666666666664
A130: 8 | B130: 26 | C130: Joe French & Matt Wycoff | E130: 14.5 | F130: 5.5 | G130: =AVERAGE(E41,E16) -> 56.506944444444443
A131: 9 | B131: 21 | C131: Ryan Eggleston & Shane Thirtyacre | E131: 14.5 | F131: 4.5 | G131: =AVERAGE(E45,E57) -> 60.222222222222221
A132: 10 | B132: 22 | C132: Jeremy Farnsworth & Tony Ebson | E132: 13.5 | F132: 5 | G132: =AVERAGE(E12,E66) -> 59.604166666666664
A133: 11 | B133: 28 | C133: Tim Potter & David McCuskey | E133: 10 | F133: 3.5 | G133: =AVERAGE(E26,E50) -> 57.888888888888886
A134: 12 | B134: 20 | C134: Dustin Utley & Tom Pepper | E134: 10 | F134: 3.5 | G134: =AVERAGE(E19,E58) -> 58.865079365079367
A135: 13 | B135: 19 | C135: Drew Detert & Anthony Moody | E135: 10 | F135: 3 | G135: =AVERAGE(E21,E53) -> 58.111111111111114
A136: 14 | B136: 31 | C136: Spencer Eubanks & Shawn Hullinger | E136: 9 | F136: 2.5 | G136: =AVERAGE(E61,E65) -> 63.444444444444443
A137: 15 | B137: 25 | C137: Ryan Wodstrchill & Phil Campos | E137: 8.5 | F137: 3 | G137: =AVERAGE(E13,E38) -> 55.682539682539684
A138: 16 | B138: 18 | C138: Jason Shook & Josh McFarland | E138: 6 | F138: 1 | G138: =AVERAGE(E49,E43) -> 58.631944444444443