A1: 2013 S.B.D.G.L. STANDINGS Through Week 14 Penninsula
A2: Rank | B2: Player | C2: Total Strokes | D2: Weeks | E2: Average | F2: H-Cap | G2: Last | H2: Week Pt. | I2: Total Pts. | J2: Sub Pts.
A4: =A3+1 -> 1 | B4: Adam Olsen | C4: 660 | D4: 14 | E4: =(C4/D4) -> 47.142857142857146 | F4: =ROUNDDOWN(((E4-48)*0.8),0) -> 0 | G4: 50 | H4: 1 | I4: 12
A5: =A4+1 -> 2 | B5: Andrew Greco | C5: 711 | D5: 14 | E5: =(C5/D5) -> 50.785714285714285 | F5: =ROUNDDOWN(((E5-48)*0.8),0) -> 2 | G5: 53 | H5: 1 | I5: 9.5
A6: =A5+1 -> 3 | B6: Jason Rimrodt | C6: 713 | D6: 14 | E6: =(C6/D6) -> 50.928571428571431 | F6: =ROUNDDOWN(((E6-48)*0.8),0) -> 2 | G6: 54 | H6: 0 | I6: 9
A7: =A6+1 -> 4 | B7: Doug Peyton | C7: 714 | D7: 14 | E7: =(C7/D7) -> 51.000 | F7: =ROUNDDOWN(((E7-48)*0.8),0) -> 2 | G7: 55 | H7: 0 | I7: 9
A8: =A7+1 -> 5 | B8: Dan Kern | C8: 722 | D8: 14 | E8: =(C8/D8) -> 51.571428571428569 | F8: =ROUNDDOWN(((E8-48)*0.8),0) -> 2 | G8: 50 | H8: 1 | I8: 8
A9: =A8+1 -> 6 | B9: Jeremy Farnsworth | C9: 671 | D9: 13 | E9: =(C9/D9) -> 51.615384615384613 | F9: =ROUNDDOWN(((E9-48)*0.8),0) -> 2 | G9: 53 | H9: 0 | I9: 8.5
A10: =A9+1 -> 7 | B10: Tim Peyton | C10: 727 | D10: 14 | E10: =(C10/D10) -> 51.928571428571431 | F10: =ROUNDDOWN(((E10-48)*0.8),0) -> 3 | G10: 52 | H10: 0.5 | I10: 8
A11: =A10+1 -> 8 | B11: Kurt Conrad | C11: 731 | D11: 14 | E11: =(C11/D11) -> 52.214285714285715 | F11: =ROUNDDOWN(((E11-48)*0.8),0) -> 3 | G11: 52 | H11: 1 | I11: 7
A12: =A11+1 -> 9 | B12: Josh Beachy | C12: 688 | D12: 13 | E12: =(C12/D12) -> 52.92307692307692 | F12: =ROUNDDOWN(((E12-48)*0.8),0) -> 3 | G12: 49 | H12: 0.5 | I12: 8
A13: =A12+1 -> 10 | B13: Matt Wieben | C13: 745 | D13: 14 | E13: =(C13/D13) -> 53.214285714285715 | F13: =ROUNDDOWN(((E13-48)*0.8),0) -> 4 | G13: 49 | H13: 1 | I13: 7
A14: =A13+1 -> 11 | B14: Doug Johnson | C14: 746 | D14: 14 | E14: =(C14/D14) -> 53.285714285714285 | F14: =ROUNDDOWN(((E14-48)*0.8),0) -> 4 | G14: 56 | H14: 0 | I14: 6.5
A15: =A14+1 -> 12 | B15: Ryan Wodstrchill | C15: 749 | D15: 14 | E15: =(C15/D15) -> 53.500 | F15: =ROUNDDOWN(((E15-48)*0.8),0) -> 4 | G15: 54 | H15: 1 | I15: 6.5
A16: =A15+1 -> 13 | B16: Nate Robbins | C16: 753 | D16: 14 | E16: =(C16/D16) -> 53.785714285714285 | F16: =ROUNDDOWN(((E16-48)*0.8),0) -> 4 | G16: 57 | H16: 1 | I16: 8.5
A17: =A16+1 -> 14 | B17: KVN Lavley | C17: 753 | D17: 14 | E17: =(C17/D17) -> 53.785714285714285 | F17: =ROUNDDOWN(((E17-48)*0.8),0) -> 4 | G17: 53 | H17: 0.5 | I17: 10
A18: =A17+1 -> 15 | B18: Dan Kent | C18: 754 | D18: 14 | E18: =(C18/D18) -> 53.857142857142854 | F18: =ROUNDDOWN(((E18-48)*0.8),0) -> 4 | G18: 53 | H18: 1 | I18: 10.5
A19: =A18+1 -> 16 | B19: Joe French | C19: 651 | D19: 12 | E19: =(C19/D19) -> 54.250 | F19: =ROUNDDOWN(((E19-48)*0.8),0) -> 5 | G19: 52 | H19: 1 | I19: 7
A20: =A19+1 -> 17 | B20: Adam Miller | C20: 709 | D20: 13 | E20: =(C20/D20) -> 54.53846153846154 | F20: =ROUNDDOWN(((E20-48)*0.8),0) -> 5 | G20: 53 | H20: 1 | I20: 6
A21: =A20+1 -> 18 | B21: Tim Potter | C21: 766 | D21: 14 | E21: =(C21/D21) -> 54.714285714285715 | F21: =ROUNDDOWN(((E21-48)*0.8),0) -> 5 | G21: 57 | H21: 1 | I21: 6
A22: =A21+1 -> 19 | B22: Drew Detert | C22: 766 | D22: 14 | E22: =(C22/D22) -> 54.714285714285715 | F22: =ROUNDDOWN(((E22-48)*0.8),0) -> 5 | G22: 55 | H22: 0 | I22: 6
A23: =A22+1 -> 20 | B23: Kirby Callahan | C23: 770 | D23: 14 | E23: =(C23/D23) -> 55.000 | F23: =ROUNDDOWN(((E23-48)*0.8),0) -> 5 | G23: 55 | H23: 0 | I23: 6.5
A24: =A23+1 -> 21 | B24: Kollin Grimm | C24: 771 | D24: 14 | E24: =(C24/D24) -> 55.071428571428569 | F24: =ROUNDDOWN(((E24-48)*0.8),0) -> 5 | G24: 57 | H24: 0 | I24: 6.5
A25: =A24+1 -> 22 | B25: Dustin Utley | C25: 772 | D25: 14 | E25: =(C25/D25) -> 55.142857142857146 | F25: =ROUNDDOWN(((E25-48)*0.8),0) -> 5 | G25: 61 | H25: 0 | I25: 4
A26: =A25+1 -> 23 | B26: Ryan Clark | C26: 772 | D26: 14 | E26: =(C26/D26) -> 55.142857142857146 | F26: =ROUNDDOWN(((E26-48)*0.8),0) -> 5 | G26: 60 | H26: 0 | I26: 8
A27: =A26+1 -> 24 | B27: Bob Hernadez | C27: 772 | D27: 14 | E27: =(C27/D27) -> 55.142857142857146 | F27: =ROUNDDOWN(((E27-48)*0.8),0) -> 5 | G27: 56 | H27: 1 | I27: 10
A28: =A27+1 -> 25 | B28: Chris Clime | C28: 718 | D28: 13 | E28: =(C28/D28) -> 55.230769230769234 | F28: =ROUNDDOWN(((E28-48)*0.8),0) -> 5 | G28: 56 | H28: 0 | I28: 6.5
A29: =A28+1 -> 26 | B29: Greg Dye | C29: 719 | D29: 13 | E29: =(C29/D29) -> 55.307692307692307 | F29: =ROUNDDOWN(((E29-48)*0.8),0) -> 5 | G29: 58 | H29: 0 | I29: 9.5
A30: =A29+1 -> 27 | B30: Travis Fruendt | C30: 775 | D30: 14 | E30: =(C30/D30) -> 55.357142857142854 | F30: =ROUNDDOWN(((E30-48)*0.8),0) -> 5 | G30: 55 | H30: 0 | I30: 12
A31: =A30+1 -> 28 | B31: Jesse Streinz | C31: 776 | D31: 14 | E31: =(C31/D31) -> 55.428571428571431 | F31: =ROUNDDOWN(((E31-48)*0.8),0) -> 5 | G31: 55 | H31: 1 | I31: 5
A32: =A31+1 -> 29 | B32: Chuck Yanda | C32: 779 | D32: 14 | E32: =(C32/D32) -> 55.642857142857146 | F32: =ROUNDDOWN(((E32-48)*0.8),0) -> 6 | G32: 51 | H32: 1 | I32: 12
A33: =A32+1 -> 30 | B33: Adam Stiers | C33: 724 | D33: 13 | E33: =(C33/D33) -> 55.692307692307693 | F33: =ROUNDDOWN(((E33-48)*0.8),0) -> 6 | G33: 57 | H33: 0 | I33: 6
A34: =A33+1 -> 31 | B34: Joel Knutson | C34: 781 | D34: 14 | E34: =(C34/D34) -> 55.785714285714285 | F34: =ROUNDDOWN(((E34-48)*0.8),0) -> 6 | G34: 61 | H34: 0 | I34: 7.5
A35: =A34+1 -> 32 | B35: Rob Mumma | C35: 781 | D35: 14 | E35: =(C35/D35) -> 55.785714285714285 | F35: =ROUNDDOWN(((E35-48)*0.8),0) -> 6 | G35: 58 | H35: 0 | I35: 7.5
A36: =A35+1 -> 33 | B36: Ryan Hamilton | C36: 787 | D36: 14 | E36: =(C36/D36) -> 56.214285714285715 | F36: =ROUNDDOWN(((E36-48)*0.8),0) -> 6 | G36: 55 | H36: 1 | I36: 7
A37: =A36+1 -> 34 | B37: Nate Veeder | C37: 788 | D37: 14 | E37: =(C37/D37) -> 56.285714285714285 | F37: =ROUNDDOWN(((E37-48)*0.8),0) -> 6 | G37: 52 | H37: 1 | I37: 4
A38: =A37+1 -> 35 | B38: Ian Jacobs | C38: 789 | D38: 14 | E38: =(C38/D38) -> 56.357142857142854 | F38: =ROUNDDOWN(((E38-48)*0.8),0) -> 6 | G38: 51 | H38: 1 | I38: 8
A39: =A38+1 -> 36 | B39: Shirtless Bill | C39: 791 | D39: 14 | E39: =(C39/D39) -> 56.500 | F39: =ROUNDDOWN(((E39-48)*0.8),0) -> 6 | G39: 60 | H39: 0 | I39: 7.5
A40: =A39+1 -> 37 | B40: Phil Campos | C40: 681 | D40: 12 | E40: =(C40/D40) -> 56.750 | F40: =ROUNDDOWN(((E40-48)*0.8),0) -> 7 | G40: 60 | H40: 0 | I40: 3
A41: =A40+1 -> 38 | B41: Jason Shook | C41: 743 | D41: 13 | E41: =(C41/D41) -> 57.153846153846153 | F41: =ROUNDDOWN(((E41-48)*0.8),0) -> 7 | G41: 59 | H41: 0 | I41: 7
A42: =A41+1 -> 39 | B42: Ryan Eggleston | C42: 801 | D42: 14 | E42: =(C42/D42) -> 57.214285714285715 | F42: =ROUNDDOWN(((E42-48)*0.8),0) -> 7 | G42: 56 | H42: 0 | I42: 7.5
A43: =A42+1 -> 40 | B43: Martin Reis | C43: 804 | D43: 14 | E43: =(C43/D43) -> 57.428571428571431 | F43: =ROUNDDOWN(((E43-48)*0.8),0) -> 7 | G43: 56 | H43: 0 | I43: 6.5
A44: =A43+1 -> 41 | B44: Josh McFarland | C44: 805 | D44: 14 | E44: =(C44/D44) -> 57.500 | F44: =ROUNDDOWN(((E44-48)*0.8),0) -> 7 | G44: 54 | H44: 1 | I44: 4
A45: =A44+1 -> 42 | B45: Matt Wyckoff | C45: 748 | D45: 13 | E45: =(C45/D45) -> 57.53846153846154 | F45: =ROUNDDOWN(((E45-48)*0.8),0) -> 7 | G45: 63 | H45: 0.5 | I45: 7
A46: =A45+1 -> 43 | B46: Travis Pike | C46: 694 | D46: 12 | E46: =(C46/D46) -> 57.833333333333336 | F46: =ROUNDDOWN(((E46-48)*0.8),0) -> 7 | G46: 60 | H46: 0.5 | I46: 7
A47: =A46+1 -> 44 | B47: Tony Rios | C47: 637 | D47: 11 | E47: =(C47/D47) -> 57.909090909090907 | F47: =ROUNDDOWN(((E47-48)*0.8),0) -> 7 | I47: 4.5 | J47: 1
A48: =A47+1 -> 45 | B48: Matt Fritz | C48: 811 | D48: 14 | E48: =(C48/D48) -> 57.928571428571431 | F48: =ROUNDDOWN(((E48-48)*0.8),0) -> 7 | G48: 57 | H48: 1 | I48: 4
A49: =A48+1 -> 46 | B49: Ben Sandell | C49: 825 | D49: 14 | E49: =(C49/D49) -> 58.928571428571431 | F49: =ROUNDDOWN(((E49-48)*0.8),0) -> 8 | G49: 57 | H49: 1 | I49: 8.5
A50: =A49+1 -> 47 | B50: Matt Shannon | C50: 826 | D50: 14 | E50: =(C50/D50) -> 59.000 | F50: =ROUNDDOWN(((E50-48)*0.8),0) -> 8 | G50: 63 | H50: 0 | I50: 4.5
A51: =A50+1 -> 48 | B51: Anthony Moody | C51: 828 | D51: 14 | E51: =(C51/D51) -> 59.142857142857146 | F51: =ROUNDDOWN(((E51-48)*0.8),0) -> 8 | G51: 58 | H51: 1 | I51: 5.5
A52: =A51+1 -> 49 | B52: Tim Troyna | C52: 769 | D52: 13 | E52: =(C52/D52) -> 59.153846153846153 | F52: =ROUNDDOWN(((E52-48)*0.8),0) -> 8 | G52: 57 | H52: 1 | I52: 6
A53: =A52+1 -> 50 | B53: David McCuskey | C53: 837 | D53: 14 | E53: =(C53/D53) -> 59.785714285714285 | F53: =ROUNDDOWN(((E53-48)*0.8),0) -> 9 | G53: 64 | H53: 0 | I53: 4.5
A54: =A53+1 -> 51 | B54: Erik Smith | C54: 842 | D54: 14 | E54: =(C54/D54) -> 60.142857142857146 | F54: =ROUNDDOWN(((E54-48)*0.8),0) -> 9 | G54: 55 | H54: 0.5 | I54: 6.5
A55: =A54+1 -> 52 | B55: Adam Henderson | C55: 848 | D55: 14 | E55: =(C55/D55) -> 60.571428571428569 | F55: =ROUNDDOWN(((E55-48)*0.8),0) -> 10 | G55: 60 | H55: 1 | I55: 6
A56: 53 | B56: Adam Chittenden | C56: 849 | D56: 14 | E56: =(C56/D56) -> 60.642857142857146 | F56: =ROUNDDOWN(((E56-48)*0.8),0) -> 10 | G56: 57 | H56: 1 | I56: 7
A57: 54 | B57: Spencer Eubanks | C57: 857 | D57: 14 | E57: =(C57/D57) -> 61.214285714285715 | F57: =ROUNDDOWN(((E57-48)*0.8),0) -> 10 | G57: 59 | H57: 1 | I57: 5
A58: 55 | B58: Tom Pepper | C58: 739 | D58: 12 | E58: =(C58/D58) -> 61.583333333333336 | F58: =ROUNDDOWN(((E58-48)*0.8),0) -> 10 | G58: 62 | H58: 1 | I58: 6
A59: 56 | B59: D Burns | C59: 865 | D59: 14 | E59: =(C59/D59) -> 61.785714285714285 | F59: =ROUNDDOWN(((E59-48)*0.8),0) -> 11 | G59: 63 | H59: 0 | I59: 3
A60: 57 | B60: Shane Thirtyacre | C60: 744 | D60: 12 | E60: =(C60/D60) -> 62.000 | F60: =ROUNDDOWN(((E60-48)*0.8),0) -> 11 | G60: 66 | H60: 0.5 | I60: 6.5
A61: 58 | B61: Pat Cutsforth | C61: 868 | D61: 14 | E61: =(C61/D61) -> 62.000 | F61: =ROUNDDOWN(((E61-48)*0.8),0) -> 11 | G61: 64 | H61: 0.5 | I61: 9
A62: 59 | B62: Avg Joe | C62: 869 | D62: 14 | E62: =(C62/D62) -> 62.071428571428569 | F62: =ROUNDDOWN(((E62-48)*0.8),0) -> 11 | G62: 69 | H62: 0 | I62: 5
A63: 60 | B63: Mitch Lerch | C63: 870 | D63: 14 | E63: =(C63/D63) -> 62.142857142857146 | F63: =ROUNDDOWN(((E63-48)*0.8),0) -> 11 | G63: 68 | H63: 1 | I63: 10
A64: 61 | B64: Sarah Potter | C64: 891 | D64: 14 | E64: =(C64/D64) -> 63.642857142857146 | F64: =ROUNDDOWN(((E64-48)*0.8),0) -> 12 | G64: 68 | H64: 0 | I64: 5.5
A65: 62 | B65: Tony Ebson | C65: 892 | D65: 14 | E65: =(C65/D65) -> 63.714285714285715 | F65: =ROUNDDOWN(((E65-48)*0.8),0) -> 12 | G65: 70 | H65: 0 | I65: 7
A66: 63 | B66: Shawn Hullinger | C66: 899 | D66: 14 | E66: =(C66/D66) -> 64.214285714285708 | F66: =ROUNDDOWN(((E66-48)*0.8),0) -> 12 | G66: 65 | H66: 0 | I66: 5.5
A67: 64 | B67: Matt Whitlock | C67: 862 | D67: 13 | E67: =(C67/D67) -> 66.307692307692307 | F67: =ROUNDDOWN(((E67-48)*0.8),0) -> 14 | G67: 65 | H67: 0 | I67: 6
A69: Subs | B69: Player | C69: Total Strokes | D69: Weeks | E69: Average | F69: H-Cap | G69: Last | H69: Week Pt. | I69: Total Pts. | J69: Subed For
A70: 1 | B70: Adam Karstens | C70: 390 | D70: 7 | E70: =SUM(C70/D70) -> 55.714285714285715 | F70: =ROUNDDOWN(((E70-48)*0.8),0) -> 6 | I70: 3.5
A71: 2 | B71: Archie Coulter | C71: 338 | D71: 6 | E71: =SUM(C71/D71) -> 56.333333333333336 | F71: =ROUNDDOWN(((E71-48)*0.8),0) -> 6 | G71: 58 | H71: 1 | I71: 1 | J71: Rios
A72: 3 | B72: Josh Spang | C72: 264 | D72: 5 | E72: =SUM(C72/D72) -> 52.800 | F72: =ROUNDDOWN(((E72-48)*0.8),0) -> 3 | G72: 52 | I72: 1.5
A73: 2 | B73: Dustin Snodgress | C73: 314 | D73: 5 | E73: =SUM(C73/D73) -> 62.800 | F73: =ROUNDDOWN(((E73-48)*0.8),0) -> 11
A74: 3 | B74: Dan Lewis | C74: 228 | D74: 4 | E74: =SUM(C74/D74) -> 57.000 | F74: =ROUNDDOWN(((E74-48)*0.8),0) -> 7 | I74: 1
A75: =SUM(A74+1) -> 4 | B75: Kevin Stibal | C75: 104 | D75: 2 | E75: =SUM(C75/D75) -> 52.000 | F75: =ROUNDDOWN(((E75-48)*0.8),0) -> 3 | I75: 1
A76: =SUM(A75+1) -> 5 | B76: Nic Gordon | C76: 116 | D76: 2 | E76: =SUM(C76/D76) -> 58.000 | F76: =ROUNDDOWN(((E76-48)*0.8),0) -> 8 | G76: 58
A77: 7 | B77: Sills | C77: 119 | D77: 2 | E77: =SUM(C77/D77) -> 59.500 | F77: =ROUNDDOWN(((E77-48)*0.8),0) -> 9
A78: 8 | B78: Johnny Walker | C78: 122 | D78: 2 | E78: =SUM(C78/D78) -> 61.000 | F78: =ROUNDDOWN(((E78-48)*0.8),0) -> 10 | I78: 1
A79: 9 | B79: Kerri Haught | C79: 124 | D79: 2 | E79: =SUM(C79/D79) -> 62.000 | F79: =ROUNDDOWN(((E79-48)*0.8),0) -> 11
A80: 10 | B80: Steve Callaway | C80: 125 | D80: 2 | E80: =SUM(C80/D80) -> 62.500 | F80: =ROUNDDOWN(((E80-48)*0.8),0) -> 11
A81: 11 | B81: Matt Snyder | C81: 162 | D81: 2 | E81: =SUM(C81/D81) -> 81.000 | F81: =ROUNDDOWN(((E81-48)*0.8),0) -> 26
A82: 12 | B82: Miguel - Bowling Green | C82: 52 | D82: 1 | E82: =SUM(C82/D82) -> 52.000 | F82: 0 | I82: 1
A83: 13 | B83: Brandon Yancey | C83: 52 | D83: 1 | E83: =SUM(C83/D83) -> 52.000 | F83: 0
A84: 14 | B84: Mike William | C84: 53 | D84: 1 | E84: =SUM(C84/D84) -> 53.000 | F84: 0
A85: 15 | B85: Aaron | C85: 53 | D85: 1 | E85: =SUM(C85/D85) -> 53.000 | F85: 0
A86: 16 | B86: Caleb | C86: 54 | D86: 1 | E86: =SUM(C86/D86) -> 54.000 | F86: 0
A87: 17 | B87: Apollo | C87: 54 | D87: 1 | E87: =SUM(C87/D87) -> 54.000 | F87: 0
A88: 18 | B88: Dave Peyton | C88: 56 | D88: 1 | E88: =SUM(C88/D88) -> 56.000 | F88: 0
A89: 19 | B89: Mike Noth | C89: 57 | D89: 1 | E89: =SUM(C89/D89) -> 57.000 | F89: 0
A90: 20 | B90: Brian Snider | C90: 59 | D90: 1 | E90: =SUM(C90/D90) -> 59.000 | F90: 0
A91: 21 | B91: Jack Gilmore | C91: 59 | D91: 1 | E91: =SUM(C91/D91) -> 59.000 | F91: 0
A92: 22 | B92: Jesse Kirk | C92: 60 | D92: 1 | E92: =SUM(C92/D92) -> 60.000 | F92: 0
A93: 23 | B93: Dustin Nohr | C93: 64 | D93: 1 | E93: =SUM(C93/D93) -> 64.000 | F93: 0
A94: 24 | B94: Craig Eastin | C94: 65 | D94: 1 | E94: =SUM(C94/D94) -> 65.000 | F94: 0
A95: 25 | C95: 0 | D95: 1 | E95: =SUM(C95/D95) -> 0.000 | F95: =ROUNDDOWN(((E95-50)*0.8),0) -> -40
A96: 26 | C96: 0 | D96: 1 | E96: =SUM(C96/D96) -> 0.000 | F96: =ROUNDDOWN(((E96-50)*0.8),0) -> -40
A97: 27 | C97: 0 | D97: 1 | E97: =SUM(C97/D97) -> 0.000 | F97: =ROUNDDOWN(((E97-50)*0.8),0) -> -40
A98: 28 | C98: 0 | D98: 1 | E98: =SUM(C98/D98) -> 0.000 | F98: =ROUNDDOWN(((E98-50)*0.8),0) -> -40
A99: 29 | C99: 0 | D99: 1 | E99: =SUM(C99/D99) -> 0.000 | F99: =ROUNDDOWN(((E99-50)*0.8),0) -> -40
A100: 30
A101: 31
A102: 25 | B102: Max Ostby | C102: 66 | D102: 1 | E102: 66.000 | F102: 0
A104: 2013 SBDGL Team Standings
B105: TEAM # | C105: BUSH | E105: Total Points | F105: Team Points | G105: Team Avg
A106: 1 | B106: 12 | C106: Ian Jacobs & Andrew Greco | E106: 27 | F106: 9.5 | G106: =AVERAGE(E5,E38) -> 53.571428571428569
A107: 2 | B107: 6 | C107: Ryan Clark & Ben Sandel | E107: 24.5 | F107: 8 | G107: =AVERAGE(E26,E49) -> 57.035714285714292
A108: 3 | B108: 13 | C108: Matt Whitlock & Greg Dye | E108: 24 | F108: 8.5 | G108: =AVERAGE(E29,E67) -> 60.807692307692307
A109: 4 | B109: 16 | C109: Tim Peyton & Josh Beachy | E109: 24 | F109: 8 | G109: =AVERAGE(E10,E12) -> 52.425824175824175
A110: 5 | B110: 3 | C110: Erik Smith & KVN | E110: 24 | F110: 7.5 | G110: =AVERAGE(E54,E17) -> 56.964285714285715
A111: 6 | B111: 10 | C111: Adam Miller & Mitch Lerch | E111: 23.5 | F111: 7.5 | G111: =AVERAGE(E20,E63) -> 58.340659340659343
A112: 7 | B112: 11 | C112: Matt Weiben & Kirby Callanhan | E112: 22.5 | F112: 9 | G112: =AVERAGE(E13,E23) -> 54.107142857142861
A113: 8 | B113: 4 | C113: Marty Reis & Travis Pike | E113: 22 | F113: 8.5 | G113: =AVERAGE(E43,E46) -> 57.63095238095238
A114: 9 | B114: 9 | C114: Tim Troyna & Pat Cutsforth | E114: 22 | F114: 7 | G114: =AVERAGE(E52,E61) -> 60.57692307692308
A115: 10 | B115: 8 | C115: Jesse Streinz & Bob Hernandez | E115: 21 | F115: 6 | G115: =AVERAGE(E27,E31) -> 55.285714285714292
A116: 11 | B116: 7 | C116: Doug Johnson & Adam Stiers | E116: 19 | F116: 6.5 | G116: =AVERAGE(E14,E33) -> 54.489010989010993
A117: 12 | B117: 14 | C117: Matt Fritz & Jason Rimrodt | E117: 18.5 | F117: 5.5 | G117: =AVERAGE(E6,E48) -> 54.428571428571431
A118: 13 | B118: 5 | C118: Average Joe & Chris Clime | E118: 17.5 | F118: 6 | G118: =AVERAGE(E28,E62) -> 58.651098901098905
A119: 14 | B119: 2 | C119: Sarah Potter & Kollin Grimm | E119: 17 | F119: 5 | G119: =AVERAGE(E24,E64) -> 59.357142857142861
A120: 15 | B120: 1 | C120: D Burns & Adam Henderson | E120: 13 | F120: 4 | G120: =AVERAGE(E55,E59) -> 61.178571428571431
A121: 16 | B121: 15 | C121: Nathan Veeder & Tony Rios | E121: 12 | F121: 3.5 | G121: =AVERAGE(E39,E47) -> 57.204545454545453
B123: TEAM # | C123: WHACKER
A124: 1 | B124: 17 | C124: Chuck Yanda & Nate Robbins | E124: 29.5 | F124: 10 | G124: =AVERAGE(E16,E32) -> 54.714285714285715
A125: 2 | B125: 30 | C125: Joel Knutson & Travis Fruendt | E125: 29.5 | F125: 10 | G125: =AVERAGE(E34,E30) -> 55.571428571428569
A126: 3 | B126: 27 | C126: Kurt Conrad & Dan Kent | E126: 28.5 | F126: 11 | G126: =AVERAGE(E11,E18) -> 53.035714285714285
A127: 4 | B127: 23 | C127: Doug Peyton & Adam Chittenden | E127: 25.5 | F127: 9.5 | G127: =AVERAGE(E7,E56) -> 55.821428571428569
A128: 5 | B128: 22 | C128: Jeremy Farnsworth & Tony Ebson | E128: 24.5 | F128: 9 | G128: =AVERAGE(E9,E65) -> 57.664835164835168
A129: 6 | B129: 29 | C129: Adam Olsen & Matt Shannon | E129: 23.5 | F129: 7 | G129: =AVERAGE(E50,E4) -> 53.071428571428569
A130: 7 | B130: 24 | C130: Ryan Hamilton & Rob Mumma | E130: 22 | F130: 7.5 | G130: =AVERAGE(E35,E36) -> 56.000
A131: 8 | B131: 21 | C131: Ryan Eggleston & Shane Thirtyacre | E131: 22 | F131: 7 | G131: =AVERAGE(E42,E60) -> 59.607142857142861
A132: 9 | B132: 32 | C132: Dan Kern & Shirtless Bill | E132: 22 | F132: 6.5 | G132: =AVERAGE(E8,E39) -> 54.035714285714285
A133: 10 | B133: 26 | C133: Joe French & Matt Wycoff | E133: 21.5 | F133: 7.5 | G133: =AVERAGE(E19,E45) -> 55.894230769230774
A134: 11 | B134: 19 | C134: Drew Detert & Anthony Moody | E134: 17.5 | F134: 6 | G134: =AVERAGE(E22,E51) -> 56.928571428571431
A135: 12 | B135: 25 | C135: Ryan Wodstrchill & Phil Campos | E135: 15.5 | F135: 6 | G135: =AVERAGE(E15,E40) -> 55.125
A136: 13 | B136: 20 | C136: Dustin Utley & Tom Pepper | E136: 15.5 | F136: 5.5 | G136: =AVERAGE(E25,E58) -> 58.363095238095241
A137: 14 | B137: 28 | C137: Tim Potter & David McCuskey | E137: 15 | F137: 4.5 | G137: =AVERAGE(E21,E53) -> 57.250
A138: 15 | B138: 18 | C138: Jason Shook & Josh McFarland | E138: 14.5 | F138: 3.5 | G138: =AVERAGE(E41,E44) -> 57.32692307692308
A139: 16 | B139: 31 | C139: Spencer Eubanks & Shawn Hullinger | E139: 14 | F139: 3.5 | G139: =AVERAGE(E57,E66) -> 62.714285714285708