A1: 2013 S.B.D.G.L. STANDINGS Through Week 8 Turkey
A2: Rank | B2: Player | C2: Total Strokes | D2: Weeks | E2: Average | F2: H-Cap | G2: Last | H2: Week Pt. | I2: Total Pts. | J2: Sub Pts.
A4: =A3+1 -> 1 | B4: Adam Olsen | C4: 381 | D4: 8 | E4: =(C4/D4) -> 47.625 | F4: =ROUNDDOWN(((E4-48)*0.8),0) -> 0 | G4: 51 | H4: 0.5 | I4: 7
A5: =A4+1 -> 2 | B5: Jason Rimrodt | C5: 409 | D5: 8 | E5: =(C5/D5) -> 51.125 | F5: =ROUNDDOWN(((E5-48)*0.8),0) -> 2 | G5: 52 | H5: 0 | I5: 7
A6: =A5+1 -> 3 | B6: Doug Peyton | C6: 410 | D6: 8 | E6: =(C6/D6) -> 51.250 | F6: =ROUNDDOWN(((E6-48)*0.8),0) -> 2 | G6: 51 | H6: 1 | I6: 7
A7: =A6+1 -> 4 | B7: Andrew Greco | C7: 411 | D7: 8 | E7: =(C7/D7) -> 51.375 | F7: =ROUNDDOWN(((E7-48)*0.8),0) -> 2 | G7: 53 | H7: 0.5 | I7: 5.5
A8: =A7+1 -> 5 | B8: Tim Peyton | C8: 412 | D8: 8 | E8: =(C8/D8) -> 51.500 | F8: =ROUNDDOWN(((E8-48)*0.8),0) -> 2 | G8: 50 | H8: 1 | I8: 6
A9: =A8+1 -> 6 | B9: Dan Kern | C9: 419 | D9: 8 | E9: =(C9/D9) -> 52.375 | F9: =ROUNDDOWN(((E9-48)*0.8),0) -> 3 | G9: 50 | H9: 0 | I9: 4
A10: =A9+1 -> 7 | B10: Doug Johnson | C10: 424 | D10: 8 | E10: =(C10/D10) -> 53.000 | F10: =ROUNDDOWN(((E10-48)*0.8),0) -> 4 | G10: 54 | H10: 0.5 | I10: 4.5
A11: =A10+1 -> 8 | B11: Kurt Conrad | C11: 425 | D11: 8 | E11: =(C11/D11) -> 53.125 | F11: =ROUNDDOWN(((E11-48)*0.8),0) -> 4 | G11: 53 | H11: 0 | I11: 4
A12: =A11+1 -> 9 | B12: Matt Wieben | C12: 426 | D12: 8 | E12: =(C12/D12) -> 53.250 | F12: =ROUNDDOWN(((E12-48)*0.8),0) -> 4 | G12: 51 | H12: 1 | I12: 3
A13: =A12+1 -> 10 | B13: Jeremy Farnsworth | C13: 431 | D13: 8 | E13: =(C13/D13) -> 53.875 | F13: =ROUNDDOWN(((E13-48)*0.8),0) -> 4 | G13: 61 | H13: 0 | I13: 4
A14: =A13+1 -> 11 | B14: Ryan Wodstrchill | C14: 432 | D14: 8 | E14: =(C14/D14) -> 54.000 | F14: =ROUNDDOWN(((E14-48)*0.8),0) -> 4 | G14: 59 | H14: 0 | I14: 2.5
A15: =A14+1 -> 12 | B15: Adam Stiers | C15: 435 | D15: 8 | E15: =(C15/D15) -> 54.375 | F15: =ROUNDDOWN(((E15-48)*0.8),0) -> 5 | G15: 50 | H15: 1 | I15: 5
A16: =A15+1 -> 13 | B16: Joe French | C16: 436 | D16: 8 | E16: =(C16/D16) -> 54.500 | F16: =ROUNDDOWN(((E16-48)*0.8),0) -> 5 | G16: 50 | H16: 1 | I16: 4
A17: =A16+1 -> 14 | B17: Dustin Utley | C17: 436 | D17: 8 | E17: =(C17/D17) -> 54.500 | F17: =ROUNDDOWN(((E17-48)*0.8),0) -> 5 | G17: 53 | H17: 1 | I17: 3
A18: =A17+1 -> 15 | B18: Josh Beachy | C18: 382 | D18: 7 | E18: =(C18/D18) -> 54.571428571428569 | F18: =ROUNDDOWN(((E18-48)*0.8),0) -> 5 | G18: 51 | H18: 1 | I18: 3.5
A19: =A18+1 -> 16 | B19: Tim Potter | C19: 437 | D19: 8 | E19: =(C19/D19) -> 54.625 | F19: =ROUNDDOWN(((E19-48)*0.8),0) -> 5 | G19: 57 | H19: 0 | I19: 2
A20: =A19+1 -> 17 | B20: Nate Robins | C20: 438 | D20: 8 | E20: =(C20/D20) -> 54.750 | F20: =ROUNDDOWN(((E20-48)*0.8),0) -> 5 | G20: 52 | H20: 1 | I20: 4.5
A21: =A20+1 -> 18 | B21: Dan Kent | C21: 440 | D21: 8 | E21: =(C21/D21) -> 55.000 | F21: =ROUNDDOWN(((E21-48)*0.8),0) -> 5 | G21: 51 | H21: 1 | I21: 6.5
A22: =A21+1 -> 19 | B22: Rob Mumma | C22: 442 | D22: 8 | E22: =(C22/D22) -> 55.250 | F22: =ROUNDDOWN(((E22-48)*0.8),0) -> 5 | G22: 52 | H22: 1 | I22: 5.5
A23: =A22+1 -> 20 | B23: KVN Lavley | C23: 442 | D23: 8 | E23: =(C23/D23) -> 55.250 | F23: =ROUNDDOWN(((E23-48)*0.8),0) -> 5 | G23: 58 | H23: 0 | I23: 4.5
A24: =A23+1 -> 21 | B24: Drew Detert | C24: 442 | D24: 8 | E24: =(C24/D24) -> 55.250 | F24: =ROUNDDOWN(((E24-48)*0.8),0) -> 5 | G24: 51 | H24: 1 | I24: 4.5
A25: =A24+1 -> 22 | B25: Joel Knutson | C25: 444 | D25: 8 | E25: =(C25/D25) -> 55.500 | F25: =ROUNDDOWN(((E25-48)*0.8),0) -> 6 | G25: 50 | H25: 1 | I25: 5.5
A26: =A25+1 -> 23 | B26: Kirby Callahan | C26: 445 | D26: 8 | E26: =(C26/D26) -> 55.625 | F26: =ROUNDDOWN(((E26-48)*0.8),0) -> 6 | G26: 53 | H26: 1 | I26: 3.5
A27: =A26+1 -> 24 | B27: Adam Miller | C27: 446 | D27: 8 | E27: =(C27/D27) -> 55.750 | F27: =ROUNDDOWN(((E27-48)*0.8),0) -> 6 | G27: 64 | H27: 0 | I27: 2.5
A28: =A27+1 -> 25 | B28: Ryan Clark | C28: 447 | D28: 8 | E28: =(C28/D28) -> 55.875 | F28: =ROUNDDOWN(((E28-48)*0.8),0) -> 6 | G28: 53 | H28: 1 | I28: 6
A29: =A28+1 -> 26 | B29: Kollin Grimm | C29: 447 | D29: 8 | E29: =(C29/D29) -> 55.875 | F29: =ROUNDDOWN(((E29-48)*0.8),0) -> 6 | G29: 52 | H29: 1 | I29: 4
A30: =A29+1 -> 27 | B30: Bob Hernadez | C30: 448 | D30: 8 | E30: =(C30/D30) -> 56.000 | F30: =ROUNDDOWN(((E30-48)*0.8),0) -> 6 | G30: 54 | H30: 0 | I30: 6
A31: =A30+1 -> 28 | B31: Shirtless Bill | C31: 449 | D31: 8 | E31: =(C31/D31) -> 56.125 | F31: =ROUNDDOWN(((E31-48)*0.8),0) -> 6 | G31: 56 | H31: 1 | I31: 4.5
A32: =A31+1 -> 29 | B32: Nate Veeder | C32: 450 | D32: 8 | E32: =(C32/D32) -> 56.250 | F32: =ROUNDDOWN(((E32-48)*0.8),0) -> 6 | G32: 57 | H32: 0.5 | I32: 3
A33: =A32+1 -> 30 | B33: Chris Clime | C33: 450 | D33: 8 | E33: =(C33/D33) -> 56.250 | F33: =ROUNDDOWN(((E33-48)*0.8),0) -> 6 | G33: 53 | H33: 0 | I33: 3
A34: =A33+1 -> 31 | B34: Greg Dye | C34: 451 | D34: 8 | E34: =(C34/D34) -> 56.375 | F34: =ROUNDDOWN(((E34-48)*0.8),0) -> 6 | G34: 50 | H34: 1 | I34: 6
A35: =A34+1 -> 32 | B35: Jesse Streinz | C35: 451 | D35: 8 | E35: =(C35/D35) -> 56.375 | F35: =ROUNDDOWN(((E35-48)*0.8),0) -> 6 | G35: 57 | H35: 0 | I35: 3
A36: =A35+1 -> 33 | B36: Phil Campos | C36: 400 | D36: 7 | E36: =(C36/D36) -> 57.142857142857146 | F36: =ROUNDDOWN(((E36-48)*0.8),0) -> 7 | I36: 1 | J36: 0
A37: =A36+1 -> 34 | B37: Travis Fruendt | C37: 458 | D37: 8 | E37: =(C37/D37) -> 57.250 | F37: =ROUNDDOWN(((E37-48)*0.8),0) -> 7 | G37: 57 | H37: 1 | I37: 7
A38: =A37+1 -> 35 | B38: Travis Pike | C38: 459 | D38: 8 | E38: =(C38/D38) -> 57.375 | F38: =ROUNDDOWN(((E38-48)*0.8),0) -> 7 | G38: 58 | H38: 0.5 | I38: 3
A39: =A38+1 -> 36 | B39: Ryan Hamilton | C39: 460 | D39: 8 | E39: =(C39/D39) -> 57.500 | F39: =ROUNDDOWN(((E39-48)*0.8),0) -> 7 | G39: 58 | H39: 0 | I39: 4
A40: =A39+1 -> 37 | B40: Matt Shannon | C40: 461 | D40: 8 | E40: =(C40/D40) -> 57.625 | F40: =ROUNDDOWN(((E40-48)*0.8),0) -> 7 | G40: 56 | H40: 0 | I40: 4
A41: =A40+1 -> 38 | B41: Chuck Yanda | C41: 463 | D41: 8 | E41: =(C41/D41) -> 57.875 | F41: =ROUNDDOWN(((E41-48)*0.8),0) -> 7 | G41: 57 | H41: 1 | I41: 6
A42: =A41+1 -> 39 | B42: Ryan Eggleston | C42: 463 | D42: 8 | E42: =(C42/D42) -> 57.875 | F42: =ROUNDDOWN(((E42-48)*0.8),0) -> 7 | G42: 58 | H42: 0.5 | I42: 4.5
A43: =A42+1 -> 40 | B43: Matt Fritz | C43: 463 | D43: 8 | E43: =(C43/D43) -> 57.875 | F43: =ROUNDDOWN(((E43-48)*0.8),0) -> 7 | G43: 60 | H43: 0 | I43: 2
A44: =A43+1 -> 41 | B44: Tony Rios | C44: 406 | D44: 7 | E44: =(C44/D44) -> 58.000 | F44: =ROUNDDOWN(((E44-48)*0.8),0) -> 8 | G44: 62 | H44: 0 | I44: 3
A45: =A44+1 -> 42 | B45: Matt Wyckoff | C45: 406 | D45: 7 | E45: =(C45/D45) -> 58.000 | F45: =ROUNDDOWN(((E45-48)*0.8),0) -> 8 | G45: 61 | H45: 0 | I45: 3
A46: =A45+1 -> 43 | B46: Ian Jacobs | C46: 465 | D46: 8 | E46: =(C46/D46) -> 58.125 | F46: =ROUNDDOWN(((E46-48)*0.8),0) -> 8 | G46: 57 | H46: 0.5 | I46: 4
A47: =A46+1 -> 44 | B47: Josh McFarland | C47: 465 | D47: 8 | E47: =(C47/D47) -> 58.125 | F47: =ROUNDDOWN(((E47-48)*0.8),0) -> 8 | G47: 58 | H47: 0 | I47: 1
A48: =A47+1 -> 45 | B48: Martin Reis | C48: 466 | D48: 8 | E48: =(C48/D48) -> 58.250 | F48: =ROUNDDOWN(((E48-48)*0.8),0) -> 8 | G48: 57 | H48: 0.5 | I48: 3.5
A49: =A48+1 -> 46 | B49: Jason Shook | C49: 409 | D49: 7 | E49: =(C49/D49) -> 58.428571428571431 | F49: =ROUNDDOWN(((E49-48)*0.8),0) -> 8 | G49: 58 | H49: 1 | I49: 3
A50: =A49+1 -> 47 | B50: Tim Troyna | C50: 476 | D50: 8 | E50: =(C50/D50) -> 59.500 | F50: =ROUNDDOWN(((E50-48)*0.8),0) -> 9 | G50: 61 | H50: 1 | I50: 3
A51: =A50+1 -> 48 | B51: Ben Sandell | C51: 477 | D51: 8 | E51: =(C51/D51) -> 59.625 | F51: =ROUNDDOWN(((E51-48)*0.8),0) -> 9 | G51: 59 | H51: 1 | I51: 6
A52: =A51+1 -> 49 | B52: David McCuskey | C52: 477 | D52: 8 | E52: =(C52/D52) -> 59.625 | F52: =ROUNDDOWN(((E52-48)*0.8),0) -> 9 | G52: 59 | H52: 0.5 | I52: 3.5
A53: =A52+1 -> 50 | B53: Adam Henderson | C53: 481 | D53: 8 | E53: =(C53/D53) -> 60.125 | F53: =ROUNDDOWN(((E53-48)*0.8),0) -> 9 | G53: 63 | H53: 0 | I53: 3.5
A54: =A53+1 -> 51 | B54: Anthony Moody | C54: 481 | D54: 8 | E54: =(C54/D54) -> 60.125 | F54: =ROUNDDOWN(((E54-48)*0.8),0) -> 9 | G54: 62 | H54: 0 | I54: 2.5
A55: =A54+1 -> 52 | B55: Shane Thirtyacre | C55: 485 | D55: 8 | E55: =(C55/D55) -> 60.625 | F55: =ROUNDDOWN(((E55-48)*0.8),0) -> 10 | G55: 58 | H55: 1 | I55: 4
A56: 53 | B56: Adam Chittenden | C56: 489 | D56: 8 | E56: =(C56/D56) -> 61.125 | F56: =ROUNDDOWN(((E56-48)*0.8),0) -> 10 | G56: 63 | H56: 0 | I56: 5
A57: 54 | B57: Erik Smith | C57: 491 | D57: 8 | E57: =(C57/D57) -> 61.375 | F57: =ROUNDDOWN(((E57-48)*0.8),0) -> 10 | G57: 59 | H57: 0 | I57: 2
A58: 55 | B58: D Burns | C58: 494 | D58: 8 | E58: =(C58/D58) -> 61.750 | F58: =ROUNDDOWN(((E58-48)*0.8),0) -> 11 | G58: 65 | H58: 0 | I58: 3
A59: 56 | B59: Tom Pepper | C59: 372 | D59: 6 | E59: =(C59/D59) -> 62.000 | F59: =ROUNDDOWN(((E59-48)*0.8),0) -> 11 | I59: 3 | J59: 0.5
A60: 57 | B60: Spencer Eubanks | C60: 496 | D60: 8 | E60: =(C60/D60) -> 62.000 | F60: =ROUNDDOWN(((E60-48)*0.8),0) -> 11 | G60: 62 | H60: 0 | I60: 1.5
A61: 58 | B61: Pat Cutsforth | C61: 498 | D61: 8 | E61: =(C61/D61) -> 62.250 | F61: =ROUNDDOWN(((E61-48)*0.8),0) -> 11 | G61: 55 | H61: 1 | I61: 6.5
A62: 59 | B62: Sarah Potter | C62: 504 | D62: 8 | E62: =(C62/D62) -> 63.000 | F62: =ROUNDDOWN(((E62-48)*0.8),0) -> 12 | G62: 60 | H62: 1 | I62: 3.5
A63: 60 | B63: Avg Joe | C63: 505 | D63: 8 | E63: =(C63/D63) -> 63.125 | F63: =ROUNDDOWN(((E63-48)*0.8),0) -> 12 | G63: 63 | H63: 0 | I63: 2
A64: 61 | B64: Mitch Lerch | C64: 506 | D64: 8 | E64: =(C64/D64) -> 63.250 | F64: =ROUNDDOWN(((E64-48)*0.8),0) -> 12 | G64: 61 | H64: 0 | I64: 4
A65: 62 | B65: Shawn Hullinger | C65: 514 | D65: 8 | E65: =(C65/D65) -> 64.250 | F65: =ROUNDDOWN(((E65-48)*0.8),0) -> 13 | G65: 64 | H65: 1 | I65: 3
A66: 63 | B66: Tony Ebson | C66: 519 | D66: 8 | E66: =(C66/D66) -> 64.875 | F66: =ROUNDDOWN(((E66-48)*0.8),0) -> 13 | G66: 68 | H66: 0 | I66: 3
A67: 64 | B67: Matt Whitlock | C67: 534 | D67: 8 | E67: =(C67/D67) -> 66.750 | F67: =ROUNDDOWN(((E67-48)*0.8),0) -> 15 | G67: 64 | H67: 1 | I67: 3
A69: Subs | B69: Player | C69: Total Strokes | D69: Weeks | E69: Average | F69: H-Cap | G69: Last | H69: Week Pt. | I69: Total Pts. | J69: Subed For
A70: 1 | B70: Dustin Snodgress | C70: 314 | D70: 5 | E70: =SUM(C70/D70) -> 62.800 | F70: =ROUNDDOWN(((E70-48)*0.8),0) -> 11
A71: 2 | B71: Adam Karstens | C71: 179 | D71: 3 | E71: =SUM(C71/D71) -> 59.666666666666664 | F71: =ROUNDDOWN(((E71-48)*0.8),0) -> 9 | G71: 63 | H71: 0 | J71: CAMPOS
A72: 3 | B72: Archie Coulter | C72: 115 | D72: 2 | E72: =SUM(C72/D72) -> 57.500 | F72: =ROUNDDOWN(((E72-48)*0.8),0) -> 7 | G72: 57 | H72: 0.5 | I72: 0.5 | J72: PEPPER
A73: 4 | B73: Kerri Haught | C73: 124 | D73: 2 | E73: =SUM(C73/D73) -> 62.000 | F73: =ROUNDDOWN(((E73-48)*0.8),0) -> 11
A74: 5 | B74: Steve Callaway | C74: 125 | D74: 2 | E74: =SUM(C74/D74) -> 62.500 | F74: =ROUNDDOWN(((E74-48)*0.8),0) -> 11 | G74: 65
A75: 6 | B75: Matt Snyder | C75: 162 | D75: 2 | E75: =SUM(C75/D75) -> 81.000 | F75: =ROUNDDOWN(((E75-48)*0.8),0) -> 26
A76: 7 | B76: Dan Lewis | C76: 63 | D76: 1 | E76: =SUM(C76/D76) -> 63.000 | F76: 0
A77: 8 | B77: Dustin Nohr | C77: 64 | D77: 1 | E77: =SUM(C77/D77) -> 64.000 | F77: 0
A78: 9 | B78: Jack Gilmore | C78: 59 | D78: 1 | E78: =SUM(C78/D78) -> 59.000 | F78: 0 | G78: 59
A79: 10 | B79: Johnny Walker | C79: 64 | D79: 1 | E79: =SUM(C79/D79) -> 64.000 | F79: 0
A80: 11 | B80: Josh Spang | C80: 57 | D80: 1 | E80: =SUM(C80/D80) -> 57.000 | F80: 0
A81: 11 | C81: 0 | D81: 1 | E81: =SUM(C81/D81) -> 0.000 | F81: =ROUNDDOWN(((E81-50)*0.8),0) -> -40
A82: 12 | C82: 0 | D82: 1 | E82: =SUM(C82/D82) -> 0.000 | F82: =ROUNDDOWN(((E82-50)*0.8),0) -> -40
A83: 13 | C83: 0 | D83: 1 | E83: =SUM(C83/D83) -> 0.000 | F83: =ROUNDDOWN(((E83-50)*0.8),0) -> -40
A84: 14 | C84: 0 | D84: 1 | E84: =SUM(C84/D84) -> 0.000 | F84: =ROUNDDOWN(((E84-50)*0.8),0) -> -40
A85: 15 | C85: 0 | D85: 1 | E85: =SUM(C85/D85) -> 0.000 | F85: =ROUNDDOWN(((E85-50)*0.8),0) -> -40
A86: 16 | C86: 0 | D86: 1 | E86: =SUM(C86/D86) -> 0.000 | F86: =ROUNDDOWN(((E86-50)*0.8),0) -> -40
A87: 17 | C87: 0 | D87: 1 | E87: =SUM(C87/D87) -> 0.000 | F87: =ROUNDDOWN(((E87-50)*0.8),0) -> -40
A88: 18 | C88: 0 | D88: 1 | E88: =SUM(C88/D88) -> 0.000 | F88: =ROUNDDOWN(((E88-50)*0.8),0) -> -40
A89: 19 | C89: 0 | D89: 1 | E89: =SUM(C89/D89) -> 0.000 | F89: =ROUNDDOWN(((E89-50)*0.8),0) -> -40
A90: 20 | C90: 0 | D90: 1 | E90: =SUM(C90/D90) -> 0.000 | F90: =ROUNDDOWN(((E90-50)*0.8),0) -> -40
A91: 21 | C91: 0 | D91: 1 | E91: =SUM(C91/D91) -> 0.000 | F91: =ROUNDDOWN(((E91-50)*0.8),0) -> -40
A92: 22 | C92: 0 | D92: 1 | E92: =SUM(C92/D92) -> 0.000 | F92: =ROUNDDOWN(((E92-50)*0.8),0) -> -40
A93: 23 | C93: 0 | D93: 1 | E93: =SUM(C93/D93) -> 0.000 | F93: =ROUNDDOWN(((E93-50)*0.8),0) -> -40
A94: 24 | C94: 0 | D94: 1 | E94: =SUM(C94/D94) -> 0.000 | F94: =ROUNDDOWN(((E94-50)*0.8),0) -> -40
A95: 25 | C95: 0 | D95: 1 | E95: =SUM(C95/D95) -> 0.000 | F95: =ROUNDDOWN(((E95-50)*0.8),0) -> -40
A96: 26 | C96: 0 | D96: 1 | E96: =SUM(C96/D96) -> 0.000 | F96: =ROUNDDOWN(((E96-50)*0.8),0) -> -40
A97: 27 | C97: 0 | D97: 1 | E97: =SUM(C97/D97) -> 0.000 | F97: =ROUNDDOWN(((E97-50)*0.8),0) -> -40
A98: 28 | C98: 0 | D98: 1 | E98: =SUM(C98/D98) -> 0.000 | F98: =ROUNDDOWN(((E98-50)*0.8),0) -> -40
A99: 28 | C99: 0 | D99: 1 | E99: =SUM(C99/D99) -> 0.000 | F99: =ROUNDDOWN(((E99-50)*0.8),0) -> -40
A100: 4
A101: 5
A103: 2013 SBDGL Team Standings
B104: TEAM # | C104: BUSH | E104: Total Points | F104: Team Points | G104: Team Avg
A105: 1 | B105: 6 | C105: Ryan Clark & Ben Sandel | E105: 18 | F105: 6 | G105: =AVERAGE(E51,E28) -> 57.750
A106: 2 | B106: 7 | C106: Doug Johnson & Adam Stiers | E106: 14.5 | F106: 5 | G106: =AVERAGE(E10,E15) -> 53.6875
A107: 3 | B107: 9 | C107: Tim Troyna & Pat Cutsforth | E107: 14.5 | F107: 5 | G107: =AVERAGE(E61,E50) -> 60.875
A108: 4 | B108: 16 | C108: Tim Peyton & Josh Beachy | E108: 14 | F108: 4.5 | G108: =AVERAGE(E18,E8) -> 53.035714285714285
A109: 5 | B109: 12 | C109: Ian Jacobs & Andrew Greco | E109: 14 | F109: 4.5 | G109: =AVERAGE(E7,E46) -> 54.750
A110: 6 | B110: 13 | C110: Matt Whitlock & Greg Dye | E110: 13.5 | F110: 4.5 | G110: =AVERAGE(E34,E67) -> 61.5625
A111: 7 | B111: 8 | C111: Jesse Streinz & Bob Hernandez | E111: 13 | F111: 4 | G111: =AVERAGE(E35,E30) -> 56.1875
A112: 8 | B112: 14 | C112: Matt Fritz & Jason Rimrodt | E112: 12.5 | F112: 3.5 | G112: =AVERAGE(E5,E43) -> 54.500
A113: 9 | B113: 11 | C113: Matt Weiben & Kirby Callanhan | E113: 11.5 | F113: 5 | G113: =AVERAGE(E26,E12) -> 54.4375
A114: 10 | B114: 2 | C114: Sarah Potter & Kollin Grimm | E114: 11.5 | F114: 4 | G114: =AVERAGE(E29,E62) -> 59.4375
A115: 11 | B115: 4 | C115: Marty Reis & Travis Pike | E115: 11 | F115: 4.5 | G115: =AVERAGE(E38,E48) -> 57.8125
A116: 12 | B116: 3 | C116: Erik Smith & KVN | E116: 9.5 | F116: 3 | G116: =AVERAGE(E57,E23) -> 58.3125
A117: 13 | B117: 10 | C117: Adam Miller & Mitch Lerch | E117: 9.5 | F117: 3 | G117: =AVERAGE(E27,E64) -> 59.500
A118: 14 | B118: 1 | C118: D Burns & Adam Henderson | E118: 9.5 | F118: 3 | G118: =AVERAGE(E53,E58) -> 60.9375
A119: 15 | B119: 15 | C119: Nathan Veeder & Tony Rios | E119: 8.5 | F119: 2.5 | G119: =AVERAGE(E32,E44) -> 57.125
A120: 16 | B120: 5 | C120: Average Joe & Chris Clime | E120: 7 | F120: 2 | G120: =AVERAGE(E63,E33) -> 59.6875
B122: TEAM # | C122: WHACKER
A123: 1 | B123: 23 | C123: Doug Peyton & Adam Chittenden | E123: 19.5 | F123: 7.5 | G123: =AVERAGE(E6,E56) -> 56.1875
A124: 2 | B124: 30 | C124: Joel Knutson & Travis Fruendt | E124: 19.5 | F124: 7 | G124: =AVERAGE(E37,E25) -> 56.375
A125: 3 | B125: 27 | C125: Kurt Conrad & Dan Kent | E125: 16.5 | F125: 6 | G125: =AVERAGE(E11,E21) -> 54.0625
A126: 4 | B126: 29 | C126: Adam Olsen & Matt Shannon | E126: 16 | F126: 5 | G126: =AVERAGE(E4,E40) -> 52.625
A127: 5 | B127: 24 | C127: Ryan Hamilton & Rob Mumma | E127: 14 | F127: 4.5 | G127: =AVERAGE(E39,E22) -> 56.375
A128: 6 | B128: 21 | C128: Ryan Eggleston & Shane Thirtyacre | E128: 14 | F128: 4.5 | G128: =AVERAGE(E42,E55) -> 59.250
A129: 7 | B129: 17 | C129: Chuck Yanda & Nate Robbins | E129: 13.5 | F129: 4 | G129: =AVERAGE(E20,E41) -> 56.3125
A130: 8 | B130: 32 | C130: Dan Kern & Shirtless Bill | E130: 12 | F130: 3.5 | G130: =AVERAGE(E31,E9) -> 54.250
A131: 9 | B131: 26 | C131: Joe French & Matt Wycoff | E131: 11.5 | F131: 4.5 | G131: =AVERAGE(E45,E16) -> 56.250
A132: 10 | B132: 22 | C132: Jeremy Farnsworth & Tony Ebson | E132: 11 | F132: 4 | G132: =AVERAGE(E13,E66) -> 59.375
A133: 11 | B133: 20 | C133: Dustin Utley & Tom Pepper | E133: 10 | F133: 3.5 | G133: =AVERAGE(E17,E59) -> 58.250
A134: 12 | B134: 19 | C134: Drew Detert & Anthony Moody | E134: 10 | F134: 3 | G134: =AVERAGE(E24,E54) -> 57.6875
A135: 13 | B135: 28 | C135: Tim Potter & David McCuskey | E135: 8 | F135: 2.5 | G135: =AVERAGE(E19,E52) -> 57.125
A136: 14 | B136: 31 | C136: Spencer Eubanks & Shawn Hullinger | E136: 6 | F136: 1.5 | G136: =AVERAGE(E60,E65) -> 63.125
A137: 15 | B137: 25 | C137: Ryan Wodstrchill & Phil Campos | E137: 5.5 | F137: 2 | G137: =AVERAGE(E14,E36) -> 55.571428571428569
A138: 16 | B138: 18 | C138: Jason Shook & Josh McFarland | E138: 5 | F138: 1 | G138: =AVERAGE(E49,E47) -> 58.276785714285715