A1: 2013 S.B.D.G.L. STANDINGS Through Week 2 Sugar Bottom
A2: Rank | B2: Player | C2: Total Strokes | D2: Weeks | E2: Average | F2: H-Cap | G2: Last | H2: Week Pt. | I2: Total Pts. | J2: Sub Pts.
A4: =A3+1 -> 1 | B4: Adam Olsen ® | C4: 96 | D4: 2 | E4: =(C4/D4) -> 48.000 | F4: =ROUNDDOWN(((E4-48)*0.8),0) -> 0 | G4: 45 | H4: 1 | I4: 2
A5: =A4+1 -> 2 | B5: Doug Johnson | C5: 99 | D5: 2 | E5: =(C5/D5) -> 49.500 | F5: =ROUNDDOWN(((E5-48)*0.8),0) -> 1 | G5: 48 | H5: 1 | I5: 2
A6: =A5+1 -> 3 | B6: Ryan Wodstrchill | C6: 102 | D6: 2 | E6: =(C6/D6) -> 51.000 | F6: =ROUNDDOWN(((E6-48)*0.8),0) -> 2 | G6: 48 | H6: 1 | I6: 2
A7: =A6+1 -> 4 | B7: Adam Miller | C7: 104 | D7: 2 | E7: =(C7/D7) -> 52.000 | F7: =ROUNDDOWN(((E7-48)*0.8),0) -> 3 | G7: 49 | H7: 1 | I7: 1.5
A8: =A7+1 -> 5 | B8: Andrew Greco | C8: 104 | D8: 2 | E8: =(C8/D8) -> 52.000 | F8: =ROUNDDOWN(((E8-48)*0.8),0) -> 3 | G8: 51 | H8: 1 | I8: 2
A9: =A8+1 -> 6 | B9: Josh Beachy | C9: 104 | D9: 2 | E9: =(C9/D9) -> 52.000 | F9: =ROUNDDOWN(((E9-48)*0.8),0) -> 3 | G9: 53 | H9: 1 | I9: 2
A10: =A9+1 -> 7 | B10: Jason Rimrodt | C10: 105 | D10: 2 | E10: =(C10/D10) -> 52.500 | F10: =ROUNDDOWN(((E10-48)*0.8),0) -> 3 | G10: 51 | H10: 1 | I10: 2
A11: =A10+1 -> 8 | B11: Tim Potter | C11: 105 | D11: 2 | E11: =(C11/D11) -> 52.500 | F11: =ROUNDDOWN(((E11-48)*0.8),0) -> 3 | G11: 51 | H11: 0 | I11: 1
A12: =A11+1 -> 9 | B12: Drew Detert | C12: 105 | D12: 2 | E12: =(C12/D12) -> 52.500 | F12: =ROUNDDOWN(((E12-48)*0.8),0) -> 3 | G12: 51 | H12: 1 | I12: 1.5
A13: =A12+1 -> 10 | B13: Doug Peyton | C13: 105 | D13: 2 | E13: =(C13/D13) -> 52.500 | F13: =ROUNDDOWN(((E13-48)*0.8),0) -> 3 | G13: 52 | H13: 1 | I13: 2
A14: =A13+1 -> 11 | B14: Travis Pike | C14: 107 | D14: 2 | E14: =(C14/D14) -> 53.500 | F14: =ROUNDDOWN(((E14-48)*0.8),0) -> 4 | G14: 55 | H14: 0.5 | I14: 1.5
A15: =A14+1 -> 12 | B15: Kurt Conrad | C15: 108 | D15: 2 | E15: =(C15/D15) -> 54.000 | F15: =ROUNDDOWN(((E15-48)*0.8),0) -> 4 | G15: 47 | H15: 1 | I15: 1
A16: =A15+1 -> 13 | B16: Dustin Utley | C16: 108 | D16: 2 | E16: =(C16/D16) -> 54.000 | F16: =ROUNDDOWN(((E16-48)*0.8),0) -> 4 | G16: 52 | H16: 0 | I16: 0.5
A17: =A16+1 -> 14 | B17: Kollin Grimm | C17: 109 | D17: 2 | E17: =(C17/D17) -> 54.500 | F17: =ROUNDDOWN(((E17-48)*0.8),0) -> 5 | G17: 50 | H17: 1 | I17: 2
A18: =A17+1 -> 15 | B18: Jeremy Farnsworth | C18: 109 | D18: 2 | E18: =(C18/D18) -> 54.500 | F18: =ROUNDDOWN(((E18-48)*0.8),0) -> 5 | G18: 53 | H18: 0 | I18: 0.5
A19: =A18+1 -> 16 | B19: Tim Peyton | C19: 109 | D19: 2 | E19: =(C19/D19) -> 54.500 | F19: =ROUNDDOWN(((E19-48)*0.8),0) -> 5 | G19: 54 | H19: 0 | I19: 1
A20: =A19+1 -> 17 | B20: Dan Kern | C20: 109 | D20: 2 | E20: =(C20/D20) -> 54.500 | F20: =ROUNDDOWN(((E20-48)*0.8),0) -> 5 | G20: 57 | H20: 0 | I20: 1
A21: =A20+1 -> 18 | B21: Matt Wieben | C21: 110 | D21: 2 | E21: =(C21/D21) -> 55.000 | F21: =ROUNDDOWN(((E21-48)*0.8),0) -> 5 | G21: 53 | H21: 0 | I21: 0
A22: =A21+1 -> 19 | B22: Kirby Callahan | C22: 110 | D22: 2 | E22: =(C22/D22) -> 55.000 | F22: =ROUNDDOWN(((E22-48)*0.8),0) -> 5 | G22: 53 | H22: 0 | I22: 1
A23: =A22+1 -> 20 | B23: Adam Stiers | C23: 110 | D23: 2 | E23: =(C23/D23) -> 55.000 | F23: =ROUNDDOWN(((E23-48)*0.8),0) -> 5 | G23: 54 | H23: 1 | I23: 2
A24: =A23+1 -> 21 | B24: Josh McFarland ® | C24: 111 | D24: 2 | E24: =(C24/D24) -> 55.500 | F24: =ROUNDDOWN(((E24-48)*0.8),0) -> 6 | G24: 52 | H24: 1 | I24: 1
A25: =A24+1 -> 22 | B25: Shirtless Bill | C25: 112 | D25: 2 | E25: =(C25/D25) -> 56.000 | F25: =ROUNDDOWN(((E25-48)*0.8),0) -> 6 | G25: 54 | H25: 0 | I25: 1
A26: =A25+1 -> 23 | B26: Ryan Clark ® | C26: 112 | D26: 2 | E26: =(C26/D26) -> 56.000 | F26: =ROUNDDOWN(((E26-48)*0.8),0) -> 6 | G26: 54 | H26: 1 | I26: 2
A27: =A26+1 -> 24 | B27: Phil Campos | C27: 114 | D27: 2 | E27: =(C27/D27) -> 57.000 | F27: =ROUNDDOWN(((E27-48)*0.8),0) -> 7 | G27: 57 | H27: 0 | I27: 1
A28: =A27+1 -> 25 | B28: Ryan Hamilton | C28: 115 | D28: 2 | E28: =(C28/D28) -> 57.500 | F28: =ROUNDDOWN(((E28-48)*0.8),0) -> 7 | G28: 54 | H28: 1 | I28: 1
A29: =A28+1 -> 26 | B29: Matt Fritz | C29: 115 | D29: 2 | E29: =(C29/D29) -> 57.500 | F29: =ROUNDDOWN(((E29-48)*0.8),0) -> 7 | G29: 54 | H29: 0 | I29: 1
A30: =A29+1 -> 27 | B30: Joe French ® | C30: 115 | D30: 2 | E30: =(C30/D30) -> 57.500 | F30: =ROUNDDOWN(((E30-48)*0.8),0) -> 7 | G30: 56 | H30: 0 | I30: 0
A31: =A30+1 -> 28 | B31: Tony Rios ® | C31: 116 | D31: 2 | E31: =(C31/D31) -> 58.000 | F31: =ROUNDDOWN(((E31-48)*0.8),0) -> 8 | G31: 55 | H31: 1 | I31: 1
A32: =A31+1 -> 29 | B32: Nate Robins ® | C32: 116 | D32: 2 | E32: =(C32/D32) -> 58.000 | F32: =ROUNDDOWN(((E32-48)*0.8),0) -> 8 | G32: 60 | H32: 0 | I32: 1
A33: =A32+1 -> 30 | B33: Nate Veeder | C33: 117 | D33: 2 | E33: =(C33/D33) -> 58.500 | F33: =ROUNDDOWN(((E33-48)*0.8),0) -> 8 | G33: 54 | H33: 0 | I33: 0
A34: =A33+1 -> 31 | B34: Chuck Yanda ® | C34: 117 | D34: 2 | E34: =(C34/D34) -> 58.500 | F34: =ROUNDDOWN(((E34-48)*0.8),0) -> 8 | G34: 55 | H34: 1 | I34: 2
A35: =A34+1 -> 32 | B35: Chris Clime | C35: 117 | D35: 2 | E35: =(C35/D35) -> 58.500 | F35: =ROUNDDOWN(((E35-48)*0.8),0) -> 8 | G35: 58 | H35: 0 | I35: 0
A36: =A35+1 -> 33 | B36: Rob Mumma | C36: 119 | D36: 2 | E36: =(C36/D36) -> 59.500 | F36: =ROUNDDOWN(((E36-48)*0.8),0) -> 9 | G36: 54 | H36: 1 | I36: 2
A37: =A36+1 -> 34 | B37: Joel Knutson | C37: 119 | D37: 2 | E37: =(C37/D37) -> 59.500 | F37: =ROUNDDOWN(((E37-48)*0.8),0) -> 9 | G37: 55 | H37: 1 | I37: 1
A38: =A37+1 -> 35 | B38: Jesse Streinz | C38: 119 | D38: 2 | E38: =(C38/D38) -> 59.500 | F38: =ROUNDDOWN(((E38-48)*0.8),0) -> 9 | G38: 58 | H38: 0 | I38: 0
A39: =A38+1 -> 36 | B39: David McCuskey | C39: 120 | D39: 2 | E39: =(C39/D39) -> 60.000 | F39: =ROUNDDOWN(((E39-48)*0.8),0) -> 9 | G39: 55 | H39: 1 | I39: 1
A40: =A39+1 -> 37 | B40: Jason Shook | C40: 120 | D40: 2 | E40: =(C40/D40) -> 60.000 | F40: =ROUNDDOWN(((E40-48)*0.8),0) -> 9 | G40: 55 | H40: 1 | I40: 1
A41: =A40+1 -> 38 | B41: Travis Fruendt | C41: 120 | D41: 2 | E41: =(C41/D41) -> 60.000 | F41: =ROUNDDOWN(((E41-48)*0.8),0) -> 9 | G41: 56 | H41: 1 | I41: 2
A42: =A41+1 -> 39 | B42: Ryan Eggleston | C42: 120 | D42: 2 | E42: =(C42/D42) -> 60.000 | F42: =ROUNDDOWN(((E42-48)*0.8),0) -> 9 | G42: 58 | H42: 0 | I42: 0.5
A43: =A42+1 -> 40 | B43: Dan Kent ® | C43: 120 | D43: 2 | E43: =(C43/D43) -> 60.000 | F43: =ROUNDDOWN(((E43-48)*0.8),0) -> 9 | G43: 59 | H43: 0.5 | I43: 1.5
A44: =A43+1 -> 41 | B44: Tim Troyna | C44: 120 | D44: 2 | E44: =(C44/D44) -> 60.000 | F44: =ROUNDDOWN(((E44-48)*0.8),0) -> 9 | G44: 61 | H44: 0 | I44: 0.5
A45: =A44+1 -> 42 | B45: Bob Hernadez ® | C45: 121 | D45: 2 | E45: =(C45/D45) -> 60.500 | F45: =ROUNDDOWN(((E45-48)*0.8),0) -> 10 | G45: 54 | H45: 1 | I45: 1
A46: =A45+1 -> 43 | B46: KVN Lavley | C46: 121 | D46: 2 | E46: =(C46/D46) -> 60.500 | F46: =ROUNDDOWN(((E46-48)*0.8),0) -> 10 | G46: 57 | H46: 0 | I46: 0
A47: =A46+1 -> 44 | B47: Martin Reis | C47: 121 | D47: 2 | E47: =(C47/D47) -> 60.500 | F47: =ROUNDDOWN(((E47-48)*0.8),0) -> 10 | G47: 59 | H47: 0 | I47: 1
A48: =A47+1 -> 45 | B48: Ian Jacobs ® | C48: 122 | D48: 2 | E48: =(C48/D48) -> 61.000 | F48: =ROUNDDOWN(((E48-48)*0.8),0) -> 10 | G48: 58 | H48: 0 | I48: 0
A49: =A48+1 -> 46 | B49: Erik Smith | C49: 123 | D49: 2 | E49: =(C49/D49) -> 61.500 | F49: =ROUNDDOWN(((E49-48)*0.8),0) -> 10 | G49: 57 | H49: 1 | I49: 1
A50: =A49+1 -> 47 | B50: Greg Dye | C50: 123 | D50: 2 | E50: =(C50/D50) -> 61.500 | F50: =ROUNDDOWN(((E50-48)*0.8),0) -> 10 | G50: 60 | H50: 1 | I50: 1
A51: =A50+1 -> 48 | B51: Ben Sandell ® | C51: 124 | D51: 2 | E51: =(C51/D51) -> 62.000 | F51: =ROUNDDOWN(((E51-48)*0.8),0) -> 11 | G51: 59 | H51: 0 | I51: 1
A52: =A51+1 -> 49 | B52: Tom Pepper | C52: 124 | D52: 2 | E52: =(C52/D52) -> 62.000 | F52: =ROUNDDOWN(((E52-48)*0.8),0) -> 11 | G52: 61 | H52: 0 | I52: 1
A53: =A52+1 -> 50 | B53: Matt Shannon | C53: 125 | D53: 2 | E53: =(C53/D53) -> 62.500 | F53: =ROUNDDOWN(((E53-48)*0.8),0) -> 11 | G53: 50 | H53: 1 | I53: 1
A54: =A53+1 -> 51 | B54: Shane Thirtyacre | C54: 125 | D54: 2 | E54: =(C54/D54) -> 62.500 | F54: =ROUNDDOWN(((E54-48)*0.8),0) -> 11 | G54: 60 | H54: 0 | I54: 0
A55: =A54+1 -> 52 | B55: Anthony Moody | C55: 125 | D55: 2 | E55: =(C55/D55) -> 62.500 | F55: =ROUNDDOWN(((E55-48)*0.8),0) -> 11 | G55: 60 | H55: 0 | I55: 0
A56: 53 | B56: Adam Henderson | C56: 126 | D56: 2 | E56: =(C56/D56) -> 63.000 | F56: =ROUNDDOWN(((E56-48)*0.8),0) -> 12 | G56: 59 | H56: 1 | I56: 1
A57: 54 | B57: Mitch Lerch | C57: 126 | D57: 2 | E57: =(C57/D57) -> 63.000 | F57: =ROUNDDOWN(((E57-48)*0.8),0) -> 12 | G57: 61 | H57: 1 | I57: 2
A58: 55 | B58: Adam Chittenden | C58: 127 | D58: 2 | E58: =(C58/D58) -> 63.500 | F58: =ROUNDDOWN(((E58-48)*0.8),0) -> 12 | G58: 57 | H58: 1 | I58: 1
A59: 56 | B59: Sarah Potter | C59: 128 | D59: 2 | E59: =(C59/D59) -> 64.000 | F59: =ROUNDDOWN(((E59-48)*0.8),0) -> 12 | G59: 62 | H59: 0.5 | I59: 1.5
A60: 57 | B60: Spencer Eubanks | C60: 128 | D60: 2 | E60: =(C60/D60) -> 64.000 | F60: =ROUNDDOWN(((E60-48)*0.8),0) -> 12 | G60: 63 | H60: 0 | I60: 0
A61: 58 | B61: Shawn Hullinger | C61: 128 | D61: 2 | E61: =(C61/D61) -> 64.000 | F61: =ROUNDDOWN(((E61-48)*0.8),0) -> 12 | G61: 63 | H61: 0 | I61: 0
A62: 59 | B62: Tony Ebson ® | C62: 131 | D62: 2 | E62: =(C62/D62) -> 65.500 | F62: =ROUNDDOWN(((E62-48)*0.8),0) -> 14 | G62: 65 | H62: 0 | I62: 1
A63: 60 | B63: D Burns | C63: 133 | D63: 2 | E63: =(C63/D63) -> 66.500 | F63: =ROUNDDOWN(((E63-48)*0.8),0) -> 14 | G63: 63 | H63: 0 | I63: 0
A64: 61 | B64: Matt Whitlock ® | C64: 137 | D64: 2 | E64: =(C64/D64) -> 68.500 | F64: =ROUNDDOWN(((E64-48)*0.8),0) -> 16 | G64: 66 | H64: 0 | I64: 0
A65: 62 | B65: Pat Cutsforth ® | C65: 138 | D65: 2 | E65: =(C65/D65) -> 69.000 | F65: =ROUNDDOWN(((E65-48)*0.8),0) -> 16 | G65: 60 | H65: 1 | I65: 1
A66: 63 | B66: Matt Snyder ® | C66: 162 | D66: 2 | E66: =(C66/D66) -> 81.000 | F66: =ROUNDDOWN(((E66-48)*0.8),0) -> 26 | G66: 80 | H66: 0 | I66: 0
A67: 64 | B67: Matt Wyckoff | C67: 59 | D67: 1 | E67: =(C67/D67) -> 59.000 | F67: 9 | G67: 59 | H67: 0.5 | I67: 0.5
A69: Subs | B69: Player | C69: Total Strokes | D69: Weeks | E69: Average | F69: H-Cap | G69: Last | H69: Week Pt. | I69: Total Pts. | J69: Subed For
A70: 1 | B70: Avg Joe | C70: 123 | D70: 2 | E70: =SUM(C70/D70) -> 61.500 | F70: =ROUNDDOWN(((E70-48)*0.8),0) -> 10 | G70: 58
A71: 2 | B71: Adam Karstens | C71: 64 | D71: 1 | E71: =SUM(C71/D71) -> 64.000 | F71: 0
A72: 3 | B72: Johnny Walker | C72: 64 | D72: 1 | E72: =SUM(C72/D72) -> 64.000 | F72: 0
A73: 2 | C73: 0 | D73: 1 | E73: =SUM(C73/D73) -> 0.000 | F73: =ROUNDDOWN(((E73-50)*0.8),0) -> -40
A74: 3 | C74: 0 | D74: 1 | E74: =SUM(C74/D74) -> 0.000 | F74: =ROUNDDOWN(((E74-50)*0.8),0) -> -40
A75: =SUM(A74+1) -> 4 | C75: 0 | D75: 1 | E75: =SUM(C75/D75) -> 0.000 | F75: =ROUNDDOWN(((E75-50)*0.8),0) -> -40
A76: =SUM(A75+1) -> 5 | C76: 0 | D76: 1 | E76: =SUM(C76/D76) -> 0.000 | F76: =ROUNDDOWN(((E76-50)*0.8),0) -> -40
A77: 7 | C77: 0 | D77: 1 | E77: =SUM(C77/D77) -> 0.000 | F77: =ROUNDDOWN(((E77-50)*0.8),0) -> -40
A78: 8 | C78: 0 | D78: 1 | E78: =SUM(C78/D78) -> 0.000 | F78: =ROUNDDOWN(((E78-50)*0.8),0) -> -40
A79: 9 | C79: 0 | D79: 1 | E79: =SUM(C79/D79) -> 0.000 | F79: =ROUNDDOWN(((E79-50)*0.8),0) -> -40
A80: 10 | C80: 0 | D80: 1 | E80: =SUM(C80/D80) -> 0.000 | F80: =ROUNDDOWN(((E80-50)*0.8),0) -> -40
A81: 11 | C81: 0 | D81: 1 | E81: =SUM(C81/D81) -> 0.000 | F81: =ROUNDDOWN(((E81-50)*0.8),0) -> -40
A82: 12 | C82: 0 | D82: 1 | E82: =SUM(C82/D82) -> 0.000 | F82: =ROUNDDOWN(((E82-50)*0.8),0) -> -40
A83: 13 | C83: 0 | D83: 1 | E83: =SUM(C83/D83) -> 0.000 | F83: =ROUNDDOWN(((E83-50)*0.8),0) -> -40
A84: 14 | C84: 0 | D84: 1 | E84: =SUM(C84/D84) -> 0.000 | F84: =ROUNDDOWN(((E84-50)*0.8),0) -> -40
A85: 15 | C85: 0 | D85: 1 | E85: =SUM(C85/D85) -> 0.000 | F85: =ROUNDDOWN(((E85-50)*0.8),0) -> -40
A86: 16 | C86: 0 | D86: 1 | E86: =SUM(C86/D86) -> 0.000 | F86: =ROUNDDOWN(((E86-50)*0.8),0) -> -40
A87: 17 | C87: 0 | D87: 1 | E87: =SUM(C87/D87) -> 0.000 | F87: =ROUNDDOWN(((E87-50)*0.8),0) -> -40
A88: 18 | C88: 0 | D88: 1 | E88: =SUM(C88/D88) -> 0.000 | F88: =ROUNDDOWN(((E88-50)*0.8),0) -> -40
A89: 19 | C89: 0 | D89: 1 | E89: =SUM(C89/D89) -> 0.000 | F89: =ROUNDDOWN(((E89-50)*0.8),0) -> -40
A90: 20 | C90: 0 | D90: 1 | E90: =SUM(C90/D90) -> 0.000 | F90: =ROUNDDOWN(((E90-50)*0.8),0) -> -40
A91: 21 | C91: 0 | D91: 1 | E91: =SUM(C91/D91) -> 0.000 | F91: =ROUNDDOWN(((E91-50)*0.8),0) -> -40
A92: 22 | C92: 0 | D92: 1 | E92: =SUM(C92/D92) -> 0.000 | F92: =ROUNDDOWN(((E92-50)*0.8),0) -> -40
A93: 23 | C93: 0 | D93: 1 | E93: =SUM(C93/D93) -> 0.000 | F93: =ROUNDDOWN(((E93-50)*0.8),0) -> -40
A94: 24 | C94: 0 | D94: 1 | E94: =SUM(C94/D94) -> 0.000 | F94: =ROUNDDOWN(((E94-50)*0.8),0) -> -40
A95: 25 | C95: 0 | D95: 1 | E95: =SUM(C95/D95) -> 0.000 | F95: =ROUNDDOWN(((E95-50)*0.8),0) -> -40
A96: 26 | C96: 0 | D96: 1 | E96: =SUM(C96/D96) -> 0.000 | F96: =ROUNDDOWN(((E96-50)*0.8),0) -> -40
A97: 27 | C97: 0 | D97: 1 | E97: =SUM(C97/D97) -> 0.000 | F97: =ROUNDDOWN(((E97-50)*0.8),0) -> -40
A98: 28 | C98: 0 | D98: 1 | E98: =SUM(C98/D98) -> 0.000 | F98: =ROUNDDOWN(((E98-50)*0.8),0) -> -40
A99: 28 | C99: 0 | D99: 1 | E99: =SUM(C99/D99) -> 0.000 | F99: =ROUNDDOWN(((E99-50)*0.8),0) -> -40
A101: 2013 SBDGL Team Standings
B102: TEAM # | C102: BUSH | E102: Total Points | F102: Team Points | G102: Team Avg
A103: 1 | B103: 7 | C103: Doug Johnson & Adam Stiers | E103: 6 | F103: 2 | G103: =AVERAGE(E5,E23) -> 52.250
A104: 2 | B104: 10 | C104: Adam Miller & Mitch Lerch | E104: 5.5 | F104: 2 | G104: =AVERAGE(E7,E57) -> 57.500
A105: 3 | B105: 2 | C105: Sarah Potter & Kollin Grimm | E105: 5.5 | F105: 2 | G105: =AVERAGE(E59,E17) -> 59.250
A106: 4 | B106: 6 | C106: Ryan Clark & Ben Sandel | E106: 5 | F106: 2 | G106: =AVERAGE(E51,E26) -> 59.000
A107: 5 | B107: 16 | C107: Tim Peyton & Josh Beachy | E107: 4.5 | F107: 1.5 | G107: =AVERAGE(E9,E19) -> 53.250
A108: 6 | B108: 14 | C108: Matt Fritz & Jason Rimrodt | E108: 4.5 | F108: 1.5 | G108: =AVERAGE(E10,E29) -> 55.000
A109: 7 | B109: 4 | C109: Marty Reis & Travis Pike | E109: 3.5 | F109: 1 | G109: =AVERAGE(E14,E47) -> 57.000
A110: 8 | B110: 9 | C110: Tim Troyna & Pat Cutsforth | E110: 2.5 | F110: 1 | G110: =AVERAGE(E44,E65) -> 64.500
A111: 9 | B111: 11 | C111: Matt Weiben & Kirby Callanhan | E111: 2 | F111: 1 | G111: =AVERAGE(E21,E22) -> 55.000
A112: 10 | B112: 12 | C112: Ian Jacobs & Andrew Greco | E112: 2 | F112: 0 | G112: =AVERAGE(E8,E48) -> 56.500
A113: 11 | B113: 3 | C113: Erik Smith & KVN | E113: 2 | F113: 1 | G113: =AVERAGE(E46,E49) -> 61.000
A114: 12 | B114: 15 | C114: Nathan Veeder & Tony Rios | E114: 1.5 | F114: 0.5 | G114: =AVERAGE(E33,E31) -> 58.250
A115: 13 | B115: 13 | C115: Matt Whitlock & Greg Dye | E115: 1.5 | F115: 0.5 | G115: =AVERAGE(E50,E64) -> 65.000
A116: 14 | B116: 8 | C116: Jesse Streinz & Bob Hernandez | E116: 1 | F116: 0 | G116: =AVERAGE(E38,E45) -> 60.000
A117: 15 | B117: 1 | C117: D Burns & Adam Henderson | E117: 1 | F117: 0 | G117: =AVERAGE(E56,E63) -> 64.750
A118: 16 | B118: 5 | C118: Matt Snyder & Chris Clime | E118: 0 | F118: 0 | G118: =AVERAGE(E66,E35) -> 69.750
B120: TEAM # | C120: WHACKER
A121: 1 | B121: 25 | C121: Ryan Wodstrchill & Phil Campos | E121: 5 | F121: 2 | G121: =AVERAGE(E6,E27) -> 54.000
A122: 2 | B122: 23 | C122: Doug Peyton & Adam Chittenden | E122: 5 | F122: 2 | G122: =AVERAGE(E13,E58) -> 58.000
A123: 3 | B123: 30 | C123: Joel Knutson & Travis Fruendt | E123: 5 | F123: 2 | G123: =AVERAGE(E37,E41) -> 59.750
A124: 4 | B124: 29 | C124: Adam Olsen & Matt Shannon | E124: 4 | F124: 1 | G124: =AVERAGE(E4,E53) -> 55.250
A125: 5 | B125: 24 | C125: Ryan Hamilton & Rob Mumma | E125: 4 | F125: 1 | G125: =AVERAGE(E28,E36) -> 58.500
A126: 6 | B126: 17 | C126: Chuck Yanda & Nate Robbins | E126: 4 | F126: 1 | G126: =AVERAGE(E32,E34) -> 58.250
A127: 7 | B127: 27 | C127: Kurt Conrad & Dan Kent | E127: 3.5 | F127: 1 | G127: =AVERAGE(E15,E43) -> 57.000
A128: 8 | B128: 32 | C128: Dan Kern & Shirtless Bill | E128: 3 | F128: 1 | G128: =AVERAGE(E20,E25) -> 55.250
A129: 9 | B129: 28 | C129: Tim Potter & David McCuskey | E129: 3 | F129: 1 | G129: =AVERAGE(E11,E39) -> 56.250
A130: 10 | B130: 18 | C130: Jason Shook & Josh McFarland | E130: 3 | F130: 1 | G130: =AVERAGE(E24,E40) -> 57.750
A131: 11 | B131: 19 | C131: Drew Detert & Anthony Moody | E131: 2.5 | F131: 1 | G131: =AVERAGE(E12,E55) -> 57.500
A132: 12 | B132: 20 | C132: Dustin Utley & Tom Pepper | E132: 2.5 | F132: 1 | G132: =AVERAGE(E16,E52) -> 58.000
A133: 13 | B133: 22 | C133: Jeremy Farnsworth & Tony Ebson | E133: 2.5 | F133: 1 | G133: =AVERAGE(E62,E18) -> 60.000
A134: 14 | B134: 26 | C134: Joe French & Matt Wycoff | E134: 0.5 | F134: 0 | G134: =AVERAGE(E30,E67) -> 58.250
A135: 15 | B135: 21 | C135: Ryan Eggleston & Shane Thirtyacre | E135: 0.5 | F135: 0 | G135: =AVERAGE(E54,E42) -> 61.250
A136: 16 | B136: 31 | C136: Spencer Eubanks & Shawn Hullinger | E136: 0 | F136: 0 | G136: =AVERAGE(E60,E61) -> 64.000