A1: 2013 S.B.D.G.L. STANDINGS Through Week 17 Sugar Bottom - Division Championships
A2: Rank | B2: Player | C2: Total Strokes | D2: Weeks | E2: Average | F2: H-Cap | G2: Last | H2: Week Pt. | I2: Total Pts. | J2: Sub Pts.
A4: =A3+1 -> 1 | B4: Adam Olsen | C4: 794 | D4: 17 | E4: =(C4/D4) -> 46.705882352941174 | F4: 0 | G4: 44 | H4: 1 | I4: 14.5
A5: =A4+1 -> 2 | B5: Doug Peyton | C5: 857 | D5: 17 | E5: =(C5/D5) -> 50.411764705882355 | F5: =ROUNDDOWN(((E5-48)*0.8),0) -> 1 | G5: 50 | H5: 1 | I5: 11
A6: =A5+1 -> 3 | B6: Jason Rimrodt | C6: 864 | D6: 17 | E6: =(C6/D6) -> 50.823529411764703 | F6: =ROUNDDOWN(((E6-48)*0.8),0) -> 2 | G6: 52 | H6: 0 | I6: 10.5
A7: =A6+1 -> 4 | B7: Andrew Greco | C7: 868 | D7: 17 | E7: =(C7/D7) -> 51.058823529411768 | F7: =ROUNDDOWN(((E7-48)*0.8),0) -> 2 | G7: 52 | H7: 0 | I7: 10.5
A8: =A7+1 -> 5 | B8: Jeremy Farnsworth | C8: 820 | D8: 16 | E8: =(C8/D8) -> 51.250 | F8: =ROUNDDOWN(((E8-48)*0.8),0) -> 2 | G8: 50 | H8: 0 | I8: 10
A9: =A8+1 -> 6 | B9: Dan Kern | C9: 874 | D9: 17 | E9: =(C9/D9) -> 51.411764705882355 | F9: =ROUNDDOWN(((E9-48)*0.8),0) -> 2 | G9: 53 | H9: 0 | I9: 10
A10: =A9+1 -> 7 | B10: Tim Peyton | C10: 877 | D10: 17 | E10: =(C10/D10) -> 51.588235294117645 | F10: =ROUNDDOWN(((E10-48)*0.8),0) -> 2 | G10: 51 | H10: 1 | I10: 11
A11: =A10+1 -> 8 | B11: Kurt Conrad | C11: 886 | D11: 17 | E11: =(C11/D11) -> 52.117647058823529 | F11: =ROUNDDOWN(((E11-48)*0.8),0) -> 3 | G11: 51 | H11: 0 | I11: 8.5
A12: =A11+1 -> 9 | B12: Josh Beachy | C12: 843 | D12: 16 | E12: =(C12/D12) -> 52.6875 | F12: =ROUNDDOWN(((E12-48)*0.8),0) -> 3 | G12: 54 | H12: 0 | I12: 9
A13: =A12+1 -> 10 | B13: Ryan Wodstrchill | C13: 899 | D13: 17 | E13: =(C13/D13) -> 52.882352941176471 | F13: =ROUNDDOWN(((E13-48)*0.8),0) -> 3 | G13: 49 | H13: 0.5 | I13: 8
A14: =A13+1 -> 11 | B14: Doug Johnson | C14: 903 | D14: 17 | E14: =(C14/D14) -> 53.117647058823529 | F14: =ROUNDDOWN(((E14-48)*0.8),0) -> 4 | G14: 51 | H14: 0 | I14: 6.5
A15: =A14+1 -> 12 | B15: KVN Lavley | C15: 904 | D15: 17 | E15: =(C15/D15) -> 53.176470588235297 | F15: =ROUNDDOWN(((E15-48)*0.8),0) -> 4 | G15: 52 | H15: 0 | I15: 12
A16: =A15+1 -> 13 | B16: Matt Wieben | C16: 905 | D16: 17 | E16: =(C16/D16) -> 53.235294117647058 | F16: =ROUNDDOWN(((E16-48)*0.8),0) -> 4 | G16: 52 | H16: 1 | I16: 9
A17: =A16+1 -> 14 | B17: Dan Kent | C17: 905 | D17: 17 | E17: =(C17/D17) -> 53.235294117647058 | F17: =ROUNDDOWN(((E17-48)*0.8),0) -> 4 | G17: 48 | H17: 1 | I17: 12.5
A18: =A17+1 -> 15 | B18: Nate Robbins | C18: 908 | D18: 17 | E18: =(C18/D18) -> 53.411764705882355 | F18: =ROUNDDOWN(((E18-48)*0.8),0) -> 4 | G18: 51 | H18: 1 | I18: 10.5
A19: =A18+1 -> 16 | B19: Adam Miller | C19: 855 | D19: 16 | E19: =(C19/D19) -> 53.4375 | F19: =ROUNDDOWN(((E19-48)*0.8),0) -> 4 | G19: 47 | H19: 1 | I19: 8
A20: =A19+1 -> 17 | B20: Joe French | C20: 806 | D20: 15 | E20: =(C20/D20) -> 53.733333333333334 | F20: =ROUNDDOWN(((E20-48)*0.8),0) -> 4 | G20: 50 | H20: 0.5 | I20: 8.5
A21: =A20+1 -> 18 | B21: Greg Dye | C21: 870 | D21: 16 | E21: =(C21/D21) -> 54.375 | F21: =ROUNDDOWN(((E21-48)*0.8),0) -> 5 | G21: 51 | H21: 1 | I21: 12.5
A22: =A21+1 -> 19 | B22: Tim Potter | C22: 925 | D22: 17 | E22: =(C22/D22) -> 54.411764705882355 | F22: =ROUNDDOWN(((E22-48)*0.8),0) -> 5 | G22: 50 | H22: 0.5 | I22: 7.5
A23: =A22+1 -> 20 | B23: Bob Hernadez | C23: 928 | D23: 17 | E23: =(C23/D23) -> 54.588235294117645 | F23: =ROUNDDOWN(((E23-48)*0.8),0) -> 5 | G23: 49 | H23: 0 | I23: 11.5
A24: =A23+1 -> 21 | B24: Kirby Callahan | C24: 931 | D24: 17 | E24: =(C24/D24) -> 54.764705882352942 | F24: =ROUNDDOWN(((E24-48)*0.8),0) -> 5 | G24: 56 | H24: 0 | I24: 8.5
A25: =A24+1 -> 22 | B25: Dustin Utley | C25: 931 | D25: 17 | E25: =(C25/D25) -> 54.764705882352942 | F25: =ROUNDDOWN(((E25-48)*0.8),0) -> 5 | G25: 55 | H25: 0 | I25: 5
A26: =A25+1 -> 23 | B26: Drew Detert | C26: 931 | D26: 17 | E26: =(C26/D26) -> 54.764705882352942 | F26: =ROUNDDOWN(((E26-48)*0.8),0) -> 5 | G26: 50 | H26: 1 | I26: 7
A27: =A26+1 -> 24 | B27: Ryan Clark | C27: 934 | D27: 17 | E27: =(C27/D27) -> 54.941176470588232 | F27: =ROUNDDOWN(((E27-48)*0.8),0) -> 5 | G27: 54 | H27: 0 | I27: 8
A28: =A27+1 -> 25 | B28: Chris Clime | C28: 880 | D28: 16 | E28: =(C28/D28) -> 55.000 | F28: =ROUNDDOWN(((E28-48)*0.8),0) -> 5 | G28: 53 | H28: 1 | I28: 9.5
A29: =A28+1 -> 26 | B29: Travis Fruendt | C29: 935 | D29: 17 | E29: =(C29/D29) -> 55.000 | F29: =ROUNDDOWN(((E29-48)*0.8),0) -> 5 | G29: 51 | H29: 1 | I29: 13
A30: =A29+1 -> 27 | B30: Kollin Grimm | C30: 937 | D30: 17 | E30: =(C30/D30) -> 55.117647058823529 | F30: =ROUNDDOWN(((E30-48)*0.8),0) -> 5 | G30: 51 | H30: 1 | I30: 7.5
A31: =A30+1 -> 28 | B31: Adam Stiers | C31: 883 | D31: 16 | E31: =(C31/D31) -> 55.1875 | F31: =ROUNDDOWN(((E31-48)*0.8),0) -> 5 | G31: 56 | H31: 0 | I31: 7
A32: =A31+1 -> 29 | B32: Chuck Yanda | C32: 940 | D32: 17 | E32: =(C32/D32) -> 55.294117647058826 | F32: =ROUNDDOWN(((E32-48)*0.8),0) -> 5 | G32: 56 | H32: 0 | I32: 13
A33: =A32+1 -> 30 | B33: Jesse Streinz | C33: 941 | D33: 17 | E33: =(C33/D33) -> 55.352941176470587 | F33: =ROUNDDOWN(((E33-48)*0.8),0) -> 5 | G33: 55 | H33: 0 | I33: 7
A34: =A33+1 -> 31 | B34: Ryan Hamilton | C34: 946 | D34: 17 | E34: =(C34/D34) -> 55.647058823529413 | F34: =ROUNDDOWN(((E34-48)*0.8),0) -> 6 | G34: 53 | H34: 1 | I34: 9
A35: =A34+1 -> 32 | B35: Joel Knutson | C35: 948 | D35: 17 | E35: =(C35/D35) -> 55.764705882352942 | F35: =ROUNDDOWN(((E35-48)*0.8),0) -> 6 | G35: 56 | H35: 0 | I35: 8
A36: =A35+1 -> 33 | B36: Rob Mumma | C36: 949 | D36: 17 | E36: =(C36/D36) -> 55.823529411764703 | F36: =ROUNDDOWN(((E36-48)*0.8),0) -> 6 | G36: 56 | H36: 0 | I36: 8.5
A37: =A36+1 -> 34 | B37: Shirtless Bill | C37: 956 | D37: 17 | E37: =(C37/D37) -> 56.235294117647058 | F37: =ROUNDDOWN(((E37-48)*0.8),0) -> 6 | G37: 54 | H37: 1 | I37: 10.5
A38: =A37+1 -> 35 | B38: Nate Veeder | C38: 960 | D38: 17 | E38: =(C38/D38) -> 56.470588235294116 | F38: =ROUNDDOWN(((E38-48)*0.8),0) -> 6 | G38: 59 | H38: 0 | I38: 4
A39: =A38+1 -> 36 | B39: Phil Campos | C39: 791 | D39: 14 | E39: =(C39/D39) -> 56.500 | F39: =ROUNDDOWN(((E39-48)*0.8),0) -> 6 | G39: 54 | H39: 1 | I39: 4
A40: =A39+1 -> 37 | B40: Ian Jacobs | C40: 961 | D40: 17 | E40: =(C40/D40) -> 56.529411764705884 | F40: =ROUNDDOWN(((E40-48)*0.8),0) -> 6 | G40: 52 | H40: 1 | I40: 9
A41: =A40+1 -> 38 | B41: Jason Shook | C41: 906 | D41: 16 | E41: =(C41/D41) -> 56.625 | F41: =ROUNDDOWN(((E41-48)*0.8),0) -> 6 | G41: 55 | H41: 0 | I41: 8
A42: =A41+1 -> 39 | B42: Martin Reis | C42: 963 | D42: 17 | E42: =(C42/D42) -> 56.647058823529413 | F42: =ROUNDDOWN(((E42-48)*0.8),0) -> 6 | G42: 47 | H42: 1 | I42: 7.5
A43: =A42+1 -> 40 | B43: Ryan Eggleston | C43: 966 | D43: 17 | E43: =(C43/D43) -> 56.823529411764703 | F43: =ROUNDDOWN(((E43-48)*0.8),0) -> 7 | G43: 53 | H43: 0.5 | I43: 8.5
A44: =A43+1 -> 41 | B44: Matt Wyckoff | C44: 913 | D44: 16 | E44: =(C44/D44) -> 57.0625 | F44: =ROUNDDOWN(((E44-48)*0.8),0) -> 7 | G44: 55 | H44: 1 | I44: 9
A45: =A44+1 -> 42 | B45: Josh McFarland | C45: 976 | D45: 17 | E45: =(C45/D45) -> 57.411764705882355 | F45: =ROUNDDOWN(((E45-48)*0.8),0) -> 7 | G45: 58 | H45: 0 | I45: 5
A46: =A45+1 -> 43 | B46: Travis Pike | C46: 864 | D46: 15 | E46: =(C46/D46) -> 57.600 | F46: =ROUNDDOWN(((E46-48)*0.8),0) -> 7 | G46: 53 | H46: 1 | I46: 8.5
A47: =A46+1 -> 44 | B47: Tony Rios | C47: 752 | D47: 13 | E47: =(C47/D47) -> 57.846153846153847 | F47: =ROUNDDOWN(((E47-48)*0.8),0) -> 7 | G47: 55 | H47: 0.5 | I47: 5
A48: =A47+1 -> 45 | B48: Matt Fritz | C48: 985 | D48: 17 | E48: =(C48/D48) -> 57.941176470588232 | F48: =ROUNDDOWN(((E48-48)*0.8),0) -> 7 | G48: 55 | H48: 1 | I48: 6
A49: =A48+1 -> 46 | B49: Ben Sandell | C49: 996 | D49: 17 | E49: =(C49/D49) -> 58.588235294117645 | F49: =ROUNDDOWN(((E49-48)*0.8),0) -> 8 | G49: 57 | H49: 1 | I49: 11.5
A50: =A49+1 -> 47 | B50: Anthony Moody | C50: 938 | D50: 16 | E50: =(C50/D50) -> 58.625 | F50: =ROUNDDOWN(((E50-48)*0.8),0) -> 8 | H50: 0 | I50: 6.5
A51: =A50+1 -> 48 | B51: Tim Troyna | C51: 946 | D51: 16 | E51: =(C51/D51) -> 59.125 | F51: =ROUNDDOWN(((E51-48)*0.8),0) -> 8 | G51: 59 | H51: 0 | I51: 7
A52: =A51+1 -> 49 | B52: Matt Shannon | C52: 1006 | D52: 17 | E52: =(C52/D52) -> 59.176470588235297 | F52: =ROUNDDOWN(((E52-48)*0.8),0) -> 8 | G52: 63 | H52: 0 | I52: 5
A53: =A52+1 -> 50 | B53: David McCuskey | C53: 1009 | D53: 17 | E53: =(C53/D53) -> 59.352941176470587 | F53: =ROUNDDOWN(((E53-48)*0.8),0) -> 9 | G53: 59 | H53: 0 | I53: 5.5
A54: =A53+1 -> 51 | B54: Erik Smith | C54: 1022 | D54: 17 | E54: =(C54/D54) -> 60.117647058823529 | F54: =ROUNDDOWN(((E54-48)*0.8),0) -> 9 | G54: 57 | H54: 1 | I54: 7.5
A55: =A54+1 -> 52 | B55: Adam Henderson | C55: 1026 | D55: 17 | E55: =(C55/D55) -> 60.352941176470587 | F55: =ROUNDDOWN(((E55-48)*0.8),0) -> 9 | G55: 56 | H55: 1 | I55: 8
A56: 53 | B56: Adam Chittenden | C56: 1027 | D56: 17 | E56: =(C56/D56) -> 60.411764705882355 | F56: =ROUNDDOWN(((E56-48)*0.8),0) -> 9 | G56: 59 | H56: 0 | I56: 8
A57: 54 | B57: Spencer Eubanks | C57: 1030 | D57: 17 | E57: =(C57/D57) -> 60.588235294117645 | F57: =ROUNDDOWN(((E57-48)*0.8),0) -> 10 | G57: 55 | H57: 1 | I57: 7
A58: 55 | B58: Tom Pepper | C58: 857 | D58: 14 | E58: =(C58/D58) -> 61.214285714285715 | F58: =ROUNDDOWN(((E58-48)*0.8),0) -> 10 | I58: 8 | J58: 1
A59: 56 | B59: D Burns | C59: 1041 | D59: 17 | E59: =(C59/D59) -> 61.235294117647058 | F59: =ROUNDDOWN(((E59-48)*0.8),0) -> 10 | G59: 57 | H59: 0.5 | I59: 4.5
A60: 57 | B60: Shane Thirtyacre | C60: 925 | D60: 15 | E60: =(C60/D60) -> 61.666666666666664 | F60: =ROUNDDOWN(((E60-48)*0.8),0) -> 10 | G60: 65 | H60: 0 | I60: 7.5
A61: 58 | B61: Mitch Lerch | C61: 1051 | D61: 17 | E61: =(C61/D61) -> 61.823529411764703 | F61: =ROUNDDOWN(((E61-48)*0.8),0) -> 11 | G61: 61 | H61: 0 | I61: 11.5
A62: 59 | B62: Pat Cutsforth | C62: 1052 | D62: 17 | E62: =(C62/D62) -> 61.882352941176471 | F62: =ROUNDDOWN(((E62-48)*0.8),0) -> 11 | G62: 60 | H62: 1 | I62: 12
A63: 60 | B63: Avg Joe | C63: 1055 | D63: 17 | E63: =(C63/D63) -> 62.058823529411768 | F63: =ROUNDDOWN(((E63-48)*0.8),0) -> 11 | G63: 59 | H63: 0 | I63: 6
A64: 61 | B64: Tony Ebson | C64: 1070 | D64: 17 | E64: =(C64/D64) -> 62.941176470588232 | F64: =ROUNDDOWN(((E64-48)*0.8),0) -> 11 | G64: 56 | H64: 1 | I64: 10
A65: 62 | B65: Shawn Hullinger | C65: 1072 | D65: 17 | E65: =(C65/D65) -> 63.058823529411768 | F65: =ROUNDDOWN(((E65-48)*0.8),0) -> 12 | G65: 56 | H65: 1 | I65: 7.5
A66: 63 | B66: Sarah Potter | C66: 1078 | D66: 17 | E66: =(C66/D66) -> 63.411764705882355 | F66: =ROUNDDOWN(((E66-48)*0.8),0) -> 12 | G66: 62 | H66: 1 | I66: 7.5
A67: 64 | B67: Matt Whitlock | C67: 1057 | D67: 16 | E67: =(C67/D67) -> 66.0625 | F67: =ROUNDDOWN(((E67-48)*0.8),0) -> 14 | G67: 65 | H67: 0 | I67: 6
A69: Subs | B69: Player | C69: Total Strokes | D69: Weeks | E69: Average | F69: H-Cap | G69: Last | H69: Week Pt. | I69: Total Pts. | J69: Subed For
A70: 1 | B70: Adam Karstens | C70: 499 | D70: 9 | E70: =SUM(C70/D70) -> 55.444444444444443 | F70: =ROUNDDOWN(((E70-48)*0.8),0) -> 5 | I70: 3.5
A71: 2 | B71: Archie Coulter | C71: 387 | D71: 7 | E71: =SUM(C71/D71) -> 55.285714285714285 | F71: =ROUNDDOWN(((E71-48)*0.8),0) -> 5 | G71: 49 | H71: 1 | I71: 2.5 | J71: Pepper
A72: 3 | B72: Dan Lewis | C72: 340 | D72: 6 | E72: =SUM(C72/D72) -> 56.666666666666664 | F72: =ROUNDDOWN(((E72-48)*0.8),0) -> 6 | I72: 1
A73: 2 | B73: Josh Spang | C73: 264 | D73: 5 | E73: =SUM(C73/D73) -> 52.800 | F73: =ROUNDDOWN(((E73-48)*0.8),0) -> 3 | I73: 1.5
A74: 3 | B74: Dustin Snodgress | C74: 314 | D74: 5 | E74: =SUM(C74/D74) -> 62.800 | F74: =ROUNDDOWN(((E74-48)*0.8),0) -> 11
A75: =SUM(A74+1) -> 4 | B75: Jason Sills | C75: 238 | D75: 4 | E75: =SUM(C75/D75) -> 59.500 | F75: =ROUNDDOWN(((E75-48)*0.8),0) -> 9 | G75: 59
A76: =SUM(A75+1) -> 5 | B76: Caleb Richer | C76: 180 | D76: 3 | E76: =SUM(C76/D76) -> 60.000 | F76: =ROUNDDOWN(((E76-48)*0.8),0) -> 9 | G76: 66
A77: 7 | B77: Kerri Haught | C77: 183 | D77: 3 | E77: =SUM(C77/D77) -> 61.000 | F77: =ROUNDDOWN(((E77-48)*0.8),0) -> 10 | G77: 59
A78: 8 | B78: Nic Gordon | C78: 184 | D78: 3 | E78: =SUM(C78/D78) -> 61.333333333333336 | F78: =ROUNDDOWN(((E78-48)*0.8),0) -> 10 | G78: 68
A79: 9 | B79: Steve Callaway | C79: 185 | D79: 3 | E79: =SUM(C79/D79) -> 61.666666666666664 | F79: =ROUNDDOWN(((E79-48)*0.8),0) -> 10
A80: 10 | B80: Kevin Stibal | C80: 104 | D80: 2 | E80: =SUM(C80/D80) -> 52.000 | F80: =ROUNDDOWN(((E80-48)*0.8),0) -> 3 | I80: 1
A81: 11 | B81: Jack Gilmore | C81: 115 | D81: 2 | E81: =SUM(C81/D81) -> 57.500 | F81: =ROUNDDOWN(((E81-48)*0.8),0) -> 7
A82: 12 | B82: Tony Hobel | C82: 118 | D82: 2 | E82: 60.000 | F82: =ROUNDDOWN(((E82-48)*0.8),0) -> 9
A83: 13 | B83: Johnny Walker | C83: 122 | D83: 2 | E83: =SUM(C83/D83) -> 61.000 | F83: =ROUNDDOWN(((E83-48)*0.8),0) -> 10 | I83: 1
A84: 14 | B84: Matt Snyder | C84: 162 | D84: 2 | E84: =SUM(C84/D84) -> 81.000 | F84: =ROUNDDOWN(((E84-48)*0.8),0) -> 26
A85: 15 | B85: Miguel - Bowling Green | C85: 52 | D85: 1 | E85: =SUM(C85/D85) -> 52.000 | F85: 0 | I85: 1
A86: 16 | B86: Brandon Yancey | C86: 52 | D86: 1 | E86: =SUM(C86/D86) -> 52.000 | F86: 0
A87: 17 | B87: Mike William | C87: 53 | D87: 1 | E87: =SUM(C87/D87) -> 53.000 | F87: 0
A88: 18 | B88: Aaron | C88: 53 | D88: 1 | E88: =SUM(C88/D88) -> 53.000 | F88: 0
A89: 19 | B89: Apollo | C89: 54 | D89: 1 | E89: =SUM(C89/D89) -> 54.000 | F89: 0
A90: 20 | B90: Dave Peyton | C90: 56 | D90: 1 | E90: =SUM(C90/D90) -> 56.000 | F90: 0
A91: 21 | B91: Mike Noth | C91: 57 | D91: 1 | E91: =SUM(C91/D91) -> 57.000 | F91: 0
A92: 22 | B92: Brian Snider | C92: 59 | D92: 1 | E92: =SUM(C92/D92) -> 59.000 | F92: 0
A93: 23 | B93: Jesse Kirk | C93: 60 | D93: 1 | E93: =SUM(C93/D93) -> 60.000 | F93: 0
A94: 24 | B94: Dustin Nohr | C94: 64 | D94: 1 | E94: =SUM(C94/D94) -> 64.000 | F94: 0
A95: 25 | C95: 0 | D95: 1 | E95: =SUM(C95/D95) -> 0.000 | F95: =ROUNDDOWN(((E95-50)*0.8),0) -> -40
A96: 26 | C96: 0 | D96: 1 | E96: =SUM(C96/D96) -> 0.000 | F96: =ROUNDDOWN(((E96-50)*0.8),0) -> -40
A97: 27 | C97: 0 | D97: 1 | E97: =SUM(C97/D97) -> 0.000 | F97: =ROUNDDOWN(((E97-50)*0.8),0) -> -40
A98: 28 | C98: 0 | D98: 1 | E98: =SUM(C98/D98) -> 0.000 | F98: =ROUNDDOWN(((E98-50)*0.8),0) -> -40
A99: 29 | C99: 0 | D99: 1 | E99: =SUM(C99/D99) -> 0.000 | F99: =ROUNDDOWN(((E99-50)*0.8),0) -> -40
A100: 30
A101: 31
A102: 25 | B102: Craig Eastin | C102: 65 | D102: 1 | E102: =SUM(C102/D102) -> 65.000 | F102: 0
A103: 26 | B103: Max Ostby | C103: 66 | D103: 1 | E103: 66.000 | F103: 0
A105: 2013 SBDGL Team Standings
B106: TEAM # | C106: BUSH | E106: Total Points | F106: Team Points | G106: Team Avg
A107: 1 | B107: 12 | C107: Ian Jacobs & Andrew Greco | E107: 30 | F107: 10.5 | G107: =AVERAGE(E7,E40) -> 53.794117647058826
A108: 2 | B108: 16 | C108: Tim Peyton & Josh Beachy | E108: 30 | F108: 10 | G108: =AVERAGE(E10,E12) -> 52.137867647058826
A109: 3 | B109: 6 | C109: Ryan Clark & Ben Sandel | E109: 29.5 | F109: 10 | G109: =AVERAGE(E27,E49) -> 56.764705882352942
A110: 4 | B110: 13 | C110: Matt Whitlock & Greg Dye | E110: 29 | F110: 10.5 | G110: =AVERAGE(E21,E67) -> 60.21875
A111: 5 | B111: 10 | C111: Adam Miller & Mitch Lerch | E111: 29 | F111: 9.5 | G111: =AVERAGE(E19,E61) -> 57.630514705882348
A112: 6 | B112: 11 | C112: Matt Weiben & Kirby Callanhan | E112: 28.5 | F112: 11 | G112: =AVERAGE(E16,E24) -> 54.000
A113: 7 | B113: 9 | C113: Tim Troyna & Pat Cutsforth | E113: 28 | F113: 9 | G113: =AVERAGE(E51,E62) -> 60.503676470588232
A114: 8 | B114: 3 | C114: Erik Smith & KVN | E114: 28 | F114: 8.5 | G114: =AVERAGE(E54,E15) -> 56.647058823529413
A115: 9 | B115: 8 | C115: Jesse Streinz & Bob Hernandez | E115: 26.5 | F115: 8 | G115: =AVERAGE(E23,E33) -> 54.970588235294116
A116: 10 | B116: 4 | C116: Marty Reis & Travis Pike | E116: 25.5 | F116: 9.5 | G116: =AVERAGE(E42,E46) -> 57.123529411764707
A117: 11 | B117: 5 | C117: Average Joe & Chris Clime | E117: 23.5 | F117: 8 | G117: =AVERAGE(E28,E63) -> 58.529411764705884
A118: 12 | B118: 14 | C118: Matt Fritz & Jason Rimrodt | E118: 23 | F118: 6.5 | G118: =AVERAGE(E6,E48) -> 54.382352941176464
A119: 13 | B119: 7 | C119: Doug Johnson & Adam Stiers | E119: 21 | F119: 7.5 | G119: =AVERAGE(E14,E31) -> 54.152573529411768
A120: 14 | B120: 2 | C120: Sarah Potter & Kollin Grimm | E120: 21 | F120: 6 | G120: =AVERAGE(E30,E66) -> 59.264705882352942
A121: 15 | B121: 1 | C121: D Burns & Adam Henderson | E121: 18.5 | F121: 6 | G121: =AVERAGE(E55,E59) -> 60.794117647058826
A122: 16 | B122: 15 | C122: Nathan Veeder & Tony Rios | E122: 12.5 | F122: 3.5 | G122: =AVERAGE(E38,E47) -> 57.158371040723978
B124: TEAM # | C124: WHACKER
A125: 1 | B125: 27 | C125: Kurt Conrad & Dan Kent | E125: 34 | F125: 13 | G125: =AVERAGE(E11,E17) -> 52.67647058823529
A126: 2 | B126: 17 | C126: Chuck Yanda & Nate Robbins | E126: 33.5 | F126: 11 | G126: =AVERAGE(E18,E32) -> 54.352941176470594
A127: 3 | B127: 22 | C127: Jeremy Farnsworth & Tony Ebson | E127: 32 | F127: 12 | G127: =AVERAGE(E8,E64) -> 57.095588235294116
A128: 4 | B128: 30 | C128: Joel Knutson & Travis Fruendt | E128: 31 | F128: 10 | G128: =AVERAGE(E29,E35) -> 55.382352941176471
A129: 5 | B129: 23 | C129: Doug Peyton & Adam Chittenden | E129: 30.5 | F129: 11.5 | G129: =AVERAGE(E5,E56) -> 55.411764705882355
A130: 6 | B130: 32 | C130: Dan Kern & Shirtless Bill | E130: 29 | F130: 8.5 | G130: =AVERAGE(E9,E37) -> 53.82352941176471
A131: 7 | B131: 29 | C131: Adam Olsen & Matt Shannon | E131: 27.5 | F131: 8 | G131: =AVERAGE(E52,E4) -> 52.941176470588232
A132: 8 | B132: 24 | C132: Ryan Hamilton & Rob Mumma | E132: 27 | F132: 9.5 | G132: =AVERAGE(E34,E36) -> 55.735294117647058
A133: 9 | B133: 26 | C133: Joe French & Matt Wycoff | E133: 27 | F133: 9.5 | G133: =AVERAGE(E20,E44) -> 55.397916666666667
A134: 10 | B134: 21 | C134: Ryan Eggleston & Shane Thirtyacre | E134: 25 | F134: 8 | G134: =AVERAGE(E43,E60) -> 59.245098039215684
A135: 11 | B135: 20 | C135: Dustin Utley & Tom Pepper | E135: 20.5 | F135: 7.5 | G135: =AVERAGE(E25,E58) -> 57.989495798319325
A136: 12 | B136: 25 | C136: Ryan Wodstrchill & Phil Campos | E136: 20 | F136: 8 | G136: =AVERAGE(E13,E39) -> 54.691176470588232
A137: 13 | B137: 31 | C137: Spencer Eubanks & Shawn Hullinger | E137: 20 | F137: 5.5 | G137: =AVERAGE(E57,E65) -> 61.82352941176471
A138: 14 | B138: 19 | C138: Drew Detert & Anthony Moody | E138: 19.5 | F138: 6 | G138: =AVERAGE(E26,E50) -> 56.694852941176471
A139: 15 | B139: 28 | C139: Tim Potter & David McCuskey | E139: 18.5 | F139: 5.5 | G139: =AVERAGE(E22,E53) -> 56.882352941176471
A140: 16 | B140: 18 | C140: Jason Shook & Josh McFarland | E140: 17.5 | F140: 4.5 | G140: =AVERAGE(E41,E45) -> 57.018382352941174