A1: 2013 S.B.D.G.L. STANDINGS Through Week 13 Hiawatha
A2: Rank | B2: Player | C2: Total Strokes | D2: Weeks | E2: Average | F2: H-Cap | G2: Last | H2: Week Pt. | I2: Total Pts. | J2: Sub Pts.
A4: =A3+1 -> 1 | B4: Adam Olsen | C4: 610 | D4: 13 | E4: =(C4/D4) -> 46.92307692307692 | F4: =ROUNDDOWN(((E4-48)*0.8),0) -> 0 | G4: 44 | H4: 1 | I4: 11
A5: =A4+1 -> 2 | B5: Andrew Greco | C5: 658 | D5: 13 | E5: =(C5/D5) -> 50.615384615384613 | F5: =ROUNDDOWN(((E5-48)*0.8),0) -> 2 | G5: 47 | H5: 1 | I5: 8.5
A6: =A5+1 -> 3 | B6: Jason Rimrodt | C6: 659 | D6: 13 | E6: =(C6/D6) -> 50.692307692307693 | F6: =ROUNDDOWN(((E6-48)*0.8),0) -> 2 | G6: 45 | H6: 0 | I6: 9
A7: =A6+1 -> 4 | B7: Doug Peyton | C7: 659 | D7: 13 | E7: =(C7/D7) -> 50.692307692307693 | F7: =ROUNDDOWN(((E7-48)*0.8),0) -> 2 | G7: 44 | H7: 1 | I7: 9
A8: =A7+1 -> 5 | B8: Jeremy Farnsworth | C8: 618 | D8: 12 | E8: =(C8/D8) -> 51.500 | F8: =ROUNDDOWN(((E8-48)*0.8),0) -> 2 | G8: 43 | H8: 1 | I8: 8.5
A9: =A8+1 -> 6 | B9: Dan Kern | C9: 672 | D9: 13 | E9: =(C9/D9) -> 51.692307692307693 | F9: =ROUNDDOWN(((E9-48)*0.8),0) -> 2 | G9: 45 | H9: 1 | I9: 7
A10: =A9+1 -> 7 | B10: Tim Peyton | C10: 675 | D10: 13 | E10: =(C10/D10) -> 51.92307692307692 | F10: =ROUNDDOWN(((E10-48)*0.8),0) -> 3 | G10: 51 | H10: 0 | I10: 7.5
A11: =A10+1 -> 8 | B11: Kurt Conrad | C11: 679 | D11: 13 | E11: =(C11/D11) -> 52.230769230769234 | F11: =ROUNDDOWN(((E11-48)*0.8),0) -> 3 | G11: 47 | H11: 0 | I11: 6
A12: =A11+1 -> 9 | B12: Doug Johnson | C12: 690 | D12: 13 | E12: =(C12/D12) -> 53.07692307692308 | F12: =ROUNDDOWN(((E12-48)*0.8),0) -> 4 | G12: 49 | H12: 0 | I12: 6.5
A13: =A12+1 -> 10 | B13: Josh Beachy | C13: 639 | D13: 12 | E13: =(C13/D13) -> 53.250 | F13: =ROUNDDOWN(((E13-48)*0.8),0) -> 4 | G13: 49 | H13: 1 | I13: 7.5
A14: =A13+1 -> 11 | B14: Ryan Wodstrchill | C14: 695 | D14: 13 | E14: =(C14/D14) -> 53.46153846153846 | F14: =ROUNDDOWN(((E14-48)*0.8),0) -> 4 | G14: 46 | H14: 1 | I14: 5.5
A15: =A14+1 -> 12 | B15: Nate Robbins | C15: 696 | D15: 13 | E15: =(C15/D15) -> 53.53846153846154 | F15: =ROUNDDOWN(((E15-48)*0.8),0) -> 4 | G15: 50 | H15: 0 | I15: 7.5
A16: =A15+1 -> 13 | B16: Matt Wieben | C16: 696 | D16: 13 | E16: =(C16/D16) -> 53.53846153846154 | F16: =ROUNDDOWN(((E16-48)*0.8),0) -> 4 | G16: 47 | H16: 1 | I16: 6
A17: =A16+1 -> 14 | B17: KVN Lavley | C17: 700 | D17: 13 | E17: =(C17/D17) -> 53.846153846153847 | F17: =ROUNDDOWN(((E17-48)*0.8),0) -> 4 | G17: 47 | H17: 1 | I17: 9.5
A18: =A17+1 -> 15 | B18: Dan Kent | C18: 701 | D18: 13 | E18: =(C18/D18) -> 53.92307692307692 | F18: =ROUNDDOWN(((E18-48)*0.8),0) -> 4 | G18: 48 | H18: 1 | I18: 9.5
A19: =A18+1 -> 16 | B19: Joe French | C19: 599 | D19: 11 | E19: =(C19/D19) -> 54.454545454545453 | F19: =ROUNDDOWN(((E19-48)*0.8),0) -> 5 | G19: 51 | H19: 0 | I19: 6
A20: =A19+1 -> 17 | B20: Tim Potter | C20: 709 | D20: 13 | E20: =(C20/D20) -> 54.53846153846154 | F20: =ROUNDDOWN(((E20-48)*0.8),0) -> 5 | G20: 49 | H20: 1 | I20: 5
A21: =A20+1 -> 18 | B21: Adam Miller | C21: 656 | D21: 12 | E21: =(C21/D21) -> 54.666666666666664 | F21: =ROUNDDOWN(((E21-48)*0.8),0) -> 5 | G21: 49 | H21: 1 | I21: 5
A22: =A21+1 -> 19 | B22: Drew Detert | C22: 711 | D22: 13 | E22: =(C22/D22) -> 54.692307692307693 | F22: =ROUNDDOWN(((E22-48)*0.8),0) -> 5 | G22: 51 | H22: 0.5 | I22: 6
A23: =A22+1 -> 20 | B23: Dustin Utley | C23: 711 | D23: 13 | E23: =(C23/D23) -> 54.692307692307693 | F23: =ROUNDDOWN(((E23-48)*0.8),0) -> 5 | G23: 51 | H23: 0 | I23: 4
A24: =A23+1 -> 21 | B24: Ryan Clark | C24: 712 | D24: 13 | E24: =(C24/D24) -> 54.769230769230766 | F24: =ROUNDDOWN(((E24-48)*0.8),0) -> 5 | G24: 50 | H24: 0 | I24: 8
A25: =A24+1 -> 22 | B25: Kollin Grimm | C25: 714 | D25: 13 | E25: =(C25/D25) -> 54.92307692307692 | F25: =ROUNDDOWN(((E25-48)*0.8),0) -> 5 | G25: 45 | H25: 1 | I25: 6.5
A26: =A25+1 -> 23 | B26: Kirby Callahan | C26: 715 | D26: 13 | E26: =(C26/D26) -> 55.000 | F26: =ROUNDDOWN(((E26-48)*0.8),0) -> 5 | G26: 46 | H26: 1 | I26: 6.5
A27: =A26+1 -> 24 | B27: Bob Hernadez | C27: 716 | D27: 13 | E27: =(C27/D27) -> 55.07692307692308 | F27: =ROUNDDOWN(((E27-48)*0.8),0) -> 5 | G27: 47 | H27: 1 | I27: 9
A28: =A27+1 -> 25 | B28: Greg Dye | C28: 661 | D28: 12 | E28: =(C28/D28) -> 55.083333333333336 | F28: =ROUNDDOWN(((E28-48)*0.8),0) -> 5 | G28: 51 | H28: 1 | I28: 9.5
A29: =A28+1 -> 26 | B29: Chris Clime | C29: 662 | D29: 12 | E29: =(C29/D29) -> 55.166666666666664 | F29: =ROUNDDOWN(((E29-48)*0.8),0) -> 5 | G29: 51 | H29: 1 | I29: 6.5
A30: =A29+1 -> 27 | B30: Travis Fruendt | C30: 720 | D30: 13 | E30: =(C30/D30) -> 55.384615384615387 | F30: =ROUNDDOWN(((E30-48)*0.8),0) -> 5 | G30: 48 | H30: 1 | I30: 12
A31: =A30+1 -> 28 | B31: Joel Knutson | C31: 720 | D31: 13 | E31: =(C31/D31) -> 55.384615384615387 | F31: =ROUNDDOWN(((E31-48)*0.8),0) -> 5 | G31: 51 | H31: 0 | I31: 7.5
A32: =A31+1 -> 29 | B32: Jesse Streinz | C32: 721 | D32: 13 | E32: =(C32/D32) -> 55.46153846153846 | F32: =ROUNDDOWN(((E32-48)*0.8),0) -> 5 | G32: 52 | H32: 0 | I32: 4
A33: =A32+1 -> 30 | B33: Adam Stiers | C33: 667 | D33: 12 | E33: =(C33/D33) -> 55.583333333333336 | F33: =ROUNDDOWN(((E33-48)*0.8),0) -> 6 | G33: 52 | H33: 0 | I33: 6
A34: =A33+1 -> 31 | B34: Rob Mumma | C34: 723 | D34: 13 | E34: =(C34/D34) -> 55.615384615384613 | F34: =ROUNDDOWN(((E34-48)*0.8),0) -> 6 | G34: 53 | H34: 0 | I34: 7.5
A35: =A34+1 -> 32 | B35: Chuck Yanda | C35: 728 | D35: 13 | E35: =(C35/D35) -> 56.000 | F35: =ROUNDDOWN(((E35-48)*0.8),0) -> 6 | G35: 51 | H35: 1 | I35: 11
A36: =A35+1 -> 33 | B36: Shirtless Bill | C36: 731 | D36: 13 | E36: =(C36/D36) -> 56.230769230769234 | F36: =ROUNDDOWN(((E36-48)*0.8),0) -> 6 | G36: 52 | H36: 1 | I36: 7.5
A37: =A36+1 -> 34 | B37: Ryan Hamilton | C37: 732 | D37: 13 | E37: =(C37/D37) -> 56.307692307692307 | F37: =ROUNDDOWN(((E37-48)*0.8),0) -> 6 | G37: 53 | H37: 0 | I37: 6
A38: =A37+1 -> 35 | B38: Phil Campos | C38: 621 | D38: 11 | E38: =(C38/D38) -> 56.454545454545453 | F38: =ROUNDDOWN(((E38-48)*0.8),0) -> 6 | G38: 51 | H38: 1 | I38: 3
A39: =A38+1 -> 36 | B39: Nate Veeder | C39: 736 | D39: 13 | E39: =(C39/D39) -> 56.615384615384613 | F39: =ROUNDDOWN(((E39-48)*0.8),0) -> 6 | G39: 53 | H39: 0 | I39: 3
A40: =A39+1 -> 37 | B40: Ian Jacobs | C40: 738 | D40: 13 | E40: =(C40/D40) -> 56.769230769230766 | F40: =ROUNDDOWN(((E40-48)*0.8),0) -> 7 | G40: 55 | H40: 0 | I40: 7
A41: =A40+1 -> 38 | B41: Jason Shook | C41: 684 | D41: 12 | E41: =(C41/D41) -> 57.000 | F41: =ROUNDDOWN(((E41-48)*0.8),0) -> 7 | G41: 48 | H41: 1 | I41: 7
A42: =A41+1 -> 39 | B42: Matt Wyckoff | C42: 685 | D42: 12 | E42: =(C42/D42) -> 57.083333333333336 | F42: =ROUNDDOWN(((E42-48)*0.8),0) -> 7 | G42: 50 | H42: 0.5 | I42: 6.5
A43: =A42+1 -> 40 | B43: Ryan Eggleston | C43: 745 | D43: 13 | E43: =(C43/D43) -> 57.307692307692307 | F43: =ROUNDDOWN(((E43-48)*0.8),0) -> 7 | G43: 53 | H43: 0 | I43: 7.5
A44: =A43+1 -> 41 | B44: Martin Reis | C44: 748 | D44: 13 | E44: =(C44/D44) -> 57.53846153846154 | F44: =ROUNDDOWN(((E44-48)*0.8),0) -> 7 | G44: 55 | H44: 0 | I44: 6.5
A45: =A44+1 -> 42 | B45: Travis Pike | C45: 634 | D45: 11 | E45: =(C45/D45) -> 57.636363636363633 | F45: =ROUNDDOWN(((E45-48)*0.8),0) -> 7 | I45: 6.5 | J45: 1
A46: =A45+1 -> 43 | B46: Josh McFarland | C46: 751 | D46: 13 | E46: =(C46/D46) -> 57.769230769230766 | F46: =ROUNDDOWN(((E46-48)*0.8),0) -> 7 | G46: 54 | H46: 0 | I46: 3
A47: =A46+1 -> 44 | B47: Tony Rios | C47: 637 | D47: 11 | E47: =(C47/D47) -> 57.909090909090907 | F47: =ROUNDDOWN(((E47-48)*0.8),0) -> 7 | G47: 54 | H47: 0 | I47: 3.5
A48: =A47+1 -> 45 | B48: Matt Fritz | C48: 754 | D48: 13 | E48: =(C48/D48) -> 58.000 | F48: =ROUNDDOWN(((E48-48)*0.8),0) -> 8 | G48: 52 | H48: 0 | I48: 3
A49: =A48+1 -> 46 | B49: Matt Shannon | C49: 763 | D49: 13 | E49: =(C49/D49) -> 58.692307692307693 | F49: =ROUNDDOWN(((E49-48)*0.8),0) -> 8 | G49: 57 | H49: 0 | I49: 4.5
A50: =A49+1 -> 47 | B50: Ben Sandell | C50: 768 | D50: 13 | E50: =(C50/D50) -> 59.07692307692308 | F50: =ROUNDDOWN(((E50-48)*0.8),0) -> 8 | G50: 52 | H50: 0 | I50: 7.5
A51: =A50+1 -> 48 | B51: Anthony Moody | C51: 770 | D51: 13 | E51: =(C51/D51) -> 59.230769230769234 | F51: =ROUNDDOWN(((E51-48)*0.8),0) -> 8 | G51: 53 | H51: 0 | I51: 4.5
A52: =A51+1 -> 49 | B52: Tim Troyna | C52: 712 | D52: 12 | E52: =(C52/D52) -> 59.333333333333336 | F52: =ROUNDDOWN(((E52-48)*0.8),0) -> 9 | G52: 56 | H52: 0 | I52: 5
A53: =A52+1 -> 50 | B53: David McCuskey | C53: 773 | D53: 13 | E53: =(C53/D53) -> 59.46153846153846 | F53: =ROUNDDOWN(((E53-48)*0.8),0) -> 9 | G53: 55 | H53: 1 | I53: 4.5
A54: =A53+1 -> 51 | B54: Erik Smith | C54: 787 | D54: 13 | E54: =(C54/D54) -> 60.53846153846154 | F54: =ROUNDDOWN(((E54-48)*0.8),0) -> 10 | G54: 55 | H54: 1 | I54: 6
A55: =A54+1 -> 52 | B55: Adam Henderson | C55: 788 | D55: 13 | E55: =(C55/D55) -> 60.615384615384613 | F55: =ROUNDDOWN(((E55-48)*0.8),0) -> 10 | G55: 57 | H55: 0 | I55: 5
A56: 53 | B56: Adam Chittenden | C56: 792 | D56: 13 | E56: =(C56/D56) -> 60.92307692307692 | F56: =ROUNDDOWN(((E56-48)*0.8),0) -> 10 | G56: 56 | H56: 0 | I56: 6
A57: 54 | B57: Spencer Eubanks | C57: 798 | D57: 13 | E57: =(C57/D57) -> 61.384615384615387 | F57: =ROUNDDOWN(((E57-48)*0.8),0) -> 10 | G57: 57 | H57: 0.5 | I57: 4
A58: 55 | B58: Avg Joe | C58: 800 | D58: 13 | E58: =(C58/D58) -> 61.53846153846154 | F58: =ROUNDDOWN(((E58-48)*0.8),0) -> 10 | G58: 55 | H58: 1 | I58: 5
A59: 56 | B59: Tom Pepper | C59: 677 | D59: 11 | E59: =(C59/D59) -> 61.545454545454547 | F59: =ROUNDDOWN(((E59-48)*0.8),0) -> 10 | G59: 61 | H59: 0 | I59: 5
A60: 57 | B60: Shane Thirtyacre | C60: 678 | D60: 11 | E60: =(C60/D60) -> 61.636363636363633 | F60: =ROUNDDOWN(((E60-48)*0.8),0) -> 10 | G60: 57 | H60: 0 | I60: 6
A61: 58 | B61: Mitch Lerch | C61: 802 | D61: 13 | E61: =(C61/D61) -> 61.692307692307693 | F61: =ROUNDDOWN(((E61-48)*0.8),0) -> 10 | G61: 53 | H61: 1 | I61: 9
A62: 59 | B62: D Burns | C62: 802 | D62: 13 | E62: =(C62/D62) -> 61.692307692307693 | F62: =ROUNDDOWN(((E62-48)*0.8),0) -> 10 | G62: 54 | H62: 0 | I62: 3
A63: 60 | B63: Pat Cutsforth | C63: 804 | D63: 13 | E63: =(C63/D63) -> 61.846153846153847 | F63: =ROUNDDOWN(((E63-48)*0.8),0) -> 11 | G63: 59 | H63: 0 | I63: 8.5
A64: 61 | B64: Tony Ebson | C64: 822 | D64: 13 | E64: =(C64/D64) -> 63.230769230769234 | F64: =ROUNDDOWN(((E64-48)*0.8),0) -> 12 | G64: 55 | H64: 0.5 | I64: 7
A65: 62 | B65: Sarah Potter | C65: 823 | D65: 13 | E65: =(C65/D65) -> 63.307692307692307 | F65: =ROUNDDOWN(((E65-48)*0.8),0) -> 12 | G65: 55 | H65: 1 | I65: 5.5
A66: 63 | B66: Shawn Hullinger | C66: 834 | D66: 13 | E66: =(C66/D66) -> 64.15384615384616 | F66: =ROUNDDOWN(((E66-48)*0.8),0) -> 12 | G66: 56 | H66: 1 | I66: 5.5
A67: 64 | B67: Matt Whitlock | C67: 797 | D67: 12 | E67: =(C67/D67) -> 66.416666666666671 | F67: =ROUNDDOWN(((E67-48)*0.8),0) -> 14 | I67: 6 | J67: 1
A69: Subs | B69: Player | C69: Total Strokes | D69: Weeks | E69: Average | F69: H-Cap | G69: Last | H69: Week Pt. | I69: Total Pts. | J69: Subed For
A70: 1 | B70: Adam Karstens | C70: 390 | D70: 7 | E70: =SUM(C70/D70) -> 55.714285714285715 | F70: =ROUNDDOWN(((E70-48)*0.8),0) -> 6 | G70: 49 | H70: 1 | I70: 3.5 | J70: Whitlock
A71: 2 | B71: Archie Coulter | C71: 280 | D71: 5 | E71: =SUM(C71/D71) -> 56.000 | F71: =ROUNDDOWN(((E71-48)*0.8),0) -> 6 | G71: 50
A72: 3 | B72: Dustin Snodgress | C72: 314 | D72: 5 | E72: =SUM(C72/D72) -> 62.800 | F72: =ROUNDDOWN(((E72-48)*0.8),0) -> 11
A73: 2 | B73: Josh Spang | C73: 212 | D73: 4 | E73: =SUM(C73/D73) -> 53.000 | F73: =ROUNDDOWN(((E73-48)*0.8),0) -> 4 | G73: 46 | H73: 1 | I73: 1.5 | J73: Pike
A74: 3 | B74: Dan Lewis | C74: 228 | D74: 4 | E74: =SUM(C74/D74) -> 57.000 | F74: =ROUNDDOWN(((E74-48)*0.8),0) -> 7 | I74: 1
A75: =SUM(A74+1) -> 4 | B75: Kevin Stibal | C75: 104 | D75: 2 | E75: =SUM(C75/D75) -> 52.000 | F75: 0 | G75: 48 | I75: 1
A76: =SUM(A75+1) -> 5 | B76: Sills | C76: 119 | D76: 2 | E76: =SUM(C76/D76) -> 59.500 | F76: =ROUNDDOWN(((E76-50)*0.8),0) -> 7 | G76: 54
A77: 7 | B77: Johnny Walker | C77: 122 | D77: 2 | E77: =SUM(C77/D77) -> 61.000 | F77: =ROUNDDOWN(((E77-48)*0.8),0) -> 10 | I77: 1
A78: 8 | B78: Kerri Haught | C78: 124 | D78: 2 | E78: =SUM(C78/D78) -> 62.000 | F78: =ROUNDDOWN(((E78-48)*0.8),0) -> 11
A79: 9 | B79: Steve Callaway | C79: 125 | D79: 2 | E79: =SUM(C79/D79) -> 62.500 | F79: =ROUNDDOWN(((E79-48)*0.8),0) -> 11
A80: 10 | B80: Matt Snyder | C80: 162 | D80: 2 | E80: =SUM(C80/D80) -> 81.000 | F80: =ROUNDDOWN(((E80-48)*0.8),0) -> 26
A81: 11 | B81: Miguel - Bowling Green | C81: 52 | D81: 1 | E81: =SUM(C81/D81) -> 52.000 | F81: 0 | I81: 1
A82: 12 | B82: Brandon Yancey | C82: 52 | D82: 1 | E82: =SUM(C82/D82) -> 52.000 | F82: 0
A83: 13 | B83: Mike William | C83: 53 | D83: 1 | E83: =SUM(C83/D83) -> 53.000 | F83: 0
A84: 14 | B84: Aaron | C84: 53 | D84: 1 | E84: =SUM(C84/D84) -> 53.000 | F84: 0
A85: 15 | B85: Caleb | C85: 54 | D85: 1 | E85: =SUM(C85/D85) -> 54.000 | F85: 0
A86: 16 | B86: Apollo | C86: 54 | D86: 1 | E86: =SUM(C86/D86) -> 54.000 | F86: 0
A87: 17 | B87: Dave Peyton | C87: 56 | D87: 1 | E87: =SUM(C87/D87) -> 56.000 | F87: 0
A88: 18 | B88: Mike Noth | C88: 57 | D88: 1 | E88: =SUM(C88/D88) -> 57.000 | F88: 0
A89: 19 | B89: Nic Gordon | C89: 58 | D89: 1 | E89: =SUM(C89/D89) -> 58.000 | F89: 0
A90: 20 | B90: Brian Snider | C90: 59 | D90: 1 | E90: =SUM(C90/D90) -> 59.000 | F90: 0
A91: 21 | B91: Jack Gilmore | C91: 59 | D91: 1 | E91: =SUM(C91/D91) -> 59.000 | F91: 0
A92: 22 | B92: Jesse Kirk | C92: 60 | D92: 1 | E92: =SUM(C92/D92) -> 60.000 | F92: 0
A93: 23 | B93: Dustin Nohr | C93: 64 | D93: 1 | E93: =SUM(C93/D93) -> 64.000 | F93: 0
A94: 24 | B94: Craig Eastin | C94: 65 | D94: 1 | E94: =SUM(C94/D94) -> 65.000 | F94: 0
A95: 25 | C95: 0 | D95: 1 | E95: =SUM(C95/D95) -> 0.000 | F95: =ROUNDDOWN(((E95-50)*0.8),0) -> -40
A96: 26 | C96: 0 | D96: 1 | E96: =SUM(C96/D96) -> 0.000 | F96: =ROUNDDOWN(((E96-50)*0.8),0) -> -40
A97: 27 | C97: 0 | D97: 1 | E97: =SUM(C97/D97) -> 0.000 | F97: =ROUNDDOWN(((E97-50)*0.8),0) -> -40
A98: 28 | C98: 0 | D98: 1 | E98: =SUM(C98/D98) -> 0.000 | F98: =ROUNDDOWN(((E98-50)*0.8),0) -> -40
A99: 29 | C99: 0 | D99: 1 | E99: =SUM(C99/D99) -> 0.000 | F99: =ROUNDDOWN(((E99-50)*0.8),0) -> -40
A100: 30
A101: 31
B103: TEAM # | C103: BUSH | E103: Total Points | F103: Team Points | G103: Team Avg
A104: 1 | B104: 12 | C104: Ian Jacobs & Andrew Greco | E104: 24 | F104: 8.5 | G104: =AVERAGE(E5,E40) -> 53.692307692307693
A105: 2 | B105: 13 | C105: Matt Whitlock & Greg Dye | E105: 24 | F105: 8.5 | G105: =AVERAGE(E28,E67) -> 60.750
A106: 3 | B106: 6 | C106: Ryan Clark & Ben Sandel | E106: 23.5 | F106: 8 | G106: =AVERAGE(E24,E50) -> 56.92307692307692
A107: 4 | B107: 16 | C107: Tim Peyton & Josh Beachy | E107: 22.5 | F107: 7.5 | G107: =AVERAGE(E10,E13) -> 52.58653846153846
A108: 5 | B108: 3 | C108: Erik Smith & KVN | E108: 22.5 | F108: 7 | G108: =AVERAGE(E54,E17) -> 57.192307692307693
A109: 6 | B109: 4 | C109: Marty Reis & Travis Pike | E109: 21.5 | F109: 8.5 | G109: =AVERAGE(E44,E45) -> 57.587412587412587
A110: 7 | B110: 11 | C110: Matt Weiben & Kirby Callanhan | E110: 20.5 | F110: 8 | G110: =AVERAGE(E15,E26) -> 54.269230769230774
A111: 8 | B111: 10 | C111: Adam Miller & Mitch Lerch | E111: 20.5 | F111: 6.5 | G111: =AVERAGE(E21,E62) -> 58.179487179487182
A112: 9 | B112: 9 | C112: Tim Troyna & Pat Cutsforth | E112: 19.5 | F112: 6 | G112: =AVERAGE(E52,E63) -> 60.589743589743591
A113: 10 | B113: 7 | C113: Doug Johnson & Adam Stiers | E113: 19 | F113: 6.5 | G113: =AVERAGE(E12,E33) -> 54.330128205128204
A114: 11 | B114: 8 | C114: Jesse Streinz & Bob Hernandez | E114: 18 | F114: 5 | G114: =AVERAGE(E27,E32) -> 55.269230769230774
A115: 12 | B115: 5 | C115: Average Joe & Chris Clime | E115: 17.5 | F115: 6 | G115: =AVERAGE(E29,E58) -> 58.352564102564102
A116: 13 | B116: 2 | C116: Sarah Potter & Kollin Grimm | E116: 17 | F116: 5 | G116: =AVERAGE(E25,E65) -> 59.115384615384613
A117: 14 | B117: 14 | C117: Matt Fritz & Jason Rimrodt | E117: 16.5 | F117: 4.5 | G117: =AVERAGE(E6,E48) -> 54.346153846153847
A118: 15 | B118: 1 | C118: D Burns & Adam Henderson | E118: 12 | F118: 4 | G118: =AVERAGE(E62,E55) -> 61.153846153846153
A119: 16 | B119: 15 | C119: Nathan Veeder & Tony Rios | E119: 9 | F119: 2.5 | G119: =AVERAGE(E39,E47) -> 57.26223776223776
B121: TEAM # | C121: WHACKER
A122: 1 | B122: 30 | C122: Joel Knutson & Travis Fruendt | E122: 29.5 | F122: 10 | G122: =AVERAGE(E30,E31) -> 55.384615384615387
A123: 2 | B123: 17 | C123: Chuck Yanda & Nate Robbins | E123: 26.5 | F123: 9 | G123: =AVERAGE(E15,E35) -> 54.769230769230774
A124: 3 | B124: 27 | C124: Kurt Conrad & Dan Kent | E124: 25.5 | F124: 10 | G124: =AVERAGE(E11,E18) -> 53.07692307692308
A125: 4 | B125: 22 | C125: Jeremy Farnsworth & Tony Ebson | E125: 24.5 | F125: 9 | G125: =AVERAGE(E64,E8) -> 57.365384615384613
A126: 5 | B126: 23 | C126: Doug Peyton & Adam Chittenden | E126: 23.5 | F126: 8.5 | G126: =AVERAGE(E7,E56) -> 55.807692307692307
A127: 6 | B127: 29 | C127: Adam Olsen & Matt Shannon | E127: 22.5 | F127: 7 | G127: =AVERAGE(E4,E49) -> 52.807692307692307
A128: 7 | B128: 21 | C128: Ryan Eggleston & Shane Thirtyacre | E128: 21.5 | F128: 7 | G128: =AVERAGE(E43,E60) -> 59.472027972027973
A129: 8 | B129: 32 | C129: Dan Kern & Shirtless Bill | E129: 21 | F129: 6.5 | G129: =AVERAGE(E9,E36) -> 53.961538461538467
A130: 9 | B130: 24 | C130: Ryan Hamilton & Rob Mumma | E130: 20 | F130: 6.5 | G130: =AVERAGE(E34,E37) -> 55.96153846153846
A131: 10 | B131: 26 | C131: Joe French & Matt Wycoff | E131: 19 | F131: 6.5 | G131: =AVERAGE(E19,E42) -> 55.768939393939391
A132: 11 | B132: 19 | C132: Drew Detert & Anthony Moody | E132: 15.5 | F132: 5 | G132: =AVERAGE(E22,E51) -> 56.961538461538467
A133: 12 | B133: 20 | C133: Dustin Utley & Tom Pepper | E133: 14.5 | F133: 5.5 | G133: =AVERAGE(E23,E59) -> 58.11888111888112
A134: 13 | B134: 28 | C134: Tim Potter & David McCuskey | E134: 14 | F134: 4.5 | G134: =AVERAGE(E20,E53) -> 57.000
A135: 14 | B135: 25 | C135: Ryan Wodstrchill & Phil Campos | E135: 13.5 | F135: 5 | G135: =AVERAGE(E14,E38) -> 54.95804195804196
A136: 15 | B136: 31 | C136: Spencer Eubanks & Shawn Hullinger | E136: 13 | F136: 3.5 | G136: =AVERAGE(E57,E66) -> 62.769230769230774
A137: 16 | B137: 18 | C137: Jason Shook & Josh McFarland | E137: 12.5 | F137: 2.5 | G137: =AVERAGE(E41,E46) -> 57.384615384615387