A1: 2013 S.B.D.G.L. STANDINGS Through Week 4 Turkey Creek
A2: Rank | B2: Player | C2: Total Strokes | D2: Weeks | E2: Average | F2: H-Cap | G2: Last | H2: Week Pt. | I2: Total Pts. | J2: Sub Pts.
A4: =A3+1 -> 1 | B4: Adam Olsen | C4: 191 | D4: 4 | E4: =(C4/D4) -> 47.750 | F4: =ROUNDDOWN(((E4-48)*0.8),0) -> 0 | G4: 52 | H4: 1 | I4: 4
A5: =A4+1 -> 2 | B5: Andrew Greco | C5: 203 | D5: 4 | E5: =(C5/D5) -> 50.750 | F5: =ROUNDDOWN(((E5-48)*0.8),0) -> 2 | G5: 53 | H5: 1 | I5: 4
A6: =A5+1 -> 3 | B6: Doug Peyton | C6: 206 | D6: 4 | E6: =(C6/D6) -> 51.500 | F6: =ROUNDDOWN(((E6-48)*0.8),0) -> 2 | G6: 52 | H6: 1 | I6: 4
A7: =A6+1 -> 4 | B7: Josh Beachy | C7: 155 | D7: 3 | E7: =(C7/D7) -> 51.666666666666664 | F7: =ROUNDDOWN(((E7-48)*0.8),0) -> 2 | H7: 0 | I7: 2 | J7: 0
A8: =A7+1 -> 5 | B8: Jason Rimrodt | C8: 207 | D8: 4 | E8: =(C8/D8) -> 51.750 | F8: =ROUNDDOWN(((E8-48)*0.8),0) -> 3 | G8: 52 | H8: 1 | I8: 4
A9: =A8+1 -> 6 | B9: Tim Peyton | C9: 207 | D9: 4 | E9: =(C9/D9) -> 51.750 | F9: =ROUNDDOWN(((E9-48)*0.8),0) -> 3 | G9: 50 | H9: 1 | I9: 3
A10: =A9+1 -> 7 | B10: Doug Johnson | C10: 207 | D10: 4 | E10: =(C10/D10) -> 51.750 | F10: =ROUNDDOWN(((E10-48)*0.8),0) -> 3 | G10: 59 | H10: 0 | I10: 2.5
A11: =A10+1 -> 8 | B11: Kurt Conrad | C11: 210 | D11: 4 | E11: =(C11/D11) -> 52.500 | F11: =ROUNDDOWN(((E11-48)*0.8),0) -> 3 | G11: 53 | H11: 1 | I11: 3
A12: =A11+1 -> 9 | B12: Dan Kern | C12: 210 | D12: 4 | E12: =(C12/D12) -> 52.500 | F12: =ROUNDDOWN(((E12-48)*0.8),0) -> 3 | G12: 53 | H12: 1 | I12: 2
A13: =A12+1 -> 10 | B13: Ryan Wodstrchill | C13: 211 | D13: 4 | E13: =(C13/D13) -> 52.750 | F13: =ROUNDDOWN(((E13-48)*0.8),0) -> 3 | G13: 56 | H13: 0 | I13: 2
A14: =A13+1 -> 11 | B14: Jeremy Farnsworth | C14: 211 | D14: 4 | E14: =(C14/D14) -> 52.750 | F14: =ROUNDDOWN(((E14-48)*0.8),0) -> 3 | G14: 50 | H14: 1 | I14: 1.5
A15: =A14+1 -> 12 | B15: Tim Potter | C15: 211 | D15: 4 | E15: =(C15/D15) -> 52.750 | F15: =ROUNDDOWN(((E15-48)*0.8),0) -> 3 | G15: 54 | H15: 0 | I15: 1
A16: =A15+1 -> 13 | B16: Drew Detert | C16: 212 | D16: 4 | E16: =(C16/D16) -> 53.000 | F16: =ROUNDDOWN(((E16-48)*0.8),0) -> 4 | G16: 57 | H16: 0 | I16: 2.5
A17: =A16+1 -> 14 | B17: Adam Miller | C17: 213 | D17: 4 | E17: =(C17/D17) -> 53.250 | F17: =ROUNDDOWN(((E17-48)*0.8),0) -> 4 | G17: 58 | H17: 0 | I17: 1.5
A18: =A17+1 -> 15 | B18: Dustin Utley | C18: 213 | D18: 4 | E18: =(C18/D18) -> 53.250 | F18: =ROUNDDOWN(((E18-48)*0.8),0) -> 4 | G18: 57 | H18: 0 | I18: 1.5
A19: =A18+1 -> 16 | B19: Matt Wieben | C19: 213 | D19: 4 | E19: =(C19/D19) -> 53.250 | F19: =ROUNDDOWN(((E19-48)*0.8),0) -> 4 | G19: 55 | H19: 0 | I19: 1
A20: =A19+1 -> 17 | B20: Adam Stiers | C20: 218 | D20: 4 | E20: =(C20/D20) -> 54.500 | F20: =ROUNDDOWN(((E20-48)*0.8),0) -> 5 | G20: 58 | H20: 0 | I20: 2
A21: =A20+1 -> 18 | B21: Kirby Callahan | C21: 221 | D21: 4 | E21: =(C21/D21) -> 55.250 | F21: =ROUNDDOWN(((E21-48)*0.8),0) -> 5 | G21: 59 | H21: 0 | I21: 1.5
A22: =A21+1 -> 19 | B22: Ryan Clark | C22: 222 | D22: 4 | E22: =(C22/D22) -> 55.500 | F22: =ROUNDDOWN(((E22-48)*0.8),0) -> 6 | G22: 56 | H22: 1 | I22: 3.5
A23: =A22+1 -> 20 | B23: Kollin Grimm | C23: 222 | D23: 4 | E23: =(C23/D23) -> 55.500 | F23: =ROUNDDOWN(((E23-48)*0.8),0) -> 6 | G23: 65 | H23: 0 | I23: 2
A24: =A23+1 -> 21 | B24: Jesse Streinz | C24: 223 | D24: 4 | E24: =(C24/D24) -> 55.750 | F24: =ROUNDDOWN(((E24-48)*0.8),0) -> 6 | G24: 54 | H24: 1 | I24: 2
A25: =A24+1 -> 22 | B25: Shirtless Bill | C25: 223 | D25: 4 | E25: =(C25/D25) -> 55.750 | F25: =ROUNDDOWN(((E25-48)*0.8),0) -> 6 | G25: 56 | H25: 1 | I25: 2
A26: =A25+1 -> 23 | B26: Joe French | C26: 223 | D26: 4 | E26: =(C26/D26) -> 55.750 | F26: =ROUNDDOWN(((E26-48)*0.8),0) -> 6 | G26: 55 | H26: 0.5 | I26: 1.5
A27: =A26+1 -> 24 | B27: Travis Pike | C27: 223 | D27: 4 | E27: =(C27/D27) -> 55.750 | F27: =ROUNDDOWN(((E27-48)*0.8),0) -> 6 | G27: 58 | H27: 0 | I27: 1.5
A28: =A27+1 -> 25 | B28: Dan Kent | C28: 224 | D28: 4 | E28: =(C28/D28) -> 56.000 | F28: =ROUNDDOWN(((E28-48)*0.8),0) -> 6 | G28: 53 | H28: 1 | I28: 3.5
A29: =A28+1 -> 26 | B29: Joel Knutson | C29: 224 | D29: 4 | E29: =(C29/D29) -> 56.000 | F29: =ROUNDDOWN(((E29-48)*0.8),0) -> 6 | G29: 55 | H29: 0.5 | I29: 2.5
A30: =A29+1 -> 27 | B30: KVN Lavley | C30: 224 | D30: 4 | E30: =(C30/D30) -> 56.000 | F30: =ROUNDDOWN(((E30-48)*0.8),0) -> 6 | G30: 52 | H30: 1 | I30: 2
A31: =A30+1 -> 28 | B31: Matt Fritz | C31: 225 | D31: 4 | E31: =(C31/D31) -> 56.250 | F31: =ROUNDDOWN(((E31-48)*0.8),0) -> 6 | G31: 53 | H31: 1 | I31: 2
A32: =A31+1 -> 29 | B32: Rob Mumma | C32: 226 | D32: 4 | E32: =(C32/D32) -> 56.500 | F32: =ROUNDDOWN(((E32-48)*0.8),0) -> 6 | G32: 54 | H32: 1 | I32: 3.5
A33: =A32+1 -> 30 | B33: Josh McFarland | C33: 226 | D33: 4 | E33: =(C33/D33) -> 56.500 | F33: =ROUNDDOWN(((E33-48)*0.8),0) -> 6 | G33: 60 | H33: 0 | I33: 1
A34: =A33+1 -> 31 | B34: Bob Hernadez | C34: 227 | D34: 4 | E34: =(C34/D34) -> 56.750 | F34: =ROUNDDOWN(((E34-48)*0.8),0) -> 7 | G34: 54 | H34: 1 | I34: 3
A35: =A34+1 -> 32 | B35: Ryan Hamilton | C35: 227 | D35: 4 | E35: =(C35/D35) -> 56.750 | F35: =ROUNDDOWN(((E35-48)*0.8),0) -> 7 | G35: 57 | H35: 1 | I35: 2
A36: =A35+1 -> 33 | B36: Chris Clime | C36: 227 | D36: 4 | E36: =(C36/D36) -> 56.750 | F36: =ROUNDDOWN(((E36-48)*0.8),0) -> 7 | G36: 55 | H36: 1 | I36: 1
A37: =A36+1 -> 34 | B37: Travis Fruendt | C37: 228 | D37: 4 | E37: =(C37/D37) -> 57.000 | F37: =ROUNDDOWN(((E37-48)*0.8),0) -> 7 | G37: 52 | H37: 1 | I37: 4
A38: =A37+1 -> 35 | B38: Tony Rios | C38: 228 | D38: 4 | E38: =(C38/D38) -> 57.000 | F38: =ROUNDDOWN(((E38-48)*0.8),0) -> 7 | G38: 55 | H38: 1 | I38: 2
A39: =A38+1 -> 36 | B39: Nate Robins | C39: 229 | D39: 4 | E39: =(C39/D39) -> 57.250 | F39: =ROUNDDOWN(((E39-48)*0.8),0) -> 7 | G39: 57 | H39: 0 | I39: 1
A40: =A39+1 -> 37 | B40: Nate Veeder | C40: 229 | D40: 4 | E40: =(C40/D40) -> 57.250 | F40: =ROUNDDOWN(((E40-48)*0.8),0) -> 7 | G40: 58 | H40: 1 | I40: 1
A41: =A40+1 -> 38 | B41: Ryan Eggleston | C41: 231 | D41: 4 | E41: =(C41/D41) -> 57.750 | F41: =ROUNDDOWN(((E41-48)*0.8),0) -> 7 | G41: 57 | H41: 1 | I41: 2.5
A42: =A41+1 -> 39 | B42: Phil Campos | C42: 231 | D42: 4 | E42: =(C42/D42) -> 57.750 | F42: =ROUNDDOWN(((E42-48)*0.8),0) -> 7 | G42: 58 | H42: 0 | I42: 1
A43: =A42+1 -> 40 | B43: Jason Shook | C43: 232 | D43: 4 | E43: =(C43/D43) -> 58.000 | F43: =ROUNDDOWN(((E43-48)*0.8),0) -> 8 | G43: 57 | H43: 1 | I43: 2
A44: =A43+1 -> 41 | B44: Ben Sandell | C44: 233 | D44: 4 | E44: =(C44/D44) -> 58.250 | F44: =ROUNDDOWN(((E44-48)*0.8),0) -> 8 | G44: 57 | H44: 1 | I44: 3
A45: =A44+1 -> 42 | B45: Chuck Yanda | C45: 233 | D45: 4 | E45: =(C45/D45) -> 58.250 | F45: =ROUNDDOWN(((E45-48)*0.8),0) -> 8 | G45: 59 | H45: 1 | I45: 3
A46: =A45+1 -> 43 | B46: Matt Wyckoff | C46: 175 | D46: 3 | E46: =(C46/D46) -> 58.333333333333336 | F46: =ROUNDDOWN(((E46-48)*0.8),0) -> 8 | G46: 59 | H46: 0 | I46: 0.5
A47: =A46+1 -> 44 | B47: Greg Dye | C47: 236 | D47: 4 | E47: =(C47/D47) -> 59.000 | F47: =ROUNDDOWN(((E47-48)*0.8),0) -> 8 | G47: 62 | H47: 0 | I47: 2
A48: =A47+1 -> 45 | B48: Tim Troyna | C48: 236 | D48: 4 | E48: =(C48/D48) -> 59.000 | F48: =ROUNDDOWN(((E48-48)*0.8),0) -> 8 | G48: 59 | H48: 1 | I48: 1.5
A49: =A48+1 -> 46 | B49: Martin Reis | C49: 237 | D49: 4 | E49: =(C49/D49) -> 59.250 | F49: =ROUNDDOWN(((E49-48)*0.8),0) -> 9 | G49: 58 | H49: 0 | I49: 1
A50: =A49+1 -> 47 | B50: David McCuskey | C50: 238 | D50: 4 | E50: =(C50/D50) -> 59.500 | F50: =ROUNDDOWN(((E50-48)*0.8),0) -> 9 | G50: 64 | H50: 0 | I50: 2
A51: =A50+1 -> 48 | B51: Ian Jacobs | C51: 238 | D51: 4 | E51: =(C51/D51) -> 59.500 | F51: =ROUNDDOWN(((E51-48)*0.8),0) -> 9 | G51: 60 | H51: 0 | I51: 0.5
A52: =A51+1 -> 49 | B52: Adam Henderson | C52: 239 | D52: 4 | E52: =(C52/D52) -> 59.750 | F52: =ROUNDDOWN(((E52-48)*0.8),0) -> 9 | G52: 59 | H52: 0 | I52: 2
A53: =A52+1 -> 50 | B53: Matt Shannon | C53: 239 | D53: 4 | E53: =(C53/D53) -> 59.750 | F53: =ROUNDDOWN(((E53-48)*0.8),0) -> 9 | G53: 53 | H53: 1 | I53: 2
A54: =A53+1 -> 51 | B54: Anthony Moody | C54: 241 | D54: 4 | E54: =(C54/D54) -> 60.250 | F54: =ROUNDDOWN(((E54-48)*0.8),0) -> 9 | G54: 61 | H54: 0 | I54: 1
A55: =A54+1 -> 52 | B55: Erik Smith | C55: 242 | D55: 4 | E55: =(C55/D55) -> 60.500 | F55: =ROUNDDOWN(((E55-48)*0.8),0) -> 10 | G55: 62 | H55: 1 | I55: 2
A56: 53 | B56: Shane Thirtyacre | C56: 244 | D56: 4 | E56: =(C56/D56) -> 61.000 | F56: =ROUNDDOWN(((E56-48)*0.8),0) -> 10 | G56: 64 | H56: 0 | I56: 0.5
A57: 54 | B57: Tom Pepper | C57: 245 | D57: 4 | E57: =(C57/D57) -> 61.250 | F57: =ROUNDDOWN(((E57-48)*0.8),0) -> 10 | G57: 66 | H57: 0 | I57: 2
A58: 55 | B58: Adam Chittenden | C58: 246 | D58: 4 | E58: =(C58/D58) -> 61.500 | F58: =ROUNDDOWN(((E58-48)*0.8),0) -> 10 | G58: 60 | H58: 1 | I58: 2.5
A59: 56 | B59: D Burns | C59: 247 | D59: 4 | E59: =(C59/D59) -> 61.750 | F59: =ROUNDDOWN(((E59-48)*0.8),0) -> 11 | G59: 60 | H59: 1 | I59: 2
A60: 57 | B60: Mitch Lerch | C60: 250 | D60: 4 | E60: =(C60/D60) -> 62.500 | F60: =ROUNDDOWN(((E60-48)*0.8),0) -> 11 | G60: 66 | H60: 0 | I60: 2.5
A61: 58 | B61: Spencer Eubanks | C61: 251 | D61: 4 | E61: =(C61/D61) -> 62.750 | F61: =ROUNDDOWN(((E61-48)*0.8),0) -> 11 | G61: 63 | H61: 0 | I61: 0
A62: 59 | B62: Avg Joe | C62: 253 | D62: 4 | E62: =(C62/D62) -> 63.250 | F62: =ROUNDDOWN(((E62-48)*0.8),0) -> 12 | G62: 65 | H62: 0 | I62: 0
A63: 60 | B63: Sarah Potter | C63: 254 | D63: 4 | E63: =(C63/D63) -> 63.500 | F63: =ROUNDDOWN(((E63-48)*0.8),0) -> 12 | G63: 69 | H63: 0 | I63: 2.5
A64: 61 | B64: Shawn Hullinger | C64: 254 | D64: 4 | E64: =(C64/D64) -> 63.500 | F64: =ROUNDDOWN(((E64-48)*0.8),0) -> 12 | G64: 66 | H64: 0 | I64: 1
A65: 62 | B65: Tony Ebson | C65: 255 | D65: 4 | E65: =(C65/D65) -> 63.750 | F65: =ROUNDDOWN(((E65-48)*0.8),0) -> 12 | G65: 63 | H65: 0 | I65: 1.5
A66: 63 | B66: Pat Cutsforth | C66: 261 | D66: 4 | E66: =(C66/D66) -> 65.250 | F66: =ROUNDDOWN(((E66-48)*0.8),0) -> 13 | G66: 60 | H66: 1 | I66: 2.5
A67: 64 | B67: Matt Whitlock | C67: 265 | D67: 4 | E67: =(C67/D67) -> 66.250 | F67: =ROUNDDOWN(((E67-48)*0.8),0) -> 14 | G67: 70 | H67: 0 | I67: 1
A69: Subs | B69: Player | C69: Total Strokes | D69: Weeks | E69: Average | F69: H-Cap | G69: Last | H69: Week Pt. | I69: Total Pts. | J69: Subed For
A70: 1 | B70: Dustin Snodgress | C70: 118 | D70: 2 | E70: =SUM(C70/D70) -> 59.000 | F70: =ROUNDDOWN(((E70-48)*0.8),0) -> 8 | G70: 62 | H70: 0 | J70: BEACHY
A71: 2 | B71: Kerri Haught | C71: 124 | D71: 2 | E71: =SUM(C71/D71) -> 62.000 | F71: =ROUNDDOWN(((E71-48)*0.8),0) -> 11 | G71: 65
A72: 3 | B72: Matt Snyder | C72: 162 | D72: 2 | E72: =SUM(C72/D72) -> 81.000 | F72: =ROUNDDOWN(((E72-48)*0.8),0) -> 26 | I72: 0
A73: 2 | C73: 0 | D73: 1 | E73: =SUM(C73/D73) -> 0.000 | F73: =ROUNDDOWN(((E73-50)*0.8),0) -> -40
A74: 3 | C74: 0 | D74: 1 | E74: =SUM(C74/D74) -> 0.000 | F74: =ROUNDDOWN(((E74-50)*0.8),0) -> -40
A75: =SUM(A74+1) -> 4 | C75: 0 | D75: 1 | E75: =SUM(C75/D75) -> 0.000 | F75: =ROUNDDOWN(((E75-50)*0.8),0) -> -40
A76: =SUM(A75+1) -> 5 | C76: 0 | D76: 1 | E76: =SUM(C76/D76) -> 0.000 | F76: =ROUNDDOWN(((E76-50)*0.8),0) -> -40
A77: 7 | C77: 0 | D77: 1 | E77: =SUM(C77/D77) -> 0.000 | F77: =ROUNDDOWN(((E77-50)*0.8),0) -> -40
A78: 8 | C78: 0 | D78: 1 | E78: =SUM(C78/D78) -> 0.000 | F78: =ROUNDDOWN(((E78-50)*0.8),0) -> -40
A79: 9 | C79: 0 | D79: 1 | E79: =SUM(C79/D79) -> 0.000 | F79: =ROUNDDOWN(((E79-50)*0.8),0) -> -40
A80: 10 | C80: 0 | D80: 1 | E80: =SUM(C80/D80) -> 0.000 | F80: =ROUNDDOWN(((E80-50)*0.8),0) -> -40
A81: 11 | C81: 0 | D81: 1 | E81: =SUM(C81/D81) -> 0.000 | F81: =ROUNDDOWN(((E81-50)*0.8),0) -> -40
A82: 12 | C82: 0 | D82: 1 | E82: =SUM(C82/D82) -> 0.000 | F82: =ROUNDDOWN(((E82-50)*0.8),0) -> -40
A83: 13 | C83: 0 | D83: 1 | E83: =SUM(C83/D83) -> 0.000 | F83: =ROUNDDOWN(((E83-50)*0.8),0) -> -40
A84: 14 | C84: 0 | D84: 1 | E84: =SUM(C84/D84) -> 0.000 | F84: =ROUNDDOWN(((E84-50)*0.8),0) -> -40
A85: 15 | C85: 0 | D85: 1 | E85: =SUM(C85/D85) -> 0.000 | F85: =ROUNDDOWN(((E85-50)*0.8),0) -> -40
A86: 16 | C86: 0 | D86: 1 | E86: =SUM(C86/D86) -> 0.000 | F86: =ROUNDDOWN(((E86-50)*0.8),0) -> -40
A87: 17 | C87: 0 | D87: 1 | E87: =SUM(C87/D87) -> 0.000 | F87: =ROUNDDOWN(((E87-50)*0.8),0) -> -40
A88: 18 | C88: 0 | D88: 1 | E88: =SUM(C88/D88) -> 0.000 | F88: =ROUNDDOWN(((E88-50)*0.8),0) -> -40
A89: 19 | C89: 0 | D89: 1 | E89: =SUM(C89/D89) -> 0.000 | F89: =ROUNDDOWN(((E89-50)*0.8),0) -> -40
A90: 20 | C90: 0 | D90: 1 | E90: =SUM(C90/D90) -> 0.000 | F90: =ROUNDDOWN(((E90-50)*0.8),0) -> -40
A91: 21 | C91: 0 | D91: 1 | E91: =SUM(C91/D91) -> 0.000 | F91: =ROUNDDOWN(((E91-50)*0.8),0) -> -40
A92: 22 | C92: 0 | D92: 1 | E92: =SUM(C92/D92) -> 0.000 | F92: =ROUNDDOWN(((E92-50)*0.8),0) -> -40
A93: 23 | C93: 0 | D93: 1 | E93: =SUM(C93/D93) -> 0.000 | F93: =ROUNDDOWN(((E93-50)*0.8),0) -> -40
A94: 24 | C94: 0 | D94: 1 | E94: =SUM(C94/D94) -> 0.000 | F94: =ROUNDDOWN(((E94-50)*0.8),0) -> -40
A95: 25 | C95: 0 | D95: 1 | E95: =SUM(C95/D95) -> 0.000 | F95: =ROUNDDOWN(((E95-50)*0.8),0) -> -40
A96: 26 | C96: 0 | D96: 1 | E96: =SUM(C96/D96) -> 0.000 | F96: =ROUNDDOWN(((E96-50)*0.8),0) -> -40
A97: 27 | C97: 0 | D97: 1 | E97: =SUM(C97/D97) -> 0.000 | F97: =ROUNDDOWN(((E97-50)*0.8),0) -> -40
A98: 28 | C98: 0 | D98: 1 | E98: =SUM(C98/D98) -> 0.000 | F98: =ROUNDDOWN(((E98-50)*0.8),0) -> -40
A99: 28 | C99: 0 | D99: 1 | E99: =SUM(C99/D99) -> 0.000 | F99: =ROUNDDOWN(((E99-50)*0.8),0) -> -40
A100: 4 | B100: Adam Karstens | C100: 64 | D100: 1 | E100: =SUM(C100/D100) -> 64.000 | F100: 0
A101: 5 | B101: Johnny Walker | C101: 64 | D101: 1 | E101: =SUM(C101/D101) -> 64.000 | F101: 0
A103: 2013 SBDGL Team Standings
B104: TEAM # | C104: BUSH | E104: Total Points | F104: Team Points | G104: Team Avg
A105: 1 | B105: 6 | C105: Ryan Clark & Ben Sandel | E105: 10.5 | F105: 4 | G105: =AVERAGE(E44,E22) -> 56.875
A106: 2 | B106: 16 | C106: Tim Peyton & Josh Beachy | E106: 8.5 | F106: 3.5 | G106: =AVERAGE(E7,E9) -> 51.708333333333329
A107: 3 | B107: 14 | C107: Matt Fritz & Jason Rimrodt | E107: 8.5 | F107: 2.5 | G107: =AVERAGE(E8,E31) -> 54.000
A108: 4 | B108: 2 | C108: Sarah Potter & Kollin Grimm | E108: 7.5 | F108: 3 | G108: =AVERAGE(E23,E63) -> 59.500
A109: 5 | B109: 8 | C109: Jesse Streinz & Bob Hernandez | E109: 7 | F109: 2 | G109: =AVERAGE(E24,E34) -> 56.250
A110: 6 | B110: 7 | C110: Doug Johnson & Adam Stiers | E110: 6.5 | F110: 2 | G110: =AVERAGE(E10,E20) -> 53.125
A111: 7 | B111: 10 | C111: Adam Miller & Mitch Lerch | E111: 6 | F111: 2 | G111: =AVERAGE(E17,E60) -> 57.875
A112: 8 | B112: 3 | C112: Erik Smith & KVN | E112: 6 | F112: 2 | G112: =AVERAGE(E30,E55) -> 58.250
A113: 9 | B113: 1 | C113: D Burns & Adam Henderson | E113: 6 | F113: 2 | G113: =AVERAGE(E56,E61) -> 61.875
A114: 10 | B114: 9 | C114: Tim Troyna & Pat Cutsforth | E114: 6 | F114: 2 | G114: =AVERAGE(E48,E66) -> 62.125
A115: 11 | B115: 12 | C115: Ian Jacobs & Andrew Greco | E115: 5.5 | F115: 1 | G115: =AVERAGE(E5,E51) -> 55.125
A116: 12 | B116: 11 | C116: Matt Weiben & Kirby Callanhan | E116: 4.5 | F116: 2 | G116: =AVERAGE(E19,E21) -> 54.250
A117: 13 | B117: 15 | C117: Nathan Veeder & Tony Rios | E117: 4.5 | F117: 1.5 | G117: =AVERAGE(E40,E38) -> 57.125
A118: 14 | B118: 13 | C118: Matt Whitlock & Greg Dye | E118: 4.5 | F118: 1.5 | G118: =AVERAGE(E47,E67) -> 62.625
A119: 15 | B119: 4 | C119: Marty Reis & Travis Pike | E119: 3.5 | F119: 1 | G119: =AVERAGE(E27,E49) -> 57.500
A120: 16 | B120: 5 | C120: Average Joe & Chris Clime | E120: 1 | F120: 0 | G120: =AVERAGE(E62,E36) -> 60.000
B122: TEAM # | C122: WHACKER
A123: 1 | B123: 23 | C123: Doug Peyton & Adam Chittenden | E123: 10.5 | F123: 4 | G123: =AVERAGE(E6,E58) -> 56.500
A124: 2 | B124: 30 | C124: Joel Knutson & Travis Fruendt | E124: 10.5 | F124: 4 | G124: =AVERAGE(E29,E37) -> 56.500
A125: 3 | B125: 27 | C125: Kurt Conrad & Dan Kent | E125: 9.5 | F125: 3 | G125: =AVERAGE(E11,E28) -> 54.250
A126: 4 | B126: 29 | C126: Adam Olsen & Matt Shannon | E126: 9 | F126: 3 | G126: =AVERAGE(E4,E53) -> 53.750
A127: 5 | B127: 24 | C127: Ryan Hamilton & Rob Mumma | E127: 7.5 | F127: 2 | G127: =AVERAGE(E35,E32) -> 56.625
A128: 6 | B128: 32 | C128: Dan Kern & Shirtless Bill | E128: 6 | F128: 2 | G128: =AVERAGE(E12,E25) -> 54.125
A129: 7 | B129: 17 | C129: Chuck Yanda & Nate Robbins | E129: 6 | F129: 2 | G129: =AVERAGE(E45,E39) -> 57.750
A130: 8 | B130: 19 | C130: Drew Detert & Anthony Moody | E130: 5.5 | F130: 2 | G130: =AVERAGE(E16,E54) -> 56.625
A131: 9 | B131: 20 | C131: Dustin Utley & Tom Pepper | E131: 5.5 | F131: 2 | G131: =AVERAGE(E18,E57) -> 57.250
A132: 10 | B132: 25 | C132: Ryan Wodstrchill & Phil Campos | E132: 5 | F132: 2 | G132: =AVERAGE(E13,E42) -> 55.250
A133: 11 | B133: 22 | C133: Jeremy Farnsworth & Tony Ebson | E133: 5 | F133: 2 | G133: =AVERAGE(E14,E65) -> 58.250
A134: 12 | B134: 28 | C134: Tim Potter & David McCuskey | E134: 4.5 | F134: 1.5 | G134: =AVERAGE(E15,E50) -> 56.125
A135: 13 | B135: 18 | C135: Jason Shook & Josh McFarland | E135: 4 | F135: 1 | G135: =AVERAGE(E33,E43) -> 57.250
A136: 14 | B136: 21 | C136: Ryan Eggleston & Shane Thirtyacre | E136: 4 | F136: 1 | G136: =AVERAGE(E41,E56) -> 59.375
A137: 15 | B137: 26 | C137: Joe French & Matt Wycoff | E137: 2.5 | F137: 0.5 | G137: =AVERAGE(E26,E46) -> 57.041666666666671
A138: 16 | B138: 31 | C138: Spencer Eubanks & Shawn Hullinger | E138: 1 | F138: 0 | G138: =AVERAGE(E61,E64) -> 63.125