A1: 2013 S.B.D.G.L. Standings Through Week 18 - League Championships
A2: Rank | B2: Player | C2: Total Strokes | D2: Weeks | E2: Average | F2: H-Cap | G2: Last | H2: Week Pt. | I2: Total Pts. | J2: Sub Pts.
A4: =A3+1 -> 1 | B4: Adam Olsen | C4: 842 | D4: 18 | E4: =(C4/D4) -> 46.777777777777779 | F4: 0 | G4: 48 | H4: 1 | I4: 15.5
A5: =A4+1 -> 2 | B5: Doug Peyton | C5: 904 | D5: 18 | E5: =(C5/D5) -> 50.222222222222221 | F5: =ROUNDDOWN(((E5-48)*0.8),0) -> 1 | G5: 47 | H5: 1 | I5: 12
A6: =A5+1 -> 3 | B6: Jason Rimrodt | C6: 912 | D6: 18 | E6: =(C6/D6) -> 50.666666666666664 | F6: =ROUNDDOWN(((E6-48)*0.8),0) -> 2 | G6: 48 | H6: 0.5 | I6: 11
A7: =A6+1 -> 4 | B7: Jeremy Farnsworth | C7: 865 | D7: 17 | E7: =(C7/D7) -> 50.882352941176471 | F7: =ROUNDDOWN(((E7-48)*0.8),0) -> 2 | G7: 45 | H7: 1 | I7: 11
A8: =A7+1 -> 5 | B8: Andrew Greco | C8: 917 | D8: 18 | E8: =(C8/D8) -> 50.944444444444443 | F8: =ROUNDDOWN(((E8-48)*0.8),0) -> 2 | G8: 49 | H8: 0 | I8: 10.5
A9: =A8+1 -> 6 | B9: Dan Kern | C9: 923 | D9: 18 | E9: =(C9/D9) -> 51.277777777777779 | F9: =ROUNDDOWN(((E9-48)*0.8),0) -> 2 | G9: 49 | H9: 1 | I9: 11
A10: =A9+1 -> 7 | B10: Tim Peyton | C10: 929 | D10: 18 | E10: =(C10/D10) -> 51.611111111111114 | F10: =ROUNDDOWN(((E10-48)*0.8),0) -> 2 | G10: 52 | H10: 0 | I10: 11
A11: =A10+1 -> 8 | B11: Kurt Conrad | C11: 935 | D11: 18 | E11: =(C11/D11) -> 51.944444444444443 | F11: =ROUNDDOWN(((E11-48)*0.8),0) -> 3 | G11: 49 | H11: 0 | I11: 8.5
A12: =A11+1 -> 9 | B12: Josh Beachy | C12: 896 | D12: 17 | E12: =(C12/D12) -> 52.705882352941174 | F12: =ROUNDDOWN(((E12-48)*0.8),0) -> 3 | G12: 53 | H12: 0 | I12: 9
A13: =A12+1 -> 10 | B13: Ryan Wodstrchill | C13: 949 | D13: 18 | E13: =(C13/D13) -> 52.722222222222221 | F13: =ROUNDDOWN(((E13-48)*0.8),0) -> 3 | G13: 50 | H13: 1 | I13: 9
A14: =A13+1 -> 11 | B14: Doug Johnson | C14: 951 | D14: 18 | E14: =(C14/D14) -> 52.833333333333336 | F14: =ROUNDDOWN(((E14-48)*0.8),0) -> 3 | G14: 48 | H14: 1 | I14: 7.5
A15: =A14+1 -> 12 | B15: Dan Kent | C15: 954 | D15: 18 | E15: =(C15/D15) -> 53.000 | F15: =ROUNDDOWN(((E15-48)*0.8),0) -> 4 | G15: 49 | H15: 1 | I15: 13.5
A16: =A15+1 -> 13 | B16: KVN Lavley | C16: 955 | D16: 18 | E16: =(C16/D16) -> 53.055555555555557 | F16: =ROUNDDOWN(((E16-48)*0.8),0) -> 4 | G16: 51 | H16: 0 | I16: 12
A17: =A16+1 -> 14 | B17: Nate Robbins | C17: 957 | D17: 18 | E17: =(C17/D17) -> 53.166666666666664 | F17: =ROUNDDOWN(((E17-48)*0.8),0) -> 4 | G17: 49 | H17: 1 | I17: 11.5
A18: =A17+1 -> 15 | B18: Matt Wieben | C18: 961 | D18: 18 | E18: =(C18/D18) -> 53.388888888888886 | F18: =ROUNDDOWN(((E18-48)*0.8),0) -> 4 | G18: 56 | H18: 0 | I18: 9
A19: =A18+1 -> 16 | B19: Adam Miller | C19: 908 | D19: 17 | E19: =(C19/D19) -> 53.411764705882355 | F19: =ROUNDDOWN(((E19-48)*0.8),0) -> 4 | G19: 53 | H19: 0 | I19: 8
A20: =A19+1 -> 17 | B20: Joe French | C20: 855 | D20: 16 | E20: =(C20/D20) -> 53.4375 | F20: =ROUNDDOWN(((E20-48)*0.8),0) -> 4 | G20: 49 | H20: 1 | I20: 9.5
A21: =A20+1 -> 18 | B21: Greg Dye | C21: 923 | D21: 17 | E21: =(C21/D21) -> 54.294117647058826 | F21: =ROUNDDOWN(((E21-48)*0.8),0) -> 5 | G21: 53 | H21: 1 | I21: 13.5
A22: =A21+1 -> 19 | B22: Tim Potter | C22: 978 | D22: 18 | E22: =(C22/D22) -> 54.333333333333336 | F22: =ROUNDDOWN(((E22-48)*0.8),0) -> 5 | G22: 53 | H22: 0.5 | I22: 8
A23: =A22+1 -> 20 | B23: Bob Hernadez | C23: 928 | D23: 17 | E23: =(C23/D23) -> 54.588235294117645 | F23: =ROUNDDOWN(((E23-48)*0.8),0) -> 5 | I23: 11.5 | J23: 0
A24: =A23+1 -> 21 | B24: Drew Detert | C24: 983 | D24: 18 | E24: =(C24/D24) -> 54.611111111111114 | F24: =ROUNDDOWN(((E24-48)*0.8),0) -> 5 | G24: 52 | H24: 1 | I24: 8
A25: =A24+1 -> 22 | B25: Ryan Clark | C25: 984 | D25: 18 | E25: =(C25/D25) -> 54.666666666666664 | F25: =ROUNDDOWN(((E25-48)*0.8),0) -> 5 | G25: 50 | H25: 1 | I25: 9
A26: =A25+1 -> 23 | B26: Kirby Callahan | C26: 985 | D26: 18 | E26: =(C26/D26) -> 54.722222222222221 | F26: =ROUNDDOWN(((E26-48)*0.8),0) -> 5 | G26: 54 | H26: 0 | I26: 8.5
A27: =A26+1 -> 24 | B27: Dustin Utley | C27: 931 | D27: 17 | E27: =(C27/D27) -> 54.764705882352942 | F27: =ROUNDDOWN(((E27-48)*0.8),0) -> 5 | I27: 5
A28: =A27+1 -> 25 | B28: Chris Clime | C28: 931 | D28: 17 | E28: =(C28/D28) -> 54.764705882352942 | F28: =ROUNDDOWN(((E28-48)*0.8),0) -> 5 | G28: 51 | H28: 0.5 | I28: 10
A29: =A28+1 -> 26 | B29: Kollin Grimm | C29: 987 | D29: 18 | E29: =(C29/D29) -> 54.833333333333336 | F29: =ROUNDDOWN(((E29-48)*0.8),0) -> 5 | G29: 50 | H29: 0 | I29: 7.5
A30: =A29+1 -> 27 | B30: Travis Fruendt | C30: 988 | D30: 18 | E30: =(C30/D30) -> 54.888888888888886 | F30: =ROUNDDOWN(((E30-48)*0.8),0) -> 5 | G30: 53 | H30: 0 | I30: 13
A31: =A30+1 -> 28 | B31: Jesse Streinz | C31: 989 | D31: 18 | E31: =(C31/D31) -> 54.944444444444443 | F31: =ROUNDDOWN(((E31-48)*0.8),0) -> 5 | G31: 48 | H31: 1 | I31: 8
A32: =A31+1 -> 29 | B32: Chuck Yanda | C32: 993 | D32: 18 | E32: =(C32/D32) -> 55.166666666666664 | F32: =ROUNDDOWN(((E32-48)*0.8),0) -> 5 | G32: 53 | H32: 0 | I32: 13
A33: =A32+1 -> 30 | B33: Adam Stiers | C33: 938 | D33: 17 | E33: =(C33/D33) -> 55.176470588235297 | F33: =ROUNDDOWN(((E33-48)*0.8),0) -> 5 | G33: 50 | H33: 0 | I33: 7
A34: =A33+1 -> 31 | B34: Joel Knutson | C34: 999 | D34: 18 | E34: =(C34/D34) -> 55.500 | F34: =ROUNDDOWN(((E34-48)*0.8),0) -> 6 | G34: 51 | H34: 0 | I34: 8
A35: =A34+1 -> 32 | B35: Ryan Hamilton | C35: 1001 | D35: 18 | E35: =(C35/D35) -> 55.611111111111114 | F35: =ROUNDDOWN(((E35-48)*0.8),0) -> 6 | G35: 55 | H35: 0 | I35: 9
A36: =A35+1 -> 33 | B36: Rob Mumma | C36: 1006 | D36: 18 | E36: =(C36/D36) -> 55.888888888888886 | F36: =ROUNDDOWN(((E36-48)*0.8),0) -> 6 | G36: 57 | H36: 0 | I36: 8.5
A37: =A36+1 -> 34 | B37: Phil Campos | C37: 841 | D37: 15 | E37: =(C37/D37) -> 56.06666666666667 | F37: =ROUNDDOWN(((E37-48)*0.8),0) -> 6 | G37: 50 | H37: 1 | I37: 5
A38: =A37+1 -> 35 | B38: Shirtless Bill | C38: 1010 | D38: 18 | E38: =(C38/D38) -> 56.111111111111114 | F38: =ROUNDDOWN(((E38-48)*0.8),0) -> 6 | G38: 54 | H38: 1 | I38: 11.5
A39: =A38+1 -> 36 | B39: Nate Veeder | C39: 1014 | D39: 18 | E39: =(C39/D39) -> 56.333333333333336 | F39: =ROUNDDOWN(((E39-48)*0.8),0) -> 6 | G39: 54 | H39: 1 | I39: 5
A40: =A39+1 -> 37 | B40: Ian Jacobs | C40: 1015 | D40: 18 | E40: =(C40/D40) -> 56.388888888888886 | F40: =ROUNDDOWN(((E40-48)*0.8),0) -> 6 | G40: 54 | H40: 0 | I40: 9
A41: =A40+1 -> 38 | B41: Martin Reis | C41: 1017 | D41: 18 | E41: =(C41/D41) -> 56.500 | F41: =ROUNDDOWN(((E41-48)*0.8),0) -> 6 | G41: 54 | H41: 0 | I41: 7.5
A42: =A41+1 -> 39 | B42: Jason Shook | C42: 962 | D42: 17 | E42: =(C42/D42) -> 56.588235294117645 | F42: =ROUNDDOWN(((E42-48)*0.8),0) -> 6 | G42: 56 | H42: 0 | I42: 8
A43: =A42+1 -> 40 | B43: Ryan Eggleston | C43: 1019 | D43: 18 | E43: =(C43/D43) -> 56.611111111111114 | F43: =ROUNDDOWN(((E43-48)*0.8),0) -> 6 | G43: 53 | H43: 1 | I43: 9.5
A44: =A43+1 -> 41 | B44: Matt Wyckoff | C44: 967 | D44: 17 | E44: =(C44/D44) -> 56.882352941176471 | F44: =ROUNDDOWN(((E44-48)*0.8),0) -> 7 | G44: 54 | H44: 0 | I44: 9
A45: =A44+1 -> 42 | B45: Josh McFarland | C45: 1031 | D45: 18 | E45: =(C45/D45) -> 57.277777777777779 | F45: =ROUNDDOWN(((E45-48)*0.8),0) -> 7 | G45: 55 | H45: 1 | I45: 6
A46: =A45+1 -> 43 | B46: Travis Pike | C46: 922 | D46: 16 | E46: =(C46/D46) -> 57.625 | F46: =ROUNDDOWN(((E46-48)*0.8),0) -> 7 | G46: 58 | H46: 0 | I46: 8.5
A47: =A46+1 -> 44 | B47: Tony Rios | C47: 752 | D47: 13 | E47: =(C47/D47) -> 57.846153846153847 | F47: =ROUNDDOWN(((E47-48)*0.8),0) -> 7 | I47: 5
A48: =A47+1 -> 45 | B48: Matt Fritz | C48: 1046 | D48: 18 | E48: =(C48/D48) -> 58.111111111111114 | F48: =ROUNDDOWN(((E48-48)*0.8),0) -> 8 | G48: 61 | H48: 0 | I48: 6
A49: =A48+1 -> 46 | B49: Ben Sandell | C49: 1052 | D49: 18 | E49: =(C49/D49) -> 58.444444444444443 | F49: =ROUNDDOWN(((E49-48)*0.8),0) -> 8 | G49: 56 | H49: 1 | I49: 12.5
A50: =A49+1 -> 47 | B50: Anthony Moody | C50: 938 | D50: 16 | E50: =(C50/D50) -> 58.625 | F50: =ROUNDDOWN(((E50-48)*0.8),0) -> 8 | I50: 6.5
A51: =A50+1 -> 48 | B51: David McCuskey | C51: 1058 | D51: 18 | E51: =(C51/D51) -> 58.777777777777779 | F51: =ROUNDDOWN(((E51-48)*0.8),0) -> 8 | G51: 49 | H51: 1 | I51: 6.5
A52: =A51+1 -> 49 | B52: Tim Troyna | C52: 1000 | D52: 17 | E52: =(C52/D52) -> 58.823529411764703 | F52: =ROUNDDOWN(((E52-48)*0.8),0) -> 8 | G52: 54 | H52: 1 | I52: 8
A53: =A52+1 -> 50 | B53: Matt Shannon | C53: 1062 | D53: 18 | E53: =(C53/D53) -> 59.000 | F53: =ROUNDDOWN(((E53-48)*0.8),0) -> 8 | G53: 56 | H53: 1 | I53: 6
A54: =A53+1 -> 51 | B54: Adam Chittenden | C54: 1077 | D54: 18 | E54: =(C54/D54) -> 59.833333333333336 | F54: =ROUNDDOWN(((E54-48)*0.8),0) -> 9 | G54: 50 | H54: 1 | I54: 9
A55: =A54+1 -> 52 | B55: Erik Smith | C55: 1083 | D55: 18 | E55: =(C55/D55) -> 60.166666666666664 | F55: =ROUNDDOWN(((E55-48)*0.8),0) -> 9 | G55: 61 | H55: 0 | I55: 7.5
A56: 53 | B56: Adam Henderson | C56: 1083 | D56: 18 | E56: =(C56/D56) -> 60.166666666666664 | F56: =ROUNDDOWN(((E56-48)*0.8),0) -> 9 | G56: 57 | H56: 0.5 | I56: 8.5
A57: 54 | B57: Spencer Eubanks | C57: 1089 | D57: 18 | E57: =(C57/D57) -> 60.500 | F57: =ROUNDDOWN(((E57-48)*0.8),0) -> 10 | G57: 59 | H57: 0 | I57: 7
A58: 55 | B58: D Burns | C58: 1094 | D58: 18 | E58: =(C58/D58) -> 60.777777777777779 | F58: =ROUNDDOWN(((E58-48)*0.8),0) -> 10 | G58: 53 | H58: 0 | I58: 4.5
A59: 56 | B59: Tom Pepper | C59: 857 | D59: 14 | E59: =(C59/D59) -> 61.214285714285715 | F59: =ROUNDDOWN(((E59-48)*0.8),0) -> 10 | I59: 8 | J59: 0
A60: 57 | B60: Mitch Lerch | C60: 1106 | D60: 18 | E60: =(C60/D60) -> 61.444444444444443 | F60: =ROUNDDOWN(((E60-48)*0.8),0) -> 10 | G60: 55 | H60: 1 | I60: 12.5
A61: 58 | B61: Shane Thirtyacre | C61: 985 | D61: 16 | E61: =(C61/D61) -> 61.5625 | F61: =ROUNDDOWN(((E61-48)*0.8),0) -> 10 | G61: 60 | H61: 1 | I61: 8.5
A62: 59 | B62: Avg Joe | C62: 1112 | D62: 18 | E62: =(C62/D62) -> 61.777777777777779 | F62: =ROUNDDOWN(((E62-48)*0.8),0) -> 11 | G62: 57 | H62: 1 | I62: 7
A63: 60 | B63: Pat Cutsforth | C63: 1113 | D63: 18 | E63: =(C63/D63) -> 61.833333333333336 | F63: =ROUNDDOWN(((E63-48)*0.8),0) -> 11 | G63: 61 | H63: 1 | I63: 13
A64: 61 | B64: Tony Ebson | C64: 1125 | D64: 18 | E64: =(C64/D64) -> 62.500 | F64: =ROUNDDOWN(((E64-48)*0.8),0) -> 11 | G64: 55 | H64: 1 | I64: 11
A65: 62 | B65: Shawn Hullinger | C65: 1128 | D65: 18 | E65: =(C65/D65) -> 62.666666666666664 | F65: =ROUNDDOWN(((E65-48)*0.8),0) -> 11 | G65: 56 | H65: 1 | I65: 8.5
A66: 63 | B66: Sarah Potter | C66: 1136 | D66: 18 | E66: =(C66/D66) -> 63.111111111111114 | F66: =ROUNDDOWN(((E66-48)*0.8),0) -> 12 | G66: 58 | H66: 1 | I66: 8.5
A67: 64 | B67: Matt Whitlock | C67: 1118 | D67: 17 | E67: =(C67/D67) -> 65.764705882352942 | F67: =ROUNDDOWN(((E67-48)*0.8),0) -> 14 | G67: 61 | H67: 0 | I67: 6
A69: Subs | B69: Player | C69: Total Strokes | D69: Weeks | E69: Average | F69: H-Cap | G69: Last | H69: Week Pt. | I69: Total Pts. | J69: Subed For
A70: 1 | B70: Adam Karstens | C70: 555 | D70: 10 | E70: =SUM(C70/D70) -> 55.500 | F70: =ROUNDDOWN(((E70-48)*0.8),0) -> 6 | G70: 56 | H70: 0 | I70: 3.5 | J70: Moody
A71: 2 | B71: Archie Coulter | C71: 387 | D71: 7 | E71: =SUM(C71/D71) -> 55.285714285714285 | F71: =ROUNDDOWN(((E71-48)*0.8),0) -> 5 | I71: 2.5
A72: 3 | B72: Dan Lewis | C72: 390 | D72: 7 | E72: =SUM(C72/D72) -> 55.714285714285715 | F72: =ROUNDDOWN(((E72-48)*0.8),0) -> 6 | G72: 50 | I72: 1
A73: 2 | B73: Josh Spang | C73: 264 | D73: 5 | E73: =SUM(C73/D73) -> 52.800 | F73: =ROUNDDOWN(((E73-48)*0.8),0) -> 3 | I73: 1.5
A74: 3 | B74: Dustin Snodgress | C74: 314 | D74: 5 | E74: =SUM(C74/D74) -> 62.800 | F74: =ROUNDDOWN(((E74-48)*0.8),0) -> 11
A75: =SUM(A74+1) -> 4 | B75: Jason Sills | C75: 238 | D75: 4 | E75: =SUM(C75/D75) -> 59.500 | F75: =ROUNDDOWN(((E75-48)*0.8),0) -> 9
A76: =SUM(A75+1) -> 5 | B76: Caleb Richer | C76: 180 | D76: 3 | E76: =SUM(C76/D76) -> 60.000 | F76: =ROUNDDOWN(((E76-48)*0.8),0) -> 9
A77: 7 | B77: Tony Hobel | C77: 173 | D77: 3 | E77: 60.000 | F77: =ROUNDDOWN(((E77-48)*0.8),0) -> 9 | G77: 55 | H77: 0 | J77: Henandez
A78: 8 | B78: Kerri Haught | C78: 183 | D78: 3 | E78: =SUM(C78/D78) -> 61.000 | F78: =ROUNDDOWN(((E78-48)*0.8),0) -> 10
A79: 9 | B79: Nic Gordon | C79: 184 | D79: 3 | E79: =SUM(C79/D79) -> 61.333333333333336 | F79: =ROUNDDOWN(((E79-48)*0.8),0) -> 10
A80: 10 | B80: Steve Callaway | C80: 185 | D80: 3 | E80: =SUM(C80/D80) -> 61.666666666666664 | F80: =ROUNDDOWN(((E80-48)*0.8),0) -> 10
A81: 11 | B81: Kevin Stibal | C81: 104 | D81: 2 | E81: =SUM(C81/D81) -> 52.000 | F81: =ROUNDDOWN(((E81-48)*0.8),0) -> 3 | I81: 1
A82: 12 | B82: Jack Gilmore | C82: 115 | D82: 2 | E82: =SUM(C82/D82) -> 57.500 | F82: =ROUNDDOWN(((E82-48)*0.8),0) -> 7
A83: 13 | B83: Johnny Walker | C83: 122 | D83: 2 | E83: =SUM(C83/D83) -> 61.000 | F83: =ROUNDDOWN(((E83-48)*0.8),0) -> 10 | I83: 1
A84: 14 | B84: Matt Snyder | C84: 162 | D84: 2 | E84: =SUM(C84/D84) -> 81.000 | F84: =ROUNDDOWN(((E84-48)*0.8),0) -> 26
A85: 15 | B85: Miguel - Bowling Green | C85: 52 | D85: 1 | E85: =SUM(C85/D85) -> 52.000 | F85: 0 | I85: 1
A86: 16 | B86: Brandon Yancey | C86: 52 | D86: 1 | E86: =SUM(C86/D86) -> 52.000 | F86: 0
A87: 17 | B87: Mike William | C87: 53 | D87: 1 | E87: =SUM(C87/D87) -> 53.000 | F87: 0
A88: 18 | B88: Aaron | C88: 53 | D88: 1 | E88: =SUM(C88/D88) -> 53.000 | F88: 0
A89: 19 | B89: Apollo | C89: 54 | D89: 1 | E89: =SUM(C89/D89) -> 54.000 | F89: 0
A90: 20 | B90: Dave Peyton | C90: 56 | D90: 1 | E90: =SUM(C90/D90) -> 56.000 | F90: 0
A91: 21 | B91: Maker | C91: 56 | D91: 1 | E91: 56.000 | F91: 0 | G91: 56 | H91: 0 | J91: Pepper
A92: 22 | B92: Mike Noth | C92: 57 | D92: 1 | E92: =SUM(C92/D92) -> 57.000 | F92: 0
A93: 23 | B93: Brian Snider | C93: 59 | D93: 1 | E93: =SUM(C93/D93) -> 59.000 | F93: 0
A94: 24 | B94: Jesse Kirk | C94: 60 | D94: 1 | E94: =SUM(C94/D94) -> 60.000 | F94: 0
A95: 25 | C95: 0 | D95: 1 | E95: =SUM(C95/D95) -> 0.000 | F95: =ROUNDDOWN(((E95-50)*0.8),0) -> -40
A96: 26 | C96: 0 | D96: 1 | E96: =SUM(C96/D96) -> 0.000 | F96: =ROUNDDOWN(((E96-50)*0.8),0) -> -40
A97: 27 | C97: 0 | D97: 1 | E97: =SUM(C97/D97) -> 0.000 | F97: =ROUNDDOWN(((E97-50)*0.8),0) -> -40
A98: 28 | C98: 0 | D98: 1 | E98: =SUM(C98/D98) -> 0.000 | F98: =ROUNDDOWN(((E98-50)*0.8),0) -> -40
A99: 29 | C99: 0 | D99: 1 | E99: =SUM(C99/D99) -> 0.000 | F99: =ROUNDDOWN(((E99-50)*0.8),0) -> -40
A100: 30
A101: 31
A102: 25 | B102: Dustin Nohr | C102: 64 | D102: 1 | E102: =SUM(C102/D102) -> 64.000 | F102: 0
A103: 26 | B103: Craig Eastin | C103: 65 | D103: 1 | E103: =SUM(C103/D103) -> 65.000 | F103: 0
A104: 27 | B104: Max Ostby | C104: 66 | D104: 1 | E104: 66.000 | F104: 0
A106: 2013 SBDGL Final Team Standings
B107: TEAM # | C107: Final Standings | E107: Total Points | F107: Team Points | G107: Team Avg
A108: 1 | B108: 27 | C108: Kurt Conrad & Dan Kent | E108: 36 | F108: 14 | G108: =AVERAGE(E11,E15) -> 52.472222222222221
A109: 2 | B109: 22 | C109: Jeremy Farnsworth & Tony Ebson | E109: 35 | F109: 13 | G109: =AVERAGE(E7,E64) -> 56.691176470588232
A110: 3 | B110: 17 | C110: Chuck Yanda & Nate Robbins | E110: 34.5 | F110: 11 | G110: =AVERAGE(E17,E32) -> 54.166666666666664
A111: 4 | B111: 23 | C111: Doug Peyton & Adam Chittenden | E111: 33.5 | F111: 12.5 | G111: =AVERAGE(E5,E54) -> 55.027777777777779
A112: 5 | B112: 6 | C112: Ryan Clark & Ben Sandel | E112: 32.5 | F112: 11 | G112: =AVERAGE(E25,E49) -> 56.555555555555557
A113: 6 | B113: 32 | C113: Dan Kern & Shirtless Bill | E113: 32 | F113: 9.5 | G113: =AVERAGE(E9,E38) -> 53.694444444444443
A114: 7 | B114: 10 | C114: Adam Miller & Mitch Lerch | E114: 31 | F114: 10.5 | G114: =AVERAGE(E19,E60) -> 57.428104575163403
A115: 8 | B115: 30 | C115: Joel Knutson & Travis Fruendt | E115: 31 | F115: 10 | G115: =AVERAGE(E30,E34) -> 55.194444444444443
A116: 9 | B116: 9 | C116: Tim Troyna & Pat Cutsforth | E116: 31 | F116: 10 | G116: =AVERAGE(E52,E63) -> 60.328431372549019
A117: 10 | B117: 29 | C117: Adam Olsen & Matt Shannon | E117: 30.5 | F117: 9 | G117: =AVERAGE(E53,E4) -> 52.888888888888886
A118: 11 | B118: 12 | C118: Ian Jacobs & Andrew Greco | E118: 30 | F118: 10.5 | G118: =AVERAGE(E8,E40) -> 53.666666666666664
A119: 12 | B119: 13 | C119: Matt Whitlock & Greg Dye | E119: 30 | F119: 10.5 | G119: =AVERAGE(E21,E67) -> 60.029411764705884
A120: 13 | B120: 16 | C120: Tim Peyton & Josh Beachy | E120: 30 | F120: 10 | G120: =AVERAGE(E10,E12) -> 52.158496732026144
A121: 14 | B121: 11 | C121: Matt Weiben & Kirby Callanhan | E121: 28.5 | F121: 11 | G121: =AVERAGE(E18,E26) -> 54.055555555555557
A122: 15 | B122: 8 | C122: Jesse Streinz & Bob Hernandez | E122: 28.5 | F122: 9 | G122: =AVERAGE(E23,E31) -> 54.76633986928104
A123: 16 | B123: 26 | C123: Joe French & Matt Wycoff | E123: 28 | F123: 9.5 | G123: =AVERAGE(E20,E44) -> 55.159926470588232
A124: 17 | B124: 21 | C124: Ryan Eggleston & Shane Thirtyacre | E124: 28 | F124: 9 | G124: =AVERAGE(E43,E61) -> 59.086805555555557
A125: 18 | B125: 3 | C125: Erik Smith & KVN | E125: 28 | F125: 8.5 | G125: =AVERAGE(E55,E16) -> 56.611111111111114
A126: 19 | B126: 24 | C126: Ryan Hamilton & Rob Mumma | E126: 27 | F126: 9.5 | G126: =AVERAGE(E35,E36) -> 55.750
A127: 20 | B127: 5 | C127: Average Joe & Chris Clime | E127: 26 | F127: 9 | G127: =AVERAGE(E28,E62) -> 58.271241830065364
A128: 21 | B128: 4 | C128: Marty Reis & Travis Pike | E128: 25.5 | F128: 9.5 | G128: =AVERAGE(E41,E46) -> 57.0625
A129: 22 | B129: 14 | C129: Matt Fritz & Jason Rimrodt | E129: 23.5 | F129: 6.5 | G129: =AVERAGE(E6,E48) -> 54.388888888888886
A130: 23 | B130: 25 | C130: Ryan Wodstrchill & Phil Campos | E130: 23 | F130: 9 | G130: =AVERAGE(E13,E37) -> 54.394444444444446
A131: 24 | B131: 2 | C131: Sarah Potter & Kollin Grimm | E131: 23 | F131: 7 | G131: =AVERAGE(E29,E66) -> 58.972222222222229
A132: 25 | B132: 7 | C132: Doug Johnson & Adam Stiers | E132: 22 | F132: 7.5 | G132: =AVERAGE(E14,E33) -> 54.004901960784316
A133: 26 | B133: 31 | C133: Spencer Eubanks & Shawn Hullinger | E133: 22 | F133: 6.5 | G133: =AVERAGE(E57,E65) -> 61.583333333333329
A134: 27 | B134: 28 | C134: Tim Potter & David McCuskey | E134: 21 | F134: 6.5 | G134: =AVERAGE(E22,E51) -> 56.555555555555557
A135: 28 | B135: 20 | C135: Dustin Utley & Tom Pepper | E135: 20.5 | F135: 7.5 | G135: =AVERAGE(E27,E59) -> 57.989495798319325
A136: 29 | B136: 19 | C136: Drew Detert & Anthony Moody | E136: 20.5 | F136: 6 | G136: =AVERAGE(E24,E50) -> 56.618055555555557
A137: 30 | B137: 18 | C137: Jason Shook & Josh McFarland | E137: 19.5 | F137: 5.5 | G137: =AVERAGE(E42,E45) -> 56.933006535947712
A138: 31 | B138: 1 | C138: D Burns & Adam Henderson | E138: 19 | F138: 6 | G138: =AVERAGE(E56,E58) -> 60.472222222222221
A139: 32 | B139: 15 | C139: Nathan Veeder & Tony Rios | E139: 13.5 | F139: 3.5 | G139: =AVERAGE(E39,E47) -> 57.089743589743591