A1: 2013 S.B.D.G.L. STANDINGS Through Week 15 Legion
A2: Rank | B2: Player | C2: Total Strokes | D2: Weeks | E2: Average | F2: H-Cap | G2: Last | H2: Week Pt. | I2: Total Pts. | J2: Sub Pts.
A4: =A3+1 -> 1 | B4: Adam Olsen | C4: 706 | D4: 15 | E4: =(C4/D4) -> 47.06666666666667 | F4: =ROUNDDOWN(((E4-48)*0.8),0) -> 0 | G4: 46 | H4: 1 | I4: 13
A5: =A4+1 -> 2 | B5: Andrew Greco | C5: 763 | D5: 15 | E5: =(C5/D5) -> 50.866666666666667 | F5: =ROUNDDOWN(((E5-48)*0.8),0) -> 2 | G5: 52 | H5: 1 | I5: 10.5
A6: =A5+1 -> 3 | B6: Jason Rimrodt | C6: 763 | D6: 15 | E6: =(C6/D6) -> 50.866666666666667 | F6: =ROUNDDOWN(((E6-48)*0.8),0) -> 2 | G6: 50 | H6: 0.5 | I6: 9.5
A7: =A6+1 -> 4 | B7: Doug Peyton | C7: 766 | D7: 15 | E7: =(C7/D7) -> 51.06666666666667 | F7: =ROUNDDOWN(((E7-48)*0.8),0) -> 2 | G7: 52 | H7: 0 | I7: 9
A8: =A7+1 -> 5 | B8: Dan Kern | C8: 772 | D8: 15 | E8: =(C8/D8) -> 51.466666666666669 | F8: =ROUNDDOWN(((E8-48)*0.8),0) -> 2 | G8: 50 | H8: 1 | I8: 9
A9: =A8+1 -> 6 | B9: Jeremy Farnsworth | C9: 724 | D9: 14 | E9: =(C9/D9) -> 51.714285714285715 | F9: =ROUNDDOWN(((E9-48)*0.8),0) -> 2 | G9: 53 | H9: 1 | I9: 9.5
A10: =A9+1 -> 7 | B10: Tim Peyton | C10: 777 | D10: 15 | E10: =(C10/D10) -> 51.800 | F10: =ROUNDDOWN(((E10-48)*0.8),0) -> 3 | G10: 50 | H10: 1 | I10: 9
A11: =A10+1 -> 8 | B11: Kurt Conrad | C11: 786 | D11: 15 | E11: =(C11/D11) -> 52.400 | F11: =ROUNDDOWN(((E11-48)*0.8),0) -> 3 | G11: 52 | H11: 0.5 | I11: 7.5
A12: =A11+1 -> 9 | B12: Josh Beachy | C12: 741 | D12: 14 | E12: =(C12/D12) -> 52.928571428571431 | F12: =ROUNDDOWN(((E12-48)*0.8),0) -> 3 | G12: 53 | H12: 0 | I12: 8
A13: =A12+1 -> 10 | B13: Doug Johnson | C13: 798 | D13: 15 | E13: =(C13/D13) -> 53.200 | F13: =ROUNDDOWN(((E13-48)*0.8),0) -> 4 | G13: 52 | H13: 0 | I13: 6.5
A14: =A13+1 -> 11 | B14: Ryan Wodstrchill | C14: 800 | D14: 15 | E14: =(C14/D14) -> 53.333333333333336 | F14: =ROUNDDOWN(((E14-48)*0.8),0) -> 4 | G14: 51 | H14: 1 | I14: 7.5
A15: =A14+1 -> 12 | B15: Matt Wieben | C15: 803 | D15: 15 | E15: =(C15/D15) -> 53.533333333333331 | F15: =ROUNDDOWN(((E15-48)*0.8),0) -> 4 | G15: 58 | H15: 0 | I15: 7
A16: =A15+1 -> 13 | B16: Nate Robbins | C16: 804 | D16: 15 | E16: =(C16/D16) -> 53.600 | F16: =ROUNDDOWN(((E16-48)*0.8),0) -> 4 | G16: 51 | H16: 1 | I16: 9.5
A17: =A16+1 -> 14 | B17: KVN Lavley | C17: 805 | D17: 15 | E17: =(C17/D17) -> 53.666666666666664 | F17: =ROUNDDOWN(((E17-48)*0.8),0) -> 4 | G17: 52 | H17: 1 | I17: 11
A18: =A17+1 -> 15 | B18: Dan Kent | C18: 808 | D18: 15 | E18: =(C18/D18) -> 53.866666666666667 | F18: =ROUNDDOWN(((E18-48)*0.8),0) -> 4 | G18: 54 | H18: 0 | I18: 10.5
A19: =A18+1 -> 16 | B19: Joe French | C19: 704 | D19: 13 | E19: =(C19/D19) -> 54.153846153846153 | F19: =ROUNDDOWN(((E19-48)*0.8),0) -> 4 | G19: 53 | H19: 0 | I19: 7
A20: =A19+1 -> 17 | B20: Adam Miller | C20: 759 | D20: 14 | E20: =(C20/D20) -> 54.214285714285715 | F20: =ROUNDDOWN(((E20-48)*0.8),0) -> 4 | G20: 50 | H20: 1 | I20: 7
A21: =A20+1 -> 18 | B21: Kirby Callahan | C21: 821 | D21: 15 | E21: =(C21/D21) -> 54.733333333333334 | F21: =ROUNDDOWN(((E21-48)*0.8),0) -> 5 | G21: 51 | H21: 1 | I21: 7.5
A22: =A21+1 -> 19 | B22: Dustin Utley | C22: 824 | D22: 15 | E22: =(C22/D22) -> 54.93333333333333 | F22: =ROUNDDOWN(((E22-48)*0.8),0) -> 5 | G22: 52 | H22: 1 | I22: 5
A23: =A22+1 -> 20 | B23: Bob Hernadez | C23: 825 | D23: 15 | E23: =(C23/D23) -> 55.000 | F23: =ROUNDDOWN(((E23-48)*0.8),0) -> 5 | G23: 53 | H23: 0.5 | I23: 10.5
A24: =A23+1 -> 21 | B24: Greg Dye | C24: 771 | D24: 14 | E24: =(C24/D24) -> 55.071428571428569 | F24: =ROUNDDOWN(((E24-48)*0.8),0) -> 5 | G24: 52 | H24: 1 | I24: 10.5
A25: =A24+1 -> 22 | B25: Adam Stiers | C25: 771 | D25: 14 | E25: =(C25/D25) -> 55.071428571428569 | F25: =ROUNDDOWN(((E25-48)*0.8),0) -> 5 | G25: 47 | H25: 1 | I25: 7
A26: =A25+1 -> 23 | B26: Tim Potter | C26: 827 | D26: 15 | E26: =(C26/D26) -> 55.133333333333333 | F26: =ROUNDDOWN(((E26-48)*0.8),0) -> 5 | G26: 61 | H26: 0 | I26: 6
A27: =A26+1 -> 24 | B27: Drew Detert | C27: 827 | D27: 15 | E27: =(C27/D27) -> 55.133333333333333 | F27: =ROUNDDOWN(((E27-48)*0.8),0) -> 5 | G27: 61 | H27: 0 | I27: 6
A28: =A27+1 -> 25 | B28: Kollin Grimm | C28: 827 | D28: 15 | E28: =(C28/D28) -> 55.133333333333333 | F28: =ROUNDDOWN(((E28-48)*0.8),0) -> 5 | G28: 56 | H28: 0 | I28: 6.5
A29: =A28+1 -> 26 | B29: Ryan Clark | C29: 828 | D29: 15 | E29: =(C29/D29) -> 55.200 | F29: =ROUNDDOWN(((E29-48)*0.8),0) -> 5 | G29: 56 | H29: 0 | I29: 8
A30: =A29+1 -> 27 | B30: Chris Clime | C30: 773 | D30: 14 | E30: =(C30/D30) -> 55.214285714285715 | F30: =ROUNDDOWN(((E30-48)*0.8),0) -> 5 | G30: 55 | H30: 1 | I30: 7.5
A31: =A30+1 -> 28 | B31: Jesse Streinz | C31: 829 | D31: 15 | E31: =(C31/D31) -> 55.266666666666666 | F31: =ROUNDDOWN(((E31-48)*0.8),0) -> 5 | G31: 53 | H31: 1 | I31: 6
A32: =A31+1 -> 29 | B32: Chuck Yanda | C32: 829 | D32: 15 | E32: =(C32/D32) -> 55.266666666666666 | F32: =ROUNDDOWN(((E32-48)*0.8),0) -> 5 | G32: 50 | H32: 1 | I32: 13
A33: =A32+1 -> 30 | B33: Travis Fruendt | C33: 832 | D33: 15 | E33: =(C33/D33) -> 55.466666666666669 | F33: =ROUNDDOWN(((E33-48)*0.8),0) -> 5 | G33: 57 | H33: 0 | I33: 12
A34: =A33+1 -> 31 | B34: Rob Mumma | C34: 836 | D34: 15 | E34: =(C34/D34) -> 55.733333333333334 | F34: =ROUNDDOWN(((E34-48)*0.8),0) -> 6 | G34: 55 | H34: 1 | I34: 8.5
A35: =A34+1 -> 32 | B35: Joel Knutson | C35: 838 | D35: 15 | E35: =(C35/D35) -> 55.866666666666667 | F35: =ROUNDDOWN(((E35-48)*0.8),0) -> 6 | G35: 57 | H35: 0 | I35: 7.5
A36: =A35+1 -> 33 | B36: Ryan Hamilton | C36: 840 | D36: 15 | E36: =(C36/D36) -> 56.000 | F36: =ROUNDDOWN(((E36-48)*0.8),0) -> 6 | G36: 53 | H36: 1 | I36: 8
A37: =A36+1 -> 34 | B37: Nate Veeder | C37: 843 | D37: 15 | E37: =(C37/D37) -> 56.200 | F37: =ROUNDDOWN(((E37-48)*0.8),0) -> 6 | G37: 55 | H37: 0 | I37: 4
A38: =A37+1 -> 35 | B38: Shirtless Bill | C38: 847 | D38: 15 | E38: =(C38/D38) -> 56.466666666666669 | F38: =ROUNDDOWN(((E38-48)*0.8),0) -> 6 | G38: 56 | H38: 1 | I38: 8.5
A39: =A38+1 -> 36 | B39: Ian Jacobs | C39: 850 | D39: 15 | E39: =(C39/D39) -> 56.666666666666664 | F39: =ROUNDDOWN(((E39-48)*0.8),0) -> 6 | G39: 61 | H39: 0 | I39: 8
A40: =A39+1 -> 37 | B40: Phil Campos | C40: 737 | D40: 13 | E40: =(C40/D40) -> 56.692307692307693 | F40: =ROUNDDOWN(((E40-48)*0.8),0) -> 6 | G40: 56 | H40: 0 | I40: 3
A41: =A40+1 -> 38 | B41: Jason Shook | C41: 799 | D41: 14 | E41: =(C41/D41) -> 57.071428571428569 | F41: =ROUNDDOWN(((E41-48)*0.8),0) -> 7 | G41: 56 | H41: 0 | I41: 7
A42: =A41+1 -> 39 | B42: Ryan Eggleston | C42: 860 | D42: 15 | E42: =(C42/D42) -> 57.333333333333336 | F42: =ROUNDDOWN(((E42-48)*0.8),0) -> 7 | G42: 59 | H42: 0.5 | I42: 8
A43: =A42+1 -> 40 | B43: Martin Reis | C43: 860 | D43: 15 | E43: =(C43/D43) -> 57.333333333333336 | F43: =ROUNDDOWN(((E43-48)*0.8),0) -> 7 | G43: 56 | H43: 0 | I43: 6.5
A44: =A43+1 -> 41 | B44: Josh McFarland | C44: 863 | D44: 15 | E44: =(C44/D44) -> 57.533333333333331 | F44: =ROUNDDOWN(((E44-48)*0.8),0) -> 7 | G44: 58 | H44: 0 | I44: 4
A45: =A44+1 -> 42 | B45: Matt Wyckoff | C45: 807 | D45: 14 | E45: =(C45/D45) -> 57.642857142857146 | F45: =ROUNDDOWN(((E45-48)*0.8),0) -> 7 | G45: 59 | H45: 0 | I45: 7
A46: =A45+1 -> 43 | B46: Travis Pike | C46: 750 | D46: 13 | E46: =(C46/D46) -> 57.692307692307693 | F46: =ROUNDDOWN(((E46-48)*0.8),0) -> 7 | G46: 56 | H46: 0.5 | I46: 7.5
A47: =A46+1 -> 44 | B47: Tony Rios | C47: 697 | D47: 12 | E47: =(C47/D47) -> 58.083333333333336 | F47: =ROUNDDOWN(((E47-48)*0.8),0) -> 8 | G47: 60 | H47: 0 | I47: 4.5
A48: =A47+1 -> 45 | B48: Matt Fritz | C48: 872 | D48: 15 | E48: =(C48/D48) -> 58.133333333333333 | F48: =ROUNDDOWN(((E48-48)*0.8),0) -> 8 | G48: 61 | H48: 0 | I48: 4
A49: =A48+1 -> 46 | B49: Ben Sandell | C49: 882 | D49: 15 | E49: =(C49/D49) -> 58.800 | F49: =ROUNDDOWN(((E49-48)*0.8),0) -> 8 | G49: 57 | H49: 1 | I49: 9.5
A50: =A49+1 -> 47 | B50: Anthony Moody | C50: 884 | D50: 15 | E50: =(C50/D50) -> 58.93333333333333 | F50: =ROUNDDOWN(((E50-48)*0.8),0) -> 8 | G50: 56 | H50: 1 | I50: 6.5
A51: =A50+1 -> 48 | B51: Matt Shannon | C51: 885 | D51: 15 | E51: =(C51/D51) -> 59.000 | F51: =ROUNDDOWN(((E51-48)*0.8),0) -> 8 | G51: 59 | H51: 0.5 | I51: 5
A52: =A51+1 -> 49 | B52: Tim Troyna | C52: 827 | D52: 14 | E52: =(C52/D52) -> 59.071428571428569 | F52: =ROUNDDOWN(((E52-48)*0.8),0) -> 8 | G52: 58 | H52: 0 | I52: 6
A53: =A52+1 -> 50 | B53: David McCuskey | C53: 900 | D53: 15 | E53: =(C53/D53) -> 60.000 | F53: =ROUNDDOWN(((E53-48)*0.8),0) -> 9 | G53: 53 | H53: 0 | I53: 4.5
A54: =A53+1 -> 51 | B54: Adam Henderson | C54: 903 | D54: 15 | E54: =(C54/D54) -> 60.200 | F54: =ROUNDDOWN(((E54-48)*0.8),0) -> 9 | G54: 55 | H54: 1 | I54: 7
A55: =A54+1 -> 52 | B55: Erik Smith | C55: 906 | D55: 15 | E55: =(C55/D55) -> 60.400 | F55: =ROUNDDOWN(((E55-48)*0.8),0) -> 9 | G55: 64 | H55: 0 | I55: 6.5
A56: 53 | B56: Adam Chittenden | C56: 910 | D56: 15 | E56: =(C56/D56) -> 60.666666666666664 | F56: =ROUNDDOWN(((E56-48)*0.8),0) -> 10 | G56: 61 | H56: 0.5 | I56: 7.5
A57: 54 | B57: Spencer Eubanks | C57: 916 | D57: 15 | E57: =(C57/D57) -> 61.06666666666667 | F57: =ROUNDDOWN(((E57-48)*0.8),0) -> 10 | G57: 59 | H57: 0 | I57: 5
A58: 55 | B58: Tom Pepper | C58: 800 | D58: 13 | E58: =(C58/D58) -> 61.53846153846154 | F58: =ROUNDDOWN(((E58-48)*0.8),0) -> 10 | G58: 61 | H58: 1 | I58: 7
A59: 56 | B59: D Burns | C59: 924 | D59: 15 | E59: =(C59/D59) -> 61.600 | F59: =ROUNDDOWN(((E59-48)*0.8),0) -> 10 | G59: 59 | H59: 1 | I59: 4
A60: 57 | B60: Shane Thirtyacre | C60: 803 | D60: 13 | E60: =(C60/D60) -> 61.769230769230766 | F60: =ROUNDDOWN(((E60-48)*0.8),0) -> 11 | G60: 59 | H60: 1 | I60: 7.5
A61: 58 | B61: Pat Cutsforth | C61: 930 | D61: 15 | E61: =(C61/D61) -> 62.000 | F61: =ROUNDDOWN(((E61-48)*0.8),0) -> 11 | G61: 62 | H61: 1 | I61: 10
A62: 59 | B62: Mitch Lerch | C62: 930 | D62: 15 | E62: =(C62/D62) -> 62.000 | F62: =ROUNDDOWN(((E62-48)*0.8),0) -> 11 | G62: 60 | H62: 0.5 | I62: 10.5
A63: 60 | B63: Avg Joe | C63: 934 | D63: 15 | E63: =(C63/D63) -> 62.266666666666666 | F63: =ROUNDDOWN(((E63-48)*0.8),0) -> 11 | G63: 65 | H63: 0 | I63: 5
A64: 61 | B64: Sarah Potter | C64: 952 | D64: 15 | E64: =(C64/D64) -> 63.466666666666669 | F64: =ROUNDDOWN(((E64-48)*0.8),0) -> 12 | G64: 61 | H64: 1 | I64: 6.5
A65: 62 | B65: Tony Ebson | C65: 955 | D65: 15 | E65: =(C65/D65) -> 63.666666666666664 | F65: =ROUNDDOWN(((E65-48)*0.8),0) -> 12 | G65: 63 | H65: 1 | I65: 8
A66: 63 | B66: Shawn Hullinger | C66: 958 | D66: 15 | E66: =(C66/D66) -> 63.866666666666667 | F66: =ROUNDDOWN(((E66-48)*0.8),0) -> 12 | G66: 59 | H66: 0 | I66: 5.5
A67: 64 | B67: Matt Whitlock | C67: 926 | D67: 14 | E67: =(C67/D67) -> 66.142857142857139 | F67: =ROUNDDOWN(((E67-48)*0.8),0) -> 14 | G67: 64 | H67: 0 | I67: 6
A69: Subs | B69: Player | C69: Total Strokes | D69: Weeks | E69: Average | F69: H-Cap | G69: Last | H69: Week Pt. | I69: Total Pts. | J69: Subed For
A70: 1 | B70: Adam Karstens | C70: 444 | D70: 8 | E70: =SUM(C70/D70) -> 55.500 | F70: =ROUNDDOWN(((E70-48)*0.8),0) -> 6 | G70: 54 | I70: 3.5
A71: 2 | B71: Archie Coulter | C71: 338 | D71: 6 | E71: =SUM(C71/D71) -> 56.333333333333336 | F71: =ROUNDDOWN(((E71-48)*0.8),0) -> 6 | I71: 1.5
A72: 3 | B72: Josh Spang | C72: 264 | D72: 5 | E72: =SUM(C72/D72) -> 52.800 | F72: =ROUNDDOWN(((E72-48)*0.8),0) -> 3 | I72: 1.5
A73: 2 | B73: Dan Lewis | C73: 289 | D73: 5 | E73: =SUM(C73/D73) -> 57.800 | F73: =ROUNDDOWN(((E73-48)*0.8),0) -> 7 | G73: 61 | I73: 1
A74: 3 | B74: Dustin Snodgress | C74: 314 | D74: 5 | E74: =SUM(C74/D74) -> 62.800 | F74: =ROUNDDOWN(((E74-48)*0.8),0) -> 11
A75: =SUM(A74+1) -> 4 | B75: Kevin Stibal | C75: 104 | D75: 2 | E75: =SUM(C75/D75) -> 52.000 | F75: =ROUNDDOWN(((E75-48)*0.8),0) -> 3 | I75: 1
A76: =SUM(A75+1) -> 5 | B76: Nic Gordon | C76: 116 | D76: 2 | E76: =SUM(C76/D76) -> 58.000 | F76: =ROUNDDOWN(((E76-48)*0.8),0) -> 8
A77: 7 | B77: Sills | C77: 119 | D77: 2 | E77: =SUM(C77/D77) -> 59.500 | F77: =ROUNDDOWN(((E77-48)*0.8),0) -> 9
A78: 8 | B78: Johnny Walker | C78: 122 | D78: 2 | E78: =SUM(C78/D78) -> 61.000 | F78: =ROUNDDOWN(((E78-48)*0.8),0) -> 10 | I78: 1
A79: 9 | B79: Kerri Haught | C79: 124 | D79: 2 | E79: =SUM(C79/D79) -> 62.000 | F79: =ROUNDDOWN(((E79-48)*0.8),0) -> 11
A80: 10 | B80: Steve Callaway | C80: 125 | D80: 2 | E80: =SUM(C80/D80) -> 62.500 | F80: =ROUNDDOWN(((E80-48)*0.8),0) -> 11
A81: 11 | B81: Matt Snyder | C81: 162 | D81: 2 | E81: =SUM(C81/D81) -> 81.000 | F81: =ROUNDDOWN(((E81-48)*0.8),0) -> 26
A82: 12 | B82: Miguel - Bowling Green | C82: 52 | D82: 1 | E82: =SUM(C82/D82) -> 52.000 | F82: 0 | I82: 1
A83: 13 | B83: Brandon Yancey | C83: 52 | D83: 1 | E83: =SUM(C83/D83) -> 52.000 | F83: 0
A84: 14 | B84: Mike William | C84: 53 | D84: 1 | E84: =SUM(C84/D84) -> 53.000 | F84: 0
A85: 15 | B85: Aaron | C85: 53 | D85: 1 | E85: =SUM(C85/D85) -> 53.000 | F85: 0
A86: 16 | B86: Caleb | C86: 54 | D86: 1 | E86: =SUM(C86/D86) -> 54.000 | F86: 0
A87: 17 | B87: Apollo | C87: 54 | D87: 1 | E87: =SUM(C87/D87) -> 54.000 | F87: 0
A88: 18 | B88: Dave Peyton | C88: 56 | D88: 1 | E88: =SUM(C88/D88) -> 56.000 | F88: 0
A89: 19 | B89: Mike Noth | C89: 57 | D89: 1 | E89: =SUM(C89/D89) -> 57.000 | F89: 0
A90: 20 | B90: Brian Snider | C90: 59 | D90: 1 | E90: =SUM(C90/D90) -> 59.000 | F90: 0
A91: 21 | B91: Jack Gilmore | C91: 59 | D91: 1 | E91: =SUM(C91/D91) -> 59.000 | F91: 0
A92: 22 | B92: Jesse Kirk | C92: 60 | D92: 1 | E92: =SUM(C92/D92) -> 60.000 | F92: 0
A93: 23 | B93: Dustin Nohr | C93: 64 | D93: 1 | E93: =SUM(C93/D93) -> 64.000 | F93: 0
A94: 24 | B94: Craig Eastin | C94: 65 | D94: 1 | E94: =SUM(C94/D94) -> 65.000 | F94: 0
A95: 25 | C95: 0 | D95: 1 | E95: =SUM(C95/D95) -> 0.000 | F95: =ROUNDDOWN(((E95-50)*0.8),0) -> -40
A96: 26 | C96: 0 | D96: 1 | E96: =SUM(C96/D96) -> 0.000 | F96: =ROUNDDOWN(((E96-50)*0.8),0) -> -40
A97: 27 | C97: 0 | D97: 1 | E97: =SUM(C97/D97) -> 0.000 | F97: =ROUNDDOWN(((E97-50)*0.8),0) -> -40
A98: 28 | C98: 0 | D98: 1 | E98: =SUM(C98/D98) -> 0.000 | F98: =ROUNDDOWN(((E98-50)*0.8),0) -> -40
A99: 29 | C99: 0 | D99: 1 | E99: =SUM(C99/D99) -> 0.000 | F99: =ROUNDDOWN(((E99-50)*0.8),0) -> -40
A100: 30
A101: 31
A102: 25 | B102: Max Ostby | C102: 66 | D102: 1 | E102: 66.000 | F102: 0
A104: 2013 SBDGL Team Standings
B105: TEAM # | C105: BUSH | E105: Total Points | F105: Team Points | G105: Team Avg
A106: 1 | B106: 12 | C106: Ian Jacobs & Andrew Greco | E106: 28 | F106: 9.5 | G106: =AVERAGE(E5,E36) -> 53.433333333333337
A107: 2 | B107: 6 | C107: Ryan Clark & Ben Sandel | E107: 26.5 | F107: 9 | G107: =AVERAGE(E29,E49) -> 57.000
A108: 3 | B108: 16 | C108: Tim Peyton & Josh Beachy | E108: 26 | F108: 9 | G108: =AVERAGE(E10,E12) -> 52.364285714285714
A109: 4 | B109: 10 | C109: Adam Miller & Mitch Lerch | E109: 26 | F109: 8.5 | G109: =AVERAGE(E20,E62) -> 58.107142857142861
A110: 5 | B110: 13 | C110: Matt Whitlock & Greg Dye | E110: 25 | F110: 8.5 | G110: =AVERAGE(E24,E67) -> 60.607142857142854
A111: 6 | B111: 3 | C111: Erik Smith & KVN | E111: 25 | F111: 7.5 | G111: =AVERAGE(E55,E17) -> 57.033333333333331
A112: 7 | B112: 11 | C112: Matt Weiben & Kirby Callanhan | E112: 24.5 | F112: 10 | G112: =AVERAGE(E15,E21) -> 54.133333333333333
A113: 8 | B113: 9 | C113: Tim Troyna & Pat Cutsforth | E113: 24 | F113: 8 | G113: =AVERAGE(E52,E61) -> 60.535714285714285
A114: 9 | B114: 8 | C114: Jesse Streinz & Bob Hernandez | E114: 23.5 | F114: 7 | G114: =AVERAGE(E23,E31) -> 55.133333333333333
A115: 10 | B115: 4 | C115: Marty Reis & Travis Pike | E115: 22.5 | F115: 8.5 | G115: =AVERAGE(E43,E46) -> 57.512820512820511
A116: 11 | B116: 7 | C116: Doug Johnson & Adam Stiers | E116: 21 | F116: 7.5 | G116: =AVERAGE(E13,E25) -> 54.135714285714286
A117: 12 | B117: 14 | C117: Matt Fritz & Jason Rimrodt | E117: 19 | F117: 5.5 | G117: =AVERAGE(E6,E48) -> 54.500
A118: 13 | B118: 5 | C118: Average Joe & Chris Clime | E118: 18.5 | F118: 6 | G118: =AVERAGE(E30,E63) -> 58.740476190476187
A119: 14 | B119: 2 | C119: Sarah Potter & Kollin Grimm | E119: 18 | F119: 5 | G119: =AVERAGE(E28,E64) -> 59.300
A120: 15 | B120: 1 | C120: D Burns & Adam Henderson | E120: 16 | F120: 5 | G120: =AVERAGE(E54,E59) -> 60.900
A121: 16 | B121: 15 | C121: Nathan Veeder & Tony Rios | E121: 12 | F121: 3.5 | G121: =AVERAGE(E36,E47) -> 57.041666666666671
B123: TEAM # | C123: WHACKER
A124: 1 | B124: 17 | C124: Chuck Yanda & Nate Robbins | E124: 32.5 | F124: 11 | G124: =AVERAGE(E16,E32) -> 54.433333333333337
A125: 2 | B125: 30 | C125: Joel Knutson & Travis Fruendt | E125: 29.5 | F125: 10 | G125: =AVERAGE(E33,E35) -> 55.666666666666671
A126: 3 | B126: 27 | C126: Kurt Conrad & Dan Kent | E126: 29 | F126: 11 | G126: =AVERAGE(E11,E18) -> 53.133333333333333
A127: 4 | B127: 22 | C127: Jeremy Farnsworth & Tony Ebson | E127: 27.5 | F127: 10 | G127: =AVERAGE(E9,E65) -> 57.69047619047619
A128: 5 | B128: 23 | C128: Doug Peyton & Adam Chittenden | E128: 26 | F128: 9.5 | G128: =AVERAGE(E7,E56) -> 55.866666666666667
A129: 6 | B129: 29 | C129: Adam Olsen & Matt Shannon | E129: 26 | F129: 8 | G129: =AVERAGE(E51,E4) -> 53.033333333333331
A130: 7 | B130: 24 | C130: Ryan Hamilton & Rob Mumma | E130: 25 | F130: 8.5 | G130: =AVERAGE(E34,E36) -> 55.866666666666667
A131: 8 | B131: 32 | C131: Dan Kern & Shirtless Bill | E131: 25 | F131: 7.5 | G131: =AVERAGE(E8,E38) -> 53.966666666666669
A132: 9 | B132: 21 | C132: Ryan Eggleston & Shane Thirtyacre | E132: 24.5 | F132: 8 | G132: =AVERAGE(E42,E60) -> 59.551282051282051
A133: 10 | B133: 26 | C133: Joe French & Matt Wycoff | E133: 21.5 | F133: 7.5 | G133: =AVERAGE(E19,E45) -> 55.89835164835165
A134: 11 | B134: 20 | C134: Dustin Utley & Tom Pepper | E134: 18.5 | F134: 6.5 | G134: =AVERAGE(E22,E58) -> 58.235897435897435
A135: 12 | B135: 19 | C135: Drew Detert & Anthony Moody | E135: 18.5 | F135: 6 | G135: =AVERAGE(E27,E50) -> 57.033333333333331
A136: 13 | B136: 25 | C136: Ryan Wodstrchill & Phil Campos | E136: 17.5 | F136: 7 | G136: =AVERAGE(E14,E40) -> 55.012820512820511
A137: 14 | B137: 28 | C137: Tim Potter & David McCuskey | E137: 15 | F137: 4.5 | G137: =AVERAGE(E26,E53) -> 57.566666666666663
A138: 15 | B138: 18 | C138: Jason Shook & Josh McFarland | E138: 14.5 | F138: 3.5 | G138: =AVERAGE(E41,E44) -> 57.30238095238095
A139: 16 | B139: 31 | C139: Spencer Eubanks & Shawn Hullinger | E139: 14 | F139: 3.5 | G139: =AVERAGE(E57,E66) -> 62.466666666666669