A1: 2013 S.B.D.G.L. STANDINGS Through Week 10 Sugar
A2: Rank | B2: Player | C2: Total Strokes | D2: Weeks | E2: Average | F2: H-Cap | G2: Last | H2: Week Pt. | I2: Total Pts. | J2: Week Sub Pts.
A4: =A3+1 -> 1 | B4: Adam Olsen | C4: 477 | D4: 10 | E4: =(C4/D4) -> 47.700 | F4: =ROUNDDOWN(((E4-48)*0.8),0) -> 0 | G4: 45 | H4: 1 | I4: 9
A5: =A4+1 -> 2 | B5: Doug Peyton | C5: 513 | D5: 10 | E5: =(C5/D5) -> 51.300 | F5: =ROUNDDOWN(((E5-48)*0.8),0) -> 2 | G5: 52 | H5: 0 | I5: 8
A6: =A5+1 -> 3 | B6: Jason Rimrodt | C6: 514 | D6: 10 | E6: =(C6/D6) -> 51.400 | F6: =ROUNDDOWN(((E6-48)*0.8),0) -> 2 | G6: 53 | H6: 1 | I6: 8.5
A7: =A6+1 -> 4 | B7: Andrew Greco | C7: 515 | D7: 10 | E7: =(C7/D7) -> 51.500 | F7: =ROUNDDOWN(((E7-48)*0.8),0) -> 2 | G7: 53 | H7: 0 | I7: 6.5
A8: =A7+1 -> 5 | B8: Dan Kern | C8: 522 | D8: 10 | E8: =(C8/D8) -> 52.200 | F8: =ROUNDDOWN(((E8-48)*0.8),0) -> 3 | G8: 50 | H8: 1 | I8: 5.5
A9: =A8+1 -> 6 | B9: Tim Peyton | C9: 527 | D9: 10 | E9: =(C9/D9) -> 52.700 | F9: =ROUNDDOWN(((E9-48)*0.8),0) -> 3 | G9: 56 | H9: 0 | I9: 6
A10: =A9+1 -> 7 | B10: Jeremy Farnsworth | C10: 480 | D10: 9 | E10: =(C10/D10) -> 53.333333333333336 | F10: =ROUNDDOWN(((E10-48)*0.8),0) -> 4 | G10: 49 | H10: 1 | I10: 5.5
A11: =A10+1 -> 8 | B11: Kurt Conrad | C11: 534 | D11: 10 | E11: =(C11/D11) -> 53.400 | F11: =ROUNDDOWN(((E11-48)*0.8),0) -> 4 | G11: 54 | H11: 0 | I11: 5
A12: =A11+1 -> 9 | B12: Doug Johnson | C12: 537 | D12: 10 | E12: =(C12/D12) -> 53.700 | F12: =ROUNDDOWN(((E12-48)*0.8),0) -> 4 | G12: 53 | H12: 1 | I12: 5.5
A13: =A12+1 -> 10 | B13: Matt Wieben | C13: 543 | D13: 10 | E13: =(C13/D13) -> 54.300 | F13: =ROUNDDOWN(((E13-48)*0.8),0) -> 5 | G13: 54 | H13: 1 | I13: 4
A14: =A13+1 -> 11 | B14: Josh Beachy | C14: 489 | D14: 9 | E14: =(C14/D14) -> 54.333333333333336 | F14: =ROUNDDOWN(((E14-48)*0.8),0) -> 5 | G14: 50 | H14: 1 | I14: 5.5
A15: =A14+1 -> 12 | B15: Ryan Wodstrchill | C15: 544 | D15: 10 | E15: =(C15/D15) -> 54.400 | F15: =ROUNDDOWN(((E15-48)*0.8),0) -> 5 | G15: 56 | H15: 0 | I15: 3.5
A16: =A15+1 -> 13 | B16: Nate Robins | C16: 547 | D16: 10 | E16: =(C16/D16) -> 54.700 | F16: =ROUNDDOWN(((E16-48)*0.8),0) -> 5 | G16: 53 | H16: 1 | I16: 5.5
A17: =A16+1 -> 14 | B17: Joe French | C17: 548 | D17: 10 | E17: =(C17/D17) -> 54.800 | F17: =ROUNDDOWN(((E17-48)*0.8),0) -> 5 | G17: 54 | H17: 0 | I17: 5
A18: =A17+1 -> 15 | B18: Dan Kent | C18: 549 | D18: 10 | E18: =(C18/D18) -> 54.900 | F18: =ROUNDDOWN(((E18-48)*0.8),0) -> 5 | G18: 49 | H18: 1 | I18: 7.5
A19: =A18+1 -> 16 | B19: KVN Lavley | C19: 551 | D19: 10 | E19: =(C19/D19) -> 55.100 | F19: =ROUNDDOWN(((E19-48)*0.8),0) -> 5 | G19: 53 | H19: 1 | I19: 6.5
A20: =A19+1 -> 17 | B20: Dustin Utley | C20: 551 | D20: 10 | E20: =(C20/D20) -> 55.100 | F20: =ROUNDDOWN(((E20-48)*0.8),0) -> 5 | G20: 52 | H20: 0 | I20: 3
A21: =A20+1 -> 18 | B21: Tim Potter | C21: 554 | D21: 10 | E21: =(C21/D21) -> 55.400 | F21: =ROUNDDOWN(((E21-48)*0.8),0) -> 5 | G21: 51 | H21: 1 | I21: 4
A22: =A21+1 -> 19 | B22: Drew Detert | C22: 556 | D22: 10 | E22: =(C22/D22) -> 55.600 | F22: =ROUNDDOWN(((E22-48)*0.8),0) -> 6 | G22: 56 | H22: 0 | I22: 4.5
A23: =A22+1 -> 20 | B23: Joel Knutson | C23: 558 | D23: 10 | E23: =(C23/D23) -> 55.800 | F23: =ROUNDDOWN(((E23-48)*0.8),0) -> 6 | G23: 57 | H23: 0 | I23: 6.5
A24: =A23+1 -> 21 | B24: Adam Miller | C24: 503 | D24: 9 | E24: =(C24/D24) -> 55.888888888888886 | F24: =ROUNDDOWN(((E24-48)*0.8),0) -> 6 | G24: 57 | H24: 0.5 | I24: 3
A25: =A24+1 -> 22 | B25: Rob Mumma | C25: 560 | D25: 10 | E25: =(C25/D25) -> 56.000 | F25: =ROUNDDOWN(((E25-48)*0.8),0) -> 6 | G25: 57 | H25: 1 | I25: 6.5
A26: =A25+1 -> 23 | B26: Ryan Clark | C26: 561 | D26: 10 | E26: =(C26/D26) -> 56.100 | F26: =ROUNDDOWN(((E26-48)*0.8),0) -> 6 | G26: 53 | H26: 1 | I26: 7
A27: =A26+1 -> 24 | B27: Kollin Grimm | C27: 561 | D27: 10 | E27: =(C27/D27) -> 56.100 | F27: =ROUNDDOWN(((E27-48)*0.8),0) -> 6 | G27: 57 | H27: 0 | I27: 4.5
A28: =A27+1 -> 25 | B28: Jesse Streinz | C28: 561 | D28: 10 | E28: =(C28/D28) -> 56.100 | F28: =ROUNDDOWN(((E28-48)*0.8),0) -> 6 | G28: 52 | H28: 1 | I28: 4
A29: =A28+1 -> 26 | B29: Greg Dye | C29: 505 | D29: 9 | E29: =(C29/D29) -> 56.111111111111114 | F29: =ROUNDDOWN(((E29-48)*0.8),0) -> 6 | G29: 54 | H29: 1 | I29: 7.5
A30: =A29+1 -> 27 | B30: Bob Hernadez | C30: 562 | D30: 10 | E30: =(C30/D30) -> 56.200 | F30: =ROUNDDOWN(((E30-48)*0.8),0) -> 6 | G30: 58 | H30: 0 | I30: 7
A31: =A30+1 -> 28 | B31: Adam Stiers | C31: 563 | D31: 10 | E31: =(C31/D31) -> 56.300 | F31: =ROUNDDOWN(((E31-48)*0.8),0) -> 6 | G31: 62 | H31: 0 | I31: 5
A32: =A31+1 -> 29 | B32: Chris Clime | C32: 507 | D32: 9 | E32: =(C32/D32) -> 56.333333333333336 | F32: =ROUNDDOWN(((E32-48)*0.8),0) -> 6 | H32: 0 | I32: 4
A33: =A32+1 -> 30 | B33: Kirby Callahan | C33: 564 | D33: 10 | E33: =(C33/D33) -> 56.400 | F33: =ROUNDDOWN(((E33-48)*0.8),0) -> 6 | G33: 58 | H33: 1 | I33: 4.5
A34: =A33+1 -> 31 | B34: Shirtless Bill | C34: 567 | D34: 10 | E34: =(C34/D34) -> 56.700 | F34: =ROUNDDOWN(((E34-48)*0.8),0) -> 6 | G34: 55 | H34: 1 | I34: 6.5
A35: =A34+1 -> 32 | B35: Ryan Hamilton | C35: 569 | D35: 10 | E35: =(C35/D35) -> 56.900 | F35: =ROUNDDOWN(((E35-48)*0.8),0) -> 7 | G35: 55 | H35: 1 | I35: 6
A36: =A35+1 -> 33 | B36: Nate Veeder | C36: 570 | D36: 10 | E36: =(C36/D36) -> 57.000 | F36: =ROUNDDOWN(((E36-48)*0.8),0) -> 7 | G36: 60 | H36: 0 | I36: 3
A37: =A36+1 -> 34 | B37: Travis Fruendt | C37: 571 | D37: 10 | E37: =(C37/D37) -> 57.100 | F37: =ROUNDDOWN(((E37-48)*0.8),0) -> 7 | G37: 57 | H37: 1 | I37: 9
A38: =A37+1 -> 35 | B38: Phil Campos | C38: 457 | D38: 8 | E38: =(C38/D38) -> 57.125 | F38: =ROUNDDOWN(((E38-48)*0.8),0) -> 7 | G38: 57 | H38: 0 | I38: 2
A39: =A38+1 -> 36 | B39: Chuck Yanda | C39: 574 | D39: 10 | E39: =(C39/D39) -> 57.400 | F39: =ROUNDDOWN(((E39-48)*0.8),0) -> 7 | G39: 54 | H39: 1 | I39: 8
A40: =A39+1 -> 37 | B40: Travis Pike | C40: 580 | D40: 10 | E40: =(C40/D40) -> 58.000 | F40: =ROUNDDOWN(((E40-48)*0.8),0) -> 8 | G40: 57 | H40: 0 | I40: 4
A41: =A40+1 -> 38 | B41: Jason Shook | C41: 523 | D41: 9 | E41: =(C41/D41) -> 58.111111111111114 | F41: =ROUNDDOWN(((E41-48)*0.8),0) -> 8 | G41: 56 | H41: 1 | I41: 5
A42: =A41+1 -> 39 | B42: Ian Jacobs | C42: 582 | D42: 10 | E42: =(C42/D42) -> 58.200 | F42: =ROUNDDOWN(((E42-48)*0.8),0) -> 8 | G42: 56 | H42: 1 | I42: 5
A43: =A42+1 -> 40 | B43: Ryan Eggleston | C43: 583 | D43: 10 | E43: =(C43/D43) -> 58.300 | F43: =ROUNDDOWN(((E43-48)*0.8),0) -> 8 | G43: 55 | H43: 1 | I43: 6
A44: =A43+1 -> 41 | B44: Matt Wyckoff | C44: 526 | D44: 9 | E44: =(C44/D44) -> 58.444444444444443 | F44: =ROUNDDOWN(((E44-48)*0.8),0) -> 8 | G44: 61 | H44: 0 | I44: 4
A45: =A44+1 -> 42 | B45: Martin Reis | C45: 585 | D45: 10 | E45: =(C45/D45) -> 58.500 | F45: =ROUNDDOWN(((E45-48)*0.8),0) -> 8 | G45: 61 | H45: 0 | I45: 4.5
A46: =A45+1 -> 43 | B46: Matt Fritz | C46: 586 | D46: 10 | E46: =(C46/D46) -> 58.600 | F46: =ROUNDDOWN(((E46-48)*0.8),0) -> 8 | G46: 57 | H46: 1 | I46: 3
A47: =A46+1 -> 44 | B47: Tony Rios | C47: 528 | D47: 9 | E47: =(C47/D47) -> 58.666666666666664 | F47: =ROUNDDOWN(((E47-48)*0.8),0) -> 8 | G47: 57 | H47: 0.5 | I47: 3.5
A48: =A47+1 -> 45 | B48: Matt Shannon | C48: 588 | D48: 10 | E48: =(C48/D48) -> 58.800 | F48: =ROUNDDOWN(((E48-48)*0.8),0) -> 8 | G48: 60 | H48: 0.5 | I48: 4.5
A49: =A48+1 -> 46 | B49: Josh McFarland | C49: 589 | D49: 10 | E49: =(C49/D49) -> 58.900 | F49: =ROUNDDOWN(((E49-48)*0.8),0) -> 8 | G49: 59 | H49: 0 | I49: 1
A50: =A49+1 -> 47 | B50: Ben Sandell | C50: 599 | D50: 10 | E50: =(C50/D50) -> 59.900 | F50: =ROUNDDOWN(((E50-48)*0.8),0) -> 9 | G50: 58 | H50: 0.5 | I50: 7.5
A51: =A50+1 -> 48 | B51: David McCuskey | C51: 601 | D51: 10 | E51: =(C51/D51) -> 60.100 | F51: =ROUNDDOWN(((E51-48)*0.8),0) -> 9 | G51: 62 | H51: 0 | I51: 3.5
A52: =A51+1 -> 49 | B52: Anthony Moody | C52: 603 | D52: 10 | E52: =(C52/D52) -> 60.300 | F52: =ROUNDDOWN(((E52-48)*0.8),0) -> 9 | G52: 57 | H52: 1 | I52: 3.5
A53: =A52+1 -> 50 | B53: Tim Troyna | C53: 545 | D53: 9 | E53: =(C53/D53) -> 60.555555555555557 | F53: =ROUNDDOWN(((E53-48)*0.8),0) -> 10 | I53: 4 | J53: 1
A54: =A53+1 -> 51 | B54: Adam Henderson | C54: 615 | D54: 10 | E54: =(C54/D54) -> 61.500 | F54: =ROUNDDOWN(((E54-48)*0.8),0) -> 10 | G54: 61 | H54: 0.5 | I54: 4
A55: =A54+1 -> 52 | B55: Erik Smith | C55: 616 | D55: 10 | E55: =(C55/D55) -> 61.600 | F55: =ROUNDDOWN(((E55-48)*0.8),0) -> 10 | G55: 65 | H55: 0 | I55: 3
A56: 53 | B56: Adam Chittenden | C56: 618 | D56: 10 | E56: =(C56/D56) -> 61.800 | F56: =ROUNDDOWN(((E56-48)*0.8),0) -> 11 | G56: 63 | H56: 0 | I56: 5
A57: 54 | B57: Shane Thirtyacre | C57: 621 | D57: 10 | E57: =(C57/D57) -> 62.100 | F57: =ROUNDDOWN(((E57-48)*0.8),0) -> 11 | G57: 65 | H57: 0 | I57: 4
A58: 55 | B58: Spencer Eubanks | C58: 621 | D58: 10 | E58: =(C58/D58) -> 62.100 | F58: =ROUNDDOWN(((E58-48)*0.8),0) -> 11 | G58: 58 | H58: 0 | I58: 2.5
A59: 56 | B59: Tom Pepper | C59: 499 | D59: 8 | E59: =(C59/D59) -> 62.375 | F59: =ROUNDDOWN(((E59-48)*0.8),0) -> 11 | G59: 63 | H59: 0.5 | I59: 4
A60: 57 | B60: Pat Cutsforth | C60: 626 | D60: 10 | E60: =(C60/D60) -> 62.600 | F60: =ROUNDDOWN(((E60-48)*0.8),0) -> 11 | G60: 63 | H60: 0 | I60: 7.5
A61: 58 | B61: D Burns | C61: 630 | D61: 10 | E61: =(C61/D61) -> 63.000 | F61: =ROUNDDOWN(((E61-48)*0.8),0) -> 12 | G61: 68 | H61: 0 | I61: 3
A62: 59 | B62: Mitch Lerch | C62: 634 | D62: 10 | E62: =(C62/D62) -> 63.400 | F62: =ROUNDDOWN(((E62-48)*0.8),0) -> 12 | G62: 64 | H62: 1 | I62: 6
A63: 60 | B63: Avg Joe | C63: 634 | D63: 10 | E63: =(C63/D63) -> 63.400 | F63: =ROUNDDOWN(((E63-48)*0.8),0) -> 12 | G63: 62 | H63: 0 | I63: 2
A64: 61 | B64: Sarah Potter | C64: 642 | D64: 10 | E64: =(C64/D64) -> 64.200 | F64: =ROUNDDOWN(((E64-48)*0.8),0) -> 12 | G64: 69 | H64: 0 | I64: 3.5
A65: 62 | B65: Shawn Hullinger | C65: 644 | D65: 10 | E65: =(C65/D65) -> 64.400 | F65: =ROUNDDOWN(((E65-48)*0.8),0) -> 13 | G65: 65 | H65: 0.5 | I65: 4.5
A66: 63 | B66: Tony Ebson | C66: 653 | D66: 10 | E66: =(C66/D66) -> 65.300 | F66: =ROUNDDOWN(((E66-48)*0.8),0) -> 13 | G66: 65 | H66: 0.5 | I66: 4.5
A67: 64 | B67: Matt Whitlock | C67: 666 | D67: 10 | E67: =(C67/D67) -> 66.600 | F67: =ROUNDDOWN(((E67-48)*0.8),0) -> 14 | G67: 65 | H67: 1 | I67: 5
A69: Subs | B69: Player | C69: Total Strokes | D69: Weeks | E69: Average | F69: H-Cap | G69: Last | H69: Week Pt. | I69: Total Pts. | J69: Subed For
A70: 1 | B70: Dustin Snodgress | C70: 314 | D70: 5 | E70: =SUM(C70/D70) -> 62.800 | F70: =ROUNDDOWN(((E70-48)*0.8),0) -> 11
A71: 2 | B71: Adam Karstens | C71: 233 | D71: 4 | E71: =SUM(C71/D71) -> 58.250 | F71: =ROUNDDOWN(((E71-48)*0.8),0) -> 8 | G71: 54 | H71: 1 | I71: 1.5 | J71: TROYNA
A72: 3 | B72: Archie Coulter | C72: 174 | D72: 3 | E72: =SUM(C72/D72) -> 58.000 | F72: =ROUNDDOWN(((E72-48)*0.8),0) -> 8 | G72: 59
A73: 2 | B73: Josh Spang | C73: 116 | D73: 2 | E73: =SUM(C73/D73) -> 58.000 | F73: =ROUNDDOWN(((E73-48)*0.8),0) -> 8 | I73: 0.5
A74: 3 | B74: Dan Lewis | C74: 119 | D74: 2 | E74: =SUM(C74/D74) -> 59.500 | F74: =ROUNDDOWN(((E74-48)*0.8),0) -> 9 | G74: 56
A75: =SUM(A74+1) -> 4 | B75: Kerri Haught | C75: 124 | D75: 2 | E75: =SUM(C75/D75) -> 62.000 | F75: =ROUNDDOWN(((E75-48)*0.8),0) -> 11
A76: =SUM(A75+1) -> 5 | B76: Steve Callaway | C76: 125 | D76: 2 | E76: =SUM(C76/D76) -> 62.500 | F76: =ROUNDDOWN(((E76-48)*0.8),0) -> 11
A77: 7 | B77: Matt Snyder | C77: 162 | D77: 2 | E77: =SUM(C77/D77) -> 81.000 | F77: =ROUNDDOWN(((E77-48)*0.8),0) -> 26
A78: 8 | B78: Mike William | C78: 53 | D78: 1 | E78: =SUM(C78/D78) -> 53.000 | F78: 0
A79: 9 | B79: Kevin Stibal | C79: 56 | D79: 1 | E79: =SUM(C79/D79) -> 56.000 | F79: 0 | I79: 1
A80: 10 | B80: Jack Gilmore | C80: 59 | D80: 1 | E80: =SUM(C80/D80) -> 59.000 | F80: 0
A81: 11 | B81: Jesse Kirk | C81: 60 | D81: 1 | E81: =SUM(C81/D81) -> 60.000 | F81: 0
A82: 12 | B82: Dustin Nohr | C82: 64 | D82: 1 | E82: =SUM(C82/D82) -> 64.000 | F82: 0
A83: 13 | B83: Johnny Walker | C83: 64 | D83: 1 | E83: =SUM(C83/D83) -> 64.000 | F83: 0
A84: 14 | B84: Craig Eastin | C84: 65 | D84: 1 | E84: =SUM(C84/D84) -> 65.000 | F84: 0
A85: 15 | B85: Sills | C85: 65 | D85: 1 | E85: =SUM(C85/D85) -> 65.000 | F85: 0
A86: 16 | C86: 0 | D86: 1 | E86: =SUM(C86/D86) -> 0.000 | F86: =ROUNDDOWN(((E86-50)*0.8),0) -> -40
A87: 17 | C87: 0 | D87: 1 | E87: =SUM(C87/D87) -> 0.000 | F87: =ROUNDDOWN(((E87-50)*0.8),0) -> -40
A88: 18 | C88: 0 | D88: 1 | E88: =SUM(C88/D88) -> 0.000 | F88: =ROUNDDOWN(((E88-50)*0.8),0) -> -40
A89: 19 | C89: 0 | D89: 1 | E89: =SUM(C89/D89) -> 0.000 | F89: =ROUNDDOWN(((E89-50)*0.8),0) -> -40
A90: 20 | C90: 0 | D90: 1 | E90: =SUM(C90/D90) -> 0.000 | F90: =ROUNDDOWN(((E90-50)*0.8),0) -> -40
A91: 21 | C91: 0 | D91: 1 | E91: =SUM(C91/D91) -> 0.000 | F91: =ROUNDDOWN(((E91-50)*0.8),0) -> -40
A92: 22 | C92: 0 | D92: 1 | E92: =SUM(C92/D92) -> 0.000 | F92: =ROUNDDOWN(((E92-50)*0.8),0) -> -40
A93: 23 | C93: 0 | D93: 1 | E93: =SUM(C93/D93) -> 0.000 | F93: =ROUNDDOWN(((E93-50)*0.8),0) -> -40
A94: 24 | C94: 0 | D94: 1 | E94: =SUM(C94/D94) -> 0.000 | F94: =ROUNDDOWN(((E94-50)*0.8),0) -> -40
A95: 25 | C95: 0 | D95: 1 | E95: =SUM(C95/D95) -> 0.000 | F95: =ROUNDDOWN(((E95-50)*0.8),0) -> -40
A96: 26 | C96: 0 | D96: 1 | E96: =SUM(C96/D96) -> 0.000 | F96: =ROUNDDOWN(((E96-50)*0.8),0) -> -40
A97: 27 | C97: 0 | D97: 1 | E97: =SUM(C97/D97) -> 0.000 | F97: =ROUNDDOWN(((E97-50)*0.8),0) -> -40
A98: 28 | C98: 0 | D98: 1 | E98: =SUM(C98/D98) -> 0.000 | F98: =ROUNDDOWN(((E98-50)*0.8),0) -> -40
A99: 29 | C99: 0 | D99: 1 | E99: =SUM(C99/D99) -> 0.000 | F99: =ROUNDDOWN(((E99-50)*0.8),0) -> -40
A100: 30
A101: 31
A103: 2013 SBDGL Team Standings
B104: TEAM # | C104: BUSH | E104: Total Points | F104: Team Points | G104: Team Avg
A105: 1 | B105: 6 | C105: Ryan Clark & Ben Sandel | E105: 21.5 | F105: 7 | G105: =AVERAGE(E50,E26) -> 58.000
A106: 2 | B106: 13 | C106: Matt Whitlock & Greg Dye | E106: 19 | F106: 6.5 | G106: =AVERAGE(E29,E67) -> 61.355555555555554
A107: 3 | B107: 16 | C107: Tim Peyton & Josh Beachy | E107: 18 | F107: 6.5 | G107: =AVERAGE(E14,E9) -> 53.516666666666666
A108: 4 | B108: 12 | C108: Ian Jacobs & Andrew Greco | E108: 18 | F108: 6.5 | G108: =AVERAGE(E42,E7) -> 54.850
A109: 5 | B109: 9 | C109: Tim Troyna & Pat Cutsforth | E109: 17.5 | F109: 6 | G109: =AVERAGE(E53,E60) -> 61.577777777777783
A110: 6 | B110: 14 | C110: Matt Fritz & Jason Rimrodt | E110: 16 | F110: 4.5 | G110: =AVERAGE(E6,E46) -> 55.000
A111: 7 | B111: 7 | C111: Doug Johnson & Adam Stiers | E111: 15.5 | F111: 5 | G111: =AVERAGE(E12,E31) -> 55.000
A112: 8 | B112: 8 | C112: Jesse Streinz & Bob Hernandez | E112: 15 | F112: 4 | G112: =AVERAGE(E28,E30) -> 56.150
A113: 9 | B113: 11 | C113: Matt Weiben & Kirby Callanhan | E113: 14.5 | F113: 6 | G113: =AVERAGE(E33,E13) -> 55.350
A114: 10 | B114: 4 | C114: Marty Reis & Travis Pike | E114: 14 | F114: 5.5 | G114: =AVERAGE(E40,E45) -> 58.250
A115: 11 | B115: 3 | C115: Erik Smith & KVN | E115: 13.5 | F115: 4 | G115: =AVERAGE(E55,E19) -> 58.350
A116: 12 | B116: 10 | C116: Adam Miller & Mitch Lerch | E116: 13 | F116: 4 | G116: =AVERAGE(E24,E62) -> 59.644444444444446
A117: 13 | B117: 2 | C117: Sarah Potter & Kollin Grimm | E117: 12 | F117: 4 | G117: =AVERAGE(E27,E64) -> 60.150
A118: 14 | B118: 1 | C118: D Burns & Adam Henderson | E118: 10 | F118: 3 | G118: =AVERAGE(E61,E54) -> 62.250
A119: 15 | B119: 5 | C119: Average Joe & Chris Clime | E119: 9 | F119: 3 | G119: =AVERAGE(E63,E32) -> 59.866666666666667
A120: 16 | B120: 15 | C120: Nathan Veeder & Tony Rios | E120: 9 | F120: 2.5 | G120: =AVERAGE(E36,E47) -> 57.833333333333329
B122: TEAM # | C122: WHACKER
A123: 1 | B123: 30 | C123: Joel Knutson & Travis Fruendt | E123: 24 | F123: 8.5 | G123: =AVERAGE(E37,E23) -> 56.450
A124: 2 | B124: 23 | C124: Doug Peyton & Adam Chittenden | E124: 21.5 | F124: 8.5 | G124: =AVERAGE(E5,E56) -> 56.550
A125: 3 | B125: 27 | C125: Kurt Conrad & Dan Kent | E125: 20.5 | F125: 8 | G125: =AVERAGE(E11,E18) -> 54.150
A126: 4 | B126: 29 | C126: Adam Olsen & Matt Shannon | E126: 19.5 | F126: 6 | G126: =AVERAGE(E4,E48) -> 53.250
A127: 5 | B127: 17 | C127: Chuck Yanda & Nate Robbins | E127: 18.5 | F127: 6 | G127: =AVERAGE(E16,E39) -> 56.050
A128: 6 | B128: 24 | C128: Ryan Hamilton & Rob Mumma | E128: 18 | F128: 5.5 | G128: =AVERAGE(E35,E25) -> 56.450
A129: 7 | B129: 32 | C129: Dan Kern & Shirtless Bill | E129: 17.5 | F129: 5.5 | G129: =AVERAGE(E34,E8) -> 54.450
A130: 8 | B130: 22 | C130: Jeremy Farnsworth & Tony Ebson | E130: 16 | F130: 6 | G130: =AVERAGE(E10,E66) -> 59.316666666666663
A131: 9 | B131: 21 | C131: Ryan Eggleston & Shane Thirtyacre | E131: 16 | F131: 5 | G131: =AVERAGE(E43,E57) -> 60.200
A132: 10 | B132: 26 | C132: Joe French & Matt Wycoff | E132: 14.5 | F132: 5.5 | G132: =AVERAGE(E44,E17) -> 56.62222222222222
A133: 11 | B133: 19 | C133: Drew Detert & Anthony Moody | E133: 12 | F133: 4 | G133: =AVERAGE(E21,E52) -> 57.850
A134: 12 | B134: 28 | C134: Tim Potter & David McCuskey | E134: 11 | F134: 3.5 | G134: =AVERAGE(E21,E51) -> 57.750
A135: 13 | B135: 20 | C135: Dustin Utley & Tom Pepper | E135: 10.5 | F135: 3.5 | G135: =AVERAGE(E20,E59) -> 58.737499999999997
A136: 14 | B136: 31 | C136: Spencer Eubanks & Shawn Hullinger | E136: 9.5 | F136: 2.5 | G136: =AVERAGE(E58,E65) -> 63.250
A137: 15 | B137: 25 | C137: Ryan Wodstrchill & Phil Campos | E137: 8.5 | F137: 3 | G137: =AVERAGE(E15,E38) -> 55.762500000000003
A138: 16 | B138: 18 | C138: Jason Shook & Josh McFarland | E138: 7 | F138: 1 | G138: =AVERAGE(E49,E41) -> 58.50555555555556