A1: SBDGL CAREER ROUND / STROKE / AVERAGE / HANDICAP HISTORY
A2: PLAYER | C2: 2000 | D2: Strokes | E2: 2001 | F2: Strokes | G2: 2002 | H2: Strokes | I2: 2003 | J2: Strokes | K2: 2004 | L2: Strokes | M2: 2005 | N2: Strokes | O2: 2006 | P2: Strokes | Q2: 2007 | R2: Strokes | S2: 2008 | T2: Strokes | U2: 2009 | V2: Strokes | W2: 2010 | X2: Strokes | Y2: 2011 | Z2: Strokes | AA2: 2012 | AB2: Strokes | AC2: 2013 | AD2: Strokes | AE2: ROUNDS | AF2: STROKES | AG2: AVG | AH2: H-Cap
A3: 1 | B3: Jesse Streinz** | E3: 13 | F3: 718 | G3: 18 | H3: 979 | I3: 18 | J3: 956 | K3: 18 | L3: 1008 | M3: 18 | N3: 976 | O3: 19 | P3: 1028 | Q3: 18 | R3: 1036 | S3: 17 | T3: 930 | U3: 18 | V3: 992 | W3: 18 | X3: 1003 | Y3: 16 | Z3: 905 | AA3: 18 | AB3: 1008 | AC3: 18 | AD3: 989 | AE3: =SUM(C3+E3+G3+I3+K3+M3+O3+Q3+S3+U3+W3+Y3+AA3+AC3) -> 227 | AF3: =SUM(D3+F3+H3+J3+L3+N3+P3+R3+T3+V3+X3+Z3+AB3+AD3) -> 12528 | AG3: =SUM(AF3/AE3) -> 55.189427312775329 | AH3: =ROUNDDOWN(((AG3-50)*0.8),0) -> 4
A4: =SUM(A3+1) -> 2 | B4: Greco | E4: 3 | F4: 167 | G4: 18 | H4: 1031 | I4: 18 | J4: 974 | K4: 18 | L4: 972 | M4: 18 | N4: 961 | O4: 19 | P4: 1002 | Q4: 17 | R4: 917 | S4: 18 | T4: 963 | U4: 18 | V4: 935 | W4: 18 | X4: 906 | Y4: 18 | Z4: 905 | AA4: 18 | AB4: 932 | AC4: 18 | AD4: 917 | AE4: =SUM(C4+E4+G4+I4+K4+M4+O4+Q4+S4+U4+W4+Y4+AA4+AC4) -> 219 | AF4: =SUM(D4+F4+H4+J4+L4+N4+P4+R4+T4+V4+X4+Z4+AB4+AD4) -> 11582 | AG4: =SUM(AF4/AE4) -> 52.885844748858446 | AH4: =ROUNDDOWN(((AG4-50)*0.8),0) -> 2
A5: =SUM(A4+1) -> 3 | B5: D. Burns | E5: 3 | F5: 179 | G5: 18 | H5: 1148 | I5: 17 | J5: 1045 | K5: 15 | L5: 911 | M5: 17 | N5: 1010 | O5: 18 | P5: 1083 | Q5: 18 | R5: 1084 | S5: 18 | T5: 1041 | U5: 6 | V5: 353 | W5: 17 | X5: 989 | Y5: 18 | Z5: 1078 | AA5: 17 | AB5: 1054 | AC5: 18 | AD5: 1094 | AE5: =SUM(C5+E5+G5+I5+K5+M5+O5+Q5+S5+U5+W5+Y5+AA5+AC5) -> 200 | AF5: =SUM(D5+F5+H5+J5+L5+N5+P5+R5+T5+V5+X5+Z5+AB5+AD5) -> 12069 | AG5: =SUM(AF5/AE5) -> 60.344999999999999 | AH5: =ROUNDDOWN(((AG5-50)*0.8),0) -> 8
A6: =SUM(A5+1) -> 4 | B6: Woody** | I6: 18 | J6: 1084 | K6: 18 | L6: 1032 | M6: 18 | N6: 1018 | O6: 19 | P6: 1045 | Q6: 18 | R6: 992 | S6: 18 | T6: 938 | U6: 18 | V6: 961 | W6: 18 | X6: 957 | Y6: 18 | Z6: 973 | AA6: 18 | AB6: 989 | AC6: 18 | AD6: 949 | AE6: =SUM(C6+E6+G6+I6+K6+M6+O6+Q6+S6+U6+W6+Y6+AA6+AC6) -> 199 | AF6: =SUM(D6+F6+H6+J6+L6+N6+P6+R6+T6+V6+X6+Z6+AB6+AD6) -> 10938 | AG6: =SUM(AF6/AE6) -> 54.964824120603012 | AH6: =ROUNDDOWN(((AG6-50)*0.8),0) -> 3
A7: =SUM(A6+1) -> 5 | B7: Josh Beachy* | I7: 18 | J7: 1050 | K7: 18 | L7: 1029 | M7: 18 | N7: 998 | O7: 18 | P7: 997 | Q7: 18 | R7: 1038 | S7: 18 | T7: 975 | U7: 18 | V7: 983 | W7: 18 | X7: 981 | Y7: 18 | Z7: 974 | AA7: 18 | AB7: 997 | AC7: 17 | AD7: 896 | AE7: =SUM(C7+E7+G7+I7+K7+M7+O7+Q7+S7+U7+W7+Y7+AA7+AC7) -> 197 | AF7: =SUM(D7+F7+H7+J7+L7+N7+P7+R7+T7+V7+X7+Z7+AB7+AD7) -> 10918 | AG7: =SUM(AF7/AE7) -> 55.421319796954315 | AH7: =ROUNDDOWN(((AG7-50)*0.8),0) -> 4
A8: =SUM(A7+1) -> 6 | B8: Joel Knutson* | I8: 14 | J8: 803 | K8: 18 | L8: 1034 | M8: 17 | N8: 937 | O8: 18 | P8: 991 | Q8: 18 | R8: 1021 | S8: 18 | T8: 948 | U8: 18 | V8: 978 | W8: 18 | X8: 979 | Y8: 16 | Z8: 896 | AA8: 18 | AB8: 1019 | AC8: 18 | AD8: 999 | AE8: =SUM(C8+E8+G8+I8+K8+M8+O8+Q8+S8+U8+W8+Y8+AA8+AC8) -> 191 | AF8: =SUM(D8+F8+H8+J8+L8+N8+P8+R8+T8+V8+X8+Z8+AB8+AD8) -> 10605 | AG8: =SUM(AF8/AE8) -> 55.523560209424083 | AH8: =ROUNDDOWN(((AG8-50)*0.8),0) -> 4
A9: =SUM(A8+1) -> 7 | B9: Farley | I9: 18 | J9: 1140 | K9: 18 | L9: 1118 | M9: 18 | N9: 1070 | O9: 18 | P9: 1055 | Q9: 17 | R9: 1022 | S9: 17 | T9: 1020 | U9: 17 | V9: 1000 | W9: 18 | X9: 1039 | Y9: 17 | Z9: 1039 | AC9: 18 | AD9: 1077 | AE9: =SUM(C9+E9+G9+I9+K9+M9+O9+Q9+S9+U9+W9+Y9+AA9+AC9) -> 176 | AF9: =SUM(D9+F9+H9+J9+L9+N9+P9+R9+T9+V9+X9+Z9+AB9+AD9) -> 10580 | AG9: =SUM(AF9/AE9) -> 60.113636363636367 | AH9: =ROUNDDOWN(((AG9-50)*0.8),0) -> 8
A10: =SUM(A9+1) -> 8 | B10: Dustin Utley | K10: 16 | L10: 974 | M10: 16 | N10: 915 | O10: 18 | P10: 989 | Q10: 17 | R10: 968 | S10: 18 | T10: 1012 | U10: 18 | V10: 1015 | W10: 18 | X10: 957 | Y10: 18 | Z10: 986 | AA10: 17 | AB10: 937 | AC10: 17 | AD10: 931 | AE10: =SUM(C10+E10+G10+I10+K10+M10+O10+Q10+S10+U10+W10+Y10+AA10+AC10) -> 173 | AF10: =SUM(D10+F10+H10+J10+L10+N10+P10+R10+T10+V10+X10+Z10+AB10+AD10) -> 9684 | AG10: =SUM(AF10/AE10) -> 55.97687861271676 | AH10: =ROUNDDOWN(((AG10-50)*0.8),0) -> 4
A11: =SUM(A10+1) -> 9 | B11: Stiers | I11: 1 | J11: 59 | K11: 17 | L11: 940 | M11: 18 | N11: 1021 | O11: 19 | P11: 1066 | Q11: 17 | R11: 962 | S11: 15 | T11: 803 | U11: 18 | V11: 974 | W11: 16 | X11: 873 | Y11: 17 | Z11: 932 | AA11: 17 | AB11: 935 | AC11: 17 | AD11: 938 | AE11: =SUM(C11+E11+G11+I11+K11+M11+O11+Q11+S11+U11+W11+Y11+AA11+AC11) -> 172 | AF11: =SUM(D11+F11+H11+J11+L11+N11+P11+R11+T11+V11+X11+Z11+AB11+AD11) -> 9503 | AG11: =SUM(AF11/AE11) -> 55.250 | AH11: =ROUNDDOWN(((AG11-50)*0.8),0) -> 4
A12: =SUM(A11+1) -> 10 | B12: Super Dave* | K12: 18 | L12: 1062 | M12: 18 | N12: 1013 | O12: 19 | P12: 1040 | Q12: 18 | R12: 1026 | S12: 18 | T12: 997 | U12: 14 | V12: 805 | W12: 9 | X12: 510 | Y12: 17 | Z12: 979 | AA12: 17 | AB12: 977 | AC12: 18 | AD12: 1058 | AE12: =SUM(C12+E12+G12+I12+K12+M12+O12+Q12+S12+U12+W12+Y12+AA12+AC12) -> 166 | AF12: =SUM(D12+F12+H12+J12+L12+N12+P12+R12+T12+V12+X12+Z12+AB12+AD12) -> 9467 | AG12: =SUM(AF12/AE12) -> 57.03012048192771 | AH12: =ROUNDDOWN(((AG12-50)*0.8),0) -> 5
A13: =SUM(A12+1) -> 11 | B13: Matt Shannon | M13: 18 | N13: 1128 | O13: 19 | P13: 1105 | Q13: 18 | R13: 1085 | S13: 18 | T13: 1065 | U13: 18 | V13: 1072 | W13: 18 | X13: 996 | Y13: 18 | Z13: 1030 | AA13: 18 | AB13: 1042 | AC13: 18 | AD13: 1062 | AE13: =SUM(C13+E13+G13+I13+K13+M13+O13+Q13+S13+U13+W13+Y13+AA13+AC13) -> 163 | AF13: =SUM(D13+F13+H13+J13+L13+N13+P13+R13+T13+V13+X13+Z13+AB13+AD13) -> 9585 | AG13: =SUM(AF13/AE13) -> 58.803680981595093 | AH13: =ROUNDDOWN(((AG13-50)*0.8),0) -> 7
A14: =SUM(A13+1) -> 12 | B14: Rimmy* | K14: 16 | L14: 814 | M14: 16 | N14: 815 | O14: 18 | P14: 905 | Q14: 10 | R14: 531 | S14: 15 | T14: 801 | U14: 16 | V14: 853 | W14: 14 | X14: 762 | Y14: 16 | Z14: 844 | AA14: 18 | AB14: 997 | AC14: 18 | AD14: 912 | AE14: =SUM(C14+E14+G14+I14+K14+M14+O14+Q14+S14+U14+W14+Y14+AA14+AC14) -> 157 | AF14: =SUM(D14+F14+H14+J14+L14+N14+P14+R14+T14+V14+X14+Z14+AB14+AD14) -> 8234 | AG14: =SUM(AF14/AE14) -> 52.445859872611464 | AH14: =ROUNDDOWN(((AG14-50)*0.8),0) -> 1
A15: =SUM(A14+1) -> 13 | B15: Joe "Cool" Wiley** | C15: 21 | D15: 1214 | E15: 22 | F15: 1220 | G15: 18 | H15: 1013 | I15: 18 | J15: 960 | K15: 18 | L15: 973 | M15: 17 | N15: 955 | O15: 6 | P15: 331 | Q15: 18 | R15: 1002 | S15: 12 | T15: 684 | U15: 1 | V15: 64 | W15: 1 | X15: 56 | AA15: 1 | AB15: 57 | AE15: =SUM(C15+E15+G15+I15+K15+M15+O15+Q15+S15+U15+W15+Y15+AA15+AC15) -> 153 | AF15: =SUM(D15+F15+H15+J15+L15+N15+P15+R15+T15+V15+X15+Z15+AB15+AD15) -> 8529 | AG15: =SUM(AF15/AE15) -> 55.745098039215684 | AH15: =ROUNDDOWN(((AG15-50)*0.8),0) -> 4
A16: =SUM(A15+1) -> 14 | B16: "Shirtless" Bill | O16: 16 | P16: 900 | Q16: 17 | R16: 962 | S16: 18 | T16: 999 | U16: 16 | V16: 897 | W16: 18 | X16: 1025 | Y16: 18 | Z16: 1012 | AA16: 17 | AB16: 975 | AC16: 18 | AD16: 1010 | AE16: =SUM(C16+E16+G16+I16+K16+M16+O16+Q16+S16+U16+W16+Y16+AA16+AC16) -> 138 | AF16: =SUM(D16+F16+H16+J16+L16+N16+P16+R16+T16+V16+X16+Z16+AB16+AD16) -> 7780 | AG16: =SUM(AF16/AE16) -> 56.376811594202898 | AH16: =ROUNDDOWN(((AG16-50)*0.8),0) -> 5
A17: =SUM(A16+1) -> 15 | B17: Tom Pepper | O17: 18 | P17: 1138 | Q17: 18 | R17: 1098 | S17: 18 | T17: 1067 | U17: 18 | V17: 1057 | W17: 18 | X17: 1040 | Y17: 16 | Z17: 953 | AA17: 18 | AB17: 1121 | AC17: 14 | AD17: 857 | AE17: =SUM(C17+E17+G17+I17+K17+M17+O17+Q17+S17+U17+W17+Y17+AA17+AC17) -> 138 | AF17: =SUM(D17+F17+H17+J17+L17+N17+P17+R17+T17+V17+X17+Z17+AB17+AD17) -> 8331 | AG17: =SUM(AF17/AE17) -> 60.369565217391305 | AH17: =ROUNDDOWN(((AG17-50)*0.8),0) -> 8
A18: =SUM(A17+1) -> 16 | B18: Tim Peyton* | M18: 4 | N18: 209 | Q18: 18 | R18: 926 | S18: 18 | T18: 908 | U18: 18 | V18: 906 | W18: 18 | X18: 913 | Y18: 18 | Z18: 900 | AA18: 18 | AB18: 914 | AC18: 18 | AD18: 929 | AE18: =SUM(C18+E18+G18+I18+K18+M18+O18+Q18+S18+U18+W18+Y18+AA18+AC18) -> 130 | AF18: =SUM(D18+F18+H18+J18+L18+N18+P18+R18+T18+V18+X18+Z18+AB18+AD18) -> 6605 | AG18: =SUM(AF18/AE18) -> 50.807692307692307 | AH18: =ROUNDDOWN(((AG18-50)*0.8),0) -> 0
A19: =SUM(A18+1) -> 17 | B19: Joe O'Neil | O19: 19 | P19: 1158 | Q19: 18 | R19: 1071 | S19: 16 | T19: 922 | U19: 7 | V19: 388 | W19: 16 | X19: 929 | Y19: 18 | Z19: 1038 | AA19: 18 | AB19: 1040 | AC19: 18 | AD19: 1112 | AE19: =SUM(C19+E19+G19+I19+K19+M19+O19+Q19+S19+U19+W19+Y19+AA19+AC19) -> 130 | AF19: =SUM(D19+F19+H19+J19+L19+N19+P19+R19+T19+V19+X19+Z19+AB19+AD19) -> 7658 | AG19: =SUM(AF19/AE19) -> 58.907692307692308 | AH19: =ROUNDDOWN(((AG19-50)*0.8),0) -> 7
A20: =SUM(A19+1) -> 18 | B20: Ryan Hamilton | K20: 3 | L20: 182 | Q20: 18 | R20: 1059 | S20: 18 | T20: 1024 | U20: 18 | V20: 1025 | W20: 18 | X20: 980 | Y20: 18 | Z20: 980 | AA20: 18 | AB20: 1016 | AC20: 18 | AD20: 1001 | AE20: =SUM(C20+E20+G20+I20+K20+M20+O20+Q20+S20+U20+W20+Y20+AA20+AC20) -> 129 | AF20: =SUM(D20+F20+H20+J20+L20+N20+P20+R20+T20+V20+X20+Z20+AB20+AD20) -> 7267 | AG20: =SUM(AF20/AE20) -> 56.333333333333336 | AH20: =ROUNDDOWN(((AG20-50)*0.8),0) -> 5
A21: =SUM(A20+1) -> 19 | B21: Matt "Frog" Geers | K21: 16 | L21: 936 | M21: 14 | N21: 836 | O21: 19 | P21: 1091 | Q21: 17 | R21: 950 | S21: 17 | T21: 906 | U21: 13 | V21: 721 | W21: 13 | X21: 734 | Y21: 14 | Z21: 776 | AA21: 5 | AB21: 300 | AE21: =SUM(C21+E21+G21+I21+K21+M21+O21+Q21+S21+U21+W21+Y21+AA21+AC21) -> 128 | AF21: =SUM(D21+F21+H21+J21+L21+N21+P21+R21+T21+V21+X21+Z21+AB21+AD21) -> 7250 | AG21: =SUM(AF21/AE21) -> 56.640625 | AH21: =ROUNDDOWN(((AG21-50)*0.8),0) -> 5
A22: =SUM(A21+1) -> 20 | B22: Matt Wieben** | O22: 1 | P22: 51 | Q22: 18 | R22: 964 | S22: 18 | T22: 952 | U22: 18 | V22: 931 | W22: 18 | X22: 896 | Y22: 18 | Z22: 915 | AA22: 18 | AB22: 965 | AC22: 18 | AD22: 961 | AE22: =SUM(C22+E22+G22+I22+K22+M22+O22+Q22+S22+U22+W22+Y22+AA22+AC22) -> 127 | AF22: =SUM(D22+F22+H22+J22+L22+N22+P22+R22+T22+V22+X22+Z22+AB22+AD22) -> 6635 | AG22: =SUM(AF22/AE22) -> 52.244094488188978 | AH22: =ROUNDDOWN(((AG22-50)*0.8),0) -> 1
A23: =SUM(A22+1) -> 21 | B23: Kollin Grimm | Q23: 17 | R23: 986 | S23: 18 | T23: 982 | U23: 18 | V23: 968 | W23: 18 | X23: 924 | Y23: 18 | Z23: 953 | AA23: 18 | AB23: 972 | AC23: 18 | AD23: 987 | AE23: =SUM(C23+E23+G23+I23+K23+M23+O23+Q23+S23+U23+W23+Y23+AA23+AC23) -> 125 | AF23: =SUM(D23+F23+H23+J23+L23+N23+P23+R23+T23+V23+X23+Z23+AB23+AD23) -> 6772 | AG23: =SUM(AF23/AE23) -> 54.176000000000002 | AH23: =ROUNDDOWN(((AG23-50)*0.8),0) -> 3
A24: =SUM(A23+1) -> 22 | B24: Jamie Gray | G24: 4 | H24: 233 | I24: 18 | J24: 1046 | K24: 18 | L24: 1056 | M24: 15 | N24: 864 | O24: 17 | P24: 998 | Q24: 17 | R24: 1011 | S24: 17 | T24: 989 | U24: 16 | V24: 956 | AE24: =SUM(C24+E24+G24+I24+K24+M24+O24+Q24+S24+U24+W24+Y24+AA24+AC24) -> 122 | AF24: =SUM(D24+F24+H24+J24+L24+N24+P24+R24+T24+V24+X24+Z24+AB24+AD24) -> 7153 | AG24: =SUM(AF24/AE24) -> 58.631147540983605 | AH24: =ROUNDDOWN(((AG24-50)*0.8),0) -> 6
A25: =SUM(A24+1) -> 23 | B25: Jesse Sauerbrei | K25: 17 | L25: 940 | M25: 18 | N25: 972 | O25: 18 | P25: 989 | Q25: 18 | R25: 969 | S25: 18 | T25: 976 | U25: 15 | V25: 814 | Y25: 16 | Z25: 870 | AE25: =SUM(C25+E25+G25+I25+K25+M25+O25+Q25+S25+U25+W25+Y25+AA25+AC25) -> 120 | AF25: =SUM(D25+F25+H25+J25+L25+N25+P25+R25+T25+V25+X25+Z25+AB25+AD25) -> 6530 | AG25: =SUM(AF25/AE25) -> 54.416666666666664 | AH25: =ROUNDDOWN(((AG25-50)*0.8),0) -> 3
A26: =SUM(A25+1) -> 24 | B26: Travis Pike | K26: 2 | L26: 113 | M26: 18 | N26: 987 | O26: 9 | P26: 504 | S26: 18 | T26: 974 | U26: 4 | V26: 227 | W26: 15 | X26: 825 | Y26: 18 | Z26: 1035 | AA26: 18 | AB26: 1037 | AC26: 16 | AD26: 922 | AE26: =SUM(C26+E26+G26+I26+K26+M26+O26+Q26+S26+U26+W26+Y26+AA26+AC26) -> 118 | AF26: =SUM(D26+F26+H26+J26+L26+N26+P26+R26+T26+V26+X26+Z26+AB26+AD26) -> 6624 | AG26: =SUM(AF26/AE26) -> 56.135593220338983 | AH26: =ROUNDDOWN(((AG26-50)*0.8),0) -> 4
A27: =SUM(A26+1) -> 25 | B27: Jerimie Maker* | M27: 6 | N27: 341 | O27: 15 | P27: 836 | Q27: 10 | R27: 545 | S27: 18 | T27: 984 | U27: 18 | V27: 975 | W27: 18 | X27: 1003 | Y27: 18 | Z27: 1078 | AA27: 13 | AB27: 807 | AC27: 1 | AD27: 56 | AE27: =SUM(C27+E27+G27+I27+K27+M27+O27+Q27+S27+U27+W27+Y27+AA27+AC27) -> 117 | AF27: =SUM(D27+F27+H27+J27+L27+N27+P27+R27+T27+V27+X27+Z27+AB27+AD27) -> 6625 | AG27: =SUM(AF27/AE27) -> 56.623931623931625 | AH27: =ROUNDDOWN(((AG27-50)*0.8),0) -> 5
A28: =SUM(A27+1) -> 26 | B28: Doug Peyton | Q28: 18 | R28: 910 | S28: 18 | T28: 916 | U28: 18 | V28: 894 | W28: 18 | X28: 881 | Y28: 5 | Z28: 251 | AA28: 18 | AB28: 913 | AC28: 18 | AD28: 904 | AE28: =SUM(C28+E28+G28+I28+K28+M28+O28+Q28+S28+U28+W28+Y28+AA28+AC28) -> 113 | AF28: =SUM(D28+F28+H28+J28+L28+N28+P28+R28+T28+V28+X28+Z28+AB28+AD28) -> 5669 | AG28: =SUM(AF28/AE28) -> 50.168141592920357 | AH28: =ROUNDDOWN(((AG28-50)*0.8),0) -> 0
A29: =SUM(A28+1) -> 27 | B29: Tim "Timmy" Troyna | O29: 17 | P29: 1048 | Q29: 15 | R29: 925 | S29: 15 | T29: 904 | U29: 15 | V29: 924 | W29: 17 | X29: 982 | Y29: 16 | Z29: 925 | AA29: 1 | AB29: 59 | AC29: 17 | AD29: 1000 | AE29: =SUM(C29+E29+G29+I29+K29+M29+O29+Q29+S29+U29+W29+Y29+AA29+AC29) -> 113 | AF29: =SUM(D29+F29+H29+J29+L29+N29+P29+R29+T29+V29+X29+Z29+AB29+AD29) -> 6767 | AG29: =SUM(AF29/AE29) -> 59.884955752212392 | AH29: =ROUNDDOWN(((AG29-50)*0.8),0) -> 7
A30: =SUM(A29+1) -> 28 | B30: Jeremy Prouty* | K30: 15 | L30: 1056 | M30: 16 | N30: 1058 | O30: 17 | P30: 1099 | Q30: 18 | R30: 1132 | S30: 15 | T30: 970 | U30: 17 | V30: 1016 | W30: 11 | X30: 656 | AA30: 1 | AB30: 71 | AE30: =SUM(C30+E30+G30+I30+K30+M30+O30+Q30+S30+U30+W30+Y30+AA30+AC30) -> 110 | AF30: =SUM(D30+F30+H30+J30+L30+N30+P30+R30+T30+V30+X30+Z30+AB30+AD30) -> 7058 | AG30: =SUM(AF30/AE30) -> 64.163636363636357 | AH30: =ROUNDDOWN(((AG30-50)*0.8),0) -> 11
A31: =SUM(A30+1) -> 29 | B31: Kevin Stibal | I31: 13 | J31: 684 | K31: 17 | L31: 881 | M31: 16 | N31: 851 | O31: 18 | P31: 966 | Q31: 17 | R31: 903 | S31: 2 | T31: 112 | U31: 11 | V31: 555 | W31: 5 | X31: 265 | Y31: 4 | Z31: 223 | AA31: 3 | AB31: 175 | AC31: 2 | AD31: 104 | AE31: =SUM(C31+E31+G31+I31+K31+M31+O31+Q31+S31+U31+W31+Y31+AA31+AC31) -> 108 | AF31: =SUM(D31+F31+H31+J31+L31+N31+P31+R31+T31+V31+X31+Z31+AB31+AD31) -> 5719 | AG31: =SUM(AF31/AE31) -> 52.953703703703702 | AH31: =ROUNDDOWN(((AG31-50)*0.8),0) -> 2
A32: =SUM(A31+1) -> 30 | B32: Marty Reis | S32: 18 | T32: 1110 | U32: 18 | V32: 1034 | W32: 18 | X32: 1013 | Y32: 17 | Z32: 929 | AA32: 18 | AB32: 1023 | AC32: 18 | AD32: 1017 | AE32: =SUM(C32+E32+G32+I32+K32+M32+O32+Q32+S32+U32+W32+Y32+AA32+AC32) -> 107 | AF32: =SUM(D32+F32+H32+J32+L32+N32+P32+R32+T32+V32+X32+Z32+AB32+AD32) -> 6126 | AG32: =SUM(AF32/AE32) -> 57.252336448598129 | AH32: =ROUNDDOWN(((AG32-50)*0.8),0) -> 5
A33: =SUM(A32+1) -> 31 | B33: Mark Dvorsky | G33: 10 | H33: 593 | I33: 18 | J33: 1059 | K33: 18 | L33: 1037 | M33: 17 | N33: 972 | O33: 17 | P33: 973 | Q33: 11 | R33: 639 | S33: 16 | T33: 930 | AE33: =SUM(C33+E33+G33+I33+K33+M33+O33+Q33+S33+U33+W33+Y33+AA33+AC33) -> 107 | AF33: =SUM(D33+F33+H33+J33+L33+N33+P33+R33+T33+V33+X33+Z33+AB33+AD33) -> 6203 | AG33: =SUM(AF33/AE33) -> 57.971962616822431 | AH33: =ROUNDDOWN(((AG33-50)*0.8),0) -> 6
A34: =SUM(A33+1) -> 32 | B34: Matt Lacina | K34: 17 | L34: 1167 | M34: 18 | N34: 1143 | O34: 18 | P34: 1117 | Q34: 18 | R34: 1122 | S34: 18 | T34: 1075 | U34: 18 | V34: 1077 | AE34: =SUM(C34+E34+G34+I34+K34+M34+O34+Q34+S34+U34+W34+Y34+AA34+AC34) -> 107 | AF34: =SUM(D34+F34+H34+J34+L34+N34+P34+R34+T34+V34+X34+Z34+AB34+AD34) -> 6701 | AG34: =SUM(AF34/AE34) -> 62.626168224299064 | AH34: =ROUNDDOWN(((AG34-50)*0.8),0) -> 10
A35: =SUM(A34+1) -> 33 | B35: Kruck | C35: 22 | D35: 1240 | E35: 21 | F35: 1158 | G35: 14 | H35: 826 | I35: 2 | J35: 118 | K35: 12 | L35: 720 | M35: 18 | N35: 1032 | U35: 7 | V35: 402 | W35: 4 | X35: 239 | AE35: =SUM(C35+E35+G35+I35+K35+M35+O35+Q35+S35+U35+W35+Y35+AA35+AC35) -> 100 | AF35: =SUM(D35+F35+H35+J35+L35+N35+P35+R35+T35+V35+X35+Z35+AB35+AD35) -> 5735 | AG35: =SUM(AF35/AE35) -> 57.350 | AH35: =ROUNDDOWN(((AG35-50)*0.8),0) -> 5
A36: =SUM(A35+1) -> 34 | B36: Max Ostby | M36: 18 | N36: 1112 | O36: 18 | P36: 1088 | Q36: 16 | R36: 994 | S36: 14 | T36: 872 | U36: 17 | V36: 1063 | W36: 13 | X36: 771 | Y36: 2 | Z36: 121 | AC36: 1 | AD36: 66 | AE36: =SUM(C36+E36+G36+I36+K36+M36+O36+Q36+S36+U36+W36+Y36+AA36+AC36) -> 99 | AF36: =SUM(D36+F36+H36+J36+L36+N36+P36+R36+T36+V36+X36+Z36+AB36+AD36) -> 6087 | AG36: =SUM(AF36/AE36) -> 61.484848484848484 | AH36: =ROUNDDOWN(((AG36-50)*0.8),0) -> 9
A37: =SUM(A36+1) -> 35 | B37: Shawn Hullinger | Q37: 5 | R37: 343 | S37: 5 | T37: 302 | U37: 17 | V37: 1077 | W37: 18 | X37: 1106 | Y37: 17 | Z37: 1031 | AA37: 18 | AB37: 1145 | AC37: 18 | AD37: 1128 | AE37: =SUM(C37+E37+G37+I37+K37+M37+O37+Q37+S37+U37+W37+Y37+AA37+AC37) -> 98 | AF37: =SUM(D37+F37+H37+J37+L37+N37+P37+R37+T37+V37+X37+Z37+AB37+AD37) -> 6132 | AG37: =SUM(AF37/AE37) -> 62.571428571428569 | AH37: =ROUNDDOWN(((AG37-50)*0.8),0) -> 10
A38: =SUM(A37+1) -> 36 | B38: Jeremy Farnsworth | S38: 12 | T38: 630 | U38: 17 | V38: 888 | W38: 18 | X38: 915 | Y38: 17 | Z38: 886 | AA38: 16 | AB38: 807 | AC38: 17 | AD38: 865 | AE38: =SUM(C38+E38+G38+I38+K38+M38+O38+Q38+S38+U38+W38+Y38+AA38+AC38) -> 97 | AF38: =SUM(D38+F38+H38+J38+L38+N38+P38+R38+T38+V38+X38+Z38+AB38+AD38) -> 4991 | AG38: =SUM(AF38/AE38) -> 51.453608247422679 | AH38: =ROUNDDOWN(((AG38-50)*0.8),0) -> 1
A39: =SUM(A38+1) -> 37 | B39: Matt Fritz | S39: 7 | T39: 405 | U39: 18 | V39: 1038 | W39: 17 | X39: 965 | Y39: 18 | Z39: 1022 | AA39: 18 | AB39: 1040 | AC39: 18 | AD39: 1046 | AE39: =SUM(C39+E39+G39+I39+K39+M39+O39+Q39+S39+U39+W39+Y39+AA39+AC39) -> 96 | AF39: =SUM(D39+F39+H39+J39+L39+N39+P39+R39+T39+V39+X39+Z39+AB39+AD39) -> 5516 | AG39: =SUM(AF39/AE39) -> 57.458333333333336 | AH39: =ROUNDDOWN(((AG39-50)*0.8),0) -> 5
A40: =SUM(A39+1) -> 38 | B40: Nathan Veeder | S40: 8 | T40: 450 | U40: 18 | V40: 1021 | W40: 17 | X40: 922 | Y40: 17 | Z40: 935 | AA40: 17 | AB40: 945 | AC40: 18 | AD40: 1014 | AE40: =SUM(C40+E40+G40+I40+K40+M40+O40+Q40+S40+U40+W40+Y40+AA40+AC40) -> 95 | AF40: =SUM(D40+F40+H40+J40+L40+N40+P40+R40+T40+V40+X40+Z40+AB40+AD40) -> 5287 | AG40: =SUM(AF40/AE40) -> 55.652631578947371 | AH40: =ROUNDDOWN(((AG40-50)*0.8),0) -> 4
A41: =SUM(A40+1) -> 39 | B41: Matt McCarley** | I41: 18 | J41: 968 | K41: 18 | L41: 944 | M41: 18 | N41: 948 | O41: 19 | P41: 971 | Q41: 18 | R41: 964 | AA41: 1 | AB41: 65 | AE41: =SUM(C41+E41+G41+I41+K41+M41+O41+Q41+S41+U41+W41+Y41+AA41+AC41) -> 92 | AF41: =SUM(D41+F41+H41+J41+L41+N41+P41+R41+T41+V41+X41+Z41+AB41+AD41) -> 4860 | AG41: =SUM(AF41/AE41) -> 52.826086956521742 | AH41: =ROUNDDOWN(((AG41-50)*0.8),0) -> 2
A42: =SUM(A41+1) -> 40 | B42: Dan Kern | U42: 17 | V42: 893 | W42: 18 | X42: 900 | Y42: 18 | Z42: 948 | AA42: 18 | AB42: 910 | AC42: 18 | AD42: 923 | AE42: =SUM(C42+E42+G42+I42+K42+M42+O42+Q42+S42+U42+W42+Y42+AA42+AC42) -> 89 | AF42: =SUM(D42+F42+H42+J42+L42+N42+P42+R42+T42+V42+X42+Z42+AB42+AD42) -> 4574 | AG42: =SUM(AF42/AE42) -> 51.393258426966291 | AH42: =ROUNDDOWN(((AG42-50)*0.8),0) -> 1
A43: =SUM(A42+1) -> 41 | B43: Rory Lasansky | M43: 18 | N43: 959 | O43: 1 | P43: 55 | Q43: 18 | R43: 1024 | S43: 18 | T43: 977 | U43: 13 | V43: 685 | W43: 17 | X43: 897 | Y43: 1 | Z43: 52 | AA43: 3 | AB43: 168 | AE43: =SUM(C43+E43+G43+I43+K43+M43+O43+Q43+S43+U43+W43+Y43+AA43+AC43) -> 89 | AF43: =SUM(D43+F43+H43+J43+L43+N43+P43+R43+T43+V43+X43+Z43+AB43+AD43) -> 4817 | AG43: =SUM(AF43/AE43) -> 54.123595505617978 | AH43: =ROUNDDOWN(((AG43-50)*0.8),0) -> 3
A44: =SUM(A43+1) -> 42 | B44: "Wheatbread" | E44: 19 | F44: 1102 | G44: 18 | H44: 1024 | I44: 18 | J44: 991 | K44: 18 | L44: 1027 | M44: 15 | N44: 835 | AE44: =SUM(C44+E44+G44+I44+K44+M44+O44+Q44+S44+U44+W44+Y44+AA44+AC44) -> 88 | AF44: =SUM(D44+F44+H44+J44+L44+N44+P44+R44+T44+V44+X44+Z44+AB44+AD44) -> 4979 | AG44: =SUM(AF44/AE44) -> 56.579545454545453 | AH44: =ROUNDDOWN(((AG44-50)*0.8),0) -> 5
A45: =SUM(A44+1) -> 43 | B45: Adam Miller | Q45: 1 | R45: 51 | U45: 17 | V45: 900 | W45: 17 | X45: 900 | Y45: 17 | Z45: 874 | AA45: 18 | AB45: 988 | AC45: 17 | AD45: 908 | AE45: =SUM(C45+E45+G45+I45+K45+M45+O45+Q45+S45+U45+W45+Y45+AA45+AC45) -> 87 | AF45: =SUM(D45+F45+H45+J45+L45+N45+P45+R45+T45+V45+X45+Z45+AB45+AD45) -> 4621 | AG45: =SUM(AF45/AE45) -> 53.114942528735632 | AH45: =ROUNDDOWN(((AG45-50)*0.8),0) -> 2
A46: =SUM(A45+1) -> 44 | B46: Spencer Eubanks | U46: 16 | V46: 1040 | W46: 18 | X46: 1169 | Y46: 18 | Z46: 1139 | AA46: 16 | AB46: 1010 | AC46: 18 | AD46: 1089 | AE46: =SUM(C46+E46+G46+I46+K46+M46+O46+Q46+S46+U46+W46+Y46+AA46+AC46) -> 86 | AF46: =SUM(D46+F46+H46+J46+L46+N46+P46+R46+T46+V46+X46+Z46+AB46+AD46) -> 5447 | AG46: =SUM(AF46/AE46) -> 63.337209302325583 | AH46: =ROUNDDOWN(((AG46-50)*0.8),0) -> 10
A47: =SUM(A46+1) -> 45 | B47: KVN | U47: 16 | V47: 837 | W47: 15 | X47: 749 | Y47: 18 | Z47: 930 | AA47: 18 | AB47: 947 | AC47: 18 | AD47: 955 | AE47: =SUM(C47+E47+G47+I47+K47+M47+O47+Q47+S47+U47+W47+Y47+AA47+AC47) -> 85 | AF47: =SUM(D47+F47+H47+J47+L47+N47+P47+R47+T47+V47+X47+Z47+AB47+AD47) -> 4418 | AG47: =SUM(AF47/AE47) -> 51.976470588235294 | AH47: =ROUNDDOWN(((AG47-50)*0.8),0) -> 1
A48: =SUM(A47+1) -> 46 | B48: Byran Bream | K48: 9 | L48: 491 | M48: 18 | N48: 955 | O48: 19 | P48: 976 | Q48: 18 | R48: 983 | S48: 18 | T48: 938 | U48: 1 | V48: 52 | AE48: =SUM(C48+E48+G48+I48+K48+M48+O48+Q48+S48+U48+W48+Y48+AA48+AC48) -> 83 | AF48: =SUM(D48+F48+H48+J48+L48+N48+P48+R48+T48+V48+X48+Z48+AB48+AD48) -> 4395 | AG48: =SUM(AF48/AE48) -> 52.951807228915662 | AH48: =ROUNDDOWN(((AG48-50)*0.8),0) -> 2
A49: =SUM(A48+1) -> 47 | B49: Dixie Smith | C49: 11 | D49: 874 | E49: 18 | F49: 1393 | G49: 17 | H49: 1220 | I49: 18 | J49: 1295 | K49: 18 | L49: 1278 | AE49: =SUM(C49+E49+G49+I49+K49+M49+O49+Q49+S49+U49+W49+Y49+AA49+AC49) -> 82 | AF49: =SUM(D49+F49+H49+J49+L49+N49+P49+R49+T49+V49+X49+Z49+AB49+AD49) -> 6060 | AG49: =SUM(AF49/AE49) -> 73.902439024390247 | AH49: =ROUNDDOWN(((AG49-50)*0.8),0) -> 19
A50: =SUM(A49+1) -> 48 | B50: Ryan "Norm" Kriz** | C50: 22 | D50: 1281 | E50: 22 | F50: 1313 | G50: 18 | H50: 1068 | I50: 17 | J50: 1034 | AE50: =SUM(C50+E50+G50+I50+K50+M50+O50+Q50+S50+U50+W50+Y50+AA50+AC50) -> 79 | AF50: =SUM(D50+F50+H50+J50+L50+N50+P50+R50+T50+V50+X50+Z50+AB50+AD50) -> 4696 | AG50: =SUM(AF50/AE50) -> 59.443037974683541 | AH50: =ROUNDDOWN(((AG50-50)*0.8),0) -> 7
A51: =SUM(A50+1) -> 49 | B51: "Snapple" | G51: 4 | H51: 209 | I51: 7 | J51: 387 | K51: 18 | L51: 1003 | M51: 16 | N51: 877 | O51: 17 | P51: 937 | Q51: 12 | R51: 674 | AE51: =SUM(C51+E51+G51+I51+K51+M51+O51+Q51+S51+U51+W51+Y51+AA51+AC51) -> 74 | AF51: =SUM(D51+F51+H51+J51+L51+N51+P51+R51+T51+V51+X51+Z51+AB51+AD51) -> 4087 | AG51: =SUM(AF51/AE51) -> 55.229729729729726 | AH51: =ROUNDDOWN(((AG51-50)*0.8),0) -> 4
A52: =SUM(A51+1) -> 50 | B52: Mike Flynn | M52: 6 | N52: 360 | O52: 15 | P52: 883 | Q52: 18 | R52: 1048 | S52: 17 | T52: 973 | U52: 18 | V52: 1054 | AE52: =SUM(C52+E52+G52+I52+K52+M52+O52+Q52+S52+U52+W52+Y52+AA52+AC52) -> 74 | AF52: =SUM(D52+F52+H52+J52+L52+N52+P52+R52+T52+V52+X52+Z52+AB52+AD52) -> 4318 | AG52: =SUM(AF52/AE52) -> 58.351351351351354 | AH52: =ROUNDDOWN(((AG52-50)*0.8),0) -> 6
A53: =SUM(A52+1) -> 51 | B53: Keith Gudenkauf | O53: 18 | P53: 993 | Q53: 13 | R53: 723 | S53: 18 | T53: 963 | U53: 17 | V53: 928 | Y53: 6 | Z53: 320 | AE53: =SUM(C53+E53+G53+I53+K53+M53+O53+Q53+S53+U53+W53+Y53+AA53+AC53) -> 72 | AF53: =SUM(D53+F53+H53+J53+L53+N53+P53+R53+T53+V53+X53+Z53+AB53+AD53) -> 3927 | AG53: =SUM(AF53/AE53) -> 54.541666666666664 | AH53: =ROUNDDOWN(((AG53-50)*0.8),0) -> 3
A54: =SUM(A53+1) -> 52 | B54: Tim Potter* | W54: 18 | X54: 930 | Y54: 17 | Z54: 923 | AA54: 18 | AB54: 1002 | AC54: 18 | AD54: 978 | AE54: =SUM(C54+E54+G54+I54+K54+M54+O54+Q54+S54+U54+W54+Y54+AA54+AC54) -> 71 | AF54: =SUM(D54+F54+H54+J54+L54+N54+P54+R54+T54+V54+X54+Z54+AB54+AD54) -> 3833 | AG54: =SUM(AF54/AE54) -> 53.985915492957744 | AH54: =ROUNDDOWN(((AG54-50)*0.8),0) -> 3
A55: =SUM(A54+1) -> 53 | B55: Justin Zehr | S55: 9 | T55: 537 | U55: 18 | V55: 1080 | W55: 16 | X55: 907 | Y55: 16 | Z55: 945 | AA55: 11 | AB55: 670 | AE55: =SUM(C55+E55+G55+I55+K55+M55+O55+Q55+S55+U55+W55+Y55+AA55+AC55) -> 70 | AF55: =SUM(D55+F55+H55+J55+L55+N55+P55+R55+T55+V55+X55+Z55+AB55+AD55) -> 4139 | AG55: =SUM(AF55/AE55) -> 59.128571428571426 | AH55: =ROUNDDOWN(((AG55-50)*0.8),0) -> 7
A56: =SUM(A55+1) -> 54 | B56: Dan Klein | K56: 11 | L56: 680 | M56: 18 | N56: 1050 | O56: 12 | P56: 665 | Q56: 18 | R56: 1024 | S56: 9 | T56: 520 | AE56: =SUM(C56+E56+G56+I56+K56+M56+O56+Q56+S56+U56+W56+Y56+AA56+AC56) -> 68 | AF56: =SUM(D56+F56+H56+J56+L56+N56+P56+R56+T56+V56+X56+Z56+AB56+AD56) -> 3939 | AG56: =SUM(AF56/AE56) -> 57.926470588235297 | AH56: =ROUNDDOWN(((AG56-50)*0.8),0) -> 6
A57: =SUM(A56+1) -> 55 | B57: JT Hagameier | C57: 3 | D57: 181 | E57: 21 | F57: 1405 | G57: 17 | H57: 1085 | I57: 15 | J57: 964 | M57: 12 | N57: 791 | AE57: =SUM(C57+E57+G57+I57+K57+M57+O57+Q57+S57+U57+W57+Y57+AA57+AC57) -> 68 | AF57: =SUM(D57+F57+H57+J57+L57+N57+P57+R57+T57+V57+X57+Z57+AB57+AD57) -> 4426 | AG57: =SUM(AF57/AE57) -> 65.088235294117652 | AH57: =ROUNDDOWN(((AG57-50)*0.8),0) -> 12
A58: =SUM(A57+1) -> 56 | B58: Corey Moel | C58: 14 | D58: 939 | E58: 21 | F58: 1306 | G58: 18 | H58: 1143 | I58: 15 | J58: 1042 | AE58: =SUM(C58+E58+G58+I58+K58+M58+O58+Q58+S58+U58+W58+Y58+AA58+AC58) -> 68 | AF58: =SUM(D58+F58+H58+J58+L58+N58+P58+R58+T58+V58+X58+Z58+AB58+AD58) -> 4430 | AG58: =SUM(AF58/AE58) -> 65.147058823529406 | AH58: =ROUNDDOWN(((AG58-50)*0.8),0) -> 12
A59: =SUM(A58+1) -> 57 | B59: Ryan Eggleston | W59: 15 | X59: 887 | Y59: 16 | Z59: 940 | AA59: 18 | AB59: 1043 | AC59: 18 | AD59: 1019 | AE59: =SUM(C59+E59+G59+I59+K59+M59+O59+Q59+S59+U59+W59+Y59+AA59+AC59) -> 67 | AF59: =SUM(D59+F59+H59+J59+L59+N59+P59+R59+T59+V59+X59+Z59+AB59+AD59) -> 3889 | AG59: =SUM(AF59/AE59) -> 58.044776119402982 | AH59: =ROUNDDOWN(((AG59-50)*0.8),0) -> 6
A60: =SUM(A59+1) -> 58 | B60: Dustin Nohr | U60: 15 | V60: 935 | W60: 18 | X60: 1031 | Y60: 15 | Z60: 873 | AA60: 16 | AB60: 928 | AC60: 1 | AD60: 64 | AE60: =SUM(C60+E60+G60+I60+K60+M60+O60+Q60+S60+U60+W60+Y60+AA60+AC60) -> 65 | AF60: =SUM(D60+F60+H60+J60+L60+N60+P60+R60+T60+V60+X60+Z60+AB60+AD60) -> 3831 | AG60: =SUM(AF60/AE60) -> 58.938461538461539 | AH60: =ROUNDDOWN(((AG60-50)*0.8),0) -> 7
A61: =SUM(A60+1) -> 59 | B61: Matt Rinker | M61: 18 | N61: 964 | O61: 19 | P61: 1044 | Q61: 18 | R61: 984 | S61: 9 | T61: 472 | AE61: =SUM(C61+E61+G61+I61+K61+M61+O61+Q61+S61+U61+W61+Y61+AA61+AC61) -> 64 | AF61: =SUM(D61+F61+H61+J61+L61+N61+P61+R61+T61+V61+X61+Z61+AB61+AD61) -> 3464 | AG61: =SUM(AF61/AE61) -> 54.125 | AH61: =ROUNDDOWN(((AG61-50)*0.8),0) -> 3
A62: =SUM(A61+1) -> 60 | B62: Brian Zyzda | G62: 1 | H62: 61 | I62: 17 | J62: 949 | K62: 17 | L62: 943 | M62: 18 | N62: 972 | O62: 10 | P62: 514 | AE62: =SUM(C62+E62+G62+I62+K62+M62+O62+Q62+S62+U62+W62+Y62+AA62+AC62) -> 63 | AF62: =SUM(D62+F62+H62+J62+L62+N62+P62+R62+T62+V62+X62+Z62+AB62+AD62) -> 3439 | AG62: =SUM(AF62/AE62) -> 54.587301587301589 | AH62: =ROUNDDOWN(((AG62-50)*0.8),0) -> 3
A63: =SUM(A62+1) -> 61 | B63: John Russell | M63: 10 | N63: 585 | O63: 17 | P63: 959 | Q63: 18 | R63: 1044 | S63: 17 | T63: 952 | AE63: =SUM(C63+E63+G63+I63+K63+M63+O63+Q63+S63+U63+W63+Y63+AA63+AC63) -> 62 | AF63: =SUM(D63+F63+H63+J63+L63+N63+P63+R63+T63+V63+X63+Z63+AB63+AD63) -> 3540 | AG63: =SUM(AF63/AE63) -> 57.096774193548384 | AH63: =ROUNDDOWN(((AG63-50)*0.8),0) -> 5
A64: =SUM(A63+1) -> 62 | B64: Jeremy Bos | K64: 16 | L64: 962 | M64: 15 | N64: 922 | O64: 15 | P64: 960 | Q64: 16 | R64: 986 | AE64: =SUM(C64+E64+G64+I64+K64+M64+O64+Q64+S64+U64+W64+Y64+AA64+AC64) -> 62 | AF64: =SUM(D64+F64+H64+J64+L64+N64+P64+R64+T64+V64+X64+Z64+AB64+AD64) -> 3830 | AG64: =SUM(AF64/AE64) -> 61.774193548387096 | AH64: =ROUNDDOWN(((AG64-50)*0.8),0) -> 9
A65: =SUM(A64+1) -> 63 | B65: Doug Johnson | Q65: 2 | R65: 99 | U65: 1 | V65: 49 | W65: 5 | X65: 246 | Y65: 17 | Z65: 905 | AA65: 18 | AB65: 973 | AC65: 18 | AD65: 951 | AE65: =SUM(C65+E65+G65+I65+K65+M65+O65+Q65+S65+U65+W65+Y65+AA65+AC65) -> 61 | AF65: =SUM(D65+F65+H65+J65+L65+N65+P65+R65+T65+V65+X65+Z65+AB65+AD65) -> 3223 | AG65: =SUM(AF65/AE65) -> 52.83606557377049 | AH65: =ROUNDDOWN(((AG65-50)*0.8),0) -> 2
A66: =SUM(A65+1) -> 64 | B66: Brian Eastwood | C66: 21 | D66: 1380 | E66: 22 | F66: 1411 | G66: 9 | H66: 562 | I66: 9 | J66: 576 | AE66: =SUM(C66+E66+G66+I66+K66+M66+O66+Q66+S66+U66+W66+Y66+AA66+AC66) -> 61 | AF66: =SUM(D66+F66+H66+J66+L66+N66+P66+R66+T66+V66+X66+Z66+AB66+AD66) -> 3929 | AG66: =SUM(AF66/AE66) -> 64.409836065573771 | AH66: =ROUNDDOWN(((AG66-50)*0.8),0) -> 11
A67: =SUM(A66+1) -> 65 | B67: Aaron Lindsley | M67: 14 | N67: 740 | O67: 19 | P67: 1011 | Q67: 12 | R67: 642 | S67: 14 | T67: 729 | AE67: =SUM(C67+E67+G67+I67+K67+M67+O67+Q67+S67+U67+W67+Y67+AA67+AC67) -> 59 | AF67: =SUM(D67+F67+H67+J67+L67+N67+P67+R67+T67+V67+X67+Z67+AB67+AD67) -> 3122 | AG67: =SUM(AF67/AE67) -> 52.915254237288138 | AH67: =ROUNDDOWN(((AG67-50)*0.8),0) -> 2
A68: =SUM(A67+1) -> 66 | B68: Shane Thirtyacre | W68: 14 | X68: 821 | Y68: 11 | Z68: 667 | AA68: 18 | AB68: 1108 | AC68: 16 | AD68: 985 | AE68: =SUM(C68+E68+G68+I68+K68+M68+O68+Q68+S68+U68+W68+Y68+AA68+AC68) -> 59 | AF68: =SUM(D68+F68+H68+J68+L68+N68+P68+R68+T68+V68+X68+Z68+AB68+AD68) -> 3581 | AG68: =SUM(AF68/AE68) -> 60.694915254237287 | AH68: =ROUNDDOWN(((AG68-50)*0.8),0) -> 8
A69: =SUM(A68+1) -> 67 | B69: Kurt Conrad* | W69: 3 | X69: 157 | Y69: 17 | Z69: 909 | AA69: 18 | AB69: 970 | AC69: 18 | AD69: 935 | AE69: =SUM(C69+E69+G69+I69+K69+M69+O69+Q69+S69+U69+W69+Y69+AA69+AC69) -> 56 | AF69: =SUM(D69+F69+H69+J69+L69+N69+P69+R69+T69+V69+X69+Z69+AB69+AD69) -> 2971 | AG69: =SUM(AF69/AE69) -> 53.053571428571431 | AH69: =ROUNDDOWN(((AG69-50)*0.8),0) -> 2
A70: =SUM(A69+1) -> 68 | B70: Travis Scott* | C70: 22 | D70: 1325 | E70: 12 | F70: 813 | G70: 14 | H70: 839 | I70: 8 | J70: 480 | AE70: =SUM(C70+E70+G70+I70+K70+M70+O70+Q70+S70+U70+W70+Y70+AA70+AC70) -> 56 | AF70: =SUM(D70+F70+H70+J70+L70+N70+P70+R70+T70+V70+X70+Z70+AB70+AD70) -> 3457 | AG70: =SUM(AF70/AE70) -> 61.732142857142854 | AH70: =ROUNDDOWN(((AG70-50)*0.8),0) -> 9
A71: =SUM(A70+1) -> 69 | B71: J "Cally" Callaghan* | M71: 18 | N71: 1138 | O71: 19 | P71: 1157 | Q71: 18 | R71: 1159 | AE71: =SUM(C71+E71+G71+I71+K71+M71+O71+Q71+S71+U71+W71+Y71+AA71+AC71) -> 55 | AF71: =SUM(D71+F71+H71+J71+L71+N71+P71+R71+T71+V71+X71+Z71+AB71+AD71) -> 3454 | AG71: =SUM(AF71/AE71) -> 62.800 | AH71: =ROUNDDOWN(((AG71-50)*0.8),0) -> 10
A72: =SUM(A71+1) -> 70 | B72: Mike Robinson | M72: 17 | N72: 934 | O72: 19 | P72: 966 | Q72: 17 | R72: 936 | AE72: =SUM(C72+E72+G72+I72+K72+M72+O72+Q72+S72+U72+W72+Y72+AA72+AC72) -> 53 | AF72: =SUM(D72+F72+H72+J72+L72+N72+P72+R72+T72+V72+X72+Z72+AB72+AD72) -> 2836 | AG72: =SUM(AF72/AE72) -> 53.509433962264154 | AH72: =ROUNDDOWN(((AG72-50)*0.8),0) -> 2
A73: =SUM(A72+1) -> 71 | B73: Jason Shook | M73: 18 | N73: 984 | O73: 1 | P73: 56 | Q73: 17 | R73: 940 | AC73: 17 | AD73: 962 | AE73: =SUM(C73+E73+G73+I73+K73+M73+O73+Q73+S73+U73+W73+Y73+AA73+AC73) -> 53 | AF73: =SUM(D73+F73+H73+J73+L73+N73+P73+R73+T73+V73+X73+Z73+AB73+AD73) -> 2942 | AG73: =SUM(AF73/AE73) -> 55.509433962264154 | AH73: =ROUNDDOWN(((AG73-50)*0.8),0) -> 4
A74: =SUM(A73+1) -> 72 | B74: Kate Papenthien | Q74: 18 | R74: 1137 | S74: 18 | T74: 1057 | U74: 17 | V74: 995 | AE74: =SUM(C74+E74+G74+I74+K74+M74+O74+Q74+S74+U74+W74+Y74+AA74+AC74) -> 53 | AF74: =SUM(D74+F74+H74+J74+L74+N74+P74+R74+T74+V74+X74+Z74+AB74+AD74) -> 3189 | AG74: =SUM(AF74/AE74) -> 60.169811320754718 | AH74: =ROUNDDOWN(((AG74-50)*0.8),0) -> 8
A75: =SUM(A74+1) -> 73 | B75: Eric Smith | Y75: 18 | Z75: 1080 | AA75: 17 | AB75: 1041 | AC75: 18 | AD75: 1083 | AE75: =SUM(C75+E75+G75+I75+K75+M75+O75+Q75+S75+U75+W75+Y75+AA75+AC75) -> 53 | AF75: =SUM(D75+F75+H75+J75+L75+N75+P75+R75+T75+V75+X75+Z75+AB75+AD75) -> 3204 | AG75: =SUM(AF75/AE75) -> 60.452830188679243 | AH75: =ROUNDDOWN(((AG75-50)*0.8),0) -> 8
A76: =SUM(A75+1) -> 74 | B76: Brent Kauffman | K76: 18 | L76: 965 | O76: 17 | P76: 901 | Q76: 17 | R76: 946 | AE76: =SUM(C76+E76+G76+I76+K76+M76+O76+Q76+S76+U76+W76+Y76+AA76+AC76) -> 52 | AF76: =SUM(D76+F76+H76+J76+L76+N76+P76+R76+T76+V76+X76+Z76+AB76+AD76) -> 2812 | AG76: =SUM(AF76/AE76) -> 54.07692307692308 | AH76: =ROUNDDOWN(((AG76-50)*0.8),0) -> 3
A77: =SUM(A76+1) -> 75 | B77: Steve Callaway | M77: 7 | N77: 422 | O77: 16 | P77: 971 | Q77: 16 | R77: 976 | S77: 3 | T77: 167 | U77: 7 | V77: 424 | AC77: 3 | AD77: 185 | AE77: =SUM(C77+E77+G77+I77+K77+M77+O77+Q77+S77+U77+W77+Y77+AA77+AC77) -> 52 | AF77: =SUM(D77+F77+H77+J77+L77+N77+P77+R77+T77+V77+X77+Z77+AB77+AD77) -> 3145 | AG77: =SUM(AF77/AE77) -> 60.480769230769234 | AH77: =ROUNDDOWN(((AG77-50)*0.8),0) -> 8
A78: =SUM(A77+1) -> 76 | B78: Rob Mumma | U78: 18 | V78: 1044 | W78: 4 | X78: 218 | Y78: 4 | Z78: 222 | AA78: 7 | AB78: 411 | AC78: 18 | AD78: 1006 | AE78: =SUM(C78+E78+G78+I78+K78+M78+O78+Q78+S78+U78+W78+Y78+AA78+AC78) -> 51 | AF78: =SUM(D78+F78+H78+J78+L78+N78+P78+R78+T78+V78+X78+Z78+AB78+AD78) -> 2901 | AG78: =SUM(AF78/AE78) -> 56.882352941176471 | AH78: =ROUNDDOWN(((AG78-50)*0.8),0) -> 5
A79: =SUM(A78+1) -> 77 | B79: Valera Petrulevich | S79: 16 | T79: 1001 | U79: 17 | V79: 1034 | W79: 18 | X79: 1028 | AE79: =SUM(C79+E79+G79+I79+K79+M79+O79+Q79+S79+U79+W79+Y79+AA79+AC79) -> 51 | AF79: =SUM(D79+F79+H79+J79+L79+N79+P79+R79+T79+V79+X79+Z79+AB79+AD79) -> 3063 | AG79: =SUM(AF79/AE79) -> 60.058823529411768 | AH79: =ROUNDDOWN(((AG79-50)*0.8),0) -> 8
A80: =SUM(A79+1) -> 78 | B80: Phil Campos | Y80: 18 | Z80: 1034 | AA80: 17 | AB80: 995 | AC80: 15 | AD80: 841 | AE80: =SUM(C80+E80+G80+I80+K80+M80+O80+Q80+S80+U80+W80+Y80+AA80+AC80) -> 50 | AF80: =SUM(D80+F80+H80+J80+L80+N80+P80+R80+T80+V80+X80+Z80+AB80+AD80) -> 2870 | AG80: =SUM(AF80/AE80) -> 57.400 | AH80: =ROUNDDOWN(((AG80-50)*0.8),0) -> 5
A81: =SUM(A80+1) -> 79 | B81: John Williams | W81: 16 | X81: 954 | Y81: 17 | Z81: 983 | AA81: 17 | AB81: 990 | AE81: =SUM(C81+E81+G81+I81+K81+M81+O81+Q81+S81+U81+W81+Y81+AA81+AC81) -> 50 | AF81: =SUM(D81+F81+H81+J81+L81+N81+P81+R81+T81+V81+X81+Z81+AB81+AD81) -> 2927 | AG81: =SUM(AF81/AE81) -> 58.540 | AH81: =ROUNDDOWN(((AG81-50)*0.8),0) -> 6
A82: =SUM(A81+1) -> 80 | B82: Dusty Mcatee | C82: 15 | D82: 888 | E82: 21 | F82: 1210 | G82: 12 | H82: 776 | AE82: =SUM(C82+E82+G82+I82+K82+M82+O82+Q82+S82+U82+W82+Y82+AA82+AC82) -> 48 | AF82: =SUM(D82+F82+H82+J82+L82+N82+P82+R82+T82+V82+X82+Z82+AB82+AD82) -> 2874 | AG82: =SUM(AF82/AE82) -> 59.875 | AH82: =ROUNDDOWN(((AG82-50)*0.8),0) -> 7
A83: =SUM(A82+1) -> 81 | B83: Lee Nerad | E83: 14 | F83: 856 | G83: 18 | H83: 1099 | I83: 16 | J83: 982 | AE83: =SUM(C83+E83+G83+I83+K83+M83+O83+Q83+S83+U83+W83+Y83+AA83+AC83) -> 48 | AF83: =SUM(D83+F83+H83+J83+L83+N83+P83+R83+T83+V83+X83+Z83+AB83+AD83) -> 2937 | AG83: =SUM(AF83/AE83) -> 61.1875 | AH83: =ROUNDDOWN(((AG83-50)*0.8),0) -> 8
A84: =SUM(A83+1) -> 82 | B84: Brandon Yoder | S84: 15 | T84: 1014 | U84: 13 | V84: 855 | W84: 10 | X84: 676 | Y84: 10 | Z84: 673 | AE84: =SUM(C84+E84+G84+I84+K84+M84+O84+Q84+S84+U84+W84+Y84+AA84+AC84) -> 48 | AF84: =SUM(D84+F84+H84+J84+L84+N84+P84+R84+T84+V84+X84+Z84+AB84+AD84) -> 3218 | AG84: =SUM(AF84/AE84) -> 67.041666666666671 | AH84: =ROUNDDOWN(((AG84-50)*0.8),0) -> 13
A85: =SUM(A84+1) -> 83 | B85: Eric Strader | G85: 18 | H85: 1178 | I85: 18 | J85: 1042 | K85: 11 | L85: 691 | AE85: =SUM(C85+E85+G85+I85+K85+M85+O85+Q85+S85+U85+W85+Y85+AA85+AC85) -> 47 | AF85: =SUM(D85+F85+H85+J85+L85+N85+P85+R85+T85+V85+X85+Z85+AB85+AD85) -> 2911 | AG85: =SUM(AF85/AE85) -> 61.936170212765958 | AH85: =ROUNDDOWN(((AG85-50)*0.8),0) -> 9
A86: =SUM(A85+1) -> 84 | B86: Joe Ostby | M86: 12 | N86: 682 | Q86: 18 | R86: 1029 | S86: 12 | T86: 683 | AE86: =SUM(C86+E86+G86+I86+K86+M86+O86+Q86+S86+U86+W86+Y86+AA86+AC86) -> 42 | AF86: =SUM(D86+F86+H86+J86+L86+N86+P86+R86+T86+V86+X86+Z86+AB86+AD86) -> 2394 | AG86: =SUM(AF86/AE86) -> 57.000 | AH86: =ROUNDDOWN(((AG86-50)*0.8),0) -> 5
A87: =SUM(A86+1) -> 85 | B87: Joe Evans | K87: 12 | L87: 815 | M87: 14 | N87: 931 | S87: 16 | T87: 1120 | AE87: =SUM(C87+E87+G87+I87+K87+M87+O87+Q87+S87+U87+W87+Y87+AA87+AC87) -> 42 | AF87: =SUM(D87+F87+H87+J87+L87+N87+P87+R87+T87+V87+X87+Z87+AB87+AD87) -> 2866 | AG87: =SUM(AF87/AE87) -> 68.238095238095241 | AH87: =ROUNDDOWN(((AG87-50)*0.8),0) -> 14
A88: =SUM(A87+1) -> 86 | B88: Scott Eastwood | C88: 20 | D88: 1619 | E88: 19 | F88: 1320 | G88: 3 | H88: 218 | AE88: =SUM(C88+E88+G88+I88+K88+M88+O88+Q88+S88+U88+W88+Y88+AA88+AC88) -> 42 | AF88: =SUM(D88+F88+H88+J88+L88+N88+P88+R88+T88+V88+X88+Z88+AB88+AD88) -> 3157 | AG88: =SUM(AF88/AE88) -> 75.166666666666671 | AH88: =ROUNDDOWN(((AG88-50)*0.8),0) -> 20
A89: =SUM(A88+1) -> 87 | B89: Troy Knapp | M89: 5 | N89: 301 | Q89: 16 | R89: 1034 | S89: 18 | T89: 1121 | U89: 1 | V89: 65 | AE89: =SUM(C89+E89+G89+I89+K89+M89+O89+Q89+S89+U89+W89+Y89+AA89+AC89) -> 40 | AF89: =SUM(D89+F89+H89+J89+L89+N89+P89+R89+T89+V89+X89+Z89+AB89+AD89) -> 2521 | AG89: =SUM(AF89/AE89) -> 63.024999999999999 | AH89: =ROUNDDOWN(((AG89-50)*0.8),0) -> 10
A90: =SUM(A89+1) -> 88 | B90: Dev Nelson | Q90: 1 | R90: 50 | U90: 15 | V90: 810 | W90: 18 | X90: 928 | Y90: 2 | Z90: 105 | AA90: 3 | AB90: 168 | AE90: =SUM(C90+E90+G90+I90+K90+M90+O90+Q90+S90+U90+W90+Y90+AA90+AC90) -> 39 | AF90: =SUM(D90+F90+H90+J90+L90+N90+P90+R90+T90+V90+X90+Z90+AB90+AD90) -> 2061 | AG90: =SUM(AF90/AE90) -> 52.846153846153847 | AH90: =ROUNDDOWN(((AG90-50)*0.8),0) -> 2
A91: =SUM(A90+1) -> 89 | B91: Brent Ross | E91: 21 | F91: 1287 | G91: 18 | H91: 1097 | AE91: =SUM(C91+E91+G91+I91+K91+M91+O91+Q91+S91+U91+W91+Y91+AA91+AC91) -> 39 | AF91: =SUM(D91+F91+H91+J91+L91+N91+P91+R91+T91+V91+X91+Z91+AB91+AD91) -> 2384 | AG91: =SUM(AF91/AE91) -> 61.128205128205131 | AH91: =ROUNDDOWN(((AG91-50)*0.8),0) -> 8
A92: =SUM(A91+1) -> 90 | B92: Jon Shear | O92: 18 | P92: 1036 | Q92: 16 | R92: 908 | S92: 4 | T92: 216 | AE92: =SUM(C92+E92+G92+I92+K92+M92+O92+Q92+S92+U92+W92+Y92+AA92+AC92) -> 38 | AF92: =SUM(D92+F92+H92+J92+L92+N92+P92+R92+T92+V92+X92+Z92+AB92+AD92) -> 2160 | AG92: =SUM(AF92/AE92) -> 56.842105263157897 | AH92: =ROUNDDOWN(((AG92-50)*0.8),0) -> 5
A93: =SUM(A92+1) -> 91 | B93: Drew Detert* | W93: 1 | X93: 55 | Y93: 18 | Z93: 947 | AC93: 18 | AD93: 983 | AE93: =SUM(C93+E93+G93+I93+K93+M93+O93+Q93+S93+U93+W93+Y93+AA93+AC93) -> 37 | AF93: =SUM(D93+F93+H93+J93+L93+N93+P93+R93+T93+V93+X93+Z93+AB93+AD93) -> 1985 | AG93: =SUM(AF93/AE93) -> 53.648648648648646 | AH93: =ROUNDDOWN(((AG93-50)*0.8),0) -> 2
A94: =SUM(A93+1) -> 92 | B94: Brad Balk | O94: 19 | P94: 1178 | Q94: 18 | R94: 1110 | AE94: =SUM(C94+E94+G94+I94+K94+M94+O94+Q94+S94+U94+W94+Y94+AA94+AC94) -> 37 | AF94: =SUM(D94+F94+H94+J94+L94+N94+P94+R94+T94+V94+X94+Z94+AB94+AD94) -> 2288 | AG94: =SUM(AF94/AE94) -> 61.837837837837839 | AH94: =ROUNDDOWN(((AG94-50)*0.8),0) -> 9
A95: =SUM(A94+1) -> 93 | B95: Chris Clime | W95: 1 | X95: 50 | AA95: 18 | AB95: 988 | AC95: 17 | AD95: 931 | AE95: =SUM(C95+E95+G95+I95+K95+M95+O95+Q95+S95+U95+W95+Y95+AA95+AC95) -> 36 | AF95: =SUM(D95+F95+H95+J95+L95+N95+P95+R95+T95+V95+X95+Z95+AB95+AD95) -> 1969 | AG95: =SUM(AF95/AE95) -> 54.694444444444443 | AH95: =ROUNDDOWN(((AG95-50)*0.8),0) -> 3
A96: =SUM(A95+1) -> 94 | B96: Kirby Callahan | AA96: 18 | AB96: 1035 | AC96: 18 | AD96: 985 | AE96: =SUM(C96+E96+G96+I96+K96+M96+O96+Q96+S96+U96+W96+Y96+AA96+AC96) -> 36 | AF96: =SUM(D96+F96+H96+J96+L96+N96+P96+R96+T96+V96+X96+Z96+AB96+AD96) -> 2020 | AG96: =SUM(AF96/AE96) -> 56.111111111111114 | AH96: =ROUNDDOWN(((AG96-50)*0.8),0) -> 4
A97: =SUM(A96+1) -> 95 | B97: Jake Sutter | M97: 18 | N97: 1034 | O97: 18 | P97: 1009 | AE97: =SUM(C97+E97+G97+I97+K97+M97+O97+Q97+S97+U97+W97+Y97+AA97+AC97) -> 36 | AF97: =SUM(D97+F97+H97+J97+L97+N97+P97+R97+T97+V97+X97+Z97+AB97+AD97) -> 2043 | AG97: =SUM(AF97/AE97) -> 56.750 | AH97: =ROUNDDOWN(((AG97-50)*0.8),0) -> 5
A98: =SUM(A97+1) -> 96 | B98: Ian Jacobs | AA98: 18 | AB98: 1050 | AC98: 18 | AD98: 1015 | AE98: =SUM(C98+E98+G98+I98+K98+M98+O98+Q98+S98+U98+W98+Y98+AA98+AC98) -> 36 | AF98: =SUM(D98+F98+H98+J98+L98+N98+P98+R98+T98+V98+X98+Z98+AB98+AD98) -> 2065 | AG98: =SUM(AF98/AE98) -> 57.361111111111114 | AH98: =ROUNDDOWN(((AG98-50)*0.8),0) -> 5
A99: =SUM(A98+1) -> 97 | B99: Sarah Potter | AA99: 18 | AB99: 1194 | AC99: 18 | AD99: 1136 | AE99: =SUM(C99+E99+G99+I99+K99+M99+O99+Q99+S99+U99+W99+Y99+AA99+AC99) -> 36 | AF99: =SUM(D99+F99+H99+J99+L99+N99+P99+R99+T99+V99+X99+Z99+AB99+AD99) -> 2330 | AG99: =SUM(AF99/AE99) -> 64.722222222222229 | AH99: =ROUNDDOWN(((AG99-50)*0.8),0) -> 11
A100: =SUM(A99+1) -> 98 | B100: Mitch "Machete" Lerch | AA100: 18 | AB100: 1269 | AC100: 18 | AD100: 1106 | AE100: =SUM(C100+E100+G100+I100+K100+M100+O100+Q100+S100+U100+W100+Y100+AA100+AC100) -> 36 | AF100: =SUM(D100+F100+H100+J100+L100+N100+P100+R100+T100+V100+X100+Z100+AB100+AD100) -> 2375 | AG100: =SUM(AF100/AE100) -> 65.972222222222229 | AH100: =ROUNDDOWN(((AG100-50)*0.8),0) -> 12
A101: =SUM(A100+1) -> 99 | B101: Skyler Landess | M101: 18 | N101: 1313 | O101: 14 | P101: 957 | S101: 3 | T101: 216 | AA101: 1 | AB101: 59 | AE101: =SUM(C101+E101+G101+I101+K101+M101+O101+Q101+S101+U101+W101+Y101+AA101+AC101) -> 36 | AF101: =SUM(D101+F101+H101+J101+L101+N101+P101+R101+T101+V101+X101+Z101+AB101+AD101) -> 2545 | AG101: =SUM(AF101/AE101) -> 70.694444444444443 | AH101: =ROUNDDOWN(((AG101-50)*0.8),0) -> 16
A102: =SUM(A101+1) -> 100 | B102: Nick Schultz | Q102: 1 | R102: 57 | S102: 16 | T102: 880 | U102: 18 | V102: 979 | AE102: =SUM(C102+E102+G102+I102+K102+M102+O102+Q102+S102+U102+W102+Y102+AA102+AC102) -> 35 | AF102: =SUM(D102+F102+H102+J102+L102+N102+P102+R102+T102+V102+X102+Z102+AB102+AD102) -> 1916 | AG102: =SUM(AF102/AE102) -> 54.74285714285714 | AH102: =ROUNDDOWN(((AG102-50)*0.8),0) -> 3
A103: =SUM(A102+1) -> 101 | B103: Travis Fruendt | AA103: 17 | AB103: 963 | AC103: 18 | AD103: 988 | AE103: =SUM(C103+E103+G103+I103+K103+M103+O103+Q103+S103+U103+W103+Y103+AA103+AC103) -> 35 | AF103: =SUM(D103+F103+H103+J103+L103+N103+P103+R103+T103+V103+X103+Z103+AB103+AD103) -> 1951 | AG103: =SUM(AF103/AE103) -> 55.74285714285714 | AH103: =ROUNDDOWN(((AG103-50)*0.8),0) -> 4
A104: =SUM(A103+1) -> 102 | B104: Adam Henderson | AA104: 17 | AB104: 1009 | AC104: 18 | AD104: 1083 | AE104: =SUM(C104+E104+G104+I104+K104+M104+O104+Q104+S104+U104+W104+Y104+AA104+AC104) -> 35 | AF104: =SUM(D104+F104+H104+J104+L104+N104+P104+R104+T104+V104+X104+Z104+AB104+AD104) -> 2092 | AG104: =SUM(AF104/AE104) -> 59.771428571428572 | AH104: =ROUNDDOWN(((AG104-50)*0.8),0) -> 7
A105: =SUM(A104+1) -> 103 | B105: Marc Bookmeyer | K105: 17 | L105: 1084 | M105: 18 | N105: 1115 | AE105: =SUM(C105+E105+G105+I105+K105+M105+O105+Q105+S105+U105+W105+Y105+AA105+AC105) -> 35 | AF105: =SUM(D105+F105+H105+J105+L105+N105+P105+R105+T105+V105+X105+Z105+AB105+AD105) -> 2199 | AG105: =SUM(AF105/AE105) -> 62.828571428571429 | AH105: =ROUNDDOWN(((AG105-50)*0.8),0) -> 10
A106: =SUM(A105+1) -> 104 | B106: Aaron "Burnie" Burnett | I106: 17 | J106: 1161 | K106: 18 | L106: 1193 | AE106: =SUM(C106+E106+G106+I106+K106+M106+O106+Q106+S106+U106+W106+Y106+AA106+AC106) -> 35 | AF106: =SUM(D106+F106+H106+J106+L106+N106+P106+R106+T106+V106+X106+Z106+AB106+AD106) -> 2354 | AG106: =SUM(AF106/AE106) -> 67.257142857142853 | AH106: =ROUNDDOWN(((AG106-50)*0.8),0) -> 13
A107: =SUM(A106+1) -> 105 | B107: Matt Wycoff | AA107: 17 | AB107: 1009 | AC107: 17 | AD107: 967 | AE107: =SUM(C107+E107+G107+I107+K107+M107+O107+Q107+S107+U107+W107+Y107+AA107+AC107) -> 34 | AF107: =SUM(D107+F107+H107+J107+L107+N107+P107+R107+T107+V107+X107+Z107+AB107+AD107) -> 1976 | AG107: =SUM(AF107/AE107) -> 58.117647058823529 | AH107: =ROUNDDOWN(((AG107-50)*0.8),0) -> 6
A108: =SUM(A107+1) -> 106 | B108: Ben Young | Q108: 16 | R108: 1072 | S108: 18 | T108: 1166 | AE108: =SUM(C108+E108+G108+I108+K108+M108+O108+Q108+S108+U108+W108+Y108+AA108+AC108) -> 34 | AF108: =SUM(D108+F108+H108+J108+L108+N108+P108+R108+T108+V108+X108+Z108+AB108+AD108) -> 2238 | AG108: =SUM(AF108/AE108) -> 65.82352941176471 | AH108: =ROUNDDOWN(((AG108-50)*0.8),0) -> 12
A109: =SUM(A108+1) -> 107 | B109: Adam Olsen | Q109: 8 | R109: 380 | S109: 1 | T109: 53 | W109: 1 | X109: 47 | AA109: 4 | AB109: 196 | AC109: 18 | AD109: 842 | AE109: =SUM(C109+E109+G109+I109+K109+M109+O109+Q109+S109+U109+W109+Y109+AA109+AC109) -> 32 | AF109: =SUM(D109+F109+H109+J109+L109+N109+P109+R109+T109+V109+X109+Z109+AB109+AD109) -> 1518 | AG109: =SUM(AF109/AE109) -> 47.4375 | AH109: =ROUNDDOWN(((AG109-50)*0.8),0) -> -2
A110: =SUM(A109+1) -> 108 | B110: Nathan Ciha | W110: 18 | X110: 1003 | Y110: 14 | Z110: 801 | AE110: =SUM(C110+E110+G110+I110+K110+M110+O110+Q110+S110+U110+W110+Y110+AA110+AC110) -> 32 | AF110: =SUM(D110+F110+H110+J110+L110+N110+P110+R110+T110+V110+X110+Z110+AB110+AD110) -> 1804 | AG110: =SUM(AF110/AE110) -> 56.375 | AH110: =ROUNDDOWN(((AG110-50)*0.8),0) -> 5
A111: =SUM(A110+1) -> 109 | B111: Brad Rew | S111: 16 | T111: 914 | U111: 13 | V111: 752 | W111: 3 | X111: 165 | AE111: =SUM(C111+E111+G111+I111+K111+M111+O111+Q111+S111+U111+W111+Y111+AA111+AC111) -> 32 | AF111: =SUM(D111+F111+H111+J111+L111+N111+P111+R111+T111+V111+X111+Z111+AB111+AD111) -> 1831 | AG111: =SUM(AF111/AE111) -> 57.21875 | AH111: =ROUNDDOWN(((AG111-50)*0.8),0) -> 5
A112: =SUM(A111+1) -> 110 | B112: Anthony Moody | Y112: 16 | Z112: 945 | AC112: 16 | AD112: 938 | AE112: =SUM(C112+E112+G112+I112+K112+M112+O112+Q112+S112+U112+W112+Y112+AA112+AC112) -> 32 | AF112: =SUM(D112+F112+H112+J112+L112+N112+P112+R112+T112+V112+X112+Z112+AB112+AD112) -> 1883 | AG112: =SUM(AF112/AE112) -> 58.84375 | AH112: =ROUNDDOWN(((AG112-50)*0.8),0) -> 7
A113: =SUM(A112+1) -> 111 | B113: Andrew Staudt | Q113: 15 | R113: 962 | S113: 13 | T113: 814 | U113: 4 | V113: 246 | AE113: =SUM(C113+E113+G113+I113+K113+M113+O113+Q113+S113+U113+W113+Y113+AA113+AC113) -> 32 | AF113: =SUM(D113+F113+H113+J113+L113+N113+P113+R113+T113+V113+X113+Z113+AB113+AD113) -> 2022 | AG113: =SUM(AF113/AE113) -> 63.1875 | AH113: =ROUNDDOWN(((AG113-50)*0.8),0) -> 10
A114: =SUM(A113+1) -> 112 | B114: Brad Milder | O114: 10 | P114: 531 | Q114: 17 | R114: 915 | Y114: 4 | Z114: 227 | AE114: =SUM(C114+E114+G114+I114+K114+M114+O114+Q114+S114+U114+W114+Y114+AA114+AC114) -> 31 | AF114: =SUM(D114+F114+H114+J114+L114+N114+P114+R114+T114+V114+X114+Z114+AB114+AD114) -> 1673 | AG114: =SUM(AF114/AE114) -> 53.967741935483872 | AH114: =ROUNDDOWN(((AG114-50)*0.8),0) -> 3
A115: =SUM(A114+1) -> 113 | B115: Corey Philips | M115: 14 | N115: 847 | O115: 17 | P115: 1008 | AE115: =SUM(C115+E115+G115+I115+K115+M115+O115+Q115+S115+U115+W115+Y115+AA115+AC115) -> 31 | AF115: =SUM(D115+F115+H115+J115+L115+N115+P115+R115+T115+V115+X115+Z115+AB115+AD115) -> 1855 | AG115: =SUM(AF115/AE115) -> 59.838709677419352 | AH115: =ROUNDDOWN(((AG115-50)*0.8),0) -> 7
A116: =SUM(A115+1) -> 114 | B116: Tyson Gosnell* | C116: 21 | D116: 1373 | E116: 3 | F116: 197 | G116: 6 | H116: 385 | I116: 1 | J116: 75 | AE116: =SUM(C116+E116+G116+I116+K116+M116+O116+Q116+S116+U116+W116+Y116+AA116+AC116) -> 31 | AF116: =SUM(D116+F116+H116+J116+L116+N116+P116+R116+T116+V116+X116+Z116+AB116+AD116) -> 2030 | AG116: =SUM(AF116/AE116) -> 65.483870967741936 | AH116: =ROUNDDOWN(((AG116-50)*0.8),0) -> 12
A117: =SUM(A116+1) -> 115 | B117: Brad Pike | M117: 18 | N117: 1265 | S117: 13 | T117: 852 | AE117: =SUM(C117+E117+G117+I117+K117+M117+O117+Q117+S117+U117+W117+Y117+AA117+AC117) -> 31 | AF117: =SUM(D117+F117+H117+J117+L117+N117+P117+R117+T117+V117+X117+Z117+AB117+AD117) -> 2117 | AG117: =SUM(AF117/AE117) -> 68.290322580645167 | AH117: =ROUNDDOWN(((AG117-50)*0.8),0) -> 14
A118: =SUM(A117+1) -> 116 | B118: Adam Karstens | U118: 1 | V118: 54 | W118: 1 | X118: 55 | Y118: 15 | Z118: 816 | AA118: 2 | AB118: 119 | AC118: 10 | AD118: 555 | AE118: =SUM(C118+E118+G118+I118+K118+M118+O118+Q118+S118+U118+W118+Y118+AA118+AC118) -> 29 | AF118: =SUM(D118+F118+H118+J118+L118+N118+P118+R118+T118+V118+X118+Z118+AB118+AD118) -> 1599 | AG118: =SUM(AF118/AE118) -> 55.137931034482762 | AH118: =ROUNDDOWN(((AG118-50)*0.8),0) -> 4
A119: =SUM(A118+1) -> 117 | B119: Brian Cobb | C119: 2 | D119: 126 | E119: 21 | F119: 1367 | G119: 6 | H119: 406 | AE119: =SUM(C119+E119+G119+I119+K119+M119+O119+Q119+S119+U119+W119+Y119+AA119+AC119) -> 29 | AF119: =SUM(D119+F119+H119+J119+L119+N119+P119+R119+T119+V119+X119+Z119+AB119+AD119) -> 1899 | AG119: =SUM(AF119/AE119) -> 65.482758620689651 | AH119: =ROUNDDOWN(((AG119-50)*0.8),0) -> 12
A120: =SUM(A119+1) -> 118 | B120: Greg Friestad | U120: 11 | V120: 607 | W120: 16 | X120: 856 | AA120: 1 | AB120: 59 | AE120: =SUM(C120+E120+G120+I120+K120+M120+O120+Q120+S120+U120+W120+Y120+AA120+AC120) -> 28 | AF120: =SUM(D120+F120+H120+J120+L120+N120+P120+R120+T120+V120+X120+Z120+AB120+AD120) -> 1522 | AG120: =SUM(AF120/AE120) -> 54.357142857142854 | AH120: =ROUNDDOWN(((AG120-50)*0.8),0) -> 3
A121: =SUM(A120+1) -> 119 | B121: Ben Sandell | AA121: 10 | AB121: 644 | AC121: 18 | AD121: 1052 | AE121: =SUM(C121+E121+G121+I121+K121+M121+O121+Q121+S121+U121+W121+Y121+AA121+AC121) -> 28 | AF121: =SUM(D121+F121+H121+J121+L121+N121+P121+R121+T121+V121+X121+Z121+AB121+AD121) -> 1696 | AG121: =SUM(AF121/AE121) -> 60.571428571428569 | AH121: =ROUNDDOWN(((AG121-50)*0.8),0) -> 8
A122: =SUM(A121+1) -> 120 | B122: Joe Grady | Q122: 18 | R122: 1039 | S122: 9 | T122: 503 | AE122: =SUM(C122+E122+G122+I122+K122+M122+O122+Q122+S122+U122+W122+Y122+AA122+AC122) -> 27 | AF122: =SUM(D122+F122+H122+J122+L122+N122+P122+R122+T122+V122+X122+Z122+AB122+AD122) -> 1542 | AG122: =SUM(AF122/AE122) -> 57.111111111111114 | AH122: =ROUNDDOWN(((AG122-50)*0.8),0) -> 5
A123: =SUM(A122+1) -> 121 | B123: Dan Lewis | W123: 13 | X123: 740 | Y123: 4 | Z123: 232 | AA123: 3 | AB123: 180 | AC123: 7 | AD123: 390 | AE123: =SUM(C123+E123+G123+I123+K123+M123+O123+Q123+S123+U123+W123+Y123+AA123+AC123) -> 27 | AF123: =SUM(D123+F123+H123+J123+L123+N123+P123+R123+T123+V123+X123+Z123+AB123+AD123) -> 1542 | AG123: =SUM(AF123/AE123) -> 57.111111111111114 | AH123: =ROUNDDOWN(((AG123-50)*0.8),0) -> 5
A124: =SUM(A123+1) -> 122 | B124: Greg Dye | W124: 1 | X124: 53 | Y124: 8 | Z124: 438 | AC124: 17 | AD124: 923 | AE124: =SUM(C124+E124+G124+I124+K124+M124+O124+Q124+S124+U124+W124+Y124+AA124+AC124) -> 26 | AF124: =SUM(D124+F124+H124+J124+L124+N124+P124+R124+T124+V124+X124+Z124+AB124+AD124) -> 1414 | AG124: =SUM(AF124/AE124) -> 54.384615384615387 | AH124: =ROUNDDOWN(((AG124-50)*0.8),0) -> 3
A125: =SUM(A124+1) -> 123 | B125: Archie Coulter | U125: 1 | V125: 58 | AA125: 18 | AB125: 1073 | AC125: 7 | AD125: 387 | AE125: =SUM(C125+E125+G125+I125+K125+M125+O125+Q125+S125+U125+W125+Y125+AA125+AC125) -> 26 | AF125: =SUM(D125+F125+H125+J125+L125+N125+P125+R125+T125+V125+X125+Z125+AB125+AD125) -> 1518 | AG125: =SUM(AF125/AE125) -> 58.384615384615387 | AH125: =ROUNDDOWN(((AG125-50)*0.8),0) -> 6
A126: =SUM(A125+1) -> 124 | B126: Mike Cameron* | G126: 14 | H126: 993 | I126: 12 | J126: 808 | AE126: =SUM(C126+E126+G126+I126+K126+M126+O126+Q126+S126+U126+W126+Y126+AA126+AC126) -> 26 | AF126: =SUM(D126+F126+H126+J126+L126+N126+P126+R126+T126+V126+X126+Z126+AB126+AD126) -> 1801 | AG126: =SUM(AF126/AE126) -> 69.269230769230774 | AH126: =ROUNDDOWN(((AG126-50)*0.8),0) -> 15
A127: =SUM(A126+1) -> 125 | B127: Jason Stroud | S127: 4 | T127: 219 | U127: 18 | V127: 980 | Y127: 3 | Z127: 170 | AE127: =SUM(C127+E127+G127+I127+K127+M127+O127+Q127+S127+U127+W127+Y127+AA127+AC127) -> 25 | AF127: =SUM(D127+F127+H127+J127+L127+N127+P127+R127+T127+V127+X127+Z127+AB127+AD127) -> 1369 | AG127: =SUM(AF127/AE127) -> 54.760 | AH127: =ROUNDDOWN(((AG127-50)*0.8),0) -> 3
A128: =SUM(A127+1) -> 126 | B128: Jeff "Peds" Petoletti | M128: 17 | N128: 1266 | O128: 8 | P128: 549 | AE128: =SUM(C128+E128+G128+I128+K128+M128+O128+Q128+S128+U128+W128+Y128+AA128+AC128) -> 25 | AF128: =SUM(D128+F128+H128+J128+L128+N128+P128+R128+T128+V128+X128+Z128+AB128+AD128) -> 1815 | AG128: =SUM(AF128/AE128) -> 72.600 | AH128: =ROUNDDOWN(((AG128-50)*0.8),0) -> 18
A129: =SUM(A128+1) -> 127 | B129: Matt Ross* | U129: 2 | V129: 116 | W129: 17 | X129: 930 | Y129: 5 | Z129: 299 | AE129: =SUM(C129+E129+G129+I129+K129+M129+O129+Q129+S129+U129+W129+Y129+AA129+AC129) -> 24 | AF129: =SUM(D129+F129+H129+J129+L129+N129+P129+R129+T129+V129+X129+Z129+AB129+AD129) -> 1345 | AG129: =SUM(AF129/AE129) -> 56.041666666666664 | AH129: =ROUNDDOWN(((AG129-50)*0.8),0) -> 4
A130: =SUM(A129+1) -> 128 | B130: Charlie Dobberstein | Q130: 18 | R130: 1041 | S130: 3 | T130: 158 | U130: 1 | V130: 53 | W130: 2 | X130: 112 | AE130: =SUM(C130+E130+G130+I130+K130+M130+O130+Q130+S130+U130+W130+Y130+AA130+AC130) -> 24 | AF130: =SUM(D130+F130+H130+J130+L130+N130+P130+R130+T130+V130+X130+Z130+AB130+AD130) -> 1364 | AG130: =SUM(AF130/AE130) -> 56.833333333333336 | AH130: =ROUNDDOWN(((AG130-50)*0.8),0) -> 5
A131: =SUM(A130+1) -> 129 | B131: Justin Oldfield | K131: 15 | L131: 1111 | M131: 8 | N131: 620 | AE131: =SUM(C131+E131+G131+I131+K131+M131+O131+Q131+S131+U131+W131+Y131+AA131+AC131) -> 23 | AF131: =SUM(D131+F131+H131+J131+L131+N131+P131+R131+T131+V131+X131+Z131+AB131+AD131) -> 1731 | AG131: =SUM(AF131/AE131) -> 75.260869565217391 | AH131: =ROUNDDOWN(((AG131-50)*0.8),0) -> 20
A132: =SUM(A131+1) -> 130 | B132: Chad Hein | O132: 19 | P132: 965 | Q132: 2 | R132: 102 | AE132: =SUM(C132+E132+G132+I132+K132+M132+O132+Q132+S132+U132+W132+Y132+AA132+AC132) -> 21 | AF132: =SUM(D132+F132+H132+J132+L132+N132+P132+R132+T132+V132+X132+Z132+AB132+AD132) -> 1067 | AG132: =SUM(AF132/AE132) -> 50.80952380952381 | AH132: =ROUNDDOWN(((AG132-50)*0.8),0) -> 0
A133: =SUM(A132+1) -> 131 | B133: Robb Neubrand | U133: 2 | V133: 108 | Y133: 1 | Z133: 51 | AA133: 18 | AB133: 999 | AE133: =SUM(C133+E133+G133+I133+K133+M133+O133+Q133+S133+U133+W133+Y133+AA133+AC133) -> 21 | AF133: =SUM(D133+F133+H133+J133+L133+N133+P133+R133+T133+V133+X133+Z133+AB133+AD133) -> 1158 | AG133: =SUM(AF133/AE133) -> 55.142857142857146 | AH133: =ROUNDDOWN(((AG133-50)*0.8),0) -> 4
A134: =SUM(A133+1) -> 132 | B134: Chuck Yanda | AA134: 3 | AB134: 165 | AC134: 18 | AD134: 993 | AE134: =SUM(C134+E134+G134+I134+K134+M134+O134+Q134+S134+U134+W134+Y134+AA134+AC134) -> 21 | AF134: =SUM(D134+F134+H134+J134+L134+N134+P134+R134+T134+V134+X134+Z134+AB134+AD134) -> 1158 | AG134: =SUM(AF134/AE134) -> 55.142857142857146 | AH134: =ROUNDDOWN(((AG134-50)*0.8),0) -> 4
A135: =SUM(A134+1) -> 133 | B135: Randy | G135: 17 | H135: 1012 | K135: 3 | L135: 172 | AE135: =SUM(C135+E135+G135+I135+K135+M135+O135+Q135+S135+U135+W135+Y135+AA135+AC135) -> 20 | AF135: =SUM(D135+F135+H135+J135+L135+N135+P135+R135+T135+V135+X135+Z135+AB135+AD135) -> 1184 | AG135: =SUM(AF135/AE135) -> 59.200 | AH135: =ROUNDDOWN(((AG135-50)*0.8),0) -> 7
A136: =SUM(A135+1) -> 134 | B136: Dustin Gaskill | Q136: 5 | R136: 299 | S136: 14 | T136: 845 | U136: 1 | V136: 66 | AE136: =SUM(C136+E136+G136+I136+K136+M136+O136+Q136+S136+U136+W136+Y136+AA136+AC136) -> 20 | AF136: =SUM(D136+F136+H136+J136+L136+N136+P136+R136+T136+V136+X136+Z136+AB136+AD136) -> 1210 | AG136: =SUM(AF136/AE136) -> 60.500 | AH136: =ROUNDDOWN(((AG136-50)*0.8),0) -> 8
A137: =SUM(A136+1) -> 135 | B137: Chase Roberts | O137: 19 | P137: 973 | AE137: =SUM(C137+E137+G137+I137+K137+M137+O137+Q137+S137+U137+W137+Y137+AA137+AC137) -> 19 | AF137: =SUM(D137+F137+H137+J137+L137+N137+P137+R137+T137+V137+X137+Z137+AB137+AD137) -> 973 | AG137: =SUM(AF137/AE137) -> 51.210526315789473 | AH137: =ROUNDDOWN(((AG137-50)*0.8),0) -> 0
A138: =SUM(A137+1) -> 136 | B138: Bob Hernandez | Y138: 1 | Z138: 53 | AA138: 1 | AB138: 56 | AC138: 17 | AD138: 928 | AE138: =SUM(C138+E138+G138+I138+K138+M138+O138+Q138+S138+U138+W138+Y138+AA138+AC138) -> 19 | AF138: =SUM(D138+F138+H138+J138+L138+N138+P138+R138+T138+V138+X138+Z138+AB138+AD138) -> 1037 | AG138: =SUM(AF138/AE138) -> 54.578947368421055 | AH138: =ROUNDDOWN(((AG138-50)*0.8),0) -> 3
A139: =SUM(A138+1) -> 137 | B139: Lon Reilly | O139: 19 | P139: 1050 | AE139: =SUM(C139+E139+G139+I139+K139+M139+O139+Q139+S139+U139+W139+Y139+AA139+AC139) -> 19 | AF139: =SUM(D139+F139+H139+J139+L139+N139+P139+R139+T139+V139+X139+Z139+AB139+AD139) -> 1050 | AG139: =SUM(AF139/AE139) -> 55.263157894736842 | AH139: =ROUNDDOWN(((AG139-50)*0.8),0) -> 4
A140: =SUM(A139+1) -> 138 | B140: John Petrie | M140: 18 | N140: 1093 | S140: 1 | T140: 61 | AE140: =SUM(C140+E140+G140+I140+K140+M140+O140+Q140+S140+U140+W140+Y140+AA140+AC140) -> 19 | AF140: =SUM(D140+F140+H140+J140+L140+N140+P140+R140+T140+V140+X140+Z140+AB140+AD140) -> 1154 | AG140: =SUM(AF140/AE140) -> 60.736842105263158 | AH140: =ROUNDDOWN(((AG140-50)*0.8),0) -> 8
A141: =SUM(A140+1) -> 139 | B141: Tony Ebson | U141: 1 | V141: 60 | AC141: 18 | AD141: 1125 | AE141: =SUM(C141+E141+G141+I141+K141+M141+O141+Q141+S141+U141+W141+Y141+AA141+AC141) -> 19 | AF141: =SUM(D141+F141+H141+J141+L141+N141+P141+R141+T141+V141+X141+Z141+AB141+AD141) -> 1185 | AG141: =SUM(AF141/AE141) -> 62.368421052631582 | AH141: =ROUNDDOWN(((AG141-50)*0.8),0) -> 9
A142: =SUM(A141+1) -> 140 | B142: Chad Goodwin | Y142: 6 | Z142: 410 | AA142: 13 | AB142: 894 | AE142: =SUM(C142+E142+G142+I142+K142+M142+O142+Q142+S142+U142+W142+Y142+AA142+AC142) -> 19 | AF142: =SUM(D142+F142+H142+J142+L142+N142+P142+R142+T142+V142+X142+Z142+AB142+AD142) -> 1304 | AG142: =SUM(AF142/AE142) -> 68.631578947368425 | AH142: =ROUNDDOWN(((AG142-50)*0.8),0) -> 14
A143: =SUM(A142+1) -> 141 | B143: Blake Moel | E143: 19 | F143: 1361 | AE143: =SUM(C143+E143+G143+I143+K143+M143+O143+Q143+S143+U143+W143+Y143+AA143+AC143) -> 19 | AF143: =SUM(D143+F143+H143+J143+L143+N143+P143+R143+T143+V143+X143+Z143+AB143+AD143) -> 1361 | AG143: =SUM(AF143/AE143) -> 71.631578947368425 | AH143: =ROUNDDOWN(((AG143-50)*0.8),0) -> 17
A144: =SUM(A143+1) -> 142 | B144: Dan Kent* | AC144: 18 | AD144: 954 | AE144: =SUM(C144+E144+G144+I144+K144+M144+O144+Q144+S144+U144+W144+Y144+AA144+AC144) -> 18 | AF144: =SUM(D144+F144+H144+J144+L144+N144+P144+R144+T144+V144+X144+Z144+AB144+AD144) -> 954 | AG144: =SUM(AF144/AE144) -> 53.000 | AH144: =ROUNDDOWN(((AG144-50)*0.8),0) -> 2
A145: =SUM(A144+1) -> 143 | B145: Nate Robbins | AC145: 18 | AD145: 957 | AE145: =SUM(C145+E145+G145+I145+K145+M145+O145+Q145+S145+U145+W145+Y145+AA145+AC145) -> 18 | AF145: =SUM(D145+F145+H145+J145+L145+N145+P145+R145+T145+V145+X145+Z145+AB145+AD145) -> 957 | AG145: =SUM(AF145/AE145) -> 53.166666666666664 | AH145: =ROUNDDOWN(((AG145-50)*0.8),0) -> 2
A146: =SUM(A145+1) -> 144 | B146: Ryan Clark | AC146: 18 | AD146: 984 | AE146: =SUM(C146+E146+G146+I146+K146+M146+O146+Q146+S146+U146+W146+Y146+AA146+AC146) -> 18 | AF146: =SUM(D146+F146+H146+J146+L146+N146+P146+R146+T146+V146+X146+Z146+AB146+AD146) -> 984 | AG146: =SUM(AF146/AE146) -> 54.666666666666664 | AH146: =ROUNDDOWN(((AG146-50)*0.8),0) -> 3
A147: =SUM(A146+1) -> 145 | B147: Dan Ferch | U147: 18 | V147: 1006 | AE147: =SUM(C147+E147+G147+I147+K147+M147+O147+Q147+S147+U147+W147+Y147+AA147+AC147) -> 18 | AF147: =SUM(D147+F147+H147+J147+L147+N147+P147+R147+T147+V147+X147+Z147+AB147+AD147) -> 1006 | AG147: =SUM(AF147/AE147) -> 55.888888888888886 | AH147: =ROUNDDOWN(((AG147-50)*0.8),0) -> 4
A148: =SUM(A147+1) -> 146 | B148: Andrew Hamer | U148: 18 | V148: 1028 | AE148: =SUM(C148+E148+G148+I148+K148+M148+O148+Q148+S148+U148+W148+Y148+AA148+AC148) -> 18 | AF148: =SUM(D148+F148+H148+J148+L148+N148+P148+R148+T148+V148+X148+Z148+AB148+AD148) -> 1028 | AG148: =SUM(AF148/AE148) -> 57.111111111111114 | AH148: =ROUNDDOWN(((AG148-50)*0.8),0) -> 5
A149: =SUM(A148+1) -> 147 | B149: Josh McFarland | AC149: 18 | AD149: 1031 | AE149: =SUM(C149+E149+G149+I149+K149+M149+O149+Q149+S149+U149+W149+Y149+AA149+AC149) -> 18 | AF149: =SUM(D149+F149+H149+J149+L149+N149+P149+R149+T149+V149+X149+Z149+AB149+AD149) -> 1031 | AG149: =SUM(AF149/AE149) -> 57.277777777777779 | AH149: =ROUNDDOWN(((AG149-50)*0.8),0) -> 5
A150: =SUM(A149+1) -> 148 | B150: Perry Thirtyacre | Y150: 1 | Z150: 62 | AA150: 17 | AB150: 975 | AE150: =SUM(C150+E150+G150+I150+K150+M150+O150+Q150+S150+U150+W150+Y150+AA150+AC150) -> 18 | AF150: =SUM(D150+F150+H150+J150+L150+N150+P150+R150+T150+V150+X150+Z150+AB150+AD150) -> 1037 | AG150: =SUM(AF150/AE150) -> 57.611111111111114 | AH150: =ROUNDDOWN(((AG150-50)*0.8),0) -> 6
A151: =SUM(A150+1) -> 149 | B151: Andy Moel | G151: 18 | H151: 1082 | AE151: =SUM(C151+E151+G151+I151+K151+M151+O151+Q151+S151+U151+W151+Y151+AA151+AC151) -> 18 | AF151: =SUM(D151+F151+H151+J151+L151+N151+P151+R151+T151+V151+X151+Z151+AB151+AD151) -> 1082 | AG151: =SUM(AF151/AE151) -> 60.111111111111114 | AH151: =ROUNDDOWN(((AG151-50)*0.8),0) -> 8
A152: =SUM(A151+1) -> 150 | B152: Kurt Kramer | K152: 18 | L152: 1083 | AE152: =SUM(C152+E152+G152+I152+K152+M152+O152+Q152+S152+U152+W152+Y152+AA152+AC152) -> 18 | AF152: =SUM(D152+F152+H152+J152+L152+N152+P152+R152+T152+V152+X152+Z152+AB152+AD152) -> 1083 | AG152: =SUM(AF152/AE152) -> 60.166666666666664 | AH152: =ROUNDDOWN(((AG152-50)*0.8),0) -> 8
A153: =SUM(A152+1) -> 151 | B153: Matt Pease | U153: 18 | V153: 1089 | AE153: =SUM(C153+E153+G153+I153+K153+M153+O153+Q153+S153+U153+W153+Y153+AA153+AC153) -> 18 | AF153: =SUM(D153+F153+H153+J153+L153+N153+P153+R153+T153+V153+X153+Z153+AB153+AD153) -> 1089 | AG153: =SUM(AF153/AE153) -> 60.500 | AH153: =ROUNDDOWN(((AG153-50)*0.8),0) -> 8
A154: =SUM(A153+1) -> 152 | B154: Pat Cutsforth | AC154: 18 | AD154: 1113 | AE154: =SUM(C154+E154+G154+I154+K154+M154+O154+Q154+S154+U154+W154+Y154+AA154+AC154) -> 18 | AF154: =SUM(D154+F154+H154+J154+L154+N154+P154+R154+T154+V154+X154+Z154+AB154+AD154) -> 1113 | AG154: =SUM(AF154/AE154) -> 61.833333333333336 | AH154: =ROUNDDOWN(((AG154-50)*0.8),0) -> 9
A155: =SUM(A154+1) -> 153 | B155: Strad Docterman | U155: 18 | V155: 1148 | AE155: =SUM(C155+E155+G155+I155+K155+M155+O155+Q155+S155+U155+W155+Y155+AA155+AC155) -> 18 | AF155: =SUM(D155+F155+H155+J155+L155+N155+P155+R155+T155+V155+X155+Z155+AB155+AD155) -> 1148 | AG155: =SUM(AF155/AE155) -> 63.777777777777779 | AH155: =ROUNDDOWN(((AG155-50)*0.8),0) -> 11
A156: =SUM(A155+1) -> 154 | B156: Ben Greco | G156: 18 | H156: 1161 | AE156: =SUM(C156+E156+G156+I156+K156+M156+O156+Q156+S156+U156+W156+Y156+AA156+AC156) -> 18 | AF156: =SUM(D156+F156+H156+J156+L156+N156+P156+R156+T156+V156+X156+Z156+AB156+AD156) -> 1161 | AG156: =SUM(AF156/AE156) -> 64.500 | AH156: =ROUNDDOWN(((AG156-50)*0.8),0) -> 11
A157: =SUM(A156+1) -> 155 | B157: John Lambert | Y157: 18 | Z157: 1181 | AE157: =SUM(C157+E157+G157+I157+K157+M157+O157+Q157+S157+U157+W157+Y157+AA157+AC157) -> 18 | AF157: =SUM(D157+F157+H157+J157+L157+N157+P157+R157+T157+V157+X157+Z157+AB157+AD157) -> 1181 | AG157: =SUM(AF157/AE157) -> 65.611111111111114 | AH157: =ROUNDDOWN(((AG157-50)*0.8),0) -> 12
A158: =SUM(A157+1) -> 156 | B158: Matt Whitlock | AC158: 17 | AD158: 1118 | AE158: =SUM(C158+E158+G158+I158+K158+M158+O158+Q158+S158+U158+W158+Y158+AA158+AC158) -> 17 | AF158: =SUM(D158+F158+H158+J158+L158+N158+P158+R158+T158+V158+X158+Z158+AB158+AD158) -> 1118 | AG158: =SUM(AF158/AE158) -> 65.764705882352942 | AH158: =ROUNDDOWN(((AG158-50)*0.8),0) -> 12
A159: =SUM(A158+1) -> 157 | B159: Chuck Hansen | W159: 17 | X159: 1030 | AE159: =SUM(C159+E159+G159+I159+K159+M159+O159+Q159+S159+U159+W159+Y159+AA159+AC159) -> 17 | AF159: =SUM(D159+F159+H159+J159+L159+N159+P159+R159+T159+V159+X159+Z159+AB159+AD159) -> 1030 | AG159: =SUM(AF159/AE159) -> 60.588235294117645 | AH159: =ROUNDDOWN(((AG159-50)*0.8),0) -> 8
A160: =SUM(A159+1) -> 158 | B160: Bridgette Rew | U160: 17 | V160: 1170 | AE160: =SUM(C160+E160+G160+I160+K160+M160+O160+Q160+S160+U160+W160+Y160+AA160+AC160) -> 17 | AF160: =SUM(D160+F160+H160+J160+L160+N160+P160+R160+T160+V160+X160+Z160+AB160+AD160) -> 1170 | AG160: =SUM(AF160/AE160) -> 68.82352941176471 | AH160: =ROUNDDOWN(((AG160-50)*0.8),0) -> 15
A161: =SUM(A160+1) -> 159 | B161: Clint Loonan | O161: 17 | P161: 980 | AE161: =SUM(C161+E161+G161+I161+K161+M161+O161+Q161+S161+U161+W161+Y161+AA161+AC161) -> 17 | AF161: =SUM(D161+F161+H161+J161+L161+N161+P161+R161+T161+V161+X161+Z161+AB161+AD161) -> 980 | AG161: =SUM(AF161/AE161) -> 57.647058823529413 | AH161: =ROUNDDOWN(((AG161-50)*0.8),0) -> 6
A162: =SUM(A161+1) -> 160 | B162: Nate Elbert | O162: 17 | P162: 1061 | AE162: =SUM(C162+E162+G162+I162+K162+M162+O162+Q162+S162+U162+W162+Y162+AA162+AC162) -> 17 | AF162: =SUM(D162+F162+H162+J162+L162+N162+P162+R162+T162+V162+X162+Z162+AB162+AD162) -> 1061 | AG162: =SUM(AF162/AE162) -> 62.411764705882355 | AH162: =ROUNDDOWN(((AG162-50)*0.8),0) -> 9
A163: =SUM(A162+1) -> 161 | B163: Ross Welter | O163: 17 | P163: 1124 | AE163: =SUM(C163+E163+G163+I163+K163+M163+O163+Q163+S163+U163+W163+Y163+AA163+AC163) -> 17 | AF163: =SUM(D163+F163+H163+J163+L163+N163+P163+R163+T163+V163+X163+Z163+AB163+AD163) -> 1124 | AG163: =SUM(AF163/AE163) -> 66.117647058823536 | AH163: =ROUNDDOWN(((AG163-50)*0.8),0) -> 12
A164: =SUM(A163+1) -> 162 | B164: Joe French | AC164: 16 | AD164: 855 | AE164: =SUM(C164+E164+G164+I164+K164+M164+O164+Q164+S164+U164+W164+Y164+AA164+AC164) -> 16 | AF164: =SUM(D164+F164+H164+J164+L164+N164+P164+R164+T164+V164+X164+Z164+AB164+AD164) -> 855 | AG164: =SUM(AF164/AE164) -> 53.4375 | AH164: =ROUNDDOWN(((AG164-50)*0.8),0) -> 2
A165: =SUM(A164+1) -> 163 | B165: Tony Rios | AA165: 3 | AB165: 182 | AC165: 13 | AD165: 752 | AE165: =SUM(C165+E165+G165+I165+K165+M165+O165+Q165+S165+U165+W165+Y165+AA165+AC165) -> 16 | AF165: =SUM(D165+F165+H165+J165+L165+N165+P165+R165+T165+V165+X165+Z165+AB165+AD165) -> 934 | AG165: =SUM(AF165/AE165) -> 58.375 | AH165: =ROUNDDOWN(((AG165-50)*0.8),0) -> 6
A166: =SUM(A165+1) -> 164 | B166: Trevor Dickerson | W166: 16 | X166: 961 | AE166: =SUM(C166+E166+G166+I166+K166+M166+O166+Q166+S166+U166+W166+Y166+AA166+AC166) -> 16 | AF166: =SUM(D166+F166+H166+J166+L166+N166+P166+R166+T166+V166+X166+Z166+AB166+AD166) -> 961 | AG166: =SUM(AF166/AE166) -> 60.0625 | AH166: =ROUNDDOWN(((AG166-50)*0.8),0) -> 8
A167: =SUM(A166+1) -> 165 | B167: Scott Lindsley | S167: 13 | T167: 724 | U167: 3 | V167: 165 | AE167: =SUM(C167+E167+G167+I167+K167+M167+O167+Q167+S167+U167+W167+Y167+AA167+AC167) -> 16 | AF167: =SUM(D167+F167+H167+J167+L167+N167+P167+R167+T167+V167+X167+Z167+AB167+AD167) -> 889 | AG167: =SUM(AF167/AE167) -> 55.5625 | AH167: =ROUNDDOWN(((AG167-50)*0.8),0) -> 4
A168: =SUM(A167+1) -> 166 | B168: David Brown | S168: 16 | T168: 960 | AE168: =SUM(C168+E168+G168+I168+K168+M168+O168+Q168+S168+U168+W168+Y168+AA168+AC168) -> 16 | AF168: =SUM(D168+F168+H168+J168+L168+N168+P168+R168+T168+V168+X168+Z168+AB168+AD168) -> 960 | AG168: =SUM(AF168/AE168) -> 60.000 | AH168: =ROUNDDOWN(((AG168-50)*0.8),0) -> 8
A169: =SUM(A168+1) -> 167 | B169: Jim Necessary | Y169: 15 | Z169: 805 | AE169: =SUM(C169+E169+G169+I169+K169+M169+O169+Q169+S169+U169+W169+Y169+AA169+AC169) -> 15 | AF169: =SUM(D169+F169+H169+J169+L169+N169+P169+R169+T169+V169+X169+Z169+AB169+AD169) -> 805 | AG169: =SUM(AF169/AE169) -> 53.666666666666664 | AH169: =ROUNDDOWN(((AG169-50)*0.8),0) -> 2
A170: =SUM(A169+1) -> 168 | B170: Mike O'neill | Y170: 15 | Z170: 921 | AE170: =SUM(C170+E170+G170+I170+K170+M170+O170+Q170+S170+U170+W170+Y170+AA170+AC170) -> 15 | AF170: =SUM(D170+F170+H170+J170+L170+N170+P170+R170+T170+V170+X170+Z170+AB170+AD170) -> 921 | AG170: =SUM(AF170/AE170) -> 61.400 | AH170: =ROUNDDOWN(((AG170-50)*0.8),0) -> 9
A171: =SUM(A170+1) -> 169 | B171: Seth Marling | S171: 14 | T171: 849 | AE171: =SUM(C171+E171+G171+I171+K171+M171+O171+Q171+S171+U171+W171+Y171+AA171+AC171) -> 14 | AF171: =SUM(D171+F171+H171+J171+L171+N171+P171+R171+T171+V171+X171+Z171+AB171+AD171) -> 849 | AG171: =SUM(AF171/AE171) -> 60.642857142857146 | AH171: =ROUNDDOWN(((AG171-50)*0.8),0) -> 8
A172: =SUM(A171+1) -> 170 | B172: Nathan Johnson | O172: 3 | P172: 175 | Q172: 10 | R172: 549 | AE172: =SUM(C172+E172+G172+I172+K172+M172+O172+Q172+S172+U172+W172+Y172+AA172+AC172) -> 13 | AF172: =SUM(D172+F172+H172+J172+L172+N172+P172+R172+T172+V172+X172+Z172+AB172+AD172) -> 724 | AG172: =SUM(AF172/AE172) -> 55.692307692307693 | AH172: =ROUNDDOWN(((AG172-50)*0.8),0) -> 4
A173: =SUM(A172+1) -> 171 | B173: Nate Lenzini | M173: 13 | N173: 809 | AE173: =SUM(C173+E173+G173+I173+K173+M173+O173+Q173+S173+U173+W173+Y173+AA173+AC173) -> 13 | AF173: =SUM(D173+F173+H173+J173+L173+N173+P173+R173+T173+V173+X173+Z173+AB173+AD173) -> 809 | AG173: =SUM(AF173/AE173) -> 62.230769230769234 | AH173: =ROUNDDOWN(((AG173-50)*0.8),0) -> 9
A174: =SUM(A173+1) -> 172 | B174: Jack Gilmore | Q174: 9 | R174: 512 | U174: 1 | V174: 52 | AC174: 2 | AD174: 115 | AE174: =SUM(C174+E174+G174+I174+K174+M174+O174+Q174+S174+U174+W174+Y174+AA174+AC174) -> 12 | AF174: =SUM(D174+F174+H174+J174+L174+N174+P174+R174+T174+V174+X174+Z174+AB174+AD174) -> 679 | AG174: =SUM(AF174/AE174) -> 56.583333333333336 | AH174: =ROUNDDOWN(((AG174-50)*0.8),0) -> 5
A175: =SUM(A174+1) -> 173 | B175: Chris Bentler | G175: 11 | H175: 620 | I175: 1 | J175: 53 | AE175: =SUM(C175+E175+G175+I175+K175+M175+O175+Q175+S175+U175+W175+Y175+AA175+AC175) -> 12 | AF175: =SUM(D175+F175+H175+J175+L175+N175+P175+R175+T175+V175+X175+Z175+AB175+AD175) -> 673 | AG175: =SUM(AF175/AE175) -> 56.083333333333336 | AH175: =ROUNDDOWN(((AG175-50)*0.8),0) -> 4
A176: =SUM(A175+1) -> 174 | B176: Zach Votroubeck | W176: 7 | X176: 431 | Y176: 4 | Z176: 282 | AE176: =SUM(C176+E176+G176+I176+K176+M176+O176+Q176+S176+U176+W176+Y176+AA176+AC176) -> 11 | AF176: =SUM(D176+F176+H176+J176+L176+N176+P176+R176+T176+V176+X176+Z176+AB176+AD176) -> 713 | AG176: =SUM(AF176/AE176) -> 64.818181818181813 | AH176: =ROUNDDOWN(((AG176-50)*0.8),0) -> 11
A177: =SUM(A176+1) -> 175 | B177: Craig | G177: 6 | H177: 356 | I177: 5 | J177: 295 | AE177: =SUM(C177+E177+G177+I177+K177+M177+O177+Q177+S177+U177+W177+Y177+AA177+AC177) -> 11 | AF177: =SUM(D177+F177+H177+J177+L177+N177+P177+R177+T177+V177+X177+Z177+AB177+AD177) -> 651 | AG177: =SUM(AF177/AE177) -> 59.18181818181818 | AH177: =ROUNDDOWN(((AG177-50)*0.8),0) -> 7
A178: =SUM(A177+1) -> 176 | B178: Al | C178: 11 | D178: 809 | AE178: =SUM(C178+E178+G178+I178+K178+M178+O178+Q178+S178+U178+W178+Y178+AA178+AC178) -> 11 | AF178: =SUM(D178+F178+H178+J178+L178+N178+P178+R178+T178+V178+X178+Z178+AB178+AD178) -> 809 | AG178: =SUM(AF178/AE178) -> 73.545454545454547 | AH178: =ROUNDDOWN(((AG178-50)*0.8),0) -> 18
A179: =SUM(A178+1) -> 177 | B179: Lyle Theisen | S179: 10 | T179: 718 | AE179: =SUM(C179+E179+G179+I179+K179+M179+O179+Q179+S179+U179+W179+Y179+AA179+AC179) -> 10 | AF179: =SUM(D179+F179+H179+J179+L179+N179+P179+R179+T179+V179+X179+Z179+AB179+AD179) -> 718 | AG179: =SUM(AF179/AE179) -> 71.800 | AH179: =ROUNDDOWN(((AG179-50)*0.8),0) -> 17
A180: =SUM(A179+1) -> 178 | B180: Aaron Killion | Y180: 9 | Z180: 520 | AE180: =SUM(C180+E180+G180+I180+K180+M180+O180+Q180+S180+U180+W180+Y180+AA180+AC180) -> 9 | AF180: =SUM(D180+F180+H180+J180+L180+N180+P180+R180+T180+V180+X180+Z180+AB180+AD180) -> 520 | AG180: =SUM(AF180/AE180) -> 57.777777777777779 | AH180: =ROUNDDOWN(((AG180-50)*0.8),0) -> 6
A181: =SUM(A180+1) -> 179 | B181: Brian Points | K181: 9 | L181: 633 | AE181: =SUM(C181+E181+G181+I181+K181+M181+O181+Q181+S181+U181+W181+Y181+AA181+AC181) -> 9 | AF181: =SUM(D181+F181+H181+J181+L181+N181+P181+R181+T181+V181+X181+Z181+AB181+AD181) -> 633 | AG181: =SUM(AF181/AE181) -> 70.333333333333329 | AH181: =ROUNDDOWN(((AG181-50)*0.8),0) -> 16
A182: =SUM(A181+1) -> 180 | B182: Kidwell | G182: 9 | H182: 552 | AE182: =SUM(C182+E182+G182+I182+K182+M182+O182+Q182+S182+U182+W182+Y182+AA182+AC182) -> 9 | AF182: =SUM(D182+F182+H182+J182+L182+N182+P182+R182+T182+V182+X182+Z182+AB182+AD182) -> 552 | AG182: =SUM(AF182/AE182) -> 61.333333333333336 | AH182: =ROUNDDOWN(((AG182-50)*0.8),0) -> 9
A183: =SUM(A182+1) -> 181 | B183: Chris Farnsworth | W183: 8 | X183: 507 | AE183: =SUM(C183+E183+G183+I183+K183+M183+O183+Q183+S183+U183+W183+Y183+AA183+AC183) -> 8 | AF183: =SUM(D183+F183+H183+J183+L183+N183+P183+R183+T183+V183+X183+Z183+AB183+AD183) -> 507 | AG183: =SUM(AF183/AE183) -> 63.375 | AH183: =ROUNDDOWN(((AG183-50)*0.8),0) -> 10
A184: =SUM(A183+1) -> 182 | B184: Doug Knepp | S184: 2 | T184: 131 | U184: 6 | V184: 390 | AE184: =SUM(C184+E184+G184+I184+K184+M184+O184+Q184+S184+U184+W184+Y184+AA184+AC184) -> 8 | AF184: =SUM(D184+F184+H184+J184+L184+N184+P184+R184+T184+V184+X184+Z184+AB184+AD184) -> 521 | AG184: =SUM(AF184/AE184) -> 65.125 | AH184: =ROUNDDOWN(((AG184-50)*0.8),0) -> 12
A185: =SUM(A184+1) -> 183 | B185: Nate | G185: 8 | H185: 456 | AE185: =SUM(C185+E185+G185+I185+K185+M185+O185+Q185+S185+U185+W185+Y185+AA185+AC185) -> 8 | AF185: =SUM(D185+F185+H185+J185+L185+N185+P185+R185+T185+V185+X185+Z185+AB185+AD185) -> 456 | AG185: =SUM(AF185/AE185) -> 57.000 | AH185: =ROUNDDOWN(((AG185-50)*0.8),0) -> 5
A186: =SUM(A185+1) -> 184 | B186: Josh Spang | S186: 1 | T186: 55 | W186: 1 | X186: 49 | AC186: 5 | AD186: 264 | AE186: =SUM(C186+E186+G186+I186+K186+M186+O186+Q186+S186+U186+W186+Y186+AA186+AC186) -> 7 | AF186: =SUM(D186+F186+H186+J186+L186+N186+P186+R186+T186+V186+X186+Z186+AB186+AD186) -> 368 | AG186: =SUM(AF186/AE186) -> 52.571428571428569 | AH186: =ROUNDDOWN(((AG186-50)*0.8),0) -> 2
A187: =SUM(A186+1) -> 185 | B187: Steve Lepeltak | S187: 7 | T187: 539 | AE187: =SUM(C187+E187+G187+I187+K187+M187+O187+Q187+S187+U187+W187+Y187+AA187+AC187) -> 7 | AF187: =SUM(D187+F187+H187+J187+L187+N187+P187+R187+T187+V187+X187+Z187+AB187+AD187) -> 539 | AG187: =SUM(AF187/AE187) -> 77.000 | AH187: =ROUNDDOWN(((AG187-50)*0.8),0) -> 21
A188: =SUM(A187+1) -> 186 | B188: Jason Baxter | S188: 7 | T188: 560 | AE188: =SUM(C188+E188+G188+I188+K188+M188+O188+Q188+S188+U188+W188+Y188+AA188+AC188) -> 7 | AF188: =SUM(D188+F188+H188+J188+L188+N188+P188+R188+T188+V188+X188+Z188+AB188+AD188) -> 560 | AG188: =SUM(AF188/AE188) -> 80.000 | AH188: =ROUNDDOWN(((AG188-50)*0.8),0) -> 24
A189: =SUM(A188+1) -> 187 | B189: "Btch'n" | M189: 1 | N189: 60 | Q189: 6 | R189: 348 | AE189: =SUM(C189+E189+G189+I189+K189+M189+O189+Q189+S189+U189+W189+Y189+AA189+AC189) -> 7 | AF189: =SUM(D189+F189+H189+J189+L189+N189+P189+R189+T189+V189+X189+Z189+AB189+AD189) -> 408 | AG189: =SUM(AF189/AE189) -> 58.285714285714285 | AH189: =ROUNDDOWN(((AG189-50)*0.8),0) -> 6
A190: =SUM(A189+1) -> 188 | B190: Abel | G190: 7 | H190: 419 | AE190: =SUM(C190+E190+G190+I190+K190+M190+O190+Q190+S190+U190+W190+Y190+AA190+AC190) -> 7 | AF190: =SUM(D190+F190+H190+J190+L190+N190+P190+R190+T190+V190+X190+Z190+AB190+AD190) -> 419 | AG190: =SUM(AF190/AE190) -> 59.857142857142854 | AH190: =ROUNDDOWN(((AG190-50)*0.8),0) -> 7
A191: =SUM(A190+1) -> 189 | B191: Aaron Porter | W191: 2 | X191: 133 | Y191: 4 | Z191: 263 | AE191: =SUM(C191+E191+G191+I191+K191+M191+O191+Q191+S191+U191+W191+Y191+AA191+AC191) -> 6 | AF191: =SUM(D191+F191+H191+J191+L191+N191+P191+R191+T191+V191+X191+Z191+AB191+AD191) -> 396 | AG191: =SUM(AF191/AE191) -> 66.000 | AH191: =ROUNDDOWN(((AG191-50)*0.8),0) -> 12
A192: =SUM(A191+1) -> 190 | B192: Cassie Shear | O192: 2 | P192: 125 | S192: 4 | T192: 241 | AE192: =SUM(C192+E192+G192+I192+K192+M192+O192+Q192+S192+U192+W192+Y192+AA192+AC192) -> 6 | AF192: =SUM(D192+F192+H192+J192+L192+N192+P192+R192+T192+V192+X192+Z192+AB192+AD192) -> 366 | AG192: =SUM(AF192/AE192) -> 61.000 | AH192: =ROUNDDOWN(((AG192-50)*0.8),0) -> 8
A193: =SUM(A192+1) -> 191 | B193: Clay Abernathy | Q193: 6 | R193: 305 | AE193: =SUM(C193+E193+G193+I193+K193+M193+O193+Q193+S193+U193+W193+Y193+AA193+AC193) -> 6 | AF193: =SUM(D193+F193+H193+J193+L193+N193+P193+R193+T193+V193+X193+Z193+AB193+AD193) -> 305 | AG193: =SUM(AF193/AE193) -> 50.833333333333336 | AH193: =ROUNDDOWN(((AG193-50)*0.8),0) -> 0
A194: =SUM(A193+1) -> 192 | B194: Chrs Timko | Q194: 6 | R194: 343 | AE194: =SUM(C194+E194+G194+I194+K194+M194+O194+Q194+S194+U194+W194+Y194+AA194+AC194) -> 6 | AF194: =SUM(D194+F194+H194+J194+L194+N194+P194+R194+T194+V194+X194+Z194+AB194+AD194) -> 343 | AG194: =SUM(AF194/AE194) -> 57.166666666666664 | AH194: =ROUNDDOWN(((AG194-50)*0.8),0) -> 5
A195: =SUM(A194+1) -> 193 | B195: Aaron Gaddis | I195: 6 | J195: 429 | AE195: =SUM(C195+E195+G195+I195+K195+M195+O195+Q195+S195+U195+W195+Y195+AA195+AC195) -> 6 | AF195: =SUM(D195+F195+H195+J195+L195+N195+P195+R195+T195+V195+X195+Z195+AB195+AD195) -> 429 | AG195: =SUM(AF195/AE195) -> 71.500 | AH195: =ROUNDDOWN(((AG195-50)*0.8),0) -> 17
A196: =SUM(A195+1) -> 194 | B196: Lance Hansen | G196: 6 | H196: 296 | AE196: =SUM(C196+E196+G196+I196+K196+M196+O196+Q196+S196+U196+W196+Y196+AA196+AC196) -> 6 | AF196: =SUM(D196+F196+H196+J196+L196+N196+P196+R196+T196+V196+X196+Z196+AB196+AD196) -> 296 | AG196: =SUM(AF196/AE196) -> 49.333333333333336 | AH196: =ROUNDDOWN(((AG196-50)*0.8),0) -> 0
A197: =SUM(A196+1) -> 195 | B197: Dustin Snodgress | AC197: 5 | AD197: 314 | AE197: =SUM(C197+E197+G197+I197+K197+M197+O197+Q197+S197+U197+W197+Y197+AA197+AC197) -> 5 | AF197: =SUM(D197+F197+H197+J197+L197+N197+P197+R197+T197+V197+X197+Z197+AB197+AD197) -> 314 | AG197: =SUM(AF197/AE197) -> 62.800 | AH197: =ROUNDDOWN(((AG197-50)*0.8),0) -> 10
A198: =SUM(A197+1) -> 196 | B198: Eric VanDeusen | U198: 4 | V198: 257 | Y198: 1 | Z198: 58 | AE198: =SUM(C198+E198+G198+I198+K198+M198+O198+Q198+S198+U198+W198+Y198+AA198+AC198) -> 5 | AF198: =SUM(D198+F198+H198+J198+L198+N198+P198+R198+T198+V198+X198+Z198+AB198+AD198) -> 315 | AG198: =SUM(AF198/AE198) -> 63.000 | AH198: =ROUNDDOWN(((AG198-50)*0.8),0) -> 10
A199: =SUM(A198+1) -> 197 | B199: "Mepo" | M199: 4 | N199: 268 | W199: 1 | X199: 64 | AE199: =SUM(C199+E199+G199+I199+K199+M199+O199+Q199+S199+U199+W199+Y199+AA199+AC199) -> 5 | AF199: =SUM(D199+F199+H199+J199+L199+N199+P199+R199+T199+V199+X199+Z199+AB199+AD199) -> 332 | AG199: =SUM(AF199/AE199) -> 66.400 | AH199: =ROUNDDOWN(((AG199-50)*0.8),0) -> 13
A200: =SUM(A199+1) -> 198 | B200: Kurtis Kron | U200: 5 | V200: 332 | AE200: =SUM(C200+E200+G200+I200+K200+M200+O200+Q200+S200+U200+W200+Y200+AA200+AC200) -> 5 | AF200: =SUM(D200+F200+H200+J200+L200+N200+P200+R200+T200+V200+X200+Z200+AB200+AD200) -> 332 | AG200: =SUM(AF200/AE200) -> 66.400 | AH200: =ROUNDDOWN(((AG200-50)*0.8),0) -> 13
A201: =SUM(A200+1) -> 199 | B201: Bobby Jo | M201: 5 | N201: 414 | AE201: =SUM(C201+E201+G201+I201+K201+M201+O201+Q201+S201+U201+W201+Y201+AA201+AC201) -> 5 | AF201: =SUM(D201+F201+H201+J201+L201+N201+P201+R201+T201+V201+X201+Z201+AB201+AD201) -> 414 | AG201: =SUM(AF201/AE201) -> 82.800 | AH201: =ROUNDDOWN(((AG201-50)*0.8),0) -> 26
A202: =SUM(A201+1) -> 200 | B202: Steve H. | G202: 3 | H202: 193 | I202: 2 | J202: 128 | AE202: =SUM(C202+E202+G202+I202+K202+M202+O202+Q202+S202+U202+W202+Y202+AA202+AC202) -> 5 | AF202: =SUM(D202+F202+H202+J202+L202+N202+P202+R202+T202+V202+X202+Z202+AB202+AD202) -> 321 | AG202: =SUM(AF202/AE202) -> 64.200 | AH202: =ROUNDDOWN(((AG202-50)*0.8),0) -> 11
A203: =SUM(A202+1) -> 201 | B203: Mickey | G203: 5 | H203: 315 | AE203: =SUM(C203+E203+G203+I203+K203+M203+O203+Q203+S203+U203+W203+Y203+AA203+AC203) -> 5 | AF203: =SUM(D203+F203+H203+J203+L203+N203+P203+R203+T203+V203+X203+Z203+AB203+AD203) -> 315 | AG203: =SUM(AF203/AE203) -> 63.000 | AH203: =ROUNDDOWN(((AG203-50)*0.8),0) -> 10
A204: =SUM(A203+1) -> 202 | B204: Sills | AC204: 4 | AD204: 238 | AE204: =SUM(C204+E204+G204+I204+K204+M204+O204+Q204+S204+U204+W204+Y204+AA204+AC204) -> 4 | AF204: =SUM(D204+F204+H204+J204+L204+N204+P204+R204+T204+V204+X204+Z204+AB204+AD204) -> 238 | AG204: =SUM(AF204/AE204) -> 59.500
A205: =SUM(A204+1) -> 203 | B205: Craig Eastin | AA205: 3 | AB205: 176 | AC205: 1 | AD205: 65 | AE205: =SUM(C205+E205+G205+I205+K205+M205+O205+Q205+S205+U205+W205+Y205+AA205+AC205) -> 4 | AF205: =SUM(D205+F205+H205+J205+L205+N205+P205+R205+T205+V205+X205+Z205+AB205+AD205) -> 241 | AG205: =SUM(AF205/AE205) -> 60.250 | AH205: =ROUNDDOWN(((AG205-50)*0.8),0) -> 8
A206: =SUM(A205+1) -> 204 | B206: Wade Geary | W206: 1 | X206: 53 | Y206: 3 | Z206: 179 | AE206: =SUM(C206+E206+G206+I206+K206+M206+O206+Q206+S206+U206+W206+Y206+AA206+AC206) -> 4 | AF206: =SUM(D206+F206+H206+J206+L206+N206+P206+R206+T206+V206+X206+Z206+AB206+AD206) -> 232 | AG206: =SUM(AF206/AE206) -> 58.000 | AH206: =ROUNDDOWN(((AG206-50)*0.8),0) -> 6
A207: =SUM(A206+1) -> 205 | B207: Jeni Zeiser | S207: 4 | T207: 395 | AE207: =SUM(C207+E207+G207+I207+K207+M207+O207+Q207+S207+U207+W207+Y207+AA207+AC207) -> 4 | AF207: =SUM(D207+F207+H207+J207+L207+N207+P207+R207+T207+V207+X207+Z207+AB207+AD207) -> 395 | AG207: =SUM(AF207/AE207) -> 98.750 | AH207: =ROUNDDOWN(((AG207-50)*0.8),0) -> 39
A208: =SUM(A207+1) -> 206 | B208: Joel Crow | K208: 3 | L208: 175 | Q208: 1 | R208: 59 | AE208: =SUM(C208+E208+G208+I208+K208+M208+O208+Q208+S208+U208+W208+Y208+AA208+AC208) -> 4 | AF208: =SUM(D208+F208+H208+J208+L208+N208+P208+R208+T208+V208+X208+Z208+AB208+AD208) -> 234 | AG208: =SUM(AF208/AE208) -> 58.500 | AH208: =ROUNDDOWN(((AG208-50)*0.8),0) -> 6
A209: =SUM(A208+1) -> 207 | B209: Jeane H. | M209: 4 | N209: 266 | AE209: =SUM(C209+E209+G209+I209+K209+M209+O209+Q209+S209+U209+W209+Y209+AA209+AC209) -> 4 | AF209: =SUM(D209+F209+H209+J209+L209+N209+P209+R209+T209+V209+X209+Z209+AB209+AD209) -> 266 | AG209: =SUM(AF209/AE209) -> 66.500 | AH209: =ROUNDDOWN(((AG209-50)*0.8),0) -> 13
A210: =SUM(A209+1) -> 208 | B210: Tony Hobel | AC210: 3 | AD210: 173 | AE210: =SUM(C210+E210+G210+I210+K210+M210+O210+Q210+S210+U210+W210+Y210+AA210+AC210) -> 3 | AF210: =SUM(D210+F210+H210+J210+L210+N210+P210+R210+T210+V210+X210+Z210+AB210+AD210) -> 173 | AG210: =SUM(AF210/AE210) -> 57.666666666666664 | AH210: =ROUNDDOWN(((AG210-50)*0.8),0) -> 6
A211: =SUM(A210+1) -> 209 | B211: Caleb Richer | AC211: 3 | AD211: 180 | AE211: =SUM(C211+E211+G211+I211+K211+M211+O211+Q211+S211+U211+W211+Y211+AA211+AC211) -> 3 | AF211: =SUM(D211+F211+H211+J211+L211+N211+P211+R211+T211+V211+X211+Z211+AB211+AD211) -> 180 | AG211: =SUM(AF211/AE211) -> 60.000 | AH211: =ROUNDDOWN(((AG211-50)*0.8),0) -> 8
A212: =SUM(A211+1) -> 210 | B212: Kerri Haught | AC212: 3 | AD212: 183 | AE212: =SUM(C212+E212+G212+I212+K212+M212+O212+Q212+S212+U212+W212+Y212+AA212+AC212) -> 3 | AF212: =SUM(D212+F212+H212+J212+L212+N212+P212+R212+T212+V212+X212+Z212+AB212+AD212) -> 183 | AG212: =SUM(AF212/AE212) -> 61.000 | AH212: =ROUNDDOWN(((AG212-50)*0.8),0) -> 8
A213: =SUM(A212+1) -> 211 | B213: Nic Gordon | AC213: 3 | AD213: 184 | AE213: =SUM(C213+E213+G213+I213+K213+M213+O213+Q213+S213+U213+W213+Y213+AA213+AC213) -> 3 | AF213: =SUM(D213+F213+H213+J213+L213+N213+P213+R213+T213+V213+X213+Z213+AB213+AD213) -> 184 | AG213: =SUM(AF213/AE213) -> 61.333333333333336 | AH213: =ROUNDDOWN(((AG213-50)*0.8),0) -> 9
A214: =SUM(A213+1) -> 212 | B214: Nate Hamilton | Y214: 1 | Z214: 57 | AA214: 2 | AB214: 119 | AE214: =SUM(C214+E214+G214+I214+K214+M214+O214+Q214+S214+U214+W214+Y214+AA214+AC214) -> 3 | AF214: =SUM(D214+F214+H214+J214+L214+N214+P214+R214+T214+V214+X214+Z214+AB214+AD214) -> 176 | AG214: =SUM(AF214/AE214) -> 58.666666666666664 | AH214: =ROUNDDOWN(((AG214-50)*0.8),0) -> 6
A215: =SUM(A214+1) -> 213 | B215: Nick Cole | Y215: 3 | Z215: 197 | AE215: =SUM(C215+E215+G215+I215+K215+M215+O215+Q215+S215+U215+W215+Y215+AA215+AC215) -> 3 | AF215: =SUM(D215+F215+H215+J215+L215+N215+P215+R215+T215+V215+X215+Z215+AB215+AD215) -> 197 | AG215: =SUM(AF215/AE215) -> 65.666666666666671 | AH215: =ROUNDDOWN(((AG215-50)*0.8),0) -> 12
A216: =SUM(A215+1) -> 214 | B216: Chase Norton | W216: 2 | X216: 118 | Y216: 1 | Z216: 54 | AE216: =SUM(C216+E216+G216+I216+K216+M216+O216+Q216+S216+U216+W216+Y216+AA216+AC216) -> 3 | AF216: =SUM(D216+F216+H216+J216+L216+N216+P216+R216+T216+V216+X216+Z216+AB216+AD216) -> 172 | AG216: =SUM(AF216/AE216) -> 57.333333333333336 | AH216: =ROUNDDOWN(((AG216-50)*0.8),0) -> 5
A217: =SUM(A216+1) -> 215 | B217: Cody Green | U217: 3 | V217: 171 | AE217: =SUM(C217+E217+G217+I217+K217+M217+O217+Q217+S217+U217+W217+Y217+AA217+AC217) -> 3 | AF217: =SUM(D217+F217+H217+J217+L217+N217+P217+R217+T217+V217+X217+Z217+AB217+AD217) -> 171 | AG217: =SUM(AF217/AE217) -> 57.000 | AH217: =ROUNDDOWN(((AG217-50)*0.8),0) -> 5
A218: =SUM(A217+1) -> 216 | B218: Tom Hashman | U218: 3 | V218: 192 | AE218: =SUM(C218+E218+G218+I218+K218+M218+O218+Q218+S218+U218+W218+Y218+AA218+AC218) -> 3 | AF218: =SUM(D218+F218+H218+J218+L218+N218+P218+R218+T218+V218+X218+Z218+AB218+AD218) -> 192 | AG218: =SUM(AF218/AE218) -> 64.000 | AH218: =ROUNDDOWN(((AG218-50)*0.8),0) -> 11
A219: =SUM(A218+1) -> 217 | B219: Jenny Robertson | S219: 3 | T219: 219 | AE219: =SUM(C219+E219+G219+I219+K219+M219+O219+Q219+S219+U219+W219+Y219+AA219+AC219) -> 3 | AF219: =SUM(D219+F219+H219+J219+L219+N219+P219+R219+T219+V219+X219+Z219+AB219+AD219) -> 219 | AG219: =SUM(AF219/AE219) -> 73.000 | AH219: =ROUNDDOWN(((AG219-50)*0.8),0) -> 18
A220: =SUM(A219+1) -> 218 | B220: Steven Crow | K220: 3 | L220: 162 | AE220: =SUM(C220+E220+G220+I220+K220+M220+O220+Q220+S220+U220+W220+Y220+AA220+AC220) -> 3 | AF220: =SUM(D220+F220+H220+J220+L220+N220+P220+R220+T220+V220+X220+Z220+AB220+AD220) -> 162 | AG220: =SUM(AF220/AE220) -> 54.000 | AH220: =ROUNDDOWN(((AG220-50)*0.8),0) -> 3
A221: =SUM(A220+1) -> 219 | B221: Johnny Walker | AC221: 2 | AD221: 122 | AE221: =SUM(C221+E221+G221+I221+K221+M221+O221+Q221+S221+U221+W221+Y221+AA221+AC221) -> 2 | AF221: =SUM(D221+F221+H221+J221+L221+N221+P221+R221+T221+V221+X221+Z221+AB221+AD221) -> 122 | AG221: =SUM(AF221/AE221) -> 61.000 | AH221: =ROUNDDOWN(((AG221-50)*0.8),0) -> 8
A222: =SUM(A221+1) -> 220 | B222: Matt Snyder | AC222: 2 | AD222: 162 | AE222: =SUM(C222+E222+G222+I222+K222+M222+O222+Q222+S222+U222+W222+Y222+AA222+AC222) -> 2 | AF222: =SUM(D222+F222+H222+J222+L222+N222+P222+R222+T222+V222+X222+Z222+AB222+AD222) -> 162 | AG222: =SUM(AF222/AE222) -> 81.000 | AH222: =ROUNDDOWN(((AG222-50)*0.8),0) -> 24
A223: =SUM(A222+1) -> 221 | B223: Dave Peyton | Q223: 1 | R223: 64 | AC223: 1 | AD223: 56 | AE223: =SUM(C223+E223+G223+I223+K223+M223+O223+Q223+S223+U223+W223+Y223+AA223+AC223) -> 2 | AF223: =SUM(D223+F223+H223+J223+L223+N223+P223+R223+T223+V223+X223+Z223+AB223+AD223) -> 120 | AG223: =SUM(AF223/AE223) -> 60.000 | AH223: =ROUNDDOWN(((AG223-50)*0.8),0) -> 8
A224: =SUM(A223+1) -> 222 | B224: Darwin Schultz | Y224: 2 | Z224: 118 | AE224: =SUM(C224+E224+G224+I224+K224+M224+O224+Q224+S224+U224+W224+Y224+AA224+AC224) -> 2 | AF224: =SUM(D224+F224+H224+J224+L224+N224+P224+R224+T224+V224+X224+Z224+AB224+AD224) -> 118 | AG224: =SUM(AF224/AE224) -> 59.000 | AH224: =ROUNDDOWN(((AG224-50)*0.8),0) -> 7
A225: =SUM(A224+1) -> 223 | B225: John Calahan | Y225: 2 | Z225: 137 | AE225: =SUM(C225+E225+G225+I225+K225+M225+O225+Q225+S225+U225+W225+Y225+AA225+AC225) -> 2 | AF225: =SUM(D225+F225+H225+J225+L225+N225+P225+R225+T225+V225+X225+Z225+AB225+AD225) -> 137 | AG225: =SUM(AF225/AE225) -> 68.500 | AH225: =ROUNDDOWN(((AG225-50)*0.8),0) -> 14
A226: =SUM(A225+1) -> 224 | B226: TJ Nanke | W226: 2 | X226: 113 | AE226: =SUM(C226+E226+G226+I226+K226+M226+O226+Q226+S226+U226+W226+Y226+AA226+AC226) -> 2 | AF226: =SUM(D226+F226+H226+J226+L226+N226+P226+R226+T226+V226+X226+Z226+AB226+AD226) -> 113 | AG226: =SUM(AF226/AE226) -> 56.500 | AH226: =ROUNDDOWN(((AG226-50)*0.8),0) -> 5
A227: =SUM(A226+1) -> 225 | B227: Justin Harris | W227: 2 | X227: 119 | AE227: =SUM(C227+E227+G227+I227+K227+M227+O227+Q227+S227+U227+W227+Y227+AA227+AC227) -> 2 | AF227: =SUM(D227+F227+H227+J227+L227+N227+P227+R227+T227+V227+X227+Z227+AB227+AD227) -> 119 | AG227: =SUM(AF227/AE227) -> 59.500 | AH227: =ROUNDDOWN(((AG227-50)*0.8),0) -> 7
A228: =SUM(A227+1) -> 226 | B228: Jake Alheid | U228: 2 | V228: 129 | AE228: =SUM(C228+E228+G228+I228+K228+M228+O228+Q228+S228+U228+W228+Y228+AA228+AC228) -> 2 | AF228: =SUM(D228+F228+H228+J228+L228+N228+P228+R228+T228+V228+X228+Z228+AB228+AD228) -> 129 | AG228: =SUM(AF228/AE228) -> 64.500 | AH228: =ROUNDDOWN(((AG228-50)*0.8),0) -> 11
A229: =SUM(A228+1) -> 227 | B229: Brandon Sheer | S229: 2 | T229: 122 | AE229: =SUM(C229+E229+G229+I229+K229+M229+O229+Q229+S229+U229+W229+Y229+AA229+AC229) -> 2 | AF229: =SUM(D229+F229+H229+J229+L229+N229+P229+R229+T229+V229+X229+Z229+AB229+AD229) -> 122 | AG229: =SUM(AF229/AE229) -> 61.000 | AH229: =ROUNDDOWN(((AG229-50)*0.8),0) -> 8
A230: =SUM(A229+1) -> 228 | B230: John McClellan | S230: 2 | T230: 129 | AE230: =SUM(C230+E230+G230+I230+K230+M230+O230+Q230+S230+U230+W230+Y230+AA230+AC230) -> 2 | AF230: =SUM(D230+F230+H230+J230+L230+N230+P230+R230+T230+V230+X230+Z230+AB230+AD230) -> 129 | AG230: =SUM(AF230/AE230) -> 64.500 | AH230: =ROUNDDOWN(((AG230-50)*0.8),0) -> 11
A231: =SUM(A230+1) -> 229 | B231: Chad Kawami | M231: 2 | N231: 107 | AE231: =SUM(C231+E231+G231+I231+K231+M231+O231+Q231+S231+U231+W231+Y231+AA231+AC231) -> 2 | AF231: =SUM(D231+F231+H231+J231+L231+N231+P231+R231+T231+V231+X231+Z231+AB231+AD231) -> 107 | AG231: =SUM(AF231/AE231) -> 53.500 | AH231: =ROUNDDOWN(((AG231-50)*0.8),0) -> 2
A232: =SUM(A231+1) -> 230 | B232: Dave Murphy | M232: 2 | N232: 131 | AE232: =SUM(C232+E232+G232+I232+K232+M232+O232+Q232+S232+U232+W232+Y232+AA232+AC232) -> 2 | AF232: =SUM(D232+F232+H232+J232+L232+N232+P232+R232+T232+V232+X232+Z232+AB232+AD232) -> 131 | AG232: =SUM(AF232/AE232) -> 65.500 | AH232: =ROUNDDOWN(((AG232-50)*0.8),0) -> 12
A233: =SUM(A232+1) -> 231 | B233: Allice "In" Chains Wiley | K233: 2 | L233: 115 | AE233: =SUM(C233+E233+G233+I233+K233+M233+O233+Q233+S233+U233+W233+Y233+AA233+AC233) -> 2 | AF233: =SUM(D233+F233+H233+J233+L233+N233+P233+R233+T233+V233+X233+Z233+AB233+AD233) -> 115 | AG233: =SUM(AF233/AE233) -> 57.500 | AH233: =ROUNDDOWN(((AG233-50)*0.8),0) -> 6
A234: =SUM(A233+1) -> 232 | B234: Miguel-Bowling Green | AC234: 1 | AD234: 52 | AE234: 1 | AF234: 52 | AG234: 52.000
A235: =SUM(A234+1) -> 233 | B235: Brandon Yancey | AC235: 1 | AD235: 52 | AE235: 1 | AF235: 52 | AG235: 52.000
A236: =SUM(A235+1) -> 234 | B236: Aaron? | AC236: 1 | AD236: 53 | AE236: 1 | AF236: 53 | AG236: 53.000
A237: =SUM(A236+1) -> 235 | B237: Mike Williams pdga#2020 | AC237: 1 | AD237: 53 | AE237: =SUM(C237+E237+G237+I237+K237+M237+O237+Q237+S237+U237+W237+Y237+AA237+AC237) -> 1 | AF237: =SUM(D237+F237+H237+J237+L237+N237+P237+R237+T237+V237+X237+Z237+AB237+AD237) -> 53 | AG237: =SUM(AF237/AE237) -> 53.000
A238: =SUM(A237+1) -> 236 | B238: Apollo | AC238: 1 | AD238: 54 | AE238: =SUM(C238+E238+G238+I238+K238+M238+O238+Q238+S238+U238+W238+Y238+AA238+AC238) -> 1 | AF238: =SUM(D238+F238+H238+J238+L238+N238+P238+R238+T238+V238+X238+Z238+AB238+AD238) -> 54 | AG238: =SUM(AF238/AE238) -> 54.000
A239: =SUM(A238+1) -> 237 | B239: Mike Noth | AC239: 1 | AD239: 57 | AE239: =SUM(C239+E239+G239+I239+K239+M239+O239+Q239+S239+U239+W239+Y239+AA239+AC239) -> 1 | AF239: =SUM(D239+F239+H239+J239+L239+N239+P239+R239+T239+V239+X239+Z239+AB239+AD239) -> 57 | AG239: =SUM(AF239/AE239) -> 57.000
A240: =SUM(A239+1) -> 238 | B240: Brian Snyder | AC240: 1 | AD240: 59 | AE240: 1 | AF240: 59 | AG240: 59.000
A241: =SUM(A240+1) -> 239 | B241: Jesse Kirk | AC241: 1 | AD241: 60 | AE241: =SUM(C241+E241+G241+I241+K241+M241+O241+Q241+S241+U241+W241+Y241+AA241+AC241) -> 1 | AF241: =SUM(D241+F241+H241+J241+L241+N241+P241+R241+T241+V241+X241+Z241+AB241+AD241) -> 60 | AG241: =SUM(AF241/AE241) -> 60.000
A242: =SUM(A241+1) -> 240 | B242: Steve Thirtyacre | AA242: 1 | AB242: 56 | AE242: =SUM(C242+E242+G242+I242+K242+M242+O242+Q242+S242+U242+W242+Y242+AA242+AC242) -> 1 | AF242: =SUM(D242+F242+H242+J242+L242+N242+P242+R242+T242+V242+X242+Z242+AB242+AD242) -> 56 | AG242: =SUM(AF242/AE242) -> 56.000
A243: =SUM(A242+1) -> 241 | B243: Pete Henderson | AA243: 1 | AB243: 61 | AE243: =SUM(C243+E243+G243+I243+K243+M243+O243+Q243+S243+U243+W243+Y243+AA243+AC243) -> 1 | AF243: =SUM(D243+F243+H243+J243+L243+N243+P243+R243+T243+V243+X243+Z243+AB243+AD243) -> 61 | AG243: =SUM(AF243/AE243) -> 61.000
A244: =SUM(A243+1) -> 242 | B244: Brent? | AA244: 1 | AB244: 62 | AE244: =SUM(C244+E244+G244+I244+K244+M244+O244+Q244+S244+U244+W244+Y244+AA244+AC244) -> 1 | AF244: =SUM(D244+F244+H244+J244+L244+N244+P244+R244+T244+V244+X244+Z244+AB244+AD244) -> 62 | AG244: =SUM(AF244/AE244) -> 62.000
A245: =SUM(A244+1) -> 243 | B245: Steve Adkinson | AA245: 1 | AB245: 65 | AE245: =SUM(C245+E245+G245+I245+K245+M245+O245+Q245+S245+U245+W245+Y245+AA245+AC245) -> 1 | AF245: =SUM(D245+F245+H245+J245+L245+N245+P245+R245+T245+V245+X245+Z245+AB245+AD245) -> 65 | AG245: =SUM(AF245/AE245) -> 65.000
A246: =SUM(A245+1) -> 244 | B246: Doc | AA246: 1 | AB246: 103 | AE246: =SUM(C246+E246+G246+I246+K246+M246+O246+Q246+S246+U246+W246+Y246+AA246+AC246) -> 1 | AF246: =SUM(D246+F246+H246+J246+L246+N246+P246+R246+T246+V246+X246+Z246+AB246+AD246) -> 103 | AG246: =SUM(AF246/AE246) -> 103.000
A247: =SUM(A246+1) -> 245 | B247: Rob O'Brien | Y247: 1 | Z247: 52 | AE247: =SUM(C247+E247+G247+I247+K247+M247+O247+Q247+S247+U247+W247+Y247+AA247+AC247) -> 1 | AF247: =SUM(D247+F247+H247+J247+L247+N247+P247+R247+T247+V247+X247+Z247+AB247+AD247) -> 52 | AG247: =SUM(AF247/AE247) -> 52.000
A248: =SUM(A247+1) -> 246 | B248: Cody Fuller | Y248: 1 | Z248: 58 | AE248: =SUM(C248+E248+G248+I248+K248+M248+O248+Q248+S248+U248+W248+Y248+AA248+AC248) -> 1 | AF248: =SUM(D248+F248+H248+J248+L248+N248+P248+R248+T248+V248+X248+Z248+AB248+AD248) -> 58 | AG248: =SUM(AF248/AE248) -> 58.000
A249: =SUM(A248+1) -> 247 | B249: Andy Johnson | Y249: 1 | Z249: 58 | AE249: =SUM(C249+E249+G249+I249+K249+M249+O249+Q249+S249+U249+W249+Y249+AA249+AC249) -> 1 | AF249: =SUM(D249+F249+H249+J249+L249+N249+P249+R249+T249+V249+X249+Z249+AB249+AD249) -> 58 | AG249: =SUM(AF249/AE249) -> 58.000
A250: =SUM(A249+1) -> 248 | B250: Joe R | Y250: 1 | Z250: 61 | AE250: =SUM(C250+E250+G250+I250+K250+M250+O250+Q250+S250+U250+W250+Y250+AA250+AC250) -> 1 | AF250: =SUM(D250+F250+H250+J250+L250+N250+P250+R250+T250+V250+X250+Z250+AB250+AD250) -> 61 | AG250: =SUM(AF250/AE250) -> 61.000
A251: =SUM(A250+1) -> 249 | B251: Nate Spencer | Y251: 1 | Z251: 67 | AE251: =SUM(C251+E251+G251+I251+K251+M251+O251+Q251+S251+U251+W251+Y251+AA251+AC251) -> 1 | AF251: =SUM(D251+F251+H251+J251+L251+N251+P251+R251+T251+V251+X251+Z251+AB251+AD251) -> 67 | AG251: =SUM(AF251/AE251) -> 67.000
A252: =SUM(A251+1) -> 250 | B252: Matt DaPaepe | Y252: 1 | Z252: 77 | AE252: =SUM(C252+E252+G252+I252+K252+M252+O252+Q252+S252+U252+W252+Y252+AA252+AC252) -> 1 | AF252: =SUM(D252+F252+H252+J252+L252+N252+P252+R252+T252+V252+X252+Z252+AB252+AD252) -> 77 | AG252: =SUM(AF252/AE252) -> 77.000
A253: =SUM(A252+1) -> 251 | B253: Adam Hartig | W253: 1 | X253: 60 | AE253: =SUM(C253+E253+G253+I253+K253+M253+O253+Q253+S253+U253+W253+Y253+AA253+AC253) -> 1 | AF253: =SUM(D253+F253+H253+J253+L253+N253+P253+R253+T253+V253+X253+Z253+AB253+AD253) -> 60 | AG253: =SUM(AF253/AE253) -> 60.000
A254: =SUM(A253+1) -> 252 | B254: T.J. Thurn | U254: 1 | V254: 50 | AE254: =SUM(C254+E254+G254+I254+K254+M254+O254+Q254+S254+U254+W254+Y254+AA254+AC254) -> 1 | AF254: =SUM(D254+F254+H254+J254+L254+N254+P254+R254+T254+V254+X254+Z254+AB254+AD254) -> 50 | AG254: =SUM(AF254/AE254) -> 50.000
A255: =SUM(A254+1) -> 253 | B255: Roland Hesford | U255: 1 | V255: 51 | AE255: =SUM(C255+E255+G255+I255+K255+M255+O255+Q255+S255+U255+W255+Y255+AA255+AC255) -> 1 | AF255: =SUM(D255+F255+H255+J255+L255+N255+P255+R255+T255+V255+X255+Z255+AB255+AD255) -> 51 | AG255: =SUM(AF255/AE255) -> 51.000
A256: =SUM(A255+1) -> 254 | B256: Will Viner | U256: 1 | V256: 56 | AE256: =SUM(C256+E256+G256+I256+K256+M256+O256+Q256+S256+U256+W256+Y256+AA256+AC256) -> 1 | AF256: =SUM(D256+F256+H256+J256+L256+N256+P256+R256+T256+V256+X256+Z256+AB256+AD256) -> 56 | AG256: =SUM(AF256/AE256) -> 56.000
A257: =SUM(A256+1) -> 255 | B257: Dan Mosley | U257: 1 | V257: 56 | AE257: =SUM(C257+E257+G257+I257+K257+M257+O257+Q257+S257+U257+W257+Y257+AA257+AC257) -> 1 | AF257: =SUM(D257+F257+H257+J257+L257+N257+P257+R257+T257+V257+X257+Z257+AB257+AD257) -> 56 | AG257: =SUM(AF257/AE257) -> 56.000
A258: =SUM(A257+1) -> 256 | B258: Eli Ostby | U258: 1 | V258: 58 | AE258: =SUM(C258+E258+G258+I258+K258+M258+O258+Q258+S258+U258+W258+Y258+AA258+AC258) -> 1 | AF258: =SUM(D258+F258+H258+J258+L258+N258+P258+R258+T258+V258+X258+Z258+AB258+AD258) -> 58 | AG258: =SUM(AF258/AE258) -> 58.000
A259: =SUM(A258+1) -> 257 | B259: Mark Ramsey | S259: 1 | T259: 59 | AE259: =SUM(C259+E259+G259+I259+K259+M259+O259+Q259+S259+U259+W259+Y259+AA259+AC259) -> 1 | AF259: =SUM(D259+F259+H259+J259+L259+N259+P259+R259+T259+V259+X259+Z259+AB259+AD259) -> 59 | AG259: =SUM(AF259/AE259) -> 59.000
A260: =SUM(A259+1) -> 258 | B260: Floyd Campbell | S260: 1 | T260: 70 | AE260: =SUM(C260+E260+G260+I260+K260+M260+O260+Q260+S260+U260+W260+Y260+AA260+AC260) -> 1 | AF260: =SUM(D260+F260+H260+J260+L260+N260+P260+R260+T260+V260+X260+Z260+AB260+AD260) -> 70 | AG260: =SUM(AF260/AE260) -> 70.000
A261: =SUM(A260+1) -> 259 | B261: Naph Rediger | S261: 1 | T261: 71 | AE261: =SUM(C261+E261+G261+I261+K261+M261+O261+Q261+S261+U261+W261+Y261+AA261+AC261) -> 1 | AF261: =SUM(D261+F261+H261+J261+L261+N261+P261+R261+T261+V261+X261+Z261+AB261+AD261) -> 71 | AG261: =SUM(AF261/AE261) -> 71.000
A262: =SUM(A261+1) -> 260 | B262: Jason Steffen | Q262: 1 | R262: 49 | AE262: =SUM(C262+E262+G262+I262+K262+M262+O262+Q262+S262+U262+W262+Y262+AA262+AC262) -> 1 | AF262: =SUM(D262+F262+H262+J262+L262+N262+P262+R262+T262+V262+X262+Z262+AB262+AD262) -> 49 | AG262: =SUM(AF262/AE262) -> 49.000
A263: =SUM(A262+1) -> 261 | B263: Tony Philips | Q263: 1 | R263: 53 | AE263: =SUM(C263+E263+G263+I263+K263+M263+O263+Q263+S263+U263+W263+Y263+AA263+AC263) -> 1 | AF263: =SUM(D263+F263+H263+J263+L263+N263+P263+R263+T263+V263+X263+Z263+AB263+AD263) -> 53 | AG263: =SUM(AF263/AE263) -> 53.000
A264: =SUM(A263+1) -> 262 | B264: Craig Fender | Q264: 1 | R264: 54 | AE264: =SUM(C264+E264+G264+I264+K264+M264+O264+Q264+S264+U264+W264+Y264+AA264+AC264) -> 1 | AF264: =SUM(D264+F264+H264+J264+L264+N264+P264+R264+T264+V264+X264+Z264+AB264+AD264) -> 54 | AG264: =SUM(AF264/AE264) -> 54.000
A265: =SUM(A264+1) -> 263 | B265: BJ Beckman | Q265: 1 | R265: 61 | AE265: =SUM(C265+E265+G265+I265+K265+M265+O265+Q265+S265+U265+W265+Y265+AA265+AC265) -> 1 | AF265: =SUM(D265+F265+H265+J265+L265+N265+P265+R265+T265+V265+X265+Z265+AB265+AD265) -> 61 | AG265: =SUM(AF265/AE265) -> 61.000
A266: =SUM(A265+1) -> 264 | B266: Adam Smith | Q266: 1 | R266: 61 | AE266: =SUM(C266+E266+G266+I266+K266+M266+O266+Q266+S266+U266+W266+Y266+AA266+AC266) -> 1 | AF266: =SUM(D266+F266+H266+J266+L266+N266+P266+R266+T266+V266+X266+Z266+AB266+AD266) -> 61 | AG266: =SUM(AF266/AE266) -> 61.000
A267: =SUM(A266+1) -> 265 | B267: Rob Posekany | Q267: 1 | R267: 63 | AE267: =SUM(C267+E267+G267+I267+K267+M267+O267+Q267+S267+U267+W267+Y267+AA267+AC267) -> 1 | AF267: =SUM(D267+F267+H267+J267+L267+N267+P267+R267+T267+V267+X267+Z267+AB267+AD267) -> 63 | AG267: =SUM(AF267/AE267) -> 63.000
A268: =SUM(A267+1) -> 266 | B268: Dave Swinford | Q268: 1 | R268: 68 | AE268: =SUM(C268+E268+G268+I268+K268+M268+O268+Q268+S268+U268+W268+Y268+AA268+AC268) -> 1 | AF268: =SUM(D268+F268+H268+J268+L268+N268+P268+R268+T268+V268+X268+Z268+AB268+AD268) -> 68 | AG268: =SUM(AF268/AE268) -> 68.000
A269: =SUM(A268+1) -> 267 | B269: Scott Ream | O269: 1 | P269: 45 | AE269: =SUM(C269+E269+G269+I269+K269+M269+O269+Q269+S269+U269+W269+Y269+AA269+AC269) -> 1 | AF269: =SUM(D269+F269+H269+J269+L269+N269+P269+R269+T269+V269+X269+Z269+AB269+AD269) -> 45 | AG269: =SUM(AF269/AE269) -> 45.000
A270: =SUM(A269+1) -> 268 | B270: Mike Baines | O270: 1 | P270: 58 | AE270: =SUM(C270+E270+G270+I270+K270+M270+O270+Q270+S270+U270+W270+Y270+AA270+AC270) -> 1 | AF270: =SUM(D270+F270+H270+J270+L270+N270+P270+R270+T270+V270+X270+Z270+AB270+AD270) -> 58 | AG270: =SUM(AF270/AE270) -> 58.000
A271: =SUM(A270+1) -> 269 | B271: Chuckles | O271: 1 | P271: 74 | AE271: =SUM(C271+E271+G271+I271+K271+M271+O271+Q271+S271+U271+W271+Y271+AA271+AC271) -> 1 | AF271: =SUM(D271+F271+H271+J271+L271+N271+P271+R271+T271+V271+X271+Z271+AB271+AD271) -> 74 | AG271: =SUM(AF271/AE271) -> 74.000
A272: =SUM(A271+1) -> 270 | B272: Trace Landess | O272: 1 | P272: 95 | AE272: =SUM(C272+E272+G272+I272+K272+M272+O272+Q272+S272+U272+W272+Y272+AA272+AC272) -> 1 | AF272: =SUM(D272+F272+H272+J272+L272+N272+P272+R272+T272+V272+X272+Z272+AB272+AD272) -> 95 | AG272: =SUM(AF272/AE272) -> 95.000
A273: =SUM(A272+1) -> 271 | B273: Jon Foley | M273: 1 | N273: 57 | AE273: =SUM(C273+E273+G273+I273+K273+M273+O273+Q273+S273+U273+W273+Y273+AA273+AC273) -> 1 | AF273: =SUM(D273+F273+H273+J273+L273+N273+P273+R273+T273+V273+X273+Z273+AB273+AD273) -> 57 | AG273: =SUM(AF273/AE273) -> 57.000
A274: =SUM(A273+1) -> 272 | B274: Justin Mager | G274: 1 | H274: 53 | AE274: =SUM(C274+E274+G274+I274+K274+M274+O274+Q274+S274+U274+W274+Y274+AA274+AC274) -> 1 | AF274: =SUM(D274+F274+H274+J274+L274+N274+P274+R274+T274+V274+X274+Z274+AB274+AD274) -> 53 | AG274: =SUM(AF274/AE274) -> 53.000
B275: red = Champion
B276: * = Multiple Championships
B277: * = Hall of Fame