A1: SBDGL CAREER ROUND/STROKE/AVERAGE/HANDICAP HISTORY
A2: PLAYER | C2: 2000 | D2: Strokes | E2: 2001 | F2: Strokes | G2: 2002 | H2: Strokes | I2: 2003 | J2: Strokes | K2: 2004 | L2: Stokes | M2: 2005 | N2: Strokes | O2: 2006 | P2: Strokes | Q2: 2007 | R2: Strokes | S2: 2008 | T2: Strokes | U2: 2009 | V2: Strokes | W2: 2010 | X2: Strokes | Y2: ROUNDS | Z2: STROKES | AA2: AVG | AB2: H-Cap
A3: 1 | B3: Jesse Streinz** | E3: 13 | F3: 718 | G3: 18 | H3: 979 | I3: 18 | J3: 956 | K3: 18 | L3: 1008 | M3: 18 | N3: 976 | O3: 19 | P3: 1028 | Q3: 18 | R3: 1036 | S3: 17 | T3: 930 | U3: 18 | V3: 992 | W3: 18 | X3: 1003 | Y3: =SUM(C3+E3+G3+I3+K3+M3+O3+Q3+S3+U3+W3) -> 175 | Z3: =SUM(D3+F3+H3+J3+L3+N3+P3+R3+T3+V3+X3) -> 9626 | AA3: =SUM(Z3/Y3) -> 55.005714285714284 | AB3: =ROUNDDOWN(((AA3-50)*0.8),0) -> 4
A4: 2 | B4: Greco | E4: 3 | F4: 167 | G4: 18 | H4: 1031 | I4: 18 | J4: 974 | K4: 18 | L4: 972 | M4: 18 | N4: 961 | O4: 19 | P4: 1002 | Q4: 17 | R4: 917 | S4: 18 | T4: 963 | U4: 18 | V4: 935 | W4: 18 | X4: 906 | Y4: =SUM(C4+E4+G4+I4+K4+M4+O4+Q4+S4+U4+W4) -> 165 | Z4: =SUM(D4+F4+H4+J4+L4+N4+P4+R4+T4+V4+X4) -> 8828 | AA4: =SUM(Z4/Y4) -> 53.5030303030303 | AB4: =ROUNDDOWN(((AA4-50)*0.8),0) -> 2
A5: 3 | B5: Joe "Cool" Wiley* | C5: 21 | D5: 1214 | E5: 22 | F5: 1220 | G5: 18 | H5: 1013 | I5: 18 | J5: 960 | K5: 18 | L5: 973 | M5: 17 | N5: 955 | O5: 6 | P5: 331 | Q5: 18 | R5: 1002 | S5: 12 | T5: 684 | U5: 1 | V5: 64 | W5: 1 | X5: 56 | Y5: =SUM(C5+E5+G5+I5+K5+M5+O5+Q5+S5+U5+W5) -> 152 | Z5: =SUM(D5+F5+H5+J5+L5+N5+P5+R5+T5+V5+X5) -> 8472 | AA5: =SUM(Z5/Y5) -> 55.736842105263158 | AB5: =ROUNDDOWN(((AA5-50)*0.8),0) -> 4
A6: 4 | B6: D. Burns | E6: 3 | F6: 179 | G6: 18 | H6: 1148 | I6: 17 | J6: 1045 | K6: 15 | L6: 911 | M6: 17 | N6: 1010 | O6: 18 | P6: 1083 | Q6: 18 | R6: 1084 | S6: 18 | T6: 1041 | U6: 6 | V6: 353 | W6: 17 | X6: 989 | Y6: =SUM(C6+E6+G6+I6+K6+M6+O6+Q6+S6+U6+W6) -> 147 | Z6: =SUM(D6+F6+H6+J6+L6+N6+P6+R6+T6+V6+X6) -> 8843 | AA6: =SUM(Z6/Y6) -> 60.156462585034014 | AB6: =ROUNDDOWN(((AA6-50)*0.8),0) -> 8
A7: 5 | B7: Woody** | I7: 18 | J7: 1084 | K7: 18 | L7: 1032 | M7: 18 | N7: 1018 | O7: 19 | P7: 1045 | Q7: 18 | R7: 992 | S7: 18 | T7: 938 | U7: 18 | V7: 961 | W7: 18 | X7: 957 | Y7: =SUM(C7+E7+G7+I7+K7+M7+O7+Q7+S7+U7+W7) -> 145 | Z7: =SUM(D7+F7+H7+J7+L7+N7+P7+R7+T7+V7+X7) -> 8027 | AA7: =SUM(Z7/Y7) -> 55.358620689655176 | AB7: =ROUNDDOWN(((AA7-50)*0.8),0) -> 4
A8: 6 | B8: Josh Beachy* | I8: 18 | J8: 1050 | K8: 18 | L8: 1029 | M8: 18 | N8: 998 | O8: 18 | P8: 997 | Q8: 18 | R8: 1038 | S8: 18 | T8: 975 | U8: 18 | V8: 983 | W8: 18 | X8: 981 | Y8: =SUM(C8+E8+G8+I8+K8+M8+O8+Q8+S8+U8+W8) -> 144 | Z8: =SUM(D8+F8+H8+J8+L8+N8+P8+R8+T8+V8+X8) -> 8051 | AA8: =SUM(Z8/Y8) -> 55.909722222222221 | AB8: =ROUNDDOWN(((AA8-50)*0.8),0) -> 4
A9: =SUM(A8+1) -> 7 | B9: Farley | I9: 18 | J9: 1140 | K9: 18 | L9: 1118 | M9: 18 | N9: 1070 | O9: 18 | P9: 1055 | Q9: 17 | R9: 1022 | S9: 17 | T9: 1020 | U9: 17 | V9: 1000 | W9: 18 | X9: 1039 | Y9: =SUM(C9+E9+G9+I9+K9+M9+O9+Q9+S9+U9+W9) -> 141 | Z9: =SUM(D9+F9+H9+J9+L9+N9+P9+R9+T9+V9+X9) -> 8464 | AA9: =SUM(Z9/Y9) -> 60.028368794326241 | AB9: =ROUNDDOWN(((AA9-50)*0.8),0) -> 8
A10: =SUM(A9+1) -> 8 | B10: Joel Knutson* | I10: 14 | J10: 803 | K10: 18 | L10: 1034 | M10: 17 | N10: 937 | O10: 18 | P10: 991 | Q10: 18 | R10: 1021 | S10: 18 | T10: 948 | U10: 18 | V10: 978 | W10: 18 | X10: 979 | Y10: =SUM(C10+E10+G10+I10+K10+M10+O10+Q10+S10+U10+W10) -> 139 | Z10: =SUM(D10+F10+H10+J10+L10+N10+P10+R10+T10+V10+X10) -> 7691 | AA10: =SUM(Z10/Y10) -> 55.330935251798564 | AB10: =ROUNDDOWN(((AA10-50)*0.8),0) -> 4
A11: =SUM(A10+1) -> 9 | B11: Jamie Gray | G11: 4 | H11: 233 | I11: 18 | J11: 1046 | K11: 18 | L11: 1056 | M11: 15 | N11: 864 | O11: 17 | P11: 998 | Q11: 17 | R11: 1011 | S11: 17 | T11: 989 | U11: 16 | V11: 956 | Y11: =SUM(C11+E11+G11+I11+K11+M11+O11+Q11+S11+U11+W11) -> 122 | Z11: =SUM(D11+F11+H11+J11+L11+N11+P11+R11+T11+V11+X11) -> 7153 | AA11: =SUM(Z11/Y11) -> 58.631147540983605 | AB11: =ROUNDDOWN(((AA11-50)*0.8),0) -> 6
A12: =SUM(A11+1) -> 10 | B12: Stiers | I12: 1 | J12: 59 | K12: 17 | L12: 940 | M12: 18 | N12: 1021 | O12: 19 | P12: 1066 | Q12: 17 | R12: 962 | S12: 15 | T12: 803 | U12: 18 | V12: 974 | W12: 16 | X12: 873 | Y12: =SUM(C12+E12+G12+I12+K12+M12+O12+Q12+S12+U12+W12) -> 121 | Z12: =SUM(D12+F12+H12+J12+L12+N12+P12+R12+T12+V12+X12) -> 6698 | AA12: =SUM(Z12/Y12) -> 55.355371900826448 | AB12: =ROUNDDOWN(((AA12-50)*0.8),0) -> 4
A13: =SUM(A12+1) -> 11 | B13: Dustin Utley | K13: 16 | L13: 974 | M13: 16 | N13: 915 | O13: 18 | P13: 989 | Q13: 17 | R13: 968 | S13: 18 | T13: 1012 | U13: 18 | V13: 1015 | W13: 18 | X13: 957 | Y13: =SUM(C13+E13+G13+I13+K13+M13+O13+Q13+S13+U13+W13) -> 121 | Z13: =SUM(D13+F13+H13+J13+L13+N13+P13+R13+T13+V13+X13) -> 6830 | AA13: =SUM(Z13/Y13) -> 56.446280991735534 | AB13: =ROUNDDOWN(((AA13-50)*0.8),0) -> 5
A14: =SUM(A13+1) -> 12 | B14: Super Dave* | K14: 18 | L14: 1062 | M14: 18 | N14: 1013 | O14: 19 | P14: 1040 | Q14: 18 | R14: 1026 | S14: 18 | T14: 997 | U14: 14 | V14: 805 | W14: 9 | X14: 510 | Y14: =SUM(C14+E14+G14+I14+K14+M14+O14+Q14+S14+U14+W14) -> 114 | Z14: =SUM(D14+F14+H14+J14+L14+N14+P14+R14+T14+V14+X14) -> 6453 | AA14: =SUM(Z14/Y14) -> 56.60526315789474 | AB14: =ROUNDDOWN(((AA14-50)*0.8),0) -> 5
A15: =SUM(A14+1) -> 13 | B15: Jeremy Prouty* | K15: 15 | L15: 1056 | M15: 16 | N15: 1058 | O15: 17 | P15: 1099 | Q15: 18 | R15: 1132 | S15: 15 | T15: 970 | U15: 17 | V15: 1016 | W15: 11 | X15: 656 | Y15: =SUM(C15+E15+G15+I15+K15+M15+O15+Q15+S15+U15+W15) -> 109 | Z15: =SUM(D15+F15+H15+J15+L15+N15+P15+R15+T15+V15+X15) -> 6987 | AA15: =SUM(Z15/Y15) -> 64.100917431192656 | AB15: =ROUNDDOWN(((AA15-50)*0.8),0) -> 11
A16: =SUM(A15+1) -> 14 | B16: Matt "Frog" Geers | K16: 16 | L16: 936 | M16: 14 | N16: 836 | O16: 19 | P16: 1091 | Q16: 17 | R16: 950 | S16: 17 | T16: 906 | U16: 13 | V16: 721 | W16: 13 | X16: 734 | Y16: =SUM(C16+E16+G16+I16+K16+M16+O16+Q16+S16+U16+W16) -> 109 | Z16: =SUM(D16+F16+H16+J16+L16+N16+P16+R16+T16+V16+X16) -> 6174 | AA16: =SUM(Z16/Y16) -> 56.642201834862384 | AB16: =ROUNDDOWN(((AA16-50)*0.8),0) -> 5
A17: =SUM(A16+1) -> 15 | B17: Matt Shannon | M17: 18 | N17: 1128 | O17: 19 | P17: 1105 | Q17: 18 | R17: 1085 | S17: 18 | T17: 1065 | U17: 18 | V17: 1072 | W17: 18 | X17: 996 | Y17: =SUM(C17+E17+G17+I17+K17+M17+O17+Q17+S17+U17+W17) -> 109 | Z17: =SUM(D17+F17+H17+J17+L17+N17+P17+R17+T17+V17+X17) -> 6451 | AA17: =SUM(Z17/Y17) -> 59.183486238532112 | AB17: =ROUNDDOWN(((AA17-50)*0.8),0) -> 7
A18: =SUM(A17+1) -> 16 | B18: Mark Dvorsky | G18: 10 | H18: 593 | I18: 18 | J18: 1059 | K18: 18 | L18: 1037 | M18: 17 | N18: 972 | O18: 17 | P18: 973 | Q18: 11 | R18: 639 | S18: 16 | T18: 930 | Y18: =SUM(C18+E18+G18+I18+K18+M18+O18+Q18+S18+U18+W18) -> 107 | Z18: =SUM(D18+F18+H18+J18+L18+N18+P18+R18+T18+V18+X18) -> 6203 | AA18: =SUM(Z18/Y18) -> 57.971962616822431 | AB18: =ROUNDDOWN(((AA18-50)*0.8),0) -> 6
A19: =SUM(A18+1) -> 17 | B19: Matt Lacina | K19: 17 | L19: 1167 | M19: 18 | N19: 1143 | O19: 18 | P19: 1117 | Q19: 18 | R19: 1122 | S19: 18 | T19: 1075 | U19: 18 | V19: 1077 | Y19: =SUM(C19+E19+G19+I19+K19+M19+O19+Q19+S19+U19+W19) -> 107 | Z19: =SUM(D19+F19+H19+J19+L19+N19+P19+R19+T19+V19+X19) -> 6701 | AA19: =SUM(Z19/Y19) -> 62.626168224299064 | AB19: =ROUNDDOWN(((AA19-50)*0.8),0) -> 10
A20: =SUM(A19+1) -> 18 | B20: Rimmy* | K20: 16 | L20: 814 | M20: 16 | N20: 815 | O20: 18 | P20: 905 | Q20: 10 | R20: 531 | S20: 15 | T20: 801 | U20: 16 | V20: 853 | W20: 14 | X20: 762 | Y20: =SUM(C20+E20+G20+I20+K20+M20+O20+Q20+S20+U20+W20) -> 105 | Z20: =SUM(D20+F20+H20+J20+L20+N20+P20+R20+T20+V20+X20) -> 5481 | AA20: =SUM(Z20/Y20) -> 52.200 | AB20: =ROUNDDOWN(((AA20-50)*0.8),0) -> 1
A21: =SUM(A20+1) -> 19 | B21: Jesse Sauerbrei | K21: 17 | L21: 940 | M21: 18 | N21: 972 | O21: 18 | P21: 989 | Q21: 18 | R21: 969 | S21: 18 | T21: 976 | U21: 15 | V21: 814 | Y21: =SUM(C21+E21+G21+I21+K21+M21+O21+Q21+S21+U21+W21) -> 104 | Z21: =SUM(D21+F21+H21+J21+L21+N21+P21+R21+T21+V21+X21) -> 5660 | AA21: =SUM(Z21/Y21) -> 54.42307692307692 | AB21: =ROUNDDOWN(((AA21-50)*0.8),0) -> 3
A22: =SUM(A21+1) -> 20 | B22: Kruck | C22: 22 | D22: 1240 | E22: 21 | F22: 1158 | G22: 14 | H22: 826 | I22: 2 | J22: 118 | K22: 12 | L22: 720 | M22: 18 | N22: 1032 | U22: 7 | V22: 402 | W22: 4 | X22: 239 | Y22: =SUM(C22+E22+G22+I22+K22+M22+O22+Q22+S22+U22+W22) -> 100 | Z22: =SUM(D22+F22+H22+J22+L22+N22+P22+R22+T22+V22+X22) -> 5735 | AA22: =SUM(Z22/Y22) -> 57.350 | AB22: =ROUNDDOWN(((AA22-50)*0.8),0) -> 5
A23: =SUM(A22+1) -> 21 | B23: Kevin Stibal | I23: 13 | J23: 684 | K23: 17 | L23: 881 | M23: 16 | N23: 851 | O23: 18 | P23: 966 | Q23: 17 | R23: 903 | S23: 2 | T23: 112 | U23: 11 | V23: 555 | W23: 5 | X23: 265 | Y23: =SUM(C23+E23+G23+I23+K23+M23+O23+Q23+S23+U23+W23) -> 99 | Z23: =SUM(D23+F23+H23+J23+L23+N23+P23+R23+T23+V23+X23) -> 5217 | AA23: =SUM(Z23/Y23) -> 52.696969696969695 | AB23: =ROUNDDOWN(((AA23-50)*0.8),0) -> 2
A24: =SUM(A23+1) -> 22 | B24: Max Ostby | M24: 18 | N24: 1112 | O24: 18 | P24: 1088 | Q24: 16 | R24: 994 | S24: 14 | T24: 872 | U24: 17 | V24: 1063 | W24: 13 | X24: 771 | Y24: =SUM(C24+E24+G24+I24+K24+M24+O24+Q24+S24+U24+W24) -> 96 | Z24: =SUM(D24+F24+H24+J24+L24+N24+P24+R24+T24+V24+X24) -> 5900 | AA24: =SUM(Z24/Y24) -> 61.458333333333336 | AB24: =ROUNDDOWN(((AA24-50)*0.8),0) -> 9
A25: =SUM(A24+1) -> 23 | B25: Matt McCarley* | I25: 18 | J25: 968 | K25: 18 | L25: 944 | M25: 18 | N25: 948 | O25: 19 | P25: 971 | Q25: 18 | R25: 964 | Y25: =SUM(C25+E25+G25+I25+K25+M25+O25+Q25+S25+U25+W25) -> 91 | Z25: =SUM(D25+F25+H25+J25+L25+N25+P25+R25+T25+V25+X25) -> 4795 | AA25: =SUM(Z25/Y25) -> 52.692307692307693 | AB25: =ROUNDDOWN(((AA25-50)*0.8),0) -> 2
A26: =SUM(A25+1) -> 24 | B26: Tom Pepper | O26: 18 | P26: 1138 | Q26: 18 | R26: 1098 | S26: 18 | T26: 1067 | U26: 18 | V26: 1057 | W26: 18 | X26: 1040 | Y26: =SUM(C26+E26+G26+I26+K26+M26+O26+Q26+S26+U26+W26) -> 90 | Z26: =SUM(D26+F26+H26+J26+L26+N26+P26+R26+T26+V26+X26) -> 5400 | AA26: =SUM(Z26/Y26) -> 60.000 | AB26: =ROUNDDOWN(((AA26-50)*0.8),0) -> 8
A27: =SUM(A26+1) -> 25 | B27: "Wheatbread" | E27: 19 | F27: 1102 | G27: 18 | H27: 1024 | I27: 18 | J27: 991 | K27: 18 | L27: 1027 | M27: 15 | N27: 835 | Y27: =SUM(C27+E27+G27+I27+K27+M27+O27+Q27+S27+U27+W27) -> 88 | Z27: =SUM(D27+F27+H27+J27+L27+N27+P27+R27+T27+V27+X27) -> 4979 | AA27: =SUM(Z27/Y27) -> 56.579545454545453 | AB27: =ROUNDDOWN(((AA27-50)*0.8),0) -> 5
A28: =SUM(A27+1) -> 26 | B28: Rory Lasansky | M28: 18 | N28: 959 | O28: 1 | P28: 55 | Q28: 18 | R28: 1024 | S28: 18 | T28: 977 | U28: 13 | V28: 685 | W28: 17 | X28: 897 | Y28: =SUM(C28+E28+G28+I28+K28+M28+O28+Q28+S28+U28+W28) -> 85 | Z28: =SUM(D28+F28+H28+J28+L28+N28+P28+R28+T28+V28+X28) -> 4597 | AA28: =SUM(Z28/Y28) -> 54.082352941176474 | AB28: =ROUNDDOWN(((AA28-50)*0.8),0) -> 3
A29: =SUM(A28+1) -> 27 | B29: "Shirtless" Bill | O29: 16 | P29: 900 | Q29: 17 | R29: 962 | S29: 18 | T29: 999 | U29: 16 | V29: 897 | W29: 18 | X29: 1025 | Y29: =SUM(C29+E29+G29+I29+K29+M29+O29+Q29+S29+U29+W29) -> 85 | Z29: =SUM(D29+F29+H29+J29+L29+N29+P29+R29+T29+V29+X29) -> 4783 | AA29: =SUM(Z29/Y29) -> 56.27058823529412 | AB29: =ROUNDDOWN(((AA29-50)*0.8),0) -> 5
A30: =SUM(A29+1) -> 28 | B30: Jerimie Maker | M30: 6 | N30: 341 | O30: 15 | P30: 836 | Q30: 10 | R30: 545 | S30: 18 | T30: 984 | U30: 18 | V30: 975 | W30: 18 | X30: 1003 | Y30: =SUM(C30+E30+G30+I30+K30+M30+O30+Q30+S30+U30+W30) -> 85 | Z30: =SUM(D30+F30+H30+J30+L30+N30+P30+R30+T30+V30+X30) -> 4684 | AA30: =SUM(Z30/Y30) -> 55.10588235294118 | AB30: =ROUNDDOWN(((AA30-50)*0.8),0) -> 4
A31: =SUM(A30+1) -> 29 | B31: Byran Bream | K31: 9 | L31: 491 | M31: 18 | N31: 955 | O31: 19 | P31: 976 | Q31: 18 | R31: 983 | S31: 18 | T31: 938 | U31: 1 | V31: 52 | Y31: =SUM(C31+E31+G31+I31+K31+M31+O31+Q31+S31+U31+W31) -> 83 | Z31: =SUM(D31+F31+H31+J31+L31+N31+P31+R31+T31+V31+X31) -> 4395 | AA31: =SUM(Z31/Y31) -> 52.951807228915662 | AB31: =ROUNDDOWN(((AA31-50)*0.8),0) -> 2
A32: =SUM(A31+1) -> 30 | B32: Dixie Smith | C32: 11 | D32: 874 | E32: 18 | F32: 1393 | G32: 17 | H32: 1220 | I32: 18 | J32: 1295 | K32: 18 | L32: 1278 | Y32: =SUM(C32+E32+G32+I32+K32+M32+O32+Q32+S32+U32+W32) -> 82 | Z32: =SUM(D32+F32+H32+J32+L32+N32+P32+R32+T32+V32+X32) -> 6060 | AA32: =SUM(Z32/Y32) -> 73.902439024390247 | AB32: =ROUNDDOWN(((AA32-50)*0.8),0) -> 19
A33: =SUM(A32+1) -> 31 | B33: Ryan "Norm" Kriz** | C33: 22 | D33: 1281 | E33: 22 | F33: 1313 | G33: 18 | H33: 1068 | I33: 17 | J33: 1034 | Y33: =SUM(C33+E33+G33+I33+K33+M33+O33+Q33+S33+U33+W33) -> 79 | Z33: =SUM(D33+F33+H33+J33+L33+N33+P33+R33+T33+V33+X33) -> 4696 | AA33: =SUM(Z33/Y33) -> 59.443037974683541 | AB33: =ROUNDDOWN(((AA33-50)*0.8),0) -> 7
A34: =SUM(A33+1) -> 32 | B34: Tim "Timmy" Troyna | O34: 17 | P34: 1048 | Q34: 15 | R34: 925 | S34: 15 | T34: 904 | U34: 15 | V34: 924 | W34: 17 | X34: 982 | Y34: =SUM(C34+E34+G34+I34+K34+M34+O34+Q34+S34+U34+W34) -> 79 | Z34: =SUM(D34+F34+H34+J34+L34+N34+P34+R34+T34+V34+X34) -> 4783 | AA34: =SUM(Z34/Y34) -> 60.544303797468352 | AB34: =ROUNDDOWN(((AA34-50)*0.8),0) -> 8
A35: =SUM(A34+1) -> 33 | B35: Joe O'Neil | O35: 19 | P35: 1158 | Q35: 18 | R35: 1071 | S35: 16 | T35: 922 | U35: 7 | V35: 388 | W35: 16 | X35: 929 | Y35: =SUM(C35+E35+G35+I35+K35+M35+O35+Q35+S35+U35+W35) -> 76 | Z35: =SUM(D35+F35+H35+J35+L35+N35+P35+R35+T35+V35+X35) -> 4468 | AA35: =SUM(Z35/Y35) -> 58.789473684210527 | AB35: =ROUNDDOWN(((AA35-50)*0.8),0) -> 7
A36: =SUM(A35+1) -> 34 | B36: Tim Peyton* | M36: 4 | N36: 209 | Q36: 18 | R36: 926 | S36: 18 | T36: 908 | U36: 18 | V36: 906 | W36: 18 | X36: 913 | Y36: =SUM(C36+E36+G36+I36+K36+M36+O36+Q36+S36+U36+W36) -> 76 | Z36: =SUM(D36+F36+H36+J36+L36+N36+P36+R36+T36+V36+X36) -> 3862 | AA36: =SUM(Z36/Y36) -> 50.815789473684212 | AB36: =ROUNDDOWN(((AA36-50)*0.8),0) -> 0
A37: =SUM(A36+1) -> 35 | B37: Ryan Hamilton | K37: 3 | L37: 182 | Q37: 18 | R37: 1059 | S37: 18 | T37: 1024 | U37: 18 | V37: 1025 | W37: 18 | X37: 980 | Y37: =SUM(C37+E37+G37+I37+K37+M37+O37+Q37+S37+U37+W37) -> 75 | Z37: =SUM(D37+F37+H37+J37+L37+N37+P37+R37+T37+V37+X37) -> 4270 | AA37: =SUM(Z37/Y37) -> 56.93333333333333 | AB37: =ROUNDDOWN(((AA37-50)*0.8),0) -> 5
A38: =SUM(A37+1) -> 36 | B38: "Snapple" | G38: 4 | H38: 209 | I38: 7 | J38: 387 | K38: 18 | L38: 1003 | M38: 16 | N38: 877 | O38: 17 | P38: 937 | Q38: 12 | R38: 674 | Y38: =SUM(C38+E38+G38+I38+K38+M38+O38+Q38+S38+U38+W38) -> 74 | Z38: =SUM(D38+F38+H38+J38+L38+N38+P38+R38+T38+V38+X38) -> 4087 | AA38: =SUM(Z38/Y38) -> 55.229729729729726 | AB38: =ROUNDDOWN(((AA38-50)*0.8),0) -> 4
A39: =SUM(A38+1) -> 37 | B39: Mike Flynn | M39: 6 | N39: 360 | O39: 15 | P39: 883 | Q39: 18 | R39: 1048 | S39: 17 | T39: 973 | U39: 18 | V39: 1054 | Y39: =SUM(C39+E39+G39+I39+K39+M39+O39+Q39+S39+U39+W39) -> 74 | Z39: =SUM(D39+F39+H39+J39+L39+N39+P39+R39+T39+V39+X39) -> 4318 | AA39: =SUM(Z39/Y39) -> 58.351351351351354 | AB39: =ROUNDDOWN(((AA39-50)*0.8),0) -> 6
A40: =SUM(A39+1) -> 38 | B40: Matt Wieben** | O40: 1 | P40: 51 | Q40: 18 | R40: 964 | S40: 18 | T40: 952 | U40: 18 | V40: 931 | W40: 18 | X40: 896 | Y40: =SUM(C40+E40+G40+I40+K40+M40+O40+Q40+S40+U40+W40) -> 73 | Z40: =SUM(D40+F40+H40+J40+L40+N40+P40+R40+T40+V40+X40) -> 3794 | AA40: =SUM(Z40/Y40) -> 51.972602739726028 | AB40: =ROUNDDOWN(((AA40-50)*0.8),0) -> 1
A41: =SUM(A40+1) -> 39 | B41: Doug Peyton | Q41: 18 | R41: 910 | S41: 18 | T41: 916 | U41: 18 | V41: 894 | W41: 18 | X41: 881 | Y41: =SUM(C41+E41+G41+I41+K41+M41+O41+Q41+S41+U41+W41) -> 72 | Z41: =SUM(D41+F41+H41+J41+L41+N41+P41+R41+T41+V41+X41) -> 3601 | AA41: =SUM(Z41/Y41) -> 50.013888888888886 | AB41: =ROUNDDOWN(((AA41-50)*0.8),0) -> 0
A42: =SUM(A41+1) -> 40 | B42: Kollin Grimm | Q42: 17 | R42: 986 | S42: 18 | T42: 982 | U42: 18 | V42: 968 | W42: 18 | X42: 924 | Y42: =SUM(C42+E42+G42+I42+K42+M42+O42+Q42+S42+U42+W42) -> 71 | Z42: =SUM(D42+F42+H42+J42+L42+N42+P42+R42+T42+V42+X42) -> 3860 | AA42: =SUM(Z42/Y42) -> 54.366197183098592 | AB42: =ROUNDDOWN(((AA42-50)*0.8),0) -> 3
A43: =SUM(A42+1) -> 41 | B43: Corey Moel | C43: 14 | D43: 939 | E43: 21 | F43: 1306 | G43: 18 | H43: 1143 | I43: 15 | J43: 1042 | Y43: =SUM(C43+E43+G43+I43+K43+M43+O43+Q43+S43+U43+W43) -> 68 | Z43: =SUM(D43+F43+H43+J43+L43+N43+P43+R43+T43+V43+X43) -> 4430 | AA43: =SUM(Z43/Y43) -> 65.147058823529406 | AB43: =ROUNDDOWN(((AA43-50)*0.8),0) -> 12
A44: =SUM(A43+1) -> 42 | B44: JT Hagameier | C44: 3 | D44: 181 | E44: 21 | F44: 1405 | G44: 17 | H44: 1085 | I44: 15 | J44: 964 | M44: 12 | N44: 791 | Y44: =SUM(C44+E44+G44+I44+K44+M44+O44+Q44+S44+U44+W44) -> 68 | Z44: =SUM(D44+F44+H44+J44+L44+N44+P44+R44+T44+V44+X44) -> 4426 | AA44: =SUM(Z44/Y44) -> 65.088235294117652 | AB44: =ROUNDDOWN(((AA44-50)*0.8),0) -> 12
A45: =SUM(A44+1) -> 43 | B45: Dan Klein | K45: 11 | L45: 680 | M45: 18 | N45: 1050 | O45: 12 | P45: 665 | Q45: 18 | R45: 1024 | S45: 9 | T45: 520 | Y45: =SUM(C45+E45+G45+I45+K45+M45+O45+Q45+S45+U45+W45) -> 68 | Z45: =SUM(D45+F45+H45+J45+L45+N45+P45+R45+T45+V45+X45) -> 3939 | AA45: =SUM(Z45/Y45) -> 57.926470588235297 | AB45: =ROUNDDOWN(((AA45-50)*0.8),0) -> 6
A46: =SUM(A45+1) -> 44 | B46: Keith Gudenkauf | O46: 18 | P46: 993 | Q46: 13 | R46: 723 | S46: 18 | T46: 963 | U46: 17 | V46: 928 | Y46: =SUM(C46+E46+G46+I46+K46+M46+O46+Q46+S46+U46+W46) -> 66 | Z46: =SUM(D46+F46+H46+J46+L46+N46+P46+R46+T46+V46+X46) -> 3607 | AA46: =SUM(Z46/Y46) -> 54.651515151515149 | AB46: =ROUNDDOWN(((AA46-50)*0.8),0) -> 3
A47: =SUM(A46+1) -> 45 | B47: Travis Pike | K47: 2 | L47: 113 | M47: 18 | N47: 987 | O47: 9 | P47: 504 | S47: 18 | T47: 974 | U47: 4 | V47: 227 | W47: 15 | X47: 825 | Y47: =SUM(C47+E47+G47+I47+K47+M47+O47+Q47+S47+U47+W47) -> 66 | Z47: =SUM(D47+F47+H47+J47+L47+N47+P47+R47+T47+V47+X47) -> 3630 | AA47: =SUM(Z47/Y47) -> 55.000 | AB47: =ROUNDDOWN(((AA47-50)*0.8),0) -> 4
A48: =SUM(A47+1) -> 46 | B48: Matt Rinker | M48: 18 | N48: 964 | O48: 19 | P48: 1044 | Q48: 18 | R48: 984 | S48: 9 | T48: 472 | Y48: =SUM(C48+E48+G48+I48+K48+M48+O48+Q48+S48+U48+W48) -> 64 | Z48: =SUM(D48+F48+H48+J48+L48+N48+P48+R48+T48+V48+X48) -> 3464 | AA48: =SUM(Z48/Y48) -> 54.125 | AB48: =ROUNDDOWN(((AA48-50)*0.8),0) -> 3
A49: =SUM(A48+1) -> 47 | B49: Brian Zyzda | G49: 1 | H49: 61 | I49: 17 | J49: 949 | K49: 17 | L49: 943 | M49: 18 | N49: 972 | O49: 10 | P49: 514 | Y49: =SUM(C49+E49+G49+I49+K49+M49+O49+Q49+S49+U49+W49) -> 63 | Z49: =SUM(D49+F49+H49+J49+L49+N49+P49+R49+T49+V49+X49) -> 3439 | AA49: =SUM(Z49/Y49) -> 54.587301587301589 | AB49: =ROUNDDOWN(((AA49-50)*0.8),0) -> 3
A50: =SUM(A49+1) -> 48 | B50: Jeremy Bos | K50: 16 | L50: 962 | M50: 15 | N50: 922 | O50: 15 | P50: 960 | Q50: 16 | R50: 986 | Y50: =SUM(C50+E50+G50+I50+K50+M50+O50+Q50+S50+U50+W50) -> 62 | Z50: =SUM(D50+F50+H50+J50+L50+N50+P50+R50+T50+V50+X50) -> 3830 | AA50: =SUM(Z50/Y50) -> 61.774193548387096 | AB50: =ROUNDDOWN(((AA50-50)*0.8),0) -> 9
A51: =SUM(A50+1) -> 49 | B51: John Russell | M51: 10 | N51: 585 | O51: 17 | P51: 959 | Q51: 18 | R51: 1044 | S51: 17 | T51: 952 | Y51: =SUM(C51+E51+G51+I51+K51+M51+O51+Q51+S51+U51+W51) -> 62 | Z51: =SUM(D51+F51+H51+J51+L51+N51+P51+R51+T51+V51+X51) -> 3540 | AA51: =SUM(Z51/Y51) -> 57.096774193548384 | AB51: =ROUNDDOWN(((AA51-50)*0.8),0) -> 5
A52: =SUM(A51+1) -> 50 | B52: Brian Eastwood | C52: 21 | D52: 1380 | E52: 22 | F52: 1411 | G52: 9 | H52: 562 | I52: 9 | J52: 576 | Y52: =SUM(C52+E52+G52+I52+K52+M52+O52+Q52+S52+U52+W52) -> 61 | Z52: =SUM(D52+F52+H52+J52+L52+N52+P52+R52+T52+V52+X52) -> 3929 | AA52: =SUM(Z52/Y52) -> 64.409836065573771 | AB52: =ROUNDDOWN(((AA52-50)*0.8),0) -> 11
A53: =SUM(A52+1) -> 51 | B53: Aaron Lindsley | M53: 14 | N53: 740 | O53: 19 | P53: 1011 | Q53: 12 | R53: 642 | S53: 14 | T53: 729 | Y53: =SUM(C53+E53+G53+I53+K53+M53+O53+Q53+S53+U53+W53) -> 59 | Z53: =SUM(D53+F53+H53+J53+L53+N53+P53+R53+T53+V53+X53) -> 3122 | AA53: =SUM(Z53/Y53) -> 52.915254237288138 | AB53: =ROUNDDOWN(((AA53-50)*0.8),0) -> 2
A54: =SUM(A53+1) -> 52 | B54: Travis Scott* | C54: 22 | D54: 1325 | E54: 12 | F54: 813 | G54: 14 | H54: 839 | I54: 8 | J54: 480 | Y54: =SUM(C54+E54+G54+I54+K54+M54+O54+Q54+S54+U54+W54) -> 56 | Z54: =SUM(D54+F54+H54+J54+L54+N54+P54+R54+T54+V54+X54) -> 3457 | AA54: =SUM(Z54/Y54) -> 61.732142857142854 | AB54: =ROUNDDOWN(((AA54-50)*0.8),0) -> 9
A55: =SUM(A54+1) -> 53 | B55: J "Cally" Callaghan* | M55: 18 | N55: 1138 | O55: 19 | P55: 1157 | Q55: 18 | R55: 1159 | Y55: =SUM(C55+E55+G55+I55+K55+M55+O55+Q55+S55+U55+W55) -> 55 | Z55: =SUM(D55+F55+H55+J55+L55+N55+P55+R55+T55+V55+X55) -> 3454 | AA55: =SUM(Z55/Y55) -> 62.800 | AB55: =ROUNDDOWN(((AA55-50)*0.8),0) -> 10
A56: =SUM(A55+1) -> 54 | B56: Marty Reis | S56: 18 | T56: 1110 | U56: 18 | V56: 1034 | W56: 18 | X56: 1013 | Y56: =SUM(C56+E56+G56+I56+K56+M56+O56+Q56+S56+U56+W56) -> 54 | Z56: =SUM(D56+F56+H56+J56+L56+N56+P56+R56+T56+V56+X56) -> 3157 | AA56: =SUM(Z56/Y56) -> 58.462962962962962 | AB56: =ROUNDDOWN(((AA56-50)*0.8),0) -> 6
A57: =SUM(A56+1) -> 55 | B57: Mike Robinson | M57: 17 | N57: 934 | O57: 19 | P57: 966 | Q57: 17 | R57: 936 | Y57: =SUM(C57+E57+G57+I57+K57+M57+O57+Q57+S57+U57+W57) -> 53 | Z57: =SUM(D57+F57+H57+J57+L57+N57+P57+R57+T57+V57+X57) -> 2836 | AA57: =SUM(Z57/Y57) -> 53.509433962264154 | AB57: =ROUNDDOWN(((AA57-50)*0.8),0) -> 2
A58: =SUM(A57+1) -> 56 | B58: Kate Papenthien | Q58: 18 | R58: 1137 | S58: 18 | T58: 1057 | U58: 17 | V58: 995 | Y58: =SUM(C58+E58+G58+I58+K58+M58+O58+Q58+S58+U58+W58) -> 53 | Z58: =SUM(D58+F58+H58+J58+L58+N58+P58+R58+T58+V58+X58) -> 3189 | AA58: =SUM(Z58/Y58) -> 60.169811320754718 | AB58: =ROUNDDOWN(((AA58-50)*0.8),0) -> 8
A59: =SUM(A58+1) -> 57 | B59: Brent Kauffman | K59: 18 | L59: 965 | O59: 17 | P59: 901 | Q59: 17 | R59: 946 | Y59: =SUM(C59+E59+G59+I59+K59+M59+O59+Q59+S59+U59+W59) -> 52 | Z59: =SUM(D59+F59+H59+J59+L59+N59+P59+R59+T59+V59+X59) -> 2812 | AA59: =SUM(Z59/Y59) -> 54.07692307692308 | AB59: =ROUNDDOWN(((AA59-50)*0.8),0) -> 3
A60: =SUM(A59+1) -> 58 | B60: Valera Petrulevich | S60: 16 | T60: 1001 | U60: 17 | V60: 1034 | W60: 18 | X60: 1028 | Y60: =SUM(C60+E60+G60+I60+K60+M60+O60+Q60+S60+U60+W60) -> 51 | Z60: =SUM(D60+F60+H60+J60+L60+N60+P60+R60+T60+V60+X60) -> 3063 | AA60: =SUM(Z60/Y60) -> 60.058823529411768 | AB60: =ROUNDDOWN(((AA60-50)*0.8),0) -> 8
A61: =SUM(A60+1) -> 59 | B61: Steve Callaway | M61: 7 | N61: 422 | O61: 16 | P61: 971 | Q61: 16 | R61: 976 | S61: 3 | T61: 167 | U61: 7 | V61: 424 | Y61: =SUM(C61+E61+G61+I61+K61+M61+O61+Q61+S61+U61+W61) -> 49 | Z61: =SUM(D61+F61+H61+J61+L61+N61+P61+R61+T61+V61+X61) -> 2960 | AA61: =SUM(Z61/Y61) -> 60.408163265306122 | AB61: =ROUNDDOWN(((AA61-50)*0.8),0) -> 8
A62: =SUM(A61+1) -> 60 | B62: Lee Nerad | E62: 14 | F62: 856 | G62: 18 | H62: 1099 | I62: 16 | J62: 982 | Y62: =SUM(C62+E62+G62+I62+K62+M62+O62+Q62+S62+U62+W62) -> 48 | Z62: =SUM(D62+F62+H62+J62+L62+N62+P62+R62+T62+V62+X62) -> 2937 | AA62: =SUM(Z62/Y62) -> 61.1875 | AB62: =ROUNDDOWN(((AA62-50)*0.8),0) -> 8
A63: =SUM(A62+1) -> 61 | B63: Dusty Mcatee | C63: 15 | D63: 888 | E63: 21 | F63: 1210 | G63: 12 | H63: 776 | Y63: =SUM(C63+E63+G63+I63+K63+M63+O63+Q63+S63+U63+W63) -> 48 | Z63: =SUM(D63+F63+H63+J63+L63+N63+P63+R63+T63+V63+X63) -> 2874 | AA63: =SUM(Z63/Y63) -> 59.875 | AB63: =ROUNDDOWN(((AA63-50)*0.8),0) -> 7
A64: =SUM(A63+1) -> 62 | B64: Eric Strader | G64: 18 | H64: 1178 | I64: 18 | J64: 1042 | K64: 11 | L64: 691 | Y64: =SUM(C64+E64+G64+I64+K64+M64+O64+Q64+S64+U64+W64) -> 47 | Z64: =SUM(D64+F64+H64+J64+L64+N64+P64+R64+T64+V64+X64) -> 2911 | AA64: =SUM(Z64/Y64) -> 61.936170212765958 | AB64: =ROUNDDOWN(((AA64-50)*0.8),0) -> 9
A65: =SUM(A64+1) -> 63 | B65: Jeremy Farnsworth | S65: 12 | T65: 630 | U65: 17 | V65: 888 | W65: 18 | X65: 915 | Y65: =SUM(C65+E65+G65+I65+K65+M65+O65+Q65+S65+U65+W65) -> 47 | Z65: =SUM(D65+F65+H65+J65+L65+N65+P65+R65+T65+V65+X65) -> 2433 | AA65: =SUM(Z65/Y65) -> 51.765957446808514 | AB65: =ROUNDDOWN(((AA65-50)*0.8),0) -> 1
A66: =SUM(A65+1) -> 64 | B66: Shawn Hullinger | Q66: 5 | R66: 343 | S66: 5 | T66: 302 | U66: 17 | V66: 1077 | W66: 18 | X66: 1106 | Y66: =SUM(C66+E66+G66+I66+K66+M66+O66+Q66+S66+U66+W66) -> 45 | Z66: =SUM(D66+F66+H66+J66+L66+N66+P66+R66+T66+V66+X66) -> 2828 | AA66: =SUM(Z66/Y66) -> 62.844444444444441 | AB66: =ROUNDDOWN(((AA66-50)*0.8),0) -> 10
A67: =SUM(A66+1) -> 65 | B67: Nathan Veeder | S67: 8 | T67: 450 | U67: 18 | V67: 1021 | W67: 17 | X67: 922 | Y67: =SUM(C67+E67+G67+I67+K67+M67+O67+Q67+S67+U67+W67) -> 43 | Z67: =SUM(D67+F67+H67+J67+L67+N67+P67+R67+T67+V67+X67) -> 2393 | AA67: =SUM(Z67/Y67) -> 55.651162790697676 | AB67: =ROUNDDOWN(((AA67-50)*0.8),0) -> 4
A68: =SUM(A67+1) -> 66 | B68: Justin Zehr | S68: 9 | T68: 537 | U68: 18 | V68: 1080 | W68: 16 | X68: 907 | Y68: =SUM(C68+E68+G68+I68+K68+M68+O68+Q68+S68+U68+W68) -> 43 | Z68: =SUM(D68+F68+H68+J68+L68+N68+P68+R68+T68+V68+X68) -> 2524 | AA68: =SUM(Z68/Y68) -> 58.697674418604649 | AB68: =ROUNDDOWN(((AA68-50)*0.8),0) -> 6
A69: =SUM(A68+1) -> 67 | B69: Scott Eastwood | C69: 20 | D69: 1619 | E69: 19 | F69: 1320 | G69: 3 | H69: 218 | Y69: =SUM(C69+E69+G69+I69+K69+M69+O69+Q69+S69+U69+W69) -> 42 | Z69: =SUM(D69+F69+H69+J69+L69+N69+P69+R69+T69+V69+X69) -> 3157 | AA69: =SUM(Z69/Y69) -> 75.166666666666671 | AB69: =ROUNDDOWN(((AA69-50)*0.8),0) -> 20
A70: =SUM(A69+1) -> 68 | B70: Joe Ostby | M70: 12 | N70: 682 | Q70: 18 | R70: 1029 | S70: 12 | T70: 683 | Y70: =SUM(C70+E70+G70+I70+K70+M70+O70+Q70+S70+U70+W70) -> 42 | Z70: =SUM(D70+F70+H70+J70+L70+N70+P70+R70+T70+V70+X70) -> 2394 | AA70: =SUM(Z70/Y70) -> 57.000 | AB70: =ROUNDDOWN(((AA70-50)*0.8),0) -> 5
A71: =SUM(A70+1) -> 69 | B71: Joe Evans | K71: 12 | L71: 815 | M71: 14 | N71: 931 | S71: 16 | T71: 1120 | Y71: =SUM(C71+E71+G71+I71+K71+M71+O71+Q71+S71+U71+W71) -> 42 | Z71: =SUM(D71+F71+H71+J71+L71+N71+P71+R71+T71+V71+X71) -> 2866 | AA71: =SUM(Z71/Y71) -> 68.238095238095241 | AB71: =ROUNDDOWN(((AA71-50)*0.8),0) -> 14
A72: =SUM(A71+1) -> 70 | B72: Matt Fritz | S72: 7 | T72: 405 | U72: 18 | V72: 1038 | W72: 17 | X72: 965 | Y72: =SUM(C72+E72+G72+I72+K72+M72+O72+Q72+S72+U72+W72) -> 42 | Z72: =SUM(D72+F72+H72+J72+L72+N72+P72+R72+T72+V72+X72) -> 2408 | AA72: =SUM(Z72/Y72) -> 57.333333333333336 | AB72: =ROUNDDOWN(((AA72-50)*0.8),0) -> 5
A73: =SUM(A72+1) -> 71 | B73: Troy Knapp | M73: 5 | N73: 301 | Q73: 16 | R73: 1034 | S73: 18 | T73: 1121 | U73: 1 | V73: 65 | Y73: =SUM(C73+E73+G73+I73+K73+M73+O73+Q73+S73+U73+W73) -> 40 | Z73: =SUM(D73+F73+H73+J73+L73+N73+P73+R73+T73+V73+X73) -> 2521 | AA73: =SUM(Z73/Y73) -> 63.024999999999999 | AB73: =ROUNDDOWN(((AA73-50)*0.8),0) -> 10
A74: =SUM(A73+1) -> 72 | B74: Brent Ross | E74: 21 | F74: 1287 | G74: 18 | H74: 1097 | Y74: =SUM(C74+E74+G74+I74+K74+M74+O74+Q74+S74+U74+W74) -> 39 | Z74: =SUM(D74+F74+H74+J74+L74+N74+P74+R74+T74+V74+X74) -> 2384 | AA74: =SUM(Z74/Y74) -> 61.128205128205131 | AB74: =ROUNDDOWN(((AA74-50)*0.8),0) -> 8
A75: =SUM(A74+1) -> 73 | B75: Jon Shear | O75: 18 | P75: 1036 | Q75: 16 | R75: 908 | S75: 4 | T75: 216 | Y75: =SUM(C75+E75+G75+I75+K75+M75+O75+Q75+S75+U75+W75) -> 38 | Z75: =SUM(D75+F75+H75+J75+L75+N75+P75+R75+T75+V75+X75) -> 2160 | AA75: =SUM(Z75/Y75) -> 56.842105263157897 | AB75: =ROUNDDOWN(((AA75-50)*0.8),0) -> 5
A76: =SUM(A75+1) -> 74 | B76: Brandon Yoder | S76: 15 | T76: 1014 | U76: 13 | V76: 855 | W76: 10 | X76: 676 | Y76: =SUM(C76+E76+G76+I76+K76+M76+O76+Q76+S76+U76+W76) -> 38 | Z76: =SUM(D76+F76+H76+J76+L76+N76+P76+R76+T76+V76+X76) -> 2545 | AA76: =SUM(Z76/Y76) -> 66.973684210526315 | AB76: =ROUNDDOWN(((AA76-50)*0.8),0) -> 13
A77: =SUM(A76+1) -> 75 | B77: Brad Balk | O77: 19 | P77: 1178 | Q77: 18 | R77: 1110 | Y77: =SUM(C77+E77+G77+I77+K77+M77+O77+Q77+S77+U77+W77) -> 37 | Z77: =SUM(D77+F77+H77+J77+L77+N77+P77+R77+T77+V77+X77) -> 2288 | AA77: =SUM(Z77/Y77) -> 61.837837837837839 | AB77: =ROUNDDOWN(((AA77-50)*0.8),0) -> 9
A78: =SUM(A77+1) -> 76 | B78: Jake Sutter | M78: 18 | N78: 1034 | O78: 18 | P78: 1009 | Y78: =SUM(C78+E78+G78+I78+K78+M78+O78+Q78+S78+U78+W78) -> 36 | Z78: =SUM(D78+F78+H78+J78+L78+N78+P78+R78+T78+V78+X78) -> 2043 | AA78: =SUM(Z78/Y78) -> 56.750 | AB78: =ROUNDDOWN(((AA78-50)*0.8),0) -> 5
A79: =SUM(A78+1) -> 77 | B79: Jason Shook | M79: 18 | N79: 984 | O79: 1 | P79: 56 | Q79: 17 | R79: 940 | Y79: =SUM(C79+E79+G79+I79+K79+M79+O79+Q79+S79+U79+W79) -> 36 | Z79: =SUM(D79+F79+H79+J79+L79+N79+P79+R79+T79+V79+X79) -> 1980 | AA79: =SUM(Z79/Y79) -> 55.000 | AB79: =ROUNDDOWN(((AA79-50)*0.8),0) -> 4
A80: =SUM(A79+1) -> 78 | B80: Aaron "Burnie" Burnett | I80: 17 | J80: 1161 | K80: 18 | L80: 1193 | Y80: =SUM(C80+E80+G80+I80+K80+M80+O80+Q80+S80+U80+W80) -> 35 | Z80: =SUM(D80+F80+H80+J80+L80+N80+P80+R80+T80+V80+X80) -> 2354 | AA80: =SUM(Z80/Y80) -> 67.257142857142853 | AB80: =ROUNDDOWN(((AA80-50)*0.8),0) -> 13
A81: =SUM(A80+1) -> 79 | B81: Marc Bookmeyer | K81: 17 | L81: 1084 | M81: 18 | N81: 1115 | Y81: =SUM(C81+E81+G81+I81+K81+M81+O81+Q81+S81+U81+W81) -> 35 | Z81: =SUM(D81+F81+H81+J81+L81+N81+P81+R81+T81+V81+X81) -> 2199 | AA81: =SUM(Z81/Y81) -> 62.828571428571429 | AB81: =ROUNDDOWN(((AA81-50)*0.8),0) -> 10
A82: =SUM(A81+1) -> 80 | B82: Skyler Landess | M82: 18 | N82: 1313 | O82: 14 | P82: 957 | S82: 3 | T82: 216 | Y82: =SUM(C82+E82+G82+I82+K82+M82+O82+Q82+S82+U82+W82) -> 35 | Z82: =SUM(D82+F82+H82+J82+L82+N82+P82+R82+T82+V82+X82) -> 2486 | AA82: =SUM(Z82/Y82) -> 71.028571428571425 | AB82: =ROUNDDOWN(((AA82-50)*0.8),0) -> 16
A83: =SUM(A82+1) -> 81 | B83: Nick Schultz | Q83: 1 | R83: 57 | S83: 16 | T83: 880 | U83: 18 | V83: 979 | Y83: =SUM(C83+E83+G83+I83+K83+M83+O83+Q83+S83+U83+W83) -> 35 | Z83: =SUM(D83+F83+H83+J83+L83+N83+P83+R83+T83+V83+X83) -> 1916 | AA83: =SUM(Z83/Y83) -> 54.74285714285714 | AB83: =ROUNDDOWN(((AA83-50)*0.8),0) -> 3
A84: =SUM(A83+1) -> 82 | B84: Adam Miller | Q84: 1 | R84: 51 | U84: 17 | V84: 900 | W84: 17 | X84: 900 | Y84: =SUM(C84+E84+G84+I84+K84+M84+O84+Q84+S84+U84+W84) -> 35 | Z84: =SUM(D84+F84+H84+J84+L84+N84+P84+R84+T84+V84+X84) -> 1851 | AA84: =SUM(Z84/Y84) -> 52.885714285714286 | AB84: =ROUNDDOWN(((AA84-50)*0.8),0) -> 2
A85: =SUM(A84+1) -> 83 | B85: Dan Kern | U85: 17 | V85: 893 | W85: 18 | X85: 900 | Y85: =SUM(C85+E85+G85+I85+K85+M85+O85+Q85+S85+U85+W85) -> 35 | Z85: =SUM(D85+F85+H85+J85+L85+N85+P85+R85+T85+V85+X85) -> 1793 | AA85: =SUM(Z85/Y85) -> 51.228571428571428 | AB85: =ROUNDDOWN(((AA85-50)*0.8),0) -> 0
A86: =SUM(A85+1) -> 84 | B86: Ben Young | Q86: 16 | R86: 1072 | S86: 18 | T86: 1166 | Y86: =SUM(C86+E86+G86+I86+K86+M86+O86+Q86+S86+U86+W86) -> 34 | Z86: =SUM(D86+F86+H86+J86+L86+N86+P86+R86+T86+V86+X86) -> 2238 | AA86: =SUM(Z86/Y86) -> 65.82352941176471 | AB86: =ROUNDDOWN(((AA86-50)*0.8),0) -> 12
A87: =SUM(A86+1) -> 85 | B87: Dev Nelson | Q87: 1 | R87: 50 | U87: 15 | V87: 810 | W87: 18 | X87: 928 | Y87: =SUM(C87+E87+G87+I87+K87+M87+O87+Q87+S87+U87+W87) -> 34 | Z87: =SUM(D87+F87+H87+J87+L87+N87+P87+R87+T87+V87+X87) -> 1788 | AA87: =SUM(Z87/Y87) -> 52.588235294117645 | AB87: =ROUNDDOWN(((AA87-50)*0.8),0) -> 2
A88: =SUM(A87+1) -> 86 | B88: Spencer Eubanks | U88: 16 | V88: 1040 | W88: 18 | X88: 1169 | Y88: =SUM(C88+E88+G88+I88+K88+M88+O88+Q88+S88+U88+W88) -> 34 | Z88: =SUM(D88+F88+H88+J88+L88+N88+P88+R88+T88+V88+X88) -> 2209 | AA88: =SUM(Z88/Y88) -> 64.970588235294116 | AB88: =ROUNDDOWN(((AA88-50)*0.8),0) -> 11
A89: =SUM(A88+1) -> 87 | B89: Dustin Nohr | U89: 15 | V89: 935 | W89: 18 | X89: 1031 | Y89: =SUM(C89+E89+G89+I89+K89+M89+O89+Q89+S89+U89+W89) -> 33 | Z89: =SUM(D89+F89+H89+J89+L89+N89+P89+R89+T89+V89+X89) -> 1966 | AA89: =SUM(Z89/Y89) -> 59.575757575757578 | AB89: =ROUNDDOWN(((AA89-50)*0.8),0) -> 7
A90: =SUM(A89+1) -> 88 | B90: Andrew Staudt | Q90: 15 | R90: 962 | S90: 13 | T90: 814 | U90: 4 | V90: 246 | Y90: =SUM(C90+E90+G90+I90+K90+M90+O90+Q90+S90+U90+W90) -> 32 | Z90: =SUM(D90+F90+H90+J90+L90+N90+P90+R90+T90+V90+X90) -> 2022 | AA90: =SUM(Z90/Y90) -> 63.1875 | AB90: =ROUNDDOWN(((AA90-50)*0.8),0) -> 10
A91: =SUM(A90+1) -> 89 | B91: Brad Rew | S91: 16 | T91: 914 | U91: 13 | V91: 752 | W91: 3 | X91: 165 | Y91: =SUM(C91+E91+G91+I91+K91+M91+O91+Q91+S91+U91+W91) -> 32 | Z91: =SUM(D91+F91+H91+J91+L91+N91+P91+R91+T91+V91+X91) -> 1831 | AA91: =SUM(Z91/Y91) -> 57.21875 | AB91: =ROUNDDOWN(((AA91-50)*0.8),0) -> 5
A92: =SUM(A91+1) -> 90 | B92: Tyson Gosnell* | C92: 21 | D92: 1373 | E92: 3 | F92: 197 | G92: 6 | H92: 385 | I92: 1 | J92: 75 | Y92: =SUM(C92+E92+G92+I92+K92+M92+O92+Q92+S92+U92+W92) -> 31 | Z92: =SUM(D92+F92+H92+J92+L92+N92+P92+R92+T92+V92+X92) -> 2030 | AA92: =SUM(Z92/Y92) -> 65.483870967741936 | AB92: =ROUNDDOWN(((AA92-50)*0.8),0) -> 12
A93: =SUM(A92+1) -> 91 | B93: Corey Philips | M93: 14 | N93: 847 | O93: 17 | P93: 1008 | Y93: =SUM(C93+E93+G93+I93+K93+M93+O93+Q93+S93+U93+W93) -> 31 | Z93: =SUM(D93+F93+H93+J93+L93+N93+P93+R93+T93+V93+X93) -> 1855 | AA93: =SUM(Z93/Y93) -> 59.838709677419352 | AB93: =ROUNDDOWN(((AA93-50)*0.8),0) -> 7
A94: =SUM(A93+1) -> 92 | B94: Brad Pike | M94: 18 | N94: 1265 | S94: 13 | T94: 852 | Y94: =SUM(C94+E94+G94+I94+K94+M94+O94+Q94+S94+U94+W94) -> 31 | Z94: =SUM(D94+F94+H94+J94+L94+N94+P94+R94+T94+V94+X94) -> 2117 | AA94: =SUM(Z94/Y94) -> 68.290322580645167 | AB94: =ROUNDDOWN(((AA94-50)*0.8),0) -> 14
A95: =SUM(A94+1) -> 93 | B95: KVN | U95: 16 | V95: 837 | W95: 15 | X95: 749 | Y95: =SUM(C95+E95+G95+I95+K95+M95+O95+Q95+S95+U95+W95) -> 31 | Z95: =SUM(D95+F95+H95+J95+L95+N95+P95+R95+T95+V95+X95) -> 1586 | AA95: =SUM(Z95/Y95) -> 51.161290322580648 | AB95: =ROUNDDOWN(((AA95-50)*0.8),0) -> 0
A96: =SUM(A95+1) -> 94 | B96: Brian Cobb | C96: 2 | D96: 126 | E96: 21 | F96: 1367 | G96: 6 | H96: 406 | Y96: =SUM(C96+E96+G96+I96+K96+M96+O96+Q96+S96+U96+W96) -> 29 | Z96: =SUM(D96+F96+H96+J96+L96+N96+P96+R96+T96+V96+X96) -> 1899 | AA96: =SUM(Z96/Y96) -> 65.482758620689651 | AB96: =ROUNDDOWN(((AA96-50)*0.8),0) -> 12
A97: =SUM(A96+1) -> 95 | B97: Brad Milder | O97: 10 | P97: 531 | Q97: 17 | R97: 915 | Y97: =SUM(C97+E97+G97+I97+K97+M97+O97+Q97+S97+U97+W97) -> 27 | Z97: =SUM(D97+F97+H97+J97+L97+N97+P97+R97+T97+V97+X97) -> 1446 | AA97: =SUM(Z97/Y97) -> 53.555555555555557 | AB97: =ROUNDDOWN(((AA97-50)*0.8),0) -> 2
A98: =SUM(A97+1) -> 96 | B98: Joe Grady | Q98: 18 | R98: 1039 | S98: 9 | T98: 503 | Y98: =SUM(C98+E98+G98+I98+K98+M98+O98+Q98+S98+U98+W98) -> 27 | Z98: =SUM(D98+F98+H98+J98+L98+N98+P98+R98+T98+V98+X98) -> 1542 | AA98: =SUM(Z98/Y98) -> 57.111111111111114 | AB98: =ROUNDDOWN(((AA98-50)*0.8),0) -> 5
A99: =SUM(A98+1) -> 97 | B99: Greg Friestad | U99: 11 | V99: 607 | W99: 16 | X99: 856 | Y99: =SUM(C99+E99+G99+I99+K99+M99+O99+Q99+S99+U99+W99) -> 27 | Z99: =SUM(D99+F99+H99+J99+L99+N99+P99+R99+T99+V99+X99) -> 1463 | AA99: =SUM(Z99/Y99) -> 54.185185185185183 | AB99: =ROUNDDOWN(((AA99-50)*0.8),0) -> 3
A100: =SUM(A99+1) -> 98 | B100: Mike Cameron* | G100: 14 | H100: 993 | I100: 12 | J100: 808 | Y100: =SUM(C100+E100+G100+I100+K100+M100+O100+Q100+S100+U100+W100) -> 26 | Z100: =SUM(D100+F100+H100+J100+L100+N100+P100+R100+T100+V100+X100) -> 1801 | AA100: =SUM(Z100/Y100) -> 69.269230769230774 | AB100: =ROUNDDOWN(((AA100-50)*0.8),0) -> 15
A101: =SUM(A100+1) -> 99 | B101: Jeff "Peds" Petoletti | M101: 17 | N101: 1266 | O101: 8 | P101: 549 | Y101: =SUM(C101+E101+G101+I101+K101+M101+O101+Q101+S101+U101+W101) -> 25 | Z101: =SUM(D101+F101+H101+J101+L101+N101+P101+R101+T101+V101+X101) -> 1815 | AA101: =SUM(Z101/Y101) -> 72.600 | AB101: =ROUNDDOWN(((AA101-50)*0.8),0) -> 18
A102: =SUM(A101+1) -> 100 | B102: Charlie Dobberstein | Q102: 18 | R102: 1041 | S102: 3 | T102: 158 | U102: 1 | V102: 53 | W102: 2 | X102: 112 | Y102: =SUM(C102+E102+G102+I102+K102+M102+O102+Q102+S102+U102+W102) -> 24 | Z102: =SUM(D102+F102+H102+J102+L102+N102+P102+R102+T102+V102+X102) -> 1364 | AA102: =SUM(Z102/Y102) -> 56.833333333333336 | AB102: =ROUNDDOWN(((AA102-50)*0.8),0) -> 5
A103: =SUM(A102+1) -> 101 | B103: Justin Oldfield | K103: 15 | L103: 1111 | M103: 8 | N103: 620 | Y103: =SUM(C103+E103+G103+I103+K103+M103+O103+Q103+S103+U103+W103) -> 23 | Z103: =SUM(D103+F103+H103+J103+L103+N103+P103+R103+T103+V103+X103) -> 1731 | AA103: =SUM(Z103/Y103) -> 75.260869565217391 | AB103: =ROUNDDOWN(((AA103-50)*0.8),0) -> 20
A104: =SUM(A103+1) -> 102 | B104: Jason Stroud | S104: 4 | T104: 219 | U104: 18 | V104: 980 | Y104: =SUM(C104+E104+G104+I104+K104+M104+O104+Q104+S104+U104+W104) -> 22 | Z104: =SUM(D104+F104+H104+J104+L104+N104+P104+R104+T104+V104+X104) -> 1199 | AA104: =SUM(Z104/Y104) -> 54.500 | AB104: =ROUNDDOWN(((AA104-50)*0.8),0) -> 3
A105: =SUM(A104+1) -> 103 | B105: Rob Mumma | U105: 18 | V105: 1044 | W105: 4 | X105: 218 | Y105: =SUM(C105+E105+G105+I105+K105+M105+O105+Q105+S105+U105+W105) -> 22 | Z105: =SUM(D105+F105+H105+J105+L105+N105+P105+R105+T105+V105+X105) -> 1262 | AA105: =SUM(Z105/Y105) -> 57.363636363636367 | AB105: =ROUNDDOWN(((AA105-50)*0.8),0) -> 5
A106: =SUM(A105+1) -> 104 | B106: Chad Hein | O106: 19 | P106: 965 | Q106: 2 | R106: 102 | Y106: =SUM(C106+E106+G106+I106+K106+M106+O106+Q106+S106+U106+W106) -> 21 | Z106: =SUM(D106+F106+H106+J106+L106+N106+P106+R106+T106+V106+X106) -> 1067 | AA106: =SUM(Z106/Y106) -> 50.80952380952381 | AB106: =ROUNDDOWN(((AA106-50)*0.8),0) -> 0
A107: =SUM(A106+1) -> 105 | B107: Randy | G107: 17 | H107: 1012 | K107: 3 | L107: 172 | Y107: =SUM(C107+E107+G107+I107+K107+M107+O107+Q107+S107+U107+W107) -> 20 | Z107: =SUM(D107+F107+H107+J107+L107+N107+P107+R107+T107+V107+X107) -> 1184 | AA107: =SUM(Z107/Y107) -> 59.200 | AB107: =ROUNDDOWN(((AA107-50)*0.8),0) -> 7
A108: =SUM(A107+1) -> 106 | B108: Dustin Gaskill | Q108: 5 | R108: 299 | S108: 14 | T108: 845 | U108: 1 | V108: 66 | Y108: =SUM(C108+E108+G108+I108+K108+M108+O108+Q108+S108+U108+W108) -> 20 | Z108: =SUM(D108+F108+H108+J108+L108+N108+P108+R108+T108+V108+X108) -> 1210 | AA108: =SUM(Z108/Y108) -> 60.500 | AB108: 0
A109: =SUM(A108+1) -> 107 | B109: Blake Moel | E109: 19 | F109: 1361 | Y109: =SUM(C109+E109+G109+I109+K109+M109+O109+Q109+S109+U109+W109) -> 19 | Z109: =SUM(D109+F109+H109+J109+L109+N109+P109+R109+T109+V109+X109) -> 1361 | AA109: =SUM(Z109/Y109) -> 71.631578947368425 | AB109: =ROUNDDOWN(((AA109-50)*0.8),0) -> 17
A110: =SUM(A109+1) -> 108 | B110: Lon Reilly | O110: 19 | P110: 1050 | Y110: =SUM(C110+E110+G110+I110+K110+M110+O110+Q110+S110+U110+W110) -> 19 | Z110: =SUM(D110+F110+H110+J110+L110+N110+P110+R110+T110+V110+X110) -> 1050 | AA110: =SUM(Z110/Y110) -> 55.263157894736842 | AB110: =ROUNDDOWN(((AA110-50)*0.8),0) -> 4
A111: =SUM(A110+1) -> 109 | B111: Chase Roberts | O111: 19 | P111: 973 | Y111: =SUM(C111+E111+G111+I111+K111+M111+O111+Q111+S111+U111+W111) -> 19 | Z111: =SUM(D111+F111+H111+J111+L111+N111+P111+R111+T111+V111+X111) -> 973 | AA111: =SUM(Z111/Y111) -> 51.210526315789473 | AB111: =ROUNDDOWN(((AA111-50)*0.8),0) -> 0
A112: =SUM(A111+1) -> 110 | B112: John Petrie | M112: 18 | N112: 1093 | S112: 1 | T112: 61 | Y112: =SUM(C112+E112+G112+I112+K112+M112+O112+Q112+S112+U112+W112) -> 19 | Z112: =SUM(D112+F112+H112+J112+L112+N112+P112+R112+T112+V112+X112) -> 1154 | AA112: =SUM(Z112/Y112) -> 60.736842105263158 | AB112: =ROUNDDOWN(((AA112-50)*0.8),0) -> 8
A113: =SUM(A112+1) -> 111 | B113: Matt Ross* | U113: 2 | V113: 116 | W113: 17 | X113: 930 | Y113: =SUM(C113+E113+G113+I113+K113+M113+O113+Q113+S113+U113+W113) -> 19 | Z113: =SUM(D113+F113+H113+J113+L113+N113+P113+R113+T113+V113+X113) -> 1046 | AA113: =SUM(Z113/Y113) -> 55.05263157894737 | AB113: =ROUNDDOWN(((AA113-50)*0.8),0) -> 4
A114: =SUM(A113+1) -> 112 | B114: Ben Greco | G114: 18 | H114: 1161 | Y114: =SUM(C114+E114+G114+I114+K114+M114+O114+Q114+S114+U114+W114) -> 18 | Z114: =SUM(D114+F114+H114+J114+L114+N114+P114+R114+T114+V114+X114) -> 1161 | AA114: =SUM(Z114/Y114) -> 64.500 | AB114: =ROUNDDOWN(((AA114-50)*0.8),0) -> 11
A115: =SUM(A114+1) -> 113 | B115: Kurt Kramer | K115: 18 | L115: 1083 | Y115: =SUM(C115+E115+G115+I115+K115+M115+O115+Q115+S115+U115+W115) -> 18 | Z115: =SUM(D115+F115+H115+J115+L115+N115+P115+R115+T115+V115+X115) -> 1083 | AA115: =SUM(Z115/Y115) -> 60.166666666666664 | AB115: =ROUNDDOWN(((AA115-50)*0.8),0) -> 8
A116: =SUM(A115+1) -> 114 | B116: Andy Moel | G116: 18 | H116: 1082 | Y116: =SUM(C116+E116+G116+I116+K116+M116+O116+Q116+S116+U116+W116) -> 18 | Z116: =SUM(D116+F116+H116+J116+L116+N116+P116+R116+T116+V116+X116) -> 1082 | AA116: =SUM(Z116/Y116) -> 60.111111111111114 | AB116: =ROUNDDOWN(((AA116-50)*0.8),0) -> 8
A117: =SUM(A116+1) -> 115 | B117: Dan Ferch | U117: 18 | V117: 1006 | Y117: =SUM(C117+E117+G117+I117+K117+M117+O117+Q117+S117+U117+W117) -> 18 | Z117: =SUM(D117+F117+H117+J117+L117+N117+P117+R117+T117+V117+X117) -> 1006 | AA117: =SUM(Z117/Y117) -> 55.888888888888886 | AB117: =ROUNDDOWN(((AA117-50)*0.8),0) -> 4
A118: =SUM(A117+1) -> 116 | B118: Andrew Hamer | U118: 18 | V118: 1028 | Y118: =SUM(C118+E118+G118+I118+K118+M118+O118+Q118+S118+U118+W118) -> 18 | Z118: =SUM(D118+F118+H118+J118+L118+N118+P118+R118+T118+V118+X118) -> 1028 | AA118: =SUM(Z118/Y118) -> 57.111111111111114 | AB118: =ROUNDDOWN(((AA118-50)*0.8),0) -> 5
A119: =SUM(A118+1) -> 117 | B119: Matt Pease | U119: 18 | V119: 1089 | Y119: =SUM(C119+E119+G119+I119+K119+M119+O119+Q119+S119+U119+W119) -> 18 | Z119: =SUM(D119+F119+H119+J119+L119+N119+P119+R119+T119+V119+X119) -> 1089 | AA119: =SUM(Z119/Y119) -> 60.500 | AB119: =ROUNDDOWN(((AA119-50)*0.8),0) -> 8
A120: =SUM(A119+1) -> 118 | B120: Strad Docterman | U120: 18 | V120: 1148 | Y120: =SUM(C120+E120+G120+I120+K120+M120+O120+Q120+S120+U120+W120) -> 18 | Z120: =SUM(D120+F120+H120+J120+L120+N120+P120+R120+T120+V120+X120) -> 1148 | AA120: =SUM(Z120/Y120) -> 63.777777777777779 | AB120: =ROUNDDOWN(((AA120-50)*0.8),0) -> 11
A121: =SUM(A120+1) -> 119 | B121: Tim Potter* | W121: 18 | X121: 930 | Y121: =SUM(C121+E121+G121+I121+K121+M121+O121+Q121+S121+U121+W121) -> 18 | Z121: =SUM(D121+F121+H121+J121+L121+N121+P121+R121+T121+V121+X121) -> 930 | AA121: =SUM(Z121/Y121) -> 51.666666666666664 | AB121: =ROUNDDOWN(((AA121-50)*0.8),0) -> 1
A122: =SUM(A121+1) -> 120 | B122: Nathan Ciha | W122: 18 | X122: 1003 | Y122: =SUM(C122+E122+G122+I122+K122+M122+O122+Q122+S122+U122+W122) -> 18 | Z122: =SUM(D122+F122+H122+J122+L122+N122+P122+R122+T122+V122+X122) -> 1003 | AA122: =SUM(Z122/Y122) -> 55.722222222222221 | AB122: =ROUNDDOWN(((AA122-50)*0.8),0) -> 4
A123: =SUM(A122+1) -> 121 | B123: Ross Welter | O123: 17 | P123: 1124 | Y123: =SUM(C123+E123+G123+I123+K123+M123+O123+Q123+S123+U123+W123) -> 17 | Z123: =SUM(D123+F123+H123+J123+L123+N123+P123+R123+T123+V123+X123) -> 1124 | AA123: =SUM(Z123/Y123) -> 66.117647058823536 | AB123: =ROUNDDOWN(((AA123-50)*0.8),0) -> 12
A124: =SUM(A123+1) -> 122 | B124: Nate Elbert | O124: 17 | P124: 1061 | Y124: =SUM(C124+E124+G124+I124+K124+M124+O124+Q124+S124+U124+W124) -> 17 | Z124: =SUM(D124+F124+H124+J124+L124+N124+P124+R124+T124+V124+X124) -> 1061 | AA124: =SUM(Z124/Y124) -> 62.411764705882355 | AB124: =ROUNDDOWN(((AA124-50)*0.8),0) -> 9
A125: =SUM(A124+1) -> 123 | B125: Clint Loonan | O125: 17 | P125: 980 | Y125: =SUM(C125+E125+G125+I125+K125+M125+O125+Q125+S125+U125+W125) -> 17 | Z125: =SUM(D125+F125+H125+J125+L125+N125+P125+R125+T125+V125+X125) -> 980 | AA125: =SUM(Z125/Y125) -> 57.647058823529413 | AB125: =ROUNDDOWN(((AA125-50)*0.8),0) -> 6
A126: =SUM(A125+1) -> 124 | B126: Bridgette Rew | U126: 17 | V126: 1170 | Y126: =SUM(C126+E126+G126+I126+K126+M126+O126+Q126+S126+U126+W126) -> 17 | Z126: =SUM(D126+F126+H126+J126+L126+N126+P126+R126+T126+V126+X126) -> 1170 | AA126: =SUM(Z126/Y126) -> 68.82352941176471 | AB126: =ROUNDDOWN(((AA126-50)*0.8),0) -> 15
A127: =SUM(A126+1) -> 125 | B127: Chuck Hansen | W127: 17 | X127: 1030 | Y127: =SUM(C127+E127+G127+I127+K127+M127+O127+Q127+S127+U127+W127) -> 17 | Z127: =SUM(D127+F127+H127+J127+L127+N127+P127+R127+T127+V127+X127) -> 1030 | AA127: =SUM(Z127/Y127) -> 60.588235294117645 | AB127: =ROUNDDOWN(((AA127-50)*0.8),0) -> 8
A128: =SUM(A127+1) -> 126 | B128: David Brown | S128: 16 | T128: 960 | Y128: =SUM(C128+E128+G128+I128+K128+M128+O128+Q128+S128+U128+W128) -> 16 | Z128: =SUM(D128+F128+H128+J128+L128+N128+P128+R128+T128+V128+X128) -> 960 | AA128: =SUM(Z128/Y128) -> 60.000 | AB128: =ROUNDDOWN(((AA128-50)*0.8),0) -> 8
A129: =SUM(A128+1) -> 127 | B129: Scott Lindsley | S129: 13 | T129: 724 | U129: 3 | V129: 165 | Y129: =SUM(C129+E129+G129+I129+K129+M129+O129+Q129+S129+U129+W129) -> 16 | Z129: =SUM(D129+F129+H129+J129+L129+N129+P129+R129+T129+V129+X129) -> 889 | AA129: =SUM(Z129/Y129) -> 55.5625 | AB129: =ROUNDDOWN(((AA129-50)*0.8),0) -> 4
A130: =SUM(A129+1) -> 128 | B130: John Williams | W130: 16 | X130: 954 | Y130: =SUM(C130+E130+G130+I130+K130+M130+O130+Q130+S130+U130+W130) -> 16 | Z130: =SUM(D130+F130+H130+J130+L130+N130+P130+R130+T130+V130+X130) -> 954 | AA130: =SUM(Z130/Y130) -> 59.625 | AB130: =ROUNDDOWN(((AA130-50)*0.8),0) -> 7
A131: =SUM(A130+1) -> 129 | B131: Trevor Dickerson | W131: 16 | X131: 961 | Y131: =SUM(C131+E131+G131+I131+K131+M131+O131+Q131+S131+U131+W131) -> 16 | Z131: =SUM(D131+F131+H131+J131+L131+N131+P131+R131+T131+V131+X131) -> 961 | AA131: =SUM(Z131/Y131) -> 60.0625 | AB131: =ROUNDDOWN(((AA131-50)*0.8),0) -> 8
A132: =SUM(A131+1) -> 130 | B132: Ryan Eggleston | W132: 15 | X132: 887 | Y132: =SUM(C132+E132+G132+I132+K132+M132+O132+Q132+S132+U132+W132) -> 15 | Z132: =SUM(D132+F132+H132+J132+L132+N132+P132+R132+T132+V132+X132) -> 887 | AA132: =SUM(Z132/Y132) -> 59.133333333333333 | AB132: =ROUNDDOWN(((AA132-50)*0.8),0) -> 7
A133: =SUM(A132+1) -> 131 | B133: Seth Marling | S133: 14 | T133: 849 | Y133: =SUM(C133+E133+G133+I133+K133+M133+O133+Q133+S133+U133+W133) -> 14 | Z133: =SUM(D133+F133+H133+J133+L133+N133+P133+R133+T133+V133+X133) -> 849 | AA133: =SUM(Z133/Y133) -> 60.642857142857146 | AB133: =ROUNDDOWN(((AA133-50)*0.8),0) -> 8
A134: =SUM(A133+1) -> 132 | B134: Shane Thirtyacre | W134: 14 | X134: 821 | Y134: =SUM(C134+E134+G134+I134+K134+M134+O134+Q134+S134+U134+W134) -> 14 | Z134: =SUM(D134+F134+H134+J134+L134+N134+P134+R134+T134+V134+X134) -> 821 | AA134: =SUM(Z134/Y134) -> 58.642857142857146 | AB134: =ROUNDDOWN(((AA134-50)*0.8),0) -> 6
A135: =SUM(A134+1) -> 133 | B135: Nate Lenzini | M135: 13 | N135: 809 | Y135: =SUM(C135+E135+G135+I135+K135+M135+O135+Q135+S135+U135+W135) -> 13 | Z135: =SUM(D135+F135+H135+J135+L135+N135+P135+R135+T135+V135+X135) -> 809 | AA135: =SUM(Z135/Y135) -> 62.230769230769234 | AB135: =ROUNDDOWN(((AA135-50)*0.8),0) -> 9
A136: =SUM(A135+1) -> 134 | B136: Nathan Johnson | O136: 3 | P136: 175 | Q136: 10 | R136: 549 | Y136: =SUM(C136+E136+G136+I136+K136+M136+O136+Q136+S136+U136+W136) -> 13 | Z136: =SUM(D136+F136+H136+J136+L136+N136+P136+R136+T136+V136+X136) -> 724 | AA136: =SUM(Z136/Y136) -> 55.692307692307693 | AB136: =ROUNDDOWN(((AA136-50)*0.8),0) -> 4
A137: =SUM(A136+1) -> 135 | B137: Dan Lewis | W137: 13 | X137: 740 | Y137: =SUM(C137+E137+G137+I137+K137+M137+O137+Q137+S137+U137+W137) -> 13 | Z137: =SUM(D137+F137+H137+J137+L137+N137+P137+R137+T137+V137+X137) -> 740 | AA137: =SUM(Z137/Y137) -> 56.92307692307692 | AB137: =ROUNDDOWN(((AA137-50)*0.8),0) -> 5
A138: =SUM(A137+1) -> 136 | B138: Chris Bentler | G138: 11 | H138: 620 | I138: 1 | J138: 53 | Y138: =SUM(C138+E138+G138+I138+K138+M138+O138+Q138+S138+U138+W138) -> 12 | Z138: =SUM(D138+F138+H138+J138+L138+N138+P138+R138+T138+V138+X138) -> 673 | AA138: =SUM(Z138/Y138) -> 56.083333333333336 | AB138: =ROUNDDOWN(((AA138-50)*0.8),0) -> 4
A139: =SUM(A138+1) -> 137 | B139: Al | C139: 11 | D139: 809 | Y139: =SUM(C139+E139+G139+I139+K139+M139+O139+Q139+S139+U139+W139) -> 11 | Z139: =SUM(D139+F139+H139+J139+L139+N139+P139+R139+T139+V139+X139) -> 809 | AA139: =SUM(Z139/Y139) -> 73.545454545454547 | AB139: =ROUNDDOWN(((AA139-50)*0.8),0) -> 18
A140: =SUM(A139+1) -> 138 | B140: Craig | G140: 6 | H140: 356 | I140: 5 | J140: 295 | Y140: =SUM(C140+E140+G140+I140+K140+M140+O140+Q140+S140+U140+W140) -> 11 | Z140: =SUM(D140+F140+H140+J140+L140+N140+P140+R140+T140+V140+X140) -> 651 | AA140: =SUM(Z140/Y140) -> 59.18181818181818 | AB140: =ROUNDDOWN(((AA140-50)*0.8),0) -> 7
A141: =SUM(A140+1) -> 139 | B141: Lyle Theisen | S141: 10 | T141: 718 | Y141: =SUM(C141+E141+G141+I141+K141+M141+O141+Q141+S141+U141+W141) -> 10 | Z141: =SUM(D141+F141+H141+J141+L141+N141+P141+R141+T141+V141+X141) -> 718 | AA141: =SUM(Z141/Y141) -> 71.800 | AB141: =ROUNDDOWN(((AA141-50)*0.8),0) -> 17
A142: =SUM(A141+1) -> 140 | B142: Jack Gilmore | Q142: 9 | R142: 512 | U142: 1 | V142: 52 | Y142: =SUM(C142+E142+G142+I142+K142+M142+O142+Q142+S142+U142+W142) -> 10 | Z142: =SUM(D142+F142+H142+J142+L142+N142+P142+R142+T142+V142+X142) -> 564 | AA142: =SUM(Z142/Y142) -> 56.400 | AB142: =ROUNDDOWN(((AA142-50)*0.8),0) -> 5
A143: =SUM(A142+1) -> 141 | B143: Adam Olsen | Q143: 8 | R143: 380 | S143: 1 | T143: 53 | W143: 1 | X143: 47 | Y143: =SUM(C143+E143+G143+I143+K143+M143+O143+Q143+S143+U143+W143) -> 10 | Z143: =SUM(D143+F143+H143+J143+L143+N143+P143+R143+T143+V143+X143) -> 480 | AA143: =SUM(Z143/Y143) -> 48.000 | AB143: =ROUNDDOWN(((AA143-50)*0.8),0) -> -1
A144: =SUM(A143+1) -> 142 | B144: Brian Points | K144: 9 | L144: 633 | Y144: =SUM(C144+E144+G144+I144+K144+M144+O144+Q144+S144+U144+W144) -> 9 | Z144: =SUM(D144+F144+H144+J144+L144+N144+P144+R144+T144+V144+X144) -> 633 | AA144: =SUM(Z144/Y144) -> 70.333333333333329 | AB144: =ROUNDDOWN(((AA144-50)*0.8),0) -> 16
A145: =SUM(A144+1) -> 143 | B145: Kidwell | G145: 9 | H145: 552 | Y145: =SUM(C145+E145+G145+I145+K145+M145+O145+Q145+S145+U145+W145) -> 9 | Z145: =SUM(D145+F145+H145+J145+L145+N145+P145+R145+T145+V145+X145) -> 552 | AA145: =SUM(Z145/Y145) -> 61.333333333333336 | AB145: =ROUNDDOWN(((AA145-50)*0.8),0) -> 9
A146: =SUM(A145+1) -> 144 | B146: Nate | G146: 8 | H146: 456 | Y146: =SUM(C146+E146+G146+I146+K146+M146+O146+Q146+S146+U146+W146) -> 8 | Z146: =SUM(D146+F146+H146+J146+L146+N146+P146+R146+T146+V146+X146) -> 456 | AA146: =SUM(Z146/Y146) -> 57.000 | AB146: =ROUNDDOWN(((AA146-50)*0.8),0) -> 5
A147: =SUM(A146+1) -> 145 | B147: Doug Knepp | S147: 2 | T147: 131 | U147: 6 | V147: 390 | Y147: =SUM(C147+E147+G147+I147+K147+M147+O147+Q147+S147+U147+W147) -> 8 | Z147: =SUM(D147+F147+H147+J147+L147+N147+P147+R147+T147+V147+X147) -> 521 | AA147: =SUM(Z147/Y147) -> 65.125 | AB147: =ROUNDDOWN(((AA147-50)*0.8),0) -> 12
A148: =SUM(A147+1) -> 146 | B148: Chris Farnsworth | W148: 8 | X148: 507 | Y148: =SUM(C148+E148+G148+I148+K148+M148+O148+Q148+S148+U148+W148) -> 8 | Z148: =SUM(D148+F148+H148+J148+L148+N148+P148+R148+T148+V148+X148) -> 507 | AA148: =SUM(Z148/Y148) -> 63.375 | AB148: =ROUNDDOWN(((AA148-50)*0.8),0) -> 10
A149: =SUM(A148+1) -> 147 | B149: Doug Johnson | Q149: 2 | R149: 99 | U149: 1 | V149: 49 | W149: 5 | X149: 246 | Y149: =SUM(C149+E149+G149+I149+K149+M149+O149+Q149+S149+U149+W149) -> 8 | Z149: =SUM(D149+F149+H149+J149+L149+N149+P149+R149+T149+V149+X149) -> 394 | AA149: =SUM(Z149/Y149) -> 49.250 | AB149: =ROUNDDOWN(((AA149-50)*0.8),0) -> 0
A150: =SUM(A149+1) -> 148 | B150: Abel | G150: 7 | H150: 419 | Y150: =SUM(C150+E150+G150+I150+K150+M150+O150+Q150+S150+U150+W150) -> 7 | Z150: =SUM(D150+F150+H150+J150+L150+N150+P150+R150+T150+V150+X150) -> 419 | AA150: =SUM(Z150/Y150) -> 59.857142857142854 | AB150: =ROUNDDOWN(((AA150-50)*0.8),0) -> 7
A151: =SUM(A150+1) -> 149 | B151: "Btch'n" | M151: 1 | N151: 60 | Q151: 6 | R151: 348 | Y151: =SUM(C151+E151+G151+I151+K151+M151+O151+Q151+S151+U151+W151) -> 7 | Z151: =SUM(D151+F151+H151+J151+L151+N151+P151+R151+T151+V151+X151) -> 408 | AA151: =SUM(Z151/Y151) -> 58.285714285714285 | AB151: =ROUNDDOWN(((AA151-50)*0.8),0) -> 6
A152: =SUM(A151+1) -> 150 | B152: Steve Lepeltak | S152: 7 | T152: 539 | Y152: =SUM(C152+E152+G152+I152+K152+M152+O152+Q152+S152+U152+W152) -> 7 | Z152: =SUM(D152+F152+H152+J152+L152+N152+P152+R152+T152+V152+X152) -> 539 | AA152: =SUM(Z152/Y152) -> 77.000 | AB152: =ROUNDDOWN(((AA152-50)*0.8),0) -> 21
A153: =SUM(A152+1) -> 151 | B153: Jason Baxter | S153: 7 | T153: 560 | Y153: =SUM(C153+E153+G153+I153+K153+M153+O153+Q153+S153+U153+W153) -> 7 | Z153: =SUM(D153+F153+H153+J153+L153+N153+P153+R153+T153+V153+X153) -> 560 | AA153: =SUM(Z153/Y153) -> 80.000 | AB153: =ROUNDDOWN(((AA153-50)*0.8),0) -> 24
A154: =SUM(A153+1) -> 152 | B154: Zach Votroubeck | W154: 7 | X154: 431 | Y154: =SUM(C154+E154+G154+I154+K154+M154+O154+Q154+S154+U154+W154) -> 7 | Z154: =SUM(D154+F154+H154+J154+L154+N154+P154+R154+T154+V154+X154) -> 431 | AA154: =SUM(Z154/Y154) -> 61.571428571428569 | AB154: =ROUNDDOWN(((AA154-50)*0.8),0) -> 9
A155: =SUM(A154+1) -> 153 | B155: Aaron Gaddis | I155: 6 | J155: 429 | Y155: =SUM(C155+E155+G155+I155+K155+M155+O155+Q155+S155+U155+W155) -> 6 | Z155: =SUM(D155+F155+H155+J155+L155+N155+P155+R155+T155+V155+X155) -> 429 | AA155: =SUM(Z155/Y155) -> 71.500 | AB155: =ROUNDDOWN(((AA155-50)*0.8),0) -> 17
A156: =SUM(A155+1) -> 154 | B156: Chrs Timko | Q156: 6 | R156: 343 | Y156: =SUM(C156+E156+G156+I156+K156+M156+O156+Q156+S156+U156+W156) -> 6 | Z156: =SUM(D156+F156+H156+J156+L156+N156+P156+R156+T156+V156+X156) -> 343 | AA156: =SUM(Z156/Y156) -> 57.166666666666664 | AB156: =ROUNDDOWN(((AA156-50)*0.8),0) -> 5
A157: =SUM(A156+1) -> 155 | B157: Clay Abernathy | Q157: 6 | R157: 305 | Y157: =SUM(C157+E157+G157+I157+K157+M157+O157+Q157+S157+U157+W157) -> 6 | Z157: =SUM(D157+F157+H157+J157+L157+N157+P157+R157+T157+V157+X157) -> 305 | AA157: =SUM(Z157/Y157) -> 50.833333333333336 | AB157: =ROUNDDOWN(((AA157-50)*0.8),0) -> 0
A158: =SUM(A157+1) -> 156 | B158: Lance Hansen | G158: 6 | H158: 296 | Y158: =SUM(C158+E158+G158+I158+K158+M158+O158+Q158+S158+U158+W158) -> 6 | Z158: =SUM(D158+F158+H158+J158+L158+N158+P158+R158+T158+V158+X158) -> 296 | AA158: =SUM(Z158/Y158) -> 49.333333333333336 | AB158: =ROUNDDOWN(((AA158-50)*0.8),0) -> 0
A159: =SUM(A158+1) -> 157 | B159: Cassie Shear | O159: 2 | P159: 125 | S159: 4 | T159: 241 | Y159: =SUM(C159+E159+G159+I159+K159+M159+O159+Q159+S159+U159+W159) -> 6 | Z159: =SUM(D159+F159+H159+J159+L159+N159+P159+R159+T159+V159+X159) -> 366 | AA159: =SUM(Z159/Y159) -> 61.000 | AB159: =ROUNDDOWN(((AA159-50)*0.8),0) -> 8
A160: =SUM(A159+1) -> 158 | B160: Bobby Jo | M160: 5 | N160: 414 | Y160: =SUM(C160+E160+G160+I160+K160+M160+O160+Q160+S160+U160+W160) -> 5 | Z160: =SUM(D160+F160+H160+J160+L160+N160+P160+R160+T160+V160+X160) -> 414 | AA160: =SUM(Z160/Y160) -> 82.800 | AB160: =ROUNDDOWN(((AA160-50)*0.8),0) -> 26
A161: =SUM(A160+1) -> 159 | B161: Steve H. | G161: 3 | H161: 193 | I161: 2 | J161: 128 | Y161: =SUM(C161+E161+G161+I161+K161+M161+O161+Q161+S161+U161+W161) -> 5 | Z161: =SUM(D161+F161+H161+J161+L161+N161+P161+R161+T161+V161+X161) -> 321 | AA161: =SUM(Z161/Y161) -> 64.200 | AB161: =ROUNDDOWN(((AA161-50)*0.8),0) -> 11
A162: =SUM(A161+1) -> 160 | B162: Mickey | G162: 5 | H162: 315 | Y162: =SUM(C162+E162+G162+I162+K162+M162+O162+Q162+S162+U162+W162) -> 5 | Z162: =SUM(D162+F162+H162+J162+L162+N162+P162+R162+T162+V162+X162) -> 315 | AA162: =SUM(Z162/Y162) -> 63.000 | AB162: =ROUNDDOWN(((AA162-50)*0.8),0) -> 10
A163: =SUM(A162+1) -> 161 | B163: Kurtis Kron | U163: 5 | V163: 332 | Y163: =SUM(C163+E163+G163+I163+K163+M163+O163+Q163+S163+U163+W163) -> 5 | Z163: =SUM(D163+F163+H163+J163+L163+N163+P163+R163+T163+V163+X163) -> 332 | AA163: =SUM(Z163/Y163) -> 66.400 | AB163: =ROUNDDOWN(((AA163-50)*0.8),0) -> 13
A164: =SUM(A163+1) -> 162 | B164: "Mepo" | M164: 4 | N164: 268 | W164: 1 | X164: 64 | Y164: =SUM(C164+E164+G164+I164+K164+M164+O164+Q164+S164+U164+W164) -> 5 | Z164: =SUM(D164+F164+H164+J164+L164+N164+P164+R164+T164+V164+X164) -> 332 | AA164: =SUM(Z164/Y164) -> 66.400 | AB164: =ROUNDDOWN(((AA164-50)*0.8),0) -> 13
A165: =SUM(A164+1) -> 163 | B165: Jeane H. | M165: 4 | N165: 266 | Y165: =SUM(C165+E165+G165+I165+K165+M165+O165+Q165+S165+U165+W165) -> 4 | Z165: =SUM(D165+F165+H165+J165+L165+N165+P165+R165+T165+V165+X165) -> 266 | AA165: =SUM(Z165/Y165) -> 66.500 | AB165: =ROUNDDOWN(((AA165-50)*0.8),0) -> 13
A166: =SUM(A165+1) -> 164 | B166: Joel Crow | K166: 3 | L166: 175 | Q166: 1 | R166: 59 | Y166: =SUM(C166+E166+G166+I166+K166+M166+O166+Q166+S166+U166+W166) -> 4 | Z166: =SUM(D166+F166+H166+J166+L166+N166+P166+R166+T166+V166+X166) -> 234 | AA166: =SUM(Z166/Y166) -> 58.500 | AB166: =ROUNDDOWN(((AA166-50)*0.8),0) -> 6
A167: =SUM(A166+1) -> 165 | B167: Jeni Zeiser | S167: 4 | T167: 395 | Y167: =SUM(C167+E167+G167+I167+K167+M167+O167+Q167+S167+U167+W167) -> 4 | Z167: =SUM(D167+F167+H167+J167+L167+N167+P167+R167+T167+V167+X167) -> 395 | AA167: =SUM(Z167/Y167) -> 98.750 | AB167: =ROUNDDOWN(((AA167-50)*0.8),0) -> 39
A168: =SUM(A167+1) -> 166 | B168: Eric VanDeusen | U168: 4 | V168: 257 | Y168: =SUM(C168+E168+G168+I168+K168+M168+O168+Q168+S168+U168+W168) -> 4 | Z168: =SUM(D168+F168+H168+J168+L168+N168+P168+R168+T168+V168+X168) -> 257 | AA168: =SUM(Z168/Y168) -> 64.250 | AB168: =ROUNDDOWN(((AA168-50)*0.8),0) -> 11
A169: =SUM(A168+1) -> 167 | B169: Steven Crow | K169: 3 | L169: 162 | Y169: =SUM(C169+E169+G169+I169+K169+M169+O169+Q169+S169+U169+W169) -> 3 | Z169: =SUM(D169+F169+H169+J169+L169+N169+P169+R169+T169+V169+X169) -> 162 | AA169: =SUM(Z169/Y169) -> 54.000 | AB169: =ROUNDDOWN(((AA169-50)*0.8),0) -> 3
A170: =SUM(A169+1) -> 168 | B170: Jenny Robertson | S170: 3 | T170: 219 | Y170: =SUM(C170+E170+G170+I170+K170+M170+O170+Q170+S170+U170+W170) -> 3 | Z170: =SUM(D170+F170+H170+J170+L170+N170+P170+R170+T170+V170+X170) -> 219 | AA170: =SUM(Z170/Y170) -> 73.000 | AB170: =ROUNDDOWN(((AA170-50)*0.8),0) -> 18
A171: =SUM(A170+1) -> 169 | B171: Cody Green | U171: 3 | V171: 171 | Y171: =SUM(C171+E171+G171+I171+K171+M171+O171+Q171+S171+U171+W171) -> 3 | Z171: =SUM(D171+F171+H171+J171+L171+N171+P171+R171+T171+V171+X171) -> 171 | AA171: =SUM(Z171/Y171) -> 57.000 | AB171: =ROUNDDOWN(((AA171-50)*0.8),0) -> 5
A172: =SUM(A171+1) -> 170 | B172: Tom Hashman | U172: 3 | V172: 192 | Y172: =SUM(C172+E172+G172+I172+K172+M172+O172+Q172+S172+U172+W172) -> 3 | Z172: =SUM(D172+F172+H172+J172+L172+N172+P172+R172+T172+V172+X172) -> 192 | AA172: =SUM(Z172/Y172) -> 64.000 | AB172: =ROUNDDOWN(((AA172-50)*0.8),0) -> 11
A173: =SUM(A172+1) -> 171 | B173: Kurt Conrad | W173: 3 | X173: 157 | Y173: =SUM(C173+E173+G173+I173+K173+M173+O173+Q173+S173+U173+W173) -> 3 | Z173: =SUM(D173+F173+H173+J173+L173+N173+P173+R173+T173+V173+X173) -> 157 | AA173: =SUM(Z173/Y173) -> 52.333333333333336 | AB173: =ROUNDDOWN(((AA173-50)*0.8),0) -> 1
A174: =SUM(A173+1) -> 172 | B174: Dave Murphy | M174: 2 | N174: 131 | Y174: =SUM(C174+E174+G174+I174+K174+M174+O174+Q174+S174+U174+W174) -> 2 | Z174: =SUM(D174+F174+H174+J174+L174+N174+P174+R174+T174+V174+X174) -> 131 | AA174: =SUM(Z174/Y174) -> 65.500 | AB174: =ROUNDDOWN(((AA174-50)*0.8),0) -> 12
A175: =SUM(A174+1) -> 173 | B175: Allice "In" Chains | K175: 2 | L175: 115 | Y175: =SUM(C175+E175+G175+I175+K175+M175+O175+Q175+S175+U175+W175) -> 2 | Z175: =SUM(D175+F175+H175+J175+L175+N175+P175+R175+T175+V175+X175) -> 115 | AA175: =SUM(Z175/Y175) -> 57.500 | AB175: =ROUNDDOWN(((AA175-50)*0.8),0) -> 6
A176: =SUM(A175+1) -> 174 | B176: Chad Kawami | M176: 2 | N176: 107 | Y176: =SUM(C176+E176+G176+I176+K176+M176+O176+Q176+S176+U176+W176) -> 2 | Z176: =SUM(D176+F176+H176+J176+L176+N176+P176+R176+T176+V176+X176) -> 107 | AA176: =SUM(Z176/Y176) -> 53.500 | AB176: =ROUNDDOWN(((AA176-50)*0.8),0) -> 2
A177: =SUM(A176+1) -> 175 | B177: Brandon Sheer | S177: 2 | T177: 122 | Y177: =SUM(C177+E177+G177+I177+K177+M177+O177+Q177+S177+U177+W177) -> 2 | Z177: =SUM(D177+F177+H177+J177+L177+N177+P177+R177+T177+V177+X177) -> 122 | AA177: =SUM(Z177/Y177) -> 61.000 | AB177: =ROUNDDOWN(((AA177-50)*0.8),0) -> 8
A178: =SUM(A177+1) -> 176 | B178: John McClellan | S178: 2 | T178: 129 | Y178: =SUM(C178+E178+G178+I178+K178+M178+O178+Q178+S178+U178+W178) -> 2 | Z178: =SUM(D178+F178+H178+J178+L178+N178+P178+R178+T178+V178+X178) -> 129 | AA178: =SUM(Z178/Y178) -> 64.500 | AB178: =ROUNDDOWN(((AA178-50)*0.8),0) -> 11
A179: =SUM(A178+1) -> 177 | B179: Robb Neubrand | U179: 2 | V179: 108 | Y179: =SUM(C179+E179+G179+I179+K179+M179+O179+Q179+S179+U179+W179) -> 2 | Z179: =SUM(D179+F179+H179+J179+L179+N179+P179+R179+T179+V179+X179) -> 108 | AA179: =SUM(Z179/Y179) -> 54.000 | AB179: =ROUNDDOWN(((AA179-50)*0.8),0) -> 3
A180: =SUM(A179+1) -> 178 | B180: Jake Alheid | U180: 2 | V180: 129 | Y180: =SUM(C180+E180+G180+I180+K180+M180+O180+Q180+S180+U180+W180) -> 2 | Z180: =SUM(D180+F180+H180+J180+L180+N180+P180+R180+T180+V180+X180) -> 129 | AA180: =SUM(Z180/Y180) -> 64.500 | AB180: =ROUNDDOWN(((AA180-50)*0.8),0) -> 11
A181: =SUM(A180+1) -> 179 | B181: Josh Spang | S181: 1 | T181: 55 | W181: 1 | X181: 49 | Y181: =SUM(C181+E181+G181+I181+K181+M181+O181+Q181+S181+U181+W181) -> 2 | Z181: =SUM(D181+F181+H181+J181+L181+N181+P181+R181+T181+V181+X181) -> 104 | AA181: =SUM(Z181/Y181) -> 52.000 | AB181: =ROUNDDOWN(((AA181-50)*0.8),0) -> 1
A182: =SUM(A181+1) -> 180 | B182: Adam Karstens | U182: 1 | V182: 54 | W182: 1 | X182: 55 | Y182: =SUM(C182+E182+G182+I182+K182+M182+O182+Q182+S182+U182+W182) -> 2 | Z182: =SUM(D182+F182+H182+J182+L182+N182+P182+R182+T182+V182+X182) -> 109 | AA182: =SUM(Z182/Y182) -> 54.500 | AB182: =ROUNDDOWN(((AA182-50)*0.8),0) -> 3
A183: =SUM(A182+1) -> 181 | B183: Justin Harris | W183: 2 | X183: 119 | Y183: =SUM(C183+E183+G183+I183+K183+M183+O183+Q183+S183+U183+W183) -> 2 | Z183: =SUM(D183+F183+H183+J183+L183+N183+P183+R183+T183+V183+X183) -> 119 | AA183: =SUM(Z183/Y183) -> 59.500 | AB183: =ROUNDDOWN(((AA183-50)*0.8),0) -> 7
A184: =SUM(A183+1) -> 182 | B184: Chase Norton | W184: 2 | X184: 118 | Y184: =SUM(C184+E184+G184+I184+K184+M184+O184+Q184+S184+U184+W184) -> 2 | Z184: =SUM(D184+F184+H184+J184+L184+N184+P184+R184+T184+V184+X184) -> 118 | AA184: =SUM(Z184/Y184) -> 59.000 | AB184: =ROUNDDOWN(((AA184-50)*0.8),0) -> 7
A185: =SUM(A184+1) -> 183 | B185: TJ Nanke | W185: 2 | X185: 113 | Y185: =SUM(C185+E185+G185+I185+K185+M185+O185+Q185+S185+U185+W185) -> 2 | Z185: =SUM(D185+F185+H185+J185+L185+N185+P185+R185+T185+V185+X185) -> 113 | AA185: =SUM(Z185/Y185) -> 56.500 | AB185: =ROUNDDOWN(((AA185-50)*0.8),0) -> 5
A186: =SUM(A185+1) -> 184 | B186: Aaron Portor | W186: 2 | X186: 133 | Y186: =SUM(C186+E186+G186+I186+K186+M186+O186+Q186+S186+U186+W186) -> 2 | Z186: =SUM(D186+F186+H186+J186+L186+N186+P186+R186+T186+V186+X186) -> 133 | AA186: =SUM(Z186/Y186) -> 66.500 | AB186: =ROUNDDOWN(((AA186-50)*0.8),0) -> 13
A187: =SUM(A186+1) -> 185 | B187: Trace Landess | O187: 1 | P187: 95 | Y187: =SUM(C187+E187+G187+I187+K187+M187+O187+Q187+S187+U187+W187) -> 1 | Z187: =SUM(D187+F187+H187+J187+L187+N187+P187+R187+T187+V187+X187) -> 95 | AA187: =SUM(Z187/Y187) -> 95.000 | AB187: 0
A188: =SUM(A187+1) -> 186 | B188: Chuckles | O188: 1 | P188: 74 | Y188: =SUM(C188+E188+G188+I188+K188+M188+O188+Q188+S188+U188+W188) -> 1 | Z188: =SUM(D188+F188+H188+J188+L188+N188+P188+R188+T188+V188+X188) -> 74 | AA188: =SUM(Z188/Y188) -> 74.000 | AB188: 0
A189: =SUM(A188+1) -> 187 | B189: Justin Mager | Q189: 1 | R189: 68 | Y189: =SUM(C189+E189+G189+I189+K189+M189+O189+Q189+S189+U189+W189) -> 1 | Z189: =SUM(D189+F189+H189+J189+L189+N189+P189+R189+T189+V189+X189) -> 68 | AA189: =SUM(Z189/Y189) -> 68.000 | AB189: 0
A190: =SUM(A189+1) -> 188 | B190: Scott Ream | Q190: 1 | R190: 64 | Y190: =SUM(C190+E190+G190+I190+K190+M190+O190+Q190+S190+U190+W190) -> 1 | Z190: =SUM(D190+F190+H190+J190+L190+N190+P190+R190+T190+V190+X190) -> 64 | AA190: =SUM(Z190/Y190) -> 64.000 | AB190: 0
A191: =SUM(A190+1) -> 189 | B191: Dave Swinford | Q191: 1 | R191: 63 | Y191: =SUM(C191+E191+G191+I191+K191+M191+O191+Q191+S191+U191+W191) -> 1 | Z191: =SUM(D191+F191+H191+J191+L191+N191+P191+R191+T191+V191+X191) -> 63 | AA191: =SUM(Z191/Y191) -> 63.000 | AB191: 0
A192: =SUM(A191+1) -> 190 | B192: Rob Posekany | Q192: 1 | R192: 61 | Y192: =SUM(C192+E192+G192+I192+K192+M192+O192+Q192+S192+U192+W192) -> 1 | Z192: =SUM(D192+F192+H192+J192+L192+N192+P192+R192+T192+V192+X192) -> 61 | AA192: =SUM(Z192/Y192) -> 61.000 | AB192: 0
A193: =SUM(A192+1) -> 191 | B193: Dave Peyton | Q193: 1 | R193: 61 | Y193: =SUM(C193+E193+G193+I193+K193+M193+O193+Q193+S193+U193+W193) -> 1 | Z193: =SUM(D193+F193+H193+J193+L193+N193+P193+R193+T193+V193+X193) -> 61 | AA193: =SUM(Z193/Y193) -> 61.000 | AB193: 0
A194: =SUM(A193+1) -> 192 | B194: BJ Beckman | O194: 1 | P194: 58 | Y194: =SUM(C194+E194+G194+I194+K194+M194+O194+Q194+S194+U194+W194) -> 1 | Z194: =SUM(D194+F194+H194+J194+L194+N194+P194+R194+T194+V194+X194) -> 58 | AA194: =SUM(Z194/Y194) -> 58.000 | AB194: 0
A195: =SUM(A194+1) -> 193 | B195: Craig Fender | M195: 1 | N195: 57 | Y195: =SUM(C195+E195+G195+I195+K195+M195+O195+Q195+S195+U195+W195) -> 1 | Z195: =SUM(D195+F195+H195+J195+L195+N195+P195+R195+T195+V195+X195) -> 57 | AA195: =SUM(Z195/Y195) -> 57.000 | AB195: 0
A196: =SUM(A195+1) -> 194 | B196: Tony Philips | Q196: 1 | R196: 54 | Y196: =SUM(C196+E196+G196+I196+K196+M196+O196+Q196+S196+U196+W196) -> 1 | Z196: =SUM(D196+F196+H196+J196+L196+N196+P196+R196+T196+V196+X196) -> 54 | AA196: =SUM(Z196/Y196) -> 54.000 | AB196: 0
A197: =SUM(A196+1) -> 195 | B197: Naph Rediger | G197: 1 | H197: 53 | Y197: =SUM(C197+E197+G197+I197+K197+M197+O197+Q197+S197+U197+W197) -> 1 | Z197: =SUM(D197+F197+H197+J197+L197+N197+P197+R197+T197+V197+X197) -> 53 | AA197: =SUM(Z197/Y197) -> 53.000 | AB197: 0
A198: =SUM(A197+1) -> 196 | B198: Jason Steffen | Q198: 1 | R198: 53 | Y198: =SUM(C198+E198+G198+I198+K198+M198+O198+Q198+S198+U198+W198) -> 1 | Z198: =SUM(D198+F198+H198+J198+L198+N198+P198+R198+T198+V198+X198) -> 53 | AA198: =SUM(Z198/Y198) -> 53.000 | AB198: 0
A199: =SUM(A198+1) -> 197 | B199: Floyd Campbell | Q199: 1 | R199: 49 | Y199: =SUM(C199+E199+G199+I199+K199+M199+O199+Q199+S199+U199+W199) -> 1 | Z199: =SUM(D199+F199+H199+J199+L199+N199+P199+R199+T199+V199+X199) -> 49 | AA199: =SUM(Z199/Y199) -> 49.000 | AB199: 0
A200: =SUM(A199+1) -> 198 | B200: Mark Ramsey | O200: 1 | P200: 45 | Y200: =SUM(C200+E200+G200+I200+K200+M200+O200+Q200+S200+U200+W200) -> 1 | Z200: =SUM(D200+F200+H200+J200+L200+N200+P200+R200+T200+V200+X200) -> 45 | AA200: =SUM(Z200/Y200) -> 45.000 | AB200: 0
A201: =SUM(A200+1) -> 199 | B201: Mike Baines | S201: 1 | T201: 71 | Y201: =SUM(C201+E201+G201+I201+K201+M201+O201+Q201+S201+U201+W201) -> 1 | Z201: =SUM(D201+F201+H201+J201+L201+N201+P201+R201+T201+V201+X201) -> 71 | AA201: =SUM(Z201/Y201) -> 71.000 | AB201: 0
A202: =SUM(A201+1) -> 200 | B202: Adam Smith | S202: 1 | T202: 59 | Y202: =SUM(C202+E202+G202+I202+K202+M202+O202+Q202+S202+U202+W202) -> 1 | Z202: =SUM(D202+F202+H202+J202+L202+N202+P202+R202+T202+V202+X202) -> 59 | AA202: =SUM(Z202/Y202) -> 59.000 | AB202: 0
A203: =SUM(A202+1) -> 201 | B203: Jon Foley | S203: 1 | T203: 70 | Y203: =SUM(C203+E203+G203+I203+K203+M203+O203+Q203+S203+U203+W203) -> 1 | Z203: =SUM(D203+F203+H203+J203+L203+N203+P203+R203+T203+V203+X203) -> 70 | AA203: =SUM(Z203/Y203) -> 70.000 | AB203: 0
A204: =SUM(A203+1) -> 202 | B204: T.J. Thurn | U204: 1 | V204: 50 | Y204: =SUM(C204+E204+G204+I204+K204+M204+O204+Q204+S204+U204+W204) -> 1 | Z204: =SUM(D204+F204+H204+J204+L204+N204+P204+R204+T204+V204+X204) -> 50 | AA204: =SUM(Z204/Y204) -> 50.000 | AB204: 0
A205: =SUM(A204+1) -> 203 | B205: Roland Hesford | U205: 1 | V205: 51 | Y205: =SUM(C205+E205+G205+I205+K205+M205+O205+Q205+S205+U205+W205) -> 1 | Z205: =SUM(D205+F205+H205+J205+L205+N205+P205+R205+T205+V205+X205) -> 51 | AA205: =SUM(Z205/Y205) -> 51.000 | AB205: 0
A206: =SUM(A205+1) -> 204 | B206: Will Viner | U206: 1 | V206: 56 | Y206: =SUM(C206+E206+G206+I206+K206+M206+O206+Q206+S206+U206+W206) -> 1 | Z206: =SUM(D206+F206+H206+J206+L206+N206+P206+R206+T206+V206+X206) -> 56 | AA206: =SUM(Z206/Y206) -> 56.000 | AB206: 0
A207: =SUM(A206+1) -> 205 | B207: Dan Mosley | U207: 1 | V207: 56 | Y207: =SUM(C207+E207+G207+I207+K207+M207+O207+Q207+S207+U207+W207) -> 1 | Z207: =SUM(D207+F207+H207+J207+L207+N207+P207+R207+T207+V207+X207) -> 56 | AA207: =SUM(Z207/Y207) -> 56.000 | AB207: 0
A208: =SUM(A207+1) -> 206 | B208: Archie Coulter | U208: 1 | V208: 58 | Y208: =SUM(C208+E208+G208+I208+K208+M208+O208+Q208+S208+U208+W208) -> 1 | Z208: =SUM(D208+F208+H208+J208+L208+N208+P208+R208+T208+V208+X208) -> 58 | AA208: =SUM(Z208/Y208) -> 58.000 | AB208: 0
A209: =SUM(A208+1) -> 207 | B209: Eli Ostby | U209: 1 | V209: 58 | Y209: =SUM(C209+E209+G209+I209+K209+M209+O209+Q209+S209+U209+W209) -> 1 | Z209: =SUM(D209+F209+H209+J209+L209+N209+P209+R209+T209+V209+X209) -> 58 | AA209: =SUM(Z209/Y209) -> 58.000 | AB209: 0
A210: =SUM(A209+1) -> 208 | B210: Tony Ebson | U210: 1 | V210: 60 | Y210: =SUM(C210+E210+G210+I210+K210+M210+O210+Q210+S210+U210+W210) -> 1 | Z210: =SUM(D210+F210+H210+J210+L210+N210+P210+R210+T210+V210+X210) -> 60 | AA210: =SUM(Z210/Y210) -> 60.000 | AB210: 0
A211: =SUM(A210+1) -> 209 | B211: Wade Geary | W211: 1 | X211: 53 | Y211: =SUM(C211+E211+G211+I211+K211+M211+O211+Q211+S211+U211+W211) -> 1 | Z211: =SUM(D211+F211+H211+J211+L211+N211+P211+R211+T211+V211+X211) -> 53 | AA211: =SUM(Z211/Y211) -> 53.000 | AB211: 0
A212: =SUM(A211+1) -> 210 | B212: Greg Dye | W212: 1 | X212: 53 | Y212: =SUM(C212+E212+G212+I212+K212+M212+O212+Q212+S212+U212+W212) -> 1 | Z212: =SUM(D212+F212+H212+J212+L212+N212+P212+R212+T212+V212+X212) -> 53 | AA212: =SUM(Z212/Y212) -> 53.000 | AB212: 0
A213: =SUM(A212+1) -> 211 | B213: Adam Hartig | W213: 1 | X213: 60 | Y213: =SUM(C213+E213+G213+I213+K213+M213+O213+Q213+S213+U213+W213) -> 1 | Z213: =SUM(D213+F213+H213+J213+L213+N213+P213+R213+T213+V213+X213) -> 60 | AA213: =SUM(Z213/Y213) -> 60.000 | AB213: 0
A214: =SUM(A213+1) -> 212 | B214: Drew Detert | W214: 1 | X214: 55 | Y214: =SUM(C214+E214+G214+I214+K214+M214+O214+Q214+S214+U214+W214) -> 1 | Z214: =SUM(D214+F214+H214+J214+L214+N214+P214+R214+T214+V214+X214) -> 55 | AA214: =SUM(Z214/Y214) -> 55.000 | AB214: 0
A215: =SUM(A214+1) -> 213 | B215: Chris Klime | W215: 1 | X215: 50 | Y215: =SUM(C215+E215+G215+I215+K215+M215+O215+Q215+S215+U215+W215) -> 1 | Z215: =SUM(D215+F215+H215+J215+L215+N215+P215+R215+T215+V215+X215) -> 50 | AA215: =SUM(Z215/Y215) -> 50.000 | AB215: 0
B217: Red text denotes League Champion with each * indicating a championship