A1: SBDGL CAREER ROUND / STROKE / AVERAGE / HANDICAP HISTORY
A2: PLAYER | C2: 2000 | D2: Strokes | E2: 2001 | F2: Strokes | G2: 2002 | H2: Strokes | I2: 2003 | J2: Strokes | K2: 2004 | L2: Strokes | M2: 2005 | N2: Strokes | O2: 2006 | P2: Strokes | Q2: 2007 | R2: Strokes | S2: 2008 | T2: Strokes | U2: 2009 | V2: Strokes | W2: 2010 | X2: Strokes | Y2: 2011 | Z2: Strokes | AA2: 2012 | AB2: Strokes | AC2: ROUNDS | AD2: STROKES | AE2: AVG | AF2: H-CAP
A3: 1 | B3: Jesse Streinz** | E3: 13 | F3: 718 | G3: 18 | H3: 979 | I3: 18 | J3: 956 | K3: 18 | L3: 1008 | M3: 18 | N3: 976 | O3: 19 | P3: 1028 | Q3: 18 | R3: 1036 | S3: 17 | T3: 930 | U3: 18 | V3: 992 | W3: 18 | X3: 1003 | Y3: 16 | Z3: 905 | AA3: 18 | AB3: 1008 | AC3: =SUM(C3+E3+G3+I3+K3+M3+O3+Q3+S3+U3+W3+Y3+AA3) -> 209 | AD3: =SUM(D3+F3+H3+J3+L3+N3+P3+R3+T3+V3+X3+Z3+AB3) -> 11539 | AE3: =SUM(AD3/AC3) -> 55.210526315789473 | AF3: =ROUNDDOWN(((AE3-50)*0.8),0) -> 4
A4: =SUM(A3+1) -> 2 | B4: Greco | E4: 3 | F4: 167 | G4: 18 | H4: 1031 | I4: 18 | J4: 974 | K4: 18 | L4: 972 | M4: 18 | N4: 961 | O4: 19 | P4: 1002 | Q4: 17 | R4: 917 | S4: 18 | T4: 963 | U4: 18 | V4: 935 | W4: 18 | X4: 906 | Y4: 18 | Z4: 905 | AA4: 18 | AB4: 932 | AC4: =SUM(C4+E4+G4+I4+K4+M4+O4+Q4+S4+U4+W4+Y4+AA4) -> 201 | AD4: =SUM(D4+F4+H4+J4+L4+N4+P4+R4+T4+V4+X4+Z4+AB4) -> 10665 | AE4: =SUM(AD4/AC4) -> 53.059701492537314 | AF4: =ROUNDDOWN(((AE4-50)*0.8),0) -> 2
A5: =SUM(A4+1) -> 3 | B5: D. Burns | E5: 3 | F5: 179 | G5: 18 | H5: 1148 | I5: 17 | J5: 1045 | K5: 15 | L5: 911 | M5: 17 | N5: 1010 | O5: 18 | P5: 1083 | Q5: 18 | R5: 1084 | S5: 18 | T5: 1041 | U5: 6 | V5: 353 | W5: 17 | X5: 989 | Y5: 18 | Z5: 1078 | AA5: 17 | AB5: 1054 | AC5: =SUM(C5+E5+G5+I5+K5+M5+O5+Q5+S5+U5+W5+Y5+AA5) -> 182 | AD5: =SUM(D5+F5+H5+J5+L5+N5+P5+R5+T5+V5+X5+Z5+AB5) -> 10975 | AE5: =SUM(AD5/AC5) -> 60.302197802197803 | AF5: =ROUNDDOWN(((AE5-50)*0.8),0) -> 8
A6: =SUM(A5+1) -> 4 | B6: Woody** | I6: 18 | J6: 1084 | K6: 18 | L6: 1032 | M6: 18 | N6: 1018 | O6: 19 | P6: 1045 | Q6: 18 | R6: 992 | S6: 18 | T6: 938 | U6: 18 | V6: 961 | W6: 18 | X6: 957 | Y6: 18 | Z6: 973 | AA6: 18 | AB6: 989 | AC6: =SUM(C6+E6+G6+I6+K6+M6+O6+Q6+S6+U6+W6+Y6+AA6) -> 181 | AD6: =SUM(D6+F6+H6+J6+L6+N6+P6+R6+T6+V6+X6+Z6+AB6) -> 9989 | AE6: =SUM(AD6/AC6) -> 55.187845303867405 | AF6: =ROUNDDOWN(((AE6-50)*0.8),0) -> 4
A7: =SUM(A6+1) -> 5 | B7: Josh Beachy* | I7: 18 | J7: 1050 | K7: 18 | L7: 1029 | M7: 18 | N7: 998 | O7: 18 | P7: 997 | Q7: 18 | R7: 1038 | S7: 18 | T7: 975 | U7: 18 | V7: 983 | W7: 18 | X7: 981 | Y7: 18 | Z7: 974 | AA7: 18 | AB7: 997 | AC7: =SUM(C7+E7+G7+I7+K7+M7+O7+Q7+S7+U7+W7+Y7+AA7) -> 180 | AD7: =SUM(D7+F7+H7+J7+L7+N7+P7+R7+T7+V7+X7+Z7+AB7) -> 10022 | AE7: =SUM(AD7/AC7) -> 55.677777777777777 | AF7: =ROUNDDOWN(((AE7-50)*0.8),0) -> 4
A8: =SUM(A7+1) -> 6 | B8: Joel Knutson* | I8: 14 | J8: 803 | K8: 18 | L8: 1034 | M8: 17 | N8: 937 | O8: 18 | P8: 991 | Q8: 18 | R8: 1021 | S8: 18 | T8: 948 | U8: 18 | V8: 978 | W8: 18 | X8: 979 | Y8: 16 | Z8: 896 | AA8: 18 | AB8: 1019 | AC8: =SUM(C8+E8+G8+I8+K8+M8+O8+Q8+S8+U8+W8+Y8+AA8) -> 173 | AD8: =SUM(D8+F8+H8+J8+L8+N8+P8+R8+T8+V8+X8+Z8+AB8) -> 9606 | AE8: =SUM(AD8/AC8) -> 55.52601156069364 | AF8: =ROUNDDOWN(((AE8-50)*0.8),0) -> 4
A9: =SUM(A8+1) -> 7 | B9: Farley | I9: 18 | J9: 1140 | K9: 18 | L9: 1118 | M9: 18 | N9: 1070 | O9: 18 | P9: 1055 | Q9: 17 | R9: 1022 | S9: 17 | T9: 1020 | U9: 17 | V9: 1000 | W9: 18 | X9: 1039 | Y9: 17 | Z9: 1039 | AC9: =SUM(C9+E9+G9+I9+K9+M9+O9+Q9+S9+U9+W9+Y9+AA9) -> 158 | AD9: =SUM(D9+F9+H9+J9+L9+N9+P9+R9+T9+V9+X9+Z9+AB9) -> 9503 | AE9: =SUM(AD9/AC9) -> 60.145569620253163 | AF9: =ROUNDDOWN(((AE9-50)*0.8),0) -> 8
A10: =SUM(A9+1) -> 8 | B10: Dustin Utley | K10: 16 | L10: 974 | M10: 16 | N10: 915 | O10: 18 | P10: 989 | Q10: 17 | R10: 968 | S10: 18 | T10: 1012 | U10: 18 | V10: 1015 | W10: 18 | X10: 957 | Y10: 18 | Z10: 986 | AA10: 17 | AB10: 937 | AC10: =SUM(C10+E10+G10+I10+K10+M10+O10+Q10+S10+U10+W10+Y10+AA10) -> 156 | AD10: =SUM(D10+F10+H10+J10+L10+N10+P10+R10+T10+V10+X10+Z10+AB10) -> 8753 | AE10: =SUM(AD10/AC10) -> 56.108974358974358 | AF10: =ROUNDDOWN(((AE10-50)*0.8),0) -> 4
A11: =SUM(A10+1) -> 9 | B11: Stiers | I11: 1 | J11: 59 | K11: 17 | L11: 940 | M11: 18 | N11: 1021 | O11: 19 | P11: 1066 | Q11: 17 | R11: 962 | S11: 15 | T11: 803 | U11: 18 | V11: 974 | W11: 16 | X11: 873 | Y11: 17 | Z11: 932 | AA11: 17 | AB11: 935 | AC11: =SUM(C11+E11+G11+I11+K11+M11+O11+Q11+S11+U11+W11+Y11+AA11) -> 155 | AD11: =SUM(D11+F11+H11+J11+L11+N11+P11+R11+T11+V11+X11+Z11+AB11) -> 8565 | AE11: =SUM(AD11/AC11) -> 55.258064516129032 | AF11: =ROUNDDOWN(((AE11-50)*0.8),0) -> 4
A12: =SUM(A11+1) -> 10 | B12: Joe "Cool" Wiley** | C12: 21 | D12: 1214 | E12: 22 | F12: 1220 | G12: 18 | H12: 1013 | I12: 18 | J12: 960 | K12: 18 | L12: 973 | M12: 17 | N12: 955 | O12: 6 | P12: 331 | Q12: 18 | R12: 1002 | S12: 12 | T12: 684 | U12: 1 | V12: 64 | W12: 1 | X12: 56 | AA12: 1 | AB12: 57 | AC12: =SUM(C12+E12+G12+I12+K12+M12+O12+Q12+S12+U12+W12+Y12+AA12) -> 153 | AD12: =SUM(D12+F12+H12+J12+L12+N12+P12+R12+T12+V12+X12+Z12+AB12) -> 8529 | AE12: =SUM(AD12/AC12) -> 55.745098039215684 | AF12: =ROUNDDOWN(((AE12-50)*0.8),0) -> 4
A13: =SUM(A12+1) -> 11 | B13: Super Dave* | K13: 18 | L13: 1062 | M13: 18 | N13: 1013 | O13: 19 | P13: 1040 | Q13: 18 | R13: 1026 | S13: 18 | T13: 997 | U13: 14 | V13: 805 | W13: 9 | X13: 510 | Y13: 17 | Z13: 979 | AA13: 17 | AB13: 977 | AC13: =SUM(C13+E13+G13+I13+K13+M13+O13+Q13+S13+U13+W13+Y13+AA13) -> 148 | AD13: =SUM(D13+F13+H13+J13+L13+N13+P13+R13+T13+V13+X13+Z13+AB13) -> 8409 | AE13: =SUM(AD13/AC13) -> 56.817567567567565 | AF13: =ROUNDDOWN(((AE13-50)*0.8),0) -> 5
A14: =SUM(A13+1) -> 12 | B14: Matt Shannon | M14: 18 | N14: 1128 | O14: 19 | P14: 1105 | Q14: 18 | R14: 1085 | S14: 18 | T14: 1065 | U14: 18 | V14: 1072 | W14: 18 | X14: 996 | Y14: 18 | Z14: 1030 | AA14: 18 | AB14: 1042 | AC14: =SUM(C14+E14+G14+I14+K14+M14+O14+Q14+S14+U14+W14+Y14+AA14) -> 145 | AD14: =SUM(D14+F14+H14+J14+L14+N14+P14+R14+T14+V14+X14+Z14+AB14) -> 8523 | AE14: =SUM(AD14/AC14) -> 58.779310344827586 | AF14: =ROUNDDOWN(((AE14-50)*0.8),0) -> 7
A15: =SUM(A14+1) -> 13 | B15: Rimmy* | K15: 16 | L15: 814 | M15: 16 | N15: 815 | O15: 18 | P15: 905 | Q15: 10 | R15: 531 | S15: 15 | T15: 801 | U15: 16 | V15: 853 | W15: 14 | X15: 762 | Y15: 16 | Z15: 844 | AA15: 18 | AB15: 997 | AC15: =SUM(C15+E15+G15+I15+K15+M15+O15+Q15+S15+U15+W15+Y15+AA15) -> 139 | AD15: =SUM(D15+F15+H15+J15+L15+N15+P15+R15+T15+V15+X15+Z15+AB15) -> 7322 | AE15: =SUM(AD15/AC15) -> 52.676258992805757 | AF15: =ROUNDDOWN(((AE15-50)*0.8),0) -> 2
A16: =SUM(A15+1) -> 14 | B16: Matt "Frog" Geers | K16: 16 | L16: 936 | M16: 14 | N16: 836 | O16: 19 | P16: 1091 | Q16: 17 | R16: 950 | S16: 17 | T16: 906 | U16: 13 | V16: 721 | W16: 13 | X16: 734 | Y16: 14 | Z16: 776 | AA16: 5 | AB16: 300 | AC16: =SUM(C16+E16+G16+I16+K16+M16+O16+Q16+S16+U16+W16+Y16+AA16) -> 128 | AD16: =SUM(D16+F16+H16+J16+L16+N16+P16+R16+T16+V16+X16+Z16+AB16) -> 7250 | AE16: =SUM(AD16/AC16) -> 56.640625 | AF16: =ROUNDDOWN(((AE16-50)*0.8),0) -> 5
A17: =SUM(A16+1) -> 15 | B17: Tom Pepper | O17: 18 | P17: 1138 | Q17: 18 | R17: 1098 | S17: 18 | T17: 1067 | U17: 18 | V17: 1057 | W17: 18 | X17: 1040 | Y17: 16 | Z17: 953 | AA17: 18 | AB17: 1121 | AC17: =SUM(C17+E17+G17+I17+K17+M17+O17+Q17+S17+U17+W17+Y17+AA17) -> 124 | AD17: =SUM(D17+F17+H17+J17+L17+N17+P17+R17+T17+V17+X17+Z17+AB17) -> 7474 | AE17: =SUM(AD17/AC17) -> 60.274193548387096 | AF17: =ROUNDDOWN(((AE17-50)*0.8),0) -> 8
A18: =SUM(A17+1) -> 16 | B18: Jamie Gray | G18: 4 | H18: 233 | I18: 18 | J18: 1046 | K18: 18 | L18: 1056 | M18: 15 | N18: 864 | O18: 17 | P18: 998 | Q18: 17 | R18: 1011 | S18: 17 | T18: 989 | U18: 16 | V18: 956 | AC18: =SUM(C18+E18+G18+I18+K18+M18+O18+Q18+S18+U18+W18+Y18+AA18) -> 122 | AD18: =SUM(D18+F18+H18+J18+L18+N18+P18+R18+T18+V18+X18+Z18+AB18) -> 7153 | AE18: =SUM(AD18/AC18) -> 58.631147540983605 | AF18: =ROUNDDOWN(((AE18-50)*0.8),0) -> 6
A19: =SUM(A18+1) -> 17 | B19: Jesse Sauerbrei | K19: 17 | L19: 940 | M19: 18 | N19: 972 | O19: 18 | P19: 989 | Q19: 18 | R19: 969 | S19: 18 | T19: 976 | U19: 15 | V19: 814 | Y19: 16 | Z19: 870 | AC19: =SUM(C19+E19+G19+I19+K19+M19+O19+Q19+S19+U19+W19+Y19+AA19) -> 120 | AD19: =SUM(D19+F19+H19+J19+L19+N19+P19+R19+T19+V19+X19+Z19+AB19) -> 6530 | AE19: =SUM(AD19/AC19) -> 54.416666666666664 | AF19: =ROUNDDOWN(((AE19-50)*0.8),0) -> 3
A20: =SUM(A19+1) -> 18 | B20: "Shirtless" Bill | O20: 16 | P20: 900 | Q20: 17 | R20: 962 | S20: 18 | T20: 999 | U20: 16 | V20: 897 | W20: 18 | X20: 1025 | Y20: 18 | Z20: 1012 | AA20: 17 | AB20: 975 | AC20: =SUM(C20+E20+G20+I20+K20+M20+O20+Q20+S20+U20+W20+Y20+AA20) -> 120 | AD20: =SUM(D20+F20+H20+J20+L20+N20+P20+R20+T20+V20+X20+Z20+AB20) -> 6770 | AE20: =SUM(AD20/AC20) -> 56.416666666666664 | AF20: =ROUNDDOWN(((AE20-50)*0.8),0) -> 5
A21: =SUM(A20+1) -> 19 | B21: Jerimie Maker* | M21: 6 | N21: 341 | O21: 15 | P21: 836 | Q21: 10 | R21: 545 | S21: 18 | T21: 984 | U21: 18 | V21: 975 | W21: 18 | X21: 1003 | Y21: 18 | Z21: 1078 | AA21: 13 | AB21: 807 | AC21: =SUM(C21+E21+G21+I21+K21+M21+O21+Q21+S21+U21+W21+Y21+AA21) -> 116 | AD21: =SUM(D21+F21+H21+J21+L21+N21+P21+R21+T21+V21+X21+Z21+AB21) -> 6569 | AE21: =SUM(AD21/AC21) -> 56.629310344827587 | AF21: =ROUNDDOWN(((AE21-50)*0.8),0) -> 5
A22: =SUM(A21+1) -> 20 | B22: Tim Peyton* | M22: 4 | N22: 209 | Q22: 18 | R22: 926 | S22: 18 | T22: 908 | U22: 18 | V22: 906 | W22: 18 | X22: 913 | Y22: 18 | Z22: 900 | AA22: 18 | AB22: 914 | AC22: =SUM(C22+E22+G22+I22+K22+M22+O22+Q22+S22+U22+W22+Y22+AA22) -> 112 | AD22: =SUM(D22+F22+H22+J22+L22+N22+P22+R22+T22+V22+X22+Z22+AB22) -> 5676 | AE22: =SUM(AD22/AC22) -> 50.678571428571431 | AF22: =ROUNDDOWN(((AE22-50)*0.8),0) -> 0
A23: =SUM(A22+1) -> 21 | B23: Joe O'Neil | O23: 19 | P23: 1158 | Q23: 18 | R23: 1071 | S23: 16 | T23: 922 | U23: 7 | V23: 388 | W23: 16 | X23: 929 | Y23: 18 | Z23: 1038 | AA23: 18 | AB23: 1040 | AC23: =SUM(C23+E23+G23+I23+K23+M23+O23+Q23+S23+U23+W23+Y23+AA23) -> 112 | AD23: =SUM(D23+F23+H23+J23+L23+N23+P23+R23+T23+V23+X23+Z23+AB23) -> 6546 | AE23: =SUM(AD23/AC23) -> 58.446428571428569 | AF23: =ROUNDDOWN(((AE23-50)*0.8),0) -> 6
A24: =SUM(A23+1) -> 22 | B24: Ryan Hamilton | K24: 3 | L24: 182 | Q24: 18 | R24: 1059 | S24: 18 | T24: 1024 | U24: 18 | V24: 1025 | W24: 18 | X24: 980 | Y24: 18 | Z24: 980 | AA24: 18 | AB24: 1016 | AC24: =SUM(C24+E24+G24+I24+K24+M24+O24+Q24+S24+U24+W24+Y24+AA24) -> 111 | AD24: =SUM(D24+F24+H24+J24+L24+N24+P24+R24+T24+V24+X24+Z24+AB24) -> 6266 | AE24: =SUM(AD24/AC24) -> 56.450450450450454 | AF24: =ROUNDDOWN(((AE24-50)*0.8),0) -> 5
A25: =SUM(A24+1) -> 23 | B25: Jeremy Prouty* | K25: 15 | L25: 1056 | M25: 16 | N25: 1058 | O25: 17 | P25: 1099 | Q25: 18 | R25: 1132 | S25: 15 | T25: 970 | U25: 17 | V25: 1016 | W25: 11 | X25: 656 | AA25: 1 | AB25: 71 | AC25: =SUM(C25+E25+G25+I25+K25+M25+O25+Q25+S25+U25+W25+Y25+AA25) -> 110 | AD25: =SUM(D25+F25+H25+J25+L25+N25+P25+R25+T25+V25+X25+Z25+AB25) -> 7058 | AE25: =SUM(AD25/AC25) -> 64.163636363636357 | AF25: =ROUNDDOWN(((AE25-50)*0.8),0) -> 11
A26: =SUM(A25+1) -> 24 | B26: Matt Wieben** | O26: 1 | P26: 51 | Q26: 18 | R26: 964 | S26: 18 | T26: 952 | U26: 18 | V26: 931 | W26: 18 | X26: 896 | Y26: 18 | Z26: 915 | AA26: 18 | AB26: 965 | AC26: =SUM(C26+E26+G26+I26+K26+M26+O26+Q26+S26+U26+W26+Y26+AA26) -> 109 | AD26: =SUM(D26+F26+H26+J26+L26+N26+P26+R26+T26+V26+X26+Z26+AB26) -> 5674 | AE26: =SUM(AD26/AC26) -> 52.055045871559635 | AF26: =ROUNDDOWN(((AE26-50)*0.8),0) -> 1
A27: =SUM(A26+1) -> 25 | B27: Kollin Grimm | Q27: 17 | R27: 986 | S27: 18 | T27: 982 | U27: 18 | V27: 968 | W27: 18 | X27: 924 | Y27: 18 | Z27: 953 | AA27: 18 | AB27: 972 | AC27: =SUM(C27+E27+G27+I27+K27+M27+O27+Q27+S27+U27+W27+Y27+AA27) -> 107 | AD27: =SUM(D27+F27+H27+J27+L27+N27+P27+R27+T27+V27+X27+Z27+AB27) -> 5785 | AE27: =SUM(AD27/AC27) -> 54.065420560747661 | AF27: =ROUNDDOWN(((AE27-50)*0.8),0) -> 3
A28: =SUM(A27+1) -> 26 | B28: Mark Dvorsky | G28: 10 | H28: 593 | I28: 18 | J28: 1059 | K28: 18 | L28: 1037 | M28: 17 | N28: 972 | O28: 17 | P28: 973 | Q28: 11 | R28: 639 | S28: 16 | T28: 930 | AC28: =SUM(C28+E28+G28+I28+K28+M28+O28+Q28+S28+U28+W28+Y28+AA28) -> 107 | AD28: =SUM(D28+F28+H28+J28+L28+N28+P28+R28+T28+V28+X28+Z28+AB28) -> 6203 | AE28: =SUM(AD28/AC28) -> 57.971962616822431 | AF28: =ROUNDDOWN(((AE28-50)*0.8),0) -> 6
A29: =SUM(A28+1) -> 27 | B29: Matt Lacina | K29: 17 | L29: 1167 | M29: 18 | N29: 1143 | O29: 18 | P29: 1117 | Q29: 18 | R29: 1122 | S29: 18 | T29: 1075 | U29: 18 | V29: 1077 | AC29: =SUM(C29+E29+G29+I29+K29+M29+O29+Q29+S29+U29+W29+Y29+AA29) -> 107 | AD29: =SUM(D29+F29+H29+J29+L29+N29+P29+R29+T29+V29+X29+Z29+AB29) -> 6701 | AE29: =SUM(AD29/AC29) -> 62.626168224299064 | AF29: =ROUNDDOWN(((AE29-50)*0.8),0) -> 10
A30: =SUM(A29+1) -> 28 | B30: Kevin Stibal | I30: 13 | J30: 684 | K30: 17 | L30: 881 | M30: 16 | N30: 851 | O30: 18 | P30: 966 | Q30: 17 | R30: 903 | S30: 2 | T30: 112 | U30: 11 | V30: 555 | W30: 5 | X30: 265 | Y30: 4 | Z30: 223 | AA30: 3 | AB30: 175 | AC30: =SUM(C30+E30+G30+I30+K30+M30+O30+Q30+S30+U30+W30+Y30+AA30) -> 106 | AD30: =SUM(D30+F30+H30+J30+L30+N30+P30+R30+T30+V30+X30+Z30+AB30) -> 5615 | AE30: =SUM(AD30/AC30) -> 52.971698113207545 | AF30: =ROUNDDOWN(((AE30-50)*0.8),0) -> 2
A31: =SUM(A30+1) -> 29 | B31: Travis Pike | K31: 2 | L31: 113 | M31: 18 | N31: 987 | O31: 9 | P31: 504 | S31: 18 | T31: 974 | U31: 4 | V31: 227 | W31: 15 | X31: 825 | Y31: 18 | Z31: 1035 | AA31: 18 | AB31: 1037 | AC31: =SUM(C31+E31+G31+I31+K31+M31+O31+Q31+S31+U31+W31+Y31+AA31) -> 102 | AD31: =SUM(D31+F31+H31+J31+L31+N31+P31+R31+T31+V31+X31+Z31+AB31) -> 5702 | AE31: =SUM(AD31/AC31) -> 55.901960784313722 | AF31: =ROUNDDOWN(((AE31-50)*0.8),0) -> 4
A32: =SUM(A31+1) -> 30 | B32: Kruck | C32: 22 | D32: 1240 | E32: 21 | F32: 1158 | G32: 14 | H32: 826 | I32: 2 | J32: 118 | K32: 12 | L32: 720 | M32: 18 | N32: 1032 | U32: 7 | V32: 402 | W32: 4 | X32: 239 | AC32: =SUM(C32+E32+G32+I32+K32+M32+O32+Q32+S32+U32+W32+Y32+AA32) -> 100 | AD32: =SUM(D32+F32+H32+J32+L32+N32+P32+R32+T32+V32+X32+Z32+AB32) -> 5735 | AE32: =SUM(AD32/AC32) -> 57.350 | AF32: =ROUNDDOWN(((AE32-50)*0.8),0) -> 5
A33: =SUM(A32+1) -> 31 | B33: Max Ostby | M33: 18 | N33: 1112 | O33: 18 | P33: 1088 | Q33: 16 | R33: 994 | S33: 14 | T33: 872 | U33: 17 | V33: 1063 | W33: 13 | X33: 771 | Y33: 2 | Z33: 121 | AC33: =SUM(C33+E33+G33+I33+K33+M33+O33+Q33+S33+U33+W33+Y33+AA33) -> 98 | AD33: =SUM(D33+F33+H33+J33+L33+N33+P33+R33+T33+V33+X33+Z33+AB33) -> 6021 | AE33: =SUM(AD33/AC33) -> 61.438775510204081 | AF33: =ROUNDDOWN(((AE33-50)*0.8),0) -> 9
A34: =SUM(A33+1) -> 32 | B34: Tim "Timmy" Troyna | O34: 17 | P34: 1048 | Q34: 15 | R34: 925 | S34: 15 | T34: 904 | U34: 15 | V34: 924 | W34: 17 | X34: 982 | Y34: 16 | Z34: 925 | AA34: 1 | AB34: 59 | AC34: =SUM(C34+E34+G34+I34+K34+M34+O34+Q34+S34+U34+W34+Y34+AA34) -> 96 | AD34: =SUM(D34+F34+H34+J34+L34+N34+P34+R34+T34+V34+X34+Z34+AB34) -> 5767 | AE34: =SUM(AD34/AC34) -> 60.072916666666664 | AF34: =ROUNDDOWN(((AE34-50)*0.8),0) -> 8
A35: =SUM(A34+1) -> 33 | B35: Doug Peyton | Q35: 18 | R35: 910 | S35: 18 | T35: 916 | U35: 18 | V35: 894 | W35: 18 | X35: 881 | Y35: 5 | Z35: 251 | AA35: 18 | AB35: 913 | AC35: =SUM(C35+E35+G35+I35+K35+M35+O35+Q35+S35+U35+W35+Y35+AA35) -> 95 | AD35: =SUM(D35+F35+H35+J35+L35+N35+P35+R35+T35+V35+X35+Z35+AB35) -> 4765 | AE35: =SUM(AD35/AC35) -> 50.157894736842103 | AF35: =ROUNDDOWN(((AE35-50)*0.8),0) -> 0
A36: =SUM(A35+1) -> 34 | B36: Matt McCarley** | I36: 18 | J36: 968 | K36: 18 | L36: 944 | M36: 18 | N36: 948 | O36: 19 | P36: 971 | Q36: 18 | R36: 964 | AA36: 1 | AB36: 65 | AC36: =SUM(C36+E36+G36+I36+K36+M36+O36+Q36+S36+U36+W36+Y36+AA36) -> 92 | AD36: =SUM(D36+F36+H36+J36+L36+N36+P36+R36+T36+V36+X36+Z36+AB36) -> 4860 | AE36: =SUM(AD36/AC36) -> 52.826086956521742 | AF36: =ROUNDDOWN(((AE36-50)*0.8),0) -> 2
A37: =SUM(A36+1) -> 35 | B37: Rory Lasansky | M37: 18 | N37: 959 | O37: 1 | P37: 55 | Q37: 18 | R37: 1024 | S37: 18 | T37: 977 | U37: 13 | V37: 685 | W37: 17 | X37: 897 | Y37: 1 | Z37: 52 | AA37: 3 | AB37: 168 | AC37: =SUM(C37+E37+G37+I37+K37+M37+O37+Q37+S37+U37+W37+Y37+AA37) -> 89 | AD37: =SUM(D37+F37+H37+J37+L37+N37+P37+R37+T37+V37+X37+Z37+AB37) -> 4817 | AE37: =SUM(AD37/AC37) -> 54.123595505617978 | AF37: =ROUNDDOWN(((AE37-50)*0.8),0) -> 3
A38: =SUM(A37+1) -> 36 | B38: Marty Reis | S38: 18 | T38: 1110 | U38: 18 | V38: 1034 | W38: 18 | X38: 1013 | Y38: 17 | Z38: 929 | AA38: 18 | AB38: 1023 | AC38: =SUM(C38+E38+G38+I38+K38+M38+O38+Q38+S38+U38+W38+Y38+AA38) -> 89 | AD38: =SUM(D38+F38+H38+J38+L38+N38+P38+R38+T38+V38+X38+Z38+AB38) -> 5109 | AE38: =SUM(AD38/AC38) -> 57.40449438202247 | AF38: =ROUNDDOWN(((AE38-50)*0.8),0) -> 5
A39: =SUM(A38+1) -> 37 | B39: "Wheatbread" | E39: 19 | F39: 1102 | G39: 18 | H39: 1024 | I39: 18 | J39: 991 | K39: 18 | L39: 1027 | M39: 15 | N39: 835 | AC39: =SUM(C39+E39+G39+I39+K39+M39+O39+Q39+S39+U39+W39+Y39+AA39) -> 88 | AD39: =SUM(D39+F39+H39+J39+L39+N39+P39+R39+T39+V39+X39+Z39+AB39) -> 4979 | AE39: =SUM(AD39/AC39) -> 56.579545454545453 | AF39: =ROUNDDOWN(((AE39-50)*0.8),0) -> 5
A40: =SUM(A39+1) -> 38 | B40: Byran Bream | K40: 9 | L40: 491 | M40: 18 | N40: 955 | O40: 19 | P40: 976 | Q40: 18 | R40: 983 | S40: 18 | T40: 938 | U40: 1 | V40: 52 | AC40: =SUM(C40+E40+G40+I40+K40+M40+O40+Q40+S40+U40+W40+Y40+AA40) -> 83 | AD40: =SUM(D40+F40+H40+J40+L40+N40+P40+R40+T40+V40+X40+Z40+AB40) -> 4395 | AE40: =SUM(AD40/AC40) -> 52.951807228915662 | AF40: =ROUNDDOWN(((AE40-50)*0.8),0) -> 2
A41: =SUM(A40+1) -> 39 | B41: Dixie Smith | C41: 11 | D41: 874 | E41: 18 | F41: 1393 | G41: 17 | H41: 1220 | I41: 18 | J41: 1295 | K41: 18 | L41: 1278 | AC41: =SUM(C41+E41+G41+I41+K41+M41+O41+Q41+S41+U41+W41+Y41+AA41) -> 82 | AD41: =SUM(D41+F41+H41+J41+L41+N41+P41+R41+T41+V41+X41+Z41+AB41) -> 6060 | AE41: =SUM(AD41/AC41) -> 73.902439024390247 | AF41: =ROUNDDOWN(((AE41-50)*0.8),0) -> 19
A42: =SUM(A41+1) -> 40 | B42: Jeremy Farnsworth | S42: 12 | T42: 630 | U42: 17 | V42: 888 | W42: 18 | X42: 915 | Y42: 17 | Z42: 886 | AA42: 16 | AB42: 807 | AC42: =SUM(C42+E42+G42+I42+K42+M42+O42+Q42+S42+U42+W42+Y42+AA42) -> 80 | AD42: =SUM(D42+F42+H42+J42+L42+N42+P42+R42+T42+V42+X42+Z42+AB42) -> 4126 | AE42: =SUM(AD42/AC42) -> 51.575000000000003 | AF42: =ROUNDDOWN(((AE42-50)*0.8),0) -> 1
A43: =SUM(A42+1) -> 41 | B43: Shawn Hullinger | Q43: 5 | R43: 343 | S43: 5 | T43: 302 | U43: 17 | V43: 1077 | W43: 18 | X43: 1106 | Y43: 17 | Z43: 1031 | AA43: 18 | AB43: 1145 | AC43: =SUM(C43+E43+G43+I43+K43+M43+O43+Q43+S43+U43+W43+Y43+AA43) -> 80 | AD43: =SUM(D43+F43+H43+J43+L43+N43+P43+R43+T43+V43+X43+Z43+AB43) -> 5004 | AE43: =SUM(AD43/AC43) -> 62.550 | AF43: =ROUNDDOWN(((AE43-50)*0.8),0) -> 10
A44: =SUM(A43+1) -> 42 | B44: Ryan "Norm" Kriz** | C44: 22 | D44: 1281 | E44: 22 | F44: 1313 | G44: 18 | H44: 1068 | I44: 17 | J44: 1034 | AC44: =SUM(C44+E44+G44+I44+K44+M44+O44+Q44+S44+U44+W44+Y44+AA44) -> 79 | AD44: =SUM(D44+F44+H44+J44+L44+N44+P44+R44+T44+V44+X44+Z44+AB44) -> 4696 | AE44: =SUM(AD44/AC44) -> 59.443037974683541 | AF44: =ROUNDDOWN(((AE44-50)*0.8),0) -> 7
A45: =SUM(A44+1) -> 43 | B45: Matt Fritz | S45: 7 | T45: 405 | U45: 18 | V45: 1038 | W45: 17 | X45: 965 | Y45: 18 | Z45: 1022 | AA45: 18 | AB45: 1040 | AC45: =SUM(C45+E45+G45+I45+K45+M45+O45+Q45+S45+U45+W45+Y45+AA45) -> 78 | AD45: =SUM(D45+F45+H45+J45+L45+N45+P45+R45+T45+V45+X45+Z45+AB45) -> 4470 | AE45: =SUM(AD45/AC45) -> 57.307692307692307 | AF45: =ROUNDDOWN(((AE45-50)*0.8),0) -> 5
A46: =SUM(A45+1) -> 44 | B46: Nathan Veeder | S46: 8 | T46: 450 | U46: 18 | V46: 1021 | W46: 17 | X46: 922 | Y46: 17 | Z46: 935 | AA46: 17 | AB46: 945 | AC46: =SUM(C46+E46+G46+I46+K46+M46+O46+Q46+S46+U46+W46+Y46+AA46) -> 77 | AD46: =SUM(D46+F46+H46+J46+L46+N46+P46+R46+T46+V46+X46+Z46+AB46) -> 4273 | AE46: =SUM(AD46/AC46) -> 55.493506493506494 | AF46: =ROUNDDOWN(((AE46-50)*0.8),0) -> 4
A47: =SUM(A46+1) -> 45 | B47: "Snapple" | G47: 4 | H47: 209 | I47: 7 | J47: 387 | K47: 18 | L47: 1003 | M47: 16 | N47: 877 | O47: 17 | P47: 937 | Q47: 12 | R47: 674 | AC47: =SUM(C47+E47+G47+I47+K47+M47+O47+Q47+S47+U47+W47+Y47+AA47) -> 74 | AD47: =SUM(D47+F47+H47+J47+L47+N47+P47+R47+T47+V47+X47+Z47+AB47) -> 4087 | AE47: =SUM(AD47/AC47) -> 55.229729729729726 | AF47: =ROUNDDOWN(((AE47-50)*0.8),0) -> 4
A48: =SUM(A47+1) -> 46 | B48: Mike Flynn | M48: 6 | N48: 360 | O48: 15 | P48: 883 | Q48: 18 | R48: 1048 | S48: 17 | T48: 973 | U48: 18 | V48: 1054 | AC48: =SUM(C48+E48+G48+I48+K48+M48+O48+Q48+S48+U48+W48+Y48+AA48) -> 74 | AD48: =SUM(D48+F48+H48+J48+L48+N48+P48+R48+T48+V48+X48+Z48+AB48) -> 4318 | AE48: =SUM(AD48/AC48) -> 58.351351351351354 | AF48: =ROUNDDOWN(((AE48-50)*0.8),0) -> 6
A49: =SUM(A48+1) -> 47 | B49: Keith Gudenkauf | O49: 18 | P49: 993 | Q49: 13 | R49: 723 | S49: 18 | T49: 963 | U49: 17 | V49: 928 | Y49: 6 | Z49: 320 | AC49: =SUM(C49+E49+G49+I49+K49+M49+O49+Q49+S49+U49+W49+Y49+AA49) -> 72 | AD49: =SUM(D49+F49+H49+J49+L49+N49+P49+R49+T49+V49+X49+Z49+AB49) -> 3927 | AE49: =SUM(AD49/AC49) -> 54.541666666666664 | AF49: =ROUNDDOWN(((AE49-50)*0.8),0) -> 3
A50: =SUM(A49+1) -> 48 | B50: Dan Kern | U50: 17 | V50: 893 | W50: 18 | X50: 900 | Y50: 18 | Z50: 948 | AA50: 18 | AB50: 910 | AC50: =SUM(C50+E50+G50+I50+K50+M50+O50+Q50+S50+U50+W50+Y50+AA50) -> 71 | AD50: =SUM(D50+F50+H50+J50+L50+N50+P50+R50+T50+V50+X50+Z50+AB50) -> 3651 | AE50: =SUM(AD50/AC50) -> 51.422535211267608 | AF50: =ROUNDDOWN(((AE50-50)*0.8),0) -> 1
A51: =SUM(A50+1) -> 49 | B51: Adam Miller | Q51: 1 | R51: 51 | U51: 17 | V51: 900 | W51: 17 | X51: 900 | Y51: 17 | Z51: 874 | AA51: 18 | AB51: 988 | AC51: =SUM(C51+E51+G51+I51+K51+M51+O51+Q51+S51+U51+W51+Y51+AA51) -> 70 | AD51: =SUM(D51+F51+H51+J51+L51+N51+P51+R51+T51+V51+X51+Z51+AB51) -> 3713 | AE51: =SUM(AD51/AC51) -> 53.042857142857144 | AF51: =ROUNDDOWN(((AE51-50)*0.8),0) -> 2
A52: =SUM(A51+1) -> 50 | B52: Justin Zehr | S52: 9 | T52: 537 | U52: 18 | V52: 1080 | W52: 16 | X52: 907 | Y52: 16 | Z52: 945 | AA52: 11 | AB52: 670 | AC52: =SUM(C52+E52+G52+I52+K52+M52+O52+Q52+S52+U52+W52+Y52+AA52) -> 70 | AD52: =SUM(D52+F52+H52+J52+L52+N52+P52+R52+T52+V52+X52+Z52+AB52) -> 4139 | AE52: =SUM(AD52/AC52) -> 59.128571428571426 | AF52: =ROUNDDOWN(((AE52-50)*0.8),0) -> 7
A53: =SUM(A52+1) -> 51 | B53: Dan Klein | K53: 11 | L53: 680 | M53: 18 | N53: 1050 | O53: 12 | P53: 665 | Q53: 18 | R53: 1024 | S53: 9 | T53: 520 | AC53: =SUM(C53+E53+G53+I53+K53+M53+O53+Q53+S53+U53+W53+Y53+AA53) -> 68 | AD53: =SUM(D53+F53+H53+J53+L53+N53+P53+R53+T53+V53+X53+Z53+AB53) -> 3939 | AE53: =SUM(AD53/AC53) -> 57.926470588235297 | AF53: =ROUNDDOWN(((AE53-50)*0.8),0) -> 6
A54: =SUM(A53+1) -> 52 | B54: Spencer Eubanks | U54: 16 | V54: 1040 | W54: 18 | X54: 1169 | Y54: 18 | Z54: 1139 | AA54: 16 | AB54: 1010 | AC54: =SUM(C54+E54+G54+I54+K54+M54+O54+Q54+S54+U54+W54+Y54+AA54) -> 68 | AD54: =SUM(D54+F54+H54+J54+L54+N54+P54+R54+T54+V54+X54+Z54+AB54) -> 4358 | AE54: =SUM(AD54/AC54) -> 64.088235294117652 | AF54: =ROUNDDOWN(((AE54-50)*0.8),0) -> 11
A55: =SUM(A54+1) -> 53 | B55: JT Hagameier | C55: 3 | D55: 181 | E55: 21 | F55: 1405 | G55: 17 | H55: 1085 | I55: 15 | J55: 964 | M55: 12 | N55: 791 | AC55: =SUM(C55+E55+G55+I55+K55+M55+O55+Q55+S55+U55+W55+Y55+AA55) -> 68 | AD55: =SUM(D55+F55+H55+J55+L55+N55+P55+R55+T55+V55+X55+Z55+AB55) -> 4426 | AE55: =SUM(AD55/AC55) -> 65.088235294117652 | AF55: =ROUNDDOWN(((AE55-50)*0.8),0) -> 12
A56: =SUM(A55+1) -> 54 | B56: Corey Moel | C56: 14 | D56: 939 | E56: 21 | F56: 1306 | G56: 18 | H56: 1143 | I56: 15 | J56: 1042 | AC56: =SUM(C56+E56+G56+I56+K56+M56+O56+Q56+S56+U56+W56+Y56+AA56) -> 68 | AD56: =SUM(D56+F56+H56+J56+L56+N56+P56+R56+T56+V56+X56+Z56+AB56) -> 4430 | AE56: =SUM(AD56/AC56) -> 65.147058823529406 | AF56: =ROUNDDOWN(((AE56-50)*0.8),0) -> 12
A57: =SUM(A56+1) -> 55 | B57: KVN | U57: 16 | V57: 837 | W57: 15 | X57: 749 | Y57: 18 | Z57: 930 | AA57: 18 | AB57: 947 | AC57: =SUM(C57+E57+G57+I57+K57+M57+O57+Q57+S57+U57+W57+Y57+AA57) -> 67 | AD57: =SUM(D57+F57+H57+J57+L57+N57+P57+R57+T57+V57+X57+Z57+AB57) -> 3463 | AE57: =SUM(AD57/AC57) -> 51.686567164179102 | AF57: =ROUNDDOWN(((AE57-50)*0.8),0) -> 1
A58: =SUM(A57+1) -> 56 | B58: Matt Rinker | M58: 18 | N58: 964 | O58: 19 | P58: 1044 | Q58: 18 | R58: 984 | S58: 9 | T58: 472 | AC58: =SUM(C58+E58+G58+I58+K58+M58+O58+Q58+S58+U58+W58+Y58+AA58) -> 64 | AD58: =SUM(D58+F58+H58+J58+L58+N58+P58+R58+T58+V58+X58+Z58+AB58) -> 3464 | AE58: =SUM(AD58/AC58) -> 54.125 | AF58: =ROUNDDOWN(((AE58-50)*0.8),0) -> 3
A59: =SUM(A58+1) -> 57 | B59: Dustin Nohr | U59: 15 | V59: 935 | W59: 18 | X59: 1031 | Y59: 15 | Z59: 873 | AA59: 16 | AB59: 928 | AC59: =SUM(C59+E59+G59+I59+K59+M59+O59+Q59+S59+U59+W59+Y59+AA59) -> 64 | AD59: =SUM(D59+F59+H59+J59+L59+N59+P59+R59+T59+V59+X59+Z59+AB59) -> 3767 | AE59: =SUM(AD59/AC59) -> 58.859375 | AF59: =ROUNDDOWN(((AE59-50)*0.8),0) -> 7
A60: =SUM(A59+1) -> 58 | B60: Brian Zyzda | G60: 1 | H60: 61 | I60: 17 | J60: 949 | K60: 17 | L60: 943 | M60: 18 | N60: 972 | O60: 10 | P60: 514 | AC60: =SUM(C60+E60+G60+I60+K60+M60+O60+Q60+S60+U60+W60+Y60+AA60) -> 63 | AD60: =SUM(D60+F60+H60+J60+L60+N60+P60+R60+T60+V60+X60+Z60+AB60) -> 3439 | AE60: =SUM(AD60/AC60) -> 54.587301587301589 | AF60: =ROUNDDOWN(((AE60-50)*0.8),0) -> 3
A61: =SUM(A60+1) -> 59 | B61: John Russell | M61: 10 | N61: 585 | O61: 17 | P61: 959 | Q61: 18 | R61: 1044 | S61: 17 | T61: 952 | AC61: =SUM(C61+E61+G61+I61+K61+M61+O61+Q61+S61+U61+W61+Y61+AA61) -> 62 | AD61: =SUM(D61+F61+H61+J61+L61+N61+P61+R61+T61+V61+X61+Z61+AB61) -> 3540 | AE61: =SUM(AD61/AC61) -> 57.096774193548384 | AF61: =ROUNDDOWN(((AE61-50)*0.8),0) -> 5
A62: =SUM(A61+1) -> 60 | B62: Jeremy Bos | K62: 16 | L62: 962 | M62: 15 | N62: 922 | O62: 15 | P62: 960 | Q62: 16 | R62: 986 | AC62: =SUM(C62+E62+G62+I62+K62+M62+O62+Q62+S62+U62+W62+Y62+AA62) -> 62 | AD62: =SUM(D62+F62+H62+J62+L62+N62+P62+R62+T62+V62+X62+Z62+AB62) -> 3830 | AE62: =SUM(AD62/AC62) -> 61.774193548387096 | AF62: =ROUNDDOWN(((AE62-50)*0.8),0) -> 9
A63: =SUM(A62+1) -> 61 | B63: Brian Eastwood | C63: 21 | D63: 1380 | E63: 22 | F63: 1411 | G63: 9 | H63: 562 | I63: 9 | J63: 576 | AC63: =SUM(C63+E63+G63+I63+K63+M63+O63+Q63+S63+U63+W63+Y63+AA63) -> 61 | AD63: =SUM(D63+F63+H63+J63+L63+N63+P63+R63+T63+V63+X63+Z63+AB63) -> 3929 | AE63: =SUM(AD63/AC63) -> 64.409836065573771 | AF63: =ROUNDDOWN(((AE63-50)*0.8),0) -> 11
A64: =SUM(A63+1) -> 62 | B64: Aaron Lindsley | M64: 14 | N64: 740 | O64: 19 | P64: 1011 | Q64: 12 | R64: 642 | S64: 14 | T64: 729 | AC64: =SUM(C64+E64+G64+I64+K64+M64+O64+Q64+S64+U64+W64+Y64+AA64) -> 59 | AD64: =SUM(D64+F64+H64+J64+L64+N64+P64+R64+T64+V64+X64+Z64+AB64) -> 3122 | AE64: =SUM(AD64/AC64) -> 52.915254237288138 | AF64: =ROUNDDOWN(((AE64-50)*0.8),0) -> 2
A65: =SUM(A64+1) -> 63 | B65: Travis Scott* | C65: 22 | D65: 1325 | E65: 12 | F65: 813 | G65: 14 | H65: 839 | I65: 8 | J65: 480 | AC65: =SUM(C65+E65+G65+I65+K65+M65+O65+Q65+S65+U65+W65+Y65+AA65) -> 56 | AD65: =SUM(D65+F65+H65+J65+L65+N65+P65+R65+T65+V65+X65+Z65+AB65) -> 3457 | AE65: =SUM(AD65/AC65) -> 61.732142857142854 | AF65: =ROUNDDOWN(((AE65-50)*0.8),0) -> 9
A66: =SUM(A65+1) -> 64 | B66: J "Cally" Callaghan* | M66: 18 | N66: 1138 | O66: 19 | P66: 1157 | Q66: 18 | R66: 1159 | AC66: =SUM(C66+E66+G66+I66+K66+M66+O66+Q66+S66+U66+W66+Y66+AA66) -> 55 | AD66: =SUM(D66+F66+H66+J66+L66+N66+P66+R66+T66+V66+X66+Z66+AB66) -> 3454 | AE66: =SUM(AD66/AC66) -> 62.800 | AF66: =ROUNDDOWN(((AE66-50)*0.8),0) -> 10
A67: =SUM(A66+1) -> 65 | B67: Mike Robinson | M67: 17 | N67: 934 | O67: 19 | P67: 966 | Q67: 17 | R67: 936 | AC67: =SUM(C67+E67+G67+I67+K67+M67+O67+Q67+S67+U67+W67+Y67+AA67) -> 53 | AD67: =SUM(D67+F67+H67+J67+L67+N67+P67+R67+T67+V67+X67+Z67+AB67) -> 2836 | AE67: =SUM(AD67/AC67) -> 53.509433962264154 | AF67: =ROUNDDOWN(((AE67-50)*0.8),0) -> 2
A68: =SUM(A67+1) -> 66 | B68: Tim Potter* | W68: 18 | X68: 930 | Y68: 17 | Z68: 923 | AA68: 18 | AB68: 1002 | AC68: =SUM(C68+E68+G68+I68+K68+M68+O68+Q68+S68+U68+W68+Y68+AA68) -> 53 | AD68: =SUM(D68+F68+H68+J68+L68+N68+P68+R68+T68+V68+X68+Z68+AB68) -> 2855 | AE68: =SUM(AD68/AC68) -> 53.867924528301884 | AF68: =ROUNDDOWN(((AE68-50)*0.8),0) -> 3
A69: =SUM(A68+1) -> 67 | B69: Kate Papenthien | Q69: 18 | R69: 1137 | S69: 18 | T69: 1057 | U69: 17 | V69: 995 | AC69: =SUM(C69+E69+G69+I69+K69+M69+O69+Q69+S69+U69+W69+Y69+AA69) -> 53 | AD69: =SUM(D69+F69+H69+J69+L69+N69+P69+R69+T69+V69+X69+Z69+AB69) -> 3189 | AE69: =SUM(AD69/AC69) -> 60.169811320754718 | AF69: =ROUNDDOWN(((AE69-50)*0.8),0) -> 8
A70: =SUM(A69+1) -> 68 | B70: Brent Kauffman | K70: 18 | L70: 965 | O70: 17 | P70: 901 | Q70: 17 | R70: 946 | AC70: =SUM(C70+E70+G70+I70+K70+M70+O70+Q70+S70+U70+W70+Y70+AA70) -> 52 | AD70: =SUM(D70+F70+H70+J70+L70+N70+P70+R70+T70+V70+X70+Z70+AB70) -> 2812 | AE70: =SUM(AD70/AC70) -> 54.07692307692308 | AF70: =ROUNDDOWN(((AE70-50)*0.8),0) -> 3
A71: =SUM(A70+1) -> 69 | B71: Valera Petrulevich | S71: 16 | T71: 1001 | U71: 17 | V71: 1034 | W71: 18 | X71: 1028 | AC71: =SUM(C71+E71+G71+I71+K71+M71+O71+Q71+S71+U71+W71+Y71+AA71) -> 51 | AD71: =SUM(D71+F71+H71+J71+L71+N71+P71+R71+T71+V71+X71+Z71+AB71) -> 3063 | AE71: =SUM(AD71/AC71) -> 60.058823529411768 | AF71: =ROUNDDOWN(((AE71-50)*0.8),0) -> 8
A72: =SUM(A71+1) -> 70 | B72: John Williams | W72: 16 | X72: 954 | Y72: 17 | Z72: 983 | AA72: 17 | AB72: 990 | AC72: =SUM(C72+E72+G72+I72+K72+M72+O72+Q72+S72+U72+W72+Y72+AA72) -> 50 | AD72: =SUM(D72+F72+H72+J72+L72+N72+P72+R72+T72+V72+X72+Z72+AB72) -> 2927 | AE72: =SUM(AD72/AC72) -> 58.540 | AF72: =ROUNDDOWN(((AE72-50)*0.8),0) -> 6
A73: =SUM(A72+1) -> 71 | B73: Ryan Eggleston | W73: 15 | X73: 887 | Y73: 16 | Z73: 940 | AA73: 18 | AB73: 1043 | AC73: =SUM(C73+E73+G73+I73+K73+M73+O73+Q73+S73+U73+W73+Y73+AA73) -> 49 | AD73: =SUM(D73+F73+H73+J73+L73+N73+P73+R73+T73+V73+X73+Z73+AB73) -> 2870 | AE73: =SUM(AD73/AC73) -> 58.571428571428569 | AF73: =ROUNDDOWN(((AE73-50)*0.8),0) -> 6
A74: =SUM(A73+1) -> 72 | B74: Steve Callaway | M74: 7 | N74: 422 | O74: 16 | P74: 971 | Q74: 16 | R74: 976 | S74: 3 | T74: 167 | U74: 7 | V74: 424 | AC74: =SUM(C74+E74+G74+I74+K74+M74+O74+Q74+S74+U74+W74+Y74+AA74) -> 49 | AD74: =SUM(D74+F74+H74+J74+L74+N74+P74+R74+T74+V74+X74+Z74+AB74) -> 2960 | AE74: =SUM(AD74/AC74) -> 60.408163265306122 | AF74: =ROUNDDOWN(((AE74-50)*0.8),0) -> 8
A75: =SUM(A74+1) -> 73 | B75: Dusty Mcatee | C75: 15 | D75: 888 | E75: 21 | F75: 1210 | G75: 12 | H75: 776 | AC75: =SUM(C75+E75+G75+I75+K75+M75+O75+Q75+S75+U75+W75+Y75+AA75) -> 48 | AD75: =SUM(D75+F75+H75+J75+L75+N75+P75+R75+T75+V75+X75+Z75+AB75) -> 2874 | AE75: =SUM(AD75/AC75) -> 59.875 | AF75: =ROUNDDOWN(((AE75-50)*0.8),0) -> 7
A76: =SUM(A75+1) -> 74 | B76: Lee Nerad | E76: 14 | F76: 856 | G76: 18 | H76: 1099 | I76: 16 | J76: 982 | AC76: =SUM(C76+E76+G76+I76+K76+M76+O76+Q76+S76+U76+W76+Y76+AA76) -> 48 | AD76: =SUM(D76+F76+H76+J76+L76+N76+P76+R76+T76+V76+X76+Z76+AB76) -> 2937 | AE76: =SUM(AD76/AC76) -> 61.1875 | AF76: =ROUNDDOWN(((AE76-50)*0.8),0) -> 8
A77: =SUM(A76+1) -> 75 | B77: Brandon Yoder | S77: 15 | T77: 1014 | U77: 13 | V77: 855 | W77: 10 | X77: 676 | Y77: 10 | Z77: 673 | AC77: =SUM(C77+E77+G77+I77+K77+M77+O77+Q77+S77+U77+W77+Y77+AA77) -> 48 | AD77: =SUM(D77+F77+H77+J77+L77+N77+P77+R77+T77+V77+X77+Z77+AB77) -> 3218 | AE77: =SUM(AD77/AC77) -> 67.041666666666671 | AF77: =ROUNDDOWN(((AE77-50)*0.8),0) -> 13
A78: =SUM(A77+1) -> 76 | B78: Eric Strader | G78: 18 | H78: 1178 | I78: 18 | J78: 1042 | K78: 11 | L78: 691 | AC78: =SUM(C78+E78+G78+I78+K78+M78+O78+Q78+S78+U78+W78+Y78+AA78) -> 47 | AD78: =SUM(D78+F78+H78+J78+L78+N78+P78+R78+T78+V78+X78+Z78+AB78) -> 2911 | AE78: =SUM(AD78/AC78) -> 61.936170212765958 | AF78: =ROUNDDOWN(((AE78-50)*0.8),0) -> 9
A79: =SUM(A78+1) -> 77 | B79: Doug Johnson | Q79: 2 | R79: 99 | U79: 1 | V79: 49 | W79: 5 | X79: 246 | Y79: 17 | Z79: 905 | AA79: 18 | AB79: 973 | AC79: =SUM(C79+E79+G79+I79+K79+M79+O79+Q79+S79+U79+W79+Y79+AA79) -> 43 | AD79: =SUM(D79+F79+H79+J79+L79+N79+P79+R79+T79+V79+X79+Z79+AB79) -> 2272 | AE79: =SUM(AD79/AC79) -> 52.837209302325583 | AF79: =ROUNDDOWN(((AE79-50)*0.8),0) -> 2
A80: =SUM(A79+1) -> 78 | B80: Shane Thirtyacre | W80: 14 | X80: 821 | Y80: 11 | Z80: 667 | AA80: 18 | AB80: 1108 | AC80: =SUM(C80+E80+G80+I80+K80+M80+O80+Q80+S80+U80+W80+Y80+AA80) -> 43 | AD80: =SUM(D80+F80+H80+J80+L80+N80+P80+R80+T80+V80+X80+Z80+AB80) -> 2596 | AE80: =SUM(AD80/AC80) -> 60.372093023255815 | AF80: =ROUNDDOWN(((AE80-50)*0.8),0) -> 8
A81: =SUM(A80+1) -> 79 | B81: Joe Ostby | M81: 12 | N81: 682 | Q81: 18 | R81: 1029 | S81: 12 | T81: 683 | AC81: =SUM(C81+E81+G81+I81+K81+M81+O81+Q81+S81+U81+W81+Y81+AA81) -> 42 | AD81: =SUM(D81+F81+H81+J81+L81+N81+P81+R81+T81+V81+X81+Z81+AB81) -> 2394 | AE81: =SUM(AD81/AC81) -> 57.000 | AF81: =ROUNDDOWN(((AE81-50)*0.8),0) -> 5
A82: =SUM(A81+1) -> 80 | B82: Joe Evans | K82: 12 | L82: 815 | M82: 14 | N82: 931 | S82: 16 | T82: 1120 | AC82: =SUM(C82+E82+G82+I82+K82+M82+O82+Q82+S82+U82+W82+Y82+AA82) -> 42 | AD82: =SUM(D82+F82+H82+J82+L82+N82+P82+R82+T82+V82+X82+Z82+AB82) -> 2866 | AE82: =SUM(AD82/AC82) -> 68.238095238095241 | AF82: =ROUNDDOWN(((AE82-50)*0.8),0) -> 14
A83: =SUM(A82+1) -> 81 | B83: Scott Eastwood | C83: 20 | D83: 1619 | E83: 19 | F83: 1320 | G83: 3 | H83: 218 | AC83: =SUM(C83+E83+G83+I83+K83+M83+O83+Q83+S83+U83+W83+Y83+AA83) -> 42 | AD83: =SUM(D83+F83+H83+J83+L83+N83+P83+R83+T83+V83+X83+Z83+AB83) -> 3157 | AE83: =SUM(AD83/AC83) -> 75.166666666666671 | AF83: =ROUNDDOWN(((AE83-50)*0.8),0) -> 20
A84: =SUM(A83+1) -> 82 | B84: Troy Knapp | M84: 5 | N84: 301 | Q84: 16 | R84: 1034 | S84: 18 | T84: 1121 | U84: 1 | V84: 65 | AC84: =SUM(C84+E84+G84+I84+K84+M84+O84+Q84+S84+U84+W84+Y84+AA84) -> 40 | AD84: =SUM(D84+F84+H84+J84+L84+N84+P84+R84+T84+V84+X84+Z84+AB84) -> 2521 | AE84: =SUM(AD84/AC84) -> 63.024999999999999 | AF84: =ROUNDDOWN(((AE84-50)*0.8),0) -> 10
A85: =SUM(A84+1) -> 83 | B85: Dev Nelson | Q85: 1 | R85: 50 | U85: 15 | V85: 810 | W85: 18 | X85: 928 | Y85: 2 | Z85: 105 | AA85: 3 | AB85: 168 | AC85: =SUM(C85+E85+G85+I85+K85+M85+O85+Q85+S85+U85+W85+Y85+AA85) -> 39 | AD85: =SUM(D85+F85+H85+J85+L85+N85+P85+R85+T85+V85+X85+Z85+AB85) -> 2061 | AE85: =SUM(AD85/AC85) -> 52.846153846153847 | AF85: =ROUNDDOWN(((AE85-50)*0.8),0) -> 2
A86: =SUM(A85+1) -> 84 | B86: Brent Ross | E86: 21 | F86: 1287 | G86: 18 | H86: 1097 | AC86: =SUM(C86+E86+G86+I86+K86+M86+O86+Q86+S86+U86+W86+Y86+AA86) -> 39 | AD86: =SUM(D86+F86+H86+J86+L86+N86+P86+R86+T86+V86+X86+Z86+AB86) -> 2384 | AE86: =SUM(AD86/AC86) -> 61.128205128205131 | AF86: =ROUNDDOWN(((AE86-50)*0.8),0) -> 8
A87: =SUM(A86+1) -> 85 | B87: Kurt Conrad | W87: 3 | X87: 157 | Y87: 17 | Z87: 909 | AA87: 18 | AB87: 970 | AC87: =SUM(C87+E87+G87+I87+K87+M87+O87+Q87+S87+U87+W87+Y87+AA87) -> 38 | AD87: =SUM(D87+F87+H87+J87+L87+N87+P87+R87+T87+V87+X87+Z87+AB87) -> 2036 | AE87: =SUM(AD87/AC87) -> 53.578947368421055 | AF87: =ROUNDDOWN(((AE87-50)*0.8),0) -> 2
A88: =SUM(A87+1) -> 86 | B88: Jon Shear | O88: 18 | P88: 1036 | Q88: 16 | R88: 908 | S88: 4 | T88: 216 | AC88: =SUM(C88+E88+G88+I88+K88+M88+O88+Q88+S88+U88+W88+Y88+AA88) -> 38 | AD88: =SUM(D88+F88+H88+J88+L88+N88+P88+R88+T88+V88+X88+Z88+AB88) -> 2160 | AE88: =SUM(AD88/AC88) -> 56.842105263157897 | AF88: =ROUNDDOWN(((AE88-50)*0.8),0) -> 5
A89: =SUM(A88+1) -> 87 | B89: Brad Balk | O89: 19 | P89: 1178 | Q89: 18 | R89: 1110 | AC89: =SUM(C89+E89+G89+I89+K89+M89+O89+Q89+S89+U89+W89+Y89+AA89) -> 37 | AD89: =SUM(D89+F89+H89+J89+L89+N89+P89+R89+T89+V89+X89+Z89+AB89) -> 2288 | AE89: =SUM(AD89/AC89) -> 61.837837837837839 | AF89: =ROUNDDOWN(((AE89-50)*0.8),0) -> 9
A90: =SUM(A89+1) -> 88 | B90: Jason Shook | M90: 18 | N90: 984 | O90: 1 | P90: 56 | Q90: 17 | R90: 940 | AC90: =SUM(C90+E90+G90+I90+K90+M90+O90+Q90+S90+U90+W90+Y90+AA90) -> 36 | AD90: =SUM(D90+F90+H90+J90+L90+N90+P90+R90+T90+V90+X90+Z90+AB90) -> 1980 | AE90: =SUM(AD90/AC90) -> 55.000 | AF90: =ROUNDDOWN(((AE90-50)*0.8),0) -> 4
A91: =SUM(A90+1) -> 89 | B91: Jake Sutter | M91: 18 | N91: 1034 | O91: 18 | P91: 1009 | AC91: =SUM(C91+E91+G91+I91+K91+M91+O91+Q91+S91+U91+W91+Y91+AA91) -> 36 | AD91: =SUM(D91+F91+H91+J91+L91+N91+P91+R91+T91+V91+X91+Z91+AB91) -> 2043 | AE91: =SUM(AD91/AC91) -> 56.750 | AF91: =ROUNDDOWN(((AE91-50)*0.8),0) -> 5
A92: =SUM(A91+1) -> 90 | B92: Skyler Landess | M92: 18 | N92: 1313 | O92: 14 | P92: 957 | S92: 3 | T92: 216 | AA92: 1 | AB92: 59 | AC92: =SUM(C92+E92+G92+I92+K92+M92+O92+Q92+S92+U92+W92+Y92+AA92) -> 36 | AD92: =SUM(D92+F92+H92+J92+L92+N92+P92+R92+T92+V92+X92+Z92+AB92) -> 2545 | AE92: =SUM(AD92/AC92) -> 70.694444444444443 | AF92: =ROUNDDOWN(((AE92-50)*0.8),0) -> 16
A93: =SUM(A92+1) -> 91 | B93: Nick Schultz | Q93: 1 | R93: 57 | S93: 16 | T93: 880 | U93: 18 | V93: 979 | AC93: =SUM(C93+E93+G93+I93+K93+M93+O93+Q93+S93+U93+W93+Y93+AA93) -> 35 | AD93: =SUM(D93+F93+H93+J93+L93+N93+P93+R93+T93+V93+X93+Z93+AB93) -> 1916 | AE93: =SUM(AD93/AC93) -> 54.74285714285714 | AF93: =ROUNDDOWN(((AE93-50)*0.8),0) -> 3
A94: =SUM(A93+1) -> 92 | B94: Phil Campos | Y94: 18 | Z94: 1034 | AA94: 17 | AB94: 995 | AC94: =SUM(C94+E94+G94+I94+K94+M94+O94+Q94+S94+U94+W94+Y94+AA94) -> 35 | AD94: =SUM(D94+F94+H94+J94+L94+N94+P94+R94+T94+V94+X94+Z94+AB94) -> 2029 | AE94: =SUM(AD94/AC94) -> 57.971428571428568 | AF94: =ROUNDDOWN(((AE94-50)*0.8),0) -> 6
A95: =SUM(A94+1) -> 93 | B95: Eric Smith | Y95: 18 | Z95: 1080 | AA95: 17 | AB95: 1041 | AC95: =SUM(C95+E95+G95+I95+K95+M95+O95+Q95+S95+U95+W95+Y95+AA95) -> 35 | AD95: =SUM(D95+F95+H95+J95+L95+N95+P95+R95+T95+V95+X95+Z95+AB95) -> 2121 | AE95: =SUM(AD95/AC95) -> 60.600 | AF95: =ROUNDDOWN(((AE95-50)*0.8),0) -> 8
A96: =SUM(A95+1) -> 94 | B96: Marc Bookmeyer | K96: 17 | L96: 1084 | M96: 18 | N96: 1115 | AC96: =SUM(C96+E96+G96+I96+K96+M96+O96+Q96+S96+U96+W96+Y96+AA96) -> 35 | AD96: =SUM(D96+F96+H96+J96+L96+N96+P96+R96+T96+V96+X96+Z96+AB96) -> 2199 | AE96: =SUM(AD96/AC96) -> 62.828571428571429 | AF96: =ROUNDDOWN(((AE96-50)*0.8),0) -> 10
A97: =SUM(A96+1) -> 95 | B97: Aaron "Burnie" Burnett | I97: 17 | J97: 1161 | K97: 18 | L97: 1193 | AC97: =SUM(C97+E97+G97+I97+K97+M97+O97+Q97+S97+U97+W97+Y97+AA97) -> 35 | AD97: =SUM(D97+F97+H97+J97+L97+N97+P97+R97+T97+V97+X97+Z97+AB97) -> 2354 | AE97: =SUM(AD97/AC97) -> 67.257142857142853 | AF97: =ROUNDDOWN(((AE97-50)*0.8),0) -> 13
A98: =SUM(A97+1) -> 96 | B98: Ben Young | Q98: 16 | R98: 1072 | S98: 18 | T98: 1166 | AC98: =SUM(C98+E98+G98+I98+K98+M98+O98+Q98+S98+U98+W98+Y98+AA98) -> 34 | AD98: =SUM(D98+F98+H98+J98+L98+N98+P98+R98+T98+V98+X98+Z98+AB98) -> 2238 | AE98: =SUM(AD98/AC98) -> 65.82352941176471 | AF98: =ROUNDDOWN(((AE98-50)*0.8),0) -> 12
A99: =SUM(A98+1) -> 97 | B99: Rob Mumma | U99: 18 | V99: 1044 | W99: 4 | X99: 218 | Y99: 4 | Z99: 222 | AA99: 7 | AB99: 411 | AC99: =SUM(C99+E99+G99+I99+K99+M99+O99+Q99+S99+U99+W99+Y99+AA99) -> 33 | AD99: =SUM(D99+F99+H99+J99+L99+N99+P99+R99+T99+V99+X99+Z99+AB99) -> 1895 | AE99: =SUM(AD99/AC99) -> 57.424242424242422 | AF99: =ROUNDDOWN(((AE99-50)*0.8),0) -> 5
A100: =SUM(A99+1) -> 98 | B100: Nathan Ciha | W100: 18 | X100: 1003 | Y100: 14 | Z100: 801 | AC100: =SUM(C100+E100+G100+I100+K100+M100+O100+Q100+S100+U100+W100+Y100+AA100) -> 32 | AD100: =SUM(D100+F100+H100+J100+L100+N100+P100+R100+T100+V100+X100+Z100+AB100) -> 1804 | AE100: =SUM(AD100/AC100) -> 56.375 | AF100: =ROUNDDOWN(((AE100-50)*0.8),0) -> 5
A101: =SUM(A100+1) -> 99 | B101: Brad Rew | S101: 16 | T101: 914 | U101: 13 | V101: 752 | W101: 3 | X101: 165 | AC101: =SUM(C101+E101+G101+I101+K101+M101+O101+Q101+S101+U101+W101+Y101+AA101) -> 32 | AD101: =SUM(D101+F101+H101+J101+L101+N101+P101+R101+T101+V101+X101+Z101+AB101) -> 1831 | AE101: =SUM(AD101/AC101) -> 57.21875 | AF101: =ROUNDDOWN(((AE101-50)*0.8),0) -> 5
A102: =SUM(A101+1) -> 100 | B102: Andrew Staudt | Q102: 15 | R102: 962 | S102: 13 | T102: 814 | U102: 4 | V102: 246 | AC102: =SUM(C102+E102+G102+I102+K102+M102+O102+Q102+S102+U102+W102+Y102+AA102) -> 32 | AD102: =SUM(D102+F102+H102+J102+L102+N102+P102+R102+T102+V102+X102+Z102+AB102) -> 2022 | AE102: =SUM(AD102/AC102) -> 63.1875 | AF102: =ROUNDDOWN(((AE102-50)*0.8),0) -> 10
A103: =SUM(A102+1) -> 101 | B103: Brad Milder | O103: 10 | P103: 531 | Q103: 17 | R103: 915 | Y103: 4 | Z103: 227 | AC103: =SUM(C103+E103+G103+I103+K103+M103+O103+Q103+S103+U103+W103+Y103+AA103) -> 31 | AD103: =SUM(D103+F103+H103+J103+L103+N103+P103+R103+T103+V103+X103+Z103+AB103) -> 1673 | AE103: =SUM(AD103/AC103) -> 53.967741935483872 | AF103: =ROUNDDOWN(((AE103-50)*0.8),0) -> 3
A104: =SUM(A103+1) -> 102 | B104: Corey Philips | M104: 14 | N104: 847 | O104: 17 | P104: 1008 | AC104: =SUM(C104+E104+G104+I104+K104+M104+O104+Q104+S104+U104+W104+Y104+AA104) -> 31 | AD104: =SUM(D104+F104+H104+J104+L104+N104+P104+R104+T104+V104+X104+Z104+AB104) -> 1855 | AE104: =SUM(AD104/AC104) -> 59.838709677419352 | AF104: =ROUNDDOWN(((AE104-50)*0.8),0) -> 7
A105: =SUM(A104+1) -> 103 | B105: Tyson Gosnell* | C105: 21 | D105: 1373 | E105: 3 | F105: 197 | G105: 6 | H105: 385 | I105: 1 | J105: 75 | AC105: =SUM(C105+E105+G105+I105+K105+M105+O105+Q105+S105+U105+W105+Y105+AA105) -> 31 | AD105: =SUM(D105+F105+H105+J105+L105+N105+P105+R105+T105+V105+X105+Z105+AB105) -> 2030 | AE105: =SUM(AD105/AC105) -> 65.483870967741936 | AF105: =ROUNDDOWN(((AE105-50)*0.8),0) -> 12
A106: =SUM(A105+1) -> 104 | B106: Brad Pike | M106: 18 | N106: 1265 | S106: 13 | T106: 852 | AC106: =SUM(C106+E106+G106+I106+K106+M106+O106+Q106+S106+U106+W106+Y106+AA106) -> 31 | AD106: =SUM(D106+F106+H106+J106+L106+N106+P106+R106+T106+V106+X106+Z106+AB106) -> 2117 | AE106: =SUM(AD106/AC106) -> 68.290322580645167 | AF106: =ROUNDDOWN(((AE106-50)*0.8),0) -> 14
A107: =SUM(A106+1) -> 105 | B107: Brian Cobb | C107: 2 | D107: 126 | E107: 21 | F107: 1367 | G107: 6 | H107: 406 | AC107: =SUM(C107+E107+G107+I107+K107+M107+O107+Q107+S107+U107+W107+Y107+AA107) -> 29 | AD107: =SUM(D107+F107+H107+J107+L107+N107+P107+R107+T107+V107+X107+Z107+AB107) -> 1899 | AE107: =SUM(AD107/AC107) -> 65.482758620689651 | AF107: =ROUNDDOWN(((AE107-50)*0.8),0) -> 12
A108: =SUM(A107+1) -> 106 | B108: Greg Friestad | U108: 11 | V108: 607 | W108: 16 | X108: 856 | AA108: 1 | AB108: 59 | AC108: =SUM(C108+E108+G108+I108+K108+M108+O108+Q108+S108+U108+W108+Y108+AA108) -> 28 | AD108: =SUM(D108+F108+H108+J108+L108+N108+P108+R108+T108+V108+X108+Z108+AB108) -> 1522 | AE108: =SUM(AD108/AC108) -> 54.357142857142854 | AF108: =ROUNDDOWN(((AE108-50)*0.8),0) -> 3
A109: =SUM(A108+1) -> 107 | B109: Joe Grady | Q109: 18 | R109: 1039 | S109: 9 | T109: 503 | AC109: =SUM(C109+E109+G109+I109+K109+M109+O109+Q109+S109+U109+W109+Y109+AA109) -> 27 | AD109: =SUM(D109+F109+H109+J109+L109+N109+P109+R109+T109+V109+X109+Z109+AB109) -> 1542 | AE109: =SUM(AD109/AC109) -> 57.111111111111114 | AF109: =ROUNDDOWN(((AE109-50)*0.8),0) -> 5
A110: =SUM(A109+1) -> 108 | B110: Mike Cameron* | G110: 14 | H110: 993 | I110: 12 | J110: 808 | AC110: =SUM(C110+E110+G110+I110+K110+M110+O110+Q110+S110+U110+W110+Y110+AA110) -> 26 | AD110: =SUM(D110+F110+H110+J110+L110+N110+P110+R110+T110+V110+X110+Z110+AB110) -> 1801 | AE110: =SUM(AD110/AC110) -> 69.269230769230774 | AF110: =ROUNDDOWN(((AE110-50)*0.8),0) -> 15
A111: =SUM(A110+1) -> 109 | B111: Jason Stroud | S111: 4 | T111: 219 | U111: 18 | V111: 980 | Y111: 3 | Z111: 170 | AC111: =SUM(C111+E111+G111+I111+K111+M111+O111+Q111+S111+U111+W111+Y111+AA111) -> 25 | AD111: =SUM(D111+F111+H111+J111+L111+N111+P111+R111+T111+V111+X111+Z111+AB111) -> 1369 | AE111: =SUM(AD111/AC111) -> 54.760 | AF111: =ROUNDDOWN(((AE111-50)*0.8),0) -> 3
A112: =SUM(A111+1) -> 110 | B112: Jeff "Peds" Petoletti | M112: 17 | N112: 1266 | O112: 8 | P112: 549 | AC112: =SUM(C112+E112+G112+I112+K112+M112+O112+Q112+S112+U112+W112+Y112+AA112) -> 25 | AD112: =SUM(D112+F112+H112+J112+L112+N112+P112+R112+T112+V112+X112+Z112+AB112) -> 1815 | AE112: =SUM(AD112/AC112) -> 72.600 | AF112: =ROUNDDOWN(((AE112-50)*0.8),0) -> 18
A113: =SUM(A112+1) -> 111 | B113: Matt Ross* | U113: 2 | V113: 116 | W113: 17 | X113: 930 | Y113: 5 | Z113: 299 | AC113: =SUM(C113+E113+G113+I113+K113+M113+O113+Q113+S113+U113+W113+Y113+AA113) -> 24 | AD113: =SUM(D113+F113+H113+J113+L113+N113+P113+R113+T113+V113+X113+Z113+AB113) -> 1345 | AE113: =SUM(AD113/AC113) -> 56.041666666666664 | AF113: =ROUNDDOWN(((AE113-50)*0.8),0) -> 4
A114: =SUM(A113+1) -> 112 | B114: Charlie Dobberstein | Q114: 18 | R114: 1041 | S114: 3 | T114: 158 | U114: 1 | V114: 53 | W114: 2 | X114: 112 | AC114: =SUM(C114+E114+G114+I114+K114+M114+O114+Q114+S114+U114+W114+Y114+AA114) -> 24 | AD114: =SUM(D114+F114+H114+J114+L114+N114+P114+R114+T114+V114+X114+Z114+AB114) -> 1364 | AE114: =SUM(AD114/AC114) -> 56.833333333333336 | AF114: =ROUNDDOWN(((AE114-50)*0.8),0) -> 5
A115: =SUM(A114+1) -> 113 | B115: Justin Oldfield | K115: 15 | L115: 1111 | M115: 8 | N115: 620 | AC115: =SUM(C115+E115+G115+I115+K115+M115+O115+Q115+S115+U115+W115+Y115+AA115) -> 23 | AD115: =SUM(D115+F115+H115+J115+L115+N115+P115+R115+T115+V115+X115+Z115+AB115) -> 1731 | AE115: =SUM(AD115/AC115) -> 75.260869565217391 | AF115: =ROUNDDOWN(((AE115-50)*0.8),0) -> 20
A116: =SUM(A115+1) -> 114 | B116: Chad Hein | O116: 19 | P116: 965 | Q116: 2 | R116: 102 | AC116: =SUM(C116+E116+G116+I116+K116+M116+O116+Q116+S116+U116+W116+Y116+AA116) -> 21 | AD116: =SUM(D116+F116+H116+J116+L116+N116+P116+R116+T116+V116+X116+Z116+AB116) -> 1067 | AE116: =SUM(AD116/AC116) -> 50.80952380952381 | AF116: =ROUNDDOWN(((AE116-50)*0.8),0) -> 0
A117: =SUM(A116+1) -> 115 | B117: Robb Neubrand | U117: 2 | V117: 108 | Y117: 1 | Z117: 51 | AA117: 18 | AB117: 999 | AC117: =SUM(C117+E117+G117+I117+K117+M117+O117+Q117+S117+U117+W117+Y117+AA117) -> 21 | AD117: =SUM(D117+F117+H117+J117+L117+N117+P117+R117+T117+V117+X117+Z117+AB117) -> 1158 | AE117: =SUM(AD117/AC117) -> 55.142857142857146 | AF117: =ROUNDDOWN(((AE117-50)*0.8),0) -> 4
A118: =SUM(A117+1) -> 116 | B118: Dan Lewis | W118: 13 | X118: 740 | Y118: 4 | Z118: 232 | AA118: 3 | AB118: 180 | AC118: =SUM(C118+E118+G118+I118+K118+M118+O118+Q118+S118+U118+W118+Y118+AA118) -> 20 | AD118: =SUM(D118+F118+H118+J118+L118+N118+P118+R118+T118+V118+X118+Z118+AB118) -> 1152 | AE118: =SUM(AD118/AC118) -> 57.600 | AF118: =ROUNDDOWN(((AE118-50)*0.8),0) -> 6
A119: =SUM(A118+1) -> 117 | B119: Randy | G119: 17 | H119: 1012 | K119: 3 | L119: 172 | AC119: =SUM(C119+E119+G119+I119+K119+M119+O119+Q119+S119+U119+W119+Y119+AA119) -> 20 | AD119: =SUM(D119+F119+H119+J119+L119+N119+P119+R119+T119+V119+X119+Z119+AB119) -> 1184 | AE119: =SUM(AD119/AC119) -> 59.200 | AF119: =ROUNDDOWN(((AE119-50)*0.8),0) -> 7
A120: =SUM(A119+1) -> 118 | B120: Dustin Gaskill | Q120: 5 | R120: 299 | S120: 14 | T120: 845 | U120: 1 | V120: 66 | AC120: =SUM(C120+E120+G120+I120+K120+M120+O120+Q120+S120+U120+W120+Y120+AA120) -> 20 | AD120: =SUM(D120+F120+H120+J120+L120+N120+P120+R120+T120+V120+X120+Z120+AB120) -> 1210 | AE120: =SUM(AD120/AC120) -> 60.500 | AF120: =ROUNDDOWN(((AE120-50)*0.8),0) -> 8
A121: =SUM(A120+1) -> 119 | B121: Chase Roberts | O121: 19 | P121: 973 | AC121: =SUM(C121+E121+G121+I121+K121+M121+O121+Q121+S121+U121+W121+Y121+AA121) -> 19 | AD121: =SUM(D121+F121+H121+J121+L121+N121+P121+R121+T121+V121+X121+Z121+AB121) -> 973 | AE121: =SUM(AD121/AC121) -> 51.210526315789473 | AF121: =ROUNDDOWN(((AE121-50)*0.8),0) -> 0
A122: =SUM(A121+1) -> 120 | B122: Drew Detert* | W122: 1 | X122: 55 | Y122: 18 | Z122: 947 | AC122: =SUM(C122+E122+G122+I122+K122+M122+O122+Q122+S122+U122+W122+Y122+AA122) -> 19 | AD122: =SUM(D122+F122+H122+J122+L122+N122+P122+R122+T122+V122+X122+Z122+AB122) -> 1002 | AE122: =SUM(AD122/AC122) -> 52.736842105263158 | AF122: =ROUNDDOWN(((AE122-50)*0.8),0) -> 2
A123: =SUM(A122+1) -> 121 | B123: Chris Clime | W123: 1 | X123: 50 | AA123: 18 | AB123: 988 | AC123: =SUM(C123+E123+G123+I123+K123+M123+O123+Q123+S123+U123+W123+Y123+AA123) -> 19 | AD123: =SUM(D123+F123+H123+J123+L123+N123+P123+R123+T123+V123+X123+Z123+AB123) -> 1038 | AE123: =SUM(AD123/AC123) -> 54.631578947368418 | AF123: =ROUNDDOWN(((AE123-50)*0.8),0) -> 3
A124: =SUM(A123+1) -> 122 | B124: Adam Karstens | U124: 1 | V124: 54 | W124: 1 | X124: 55 | Y124: 15 | Z124: 816 | AA124: 2 | AB124: 119 | AC124: =SUM(C124+E124+G124+I124+K124+M124+O124+Q124+S124+U124+W124+Y124+AA124) -> 19 | AD124: =SUM(D124+F124+H124+J124+L124+N124+P124+R124+T124+V124+X124+Z124+AB124) -> 1044 | AE124: =SUM(AD124/AC124) -> 54.94736842105263 | AF124: =ROUNDDOWN(((AE124-50)*0.8),0) -> 3
A125: =SUM(A124+1) -> 123 | B125: Lon Reilly | O125: 19 | P125: 1050 | AC125: =SUM(C125+E125+G125+I125+K125+M125+O125+Q125+S125+U125+W125+Y125+AA125) -> 19 | AD125: =SUM(D125+F125+H125+J125+L125+N125+P125+R125+T125+V125+X125+Z125+AB125) -> 1050 | AE125: =SUM(AD125/AC125) -> 55.263157894736842 | AF125: =ROUNDDOWN(((AE125-50)*0.8),0) -> 4
A126: =SUM(A125+1) -> 124 | B126: Archie Coulter | U126: 1 | V126: 58 | AA126: 18 | AB126: 1073 | AC126: =SUM(C126+E126+G126+I126+K126+M126+O126+Q126+S126+U126+W126+Y126+AA126) -> 19 | AD126: =SUM(D126+F126+H126+J126+L126+N126+P126+R126+T126+V126+X126+Z126+AB126) -> 1131 | AE126: =SUM(AD126/AC126) -> 59.526315789473685 | AF126: =ROUNDDOWN(((AE126-50)*0.8),0) -> 7
A127: =SUM(A126+1) -> 125 | B127: John Petrie | M127: 18 | N127: 1093 | S127: 1 | T127: 61 | AC127: =SUM(C127+E127+G127+I127+K127+M127+O127+Q127+S127+U127+W127+Y127+AA127) -> 19 | AD127: =SUM(D127+F127+H127+J127+L127+N127+P127+R127+T127+V127+X127+Z127+AB127) -> 1154 | AE127: =SUM(AD127/AC127) -> 60.736842105263158 | AF127: =ROUNDDOWN(((AE127-50)*0.8),0) -> 8
A128: =SUM(A127+1) -> 126 | B128: Chad Goodwin | Y128: 6 | Z128: 410 | AA128: 13 | AB128: 894 | AC128: =SUM(C128+E128+G128+I128+K128+M128+O128+Q128+S128+U128+W128+Y128+AA128) -> 19 | AD128: =SUM(D128+F128+H128+J128+L128+N128+P128+R128+T128+V128+X128+Z128+AB128) -> 1304 | AE128: =SUM(AD128/AC128) -> 68.631578947368425 | AF128: =ROUNDDOWN(((AE128-50)*0.8),0) -> 14
A129: =SUM(A128+1) -> 127 | B129: Blake Moel | E129: 19 | F129: 1361 | AC129: =SUM(C129+E129+G129+I129+K129+M129+O129+Q129+S129+U129+W129+Y129+AA129) -> 19 | AD129: =SUM(D129+F129+H129+J129+L129+N129+P129+R129+T129+V129+X129+Z129+AB129) -> 1361 | AE129: =SUM(AD129/AC129) -> 71.631578947368425 | AF129: =ROUNDDOWN(((AE129-50)*0.8),0) -> 17
A130: =SUM(A129+1) -> 128 | B130: Dan Ferch | U130: 18 | V130: 1006 | AC130: =SUM(C130+E130+G130+I130+K130+M130+O130+Q130+S130+U130+W130+Y130+AA130) -> 18 | AD130: =SUM(D130+F130+H130+J130+L130+N130+P130+R130+T130+V130+X130+Z130+AB130) -> 1006 | AE130: =SUM(AD130/AC130) -> 55.888888888888886 | AF130: =ROUNDDOWN(((AE130-50)*0.8),0) -> 4
A131: =SUM(A130+1) -> 129 | B131: Andrew Hamer | U131: 18 | V131: 1028 | AC131: =SUM(C131+E131+G131+I131+K131+M131+O131+Q131+S131+U131+W131+Y131+AA131) -> 18 | AD131: =SUM(D131+F131+H131+J131+L131+N131+P131+R131+T131+V131+X131+Z131+AB131) -> 1028 | AE131: =SUM(AD131/AC131) -> 57.111111111111114 | AF131: =ROUNDDOWN(((AE131-50)*0.8),0) -> 5
A132: =SUM(A131+1) -> 130 | B132: Kirby Callahan | AA132: 18 | AB132: 1035 | AC132: =SUM(C132+E132+G132+I132+K132+M132+O132+Q132+S132+U132+W132+Y132+AA132) -> 18 | AD132: =SUM(D132+F132+H132+J132+L132+N132+P132+R132+T132+V132+X132+Z132+AB132) -> 1035 | AE132: =SUM(AD132/AC132) -> 57.500 | AF132: =ROUNDDOWN(((AE132-50)*0.8),0) -> 6
A133: =SUM(A132+1) -> 131 | B133: Perry Thirtyacre | Y133: 1 | Z133: 62 | AA133: 17 | AB133: 975 | AC133: =SUM(C133+E133+G133+I133+K133+M133+O133+Q133+S133+U133+W133+Y133+AA133) -> 18 | AD133: =SUM(D133+F133+H133+J133+L133+N133+P133+R133+T133+V133+X133+Z133+AB133) -> 1037 | AE133: =SUM(AD133/AC133) -> 57.611111111111114 | AF133: =ROUNDDOWN(((AE133-50)*0.8),0) -> 6
A134: =SUM(A133+1) -> 132 | B134: Ian Jacobs | AA134: 18 | AB134: 1050 | AC134: =SUM(C134+E134+G134+I134+K134+M134+O134+Q134+S134+U134+W134+Y134+AA134) -> 18 | AD134: =SUM(D134+F134+H134+J134+L134+N134+P134+R134+T134+V134+X134+Z134+AB134) -> 1050 | AE134: =SUM(AD134/AC134) -> 58.333333333333336 | AF134: =ROUNDDOWN(((AE134-50)*0.8),0) -> 6
A135: =SUM(A134+1) -> 133 | B135: Andy Moel | G135: 18 | H135: 1082 | AC135: =SUM(C135+E135+G135+I135+K135+M135+O135+Q135+S135+U135+W135+Y135+AA135) -> 18 | AD135: =SUM(D135+F135+H135+J135+L135+N135+P135+R135+T135+V135+X135+Z135+AB135) -> 1082 | AE135: =SUM(AD135/AC135) -> 60.111111111111114 | AF135: =ROUNDDOWN(((AE135-50)*0.8),0) -> 8
A136: =SUM(A135+1) -> 134 | B136: Kurt Kramer | K136: 18 | L136: 1083 | AC136: =SUM(C136+E136+G136+I136+K136+M136+O136+Q136+S136+U136+W136+Y136+AA136) -> 18 | AD136: =SUM(D136+F136+H136+J136+L136+N136+P136+R136+T136+V136+X136+Z136+AB136) -> 1083 | AE136: =SUM(AD136/AC136) -> 60.166666666666664 | AF136: =ROUNDDOWN(((AE136-50)*0.8),0) -> 8
A137: =SUM(A136+1) -> 135 | B137: Matt Pease | U137: 18 | V137: 1089 | AC137: =SUM(C137+E137+G137+I137+K137+M137+O137+Q137+S137+U137+W137+Y137+AA137) -> 18 | AD137: =SUM(D137+F137+H137+J137+L137+N137+P137+R137+T137+V137+X137+Z137+AB137) -> 1089 | AE137: =SUM(AD137/AC137) -> 60.500 | AF137: =ROUNDDOWN(((AE137-50)*0.8),0) -> 8
A138: =SUM(A137+1) -> 136 | B138: Strad Docterman | U138: 18 | V138: 1148 | AC138: =SUM(C138+E138+G138+I138+K138+M138+O138+Q138+S138+U138+W138+Y138+AA138) -> 18 | AD138: =SUM(D138+F138+H138+J138+L138+N138+P138+R138+T138+V138+X138+Z138+AB138) -> 1148 | AE138: =SUM(AD138/AC138) -> 63.777777777777779 | AF138: =ROUNDDOWN(((AE138-50)*0.8),0) -> 11
A139: =SUM(A138+1) -> 137 | B139: Ben Greco | G139: 18 | H139: 1161 | AC139: =SUM(C139+E139+G139+I139+K139+M139+O139+Q139+S139+U139+W139+Y139+AA139) -> 18 | AD139: =SUM(D139+F139+H139+J139+L139+N139+P139+R139+T139+V139+X139+Z139+AB139) -> 1161 | AE139: =SUM(AD139/AC139) -> 64.500 | AF139: =ROUNDDOWN(((AE139-50)*0.8),0) -> 11
A140: =SUM(A139+1) -> 138 | B140: John Lambert | Y140: 18 | Z140: 1181 | AC140: =SUM(C140+E140+G140+I140+K140+M140+O140+Q140+S140+U140+W140+Y140+AA140) -> 18 | AD140: =SUM(D140+F140+H140+J140+L140+N140+P140+R140+T140+V140+X140+Z140+AB140) -> 1181 | AE140: =SUM(AD140/AC140) -> 65.611111111111114 | AF140: =ROUNDDOWN(((AE140-50)*0.8),0) -> 12
A141: =SUM(A140+1) -> 139 | B141: Sarah Potter | AA141: 18 | AB141: 1194 | AC141: =SUM(C141+E141+G141+I141+K141+M141+O141+Q141+S141+U141+W141+Y141+AA141) -> 18 | AD141: =SUM(D141+F141+H141+J141+L141+N141+P141+R141+T141+V141+X141+Z141+AB141) -> 1194 | AE141: =SUM(AD141/AC141) -> 66.333333333333329 | AF141: =ROUNDDOWN(((AE141-50)*0.8),0) -> 13
A142: =SUM(A141+1) -> 140 | B142: Mitch "Machete" Lerch | AA142: 18 | AB142: 1269 | AC142: =SUM(C142+E142+G142+I142+K142+M142+O142+Q142+S142+U142+W142+Y142+AA142) -> 18 | AD142: =SUM(D142+F142+H142+J142+L142+N142+P142+R142+T142+V142+X142+Z142+AB142) -> 1269 | AE142: =SUM(AD142/AC142) -> 70.500 | AF142: =ROUNDDOWN(((AE142-50)*0.8),0) -> 16
A143: =SUM(A142+1) -> 141 | B143: Travis Fruendt | AA143: 17 | AB143: 963 | AC143: =SUM(C143+E143+G143+I143+K143+M143+O143+Q143+S143+U143+W143+Y143+AA143) -> 17 | AD143: =SUM(D143+F143+H143+J143+L143+N143+P143+R143+T143+V143+X143+Z143+AB143) -> 963 | AE143: =SUM(AD143/AC143) -> 56.647058823529413 | AF143: =ROUNDDOWN(((AE143-50)*0.8),0) -> 5
A144: =SUM(A143+1) -> 142 | B144: Clint Loonan | O144: 17 | P144: 980 | AC144: =SUM(C144+E144+G144+I144+K144+M144+O144+Q144+S144+U144+W144+Y144+AA144) -> 17 | AD144: =SUM(D144+F144+H144+J144+L144+N144+P144+R144+T144+V144+X144+Z144+AB144) -> 980 | AE144: =SUM(AD144/AC144) -> 57.647058823529413 | AF144: =ROUNDDOWN(((AE144-50)*0.8),0) -> 6
A145: =SUM(A144+1) -> 143 | B145: Matt Wycoff | AA145: 17 | AB145: 1009 | AC145: =SUM(C145+E145+G145+I145+K145+M145+O145+Q145+S145+U145+W145+Y145+AA145) -> 17 | AD145: =SUM(D145+F145+H145+J145+L145+N145+P145+R145+T145+V145+X145+Z145+AB145) -> 1009 | AE145: =SUM(AD145/AC145) -> 59.352941176470587 | AF145: =ROUNDDOWN(((AE145-50)*0.8),0) -> 7
A146: =SUM(A145+1) -> 144 | B146: Adam Henderson | AA146: 17 | AB146: 1009 | AC146: =SUM(C146+E146+G146+I146+K146+M146+O146+Q146+S146+U146+W146+Y146+AA146) -> 17 | AD146: =SUM(D146+F146+H146+J146+L146+N146+P146+R146+T146+V146+X146+Z146+AB146) -> 1009 | AE146: =SUM(AD146/AC146) -> 59.352941176470587 | AF146: =ROUNDDOWN(((AE146-50)*0.8),0) -> 7
A147: =SUM(A146+1) -> 145 | B147: Chuck Hansen | W147: 17 | X147: 1030 | AC147: =SUM(C147+E147+G147+I147+K147+M147+O147+Q147+S147+U147+W147+Y147+AA147) -> 17 | AD147: =SUM(D147+F147+H147+J147+L147+N147+P147+R147+T147+V147+X147+Z147+AB147) -> 1030 | AE147: =SUM(AD147/AC147) -> 60.588235294117645 | AF147: =ROUNDDOWN(((AE147-50)*0.8),0) -> 8
A148: =SUM(A147+1) -> 146 | B148: Nate Elbert | O148: 17 | P148: 1061 | AC148: =SUM(C148+E148+G148+I148+K148+M148+O148+Q148+S148+U148+W148+Y148+AA148) -> 17 | AD148: =SUM(D148+F148+H148+J148+L148+N148+P148+R148+T148+V148+X148+Z148+AB148) -> 1061 | AE148: =SUM(AD148/AC148) -> 62.411764705882355 | AF148: =ROUNDDOWN(((AE148-50)*0.8),0) -> 9
A149: =SUM(A148+1) -> 147 | B149: Ross Welter | O149: 17 | P149: 1124 | AC149: =SUM(C149+E149+G149+I149+K149+M149+O149+Q149+S149+U149+W149+Y149+AA149) -> 17 | AD149: =SUM(D149+F149+H149+J149+L149+N149+P149+R149+T149+V149+X149+Z149+AB149) -> 1124 | AE149: =SUM(AD149/AC149) -> 66.117647058823536 | AF149: =ROUNDDOWN(((AE149-50)*0.8),0) -> 12
A150: =SUM(A149+1) -> 148 | B150: Bridgette Rew | U150: 17 | V150: 1170 | AC150: =SUM(C150+E150+G150+I150+K150+M150+O150+Q150+S150+U150+W150+Y150+AA150) -> 17 | AD150: =SUM(D150+F150+H150+J150+L150+N150+P150+R150+T150+V150+X150+Z150+AB150) -> 1170 | AE150: =SUM(AD150/AC150) -> 68.82352941176471 | AF150: =ROUNDDOWN(((AE150-50)*0.8),0) -> 15
A151: =SUM(A150+1) -> 149 | B151: Scott Lindsley | S151: 13 | T151: 724 | U151: 3 | V151: 165 | AC151: =SUM(C151+E151+G151+I151+K151+M151+O151+Q151+S151+U151+W151+Y151+AA151) -> 16 | AD151: =SUM(D151+F151+H151+J151+L151+N151+P151+R151+T151+V151+X151+Z151+AB151) -> 889 | AE151: =SUM(AD151/AC151) -> 55.5625 | AF151: =ROUNDDOWN(((AE151-50)*0.8),0) -> 4
A152: =SUM(A151+1) -> 150 | B152: Anthony Moody | Y152: 16 | Z152: 945 | AC152: =SUM(C152+E152+G152+I152+K152+M152+O152+Q152+S152+U152+W152+Y152+AA152) -> 16 | AD152: =SUM(D152+F152+H152+J152+L152+N152+P152+R152+T152+V152+X152+Z152+AB152) -> 945 | AE152: =SUM(AD152/AC152) -> 59.0625 | AF152: =ROUNDDOWN(((AE152-50)*0.8),0) -> 7
A153: =SUM(A152+1) -> 151 | B153: David Brown | S153: 16 | T153: 960 | AC153: =SUM(C153+E153+G153+I153+K153+M153+O153+Q153+S153+U153+W153+Y153+AA153) -> 16 | AD153: =SUM(D153+F153+H153+J153+L153+N153+P153+R153+T153+V153+X153+Z153+AB153) -> 960 | AE153: =SUM(AD153/AC153) -> 60.000 | AF153: =ROUNDDOWN(((AE153-50)*0.8),0) -> 8
A154: =SUM(A153+1) -> 152 | B154: Trevor Dickerson | W154: 16 | X154: 961 | AC154: =SUM(C154+E154+G154+I154+K154+M154+O154+Q154+S154+U154+W154+Y154+AA154) -> 16 | AD154: =SUM(D154+F154+H154+J154+L154+N154+P154+R154+T154+V154+X154+Z154+AB154) -> 961 | AE154: =SUM(AD154/AC154) -> 60.0625 | AF154: =ROUNDDOWN(((AE154-50)*0.8),0) -> 8
A155: =SUM(A154+1) -> 153 | B155: Jim Necessary | Y155: 15 | Z155: 805 | AC155: =SUM(C155+E155+G155+I155+K155+M155+O155+Q155+S155+U155+W155+Y155+AA155) -> 15 | AD155: =SUM(D155+F155+H155+J155+L155+N155+P155+R155+T155+V155+X155+Z155+AB155) -> 805 | AE155: =SUM(AD155/AC155) -> 53.666666666666664 | AF155: =ROUNDDOWN(((AE155-50)*0.8),0) -> 2
A156: =SUM(A155+1) -> 154 | B156: Mike O'neill | Y156: 15 | Z156: 921 | AC156: =SUM(C156+E156+G156+I156+K156+M156+O156+Q156+S156+U156+W156+Y156+AA156) -> 15 | AD156: =SUM(D156+F156+H156+J156+L156+N156+P156+R156+T156+V156+X156+Z156+AB156) -> 921 | AE156: =SUM(AD156/AC156) -> 61.400 | AF156: =ROUNDDOWN(((AE156-50)*0.8),0) -> 9
A157: =SUM(A156+1) -> 155 | B157: Adam Olsen | Q157: 8 | R157: 380 | S157: 1 | T157: 53 | W157: 1 | X157: 47 | AA157: 4 | AB157: 196 | AC157: =SUM(C157+E157+G157+I157+K157+M157+O157+Q157+S157+U157+W157+Y157+AA157) -> 14 | AD157: =SUM(D157+F157+H157+J157+L157+N157+P157+R157+T157+V157+X157+Z157+AB157) -> 676 | AE157: =SUM(AD157/AC157) -> 48.285714285714285 | AF157: =ROUNDDOWN(((AE157-50)*0.8),0) -> -1
A158: =SUM(A157+1) -> 156 | B158: Seth Marling | S158: 14 | T158: 849 | AC158: =SUM(C158+E158+G158+I158+K158+M158+O158+Q158+S158+U158+W158+Y158+AA158) -> 14 | AD158: =SUM(D158+F158+H158+J158+L158+N158+P158+R158+T158+V158+X158+Z158+AB158) -> 849 | AE158: =SUM(AD158/AC158) -> 60.642857142857146 | AF158: =ROUNDDOWN(((AE158-50)*0.8),0) -> 8
A159: =SUM(A158+1) -> 157 | B159: Nathan Johnson | O159: 3 | P159: 175 | Q159: 10 | R159: 549 | AC159: =SUM(C159+E159+G159+I159+K159+M159+O159+Q159+S159+U159+W159+Y159+AA159) -> 13 | AD159: =SUM(D159+F159+H159+J159+L159+N159+P159+R159+T159+V159+X159+Z159+AB159) -> 724 | AE159: =SUM(AD159/AC159) -> 55.692307692307693 | AF159: =ROUNDDOWN(((AE159-50)*0.8),0) -> 4
A160: =SUM(A159+1) -> 158 | B160: Nate Lenzini | M160: 13 | N160: 809 | AC160: =SUM(C160+E160+G160+I160+K160+M160+O160+Q160+S160+U160+W160+Y160+AA160) -> 13 | AD160: =SUM(D160+F160+H160+J160+L160+N160+P160+R160+T160+V160+X160+Z160+AB160) -> 809 | AE160: =SUM(AD160/AC160) -> 62.230769230769234 | AF160: =ROUNDDOWN(((AE160-50)*0.8),0) -> 9
A161: =SUM(A160+1) -> 159 | B161: Chris Bentler | G161: 11 | H161: 620 | I161: 1 | J161: 53 | AC161: =SUM(C161+E161+G161+I161+K161+M161+O161+Q161+S161+U161+W161+Y161+AA161) -> 12 | AD161: =SUM(D161+F161+H161+J161+L161+N161+P161+R161+T161+V161+X161+Z161+AB161) -> 673 | AE161: =SUM(AD161/AC161) -> 56.083333333333336 | AF161: =ROUNDDOWN(((AE161-50)*0.8),0) -> 4
A162: =SUM(A161+1) -> 160 | B162: Craig | G162: 6 | H162: 356 | I162: 5 | J162: 295 | AC162: =SUM(C162+E162+G162+I162+K162+M162+O162+Q162+S162+U162+W162+Y162+AA162) -> 11 | AD162: =SUM(D162+F162+H162+J162+L162+N162+P162+R162+T162+V162+X162+Z162+AB162) -> 651 | AE162: =SUM(AD162/AC162) -> 59.18181818181818 | AF162: =ROUNDDOWN(((AE162-50)*0.8),0) -> 7
A163: =SUM(A162+1) -> 161 | B163: Zach Votroubeck | W163: 7 | X163: 431 | Y163: 4 | Z163: 282 | AC163: =SUM(C163+E163+G163+I163+K163+M163+O163+Q163+S163+U163+W163+Y163+AA163) -> 11 | AD163: =SUM(D163+F163+H163+J163+L163+N163+P163+R163+T163+V163+X163+Z163+AB163) -> 713 | AE163: =SUM(AD163/AC163) -> 64.818181818181813 | AF163: =ROUNDDOWN(((AE163-50)*0.8),0) -> 11
A164: =SUM(A163+1) -> 162 | B164: Al | C164: 11 | D164: 809 | AC164: =SUM(C164+E164+G164+I164+K164+M164+O164+Q164+S164+U164+W164+Y164+AA164) -> 11 | AD164: =SUM(D164+F164+H164+J164+L164+N164+P164+R164+T164+V164+X164+Z164+AB164) -> 809 | AE164: =SUM(AD164/AC164) -> 73.545454545454547 | AF164: =ROUNDDOWN(((AE164-50)*0.8),0) -> 18
A165: =SUM(A164+1) -> 163 | B165: Jack Gilmore | Q165: 9 | R165: 512 | U165: 1 | V165: 52 | AC165: =SUM(C165+E165+G165+I165+K165+M165+O165+Q165+S165+U165+W165+Y165+AA165) -> 10 | AD165: =SUM(D165+F165+H165+J165+L165+N165+P165+R165+T165+V165+X165+Z165+AB165) -> 564 | AE165: =SUM(AD165/AC165) -> 56.400 | AF165: =ROUNDDOWN(((AE165-50)*0.8),0) -> 5
A166: =SUM(A165+1) -> 164 | B166: Ben Sandell | AA166: 10 | AB166: 644 | AC166: =SUM(C166+E166+G166+I166+K166+M166+O166+Q166+S166+U166+W166+Y166+AA166) -> 10 | AD166: =SUM(D166+F166+H166+J166+L166+N166+P166+R166+T166+V166+X166+Z166+AB166) -> 644 | AE166: =SUM(AD166/AC166) -> 64.400 | AF166: =ROUNDDOWN(((AE166-50)*0.8),0) -> 11
A167: =SUM(A166+1) -> 165 | B167: Lyle Theisen | S167: 10 | T167: 718 | AC167: =SUM(C167+E167+G167+I167+K167+M167+O167+Q167+S167+U167+W167+Y167+AA167) -> 10 | AD167: =SUM(D167+F167+H167+J167+L167+N167+P167+R167+T167+V167+X167+Z167+AB167) -> 718 | AE167: =SUM(AD167/AC167) -> 71.800 | AF167: =ROUNDDOWN(((AE167-50)*0.8),0) -> 17
A168: =SUM(A167+1) -> 166 | B168: Greg Dye | W168: 1 | X168: 53 | Y168: 8 | Z168: 438 | AC168: =SUM(C168+E168+G168+I168+K168+M168+O168+Q168+S168+U168+W168+Y168+AA168) -> 9 | AD168: =SUM(D168+F168+H168+J168+L168+N168+P168+R168+T168+V168+X168+Z168+AB168) -> 491 | AE168: =SUM(AD168/AC168) -> 54.555555555555557 | AF168: =ROUNDDOWN(((AE168-50)*0.8),0) -> 3
A169: =SUM(A168+1) -> 167 | B169: Aaron Killion | Y169: 9 | Z169: 520 | AC169: =SUM(C169+E169+G169+I169+K169+M169+O169+Q169+S169+U169+W169+Y169+AA169) -> 9 | AD169: =SUM(D169+F169+H169+J169+L169+N169+P169+R169+T169+V169+X169+Z169+AB169) -> 520 | AE169: =SUM(AD169/AC169) -> 57.777777777777779 | AF169: =ROUNDDOWN(((AE169-50)*0.8),0) -> 6
A170: =SUM(A169+1) -> 168 | B170: Kidwell | G170: 9 | H170: 552 | AC170: =SUM(C170+E170+G170+I170+K170+M170+O170+Q170+S170+U170+W170+Y170+AA170) -> 9 | AD170: =SUM(D170+F170+H170+J170+L170+N170+P170+R170+T170+V170+X170+Z170+AB170) -> 552 | AE170: =SUM(AD170/AC170) -> 61.333333333333336 | AF170: =ROUNDDOWN(((AE170-50)*0.8),0) -> 9
A171: =SUM(A170+1) -> 169 | B171: Brian Points | K171: 9 | L171: 633 | AC171: =SUM(C171+E171+G171+I171+K171+M171+O171+Q171+S171+U171+W171+Y171+AA171) -> 9 | AD171: =SUM(D171+F171+H171+J171+L171+N171+P171+R171+T171+V171+X171+Z171+AB171) -> 633 | AE171: =SUM(AD171/AC171) -> 70.333333333333329 | AF171: =ROUNDDOWN(((AE171-50)*0.8),0) -> 16
A172: =SUM(A171+1) -> 170 | B172: Nate | G172: 8 | H172: 456 | AC172: =SUM(C172+E172+G172+I172+K172+M172+O172+Q172+S172+U172+W172+Y172+AA172) -> 8 | AD172: =SUM(D172+F172+H172+J172+L172+N172+P172+R172+T172+V172+X172+Z172+AB172) -> 456 | AE172: =SUM(AD172/AC172) -> 57.000 | AF172: =ROUNDDOWN(((AE172-50)*0.8),0) -> 5
A173: =SUM(A172+1) -> 171 | B173: Chris Farnsworth | W173: 8 | X173: 507 | AC173: =SUM(C173+E173+G173+I173+K173+M173+O173+Q173+S173+U173+W173+Y173+AA173) -> 8 | AD173: =SUM(D173+F173+H173+J173+L173+N173+P173+R173+T173+V173+X173+Z173+AB173) -> 507 | AE173: =SUM(AD173/AC173) -> 63.375 | AF173: =ROUNDDOWN(((AE173-50)*0.8),0) -> 10
A174: =SUM(A173+1) -> 172 | B174: Doug Knepp | S174: 2 | T174: 131 | U174: 6 | V174: 390 | AC174: =SUM(C174+E174+G174+I174+K174+M174+O174+Q174+S174+U174+W174+Y174+AA174) -> 8 | AD174: =SUM(D174+F174+H174+J174+L174+N174+P174+R174+T174+V174+X174+Z174+AB174) -> 521 | AE174: =SUM(AD174/AC174) -> 65.125 | AF174: =ROUNDDOWN(((AE174-50)*0.8),0) -> 12
A175: =SUM(A174+1) -> 173 | B175: "Btch'n" | M175: 1 | N175: 60 | Q175: 6 | R175: 348 | AC175: =SUM(C175+E175+G175+I175+K175+M175+O175+Q175+S175+U175+W175+Y175+AA175) -> 7 | AD175: =SUM(D175+F175+H175+J175+L175+N175+P175+R175+T175+V175+X175+Z175+AB175) -> 408 | AE175: =SUM(AD175/AC175) -> 58.285714285714285 | AF175: =ROUNDDOWN(((AE175-50)*0.8),0) -> 6
A176: =SUM(A175+1) -> 174 | B176: Abel | G176: 7 | H176: 419 | AC176: =SUM(C176+E176+G176+I176+K176+M176+O176+Q176+S176+U176+W176+Y176+AA176) -> 7 | AD176: =SUM(D176+F176+H176+J176+L176+N176+P176+R176+T176+V176+X176+Z176+AB176) -> 419 | AE176: =SUM(AD176/AC176) -> 59.857142857142854 | AF176: =ROUNDDOWN(((AE176-50)*0.8),0) -> 7
A177: =SUM(A176+1) -> 175 | B177: Steve Lepeltak | S177: 7 | T177: 539 | AC177: =SUM(C177+E177+G177+I177+K177+M177+O177+Q177+S177+U177+W177+Y177+AA177) -> 7 | AD177: =SUM(D177+F177+H177+J177+L177+N177+P177+R177+T177+V177+X177+Z177+AB177) -> 539 | AE177: =SUM(AD177/AC177) -> 77.000 | AF177: =ROUNDDOWN(((AE177-50)*0.8),0) -> 21
A178: =SUM(A177+1) -> 176 | B178: Jason Baxter | S178: 7 | T178: 560 | AC178: =SUM(C178+E178+G178+I178+K178+M178+O178+Q178+S178+U178+W178+Y178+AA178) -> 7 | AD178: =SUM(D178+F178+H178+J178+L178+N178+P178+R178+T178+V178+X178+Z178+AB178) -> 560 | AE178: =SUM(AD178/AC178) -> 80.000 | AF178: =ROUNDDOWN(((AE178-50)*0.8),0) -> 24
A179: =SUM(A178+1) -> 177 | B179: Lance Hansen | G179: 6 | H179: 296 | AC179: =SUM(C179+E179+G179+I179+K179+M179+O179+Q179+S179+U179+W179+Y179+AA179) -> 6 | AD179: =SUM(D179+F179+H179+J179+L179+N179+P179+R179+T179+V179+X179+Z179+AB179) -> 296 | AE179: =SUM(AD179/AC179) -> 49.333333333333336 | AF179: =ROUNDDOWN(((AE179-50)*0.8),0) -> 0
A180: =SUM(A179+1) -> 178 | B180: Clay Abernathy | Q180: 6 | R180: 305 | AC180: =SUM(C180+E180+G180+I180+K180+M180+O180+Q180+S180+U180+W180+Y180+AA180) -> 6 | AD180: =SUM(D180+F180+H180+J180+L180+N180+P180+R180+T180+V180+X180+Z180+AB180) -> 305 | AE180: =SUM(AD180/AC180) -> 50.833333333333336 | AF180: =ROUNDDOWN(((AE180-50)*0.8),0) -> 0
A181: =SUM(A180+1) -> 179 | B181: Chrs Timko | Q181: 6 | R181: 343 | AC181: =SUM(C181+E181+G181+I181+K181+M181+O181+Q181+S181+U181+W181+Y181+AA181) -> 6 | AD181: =SUM(D181+F181+H181+J181+L181+N181+P181+R181+T181+V181+X181+Z181+AB181) -> 343 | AE181: =SUM(AD181/AC181) -> 57.166666666666664 | AF181: =ROUNDDOWN(((AE181-50)*0.8),0) -> 5
A182: =SUM(A181+1) -> 180 | B182: Cassie Shear | O182: 2 | P182: 125 | S182: 4 | T182: 241 | AC182: =SUM(C182+E182+G182+I182+K182+M182+O182+Q182+S182+U182+W182+Y182+AA182) -> 6 | AD182: =SUM(D182+F182+H182+J182+L182+N182+P182+R182+T182+V182+X182+Z182+AB182) -> 366 | AE182: =SUM(AD182/AC182) -> 61.000 | AF182: =ROUNDDOWN(((AE182-50)*0.8),0) -> 8
A183: =SUM(A182+1) -> 181 | B183: Aaron Porter | W183: 2 | X183: 133 | Y183: 4 | Z183: 263 | AC183: =SUM(C183+E183+G183+I183+K183+M183+O183+Q183+S183+U183+W183+Y183+AA183) -> 6 | AD183: =SUM(D183+F183+H183+J183+L183+N183+P183+R183+T183+V183+X183+Z183+AB183) -> 396 | AE183: =SUM(AD183/AC183) -> 66.000 | AF183: =ROUNDDOWN(((AE183-50)*0.8),0) -> 12
A184: =SUM(A183+1) -> 182 | B184: Aaron Gaddis | I184: 6 | J184: 429 | AC184: =SUM(C184+E184+G184+I184+K184+M184+O184+Q184+S184+U184+W184+Y184+AA184) -> 6 | AD184: =SUM(D184+F184+H184+J184+L184+N184+P184+R184+T184+V184+X184+Z184+AB184) -> 429 | AE184: =SUM(AD184/AC184) -> 71.500 | AF184: =ROUNDDOWN(((AE184-50)*0.8),0) -> 17
A185: =SUM(A184+1) -> 183 | B185: Mickey | G185: 5 | H185: 315 | AC185: =SUM(C185+E185+G185+I185+K185+M185+O185+Q185+S185+U185+W185+Y185+AA185) -> 5 | AD185: =SUM(D185+F185+H185+J185+L185+N185+P185+R185+T185+V185+X185+Z185+AB185) -> 315 | AE185: =SUM(AD185/AC185) -> 63.000 | AF185: =ROUNDDOWN(((AE185-50)*0.8),0) -> 10
A186: =SUM(A185+1) -> 184 | B186: Eric VanDeusen | U186: 4 | V186: 257 | Y186: 1 | Z186: 58 | AC186: =SUM(C186+E186+G186+I186+K186+M186+O186+Q186+S186+U186+W186+Y186+AA186) -> 5 | AD186: =SUM(D186+F186+H186+J186+L186+N186+P186+R186+T186+V186+X186+Z186+AB186) -> 315 | AE186: =SUM(AD186/AC186) -> 63.000 | AF186: =ROUNDDOWN(((AE186-50)*0.8),0) -> 10
A187: =SUM(A186+1) -> 185 | B187: Steve H. | G187: 3 | H187: 193 | I187: 2 | J187: 128 | AC187: =SUM(C187+E187+G187+I187+K187+M187+O187+Q187+S187+U187+W187+Y187+AA187) -> 5 | AD187: =SUM(D187+F187+H187+J187+L187+N187+P187+R187+T187+V187+X187+Z187+AB187) -> 321 | AE187: =SUM(AD187/AC187) -> 64.200 | AF187: =ROUNDDOWN(((AE187-50)*0.8),0) -> 11
A188: =SUM(A187+1) -> 186 | B188: Kurtis Kron | U188: 5 | V188: 332 | AC188: =SUM(C188+E188+G188+I188+K188+M188+O188+Q188+S188+U188+W188+Y188+AA188) -> 5 | AD188: =SUM(D188+F188+H188+J188+L188+N188+P188+R188+T188+V188+X188+Z188+AB188) -> 332 | AE188: =SUM(AD188/AC188) -> 66.400 | AF188: =ROUNDDOWN(((AE188-50)*0.8),0) -> 13
A189: =SUM(A188+1) -> 187 | B189: "Mepo" | M189: 4 | N189: 268 | W189: 1 | X189: 64 | AC189: =SUM(C189+E189+G189+I189+K189+M189+O189+Q189+S189+U189+W189+Y189+AA189) -> 5 | AD189: =SUM(D189+F189+H189+J189+L189+N189+P189+R189+T189+V189+X189+Z189+AB189) -> 332 | AE189: =SUM(AD189/AC189) -> 66.400 | AF189: =ROUNDDOWN(((AE189-50)*0.8),0) -> 13
A190: =SUM(A189+1) -> 188 | B190: Bobby Jo | M190: 5 | N190: 414 | AC190: =SUM(C190+E190+G190+I190+K190+M190+O190+Q190+S190+U190+W190+Y190+AA190) -> 5 | AD190: =SUM(D190+F190+H190+J190+L190+N190+P190+R190+T190+V190+X190+Z190+AB190) -> 414 | AE190: =SUM(AD190/AC190) -> 82.800 | AF190: =ROUNDDOWN(((AE190-50)*0.8),0) -> 26
A191: =SUM(A190+1) -> 189 | B191: Wade Geary | W191: 1 | X191: 53 | Y191: 3 | Z191: 179 | AC191: =SUM(C191+E191+G191+I191+K191+M191+O191+Q191+S191+U191+W191+Y191+AA191) -> 4 | AD191: =SUM(D191+F191+H191+J191+L191+N191+P191+R191+T191+V191+X191+Z191+AB191) -> 232 | AE191: =SUM(AD191/AC191) -> 58.000 | AF191: =ROUNDDOWN(((AE191-50)*0.8),0) -> 6
A192: =SUM(A191+1) -> 190 | B192: Joel Crow | K192: 3 | L192: 175 | Q192: 1 | R192: 59 | AC192: =SUM(C192+E192+G192+I192+K192+M192+O192+Q192+S192+U192+W192+Y192+AA192) -> 4 | AD192: =SUM(D192+F192+H192+J192+L192+N192+P192+R192+T192+V192+X192+Z192+AB192) -> 234 | AE192: =SUM(AD192/AC192) -> 58.500 | AF192: =ROUNDDOWN(((AE192-50)*0.8),0) -> 6
A193: =SUM(A192+1) -> 191 | B193: Jeane H. | M193: 4 | N193: 266 | AC193: =SUM(C193+E193+G193+I193+K193+M193+O193+Q193+S193+U193+W193+Y193+AA193) -> 4 | AD193: =SUM(D193+F193+H193+J193+L193+N193+P193+R193+T193+V193+X193+Z193+AB193) -> 266 | AE193: =SUM(AD193/AC193) -> 66.500 | AF193: =ROUNDDOWN(((AE193-50)*0.8),0) -> 13
A194: =SUM(A193+1) -> 192 | B194: Jeni Zeiser | S194: 4 | T194: 395 | AC194: =SUM(C194+E194+G194+I194+K194+M194+O194+Q194+S194+U194+W194+Y194+AA194) -> 4 | AD194: =SUM(D194+F194+H194+J194+L194+N194+P194+R194+T194+V194+X194+Z194+AB194) -> 395 | AE194: =SUM(AD194/AC194) -> 98.750 | AF194: =ROUNDDOWN(((AE194-50)*0.8),0) -> 39
A195: =SUM(A194+1) -> 193 | B195: Steven Crow | K195: 3 | L195: 162 | AC195: =SUM(C195+E195+G195+I195+K195+M195+O195+Q195+S195+U195+W195+Y195+AA195) -> 3 | AD195: =SUM(D195+F195+H195+J195+L195+N195+P195+R195+T195+V195+X195+Z195+AB195) -> 162 | AE195: =SUM(AD195/AC195) -> 54.000 | AF195: =ROUNDDOWN(((AE195-50)*0.8),0) -> 3
A196: =SUM(A195+1) -> 194 | B196: Chuck | AA196: 3 | AB196: 165 | AC196: =SUM(C196+E196+G196+I196+K196+M196+O196+Q196+S196+U196+W196+Y196+AA196) -> 3 | AD196: =SUM(D196+F196+H196+J196+L196+N196+P196+R196+T196+V196+X196+Z196+AB196) -> 165 | AE196: =SUM(AD196/AC196) -> 55.000 | AF196: =ROUNDDOWN(((AE196-50)*0.8),0) -> 4
A197: =SUM(A196+1) -> 195 | B197: Cody Green | U197: 3 | V197: 171 | AC197: =SUM(C197+E197+G197+I197+K197+M197+O197+Q197+S197+U197+W197+Y197+AA197) -> 3 | AD197: =SUM(D197+F197+H197+J197+L197+N197+P197+R197+T197+V197+X197+Z197+AB197) -> 171 | AE197: =SUM(AD197/AC197) -> 57.000 | AF197: =ROUNDDOWN(((AE197-50)*0.8),0) -> 5
A198: =SUM(A197+1) -> 196 | B198: Chase Norton | W198: 2 | X198: 118 | Y198: 1 | Z198: 54 | AC198: =SUM(C198+E198+G198+I198+K198+M198+O198+Q198+S198+U198+W198+Y198+AA198) -> 3 | AD198: =SUM(D198+F198+H198+J198+L198+N198+P198+R198+T198+V198+X198+Z198+AB198) -> 172 | AE198: =SUM(AD198/AC198) -> 57.333333333333336 | AF198: =ROUNDDOWN(((AE198-50)*0.8),0) -> 5
A199: =SUM(A198+1) -> 197 | B199: Nate Hamilton | Y199: 1 | Z199: 57 | AA199: 2 | AB199: 119 | AC199: =SUM(C199+E199+G199+I199+K199+M199+O199+Q199+S199+U199+W199+Y199+AA199) -> 3 | AD199: =SUM(D199+F199+H199+J199+L199+N199+P199+R199+T199+V199+X199+Z199+AB199) -> 176 | AE199: =SUM(AD199/AC199) -> 58.666666666666664 | AF199: =ROUNDDOWN(((AE199-50)*0.8),0) -> 6
A200: =SUM(A199+1) -> 198 | B200: Craig Eastin | AA200: 3 | AB200: 176 | AC200: =SUM(C200+E200+G200+I200+K200+M200+O200+Q200+S200+U200+W200+Y200+AA200) -> 3 | AD200: =SUM(D200+F200+H200+J200+L200+N200+P200+R200+T200+V200+X200+Z200+AB200) -> 176 | AE200: =SUM(AD200/AC200) -> 58.666666666666664 | AF200: =ROUNDDOWN(((AE200-50)*0.8),0) -> 6
A201: =SUM(A200+1) -> 199 | B201: Tony Rios | AA201: 3 | AB201: 182 | AC201: =SUM(C201+E201+G201+I201+K201+M201+O201+Q201+S201+U201+W201+Y201+AA201) -> 3 | AD201: =SUM(D201+F201+H201+J201+L201+N201+P201+R201+T201+V201+X201+Z201+AB201) -> 182 | AE201: =SUM(AD201/AC201) -> 60.666666666666664 | AF201: =ROUNDDOWN(((AE201-50)*0.8),0) -> 8
A202: =SUM(A201+1) -> 200 | B202: Tom Hashman | U202: 3 | V202: 192 | AC202: =SUM(C202+E202+G202+I202+K202+M202+O202+Q202+S202+U202+W202+Y202+AA202) -> 3 | AD202: =SUM(D202+F202+H202+J202+L202+N202+P202+R202+T202+V202+X202+Z202+AB202) -> 192 | AE202: =SUM(AD202/AC202) -> 64.000 | AF202: =ROUNDDOWN(((AE202-50)*0.8),0) -> 11
A203: =SUM(A202+1) -> 201 | B203: Nick Cole | Y203: 3 | Z203: 197 | AC203: =SUM(C203+E203+G203+I203+K203+M203+O203+Q203+S203+U203+W203+Y203+AA203) -> 3 | AD203: =SUM(D203+F203+H203+J203+L203+N203+P203+R203+T203+V203+X203+Z203+AB203) -> 197 | AE203: =SUM(AD203/AC203) -> 65.666666666666671 | AF203: =ROUNDDOWN(((AE203-50)*0.8),0) -> 12
A204: =SUM(A203+1) -> 202 | B204: Jenny Robertson | S204: 3 | T204: 219 | AC204: =SUM(C204+E204+G204+I204+K204+M204+O204+Q204+S204+U204+W204+Y204+AA204) -> 3 | AD204: =SUM(D204+F204+H204+J204+L204+N204+P204+R204+T204+V204+X204+Z204+AB204) -> 219 | AE204: =SUM(AD204/AC204) -> 73.000 | AF204: =ROUNDDOWN(((AE204-50)*0.8),0) -> 18
A205: =SUM(A204+1) -> 203 | B205: Josh Spang | S205: 1 | T205: 55 | W205: 1 | X205: 49 | AC205: =SUM(C205+E205+G205+I205+K205+M205+O205+Q205+S205+U205+W205+Y205+AA205) -> 2 | AD205: =SUM(D205+F205+H205+J205+L205+N205+P205+R205+T205+V205+X205+Z205+AB205) -> 104 | AE205: =SUM(AD205/AC205) -> 52.000 | AF205: =ROUNDDOWN(((AE205-50)*0.8),0) -> 1
A206: =SUM(A205+1) -> 204 | B206: Chad Kawami | M206: 2 | N206: 107 | AC206: =SUM(C206+E206+G206+I206+K206+M206+O206+Q206+S206+U206+W206+Y206+AA206) -> 2 | AD206: =SUM(D206+F206+H206+J206+L206+N206+P206+R206+T206+V206+X206+Z206+AB206) -> 107 | AE206: =SUM(AD206/AC206) -> 53.500 | AF206: =ROUNDDOWN(((AE206-50)*0.8),0) -> 2
A207: =SUM(A206+1) -> 205 | B207: Bob Hernandez | Y207: 1 | Z207: 53 | AA207: 1 | AB207: 56 | AC207: =SUM(C207+E207+G207+I207+K207+M207+O207+Q207+S207+U207+W207+Y207+AA207) -> 2 | AD207: =SUM(D207+F207+H207+J207+L207+N207+P207+R207+T207+V207+X207+Z207+AB207) -> 109 | AE207: =SUM(AD207/AC207) -> 54.500 | AF207: =ROUNDDOWN(((AE207-50)*0.8),0) -> 3
A208: =SUM(A207+1) -> 206 | B208: TJ Nanke | W208: 2 | X208: 113 | AC208: =SUM(C208+E208+G208+I208+K208+M208+O208+Q208+S208+U208+W208+Y208+AA208) -> 2 | AD208: =SUM(D208+F208+H208+J208+L208+N208+P208+R208+T208+V208+X208+Z208+AB208) -> 113 | AE208: =SUM(AD208/AC208) -> 56.500 | AF208: =ROUNDDOWN(((AE208-50)*0.8),0) -> 5
A209: =SUM(A208+1) -> 207 | B209: Allice "In" Chains | K209: 2 | L209: 115 | AC209: =SUM(C209+E209+G209+I209+K209+M209+O209+Q209+S209+U209+W209+Y209+AA209) -> 2 | AD209: =SUM(D209+F209+H209+J209+L209+N209+P209+R209+T209+V209+X209+Z209+AB209) -> 115 | AE209: =SUM(AD209/AC209) -> 57.500 | AF209: =ROUNDDOWN(((AE209-50)*0.8),0) -> 6
A210: =SUM(A209+1) -> 208 | B210: Darwin Schultz | Y210: 2 | Z210: 118 | AC210: =SUM(C210+E210+G210+I210+K210+M210+O210+Q210+S210+U210+W210+Y210+AA210) -> 2 | AD210: =SUM(D210+F210+H210+J210+L210+N210+P210+R210+T210+V210+X210+Z210+AB210) -> 118 | AE210: =SUM(AD210/AC210) -> 59.000 | AF210: =ROUNDDOWN(((AE210-50)*0.8),0) -> 7
A211: =SUM(A210+1) -> 209 | B211: Justin Harris | W211: 2 | X211: 119 | AC211: =SUM(C211+E211+G211+I211+K211+M211+O211+Q211+S211+U211+W211+Y211+AA211) -> 2 | AD211: =SUM(D211+F211+H211+J211+L211+N211+P211+R211+T211+V211+X211+Z211+AB211) -> 119 | AE211: =SUM(AD211/AC211) -> 59.500 | AF211: =ROUNDDOWN(((AE211-50)*0.8),0) -> 7
A212: =SUM(A211+1) -> 210 | B212: Brandon Sheer | S212: 2 | T212: 122 | AC212: =SUM(C212+E212+G212+I212+K212+M212+O212+Q212+S212+U212+W212+Y212+AA212) -> 2 | AD212: =SUM(D212+F212+H212+J212+L212+N212+P212+R212+T212+V212+X212+Z212+AB212) -> 122 | AE212: =SUM(AD212/AC212) -> 61.000 | AF212: =ROUNDDOWN(((AE212-50)*0.8),0) -> 8
A213: =SUM(A212+1) -> 211 | B213: John McClellan | S213: 2 | T213: 129 | AC213: =SUM(C213+E213+G213+I213+K213+M213+O213+Q213+S213+U213+W213+Y213+AA213) -> 2 | AD213: =SUM(D213+F213+H213+J213+L213+N213+P213+R213+T213+V213+X213+Z213+AB213) -> 129 | AE213: =SUM(AD213/AC213) -> 64.500 | AF213: =ROUNDDOWN(((AE213-50)*0.8),0) -> 11
A214: =SUM(A213+1) -> 212 | B214: Jake Alheid | U214: 2 | V214: 129 | AC214: =SUM(C214+E214+G214+I214+K214+M214+O214+Q214+S214+U214+W214+Y214+AA214) -> 2 | AD214: =SUM(D214+F214+H214+J214+L214+N214+P214+R214+T214+V214+X214+Z214+AB214) -> 129 | AE214: =SUM(AD214/AC214) -> 64.500 | AF214: =ROUNDDOWN(((AE214-50)*0.8),0) -> 11
A215: =SUM(A214+1) -> 213 | B215: Dave Murphy | M215: 2 | N215: 131 | AC215: =SUM(C215+E215+G215+I215+K215+M215+O215+Q215+S215+U215+W215+Y215+AA215) -> 2 | AD215: =SUM(D215+F215+H215+J215+L215+N215+P215+R215+T215+V215+X215+Z215+AB215) -> 131 | AE215: =SUM(AD215/AC215) -> 65.500 | AF215: =ROUNDDOWN(((AE215-50)*0.8),0) -> 12
A216: =SUM(A215+1) -> 214 | B216: John Calahan | Y216: 2 | Z216: 137 | AC216: =SUM(C216+E216+G216+I216+K216+M216+O216+Q216+S216+U216+W216+Y216+AA216) -> 2 | AD216: =SUM(D216+F216+H216+J216+L216+N216+P216+R216+T216+V216+X216+Z216+AB216) -> 137 | AE216: =SUM(AD216/AC216) -> 68.500 | AF216: =ROUNDDOWN(((AE216-50)*0.8),0) -> 14
A217: =SUM(A216+1) -> 215 | B217: Mark Ramsey | O217: 1 | P217: 45 | AC217: =SUM(C217+E217+G217+I217+K217+M217+O217+Q217+S217+U217+W217+Y217+AA217) -> 1 | AD217: =SUM(D217+F217+H217+J217+L217+N217+P217+R217+T217+V217+X217+Z217+AB217) -> 45 | AE217: =SUM(AD217/AC217) -> 45.000
A218: =SUM(A217+1) -> 216 | B218: Floyd Campbell | Q218: 1 | R218: 49 | AC218: =SUM(C218+E218+G218+I218+K218+M218+O218+Q218+S218+U218+W218+Y218+AA218) -> 1 | AD218: =SUM(D218+F218+H218+J218+L218+N218+P218+R218+T218+V218+X218+Z218+AB218) -> 49 | AE218: =SUM(AD218/AC218) -> 49.000
A219: =SUM(A218+1) -> 217 | B219: T.J. Thurn | U219: 1 | V219: 50 | AC219: =SUM(C219+E219+G219+I219+K219+M219+O219+Q219+S219+U219+W219+Y219+AA219) -> 1 | AD219: =SUM(D219+F219+H219+J219+L219+N219+P219+R219+T219+V219+X219+Z219+AB219) -> 50 | AE219: =SUM(AD219/AC219) -> 50.000
A220: =SUM(A219+1) -> 218 | B220: Roland Hesford | U220: 1 | V220: 51 | AC220: =SUM(C220+E220+G220+I220+K220+M220+O220+Q220+S220+U220+W220+Y220+AA220) -> 1 | AD220: =SUM(D220+F220+H220+J220+L220+N220+P220+R220+T220+V220+X220+Z220+AB220) -> 51 | AE220: =SUM(AD220/AC220) -> 51.000
A221: =SUM(A220+1) -> 219 | B221: Rob O'Brien | Y221: 1 | Z221: 52 | AC221: =SUM(C221+E221+G221+I221+K221+M221+O221+Q221+S221+U221+W221+Y221+AA221) -> 1 | AD221: =SUM(D221+F221+H221+J221+L221+N221+P221+R221+T221+V221+X221+Z221+AB221) -> 52 | AE221: =SUM(AD221/AC221) -> 52.000
A222: =SUM(A221+1) -> 220 | B222: Naph Rediger | G222: 1 | H222: 53 | AC222: =SUM(C222+E222+G222+I222+K222+M222+O222+Q222+S222+U222+W222+Y222+AA222) -> 1 | AD222: =SUM(D222+F222+H222+J222+L222+N222+P222+R222+T222+V222+X222+Z222+AB222) -> 53 | AE222: =SUM(AD222/AC222) -> 53.000
A223: =SUM(A222+1) -> 221 | B223: Jason Steffen | Q223: 1 | R223: 53 | AC223: =SUM(C223+E223+G223+I223+K223+M223+O223+Q223+S223+U223+W223+Y223+AA223) -> 1 | AD223: =SUM(D223+F223+H223+J223+L223+N223+P223+R223+T223+V223+X223+Z223+AB223) -> 53 | AE223: =SUM(AD223/AC223) -> 53.000
A224: =SUM(A223+1) -> 222 | B224: Tony Philips | Q224: 1 | R224: 54 | AC224: =SUM(C224+E224+G224+I224+K224+M224+O224+Q224+S224+U224+W224+Y224+AA224) -> 1 | AD224: =SUM(D224+F224+H224+J224+L224+N224+P224+R224+T224+V224+X224+Z224+AB224) -> 54 | AE224: =SUM(AD224/AC224) -> 54.000
A225: =SUM(A224+1) -> 223 | B225: Will Viner | U225: 1 | V225: 56 | AC225: =SUM(C225+E225+G225+I225+K225+M225+O225+Q225+S225+U225+W225+Y225+AA225) -> 1 | AD225: =SUM(D225+F225+H225+J225+L225+N225+P225+R225+T225+V225+X225+Z225+AB225) -> 56 | AE225: =SUM(AD225/AC225) -> 56.000
A226: =SUM(A225+1) -> 224 | B226: Dan Mosley | U226: 1 | V226: 56 | AC226: =SUM(C226+E226+G226+I226+K226+M226+O226+Q226+S226+U226+W226+Y226+AA226) -> 1 | AD226: =SUM(D226+F226+H226+J226+L226+N226+P226+R226+T226+V226+X226+Z226+AB226) -> 56 | AE226: =SUM(AD226/AC226) -> 56.000
A227: =SUM(A226+1) -> 225 | B227: Steve Thirtyacre | AA227: 1 | AB227: 56 | AC227: =SUM(C227+E227+G227+I227+K227+M227+O227+Q227+S227+U227+W227+Y227+AA227) -> 1 | AD227: =SUM(D227+F227+H227+J227+L227+N227+P227+R227+T227+V227+X227+Z227+AB227) -> 56 | AE227: =SUM(AD227/AC227) -> 56.000
A228: =SUM(A227+1) -> 226 | B228: Craig Fender | M228: 1 | N228: 57 | AC228: =SUM(C228+E228+G228+I228+K228+M228+O228+Q228+S228+U228+W228+Y228+AA228) -> 1 | AD228: =SUM(D228+F228+H228+J228+L228+N228+P228+R228+T228+V228+X228+Z228+AB228) -> 57 | AE228: =SUM(AD228/AC228) -> 57.000
A229: =SUM(A228+1) -> 227 | B229: BJ Beckman | O229: 1 | P229: 58 | AC229: =SUM(C229+E229+G229+I229+K229+M229+O229+Q229+S229+U229+W229+Y229+AA229) -> 1 | AD229: =SUM(D229+F229+H229+J229+L229+N229+P229+R229+T229+V229+X229+Z229+AB229) -> 58 | AE229: =SUM(AD229/AC229) -> 58.000
A230: =SUM(A229+1) -> 228 | B230: Eli Ostby | U230: 1 | V230: 58 | AC230: =SUM(C230+E230+G230+I230+K230+M230+O230+Q230+S230+U230+W230+Y230+AA230) -> 1 | AD230: =SUM(D230+F230+H230+J230+L230+N230+P230+R230+T230+V230+X230+Z230+AB230) -> 58 | AE230: =SUM(AD230/AC230) -> 58.000
A231: =SUM(A230+1) -> 229 | B231: Cody Fuller | Y231: 1 | Z231: 58 | AC231: =SUM(C231+E231+G231+I231+K231+M231+O231+Q231+S231+U231+W231+Y231+AA231) -> 1 | AD231: =SUM(D231+F231+H231+J231+L231+N231+P231+R231+T231+V231+X231+Z231+AB231) -> 58 | AE231: =SUM(AD231/AC231) -> 58.000
A232: =SUM(A231+1) -> 230 | B232: Andy Johnson | Y232: 1 | Z232: 58 | AC232: =SUM(C232+E232+G232+I232+K232+M232+O232+Q232+S232+U232+W232+Y232+AA232) -> 1 | AD232: =SUM(D232+F232+H232+J232+L232+N232+P232+R232+T232+V232+X232+Z232+AB232) -> 58 | AE232: =SUM(AD232/AC232) -> 58.000
A233: =SUM(A232+1) -> 231 | B233: Adam Smith | S233: 1 | T233: 59 | AC233: =SUM(C233+E233+G233+I233+K233+M233+O233+Q233+S233+U233+W233+Y233+AA233) -> 1 | AD233: =SUM(D233+F233+H233+J233+L233+N233+P233+R233+T233+V233+X233+Z233+AB233) -> 59 | AE233: =SUM(AD233/AC233) -> 59.000
A234: =SUM(A233+1) -> 232 | B234: Tony Ebson | U234: 1 | V234: 60 | AC234: =SUM(C234+E234+G234+I234+K234+M234+O234+Q234+S234+U234+W234+Y234+AA234) -> 1 | AD234: =SUM(D234+F234+H234+J234+L234+N234+P234+R234+T234+V234+X234+Z234+AB234) -> 60 | AE234: =SUM(AD234/AC234) -> 60.000
A235: =SUM(A234+1) -> 233 | B235: Adam Hartig | W235: 1 | X235: 60 | AC235: =SUM(C235+E235+G235+I235+K235+M235+O235+Q235+S235+U235+W235+Y235+AA235) -> 1 | AD235: =SUM(D235+F235+H235+J235+L235+N235+P235+R235+T235+V235+X235+Z235+AB235) -> 60 | AE235: =SUM(AD235/AC235) -> 60.000
A236: =SUM(A235+1) -> 234 | B236: Rob Posekany | Q236: 1 | R236: 61 | AC236: =SUM(C236+E236+G236+I236+K236+M236+O236+Q236+S236+U236+W236+Y236+AA236) -> 1 | AD236: =SUM(D236+F236+H236+J236+L236+N236+P236+R236+T236+V236+X236+Z236+AB236) -> 61 | AE236: =SUM(AD236/AC236) -> 61.000
A237: =SUM(A236+1) -> 235 | B237: Dave Peyton | Q237: 1 | R237: 61 | AC237: =SUM(C237+E237+G237+I237+K237+M237+O237+Q237+S237+U237+W237+Y237+AA237) -> 1 | AD237: =SUM(D237+F237+H237+J237+L237+N237+P237+R237+T237+V237+X237+Z237+AB237) -> 61 | AE237: =SUM(AD237/AC237) -> 61.000
A238: =SUM(A237+1) -> 236 | B238: Joe R | Y238: 1 | Z238: 61 | AC238: =SUM(C238+E238+G238+I238+K238+M238+O238+Q238+S238+U238+W238+Y238+AA238) -> 1 | AD238: =SUM(D238+F238+H238+J238+L238+N238+P238+R238+T238+V238+X238+Z238+AB238) -> 61 | AE238: =SUM(AD238/AC238) -> 61.000
A239: =SUM(A238+1) -> 237 | B239: Pete Henderson | AA239: 1 | AB239: 61 | AC239: =SUM(C239+E239+G239+I239+K239+M239+O239+Q239+S239+U239+W239+Y239+AA239) -> 1 | AD239: =SUM(D239+F239+H239+J239+L239+N239+P239+R239+T239+V239+X239+Z239+AB239) -> 61 | AE239: =SUM(AD239/AC239) -> 61.000
A240: =SUM(A239+1) -> 238 | B240: Brent? | AA240: 1 | AB240: 62 | AC240: =SUM(C240+E240+G240+I240+K240+M240+O240+Q240+S240+U240+W240+Y240+AA240) -> 1 | AD240: =SUM(D240+F240+H240+J240+L240+N240+P240+R240+T240+V240+X240+Z240+AB240) -> 62 | AE240: =SUM(AD240/AC240) -> 62.000
A241: =SUM(A240+1) -> 239 | B241: Dave Swinford | Q241: 1 | R241: 63 | AC241: =SUM(C241+E241+G241+I241+K241+M241+O241+Q241+S241+U241+W241+Y241+AA241) -> 1 | AD241: =SUM(D241+F241+H241+J241+L241+N241+P241+R241+T241+V241+X241+Z241+AB241) -> 63 | AE241: =SUM(AD241/AC241) -> 63.000
A242: =SUM(A241+1) -> 240 | B242: Scott Ream | Q242: 1 | R242: 64 | AC242: =SUM(C242+E242+G242+I242+K242+M242+O242+Q242+S242+U242+W242+Y242+AA242) -> 1 | AD242: =SUM(D242+F242+H242+J242+L242+N242+P242+R242+T242+V242+X242+Z242+AB242) -> 64 | AE242: =SUM(AD242/AC242) -> 64.000
A243: =SUM(A242+1) -> 241 | B243: Steve Adkinson | AA243: 1 | AB243: 65 | AC243: =SUM(C243+E243+G243+I243+K243+M243+O243+Q243+S243+U243+W243+Y243+AA243) -> 1 | AD243: =SUM(D243+F243+H243+J243+L243+N243+P243+R243+T243+V243+X243+Z243+AB243) -> 65 | AE243: =SUM(AD243/AC243) -> 65.000
A244: =SUM(A243+1) -> 242 | B244: Nate Spencer | Y244: 1 | Z244: 67 | AC244: =SUM(C244+E244+G244+I244+K244+M244+O244+Q244+S244+U244+W244+Y244+AA244) -> 1 | AD244: =SUM(D244+F244+H244+J244+L244+N244+P244+R244+T244+V244+X244+Z244+AB244) -> 67 | AE244: =SUM(AD244/AC244) -> 67.000
A245: =SUM(A244+1) -> 243 | B245: Justin Mager | Q245: 1 | R245: 68 | AC245: =SUM(C245+E245+G245+I245+K245+M245+O245+Q245+S245+U245+W245+Y245+AA245) -> 1 | AD245: =SUM(D245+F245+H245+J245+L245+N245+P245+R245+T245+V245+X245+Z245+AB245) -> 68 | AE245: =SUM(AD245/AC245) -> 68.000
A246: =SUM(A245+1) -> 244 | B246: Jon Foley | S246: 1 | T246: 70 | AC246: =SUM(C246+E246+G246+I246+K246+M246+O246+Q246+S246+U246+W246+Y246+AA246) -> 1 | AD246: =SUM(D246+F246+H246+J246+L246+N246+P246+R246+T246+V246+X246+Z246+AB246) -> 70 | AE246: =SUM(AD246/AC246) -> 70.000
A247: =SUM(A246+1) -> 245 | B247: Mike Baines | S247: 1 | T247: 71 | AC247: =SUM(C247+E247+G247+I247+K247+M247+O247+Q247+S247+U247+W247+Y247+AA247) -> 1 | AD247: =SUM(D247+F247+H247+J247+L247+N247+P247+R247+T247+V247+X247+Z247+AB247) -> 71 | AE247: =SUM(AD247/AC247) -> 71.000
A248: =SUM(A247+1) -> 246 | B248: Chuckles | O248: 1 | P248: 74 | AC248: =SUM(C248+E248+G248+I248+K248+M248+O248+Q248+S248+U248+W248+Y248+AA248) -> 1 | AD248: =SUM(D248+F248+H248+J248+L248+N248+P248+R248+T248+V248+X248+Z248+AB248) -> 74 | AE248: =SUM(AD248/AC248) -> 74.000
A249: =SUM(A248+1) -> 247 | B249: Matt DaPaepe | Y249: 1 | Z249: 77 | AC249: =SUM(C249+E249+G249+I249+K249+M249+O249+Q249+S249+U249+W249+Y249+AA249) -> 1 | AD249: =SUM(D249+F249+H249+J249+L249+N249+P249+R249+T249+V249+X249+Z249+AB249) -> 77 | AE249: =SUM(AD249/AC249) -> 77.000
A250: =SUM(A249+1) -> 248 | B250: Trace Landess | O250: 1 | P250: 95 | AC250: =SUM(C250+E250+G250+I250+K250+M250+O250+Q250+S250+U250+W250+Y250+AA250) -> 1 | AD250: =SUM(D250+F250+H250+J250+L250+N250+P250+R250+T250+V250+X250+Z250+AB250) -> 95 | AE250: =SUM(AD250/AC250) -> 95.000
A251: =SUM(A250+1) -> 249 | B251: Doc | AA251: 1 | AB251: 103 | AC251: =SUM(C251+E251+G251+I251+K251+M251+O251+Q251+S251+U251+W251+Y251+AA251) -> 1 | AD251: =SUM(D251+F251+H251+J251+L251+N251+P251+R251+T251+V251+X251+Z251+AB251) -> 103 | AE251: =SUM(AD251/AC251) -> 103.000
A252: red = Champion * = Multiple Championships green * = Hall of Fame