A1: SBDGL CAREER ROUND/STROKE/AVERAGE/HANDICAP HISTORY
A2: PLAYER | C2: 2000 | D2: Strokes | E2: 2001 | F2: Strokes | G2: 2002 | H2: Strokes | I2: 2003 | J2: Strokes | K2: 2004 | L2: Stokes | M2: 2005 | N2: Strokes | O2: 2006 | P2: Strokes | Q2: 2007 | R2: Strokes | S2: 2008 | T2: Strokes | U2: 2009 | V2: Strokes | W2: 2010 | X2: Strokes | Y2: 2011 | Z2: Strokes | AA2: ROUNDS | AB2: STROKES | AC2: AVG | AD2: H-Cap
A3: 1 | B3: Jesse Streinz** | E3: 13 | F3: 718 | G3: 18 | H3: 979 | I3: 18 | J3: 956 | K3: 18 | L3: 1008 | M3: 18 | N3: 976 | O3: 19 | P3: 1028 | Q3: 18 | R3: 1036 | S3: 17 | T3: 930 | U3: 18 | V3: 992 | W3: 18 | X3: 1003 | Y3: 16 | Z3: 905 | AA3: =SUM(C3+E3+G3+I3+K3+M3+O3+Q3+S3+U3+W3+Y3) -> 191 | AB3: =SUM(D3+F3+H3+J3+L3+N3+P3+R3+T3+V3+X3+Z3) -> 10531 | AC3: =SUM(AB3/AA3) -> 55.136125654450261 | AD3: =ROUNDDOWN(((AC3-50)*0.8),0) -> 4
A4: 2 | B4: Greco | E4: 3 | F4: 167 | G4: 18 | H4: 1031 | I4: 18 | J4: 974 | K4: 18 | L4: 972 | M4: 18 | N4: 961 | O4: 19 | P4: 1002 | Q4: 17 | R4: 917 | S4: 18 | T4: 963 | U4: 18 | V4: 935 | W4: 18 | X4: 906 | Y4: 18 | Z4: 905 | AA4: =SUM(C4+E4+G4+I4+K4+M4+O4+Q4+S4+U4+W4+Y4) -> 183 | AB4: =SUM(D4+F4+H4+J4+L4+N4+P4+R4+T4+V4+X4+Z4) -> 9733 | AC4: =SUM(AB4/AA4) -> 53.185792349726775 | AD4: =ROUNDDOWN(((AC4-50)*0.8),0) -> 2
A5: 3 | B5: D. Burns | E5: 3 | F5: 179 | G5: 18 | H5: 1148 | I5: 17 | J5: 1045 | K5: 15 | L5: 911 | M5: 17 | N5: 1010 | O5: 18 | P5: 1083 | Q5: 18 | R5: 1084 | S5: 18 | T5: 1041 | U5: 6 | V5: 353 | W5: 17 | X5: 989 | Y5: 18 | Z5: 1078 | AA5: =SUM(C5+E5+G5+I5+K5+M5+O5+Q5+S5+U5+W5+Y5) -> 165 | AB5: =SUM(D5+F5+H5+J5+L5+N5+P5+R5+T5+V5+X5+Z5) -> 9921 | AC5: =SUM(AB5/AA5) -> 60.127272727272725 | AD5: =ROUNDDOWN(((AC5-50)*0.8),0) -> 8
A6: 4 | B6: Woody** | I6: 18 | J6: 1084 | K6: 18 | L6: 1032 | M6: 18 | N6: 1018 | O6: 19 | P6: 1045 | Q6: 18 | R6: 992 | S6: 18 | T6: 938 | U6: 18 | V6: 961 | W6: 18 | X6: 957 | Y6: 18 | Z6: 973 | AA6: =SUM(C6+E6+G6+I6+K6+M6+O6+Q6+S6+U6+W6+Y6) -> 163 | AB6: =SUM(D6+F6+H6+J6+L6+N6+P6+R6+T6+V6+X6+Z6) -> 9000 | AC6: =SUM(AB6/AA6) -> 55.214723926380366 | AD6: =ROUNDDOWN(((AC6-50)*0.8),0) -> 4
A7: 5 | B7: Josh Beachy* | I7: 18 | J7: 1050 | K7: 18 | L7: 1029 | M7: 18 | N7: 998 | O7: 18 | P7: 997 | Q7: 18 | R7: 1038 | S7: 18 | T7: 975 | U7: 18 | V7: 983 | W7: 18 | X7: 981 | Y7: 18 | Z7: 974 | AA7: =SUM(C7+E7+G7+I7+K7+M7+O7+Q7+S7+U7+W7+Y7) -> 162 | AB7: =SUM(D7+F7+H7+J7+L7+N7+P7+R7+T7+V7+X7+Z7) -> 9025 | AC7: =SUM(AB7/AA7) -> 55.709876543209873 | AD7: =ROUNDDOWN(((AC7-50)*0.8),0) -> 4
A8: 6 | B8: Farley | I8: 18 | J8: 1140 | K8: 18 | L8: 1118 | M8: 18 | N8: 1070 | O8: 18 | P8: 1055 | Q8: 17 | R8: 1022 | S8: 17 | T8: 1020 | U8: 17 | V8: 1000 | W8: 18 | X8: 1039 | Y8: 17 | Z8: 1039 | AA8: =SUM(C8+E8+G8+I8+K8+M8+O8+Q8+S8+U8+W8+Y8) -> 158 | AB8: =SUM(D8+F8+H8+J8+L8+N8+P8+R8+T8+V8+X8+Z8) -> 9503 | AC8: =SUM(AB8/AA8) -> 60.145569620253163 | AD8: =ROUNDDOWN(((AC8-50)*0.8),0) -> 8
A9: =SUM(A8+1) -> 7 | B9: Joel Knutson* | I9: 14 | J9: 803 | K9: 18 | L9: 1034 | M9: 17 | N9: 937 | O9: 18 | P9: 991 | Q9: 18 | R9: 1021 | S9: 18 | T9: 948 | U9: 18 | V9: 978 | W9: 18 | X9: 979 | Y9: 16 | Z9: 896 | AA9: =SUM(C9+E9+G9+I9+K9+M9+O9+Q9+S9+U9+W9+Y9) -> 155 | AB9: =SUM(D9+F9+H9+J9+L9+N9+P9+R9+T9+V9+X9+Z9) -> 8587 | AC9: =SUM(AB9/AA9) -> 55.400 | AD9: =ROUNDDOWN(((AC9-50)*0.8),0) -> 4
A10: =SUM(A9+1) -> 8 | B10: Joe "Cool" Wiley* | C10: 21 | D10: 1214 | E10: 22 | F10: 1220 | G10: 18 | H10: 1013 | I10: 18 | J10: 960 | K10: 18 | L10: 973 | M10: 17 | N10: 955 | O10: 6 | P10: 331 | Q10: 18 | R10: 1002 | S10: 12 | T10: 684 | U10: 1 | V10: 64 | W10: 1 | X10: 56 | AA10: =SUM(C10+E10+G10+I10+K10+M10+O10+Q10+S10+U10+W10+Y10) -> 152 | AB10: =SUM(D10+F10+H10+J10+L10+N10+P10+R10+T10+V10+X10+Z10) -> 8472 | AC10: =SUM(AB10/AA10) -> 55.736842105263158 | AD10: =ROUNDDOWN(((AC10-50)*0.8),0) -> 4
A11: =SUM(A10+1) -> 9 | B11: Dustin Utley | K11: 16 | L11: 974 | M11: 16 | N11: 915 | O11: 18 | P11: 989 | Q11: 17 | R11: 968 | S11: 18 | T11: 1012 | U11: 18 | V11: 1015 | W11: 18 | X11: 957 | Y11: 18 | Z11: 986 | AA11: =SUM(C11+E11+G11+I11+K11+M11+O11+Q11+S11+U11+W11+Y11) -> 139 | AB11: =SUM(D11+F11+H11+J11+L11+N11+P11+R11+T11+V11+X11+Z11) -> 7816 | AC11: =SUM(AB11/AA11) -> 56.230215827338128 | AD11: =ROUNDDOWN(((AC11-50)*0.8),0) -> 4
A12: =SUM(A11+1) -> 10 | B12: Stiers | I12: 1 | J12: 59 | K12: 17 | L12: 940 | M12: 18 | N12: 1021 | O12: 19 | P12: 1066 | Q12: 17 | R12: 962 | S12: 15 | T12: 803 | U12: 18 | V12: 974 | W12: 16 | X12: 873 | Y12: 17 | Z12: 932 | AA12: =SUM(C12+E12+G12+I12+K12+M12+O12+Q12+S12+U12+W12+Y12) -> 138 | AB12: =SUM(D12+F12+H12+J12+L12+N12+P12+R12+T12+V12+X12+Z12) -> 7630 | AC12: =SUM(AB12/AA12) -> 55.289855072463766 | AD12: =ROUNDDOWN(((AC12-50)*0.8),0) -> 4
A13: =SUM(A12+1) -> 11 | B13: Super Dave* | K13: 18 | L13: 1062 | M13: 18 | N13: 1013 | O13: 19 | P13: 1040 | Q13: 18 | R13: 1026 | S13: 18 | T13: 997 | U13: 14 | V13: 805 | W13: 9 | X13: 510 | Y13: 17 | Z13: 979 | AA13: =SUM(C13+E13+G13+I13+K13+M13+O13+Q13+S13+U13+W13+Y13) -> 131 | AB13: =SUM(D13+F13+H13+J13+L13+N13+P13+R13+T13+V13+X13+Z13) -> 7432 | AC13: =SUM(AB13/AA13) -> 56.732824427480914 | AD13: =ROUNDDOWN(((AC13-50)*0.8),0) -> 5
A14: =SUM(A13+1) -> 12 | B14: Matt Shannon | M14: 18 | N14: 1128 | O14: 19 | P14: 1105 | Q14: 18 | R14: 1085 | S14: 18 | T14: 1065 | U14: 18 | V14: 1072 | W14: 18 | X14: 996 | Y14: 18 | Z14: 1030 | AA14: =SUM(C14+E14+G14+I14+K14+M14+O14+Q14+S14+U14+W14+Y14) -> 127 | AB14: =SUM(D14+F14+H14+J14+L14+N14+P14+R14+T14+V14+X14+Z14) -> 7481 | AC14: =SUM(AB14/AA14) -> 58.905511811023622 | AD14: =ROUNDDOWN(((AC14-50)*0.8),0) -> 7
A15: =SUM(A14+1) -> 13 | B15: Matt "Frog" Geers | K15: 16 | L15: 936 | M15: 14 | N15: 836 | O15: 19 | P15: 1091 | Q15: 17 | R15: 950 | S15: 17 | T15: 906 | U15: 13 | V15: 721 | W15: 13 | X15: 734 | Y15: 14 | Z15: 776 | AA15: =SUM(C15+E15+G15+I15+K15+M15+O15+Q15+S15+U15+W15+Y15) -> 123 | AB15: =SUM(D15+F15+H15+J15+L15+N15+P15+R15+T15+V15+X15+Z15) -> 6950 | AC15: =SUM(AB15/AA15) -> 56.50406504065041 | AD15: =ROUNDDOWN(((AC15-50)*0.8),0) -> 5
A16: =SUM(A15+1) -> 14 | B16: Jamie Gray | G16: 4 | H16: 233 | I16: 18 | J16: 1046 | K16: 18 | L16: 1056 | M16: 15 | N16: 864 | O16: 17 | P16: 998 | Q16: 17 | R16: 1011 | S16: 17 | T16: 989 | U16: 16 | V16: 956 | AA16: =SUM(C16+E16+G16+I16+K16+M16+O16+Q16+S16+U16+W16+Y16) -> 122 | AB16: =SUM(D16+F16+H16+J16+L16+N16+P16+R16+T16+V16+X16+Z16) -> 7153 | AC16: =SUM(AB16/AA16) -> 58.631147540983605 | AD16: =ROUNDDOWN(((AC16-50)*0.8),0) -> 6
A17: =SUM(A16+1) -> 15 | B17: Rimmy* | K17: 16 | L17: 814 | M17: 16 | N17: 815 | O17: 18 | P17: 905 | Q17: 10 | R17: 531 | S17: 15 | T17: 801 | U17: 16 | V17: 853 | W17: 14 | X17: 762 | Y17: 16 | Z17: 844 | AA17: =SUM(C17+E17+G17+I17+K17+M17+O17+Q17+S17+U17+W17+Y17) -> 121 | AB17: =SUM(D17+F17+H17+J17+L17+N17+P17+R17+T17+V17+X17+Z17) -> 6325 | AC17: =SUM(AB17/AA17) -> 52.272727272727273 | AD17: =ROUNDDOWN(((AC17-50)*0.8),0) -> 1
A18: =SUM(A17+1) -> 16 | B18: Jesse Sauerbrei | K18: 17 | L18: 940 | M18: 18 | N18: 972 | O18: 18 | P18: 989 | Q18: 18 | R18: 969 | S18: 18 | T18: 976 | U18: 15 | V18: 814 | Y18: 16 | Z18: 870 | AA18: =SUM(C18+E18+G18+I18+K18+M18+O18+Q18+S18+U18+W18+Y18) -> 120 | AB18: =SUM(D18+F18+H18+J18+L18+N18+P18+R18+T18+V18+X18+Z18) -> 6530 | AC18: =SUM(AB18/AA18) -> 54.416666666666664 | AD18: =ROUNDDOWN(((AC18-50)*0.8),0) -> 3
A19: =SUM(A18+1) -> 17 | B19: Jeremy Prouty* | K19: 15 | L19: 1056 | M19: 16 | N19: 1058 | O19: 17 | P19: 1099 | Q19: 18 | R19: 1132 | S19: 15 | T19: 970 | U19: 17 | V19: 1016 | W19: 11 | X19: 656 | AA19: =SUM(C19+E19+G19+I19+K19+M19+O19+Q19+S19+U19+W19+Y19) -> 109 | AB19: =SUM(D19+F19+H19+J19+L19+N19+P19+R19+T19+V19+X19+Z19) -> 6987 | AC19: =SUM(AB19/AA19) -> 64.100917431192656 | AD19: =ROUNDDOWN(((AC19-50)*0.8),0) -> 11
A20: =SUM(A19+1) -> 18 | B20: Mark Dvorsky | G20: 10 | H20: 593 | I20: 18 | J20: 1059 | K20: 18 | L20: 1037 | M20: 17 | N20: 972 | O20: 17 | P20: 973 | Q20: 11 | R20: 639 | S20: 16 | T20: 930 | AA20: =SUM(C20+E20+G20+I20+K20+M20+O20+Q20+S20+U20+W20+Y20) -> 107 | AB20: =SUM(D20+F20+H20+J20+L20+N20+P20+R20+T20+V20+X20+Z20) -> 6203 | AC20: =SUM(AB20/AA20) -> 57.971962616822431 | AD20: =ROUNDDOWN(((AC20-50)*0.8),0) -> 6
A21: =SUM(A20+1) -> 19 | B21: Matt Lacina | K21: 17 | L21: 1167 | M21: 18 | N21: 1143 | O21: 18 | P21: 1117 | Q21: 18 | R21: 1122 | S21: 18 | T21: 1075 | U21: 18 | V21: 1077 | AA21: =SUM(C21+E21+G21+I21+K21+M21+O21+Q21+S21+U21+W21+Y21) -> 107 | AB21: =SUM(D21+F21+H21+J21+L21+N21+P21+R21+T21+V21+X21+Z21) -> 6701 | AC21: =SUM(AB21/AA21) -> 62.626168224299064 | AD21: =ROUNDDOWN(((AC21-50)*0.8),0) -> 10
A22: =SUM(A21+1) -> 20 | B22: Tom Pepper | O22: 18 | P22: 1138 | Q22: 18 | R22: 1098 | S22: 18 | T22: 1067 | U22: 18 | V22: 1057 | W22: 18 | X22: 1040 | Y22: 16 | Z22: 953 | AA22: =SUM(C22+E22+G22+I22+K22+M22+O22+Q22+S22+U22+W22+Y22) -> 106 | AB22: =SUM(D22+F22+H22+J22+L22+N22+P22+R22+T22+V22+X22+Z22) -> 6353 | AC22: =SUM(AB22/AA22) -> 59.933962264150942 | AD22: =ROUNDDOWN(((AC22-50)*0.8),0) -> 7
A23: =SUM(A22+1) -> 21 | B23: Kevin Stibal | I23: 13 | J23: 684 | K23: 17 | L23: 881 | M23: 16 | N23: 851 | O23: 18 | P23: 966 | Q23: 17 | R23: 903 | S23: 2 | T23: 112 | U23: 11 | V23: 555 | W23: 5 | X23: 265 | Y23: 4 | Z23: 223 | AA23: =SUM(C23+E23+G23+I23+K23+M23+O23+Q23+S23+U23+W23+Y23) -> 103 | AB23: =SUM(D23+F23+H23+J23+L23+N23+P23+R23+T23+V23+X23+Z23) -> 5440 | AC23: =SUM(AB23/AA23) -> 52.815533980582522 | AD23: =ROUNDDOWN(((AC23-50)*0.8),0) -> 2
A24: =SUM(A23+1) -> 22 | B24: Jerimie Maker* | M24: 6 | N24: 341 | O24: 15 | P24: 836 | Q24: 10 | R24: 545 | S24: 18 | T24: 984 | U24: 18 | V24: 975 | W24: 18 | X24: 1003 | Y24: 18 | Z24: 1078 | AA24: =SUM(C24+E24+G24+I24+K24+M24+O24+Q24+S24+U24+W24+Y24) -> 103 | AB24: =SUM(D24+F24+H24+J24+L24+N24+P24+R24+T24+V24+X24+Z24) -> 5762 | AC24: =SUM(AB24/AA24) -> 55.941747572815537 | AD24: =ROUNDDOWN(((AC24-50)*0.8),0) -> 4
A25: =SUM(A24+1) -> 23 | B25: "Shirtless" Bill | O25: 16 | P25: 900 | Q25: 17 | R25: 962 | S25: 18 | T25: 999 | U25: 16 | V25: 897 | W25: 18 | X25: 1025 | Y25: 18 | Z25: 1012 | AA25: =SUM(C25+E25+G25+I25+K25+M25+O25+Q25+S25+U25+W25+Y25) -> 103 | AB25: =SUM(D25+F25+H25+J25+L25+N25+P25+R25+T25+V25+X25+Z25) -> 5795 | AC25: =SUM(AB25/AA25) -> 56.262135922330096 | AD25: =ROUNDDOWN(((AC25-50)*0.8),0) -> 5
A26: =SUM(A25+1) -> 24 | B26: Kruck | C26: 22 | D26: 1240 | E26: 21 | F26: 1158 | G26: 14 | H26: 826 | I26: 2 | J26: 118 | K26: 12 | L26: 720 | M26: 18 | N26: 1032 | U26: 7 | V26: 402 | W26: 4 | X26: 239 | AA26: =SUM(C26+E26+G26+I26+K26+M26+O26+Q26+S26+U26+W26+Y26) -> 100 | AB26: =SUM(D26+F26+H26+J26+L26+N26+P26+R26+T26+V26+X26+Z26) -> 5735 | AC26: =SUM(AB26/AA26) -> 57.350 | AD26: =ROUNDDOWN(((AC26-50)*0.8),0) -> 5
A27: =SUM(A26+1) -> 25 | B27: Max Ostby | M27: 18 | N27: 1112 | O27: 18 | P27: 1088 | Q27: 16 | R27: 994 | S27: 14 | T27: 872 | U27: 17 | V27: 1063 | W27: 13 | X27: 771 | Y27: 2 | Z27: 121 | AA27: =SUM(C27+E27+G27+I27+K27+M27+O27+Q27+S27+U27+W27+Y27) -> 98 | AB27: =SUM(D27+F27+H27+J27+L27+N27+P27+R27+T27+V27+X27+Z27) -> 6021 | AC27: =SUM(AB27/AA27) -> 61.438775510204081 | AD27: =ROUNDDOWN(((AC27-50)*0.8),0) -> 9
A28: =SUM(A27+1) -> 26 | B28: Tim "Timmy" Troyna | O28: 17 | P28: 1048 | Q28: 15 | R28: 925 | S28: 15 | T28: 904 | U28: 15 | V28: 924 | W28: 17 | X28: 982 | Y28: 16 | Z28: 925 | AA28: =SUM(C28+E28+G28+I28+K28+M28+O28+Q28+S28+U28+W28+Y28) -> 95 | AB28: =SUM(D28+F28+H28+J28+L28+N28+P28+R28+T28+V28+X28+Z28) -> 5708 | AC28: =SUM(AB28/AA28) -> 60.084210526315786 | AD28: =ROUNDDOWN(((AC28-50)*0.8),0) -> 8
A29: =SUM(A28+1) -> 27 | B29: Joe O'Neil | O29: 19 | P29: 1158 | Q29: 18 | R29: 1071 | S29: 16 | T29: 922 | U29: 7 | V29: 388 | W29: 16 | X29: 929 | Y29: 18 | Z29: 1038 | AA29: =SUM(C29+E29+G29+I29+K29+M29+O29+Q29+S29+U29+W29+Y29) -> 94 | AB29: =SUM(D29+F29+H29+J29+L29+N29+P29+R29+T29+V29+X29+Z29) -> 5506 | AC29: =SUM(AB29/AA29) -> 58.574468085106382 | AD29: =ROUNDDOWN(((AC29-50)*0.8),0) -> 6
A30: =SUM(A29+1) -> 28 | B30: Tim Peyton* | M30: 4 | N30: 209 | Q30: 18 | R30: 926 | S30: 18 | T30: 908 | U30: 18 | V30: 906 | W30: 18 | X30: 913 | Y30: 18 | Z30: 900 | AA30: =SUM(C30+E30+G30+I30+K30+M30+O30+Q30+S30+U30+W30+Y30) -> 94 | AB30: =SUM(D30+F30+H30+J30+L30+N30+P30+R30+T30+V30+X30+Z30) -> 4762 | AC30: =SUM(AB30/AA30) -> 50.659574468085104 | AD30: =ROUNDDOWN(((AC30-50)*0.8),0) -> 0
A31: =SUM(A30+1) -> 29 | B31: Ryan Hamilton | K31: 3 | L31: 182 | Q31: 18 | R31: 1059 | S31: 18 | T31: 1024 | U31: 18 | V31: 1025 | W31: 18 | X31: 980 | Y31: 18 | Z31: 980 | AA31: =SUM(C31+E31+G31+I31+K31+M31+O31+Q31+S31+U31+W31+Y31) -> 93 | AB31: =SUM(D31+F31+H31+J31+L31+N31+P31+R31+T31+V31+X31+Z31) -> 5250 | AC31: =SUM(AB31/AA31) -> 56.451612903225808 | AD31: =ROUNDDOWN(((AC31-50)*0.8),0) -> 5
A32: =SUM(A31+1) -> 30 | B32: Matt McCarley* | I32: 18 | J32: 968 | K32: 18 | L32: 944 | M32: 18 | N32: 948 | O32: 19 | P32: 971 | Q32: 18 | R32: 964 | AA32: =SUM(C32+E32+G32+I32+K32+M32+O32+Q32+S32+U32+W32+Y32) -> 91 | AB32: =SUM(D32+F32+H32+J32+L32+N32+P32+R32+T32+V32+X32+Z32) -> 4795 | AC32: =SUM(AB32/AA32) -> 52.692307692307693 | AD32: =ROUNDDOWN(((AC32-50)*0.8),0) -> 2
A33: =SUM(A32+1) -> 31 | B33: Matt Wieben** | O33: 1 | P33: 51 | Q33: 18 | R33: 964 | S33: 18 | T33: 952 | U33: 18 | V33: 931 | W33: 18 | X33: 896 | Y33: 18 | Z33: 915 | AA33: =SUM(C33+E33+G33+I33+K33+M33+O33+Q33+S33+U33+W33+Y33) -> 91 | AB33: =SUM(D33+F33+H33+J33+L33+N33+P33+R33+T33+V33+X33+Z33) -> 4709 | AC33: =SUM(AB33/AA33) -> 51.747252747252745 | AD33: =ROUNDDOWN(((AC33-50)*0.8),0) -> 1
A34: =SUM(A33+1) -> 32 | B34: Kollin Grimm | Q34: 17 | R34: 986 | S34: 18 | T34: 982 | U34: 18 | V34: 968 | W34: 18 | X34: 924 | Y34: 18 | Z34: 953 | AA34: =SUM(C34+E34+G34+I34+K34+M34+O34+Q34+S34+U34+W34+Y34) -> 89 | AB34: =SUM(D34+F34+H34+J34+L34+N34+P34+R34+T34+V34+X34+Z34) -> 4813 | AC34: =SUM(AB34/AA34) -> 54.078651685393261 | AD34: =ROUNDDOWN(((AC34-50)*0.8),0) -> 3
A35: =SUM(A34+1) -> 33 | B35: "Wheatbread" | E35: 19 | F35: 1102 | G35: 18 | H35: 1024 | I35: 18 | J35: 991 | K35: 18 | L35: 1027 | M35: 15 | N35: 835 | AA35: =SUM(C35+E35+G35+I35+K35+M35+O35+Q35+S35+U35+W35+Y35) -> 88 | AB35: =SUM(D35+F35+H35+J35+L35+N35+P35+R35+T35+V35+X35+Z35) -> 4979 | AC35: =SUM(AB35/AA35) -> 56.579545454545453 | AD35: =ROUNDDOWN(((AC35-50)*0.8),0) -> 5
A36: =SUM(A35+1) -> 34 | B36: Rory Lasansky | M36: 18 | N36: 959 | O36: 1 | P36: 55 | Q36: 18 | R36: 1024 | S36: 18 | T36: 977 | U36: 13 | V36: 685 | W36: 17 | X36: 897 | Y36: 1 | Z36: 52 | AA36: =SUM(C36+E36+G36+I36+K36+M36+O36+Q36+S36+U36+W36+Y36) -> 86 | AB36: =SUM(D36+F36+H36+J36+L36+N36+P36+R36+T36+V36+X36+Z36) -> 4649 | AC36: =SUM(AB36/AA36) -> 54.058139534883722 | AD36: =ROUNDDOWN(((AC36-50)*0.8),0) -> 3
A37: =SUM(A36+1) -> 35 | B37: Travis Pike | K37: 2 | L37: 113 | M37: 18 | N37: 987 | O37: 9 | P37: 504 | S37: 18 | T37: 974 | U37: 4 | V37: 227 | W37: 15 | X37: 825 | Y37: 18 | Z37: 1035 | AA37: =SUM(C37+E37+G37+I37+K37+M37+O37+Q37+S37+U37+W37+Y37) -> 84 | AB37: =SUM(D37+F37+H37+J37+L37+N37+P37+R37+T37+V37+X37+Z37) -> 4665 | AC37: =SUM(AB37/AA37) -> 55.535714285714285 | AD37: =ROUNDDOWN(((AC37-50)*0.8),0) -> 4
A38: =SUM(A37+1) -> 36 | B38: Byran Bream | K38: 9 | L38: 491 | M38: 18 | N38: 955 | O38: 19 | P38: 976 | Q38: 18 | R38: 983 | S38: 18 | T38: 938 | U38: 1 | V38: 52 | AA38: =SUM(C38+E38+G38+I38+K38+M38+O38+Q38+S38+U38+W38+Y38) -> 83 | AB38: =SUM(D38+F38+H38+J38+L38+N38+P38+R38+T38+V38+X38+Z38) -> 4395 | AC38: =SUM(AB38/AA38) -> 52.951807228915662 | AD38: =ROUNDDOWN(((AC38-50)*0.8),0) -> 2
A39: =SUM(A38+1) -> 37 | B39: Dixie Smith | C39: 11 | D39: 874 | E39: 18 | F39: 1393 | G39: 17 | H39: 1220 | I39: 18 | J39: 1295 | K39: 18 | L39: 1278 | AA39: =SUM(C39+E39+G39+I39+K39+M39+O39+Q39+S39+U39+W39+Y39) -> 82 | AB39: =SUM(D39+F39+H39+J39+L39+N39+P39+R39+T39+V39+X39+Z39) -> 6060 | AC39: =SUM(AB39/AA39) -> 73.902439024390247 | AD39: =ROUNDDOWN(((AC39-50)*0.8),0) -> 19
A40: =SUM(A39+1) -> 38 | B40: Ryan "Norm" Kriz** | C40: 22 | D40: 1281 | E40: 22 | F40: 1313 | G40: 18 | H40: 1068 | I40: 17 | J40: 1034 | AA40: =SUM(C40+E40+G40+I40+K40+M40+O40+Q40+S40+U40+W40+Y40) -> 79 | AB40: =SUM(D40+F40+H40+J40+L40+N40+P40+R40+T40+V40+X40+Z40) -> 4696 | AC40: =SUM(AB40/AA40) -> 59.443037974683541 | AD40: =ROUNDDOWN(((AC40-50)*0.8),0) -> 7
A41: =SUM(A40+1) -> 39 | B41: Doug Peyton | Q41: 18 | R41: 910 | S41: 18 | T41: 916 | U41: 18 | V41: 894 | W41: 18 | X41: 881 | Y41: 5 | Z41: 251 | AA41: =SUM(C41+E41+G41+I41+K41+M41+O41+Q41+S41+U41+W41+Y41) -> 77 | AB41: =SUM(D41+F41+H41+J41+L41+N41+P41+R41+T41+V41+X41+Z41) -> 3852 | AC41: =SUM(AB41/AA41) -> 50.025974025974023 | AD41: =ROUNDDOWN(((AC41-50)*0.8),0) -> 0
A42: =SUM(A41+1) -> 40 | B42: "Snapple" | G42: 4 | H42: 209 | I42: 7 | J42: 387 | K42: 18 | L42: 1003 | M42: 16 | N42: 877 | O42: 17 | P42: 937 | Q42: 12 | R42: 674 | AA42: =SUM(C42+E42+G42+I42+K42+M42+O42+Q42+S42+U42+W42+Y42) -> 74 | AB42: =SUM(D42+F42+H42+J42+L42+N42+P42+R42+T42+V42+X42+Z42) -> 4087 | AC42: =SUM(AB42/AA42) -> 55.229729729729726 | AD42: =ROUNDDOWN(((AC42-50)*0.8),0) -> 4
A43: =SUM(A42+1) -> 41 | B43: Mike Flynn | M43: 6 | N43: 360 | O43: 15 | P43: 883 | Q43: 18 | R43: 1048 | S43: 17 | T43: 973 | U43: 18 | V43: 1054 | AA43: =SUM(C43+E43+G43+I43+K43+M43+O43+Q43+S43+U43+W43+Y43) -> 74 | AB43: =SUM(D43+F43+H43+J43+L43+N43+P43+R43+T43+V43+X43+Z43) -> 4318 | AC43: =SUM(AB43/AA43) -> 58.351351351351354 | AD43: =ROUNDDOWN(((AC43-50)*0.8),0) -> 6
A44: =SUM(A43+1) -> 42 | B44: Keith Gudenkauf | O44: 18 | P44: 993 | Q44: 13 | R44: 723 | S44: 18 | T44: 963 | U44: 17 | V44: 928 | Y44: 6 | Z44: 320 | AA44: =SUM(C44+E44+G44+I44+K44+M44+O44+Q44+S44+U44+W44+Y44) -> 72 | AB44: =SUM(D44+F44+H44+J44+L44+N44+P44+R44+T44+V44+X44+Z44) -> 3927 | AC44: =SUM(AB44/AA44) -> 54.541666666666664 | AD44: =ROUNDDOWN(((AC44-50)*0.8),0) -> 3
A45: =SUM(A44+1) -> 43 | B45: Marty Reis | S45: 18 | T45: 1110 | U45: 18 | V45: 1034 | W45: 18 | X45: 1013 | Y45: 17 | Z45: 929 | AA45: =SUM(C45+E45+G45+I45+K45+M45+O45+Q45+S45+U45+W45+Y45) -> 71 | AB45: =SUM(D45+F45+H45+J45+L45+N45+P45+R45+T45+V45+X45+Z45) -> 4086 | AC45: =SUM(AB45/AA45) -> 57.549295774647888 | AD45: =ROUNDDOWN(((AC45-50)*0.8),0) -> 6
A46: =SUM(A45+1) -> 44 | B46: Corey Moel | C46: 14 | D46: 939 | E46: 21 | F46: 1306 | G46: 18 | H46: 1143 | I46: 15 | J46: 1042 | AA46: =SUM(C46+E46+G46+I46+K46+M46+O46+Q46+S46+U46+W46+Y46) -> 68 | AB46: =SUM(D46+F46+H46+J46+L46+N46+P46+R46+T46+V46+X46+Z46) -> 4430 | AC46: =SUM(AB46/AA46) -> 65.147058823529406 | AD46: =ROUNDDOWN(((AC46-50)*0.8),0) -> 12
A47: =SUM(A46+1) -> 45 | B47: JT Hagameier | C47: 3 | D47: 181 | E47: 21 | F47: 1405 | G47: 17 | H47: 1085 | I47: 15 | J47: 964 | M47: 12 | N47: 791 | AA47: =SUM(C47+E47+G47+I47+K47+M47+O47+Q47+S47+U47+W47+Y47) -> 68 | AB47: =SUM(D47+F47+H47+J47+L47+N47+P47+R47+T47+V47+X47+Z47) -> 4426 | AC47: =SUM(AB47/AA47) -> 65.088235294117652 | AD47: =ROUNDDOWN(((AC47-50)*0.8),0) -> 12
A48: =SUM(A47+1) -> 46 | B48: Dan Klein | K48: 11 | L48: 680 | M48: 18 | N48: 1050 | O48: 12 | P48: 665 | Q48: 18 | R48: 1024 | S48: 9 | T48: 520 | AA48: =SUM(C48+E48+G48+I48+K48+M48+O48+Q48+S48+U48+W48+Y48) -> 68 | AB48: =SUM(D48+F48+H48+J48+L48+N48+P48+R48+T48+V48+X48+Z48) -> 3939 | AC48: =SUM(AB48/AA48) -> 57.926470588235297 | AD48: =ROUNDDOWN(((AC48-50)*0.8),0) -> 6
A49: =SUM(A48+1) -> 47 | B49: Matt Rinker | M49: 18 | N49: 964 | O49: 19 | P49: 1044 | Q49: 18 | R49: 984 | S49: 9 | T49: 472 | AA49: =SUM(C49+E49+G49+I49+K49+M49+O49+Q49+S49+U49+W49+Y49) -> 64 | AB49: =SUM(D49+F49+H49+J49+L49+N49+P49+R49+T49+V49+X49+Z49) -> 3464 | AC49: =SUM(AB49/AA49) -> 54.125 | AD49: =ROUNDDOWN(((AC49-50)*0.8),0) -> 3
A50: =SUM(A49+1) -> 48 | B50: Jeremy Farnsworth | S50: 12 | T50: 630 | U50: 17 | V50: 888 | W50: 18 | X50: 915 | Y50: 17 | Z50: 886 | AA50: =SUM(C50+E50+G50+I50+K50+M50+O50+Q50+S50+U50+W50+Y50) -> 64 | AB50: =SUM(D50+F50+H50+J50+L50+N50+P50+R50+T50+V50+X50+Z50) -> 3319 | AC50: =SUM(AB50/AA50) -> 51.859375 | AD50: =ROUNDDOWN(((AC50-50)*0.8),0) -> 1
A51: =SUM(A50+1) -> 49 | B51: Brian Zyzda | G51: 1 | H51: 61 | I51: 17 | J51: 949 | K51: 17 | L51: 943 | M51: 18 | N51: 972 | O51: 10 | P51: 514 | AA51: =SUM(C51+E51+G51+I51+K51+M51+O51+Q51+S51+U51+W51+Y51) -> 63 | AB51: =SUM(D51+F51+H51+J51+L51+N51+P51+R51+T51+V51+X51+Z51) -> 3439 | AC51: =SUM(AB51/AA51) -> 54.587301587301589 | AD51: =ROUNDDOWN(((AC51-50)*0.8),0) -> 3
A52: =SUM(A51+1) -> 50 | B52: Jeremy Bos | K52: 16 | L52: 962 | M52: 15 | N52: 922 | O52: 15 | P52: 960 | Q52: 16 | R52: 986 | AA52: =SUM(C52+E52+G52+I52+K52+M52+O52+Q52+S52+U52+W52+Y52) -> 62 | AB52: =SUM(D52+F52+H52+J52+L52+N52+P52+R52+T52+V52+X52+Z52) -> 3830 | AC52: =SUM(AB52/AA52) -> 61.774193548387096 | AD52: =ROUNDDOWN(((AC52-50)*0.8),0) -> 9
A53: =SUM(A52+1) -> 51 | B53: John Russell | M53: 10 | N53: 585 | O53: 17 | P53: 959 | Q53: 18 | R53: 1044 | S53: 17 | T53: 952 | AA53: =SUM(C53+E53+G53+I53+K53+M53+O53+Q53+S53+U53+W53+Y53) -> 62 | AB53: =SUM(D53+F53+H53+J53+L53+N53+P53+R53+T53+V53+X53+Z53) -> 3540 | AC53: =SUM(AB53/AA53) -> 57.096774193548384 | AD53: =ROUNDDOWN(((AC53-50)*0.8),0) -> 5
A54: =SUM(A53+1) -> 52 | B54: Shawn Hullinger | Q54: 5 | R54: 343 | S54: 5 | T54: 302 | U54: 17 | V54: 1077 | W54: 18 | X54: 1106 | Y54: 17 | Z54: 1031 | AA54: =SUM(C54+E54+G54+I54+K54+M54+O54+Q54+S54+U54+W54+Y54) -> 62 | AB54: =SUM(D54+F54+H54+J54+L54+N54+P54+R54+T54+V54+X54+Z54) -> 3859 | AC54: =SUM(AB54/AA54) -> 62.241935483870968 | AD54: =ROUNDDOWN(((AC54-50)*0.8),0) -> 9
A55: =SUM(A54+1) -> 53 | B55: Brian Eastwood | C55: 21 | D55: 1380 | E55: 22 | F55: 1411 | G55: 9 | H55: 562 | I55: 9 | J55: 576 | AA55: =SUM(C55+E55+G55+I55+K55+M55+O55+Q55+S55+U55+W55+Y55) -> 61 | AB55: =SUM(D55+F55+H55+J55+L55+N55+P55+R55+T55+V55+X55+Z55) -> 3929 | AC55: =SUM(AB55/AA55) -> 64.409836065573771 | AD55: =ROUNDDOWN(((AC55-50)*0.8),0) -> 11
A56: =SUM(A55+1) -> 54 | B56: Nathan Veeder | S56: 8 | T56: 450 | U56: 18 | V56: 1021 | W56: 17 | X56: 922 | Y56: 17 | Z56: 935 | AA56: =SUM(C56+E56+G56+I56+K56+M56+O56+Q56+S56+U56+W56+Y56) -> 60 | AB56: =SUM(D56+F56+H56+J56+L56+N56+P56+R56+T56+V56+X56+Z56) -> 3328 | AC56: =SUM(AB56/AA56) -> 55.466666666666669 | AD56: =ROUNDDOWN(((AC56-50)*0.8),0) -> 4
A57: =SUM(A56+1) -> 55 | B57: Matt Fritz | S57: 7 | T57: 405 | U57: 18 | V57: 1038 | W57: 17 | X57: 965 | Y57: 18 | Z57: 1022 | AA57: =SUM(C57+E57+G57+I57+K57+M57+O57+Q57+S57+U57+W57+Y57) -> 60 | AB57: =SUM(D57+F57+H57+J57+L57+N57+P57+R57+T57+V57+X57+Z57) -> 3430 | AC57: =SUM(AB57/AA57) -> 57.166666666666664 | AD57: =ROUNDDOWN(((AC57-50)*0.8),0) -> 5
A58: =SUM(A57+1) -> 56 | B58: Aaron Lindsley | M58: 14 | N58: 740 | O58: 19 | P58: 1011 | Q58: 12 | R58: 642 | S58: 14 | T58: 729 | AA58: =SUM(C58+E58+G58+I58+K58+M58+O58+Q58+S58+U58+W58+Y58) -> 59 | AB58: =SUM(D58+F58+H58+J58+L58+N58+P58+R58+T58+V58+X58+Z58) -> 3122 | AC58: =SUM(AB58/AA58) -> 52.915254237288138 | AD58: =ROUNDDOWN(((AC58-50)*0.8),0) -> 2
A59: =SUM(A58+1) -> 57 | B59: Justin Zehr | S59: 9 | T59: 537 | U59: 18 | V59: 1080 | W59: 16 | X59: 907 | Y59: 16 | Z59: 945 | AA59: =SUM(C59+E59+G59+I59+K59+M59+O59+Q59+S59+U59+W59+Y59) -> 59 | AB59: =SUM(D59+F59+H59+J59+L59+N59+P59+R59+T59+V59+X59+Z59) -> 3469 | AC59: =SUM(AB59/AA59) -> 58.796610169491522 | AD59: =ROUNDDOWN(((AC59-50)*0.8),0) -> 7
A60: =SUM(A59+1) -> 58 | B60: Travis Scott* | C60: 22 | D60: 1325 | E60: 12 | F60: 813 | G60: 14 | H60: 839 | I60: 8 | J60: 480 | AA60: =SUM(C60+E60+G60+I60+K60+M60+O60+Q60+S60+U60+W60+Y60) -> 56 | AB60: =SUM(D60+F60+H60+J60+L60+N60+P60+R60+T60+V60+X60+Z60) -> 3457 | AC60: =SUM(AB60/AA60) -> 61.732142857142854 | AD60: =ROUNDDOWN(((AC60-50)*0.8),0) -> 9
A61: =SUM(A60+1) -> 59 | B61: J "Cally" Callaghan* | M61: 18 | N61: 1138 | O61: 19 | P61: 1157 | Q61: 18 | R61: 1159 | AA61: =SUM(C61+E61+G61+I61+K61+M61+O61+Q61+S61+U61+W61+Y61) -> 55 | AB61: =SUM(D61+F61+H61+J61+L61+N61+P61+R61+T61+V61+X61+Z61) -> 3454 | AC61: =SUM(AB61/AA61) -> 62.800 | AD61: =ROUNDDOWN(((AC61-50)*0.8),0) -> 10
A62: =SUM(A61+1) -> 60 | B62: Mike Robinson | M62: 17 | N62: 934 | O62: 19 | P62: 966 | Q62: 17 | R62: 936 | AA62: =SUM(C62+E62+G62+I62+K62+M62+O62+Q62+S62+U62+W62+Y62) -> 53 | AB62: =SUM(D62+F62+H62+J62+L62+N62+P62+R62+T62+V62+X62+Z62) -> 2836 | AC62: =SUM(AB62/AA62) -> 53.509433962264154 | AD62: =ROUNDDOWN(((AC62-50)*0.8),0) -> 2
A63: =SUM(A62+1) -> 61 | B63: Kate Papenthien | Q63: 18 | R63: 1137 | S63: 18 | T63: 1057 | U63: 17 | V63: 995 | AA63: =SUM(C63+E63+G63+I63+K63+M63+O63+Q63+S63+U63+W63+Y63) -> 53 | AB63: =SUM(D63+F63+H63+J63+L63+N63+P63+R63+T63+V63+X63+Z63) -> 3189 | AC63: =SUM(AB63/AA63) -> 60.169811320754718 | AD63: =ROUNDDOWN(((AC63-50)*0.8),0) -> 8
A64: =SUM(A63+1) -> 62 | B64: Dan Kern | U64: 17 | V64: 893 | W64: 18 | X64: 900 | Y64: 18 | Z64: 948 | AA64: =SUM(C64+E64+G64+I64+K64+M64+O64+Q64+S64+U64+W64+Y64) -> 53 | AB64: =SUM(D64+F64+H64+J64+L64+N64+P64+R64+T64+V64+X64+Z64) -> 2741 | AC64: =SUM(AB64/AA64) -> 51.716981132075475 | AD64: =ROUNDDOWN(((AC64-50)*0.8),0) -> 1
A65: =SUM(A64+1) -> 63 | B65: Brent Kauffman | K65: 18 | L65: 965 | O65: 17 | P65: 901 | Q65: 17 | R65: 946 | AA65: =SUM(C65+E65+G65+I65+K65+M65+O65+Q65+S65+U65+W65+Y65) -> 52 | AB65: =SUM(D65+F65+H65+J65+L65+N65+P65+R65+T65+V65+X65+Z65) -> 2812 | AC65: =SUM(AB65/AA65) -> 54.07692307692308 | AD65: =ROUNDDOWN(((AC65-50)*0.8),0) -> 3
A66: =SUM(A65+1) -> 64 | B66: Adam Miller | Q66: 1 | R66: 51 | U66: 17 | V66: 900 | W66: 17 | X66: 900 | Y66: 17 | Z66: 874 | AA66: =SUM(C66+E66+G66+I66+K66+M66+O66+Q66+S66+U66+W66+Y66) -> 52 | AB66: =SUM(D66+F66+H66+J66+L66+N66+P66+R66+T66+V66+X66+Z66) -> 2725 | AC66: =SUM(AB66/AA66) -> 52.403846153846153 | AD66: =ROUNDDOWN(((AC66-50)*0.8),0) -> 1
A67: =SUM(A66+1) -> 65 | B67: Spencer Eubanks | U67: 16 | V67: 1040 | W67: 18 | X67: 1169 | Y67: 18 | Z67: 1139 | AA67: =SUM(C67+E67+G67+I67+K67+M67+O67+Q67+S67+U67+W67+Y67) -> 52 | AB67: =SUM(D67+F67+H67+J67+L67+N67+P67+R67+T67+V67+X67+Z67) -> 3348 | AC67: =SUM(AB67/AA67) -> 64.384615384615387 | AD67: =ROUNDDOWN(((AC67-50)*0.8),0) -> 11
A68: =SUM(A67+1) -> 66 | B68: Valera Petrulevich | S68: 16 | T68: 1001 | U68: 17 | V68: 1034 | W68: 18 | X68: 1028 | AA68: =SUM(C68+E68+G68+I68+K68+M68+O68+Q68+S68+U68+W68+Y68) -> 51 | AB68: =SUM(D68+F68+H68+J68+L68+N68+P68+R68+T68+V68+X68+Z68) -> 3063 | AC68: =SUM(AB68/AA68) -> 60.058823529411768 | AD68: =ROUNDDOWN(((AC68-50)*0.8),0) -> 8
A69: =SUM(A68+1) -> 67 | B69: Steve Callaway | M69: 7 | N69: 422 | O69: 16 | P69: 971 | Q69: 16 | R69: 976 | S69: 3 | T69: 167 | U69: 7 | V69: 424 | AA69: =SUM(C69+E69+G69+I69+K69+M69+O69+Q69+S69+U69+W69+Y69) -> 49 | AB69: =SUM(D69+F69+H69+J69+L69+N69+P69+R69+T69+V69+X69+Z69) -> 2960 | AC69: =SUM(AB69/AA69) -> 60.408163265306122 | AD69: =ROUNDDOWN(((AC69-50)*0.8),0) -> 8
A70: =SUM(A69+1) -> 68 | B70: KVN | U70: 16 | V70: 837 | W70: 15 | X70: 749 | Y70: 18 | Z70: 930 | AA70: =SUM(C70+E70+G70+I70+K70+M70+O70+Q70+S70+U70+W70+Y70) -> 49 | AB70: =SUM(D70+F70+H70+J70+L70+N70+P70+R70+T70+V70+X70+Z70) -> 2516 | AC70: =SUM(AB70/AA70) -> 51.346938775510203 | AD70: =ROUNDDOWN(((AC70-50)*0.8),0) -> 1
A71: =SUM(A70+1) -> 69 | B71: Lee Nerad | E71: 14 | F71: 856 | G71: 18 | H71: 1099 | I71: 16 | J71: 982 | AA71: =SUM(C71+E71+G71+I71+K71+M71+O71+Q71+S71+U71+W71+Y71) -> 48 | AB71: =SUM(D71+F71+H71+J71+L71+N71+P71+R71+T71+V71+X71+Z71) -> 2937 | AC71: =SUM(AB71/AA71) -> 61.1875 | AD71: =ROUNDDOWN(((AC71-50)*0.8),0) -> 8
A72: =SUM(A71+1) -> 70 | B72: Dusty Mcatee | C72: 15 | D72: 888 | E72: 21 | F72: 1210 | G72: 12 | H72: 776 | AA72: =SUM(C72+E72+G72+I72+K72+M72+O72+Q72+S72+U72+W72+Y72) -> 48 | AB72: =SUM(D72+F72+H72+J72+L72+N72+P72+R72+T72+V72+X72+Z72) -> 2874 | AC72: =SUM(AB72/AA72) -> 59.875 | AD72: =ROUNDDOWN(((AC72-50)*0.8),0) -> 7
A73: =SUM(A72+1) -> 71 | B73: Brandon Yoder | S73: 15 | T73: 1014 | U73: 13 | V73: 855 | W73: 10 | X73: 676 | Y73: 10 | Z73: 673 | AA73: =SUM(C73+E73+G73+I73+K73+M73+O73+Q73+S73+U73+W73+Y73) -> 48 | AB73: =SUM(D73+F73+H73+J73+L73+N73+P73+R73+T73+V73+X73+Z73) -> 3218 | AC73: =SUM(AB73/AA73) -> 67.041666666666671 | AD73: =ROUNDDOWN(((AC73-50)*0.8),0) -> 13
A74: =SUM(A73+1) -> 72 | B74: Dustin Nohr | U74: 15 | V74: 935 | W74: 18 | X74: 1031 | Y74: 15 | Z74: 873 | AA74: =SUM(C74+E74+G74+I74+K74+M74+O74+Q74+S74+U74+W74+Y74) -> 48 | AB74: =SUM(D74+F74+H74+J74+L74+N74+P74+R74+T74+V74+X74+Z74) -> 2839 | AC74: =SUM(AB74/AA74) -> 59.145833333333336 | AD74: =ROUNDDOWN(((AC74-50)*0.8),0) -> 7
A75: =SUM(A74+1) -> 73 | B75: Eric Strader | G75: 18 | H75: 1178 | I75: 18 | J75: 1042 | K75: 11 | L75: 691 | AA75: =SUM(C75+E75+G75+I75+K75+M75+O75+Q75+S75+U75+W75+Y75) -> 47 | AB75: =SUM(D75+F75+H75+J75+L75+N75+P75+R75+T75+V75+X75+Z75) -> 2911 | AC75: =SUM(AB75/AA75) -> 61.936170212765958 | AD75: =ROUNDDOWN(((AC75-50)*0.8),0) -> 9
A76: =SUM(A75+1) -> 74 | B76: Scott Eastwood | C76: 20 | D76: 1619 | E76: 19 | F76: 1320 | G76: 3 | H76: 218 | AA76: =SUM(C76+E76+G76+I76+K76+M76+O76+Q76+S76+U76+W76+Y76) -> 42 | AB76: =SUM(D76+F76+H76+J76+L76+N76+P76+R76+T76+V76+X76+Z76) -> 3157 | AC76: =SUM(AB76/AA76) -> 75.166666666666671 | AD76: =ROUNDDOWN(((AC76-50)*0.8),0) -> 20
A77: =SUM(A76+1) -> 75 | B77: Joe Ostby | M77: 12 | N77: 682 | Q77: 18 | R77: 1029 | S77: 12 | T77: 683 | AA77: =SUM(C77+E77+G77+I77+K77+M77+O77+Q77+S77+U77+W77+Y77) -> 42 | AB77: =SUM(D77+F77+H77+J77+L77+N77+P77+R77+T77+V77+X77+Z77) -> 2394 | AC77: =SUM(AB77/AA77) -> 57.000 | AD77: =ROUNDDOWN(((AC77-50)*0.8),0) -> 5
A78: =SUM(A77+1) -> 76 | B78: Joe Evans | K78: 12 | L78: 815 | M78: 14 | N78: 931 | S78: 16 | T78: 1120 | AA78: =SUM(C78+E78+G78+I78+K78+M78+O78+Q78+S78+U78+W78+Y78) -> 42 | AB78: =SUM(D78+F78+H78+J78+L78+N78+P78+R78+T78+V78+X78+Z78) -> 2866 | AC78: =SUM(AB78/AA78) -> 68.238095238095241 | AD78: =ROUNDDOWN(((AC78-50)*0.8),0) -> 14
A79: =SUM(A78+1) -> 77 | B79: Troy Knapp | M79: 5 | N79: 301 | Q79: 16 | R79: 1034 | S79: 18 | T79: 1121 | U79: 1 | V79: 65 | AA79: =SUM(C79+E79+G79+I79+K79+M79+O79+Q79+S79+U79+W79+Y79) -> 40 | AB79: =SUM(D79+F79+H79+J79+L79+N79+P79+R79+T79+V79+X79+Z79) -> 2521 | AC79: =SUM(AB79/AA79) -> 63.024999999999999 | AD79: =ROUNDDOWN(((AC79-50)*0.8),0) -> 10
A80: =SUM(A79+1) -> 78 | B80: Brent Ross | E80: 21 | F80: 1287 | G80: 18 | H80: 1097 | AA80: =SUM(C80+E80+G80+I80+K80+M80+O80+Q80+S80+U80+W80+Y80) -> 39 | AB80: =SUM(D80+F80+H80+J80+L80+N80+P80+R80+T80+V80+X80+Z80) -> 2384 | AC80: =SUM(AB80/AA80) -> 61.128205128205131 | AD80: =ROUNDDOWN(((AC80-50)*0.8),0) -> 8
A81: =SUM(A80+1) -> 79 | B81: Jon Shear | O81: 18 | P81: 1036 | Q81: 16 | R81: 908 | S81: 4 | T81: 216 | AA81: =SUM(C81+E81+G81+I81+K81+M81+O81+Q81+S81+U81+W81+Y81) -> 38 | AB81: =SUM(D81+F81+H81+J81+L81+N81+P81+R81+T81+V81+X81+Z81) -> 2160 | AC81: =SUM(AB81/AA81) -> 56.842105263157897 | AD81: =ROUNDDOWN(((AC81-50)*0.8),0) -> 5
A82: =SUM(A81+1) -> 80 | B82: Brad Balk | O82: 19 | P82: 1178 | Q82: 18 | R82: 1110 | AA82: =SUM(C82+E82+G82+I82+K82+M82+O82+Q82+S82+U82+W82+Y82) -> 37 | AB82: =SUM(D82+F82+H82+J82+L82+N82+P82+R82+T82+V82+X82+Z82) -> 2288 | AC82: =SUM(AB82/AA82) -> 61.837837837837839 | AD82: =ROUNDDOWN(((AC82-50)*0.8),0) -> 9
A83: =SUM(A82+1) -> 81 | B83: Jake Sutter | M83: 18 | N83: 1034 | O83: 18 | P83: 1009 | AA83: =SUM(C83+E83+G83+I83+K83+M83+O83+Q83+S83+U83+W83+Y83) -> 36 | AB83: =SUM(D83+F83+H83+J83+L83+N83+P83+R83+T83+V83+X83+Z83) -> 2043 | AC83: =SUM(AB83/AA83) -> 56.750 | AD83: =ROUNDDOWN(((AC83-50)*0.8),0) -> 5
A84: =SUM(A83+1) -> 82 | B84: Jason Shook | M84: 18 | N84: 984 | O84: 1 | P84: 56 | Q84: 17 | R84: 940 | AA84: =SUM(C84+E84+G84+I84+K84+M84+O84+Q84+S84+U84+W84+Y84) -> 36 | AB84: =SUM(D84+F84+H84+J84+L84+N84+P84+R84+T84+V84+X84+Z84) -> 1980 | AC84: =SUM(AB84/AA84) -> 55.000 | AD84: =ROUNDDOWN(((AC84-50)*0.8),0) -> 4
A85: =SUM(A84+1) -> 83 | B85: Dev Nelson | Q85: 1 | R85: 50 | U85: 15 | V85: 810 | W85: 18 | X85: 928 | Y85: 2 | Z85: 105 | AA85: =SUM(C85+E85+G85+I85+K85+M85+O85+Q85+S85+U85+W85+Y85) -> 36 | AB85: =SUM(D85+F85+H85+J85+L85+N85+P85+R85+T85+V85+X85+Z85) -> 1893 | AC85: =SUM(AB85/AA85) -> 52.583333333333336 | AD85: =ROUNDDOWN(((AC85-50)*0.8),0) -> 2
A86: =SUM(A85+1) -> 84 | B86: Aaron "Burnie" Burnett | I86: 17 | J86: 1161 | K86: 18 | L86: 1193 | AA86: =SUM(C86+E86+G86+I86+K86+M86+O86+Q86+S86+U86+W86+Y86) -> 35 | AB86: =SUM(D86+F86+H86+J86+L86+N86+P86+R86+T86+V86+X86+Z86) -> 2354 | AC86: =SUM(AB86/AA86) -> 67.257142857142853 | AD86: =ROUNDDOWN(((AC86-50)*0.8),0) -> 13
A87: =SUM(A86+1) -> 85 | B87: Marc Bookmeyer | K87: 17 | L87: 1084 | M87: 18 | N87: 1115 | AA87: =SUM(C87+E87+G87+I87+K87+M87+O87+Q87+S87+U87+W87+Y87) -> 35 | AB87: =SUM(D87+F87+H87+J87+L87+N87+P87+R87+T87+V87+X87+Z87) -> 2199 | AC87: =SUM(AB87/AA87) -> 62.828571428571429 | AD87: =ROUNDDOWN(((AC87-50)*0.8),0) -> 10
A88: =SUM(A87+1) -> 86 | B88: Skyler Landess | M88: 18 | N88: 1313 | O88: 14 | P88: 957 | S88: 3 | T88: 216 | AA88: =SUM(C88+E88+G88+I88+K88+M88+O88+Q88+S88+U88+W88+Y88) -> 35 | AB88: =SUM(D88+F88+H88+J88+L88+N88+P88+R88+T88+V88+X88+Z88) -> 2486 | AC88: =SUM(AB88/AA88) -> 71.028571428571425 | AD88: =ROUNDDOWN(((AC88-50)*0.8),0) -> 16
A89: =SUM(A88+1) -> 87 | B89: Nick Schultz | Q89: 1 | R89: 57 | S89: 16 | T89: 880 | U89: 18 | V89: 979 | AA89: =SUM(C89+E89+G89+I89+K89+M89+O89+Q89+S89+U89+W89+Y89) -> 35 | AB89: =SUM(D89+F89+H89+J89+L89+N89+P89+R89+T89+V89+X89+Z89) -> 1916 | AC89: =SUM(AB89/AA89) -> 54.74285714285714 | AD89: =ROUNDDOWN(((AC89-50)*0.8),0) -> 3
A90: =SUM(A89+1) -> 88 | B90: Tim Potter* | W90: 18 | X90: 930 | Y90: 17 | Z90: 923 | AA90: =SUM(C90+E90+G90+I90+K90+M90+O90+Q90+S90+U90+W90+Y90) -> 35 | AB90: =SUM(D90+F90+H90+J90+L90+N90+P90+R90+T90+V90+X90+Z90) -> 1853 | AC90: =SUM(AB90/AA90) -> 52.942857142857143 | AD90: =ROUNDDOWN(((AC90-50)*0.8),0) -> 2
A91: =SUM(A90+1) -> 89 | B91: Ben Young | Q91: 16 | R91: 1072 | S91: 18 | T91: 1166 | AA91: =SUM(C91+E91+G91+I91+K91+M91+O91+Q91+S91+U91+W91+Y91) -> 34 | AB91: =SUM(D91+F91+H91+J91+L91+N91+P91+R91+T91+V91+X91+Z91) -> 2238 | AC91: =SUM(AB91/AA91) -> 65.82352941176471 | AD91: =ROUNDDOWN(((AC91-50)*0.8),0) -> 12
A92: =SUM(A91+1) -> 90 | B92: John Williams | W92: 16 | X92: 954 | Y92: 17 | Z92: 983 | AA92: =SUM(C92+E92+G92+I92+K92+M92+O92+Q92+S92+U92+W92+Y92) -> 33 | AB92: =SUM(D92+F92+H92+J92+L92+N92+P92+R92+T92+V92+X92+Z92) -> 1937 | AC92: =SUM(AB92/AA92) -> 58.696969696969695 | AD92: =ROUNDDOWN(((AC92-50)*0.8),0) -> 6
A93: =SUM(A92+1) -> 91 | B93: Andrew Staudt | Q93: 15 | R93: 962 | S93: 13 | T93: 814 | U93: 4 | V93: 246 | AA93: =SUM(C93+E93+G93+I93+K93+M93+O93+Q93+S93+U93+W93+Y93) -> 32 | AB93: =SUM(D93+F93+H93+J93+L93+N93+P93+R93+T93+V93+X93+Z93) -> 2022 | AC93: =SUM(AB93/AA93) -> 63.1875 | AD93: =ROUNDDOWN(((AC93-50)*0.8),0) -> 10
A94: =SUM(A93+1) -> 92 | B94: Brad Rew | S94: 16 | T94: 914 | U94: 13 | V94: 752 | W94: 3 | X94: 165 | AA94: =SUM(C94+E94+G94+I94+K94+M94+O94+Q94+S94+U94+W94+Y94) -> 32 | AB94: =SUM(D94+F94+H94+J94+L94+N94+P94+R94+T94+V94+X94+Z94) -> 1831 | AC94: =SUM(AB94/AA94) -> 57.21875 | AD94: =ROUNDDOWN(((AC94-50)*0.8),0) -> 5
A95: =SUM(A94+1) -> 93 | B95: Nathan Ciha | W95: 18 | X95: 1003 | Y95: 14 | Z95: 801 | AA95: =SUM(C95+E95+G95+I95+K95+M95+O95+Q95+S95+U95+W95+Y95) -> 32 | AB95: =SUM(D95+F95+H95+J95+L95+N95+P95+R95+T95+V95+X95+Z95) -> 1804 | AC95: =SUM(AB95/AA95) -> 56.375 | AD95: =ROUNDDOWN(((AC95-50)*0.8),0) -> 5
A96: =SUM(A95+1) -> 94 | B96: Tyson Gosnell* | C96: 21 | D96: 1373 | E96: 3 | F96: 197 | G96: 6 | H96: 385 | I96: 1 | J96: 75 | AA96: =SUM(C96+E96+G96+I96+K96+M96+O96+Q96+S96+U96+W96+Y96) -> 31 | AB96: =SUM(D96+F96+H96+J96+L96+N96+P96+R96+T96+V96+X96+Z96) -> 2030 | AC96: =SUM(AB96/AA96) -> 65.483870967741936 | AD96: =ROUNDDOWN(((AC96-50)*0.8),0) -> 12
A97: =SUM(A96+1) -> 95 | B97: Corey Philips | M97: 14 | N97: 847 | O97: 17 | P97: 1008 | AA97: =SUM(C97+E97+G97+I97+K97+M97+O97+Q97+S97+U97+W97+Y97) -> 31 | AB97: =SUM(D97+F97+H97+J97+L97+N97+P97+R97+T97+V97+X97+Z97) -> 1855 | AC97: =SUM(AB97/AA97) -> 59.838709677419352 | AD97: =ROUNDDOWN(((AC97-50)*0.8),0) -> 7
A98: =SUM(A97+1) -> 96 | B98: Brad Pike | M98: 18 | N98: 1265 | S98: 13 | T98: 852 | AA98: =SUM(C98+E98+G98+I98+K98+M98+O98+Q98+S98+U98+W98+Y98) -> 31 | AB98: =SUM(D98+F98+H98+J98+L98+N98+P98+R98+T98+V98+X98+Z98) -> 2117 | AC98: =SUM(AB98/AA98) -> 68.290322580645167 | AD98: =ROUNDDOWN(((AC98-50)*0.8),0) -> 14
A99: =SUM(A98+1) -> 97 | B99: Ryan Eggleston | W99: 15 | X99: 887 | Y99: 16 | Z99: 940 | AA99: =SUM(C99+E99+G99+I99+K99+M99+O99+Q99+S99+U99+W99+Y99) -> 31 | AB99: =SUM(D99+F99+H99+J99+L99+N99+P99+R99+T99+V99+X99+Z99) -> 1827 | AC99: =SUM(AB99/AA99) -> 58.935483870967744 | AD99: =ROUNDDOWN(((AC99-50)*0.8),0) -> 7
A100: =SUM(A99+1) -> 98 | B100: Brad Milder | O100: 10 | P100: 531 | Q100: 17 | R100: 915 | Y100: 4 | Z100: 227 | AA100: =SUM(C100+E100+G100+I100+K100+M100+O100+Q100+S100+U100+W100+Y100) -> 31 | AB100: =SUM(D100+F100+H100+J100+L100+N100+P100+R100+T100+V100+X100+Z100) -> 1673 | AC100: =SUM(AB100/AA100) -> 53.967741935483872 | AD100: =ROUNDDOWN(((AC100-50)*0.8),0) -> 3
A101: =SUM(A100+1) -> 99 | B101: Brian Cobb | C101: 2 | D101: 126 | E101: 21 | F101: 1367 | G101: 6 | H101: 406 | AA101: =SUM(C101+E101+G101+I101+K101+M101+O101+Q101+S101+U101+W101+Y101) -> 29 | AB101: =SUM(D101+F101+H101+J101+L101+N101+P101+R101+T101+V101+X101+Z101) -> 1899 | AC101: =SUM(AB101/AA101) -> 65.482758620689651 | AD101: =ROUNDDOWN(((AC101-50)*0.8),0) -> 12
A102: =SUM(A101+1) -> 100 | B102: Joe Grady | Q102: 18 | R102: 1039 | S102: 9 | T102: 503 | AA102: =SUM(C102+E102+G102+I102+K102+M102+O102+Q102+S102+U102+W102+Y102) -> 27 | AB102: =SUM(D102+F102+H102+J102+L102+N102+P102+R102+T102+V102+X102+Z102) -> 1542 | AC102: =SUM(AB102/AA102) -> 57.111111111111114 | AD102: =ROUNDDOWN(((AC102-50)*0.8),0) -> 5
A103: =SUM(A102+1) -> 101 | B103: Greg Friestad | U103: 11 | V103: 607 | W103: 16 | X103: 856 | AA103: =SUM(C103+E103+G103+I103+K103+M103+O103+Q103+S103+U103+W103+Y103) -> 27 | AB103: =SUM(D103+F103+H103+J103+L103+N103+P103+R103+T103+V103+X103+Z103) -> 1463 | AC103: =SUM(AB103/AA103) -> 54.185185185185183 | AD103: =ROUNDDOWN(((AC103-50)*0.8),0) -> 3
A104: =SUM(A103+1) -> 102 | B104: Mike Cameron* | G104: 14 | H104: 993 | I104: 12 | J104: 808 | AA104: =SUM(C104+E104+G104+I104+K104+M104+O104+Q104+S104+U104+W104+Y104) -> 26 | AB104: =SUM(D104+F104+H104+J104+L104+N104+P104+R104+T104+V104+X104+Z104) -> 1801 | AC104: =SUM(AB104/AA104) -> 69.269230769230774 | AD104: =ROUNDDOWN(((AC104-50)*0.8),0) -> 15
A105: =SUM(A104+1) -> 103 | B105: Rob Mumma | U105: 18 | V105: 1044 | W105: 4 | X105: 218 | Y105: 4 | Z105: 222 | AA105: =SUM(C105+E105+G105+I105+K105+M105+O105+Q105+S105+U105+W105+Y105) -> 26 | AB105: =SUM(D105+F105+H105+J105+L105+N105+P105+R105+T105+V105+X105+Z105) -> 1484 | AC105: =SUM(AB105/AA105) -> 57.07692307692308 | AD105: =ROUNDDOWN(((AC105-50)*0.8),0) -> 5
A106: =SUM(A105+1) -> 104 | B106: Jeff "Peds" Petoletti | M106: 17 | N106: 1266 | O106: 8 | P106: 549 | AA106: =SUM(C106+E106+G106+I106+K106+M106+O106+Q106+S106+U106+W106+Y106) -> 25 | AB106: =SUM(D106+F106+H106+J106+L106+N106+P106+R106+T106+V106+X106+Z106) -> 1815 | AC106: =SUM(AB106/AA106) -> 72.600 | AD106: =ROUNDDOWN(((AC106-50)*0.8),0) -> 18
A107: =SUM(A106+1) -> 105 | B107: Jason Stroud | S107: 4 | T107: 219 | U107: 18 | V107: 980 | Y107: 3 | Z107: 170 | AA107: =SUM(C107+E107+G107+I107+K107+M107+O107+Q107+S107+U107+W107+Y107) -> 25 | AB107: =SUM(D107+F107+H107+J107+L107+N107+P107+R107+T107+V107+X107+Z107) -> 1369 | AC107: =SUM(AB107/AA107) -> 54.760 | AD107: =ROUNDDOWN(((AC107-50)*0.8),0) -> 3
A108: =SUM(A107+1) -> 106 | B108: Shane Thirtyacre | W108: 14 | X108: 821 | Y108: 11 | Z108: 667 | AA108: =SUM(C108+E108+G108+I108+K108+M108+O108+Q108+S108+U108+W108+Y108) -> 25 | AB108: =SUM(D108+F108+H108+J108+L108+N108+P108+R108+T108+V108+X108+Z108) -> 1488 | AC108: =SUM(AB108/AA108) -> 59.520 | AD108: =ROUNDDOWN(((AC108-50)*0.8),0) -> 7
A109: =SUM(A108+1) -> 107 | B109: Doug Johnson | Q109: 2 | R109: 99 | U109: 1 | V109: 49 | W109: 5 | X109: 246 | Y109: 17 | Z109: 905 | AA109: =SUM(C109+E109+G109+I109+K109+M109+O109+Q109+S109+U109+W109+Y109) -> 25 | AB109: =SUM(D109+F109+H109+J109+L109+N109+P109+R109+T109+V109+X109+Z109) -> 1299 | AC109: =SUM(AB109/AA109) -> 51.960 | AD109: =ROUNDDOWN(((AC109-50)*0.8),0) -> 1
A110: =SUM(A109+1) -> 108 | B110: Charlie Dobberstein | Q110: 18 | R110: 1041 | S110: 3 | T110: 158 | U110: 1 | V110: 53 | W110: 2 | X110: 112 | AA110: =SUM(C110+E110+G110+I110+K110+M110+O110+Q110+S110+U110+W110+Y110) -> 24 | AB110: =SUM(D110+F110+H110+J110+L110+N110+P110+R110+T110+V110+X110+Z110) -> 1364 | AC110: =SUM(AB110/AA110) -> 56.833333333333336 | AD110: =ROUNDDOWN(((AC110-50)*0.8),0) -> 5
A111: =SUM(A110+1) -> 109 | B111: Matt Ross* | U111: 2 | V111: 116 | W111: 17 | X111: 930 | Y111: 5 | Z111: 299 | AA111: =SUM(C111+E111+G111+I111+K111+M111+O111+Q111+S111+U111+W111+Y111) -> 24 | AB111: =SUM(D111+F111+H111+J111+L111+N111+P111+R111+T111+V111+X111+Z111) -> 1345 | AC111: =SUM(AB111/AA111) -> 56.041666666666664 | AD111: =ROUNDDOWN(((AC111-50)*0.8),0) -> 4
A112: =SUM(A111+1) -> 110 | B112: Justin Oldfield | K112: 15 | L112: 1111 | M112: 8 | N112: 620 | AA112: =SUM(C112+E112+G112+I112+K112+M112+O112+Q112+S112+U112+W112+Y112) -> 23 | AB112: =SUM(D112+F112+H112+J112+L112+N112+P112+R112+T112+V112+X112+Z112) -> 1731 | AC112: =SUM(AB112/AA112) -> 75.260869565217391 | AD112: =ROUNDDOWN(((AC112-50)*0.8),0) -> 20
A113: =SUM(A112+1) -> 111 | B113: Chad Hein | O113: 19 | P113: 965 | Q113: 2 | R113: 102 | AA113: =SUM(C113+E113+G113+I113+K113+M113+O113+Q113+S113+U113+W113+Y113) -> 21 | AB113: =SUM(D113+F113+H113+J113+L113+N113+P113+R113+T113+V113+X113+Z113) -> 1067 | AC113: =SUM(AB113/AA113) -> 50.80952380952381 | AD113: =ROUNDDOWN(((AC113-50)*0.8),0) -> 0
A114: =SUM(A113+1) -> 112 | B114: Randy | G114: 17 | H114: 1012 | K114: 3 | L114: 172 | AA114: =SUM(C114+E114+G114+I114+K114+M114+O114+Q114+S114+U114+W114+Y114) -> 20 | AB114: =SUM(D114+F114+H114+J114+L114+N114+P114+R114+T114+V114+X114+Z114) -> 1184 | AC114: =SUM(AB114/AA114) -> 59.200 | AD114: =ROUNDDOWN(((AC114-50)*0.8),0) -> 7
A115: =SUM(A114+1) -> 113 | B115: Dustin Gaskill | Q115: 5 | R115: 299 | S115: 14 | T115: 845 | U115: 1 | V115: 66 | AA115: =SUM(C115+E115+G115+I115+K115+M115+O115+Q115+S115+U115+W115+Y115) -> 20 | AB115: =SUM(D115+F115+H115+J115+L115+N115+P115+R115+T115+V115+X115+Z115) -> 1210 | AC115: =SUM(AB115/AA115) -> 60.500 | AD115: =ROUNDDOWN(((AC115-50)*0.8),0) -> 8
A116: =SUM(A115+1) -> 114 | B116: Kurt Conrad | W116: 3 | X116: 157 | Y116: 17 | Z116: 909 | AA116: =SUM(C116+E116+G116+I116+K116+M116+O116+Q116+S116+U116+W116+Y116) -> 20 | AB116: =SUM(D116+F116+H116+J116+L116+N116+P116+R116+T116+V116+X116+Z116) -> 1066 | AC116: =SUM(AB116/AA116) -> 53.300 | AD116: =ROUNDDOWN(((AC116-50)*0.8),0) -> 2
A117: =SUM(A116+1) -> 115 | B117: Blake Moel | E117: 19 | F117: 1361 | AA117: =SUM(C117+E117+G117+I117+K117+M117+O117+Q117+S117+U117+W117+Y117) -> 19 | AB117: =SUM(D117+F117+H117+J117+L117+N117+P117+R117+T117+V117+X117+Z117) -> 1361 | AC117: =SUM(AB117/AA117) -> 71.631578947368425 | AD117: =ROUNDDOWN(((AC117-50)*0.8),0) -> 17
A118: =SUM(A117+1) -> 116 | B118: Lon Reilly | O118: 19 | P118: 1050 | AA118: =SUM(C118+E118+G118+I118+K118+M118+O118+Q118+S118+U118+W118+Y118) -> 19 | AB118: =SUM(D118+F118+H118+J118+L118+N118+P118+R118+T118+V118+X118+Z118) -> 1050 | AC118: =SUM(AB118/AA118) -> 55.263157894736842 | AD118: =ROUNDDOWN(((AC118-50)*0.8),0) -> 4
A119: =SUM(A118+1) -> 117 | B119: Chase Roberts | O119: 19 | P119: 973 | AA119: =SUM(C119+E119+G119+I119+K119+M119+O119+Q119+S119+U119+W119+Y119) -> 19 | AB119: =SUM(D119+F119+H119+J119+L119+N119+P119+R119+T119+V119+X119+Z119) -> 973 | AC119: =SUM(AB119/AA119) -> 51.210526315789473 | AD119: =ROUNDDOWN(((AC119-50)*0.8),0) -> 0
A120: =SUM(A119+1) -> 118 | B120: John Petrie | M120: 18 | N120: 1093 | S120: 1 | T120: 61 | AA120: =SUM(C120+E120+G120+I120+K120+M120+O120+Q120+S120+U120+W120+Y120) -> 19 | AB120: =SUM(D120+F120+H120+J120+L120+N120+P120+R120+T120+V120+X120+Z120) -> 1154 | AC120: =SUM(AB120/AA120) -> 60.736842105263158 | AD120: =ROUNDDOWN(((AC120-50)*0.8),0) -> 8
A121: =SUM(A120+1) -> 119 | B121: Drew Detert* | W121: 1 | X121: 55 | Y121: 18 | Z121: 947 | AA121: =SUM(C121+E121+G121+I121+K121+M121+O121+Q121+S121+U121+W121+Y121) -> 19 | AB121: =SUM(D121+F121+H121+J121+L121+N121+P121+R121+T121+V121+X121+Z121) -> 1002 | AC121: =SUM(AB121/AA121) -> 52.736842105263158 | AD121: =ROUNDDOWN(((AC121-50)*0.8),0) -> 2
A122: =SUM(A121+1) -> 120 | B122: Ben Greco | G122: 18 | H122: 1161 | AA122: =SUM(C122+E122+G122+I122+K122+M122+O122+Q122+S122+U122+W122+Y122) -> 18 | AB122: =SUM(D122+F122+H122+J122+L122+N122+P122+R122+T122+V122+X122+Z122) -> 1161 | AC122: =SUM(AB122/AA122) -> 64.500 | AD122: =ROUNDDOWN(((AC122-50)*0.8),0) -> 11
A123: =SUM(A122+1) -> 121 | B123: Kurt Kramer | K123: 18 | L123: 1083 | AA123: =SUM(C123+E123+G123+I123+K123+M123+O123+Q123+S123+U123+W123+Y123) -> 18 | AB123: =SUM(D123+F123+H123+J123+L123+N123+P123+R123+T123+V123+X123+Z123) -> 1083 | AC123: =SUM(AB123/AA123) -> 60.166666666666664 | AD123: =ROUNDDOWN(((AC123-50)*0.8),0) -> 8
A124: =SUM(A123+1) -> 122 | B124: Andy Moel | G124: 18 | H124: 1082 | AA124: =SUM(C124+E124+G124+I124+K124+M124+O124+Q124+S124+U124+W124+Y124) -> 18 | AB124: =SUM(D124+F124+H124+J124+L124+N124+P124+R124+T124+V124+X124+Z124) -> 1082 | AC124: =SUM(AB124/AA124) -> 60.111111111111114 | AD124: =ROUNDDOWN(((AC124-50)*0.8),0) -> 8
A125: =SUM(A124+1) -> 123 | B125: Dan Ferch | U125: 18 | V125: 1006 | AA125: =SUM(C125+E125+G125+I125+K125+M125+O125+Q125+S125+U125+W125+Y125) -> 18 | AB125: =SUM(D125+F125+H125+J125+L125+N125+P125+R125+T125+V125+X125+Z125) -> 1006 | AC125: =SUM(AB125/AA125) -> 55.888888888888886 | AD125: =ROUNDDOWN(((AC125-50)*0.8),0) -> 4
A126: =SUM(A125+1) -> 124 | B126: Andrew Hamer | U126: 18 | V126: 1028 | AA126: =SUM(C126+E126+G126+I126+K126+M126+O126+Q126+S126+U126+W126+Y126) -> 18 | AB126: =SUM(D126+F126+H126+J126+L126+N126+P126+R126+T126+V126+X126+Z126) -> 1028 | AC126: =SUM(AB126/AA126) -> 57.111111111111114 | AD126: =ROUNDDOWN(((AC126-50)*0.8),0) -> 5
A127: =SUM(A126+1) -> 125 | B127: Matt Pease | U127: 18 | V127: 1089 | AA127: =SUM(C127+E127+G127+I127+K127+M127+O127+Q127+S127+U127+W127+Y127) -> 18 | AB127: =SUM(D127+F127+H127+J127+L127+N127+P127+R127+T127+V127+X127+Z127) -> 1089 | AC127: =SUM(AB127/AA127) -> 60.500 | AD127: =ROUNDDOWN(((AC127-50)*0.8),0) -> 8
A128: =SUM(A127+1) -> 126 | B128: Strad Docterman | U128: 18 | V128: 1148 | AA128: =SUM(C128+E128+G128+I128+K128+M128+O128+Q128+S128+U128+W128+Y128) -> 18 | AB128: =SUM(D128+F128+H128+J128+L128+N128+P128+R128+T128+V128+X128+Z128) -> 1148 | AC128: =SUM(AB128/AA128) -> 63.777777777777779 | AD128: =ROUNDDOWN(((AC128-50)*0.8),0) -> 11
A129: =SUM(A128+1) -> 127 | B129: Phil Campos | Y129: 18 | Z129: 1034 | AA129: =SUM(C129+E129+G129+I129+K129+M129+O129+Q129+S129+U129+W129+Y129) -> 18 | AB129: =SUM(D129+F129+H129+J129+L129+N129+P129+R129+T129+V129+X129+Z129) -> 1034 | AC129: =SUM(AB129/AA129) -> 57.444444444444443 | AD129: =ROUNDDOWN(((AC129-50)*0.8),0) -> 5
A130: =SUM(A129+1) -> 128 | B130: Eric Smith | Y130: 18 | Z130: 1080 | AA130: =SUM(C130+E130+G130+I130+K130+M130+O130+Q130+S130+U130+W130+Y130) -> 18 | AB130: =SUM(D130+F130+H130+J130+L130+N130+P130+R130+T130+V130+X130+Z130) -> 1080 | AC130: =SUM(AB130/AA130) -> 60.000 | AD130: =ROUNDDOWN(((AC130-50)*0.8),0) -> 8
A131: =SUM(A130+1) -> 129 | B131: John Lambert | Y131: 18 | Z131: 1181 | AA131: =SUM(C131+E131+G131+I131+K131+M131+O131+Q131+S131+U131+W131+Y131) -> 18 | AB131: =SUM(D131+F131+H131+J131+L131+N131+P131+R131+T131+V131+X131+Z131) -> 1181 | AC131: =SUM(AB131/AA131) -> 65.611111111111114 | AD131: =ROUNDDOWN(((AC131-50)*0.8),0) -> 12
A132: =SUM(A131+1) -> 130 | B132: Ross Welter | O132: 17 | P132: 1124 | AA132: =SUM(C132+E132+G132+I132+K132+M132+O132+Q132+S132+U132+W132+Y132) -> 17 | AB132: =SUM(D132+F132+H132+J132+L132+N132+P132+R132+T132+V132+X132+Z132) -> 1124 | AC132: =SUM(AB132/AA132) -> 66.117647058823536 | AD132: =ROUNDDOWN(((AC132-50)*0.8),0) -> 12
A133: =SUM(A132+1) -> 131 | B133: Nate Elbert | O133: 17 | P133: 1061 | AA133: =SUM(C133+E133+G133+I133+K133+M133+O133+Q133+S133+U133+W133+Y133) -> 17 | AB133: =SUM(D133+F133+H133+J133+L133+N133+P133+R133+T133+V133+X133+Z133) -> 1061 | AC133: =SUM(AB133/AA133) -> 62.411764705882355 | AD133: =ROUNDDOWN(((AC133-50)*0.8),0) -> 9
A134: =SUM(A133+1) -> 132 | B134: Clint Loonan | O134: 17 | P134: 980 | AA134: =SUM(C134+E134+G134+I134+K134+M134+O134+Q134+S134+U134+W134+Y134) -> 17 | AB134: =SUM(D134+F134+H134+J134+L134+N134+P134+R134+T134+V134+X134+Z134) -> 980 | AC134: =SUM(AB134/AA134) -> 57.647058823529413 | AD134: =ROUNDDOWN(((AC134-50)*0.8),0) -> 6
A135: =SUM(A134+1) -> 133 | B135: Bridgette Rew | U135: 17 | V135: 1170 | AA135: =SUM(C135+E135+G135+I135+K135+M135+O135+Q135+S135+U135+W135+Y135) -> 17 | AB135: =SUM(D135+F135+H135+J135+L135+N135+P135+R135+T135+V135+X135+Z135) -> 1170 | AC135: =SUM(AB135/AA135) -> 68.82352941176471 | AD135: =ROUNDDOWN(((AC135-50)*0.8),0) -> 15
A136: =SUM(A135+1) -> 134 | B136: Chuck Hansen | W136: 17 | X136: 1030 | AA136: =SUM(C136+E136+G136+I136+K136+M136+O136+Q136+S136+U136+W136+Y136) -> 17 | AB136: =SUM(D136+F136+H136+J136+L136+N136+P136+R136+T136+V136+X136+Z136) -> 1030 | AC136: =SUM(AB136/AA136) -> 60.588235294117645 | AD136: =ROUNDDOWN(((AC136-50)*0.8),0) -> 8
A137: =SUM(A136+1) -> 135 | B137: Dan Lewis | W137: 13 | X137: 740 | Y137: 4 | Z137: 232 | AA137: =SUM(C137+E137+G137+I137+K137+M137+O137+Q137+S137+U137+W137+Y137) -> 17 | AB137: =SUM(D137+F137+H137+J137+L137+N137+P137+R137+T137+V137+X137+Z137) -> 972 | AC137: =SUM(AB137/AA137) -> 57.176470588235297 | AD137: =ROUNDDOWN(((AC137-50)*0.8),0) -> 5
A138: =SUM(A137+1) -> 136 | B138: Adam Karstens | U138: 1 | V138: 54 | W138: 1 | X138: 55 | Y138: 15 | Z138: 816 | AA138: =SUM(C138+E138+G138+I138+K138+M138+O138+Q138+S138+U138+W138+Y138) -> 17 | AB138: =SUM(D138+F138+H138+J138+L138+N138+P138+R138+T138+V138+X138+Z138) -> 925 | AC138: =SUM(AB138/AA138) -> 54.411764705882355 | AD138: =ROUNDDOWN(((AC138-50)*0.8),0) -> 3
A139: =SUM(A138+1) -> 137 | B139: David Brown | S139: 16 | T139: 960 | AA139: =SUM(C139+E139+G139+I139+K139+M139+O139+Q139+S139+U139+W139+Y139) -> 16 | AB139: =SUM(D139+F139+H139+J139+L139+N139+P139+R139+T139+V139+X139+Z139) -> 960 | AC139: =SUM(AB139/AA139) -> 60.000 | AD139: =ROUNDDOWN(((AC139-50)*0.8),0) -> 8
A140: =SUM(A139+1) -> 138 | B140: Scott Lindsley | S140: 13 | T140: 724 | U140: 3 | V140: 165 | AA140: =SUM(C140+E140+G140+I140+K140+M140+O140+Q140+S140+U140+W140+Y140) -> 16 | AB140: =SUM(D140+F140+H140+J140+L140+N140+P140+R140+T140+V140+X140+Z140) -> 889 | AC140: =SUM(AB140/AA140) -> 55.5625 | AD140: =ROUNDDOWN(((AC140-50)*0.8),0) -> 4
A141: =SUM(A140+1) -> 139 | B141: Trevor Dickerson | W141: 16 | X141: 961 | AA141: =SUM(C141+E141+G141+I141+K141+M141+O141+Q141+S141+U141+W141+Y141) -> 16 | AB141: =SUM(D141+F141+H141+J141+L141+N141+P141+R141+T141+V141+X141+Z141) -> 961 | AC141: =SUM(AB141/AA141) -> 60.0625 | AD141: =ROUNDDOWN(((AC141-50)*0.8),0) -> 8
A142: =SUM(A141+1) -> 140 | B142: Anthony Moody | Y142: 16 | Z142: 945 | AA142: =SUM(C142+E142+G142+I142+K142+M142+O142+Q142+S142+U142+W142+Y142) -> 16 | AB142: =SUM(D142+F142+H142+J142+L142+N142+P142+R142+T142+V142+X142+Z142) -> 945 | AC142: =SUM(AB142/AA142) -> 59.0625 | AD142: =ROUNDDOWN(((AC142-50)*0.8),0) -> 7
A143: =SUM(A142+1) -> 141 | B143: Mike O'neill | Y143: 15 | Z143: 921 | AA143: =SUM(C143+E143+G143+I143+K143+M143+O143+Q143+S143+U143+W143+Y143) -> 15 | AB143: =SUM(D143+F143+H143+J143+L143+N143+P143+R143+T143+V143+X143+Z143) -> 921 | AC143: =SUM(AB143/AA143) -> 61.400 | AD143: =ROUNDDOWN(((AC143-50)*0.8),0) -> 9
A144: =SUM(A143+1) -> 142 | B144: Jim Necessary | Y144: 15 | Z144: 805 | AA144: =SUM(C144+E144+G144+I144+K144+M144+O144+Q144+S144+U144+W144+Y144) -> 15 | AB144: =SUM(D144+F144+H144+J144+L144+N144+P144+R144+T144+V144+X144+Z144) -> 805 | AC144: =SUM(AB144/AA144) -> 53.666666666666664 | AD144: =ROUNDDOWN(((AC144-50)*0.8),0) -> 2
A145: =SUM(A144+1) -> 143 | B145: Seth Marling | S145: 14 | T145: 849 | AA145: =SUM(C145+E145+G145+I145+K145+M145+O145+Q145+S145+U145+W145+Y145) -> 14 | AB145: =SUM(D145+F145+H145+J145+L145+N145+P145+R145+T145+V145+X145+Z145) -> 849 | AC145: =SUM(AB145/AA145) -> 60.642857142857146 | AD145: =ROUNDDOWN(((AC145-50)*0.8),0) -> 8
A146: =SUM(A145+1) -> 144 | B146: Nate Lenzini | M146: 13 | N146: 809 | AA146: =SUM(C146+E146+G146+I146+K146+M146+O146+Q146+S146+U146+W146+Y146) -> 13 | AB146: =SUM(D146+F146+H146+J146+L146+N146+P146+R146+T146+V146+X146+Z146) -> 809 | AC146: =SUM(AB146/AA146) -> 62.230769230769234 | AD146: =ROUNDDOWN(((AC146-50)*0.8),0) -> 9
A147: =SUM(A146+1) -> 145 | B147: Nathan Johnson | O147: 3 | P147: 175 | Q147: 10 | R147: 549 | AA147: =SUM(C147+E147+G147+I147+K147+M147+O147+Q147+S147+U147+W147+Y147) -> 13 | AB147: =SUM(D147+F147+H147+J147+L147+N147+P147+R147+T147+V147+X147+Z147) -> 724 | AC147: =SUM(AB147/AA147) -> 55.692307692307693 | AD147: =ROUNDDOWN(((AC147-50)*0.8),0) -> 4
A148: =SUM(A147+1) -> 146 | B148: Chris Bentler | G148: 11 | H148: 620 | I148: 1 | J148: 53 | AA148: =SUM(C148+E148+G148+I148+K148+M148+O148+Q148+S148+U148+W148+Y148) -> 12 | AB148: =SUM(D148+F148+H148+J148+L148+N148+P148+R148+T148+V148+X148+Z148) -> 673 | AC148: =SUM(AB148/AA148) -> 56.083333333333336 | AD148: =ROUNDDOWN(((AC148-50)*0.8),0) -> 4
A149: =SUM(A148+1) -> 147 | B149: Al | C149: 11 | D149: 809 | AA149: =SUM(C149+E149+G149+I149+K149+M149+O149+Q149+S149+U149+W149+Y149) -> 11 | AB149: =SUM(D149+F149+H149+J149+L149+N149+P149+R149+T149+V149+X149+Z149) -> 809 | AC149: =SUM(AB149/AA149) -> 73.545454545454547 | AD149: =ROUNDDOWN(((AC149-50)*0.8),0) -> 18
A150: =SUM(A149+1) -> 148 | B150: Craig | G150: 6 | H150: 356 | I150: 5 | J150: 295 | AA150: =SUM(C150+E150+G150+I150+K150+M150+O150+Q150+S150+U150+W150+Y150) -> 11 | AB150: =SUM(D150+F150+H150+J150+L150+N150+P150+R150+T150+V150+X150+Z150) -> 651 | AC150: =SUM(AB150/AA150) -> 59.18181818181818 | AD150: =ROUNDDOWN(((AC150-50)*0.8),0) -> 7
A151: =SUM(A150+1) -> 149 | B151: Zach Votroubeck | W151: 7 | X151: 431 | Y151: 4 | Z151: 282 | AA151: =SUM(C151+E151+G151+I151+K151+M151+O151+Q151+S151+U151+W151+Y151) -> 11 | AB151: =SUM(D151+F151+H151+J151+L151+N151+P151+R151+T151+V151+X151+Z151) -> 713 | AC151: =SUM(AB151/AA151) -> 64.818181818181813 | AD151: =ROUNDDOWN(((AC151-50)*0.8),0) -> 11
A152: =SUM(A151+1) -> 150 | B152: Lyle Theisen | S152: 10 | T152: 718 | AA152: =SUM(C152+E152+G152+I152+K152+M152+O152+Q152+S152+U152+W152+Y152) -> 10 | AB152: =SUM(D152+F152+H152+J152+L152+N152+P152+R152+T152+V152+X152+Z152) -> 718 | AC152: =SUM(AB152/AA152) -> 71.800 | AD152: =ROUNDDOWN(((AC152-50)*0.8),0) -> 17
A153: =SUM(A152+1) -> 151 | B153: Jack Gilmore | Q153: 9 | R153: 512 | U153: 1 | V153: 52 | AA153: =SUM(C153+E153+G153+I153+K153+M153+O153+Q153+S153+U153+W153+Y153) -> 10 | AB153: =SUM(D153+F153+H153+J153+L153+N153+P153+R153+T153+V153+X153+Z153) -> 564 | AC153: =SUM(AB153/AA153) -> 56.400 | AD153: =ROUNDDOWN(((AC153-50)*0.8),0) -> 5
A154: =SUM(A153+1) -> 152 | B154: Adam Olsen | Q154: 8 | R154: 380 | S154: 1 | T154: 53 | W154: 1 | X154: 47 | AA154: =SUM(C154+E154+G154+I154+K154+M154+O154+Q154+S154+U154+W154+Y154) -> 10 | AB154: =SUM(D154+F154+H154+J154+L154+N154+P154+R154+T154+V154+X154+Z154) -> 480 | AC154: =SUM(AB154/AA154) -> 48.000 | AD154: =ROUNDDOWN(((AC154-50)*0.8),0) -> -1
A155: =SUM(A154+1) -> 153 | B155: Brian Points | K155: 9 | L155: 633 | AA155: =SUM(C155+E155+G155+I155+K155+M155+O155+Q155+S155+U155+W155+Y155) -> 9 | AB155: =SUM(D155+F155+H155+J155+L155+N155+P155+R155+T155+V155+X155+Z155) -> 633 | AC155: =SUM(AB155/AA155) -> 70.333333333333329 | AD155: =ROUNDDOWN(((AC155-50)*0.8),0) -> 16
A156: =SUM(A155+1) -> 154 | B156: Kidwell | G156: 9 | H156: 552 | AA156: =SUM(C156+E156+G156+I156+K156+M156+O156+Q156+S156+U156+W156+Y156) -> 9 | AB156: =SUM(D156+F156+H156+J156+L156+N156+P156+R156+T156+V156+X156+Z156) -> 552 | AC156: =SUM(AB156/AA156) -> 61.333333333333336 | AD156: =ROUNDDOWN(((AC156-50)*0.8),0) -> 9
A157: =SUM(A156+1) -> 155 | B157: Greg Dye | W157: 1 | X157: 53 | Y157: 8 | Z157: 438 | AA157: =SUM(C157+E157+G157+I157+K157+M157+O157+Q157+S157+U157+W157+Y157) -> 9 | AB157: =SUM(D157+F157+H157+J157+L157+N157+P157+R157+T157+V157+X157+Z157) -> 491 | AC157: =SUM(AB157/AA157) -> 54.555555555555557 | AD157: =ROUNDDOWN(((AC157-50)*0.8),0) -> 3
A158: =SUM(A157+1) -> 156 | B158: Aaron Killion | Y158: 9 | Z158: 520 | AA158: =SUM(C158+E158+G158+I158+K158+M158+O158+Q158+S158+U158+W158+Y158) -> 9 | AB158: =SUM(D158+F158+H158+J158+L158+N158+P158+R158+T158+V158+X158+Z158) -> 520 | AC158: =SUM(AB158/AA158) -> 57.777777777777779 | AD158: =ROUNDDOWN(((AC158-50)*0.8),0) -> 6
A159: =SUM(A158+1) -> 157 | B159: Nate | G159: 8 | H159: 456 | AA159: =SUM(C159+E159+G159+I159+K159+M159+O159+Q159+S159+U159+W159+Y159) -> 8 | AB159: =SUM(D159+F159+H159+J159+L159+N159+P159+R159+T159+V159+X159+Z159) -> 456 | AC159: =SUM(AB159/AA159) -> 57.000 | AD159: =ROUNDDOWN(((AC159-50)*0.8),0) -> 5
A160: =SUM(A159+1) -> 158 | B160: Doug Knepp | S160: 2 | T160: 131 | U160: 6 | V160: 390 | AA160: =SUM(C160+E160+G160+I160+K160+M160+O160+Q160+S160+U160+W160+Y160) -> 8 | AB160: =SUM(D160+F160+H160+J160+L160+N160+P160+R160+T160+V160+X160+Z160) -> 521 | AC160: =SUM(AB160/AA160) -> 65.125 | AD160: =ROUNDDOWN(((AC160-50)*0.8),0) -> 12
A161: =SUM(A160+1) -> 159 | B161: Chris Farnsworth | W161: 8 | X161: 507 | AA161: =SUM(C161+E161+G161+I161+K161+M161+O161+Q161+S161+U161+W161+Y161) -> 8 | AB161: =SUM(D161+F161+H161+J161+L161+N161+P161+R161+T161+V161+X161+Z161) -> 507 | AC161: =SUM(AB161/AA161) -> 63.375 | AD161: =ROUNDDOWN(((AC161-50)*0.8),0) -> 10
A162: =SUM(A161+1) -> 160 | B162: Abel | G162: 7 | H162: 419 | AA162: =SUM(C162+E162+G162+I162+K162+M162+O162+Q162+S162+U162+W162+Y162) -> 7 | AB162: =SUM(D162+F162+H162+J162+L162+N162+P162+R162+T162+V162+X162+Z162) -> 419 | AC162: =SUM(AB162/AA162) -> 59.857142857142854 | AD162: =ROUNDDOWN(((AC162-50)*0.8),0) -> 7
A163: =SUM(A162+1) -> 161 | B163: "Btch'n" | M163: 1 | N163: 60 | Q163: 6 | R163: 348 | AA163: =SUM(C163+E163+G163+I163+K163+M163+O163+Q163+S163+U163+W163+Y163) -> 7 | AB163: =SUM(D163+F163+H163+J163+L163+N163+P163+R163+T163+V163+X163+Z163) -> 408 | AC163: =SUM(AB163/AA163) -> 58.285714285714285 | AD163: =ROUNDDOWN(((AC163-50)*0.8),0) -> 6
A164: =SUM(A163+1) -> 162 | B164: Steve Lepeltak | S164: 7 | T164: 539 | AA164: =SUM(C164+E164+G164+I164+K164+M164+O164+Q164+S164+U164+W164+Y164) -> 7 | AB164: =SUM(D164+F164+H164+J164+L164+N164+P164+R164+T164+V164+X164+Z164) -> 539 | AC164: =SUM(AB164/AA164) -> 77.000 | AD164: =ROUNDDOWN(((AC164-50)*0.8),0) -> 21
A165: =SUM(A164+1) -> 163 | B165: Jason Baxter | S165: 7 | T165: 560 | AA165: =SUM(C165+E165+G165+I165+K165+M165+O165+Q165+S165+U165+W165+Y165) -> 7 | AB165: =SUM(D165+F165+H165+J165+L165+N165+P165+R165+T165+V165+X165+Z165) -> 560 | AC165: =SUM(AB165/AA165) -> 80.000 | AD165: =ROUNDDOWN(((AC165-50)*0.8),0) -> 24
A166: =SUM(A165+1) -> 164 | B166: Aaron Gaddis | I166: 6 | J166: 429 | AA166: =SUM(C166+E166+G166+I166+K166+M166+O166+Q166+S166+U166+W166+Y166) -> 6 | AB166: =SUM(D166+F166+H166+J166+L166+N166+P166+R166+T166+V166+X166+Z166) -> 429 | AC166: =SUM(AB166/AA166) -> 71.500 | AD166: =ROUNDDOWN(((AC166-50)*0.8),0) -> 17
A167: =SUM(A166+1) -> 165 | B167: Chrs Timko | Q167: 6 | R167: 343 | AA167: =SUM(C167+E167+G167+I167+K167+M167+O167+Q167+S167+U167+W167+Y167) -> 6 | AB167: =SUM(D167+F167+H167+J167+L167+N167+P167+R167+T167+V167+X167+Z167) -> 343 | AC167: =SUM(AB167/AA167) -> 57.166666666666664 | AD167: =ROUNDDOWN(((AC167-50)*0.8),0) -> 5
A168: =SUM(A167+1) -> 166 | B168: Clay Abernathy | Q168: 6 | R168: 305 | AA168: =SUM(C168+E168+G168+I168+K168+M168+O168+Q168+S168+U168+W168+Y168) -> 6 | AB168: =SUM(D168+F168+H168+J168+L168+N168+P168+R168+T168+V168+X168+Z168) -> 305 | AC168: =SUM(AB168/AA168) -> 50.833333333333336 | AD168: =ROUNDDOWN(((AC168-50)*0.8),0) -> 0
A169: =SUM(A168+1) -> 167 | B169: Lance Hansen | G169: 6 | H169: 296 | AA169: =SUM(C169+E169+G169+I169+K169+M169+O169+Q169+S169+U169+W169+Y169) -> 6 | AB169: =SUM(D169+F169+H169+J169+L169+N169+P169+R169+T169+V169+X169+Z169) -> 296 | AC169: =SUM(AB169/AA169) -> 49.333333333333336 | AD169: =ROUNDDOWN(((AC169-50)*0.8),0) -> 0
A170: =SUM(A169+1) -> 168 | B170: Cassie Shear | O170: 2 | P170: 125 | S170: 4 | T170: 241 | AA170: =SUM(C170+E170+G170+I170+K170+M170+O170+Q170+S170+U170+W170+Y170) -> 6 | AB170: =SUM(D170+F170+H170+J170+L170+N170+P170+R170+T170+V170+X170+Z170) -> 366 | AC170: =SUM(AB170/AA170) -> 61.000 | AD170: =ROUNDDOWN(((AC170-50)*0.8),0) -> 8
A171: =SUM(A170+1) -> 169 | B171: Aaron Porter | W171: 2 | X171: 133 | Y171: 4 | Z171: 263 | AA171: =SUM(C171+E171+G171+I171+K171+M171+O171+Q171+S171+U171+W171+Y171) -> 6 | AB171: =SUM(D171+F171+H171+J171+L171+N171+P171+R171+T171+V171+X171+Z171) -> 396 | AC171: =SUM(AB171/AA171) -> 66.000 | AD171: =ROUNDDOWN(((AC171-50)*0.8),0) -> 12
A172: =SUM(A171+1) -> 170 | B172: Chad Goodwin | Y172: 6 | Z172: 410 | AA172: =SUM(C172+E172+G172+I172+K172+M172+O172+Q172+S172+U172+W172+Y172) -> 6 | AB172: =SUM(D172+F172+H172+J172+L172+N172+P172+R172+T172+V172+X172+Z172) -> 410 | AC172: =SUM(AB172/AA172) -> 68.333333333333329 | AD172: =ROUNDDOWN(((AC172-50)*0.8),0) -> 14
A173: =SUM(A172+1) -> 171 | B173: Bobby Jo | M173: 5 | N173: 414 | AA173: =SUM(C173+E173+G173+I173+K173+M173+O173+Q173+S173+U173+W173+Y173) -> 5 | AB173: =SUM(D173+F173+H173+J173+L173+N173+P173+R173+T173+V173+X173+Z173) -> 414 | AC173: =SUM(AB173/AA173) -> 82.800 | AD173: =ROUNDDOWN(((AC173-50)*0.8),0) -> 26
A174: =SUM(A173+1) -> 172 | B174: Steve H. | G174: 3 | H174: 193 | I174: 2 | J174: 128 | AA174: =SUM(C174+E174+G174+I174+K174+M174+O174+Q174+S174+U174+W174+Y174) -> 5 | AB174: =SUM(D174+F174+H174+J174+L174+N174+P174+R174+T174+V174+X174+Z174) -> 321 | AC174: =SUM(AB174/AA174) -> 64.200 | AD174: =ROUNDDOWN(((AC174-50)*0.8),0) -> 11
A175: =SUM(A174+1) -> 173 | B175: Mickey | G175: 5 | H175: 315 | AA175: =SUM(C175+E175+G175+I175+K175+M175+O175+Q175+S175+U175+W175+Y175) -> 5 | AB175: =SUM(D175+F175+H175+J175+L175+N175+P175+R175+T175+V175+X175+Z175) -> 315 | AC175: =SUM(AB175/AA175) -> 63.000 | AD175: =ROUNDDOWN(((AC175-50)*0.8),0) -> 10
A176: =SUM(A175+1) -> 174 | B176: Kurtis Kron | U176: 5 | V176: 332 | AA176: =SUM(C176+E176+G176+I176+K176+M176+O176+Q176+S176+U176+W176+Y176) -> 5 | AB176: =SUM(D176+F176+H176+J176+L176+N176+P176+R176+T176+V176+X176+Z176) -> 332 | AC176: =SUM(AB176/AA176) -> 66.400 | AD176: =ROUNDDOWN(((AC176-50)*0.8),0) -> 13
A177: =SUM(A176+1) -> 175 | B177: "Mepo" | M177: 4 | N177: 268 | W177: 1 | X177: 64 | AA177: =SUM(C177+E177+G177+I177+K177+M177+O177+Q177+S177+U177+W177+Y177) -> 5 | AB177: =SUM(D177+F177+H177+J177+L177+N177+P177+R177+T177+V177+X177+Z177) -> 332 | AC177: =SUM(AB177/AA177) -> 66.400 | AD177: =ROUNDDOWN(((AC177-50)*0.8),0) -> 13
A178: =SUM(A177+1) -> 176 | B178: Eric VanDeusen | U178: 4 | V178: 257 | Y178: 1 | Z178: 58 | AA178: =SUM(C178+E178+G178+I178+K178+M178+O178+Q178+S178+U178+W178+Y178) -> 5 | AB178: =SUM(D178+F178+H178+J178+L178+N178+P178+R178+T178+V178+X178+Z178) -> 315 | AC178: =SUM(AB178/AA178) -> 63.000 | AD178: =ROUNDDOWN(((AC178-50)*0.8),0) -> 10
A179: =SUM(A178+1) -> 177 | B179: Jeane H. | M179: 4 | N179: 266 | AA179: =SUM(C179+E179+G179+I179+K179+M179+O179+Q179+S179+U179+W179+Y179) -> 4 | AB179: =SUM(D179+F179+H179+J179+L179+N179+P179+R179+T179+V179+X179+Z179) -> 266 | AC179: =SUM(AB179/AA179) -> 66.500 | AD179: =ROUNDDOWN(((AC179-50)*0.8),0) -> 13
A180: =SUM(A179+1) -> 178 | B180: Joel Crow | K180: 3 | L180: 175 | Q180: 1 | R180: 59 | AA180: =SUM(C180+E180+G180+I180+K180+M180+O180+Q180+S180+U180+W180+Y180) -> 4 | AB180: =SUM(D180+F180+H180+J180+L180+N180+P180+R180+T180+V180+X180+Z180) -> 234 | AC180: =SUM(AB180/AA180) -> 58.500 | AD180: =ROUNDDOWN(((AC180-50)*0.8),0) -> 6
A181: =SUM(A180+1) -> 179 | B181: Jeni Zeiser | S181: 4 | T181: 395 | AA181: =SUM(C181+E181+G181+I181+K181+M181+O181+Q181+S181+U181+W181+Y181) -> 4 | AB181: =SUM(D181+F181+H181+J181+L181+N181+P181+R181+T181+V181+X181+Z181) -> 395 | AC181: =SUM(AB181/AA181) -> 98.750 | AD181: =ROUNDDOWN(((AC181-50)*0.8),0) -> 39
A182: =SUM(A181+1) -> 180 | B182: Wade Geary | W182: 1 | X182: 53 | Y182: 3 | Z182: 179 | AA182: =SUM(C182+E182+G182+I182+K182+M182+O182+Q182+S182+U182+W182+Y182) -> 4 | AB182: =SUM(D182+F182+H182+J182+L182+N182+P182+R182+T182+V182+X182+Z182) -> 232 | AC182: =SUM(AB182/AA182) -> 58.000 | AD182: =ROUNDDOWN(((AC182-50)*0.8),0) -> 6
A183: =SUM(A182+1) -> 181 | B183: Steven Crow | K183: 3 | L183: 162 | AA183: =SUM(C183+E183+G183+I183+K183+M183+O183+Q183+S183+U183+W183+Y183) -> 3 | AB183: =SUM(D183+F183+H183+J183+L183+N183+P183+R183+T183+V183+X183+Z183) -> 162 | AC183: =SUM(AB183/AA183) -> 54.000 | AD183: =ROUNDDOWN(((AC183-50)*0.8),0) -> 3
A184: =SUM(A183+1) -> 182 | B184: Jenny Robertson | S184: 3 | T184: 219 | AA184: =SUM(C184+E184+G184+I184+K184+M184+O184+Q184+S184+U184+W184+Y184) -> 3 | AB184: =SUM(D184+F184+H184+J184+L184+N184+P184+R184+T184+V184+X184+Z184) -> 219 | AC184: =SUM(AB184/AA184) -> 73.000 | AD184: =ROUNDDOWN(((AC184-50)*0.8),0) -> 18
A185: =SUM(A184+1) -> 183 | B185: Cody Green | U185: 3 | V185: 171 | AA185: =SUM(C185+E185+G185+I185+K185+M185+O185+Q185+S185+U185+W185+Y185) -> 3 | AB185: =SUM(D185+F185+H185+J185+L185+N185+P185+R185+T185+V185+X185+Z185) -> 171 | AC185: =SUM(AB185/AA185) -> 57.000 | AD185: =ROUNDDOWN(((AC185-50)*0.8),0) -> 5
A186: =SUM(A185+1) -> 184 | B186: Tom Hashman | U186: 3 | V186: 192 | AA186: =SUM(C186+E186+G186+I186+K186+M186+O186+Q186+S186+U186+W186+Y186) -> 3 | AB186: =SUM(D186+F186+H186+J186+L186+N186+P186+R186+T186+V186+X186+Z186) -> 192 | AC186: =SUM(AB186/AA186) -> 64.000 | AD186: =ROUNDDOWN(((AC186-50)*0.8),0) -> 11
A187: =SUM(A186+1) -> 185 | B187: Chase Norton | W187: 2 | X187: 118 | Y187: 1 | Z187: 54 | AA187: =SUM(C187+E187+G187+I187+K187+M187+O187+Q187+S187+U187+W187+Y187) -> 3 | AB187: =SUM(D187+F187+H187+J187+L187+N187+P187+R187+T187+V187+X187+Z187) -> 172 | AC187: =SUM(AB187/AA187) -> 57.333333333333336 | AD187: =ROUNDDOWN(((AC187-50)*0.8),0) -> 5
A188: =SUM(A187+1) -> 186 | B188: Nick Cole | Y188: 3 | Z188: 197 | AA188: =SUM(C188+E188+G188+I188+K188+M188+O188+Q188+S188+U188+W188+Y188) -> 3 | AB188: =SUM(D188+F188+H188+J188+L188+N188+P188+R188+T188+V188+X188+Z188) -> 197 | AC188: =SUM(AB188/AA188) -> 65.666666666666671 | AD188: =ROUNDDOWN(((AC188-50)*0.8),0) -> 12
A189: =SUM(A188+1) -> 187 | B189: Dave Murphy | M189: 2 | N189: 131 | AA189: =SUM(C189+E189+G189+I189+K189+M189+O189+Q189+S189+U189+W189+Y189) -> 2 | AB189: =SUM(D189+F189+H189+J189+L189+N189+P189+R189+T189+V189+X189+Z189) -> 131 | AC189: =SUM(AB189/AA189) -> 65.500 | AD189: =ROUNDDOWN(((AC189-50)*0.8),0) -> 12
A190: =SUM(A189+1) -> 188 | B190: Allice "In" Chains | K190: 2 | L190: 115 | AA190: =SUM(C190+E190+G190+I190+K190+M190+O190+Q190+S190+U190+W190+Y190) -> 2 | AB190: =SUM(D190+F190+H190+J190+L190+N190+P190+R190+T190+V190+X190+Z190) -> 115 | AC190: =SUM(AB190/AA190) -> 57.500 | AD190: =ROUNDDOWN(((AC190-50)*0.8),0) -> 6
A191: =SUM(A190+1) -> 189 | B191: Chad Kawami | M191: 2 | N191: 107 | AA191: =SUM(C191+E191+G191+I191+K191+M191+O191+Q191+S191+U191+W191+Y191) -> 2 | AB191: =SUM(D191+F191+H191+J191+L191+N191+P191+R191+T191+V191+X191+Z191) -> 107 | AC191: =SUM(AB191/AA191) -> 53.500 | AD191: =ROUNDDOWN(((AC191-50)*0.8),0) -> 2
A192: =SUM(A191+1) -> 190 | B192: Brandon Sheer | S192: 2 | T192: 122 | AA192: =SUM(C192+E192+G192+I192+K192+M192+O192+Q192+S192+U192+W192+Y192) -> 2 | AB192: =SUM(D192+F192+H192+J192+L192+N192+P192+R192+T192+V192+X192+Z192) -> 122 | AC192: =SUM(AB192/AA192) -> 61.000 | AD192: =ROUNDDOWN(((AC192-50)*0.8),0) -> 8
A193: =SUM(A192+1) -> 191 | B193: John McClellan | S193: 2 | T193: 129 | AA193: =SUM(C193+E193+G193+I193+K193+M193+O193+Q193+S193+U193+W193+Y193) -> 2 | AB193: =SUM(D193+F193+H193+J193+L193+N193+P193+R193+T193+V193+X193+Z193) -> 129 | AC193: =SUM(AB193/AA193) -> 64.500 | AD193: =ROUNDDOWN(((AC193-50)*0.8),0) -> 11
A194: =SUM(A193+1) -> 192 | B194: Robb Neubrand | U194: 2 | V194: 108 | AA194: =SUM(C194+E194+G194+I194+K194+M194+O194+Q194+S194+U194+W194+Y194) -> 2 | AB194: =SUM(D194+F194+H194+J194+L194+N194+P194+R194+T194+V194+X194+Z194) -> 108 | AC194: =SUM(AB194/AA194) -> 54.000 | AD194: =ROUNDDOWN(((AC194-50)*0.8),0) -> 3
A195: =SUM(A194+1) -> 193 | B195: Jake Alheid | U195: 2 | V195: 129 | AA195: =SUM(C195+E195+G195+I195+K195+M195+O195+Q195+S195+U195+W195+Y195) -> 2 | AB195: =SUM(D195+F195+H195+J195+L195+N195+P195+R195+T195+V195+X195+Z195) -> 129 | AC195: =SUM(AB195/AA195) -> 64.500 | AD195: =ROUNDDOWN(((AC195-50)*0.8),0) -> 11
A196: =SUM(A195+1) -> 194 | B196: Josh Spang | S196: 1 | T196: 55 | W196: 1 | X196: 49 | AA196: =SUM(C196+E196+G196+I196+K196+M196+O196+Q196+S196+U196+W196+Y196) -> 2 | AB196: =SUM(D196+F196+H196+J196+L196+N196+P196+R196+T196+V196+X196+Z196) -> 104 | AC196: =SUM(AB196/AA196) -> 52.000 | AD196: =ROUNDDOWN(((AC196-50)*0.8),0) -> 1
A197: =SUM(A196+1) -> 195 | B197: Justin Harris | W197: 2 | X197: 119 | AA197: =SUM(C197+E197+G197+I197+K197+M197+O197+Q197+S197+U197+W197+Y197) -> 2 | AB197: =SUM(D197+F197+H197+J197+L197+N197+P197+R197+T197+V197+X197+Z197) -> 119 | AC197: =SUM(AB197/AA197) -> 59.500 | AD197: =ROUNDDOWN(((AC197-50)*0.8),0) -> 7
A198: =SUM(A197+1) -> 196 | B198: TJ Nanke | W198: 2 | X198: 113 | AA198: =SUM(C198+E198+G198+I198+K198+M198+O198+Q198+S198+U198+W198+Y198) -> 2 | AB198: =SUM(D198+F198+H198+J198+L198+N198+P198+R198+T198+V198+X198+Z198) -> 113 | AC198: =SUM(AB198/AA198) -> 56.500 | AD198: =ROUNDDOWN(((AC198-50)*0.8),0) -> 5
A199: =SUM(A198+1) -> 197 | B199: Darwin Schultz | Y199: 2 | Z199: 118 | AA199: =SUM(C199+E199+G199+I199+K199+M199+O199+Q199+S199+U199+W199+Y199) -> 2 | AB199: =SUM(D199+F199+H199+J199+L199+N199+P199+R199+T199+V199+X199+Z199) -> 118 | AC199: =SUM(AB199/AA199) -> 59.000 | AD199: =ROUNDDOWN(((AC199-50)*0.8),0) -> 7
A200: =SUM(A199+1) -> 198 | B200: John Calahan | Y200: 2 | Z200: 137 | AA200: =SUM(C200+E200+G200+I200+K200+M200+O200+Q200+S200+U200+W200+Y200) -> 2 | AB200: =SUM(D200+F200+H200+J200+L200+N200+P200+R200+T200+V200+X200+Z200) -> 137 | AC200: =SUM(AB200/AA200) -> 68.500 | AD200: =ROUNDDOWN(((AC200-50)*0.8),0) -> 14
A201: =SUM(A200+1) -> 199 | B201: Trace Landess | O201: 1 | P201: 95 | AA201: =SUM(C201+E201+G201+I201+K201+M201+O201+Q201+S201+U201+W201+Y201) -> 1 | AB201: =SUM(D201+F201+H201+J201+L201+N201+P201+R201+T201+V201+X201+Z201) -> 95 | AC201: =SUM(AB201/AA201) -> 95.000 | AD201: 0
A202: =SUM(A201+1) -> 200 | B202: Chuckles | O202: 1 | P202: 74 | AA202: =SUM(C202+E202+G202+I202+K202+M202+O202+Q202+S202+U202+W202+Y202) -> 1 | AB202: =SUM(D202+F202+H202+J202+L202+N202+P202+R202+T202+V202+X202+Z202) -> 74 | AC202: =SUM(AB202/AA202) -> 74.000 | AD202: 0
A203: =SUM(A202+1) -> 201 | B203: Justin Mager | Q203: 1 | R203: 68 | AA203: =SUM(C203+E203+G203+I203+K203+M203+O203+Q203+S203+U203+W203+Y203) -> 1 | AB203: =SUM(D203+F203+H203+J203+L203+N203+P203+R203+T203+V203+X203+Z203) -> 68 | AC203: =SUM(AB203/AA203) -> 68.000 | AD203: 0
A204: =SUM(A203+1) -> 202 | B204: Scott Ream | Q204: 1 | R204: 64 | AA204: =SUM(C204+E204+G204+I204+K204+M204+O204+Q204+S204+U204+W204+Y204) -> 1 | AB204: =SUM(D204+F204+H204+J204+L204+N204+P204+R204+T204+V204+X204+Z204) -> 64 | AC204: =SUM(AB204/AA204) -> 64.000 | AD204: 0
A205: =SUM(A204+1) -> 203 | B205: Dave Swinford | Q205: 1 | R205: 63 | AA205: =SUM(C205+E205+G205+I205+K205+M205+O205+Q205+S205+U205+W205+Y205) -> 1 | AB205: =SUM(D205+F205+H205+J205+L205+N205+P205+R205+T205+V205+X205+Z205) -> 63 | AC205: =SUM(AB205/AA205) -> 63.000 | AD205: 0
A206: =SUM(A205+1) -> 204 | B206: Rob Posekany | Q206: 1 | R206: 61 | AA206: =SUM(C206+E206+G206+I206+K206+M206+O206+Q206+S206+U206+W206+Y206) -> 1 | AB206: =SUM(D206+F206+H206+J206+L206+N206+P206+R206+T206+V206+X206+Z206) -> 61 | AC206: =SUM(AB206/AA206) -> 61.000 | AD206: 0
A207: =SUM(A206+1) -> 205 | B207: Dave Peyton | Q207: 1 | R207: 61 | AA207: =SUM(C207+E207+G207+I207+K207+M207+O207+Q207+S207+U207+W207+Y207) -> 1 | AB207: =SUM(D207+F207+H207+J207+L207+N207+P207+R207+T207+V207+X207+Z207) -> 61 | AC207: =SUM(AB207/AA207) -> 61.000 | AD207: 0
A208: =SUM(A207+1) -> 206 | B208: BJ Beckman | O208: 1 | P208: 58 | AA208: =SUM(C208+E208+G208+I208+K208+M208+O208+Q208+S208+U208+W208+Y208) -> 1 | AB208: =SUM(D208+F208+H208+J208+L208+N208+P208+R208+T208+V208+X208+Z208) -> 58 | AC208: =SUM(AB208/AA208) -> 58.000 | AD208: 0
A209: =SUM(A208+1) -> 207 | B209: Craig Fender | M209: 1 | N209: 57 | AA209: =SUM(C209+E209+G209+I209+K209+M209+O209+Q209+S209+U209+W209+Y209) -> 1 | AB209: =SUM(D209+F209+H209+J209+L209+N209+P209+R209+T209+V209+X209+Z209) -> 57 | AC209: =SUM(AB209/AA209) -> 57.000 | AD209: 0
A210: =SUM(A209+1) -> 208 | B210: Tony Philips | Q210: 1 | R210: 54 | AA210: =SUM(C210+E210+G210+I210+K210+M210+O210+Q210+S210+U210+W210+Y210) -> 1 | AB210: =SUM(D210+F210+H210+J210+L210+N210+P210+R210+T210+V210+X210+Z210) -> 54 | AC210: =SUM(AB210/AA210) -> 54.000 | AD210: 0
A211: =SUM(A210+1) -> 209 | B211: Naph Rediger | G211: 1 | H211: 53 | AA211: =SUM(C211+E211+G211+I211+K211+M211+O211+Q211+S211+U211+W211+Y211) -> 1 | AB211: =SUM(D211+F211+H211+J211+L211+N211+P211+R211+T211+V211+X211+Z211) -> 53 | AC211: =SUM(AB211/AA211) -> 53.000 | AD211: 0
A212: =SUM(A211+1) -> 210 | B212: Jason Steffen | Q212: 1 | R212: 53 | AA212: =SUM(C212+E212+G212+I212+K212+M212+O212+Q212+S212+U212+W212+Y212) -> 1 | AB212: =SUM(D212+F212+H212+J212+L212+N212+P212+R212+T212+V212+X212+Z212) -> 53 | AC212: =SUM(AB212/AA212) -> 53.000 | AD212: 0
A213: =SUM(A212+1) -> 211 | B213: Floyd Campbell | Q213: 1 | R213: 49 | AA213: =SUM(C213+E213+G213+I213+K213+M213+O213+Q213+S213+U213+W213+Y213) -> 1 | AB213: =SUM(D213+F213+H213+J213+L213+N213+P213+R213+T213+V213+X213+Z213) -> 49 | AC213: =SUM(AB213/AA213) -> 49.000 | AD213: 0
A214: =SUM(A213+1) -> 212 | B214: Mark Ramsey | O214: 1 | P214: 45 | AA214: =SUM(C214+E214+G214+I214+K214+M214+O214+Q214+S214+U214+W214+Y214) -> 1 | AB214: =SUM(D214+F214+H214+J214+L214+N214+P214+R214+T214+V214+X214+Z214) -> 45 | AC214: =SUM(AB214/AA214) -> 45.000 | AD214: 0
A215: =SUM(A214+1) -> 213 | B215: Mike Baines | S215: 1 | T215: 71 | AA215: =SUM(C215+E215+G215+I215+K215+M215+O215+Q215+S215+U215+W215+Y215) -> 1 | AB215: =SUM(D215+F215+H215+J215+L215+N215+P215+R215+T215+V215+X215+Z215) -> 71 | AC215: =SUM(AB215/AA215) -> 71.000 | AD215: 0
A216: 214 | B216: Adam Smith | S216: 1 | T216: 59 | AA216: =SUM(C216+E216+G216+I216+K216+M216+O216+Q216+S216+U216+W216+Y216) -> 1 | AB216: =SUM(D216+F216+H216+J216+L216+N216+P216+R216+T216+V216+X216+Z216) -> 59 | AC216: =SUM(AB216/AA216) -> 59.000 | AD216: 0
A217: 215 | B217: Jon Foley | S217: 1 | T217: 70 | AA217: =SUM(C217+E217+G217+I217+K217+M217+O217+Q217+S217+U217+W217+Y217) -> 1 | AB217: =SUM(D217+F217+H217+J217+L217+N217+P217+R217+T217+V217+X217+Z217) -> 70 | AC217: =SUM(AB217/AA217) -> 70.000 | AD217: 0
A218: 216 | B218: T.J. Thurn | U218: 1 | V218: 50 | AA218: =SUM(C218+E218+G218+I218+K218+M218+O218+Q218+S218+U218+W218+Y218) -> 1 | AB218: =SUM(D218+F218+H218+J218+L218+N218+P218+R218+T218+V218+X218+Z218) -> 50 | AC218: =SUM(AB218/AA218) -> 50.000 | AD218: 0
A219: 217 | B219: Roland Hesford | U219: 1 | V219: 51 | AA219: =SUM(C219+E219+G219+I219+K219+M219+O219+Q219+S219+U219+W219+Y219) -> 1 | AB219: =SUM(D219+F219+H219+J219+L219+N219+P219+R219+T219+V219+X219+Z219) -> 51 | AC219: =SUM(AB219/AA219) -> 51.000 | AD219: 0
A220: 218 | B220: Will Viner | U220: 1 | V220: 56 | AA220: =SUM(C220+E220+G220+I220+K220+M220+O220+Q220+S220+U220+W220+Y220) -> 1 | AB220: =SUM(D220+F220+H220+J220+L220+N220+P220+R220+T220+V220+X220+Z220) -> 56 | AC220: =SUM(AB220/AA220) -> 56.000 | AD220: 0
A221: 219 | B221: Dan Mosley | U221: 1 | V221: 56 | AA221: =SUM(C221+E221+G221+I221+K221+M221+O221+Q221+S221+U221+W221+Y221) -> 1 | AB221: =SUM(D221+F221+H221+J221+L221+N221+P221+R221+T221+V221+X221+Z221) -> 56 | AC221: =SUM(AB221/AA221) -> 56.000 | AD221: 0
A222: 220 | B222: Archie Coulter | U222: 1 | V222: 58 | AA222: =SUM(C222+E222+G222+I222+K222+M222+O222+Q222+S222+U222+W222+Y222) -> 1 | AB222: =SUM(D222+F222+H222+J222+L222+N222+P222+R222+T222+V222+X222+Z222) -> 58 | AC222: =SUM(AB222/AA222) -> 58.000 | AD222: 0
A223: 221 | B223: Eli Ostby | U223: 1 | V223: 58 | AA223: =SUM(C223+E223+G223+I223+K223+M223+O223+Q223+S223+U223+W223+Y223) -> 1 | AB223: =SUM(D223+F223+H223+J223+L223+N223+P223+R223+T223+V223+X223+Z223) -> 58 | AC223: =SUM(AB223/AA223) -> 58.000 | AD223: 0
A224: 222 | B224: Tony Ebson | U224: 1 | V224: 60 | AA224: =SUM(C224+E224+G224+I224+K224+M224+O224+Q224+S224+U224+W224+Y224) -> 1 | AB224: =SUM(D224+F224+H224+J224+L224+N224+P224+R224+T224+V224+X224+Z224) -> 60 | AC224: =SUM(AB224/AA224) -> 60.000 | AD224: 0
A225: 223 | B225: Adam Hartig | W225: 1 | X225: 60 | AA225: =SUM(C225+E225+G225+I225+K225+M225+O225+Q225+S225+U225+W225+Y225) -> 1 | AB225: =SUM(D225+F225+H225+J225+L225+N225+P225+R225+T225+V225+X225+Z225) -> 60 | AC225: =SUM(AB225/AA225) -> 60.000 | AD225: 0
A226: 224 | B226: Chris Klime | W226: 1 | X226: 50 | AA226: =SUM(C226+E226+G226+I226+K226+M226+O226+Q226+S226+U226+W226+Y226) -> 1 | AB226: =SUM(D226+F226+H226+J226+L226+N226+P226+R226+T226+V226+X226+Z226) -> 50 | AC226: =SUM(AB226/AA226) -> 50.000 | AD226: 0
A227: 225 | B227: Rob Neubrand | Y227: 1 | Z227: 51 | AA227: =SUM(C227+E227+G227+I227+K227+M227+O227+Q227+S227+U227+W227+Y227) -> 1 | AB227: =SUM(D227+F227+H227+J227+L227+N227+P227+R227+T227+V227+X227+Z227) -> 51 | AC227: =SUM(AB227/AA227) -> 51.000 | AD227: 0
A228: =SUM(A227+1) -> 226 | B228: Rob O'Brien | Y228: 1 | Z228: 52 | AA228: =SUM(C228+E228+G228+I228+K228+M228+O228+Q228+S228+U228+W228+Y228) -> 1 | AB228: =SUM(D228+F228+H228+J228+L228+N228+P228+R228+T228+V228+X228+Z228) -> 52 | AC228: =SUM(AB228/AA228) -> 52.000 | AD228: 0
A229: =SUM(A228+1) -> 227 | B229: Bob Hernandez | Y229: 1 | Z229: 53 | AA229: =SUM(C229+E229+G229+I229+K229+M229+O229+Q229+S229+U229+W229+Y229) -> 1 | AB229: =SUM(D229+F229+H229+J229+L229+N229+P229+R229+T229+V229+X229+Z229) -> 53 | AC229: =SUM(AB229/AA229) -> 53.000 | AD229: 0
A230: =SUM(A229+1) -> 228 | B230: Nate Hamilton | Y230: 1 | Z230: 57 | AA230: =SUM(C230+E230+G230+I230+K230+M230+O230+Q230+S230+U230+W230+Y230) -> 1 | AB230: =SUM(D230+F230+H230+J230+L230+N230+P230+R230+T230+V230+X230+Z230) -> 57 | AC230: =SUM(AB230/AA230) -> 57.000 | AD230: 0
A231: =SUM(A230+1) -> 229 | B231: Cody Fuller | Y231: 1 | Z231: 58 | AA231: =SUM(C231+E231+G231+I231+K231+M231+O231+Q231+S231+U231+W231+Y231) -> 1 | AB231: =SUM(D231+F231+H231+J231+L231+N231+P231+R231+T231+V231+X231+Z231) -> 58 | AC231: =SUM(AB231/AA231) -> 58.000 | AD231: 0
A232: =SUM(A231+1) -> 230 | B232: Andy Johnson | Y232: 1 | Z232: 58 | AA232: =SUM(C232+E232+G232+I232+K232+M232+O232+Q232+S232+U232+W232+Y232) -> 1 | AB232: =SUM(D232+F232+H232+J232+L232+N232+P232+R232+T232+V232+X232+Z232) -> 58 | AC232: =SUM(AB232/AA232) -> 58.000 | AD232: 0
A233: =SUM(A232+1) -> 231 | B233: Joe R | Y233: 1 | Z233: 61 | AA233: =SUM(C233+E233+G233+I233+K233+M233+O233+Q233+S233+U233+W233+Y233) -> 1 | AB233: =SUM(D233+F233+H233+J233+L233+N233+P233+R233+T233+V233+X233+Z233) -> 61 | AC233: =SUM(AB233/AA233) -> 61.000 | AD233: 0
A234: =SUM(A233+1) -> 232 | B234: Perry Thirtyacre | Y234: 1 | Z234: 62 | AA234: =SUM(C234+E234+G234+I234+K234+M234+O234+Q234+S234+U234+W234+Y234) -> 1 | AB234: =SUM(D234+F234+H234+J234+L234+N234+P234+R234+T234+V234+X234+Z234) -> 62 | AC234: =SUM(AB234/AA234) -> 62.000 | AD234: 0
A235: =SUM(A234+1) -> 233 | B235: Nate Spencer | Y235: 1 | Z235: 67 | AA235: =SUM(C235+E235+G235+I235+K235+M235+O235+Q235+S235+U235+W235+Y235) -> 1 | AB235: =SUM(D235+F235+H235+J235+L235+N235+P235+R235+T235+V235+X235+Z235) -> 67 | AC235: =SUM(AB235/AA235) -> 67.000 | AD235: 0
A236: =SUM(A235+1) -> 234 | B236: Matt DaPaepe | Y236: 1 | Z236: 77 | AA236: =SUM(C236+E236+G236+I236+K236+M236+O236+Q236+S236+U236+W236+Y236) -> 1 | AB236: =SUM(D236+F236+H236+J236+L236+N236+P236+R236+T236+V236+X236+Z236) -> 77 | AC236: =SUM(AB236/AA236) -> 77.000 | AD236: 0
A237: red = Champion
A238: * = Multiple Championships
A239: green = Hall of Fame